title,title_orig,discount_price,discount_price_currency,retail_price,retail_price_currency,discount_price_in_original_currency,nb_cart_orders_approx,nb_units_purchased_approx,uses_ad_boosts,rating,rating_count,rating_five_count,rating_four_count,rating_three_count,rating_two_count,rating_one_count,badges_count,badge_local_product,badge_product_quality,badge_fast_shipping,tags,product_color,product_variation_size_id,product_variation_inventory,shipping_option_name,shipping_option_price,shipping_is_express,countries_shipped_to,inventory_total,has_urgency_banner,urgency_text,origin_country,merchant_title,merchant_name,merchant_info_subtitle,merchant_rating_count,merchant_rating,merchant_id,merchant_has_profile_picture,merchant_profile_picture,product_url,product_picture,product_id
Summer Women One-piece Swimsuit Swimwear Bathing Suit Tankini Bikini Monokini Swimming Suit Beachwear,Summer Women One-piece Swimsuit Swimwear Bathing Suit Tankini Bikini Monokini Swimming Suit Beachwear,10.0,EUR,10.0,EUR,12,9,,,5.0,0.0,,,,,,,,,,,green,xs,2,Livraison standard,3.0,false,,50,,,CN,schongyr,schongyr,"81 % avis positifs (1,287 notes)",1287,3.8119658119658117,5e1877cce0a9f41e237c1954,,,https://www.wish.com/c/605ecefe1697fc014be3a125,https://canary.contestimg.wish.com/api/webimage/605ecefe1697fc014be3a125-medium.jpg,605ecefe1697fc014be3a125
Nouveau morceau de maillot de bain Bikini maillots de bain maillots de bain maillots de bain maillot de bain,New Summer Fashion  Women's Solid Piece Of Swimsuit Bikini Swimwear Beachwear Bathing Suit,10.0,EUR,68.0,EUR,11,10,,,3.911764705882353,34.0,15,10,2,5,2,,,,,,black,s,5,Livraison standard,3.0,false,,50,true,Quantité limitée !,CN,Arcticweather,arcticweather,93 % avis positifs (810 notes),810,4.383950617283951,5af401f947ea632a86fff32d,,,https://www.wish.com/c/5dfb5c70253de90c493ac035,https://canary.contestimg.wish.com/api/webimage/5dfb5c70253de90c493ac035-medium.jpg,5dfb5c70253de90c493ac035
2021 offre spéciale femme Sexy maillot de bain dentelle évider Crochet Bikini couvrir maillots de bain été plage robe vacances vêtements de plage,2021 Hot Sale Female Sexy Bathing Suit Lace Hollow Out Crochet Bikini Cover Up Swimwear Summer Beach Dress Holiday Beachwear,22.0,EUR,22.0,EUR,26,10,,,5.0,0.0,,,,,,,,,,,,,50,Livraison standard,7.0,false,,50,,,CA,11368796 CANADA CORPORATION,11368796canadacorporation,"80 % avis positifs (1,166 notes)",1166,3.9382504288164664,5ffb1f43fa8a25c707537989,,,https://www.wish.com/c/6009a475dc853f21981b0237,https://canary.contestimg.wish.com/api/webimage/6009a475dc853f21981b0237-medium.jpg,6009a475dc853f21981b0237
Free People,,,,,,,,,,,,,,,,,,,,,,,,,,,,,,,,,,,,,,,,,https://www.wish.com/c/5ed7832590b8a6318c2d7349,,5ed7832590b8a6318c2d7349
Rash Guard Femmes À Manches Longues D'une Seule Pièce Maillot De Bain De Plage De Bain Surf Costume De Plongée Imprimé Floral Beachwear,Rash Guard Women Long Sleeve One-piece Beach Swimsuit Bathing Surfing Diving Suit Floral Print Beachwear,16.0,EUR,106.0,EUR,19,1000,,,4.451827242524917,301.0,209,43,35,4,10,,,,,,,1-s,50,Livraison standard,5.0,false,,50,,,CN,OUMUYI,oumuyi,93 % avis positifs (679 notes),679,4.440353460972018,590167d05aab7707999fed51,,,https://www.wish.com/c/5a6f4db695f79f04d1279207,https://canary.contestimg.wish.com/api/webimage/5a6f4db695f79f04d1279207-medium.jpg,5a6f4db695f79f04d1279207
Men's Quick-Dry Shorts Siwmwear Beach-Shorts Swim-Shorts Beach-Wear Sports for Summer,Men's Quick-Dry Shorts Siwmwear Beach-Shorts Swim-Shorts Beach-Wear Sports for Summer,4.83,EUR,46.0,EUR,5.85,1000,,,3.8823529411764706,306.0,141,74,39,18,34,,,,,,white,s,25,Livraison standard,1.0,false,,50,,,CN,zhangxiaoyunyun,zhangxiaoyunyun,86% Positive Feedback (404 ratings),404,4.071782178217822,5d41a75de13a7e2059f79277,,,https://www.wish.com/c/5e54b45a7da27e36a9d02e07,https://canary.contestimg.wish.com/api/webimage/5e54b45a7da27e36a9d02e07-medium.jpg,5e54b45a7da27e36a9d02e07
Marilyn Monroe,,,,,,,,,,,,,,,,,,,,,,,,,,,,,,,,,,,,,,,,,https://www.wish.com/c/5e8d30009719ed64049677c2,,5e8d30009719ed64049677c2
Favlux,,,,,,,,,,,,,,,,,,,,,,,,,,,,,,,,,,,,,,,,,https://www.wish.com/c/5e3b0ba89719eddf0ac7e6ad,,5e3b0ba89719eddf0ac7e6ad
2021 Sexy couleur Bikini femmes maillots de bain Bandeau Biquini maillot de bain femme maillot de bain Push Up Bikini ensemble maillots de bain купальники,2021 Sexy Color Bikini Women Swimwear Bandeau Biquini Swimsuit Female Bathing Suit Push Up Bikini Set Beachwear купальники,16.0,EUR,16.0,EUR,19,0,,,5.0,0.0,,,,,,,,,,,blue,"s,poland",50,Livraison standard,11.0,false,,50,true,Quantité limitée !,CA,11368796 CANADA CORPORATION,11368796canadacorporation,"80 % avis positifs (1,166 notes)",1166,3.9382504288164664,5ffb1f43fa8a25c707537989,,,https://www.wish.com/c/6015502282c4408bc2a0609e,https://canary.contestimg.wish.com/api/webimage/6015502282c4408bc2a0609e-medium.jpg,6015502282c4408bc2a0609e
SEASELFIE Sexy Bandeau Low-Waisted Bikini Sets Swimwear Women Swimsuits Bathing Suit 2021 Solid Blue Tank Top Bikinis Beachwear,SEASELFIE Sexy Bandeau Low-Waisted Bikini Sets Swimwear Women Swimsuits Bathing Suit 2021 Solid Blue Tank Top Bikinis Beachwear,25.0,EUR,25.0,EUR,30,0,,,5.0,0.0,,,,,,,,,,,blue,xs,50,Livraison standard,8.0,false,,50,,,CA,11368796 CANADA CORPORATION,11368796canadacorporation,"80 % avis positifs (1,166 notes)",1166,3.9382504288164664,5ffb1f43fa8a25c707537989,,,https://www.wish.com/c/602801e2f6d1b336f0ca7be2,https://canary.contestimg.wish.com/api/webimage/602801e2f6d1b336f0ca7be2-medium.jpg,602801e2f6d1b336f0ca7be2
Vêtements de plage pour femmes sans manches Bodycon Romper Jumpsuit Club Body Body Pantalon Long pour femmes,Womens Casual Sleeveless Bodycon Romper Jumpsuit Club Bodysuit Long Pants Beachwear,15.0,EUR,15.0,EUR,17,7,,,1.0,1.0,0,0,0,0,1,,,,,,white,m,50,Livraison standard,5.0,false,,50,true,Quantité limitée !,CN,pkpk,pkpk,88 % avis positifs (114 notes),114,4.192982456140351,5d5150ce8388970711e6909b,,,https://www.wish.com/c/5f0d5f18a3eadb35485631a3,https://canary.contestimg.wish.com/api/webimage/5f0d5f18a3eadb35485631a3-medium.jpg,5f0d5f18a3eadb35485631a3
Ensemble de bikini de bikini de bandage de soutien-gorge rembourré de soutien-gorge rembourré de Push-up de femmes,Women Push-up Padded Bra Bandage Bikini Set Swimsuit,7.0,EUR,57.0,EUR,8,10000,,,3.7545596664929652,1919.0,843,399,282,153,242,,,,,,black,s,50,Livraison standard,2.0,false,,50,true,Quantité limitée !,CN,Manystone91,manystone91,"(3,115 notes)",3115,4.174317817014447,57d904168172661fe3b3256a,,,https://www.wish.com/c/5c823b50a937185c992e6d2f,https://canary.contestimg.wish.com/api/webimage/5c823b50a937185c992e6d2f-medium.jpg,5c823b50a937185c992e6d2f
 Mode Femmes Couleur Unie Creux Smock Long Bikini Cover Up Laçage Cardigan Beachwear, Fashion Women Solid Color Hollow Smock Long Bikini Cover Up Lacing Cardigan Beachwear,11.0,EUR,11.0,EUR,13,10,,,4.055555555555555,18.0,9,4,3,1,1,,,,,,black,xs,50,Livraison Express,4.0,true,,50,true,Quantité limitée !,CN,flh,flh,"(1,524 notes)",1524,4.2434383202099735,59477d19c250815de749576e,,,https://www.wish.com/c/5d6527ec759b651d4516c512,https://canary.contestimg.wish.com/api/webimage/5d6527ec759b651d4516c512-medium.jpg,5d6527ec759b651d4516c512
Maman et filles Summer One Piece Bikinis Beach Fashion Print Slim Swimwear Beachwear,Mom and Girls Summer One Piece Bikinis Beach Fashion Print Slim Swimwear Beachwear,7.0,EUR,8.0,EUR,8,10,,,4.018867924528302,53.0,31,7,7,1,7,,,,,,white,110cm,11,Livraison standard,2.0,false,,50,true,Quantité limitée !,CN,Unnistore,unnistore,"(50,739 notes)",50739,4.031317132777548,5684eae9daaaee26a0fdadba,,,https://www.wish.com/c/5cac04fd5f0f7a568dbfa5f1,https://canary.contestimg.wish.com/api/webimage/5cac04fd5f0f7a568dbfa5f1-medium.jpg,5cac04fd5f0f7a568dbfa5f1
2021 Sexy Women Bikini Bandage Push Up Swimwear Lace One Piece Swimsuit Bathing Beachwear Bodysuit,2021 Sexy Women Bikini Bandage Push Up Swimwear Lace One Piece Swimsuit Bathing Beachwear Bodysuit,8.0,EUR,8.0,EUR,9,10,,,3.0,5.0,1,1,0,3,0,,,,,,black,xs,5,Livraison standard,3.0,false,,50,,,US,KINNLTY,kinnlty,"79 % avis positifs (1,015 notes)",1015,3.775369458128079,5e693079c6a6e679c0bf4613,,,https://www.wish.com/c/6030bb04c9bbb2d0813cc997,https://canary.contestimg.wish.com/api/webimage/6030bb04c9bbb2d0813cc997-medium.jpg,6030bb04c9bbb2d0813cc997
2021 Summer New Fashion Men Beach Shorts Swimwear Quick-drying Swimming Shorts Beachwear Sports Fitness Plus Size,2021 Summer New Fashion Men Beach Shorts Swimwear Quick-drying Swimming Shorts Beachwear Sports Fitness Plus Size,4.12,EUR,5.0,EUR,5.0,10,,,5.0,0.0,,,,,,,,,,,green,s,5,Livraison standard,2.0,false,,50,true,Quantité limitée !,CN,shunhao3600,shunhao3600,85 % avis positifs (62 notes),62,3.8870967741935485,5eca1874a9237c9b568971fd,,,https://www.wish.com/c/60488a5324701a1bbc62bea8,https://canary.contestimg.wish.com/api/webimage/60488a5324701a1bbc62bea8-medium.jpg,60488a5324701a1bbc62bea8
Maillot de bain été ' maillot de bain pour femme Beach s Cover Cover up Sunscreen Coat_yd,Women's Summer Swimsuit Bikini Beach Swimwear Cover up Sunscreen Coat_yd,7.0,EUR,87.0,EUR,8,1000,,,4.263814616755793,561.0,347,112,42,23,37,,,,,,winered,size/xs,28,Livraison standard,2.0,false,,50,true,Quantité limitée !,CN,Tomatomarket,tomatomarket,"86 % avis positifs (1,547 notes)",1547,4.091790562378797,5a06a08ce650334b562bffdc,,,https://www.wish.com/c/5d099a09b4e76760cb5a852a,https://canary.contestimg.wish.com/api/webimage/5d099a09b4e76760cb5a852a-medium.jpg,5d099a09b4e76760cb5a852a
Femmes Deux Pièces Tankini Ensemble Maillot De Bain Maillot De Bain Maillots De Bain Monokini Bikini Beachwear Maillot De Bain Plus La Taille XS-8XL,Womens Two Pieces Tankini Set Swimsuit Swimming Suit Swimwear Monokini Bikini Beachwear Swimdress  Plus Size XS-8XL,10.0,EUR,10.0,EUR,12,10,,,4.6,5.0,3,2,0,0,0,,,,,,yellow,xs,50,Livraison standard,3.0,false,,50,,,CN,sunleijun,sunleijunb20e383adc7111e6a94206a1581eec40,"80 % avis positifs (2,018 notes)",2018,3.770564915758176,587da4a3f1f65d77cd7c5fe9,,,https://www.wish.com/c/5f6ea0b42c86ba0040a96fc7,https://canary.contestimg.wish.com/api/webimage/5f6ea0b42c86ba0040a96fc7-medium.jpg,5f6ea0b42c86ba0040a96fc7
INGAGA 2020 Bikinis High Waist Swimsuits Swimwear Women Push Up Biquini Beachwear Top Wrap Bathing Suit Women Ruched Bikini Set,INGAGA 2020 Bikinis High Waist Swimsuits Swimwear Women Push Up Biquini Beachwear Top Wrap Bathing Suit Women Ruched Bikini Set,25.0,EUR,25.0,EUR,30,0,,,5.0,0.0,,,,,,,,,,,black,s,40,Livraison standard,15.0,false,,50,true,Quantité limitée !,CA,11368796 CANADA CORPORATION,11368796canadacorporation,"80 % avis positifs (1,166 notes)",1166,3.9382504288164664,5ffb1f43fa8a25c707537989,,,https://www.wish.com/c/6012d84157aebd3b750db831,https://canary.contestimg.wish.com/api/webimage/6012d84157aebd3b750db831-medium.jpg,6012d84157aebd3b750db831
Maillot de bain imprimé femme maillot de bain maillot de bain deux pièces maillot de bain bikini grande taille XS-8XL,Womens Printed Swimwear Swimsuit Bathing Suit Two Pieces Beachwear Bikini Plus Size XS-8XL,10.0,EUR,10.0,EUR,11,10,,,4.0,1.0,0,1,0,0,0,,,,,,black&white,xs,50,Livraison standard,2.0,false,,50,,,CN,loveliyinger,loveliyinger,"(4,986 notes)",4986,4.0619735258724425,587f4f510366d0022fd667ec,,,https://www.wish.com/c/5f6dfa0d91d7f9004cd69874,https://canary.contestimg.wish.com/api/webimage/5f6dfa0d91d7f9004cd69874-medium.jpg,5f6dfa0d91d7f9004cd69874
Mode d'été pour femmes nouveau maillot de bain deux pièces ensembles de Bikini imprimé léopard maillots de bain maillot de bain dames maillots de bain Bikini,Women's Summer Fashion New Two Piece Swimsuit Leopard Print Bikini Sets Swimwear Bathing Suit Ladies Beachwear Bikini ,4.71,EUR,5.0,EUR,5.71,10,,,3.6122448979591835,49.0,22,8,6,4,9,,,,,,green,xs,2,Livraison standard,2.0,false,,50,true,Quantité limitée !,CN,alabaostore est un vendeur agréé,alabaostore,"(1,018 notes)",1018,4.011787819253438,5d5256c527752b19063d8c53,,,https://www.wish.com/c/5eb3b19d5b1465392d52ec37,https://canary.contestimg.wish.com/api/webimage/5eb3b19d5b1465392d52ec37-medium.jpg,5eb3b19d5b1465392d52ec37
Femmes Sexy Bikini Set Push Up Maillots De Bain Deux Pièces D'été Beachwear Patchwork Split Sous-Vêtements,Women Sexy Bikini Set Push Up Swimsuits Two Piece Summer Beachwear Patchwork Split Underwear,2.0,EUR,2.0,EUR,2,9,,,5.0,0.0,,,,,,,,,,,oldrose,2xs,50,Livraison standard,1,false,,50,,,CN,sun xiao jie,sunxiaojie,(139 notes),139,4.043165467625899,5de788b98db42009c50b8637,,,https://www.wish.com/c/5ed8b580139c18513e118d36,https://canary.contestimg.wish.com/api/webimage/5ed8b580139c18513e118d36-medium.jpg,5ed8b580139c18513e118d36
Newest Fashion Summer Men's Quick-Dry Shorts Siwmwear Beach-Shorts Swim-shorts Beach-Wear for Summer  9 Colors S-XXXL,Newest Fashion Summer Men's Quick-Dry Shorts Siwmwear Beach-Shorts Swim-shorts Beach-Wear for Summer  9 Colors S-XXXL,7.0,EUR,7.0,EUR,8,10,,,5.0,0.0,,,,,,,,,,,black,s,50,Livraison standard,2.0,false,,50,,,CN,zuxiantanshi,zuxiantanshi,100 % avis positifs (2 notes),2,3.5,5f5882e5bde18a0f29644db0,,,https://www.wish.com/c/605c97998733cfec1d68b708,https://canary.contestimg.wish.com/api/webimage/605c97998733cfec1d68b708-medium.jpg,605c97998733cfec1d68b708
2019 Sexy femmes OMG lettres maillots de bain brésilien Bandage Push Up maillot de bain solide maillots de bain maillot de bain string Biquini Bikini ensemble,2019 Sexy Women OMG Letters Swimwear Brazilian Bandage Push Up Swimsuit Solid Beachwear Bathing Suit Thong Biquini Bikini Set,16.0,EUR,16.0,EUR,19,1,,,5.0,0.0,,,,,,,,,,,multicolored,l,50,Livraison standard,12.0,false,,50,,,CA,11368796 CANADA CORPORATION,11368796canadacorporation,"80 % avis positifs (1,166 notes)",1166,3.9382504288164664,5ffb1f43fa8a25c707537989,,,https://www.wish.com/c/5ffee7d05fd12dfe7113ba20,https://canary.contestimg.wish.com/api/webimage/5ffee7d05fd12dfe7113ba20-medium.jpg,5ffee7d05fd12dfe7113ba20
 Maillot de bain femme Maillot de bain Maillot de bain Tankini Bikini Monokini Maillot de bain Beachwear Plus Size XS-8XL, Women Swimsuit Swimwear Bathing Suit Tankini Bikini Monokini Swimming Suit Beachwear  Plus Size XS-8XL,4.0,EUR,55.0,EUR,4.85,10,,,3.533333333333333,15.0,6,2,3,2,2,,,,,,yellow,xs,2,Livraison standard,1.0,false,,50,true,Quantité limitée !,CN,jingman,jingman,"77 % avis positifs (1,580 notes)",1580,3.7272151898734176,58bd6d5d9eed0a5ba364d256,,,https://www.wish.com/c/5e58c2f7be1fa0476ee8ce80,https://canary.contestimg.wish.com/api/webimage/5e58c2f7be1fa0476ee8ce80-medium.jpg,5e58c2f7be1fa0476ee8ce80
Grande taille femmes Tankini ensemble maillot de bain maillot de bain maillot de bain à pois Floral à volants Bikini ensemble maillots de bain tronc maillots de bain,Plus Size Women Tankini Set Swimdress Swimsuit Bathing Suit Polka Dot Floral Ruffle Bikini Set Beachwear Trunk Swimwear ,14.0,EUR,82.0,EUR,16,10,,,3.0,2.0,1,0,0,0,1,,,,,,whitedot,s,50,Livraison standard,5.0,false,,50,,,CN,ShoppingTrolley,shoppingtrolley,"93 % avis positifs (1,721 notes)",1721,4.329459616502033,5a61a4a95349200ac9247725,,,https://www.wish.com/c/5cfdbbb6d0575778ccaea755,https://canary.contestimg.wish.com/api/webimage/5cfdbbb6d0575778ccaea755-medium.jpg,5cfdbbb6d0575778ccaea755
Summr femmes solide Bikinis maillots de bain femmes maternité Tankinis 2019 maillot de bain maillot de bain enceinte costume grossesse maillots de bain,Summr Women Solid Bikinis Swimwear Women Maternity Tankinis 2019 Swimsuit Beachwear Pregnant Suit Pregnancy Swimwear,10.0,EUR,57.0,EUR,11,10,,,3.0,1.0,0,0,1,0,0,,,,,,blue,m,3,Livraison standard,2.0,false,,27,,,CN,Yanyuqing,yanyuqing,"84 % avis positifs (1,201 notes)",1201,4.020815986677769,5d522bf66045d858a539384c,,,https://www.wish.com/c/5e7ef12823dc2b48a24bf53f,https://canary.contestimg.wish.com/api/webimage/5e7ef12823dc2b48a24bf53f-medium.jpg,5e7ef12823dc2b48a24bf53f
2 Pcs Tie Dyed Bandeau Push-Up Soutien-Gorge Rembourré Bikini Ensemble Mode Femmes Bandage Deux Pièces Bikinis Maillot De Bain Chic Taille Haute Shorts De Bain Dos Nu Maillots De Bain,2Pcs Tie Dyed Bandeau Push-Up Padded Bra Bikini Set Fashion Women Bandage Two Piece Bikinis Swimsuit Chic High Waist Swimming Shorts Backless Beachwear Swimwear,13.0,EUR,13.0,EUR,15,10,,,5.0,0.0,,,,,,,,,,,green,s,50,Livraison standard,4.0,false,,50,,,CN,bianyiren,bianyiren,"91 % avis positifs (2,930 notes)",2930,4.309215017064846,5b0cb8e101287527a576e9e7,,,https://www.wish.com/c/5fe069f7fdacf7003e804621,https://canary.contestimg.wish.com/api/webimage/5fe069f7fdacf7003e804621-medium.jpg,5fe069f7fdacf7003e804621
Femmes Strappy Back Tie Dye Imprimer Tankini Ensemble Maillot De Bain Maillots De Bain Maillot De Bain Beachwear Plus La Taille XS-8XL,Womens Strappy Back Tie Dye Print Tankini Set Swimsuit Swimwear Bathing Suit Beachwear Plus Size XS-8XL,12.0,EUR,12.0,EUR,14,10,,,5.0,2.0,2,0,0,0,0,,,,,,blue,xs,1,Livraison standard,4.0,false,,50,,,CN,Bright Eye Fashion TOP,brighteyefashiontop,"90 % avis positifs (8,305 notes)",8305,4.205538832028898,56f52b8027a7461dad277be2,,,https://www.wish.com/c/5fc5de415de9a47ea6e202ac,https://canary.contestimg.wish.com/api/webimage/5fc5de415de9a47ea6e202ac-medium.jpg,5fc5de415de9a47ea6e202ac
Bikini Set 2020 Summer Swimwear Biquini Women Ruched Hollow Sexy Bikini Push-Up Padded Swimwear Swimsuit Beachwear Set,Bikini Set 2020 Summer Swimwear Biquini Women Ruched Hollow Sexy Bikini Push-Up Padded Swimwear Swimsuit Beachwear Set,28.0,EUR,28.0,EUR,33,0,,,5.0,0.0,,,,,,,,,,,purple,s,50,Livraison standard,14.0,false,,50,,,CA,11368796 CANADA CORPORATION,11368796canadacorporation,"80 % avis positifs (1,166 notes)",1166,3.9382504288164664,5ffb1f43fa8a25c707537989,,,https://www.wish.com/c/600994f230b50a003e318db8,https://canary.contestimg.wish.com/api/webimage/600994f230b50a003e318db8-medium.jpg,600994f230b50a003e318db8
Fantastique femmes Bikini ensemble maillot de bain rayé maillots de bain maillots de bain maillot de bain S / M / L / XL,Fantastic  Women Bikini Set Striped Swimsuit Swimwear Beachwear Bathing Suit  S/M/L/XL,7.0,EUR,7.0,EUR,8,10,,,5.0,0.0,,,,,,,,,,,black,s,50,Livraison standard,3.0,false,,50,,,CN,easy_lucky,easy_lucky,"(230,680 notes)",230680,4.350624241373331,53f6b9901f50630534664625,,,https://www.wish.com/c/5f7191fc05abda004011407a,https://canary.contestimg.wish.com/api/webimage/5f7191fc05abda004011407a-medium.jpg,5f7191fc05abda004011407a
Femmes été modestie burkini rétro maillots de bain ensemble femmes maillot de bain couverture complète maillots de bain maillots de bain,Women Summer Modesty Burkini Retro Swimsuits Set Women Swimsuit Full Cover Beachwear Swimwear ,7.0,EUR,7.0,EUR,8,10,,,3.8026315789473686,76.0,37,13,10,6,10,,,,,,blue,xxxs,16,Livraison standard,3.0,false,,50,true,Quantité limitée !,CN,THIS TOWN,thistown,"87 % avis positifs (15,507 notes)",15507,4.0512026826594445,58b033a0a58f5c1e132667d9,,,https://www.wish.com/c/5b3348586280844f0f10f2f8,https://canary.contestimg.wish.com/api/webimage/5b3348586280844f0f10f2f8-medium.jpg,5b3348586280844f0f10f2f8
"Gitan, crochet, jupe à pompons, avec frange longue. Tiré d'un motif original des années 70. Vêtements de festival. Jupe Boho. Jupe végétalienne","Gypsy, crochet, tassel skirt, with long fringe. Taken from an original pattern from the seventys. Festival clothing. Boho skirt. Vegan skirt",10.0,EUR,10.0,EUR,11,1000,,,4.345083487940631,539.0,358,87,47,16,31,,,,,,white,xs,50,Livraison standard,2.0,false,,50,,,CN,zhanghuiying,zhanghuiying,"94 % avis positifs (7,947 notes)",7947,4.415376871775512,55593c0abe0bad0e6c8371e5,,,https://www.wish.com/c/5a3d0fa7d0249912cd8cc037,https://canary.contestimg.wish.com/api/webimage/5a3d0fa7d0249912cd8cc037-medium.jpg,5a3d0fa7d0249912cd8cc037
Femmes Halter Maillots de bain Deux pièces Maillot de bain Push Up Bandage Maillots de bain Maillots de bain Soutien-gorge rassemblé Lingerie évider Soutien-gorge imprimé sexy et sous-vêtements string Plus la taille,Womens Halter Bathing Suits Two Pieces Push Up Swimsuit Bandage Swimwear Beachwear Gathered Bra Hollow Out Lingerie Sexy Printed Bra And G-String Underwear Plus Size,4.83,EUR,5.0,EUR,5.86,10,,,4.75,4.0,3,1,0,0,0,,,,,,lightgreen,xxs,1,Livraison standard,1.0,false,,50,,,CN,PurpleFire,purplefire,"92 % avis positifs (3,082 notes)",3082,4.333225178455549,59521e11e81e8a3ff5b5bf61,,,https://www.wish.com/c/601d269f26e751004cb46df8,https://canary.contestimg.wish.com/api/webimage/601d269f26e751004cb46df8-medium.jpg,601d269f26e751004cb46df8
Femmes Strappy Back Imprimé Multi Couleur Tankini Ensemble Maillots De Bain Maillots De Bain Maillot De Bain Beachwear Plus La Taille XS-8XL,Womens Strappy Back Printed Multi Color Tankini Set Swimsuits Swimwear Bathing Suit Beachwear Plus Size XS-8XL,5.0,EUR,5.0,EUR,6,10,,,3.4285714285714284,7.0,4,0,0,1,2,,,,,,multicolor,sizexs,3,Livraison standard,2.0,false,,50,,,CN,BEAUTY MAIL,beautymail,"84 % avis positifs (1,263 notes)",1263,4.009501187648456,56f3e459304bc76e4c9624ba,,,https://www.wish.com/c/5f7f1be630b88c1c89db335b,https://canary.contestimg.wish.com/api/webimage/5f7f1be630b88c1c89db335b-medium.jpg,5f7f1be630b88c1c89db335b
Wome s Beach Bikini Cover up Jupe de bain Short Wrap Sarong Beachwear Cover Dress,Wome s Beach Bikini Cover up Swim Skirt Short Wrap Sarong Beachwear Cover Dress,5.0,EUR,5.0,EUR,5,10,,,3.5833333333333335,12.0,7,0,1,1,3,,,,,,white,freesize,50,Livraison standard,2.0,false,,50,true,Quantité limitée !,CN,NANNZI XIINNG FATION CLOTHING SHOP,nannzixiinngfationclothingshop,82 % avis positifs (220 notes),220,3.9727272727272727,5ed4a30d0eab7404006b7cf2,,,https://www.wish.com/c/5f278934a05673558c14a5ac,https://canary.contestimg.wish.com/api/webimage/5f278934a05673558c14a5ac-medium.jpg,5f278934a05673558c14a5ac
Maillots de bain sexy pour femmes Ensemble de bikini Bandeau Push-Up Soutien-gorge rembourré Maillot de bain Beachwear,Sexy Women's Swimwear Bikini Set Bandeau Push-Up Padded Bra Swimsuit Beachwear,14.0,EUR,17.0,EUR,16,20000,,,3.2333333333333334,60.0,22,7,11,3,17,,,,,,,xl,4,Livraison standard,5.0,false,,50,,,CN,clothesworld,clothesworld,84 % avis positifs (232 notes),232,3.8491379310344827,53f0ac36104dae3e363ed8d6,,,https://www.wish.com/c/551ea06105705558ee464527,https://canary.contestimg.wish.com/api/webimage/551ea06105705558ee464527-medium.jpg,551ea06105705558ee464527
2020 Women Swimwear Sexy Bikini Set Gradient Print 2 Pieces Ladies Push-up Padded Bra Swimming Suit Beachwear #YL5,2020 Women Swimwear Sexy Bikini Set Gradient Print 2 Pieces Ladies Push-up Padded Bra Swimming Suit Beachwear #YL5,17.0,EUR,17.0,EUR,20.0,10,,,5.0,1.0,1,0,0,0,0,,,,,,purple,s,50,Livraison standard,0.0,false,,50,,,CA,Loom,loom,81 % avis positifs (403 notes),403,4.054590570719603,60108516d38ac0468d48a860,,,https://www.wish.com/c/60187d94343b3d44116be6f3,https://canary.contestimg.wish.com/api/webimage/60187d94343b3d44116be6f3-medium.jpg,60187d94343b3d44116be6f3
Femmes Mode Maillots De Bain Deux Pièces Maillots De Bain Maillots De Bain Dos Nu Tankini Beachwear Maillot De Bain et Shorts,Women Fashion Swimsuits Two Pieces Swimwear Bathing Suits Backless Tankini Beachwear Swimdress and Shorts ,5.0,EUR,5.0,EUR,5,10,,,3.34375,32.0,12,4,5,5,6,,,,,,purple,xs,2,Livraison standard,2.0,false,,50,,,CN,Dream Paris,dreamparis,"79 % avis positifs (9,622 notes)",9622,3.724693410933278,575ae9d320c8d15cbf9e6918,,,https://www.wish.com/c/5e018540c53fc94e1f565dbf,https://canary.contestimg.wish.com/api/webimage/5e018540c53fc94e1f565dbf-medium.jpg,5e018540c53fc94e1f565dbf
Maillot de bain Bikini Maillot de bain Bikini 5 Couleurs Femme Mode Mode Sexy Combinaison de bain Slim Fit Spaghetti Bracelet Camouflage Maillot de bain une pièce Bikini Maillot de bain sans dos,5 Colors Women Fashion Sexy Backless Swimming Jumpsuits Slim Fit Spaghetti Strap Camouflage One Piece Swimsuit Bikini Beachwear Bathing Suit,4.69,EUR,42.0,EUR,5.68,1000,,,3.466463414634146,656.0,274,85,100,67,130,,,,,,pink,s,50,Livraison standard,1.0,false,,50,,,CN,snowgirl,snowgirl,"(38,404 notes)",38404,3.97031559212582,5639cd9bddb94f103070ef9f,,,https://www.wish.com/c/5c3c203632a6a40bc2a9c5d9,https://canary.contestimg.wish.com/api/webimage/5c3c203632a6a40bc2a9c5d9-medium.jpg,5c3c203632a6a40bc2a9c5d9
Old Glory,,,,,,,,,,,,,,,,,,,,,,,,,,,,,,,,,,,,,,,,,https://www.wish.com/c/5e542cfc9719ed19e848486d,,5e542cfc9719ed19e848486d
Léopard Patchwork Maillots De Bain Femmes Mode Deux Pièces Ensemble Maillot De Bain Maillot De Bain Beach-Wear Tankinis V-Neck Bikini Sexy Bikinis Tankinis,Leopard Patchwork Swimwear Women Fashion Two Piece Set Swimsuit Bathing Suit Beach-Wear Tankinis V-Neck Bikini sexy bikinis tankinis,10.0,EUR,10.0,EUR,12,10,,,5.0,0.0,,,,,,,,,,,leopard&black,s,50,Livraison standard,3.0,false,,50,,,CN,klfhjklsffhj5,klfhjklsffhj5,89 % avis positifs (323 notes),323,4.226006191950464,5edddc4c69edc057c1f8b057,,,https://www.wish.com/c/5fffbe4b4f9c385376393d64,https://canary.contestimg.wish.com/api/webimage/5fffbe4b4f9c385376393d64-medium.jpg,5fffbe4b4f9c385376393d64
Femmes Mode Été Deux Pièces Maillots De Bain De Plage Casual Bikini Rayé Ensemble Dames Bandage Push-ups Soutien-Gorge Rayures Verticales Maillot De Bain Beachwear Maillot De Bain Plus La Taille,Women Fashion Summer Two-piece Beach Swimwear Casual Striped Bikini Set Ladies Bandage Push-ups Bra Vertical Stripes Swimsuit Beachwear Bathing Suit Plus Size,10.0,EUR,10.0,EUR,11,10,,,3.5833333333333335,36.0,16,6,4,3,7,,,,,,red,s,50,Livraison standard,3.0,false,,50,,,CN,shenzhenhuanbaoxiaoshangpu,深圳环保小商铺,"83 % avis positifs (17,090 notes)",17090,3.894499707431246,5787948b09ce0919dababd5b,,,https://www.wish.com/c/5e37c256b0826227b061a368,https://canary.contestimg.wish.com/api/webimage/5e37c256b0826227b061a368-medium.jpg,5e37c256b0826227b061a368
Under Armour,,,,,,,,,,,,,,,,,,,,,,,,,,,,,,,,,,,,,,,,,https://www.wish.com/c/5e542cff9719ed19e8484884,,5e542cff9719ed19e8484884
