title,title_orig,discount_price,discount_price_currency,retail_price,retail_price_currency,discount_price_in_original_currency,nb_cart_orders_approx,nb_units_purchased_approx,uses_ad_boosts,rating,rating_count,rating_five_count,rating_four_count,rating_three_count,rating_two_count,rating_one_count,badges_count,badge_local_product,badge_product_quality,badge_fast_shipping,tags,product_color,product_variation_size_id,product_variation_inventory,shipping_option_name,shipping_option_price,shipping_is_express,countries_shipped_to,inventory_total,has_urgency_banner,urgency_text,origin_country,merchant_title,merchant_name,merchant_info_subtitle,merchant_rating_count,merchant_rating,merchant_id,merchant_has_profile_picture,merchant_profile_picture,product_url,product_picture,product_id
Tommy Hilfiger,,,,,,,,,,,,,,,,,,,,,,,,,,,,,,,,,,,,,,,,,https://www.wish.com/c/5e8d2fcf9719ed640496768a,,5e8d2fcf9719ed640496768a
2021 Été NOUVEAU Débardeur rayé à la mode pour femmes + Slip imprimé de tournesol Ensemble de bikini Deux pièces Maillots de bain Sexy Col en V profond sans manches Crop Top Maillot de bain taille haute Summer Beachwear Plus Size S-3XL,2021 Summer NEW Women's Fashion Striped Tank Top + Sunflower Print Briefs Bikini Set Two Pieces Swimwear Sexy Deep V-neck Neck Backless Sleeveless Crop Top High Waisted Swimsuit Summer Beachwear Plus Size S-3XL,5.0,EUR,5.0,EUR,5,10,,,5.0,1.0,1,0,0,0,0,,,,,,black,xs,5,Livraison standard,2.0,false,,50,,,CN,S You Again,水墨青山,"83 % avis positifs (16,534 notes)",16534,3.8825450586669894,5667a686dad4ce30ab85758e,,,https://www.wish.com/c/5ff588d0528179415ada1a00,https://canary.contestimg.wish.com/api/webimage/5ff588d0528179415ada1a00-medium.jpg,5ff588d0528179415ada1a00
Modeste d'été maillot de bain musulman maillot de bain couverture complète islamique Beachwear Suit,Summer Modesty Muslim Swimwear Swimsuit Full Cover Islamic Beachwear Suit,21.0,EUR,21.0,EUR,25,10,,,4.142857142857143,147.0,82,33,16,3,13,,,,,,black,l,5,Livraison standard,6.0,false,,50,,,CN,yushihaoyu,yushihaoyu,"(9,361 notes)",9361,4.424954598867642,58da64693dc5e354165dd1d4,,,https://www.wish.com/c/5a44bf41daa5c767100b9986,https://canary.contestimg.wish.com/api/webimage/5a44bf41daa5c767100b9986-medium.jpg,5a44bf41daa5c767100b9986
Femmes asymétrique ourlet imprimé cravate avant maillot de bain haut de bain maillot de bain deux pièces Bikini Beachwear grande taille XS-8XL,Womens Asymmetric Hem Printed Tie Front Swimwear Top Swimsuit Bathing Suit Two Pieces Bikini Beachwear Plus Size XS-8XL,8.0,EUR,8.0,EUR,9,10,,,4.21875,32.0,18,7,4,2,1,,,,,,multicolor,xs,50,Livraison standard,3.0,false,,50,,,CN,Honest Fashion shopping,honestfashionshopping,"91 % avis positifs (11,010 notes)",11010,4.237511353315168,570d017b1b4ca758e18e407d,,,https://www.wish.com/c/5f6e9b4ac4919e0044f9b60a,https://canary.contestimg.wish.com/api/webimage/5f6e9b4ac4919e0044f9b60a-medium.jpg,5f6e9b4ac4919e0044f9b60a
Women's Dinosaur Printed Sexy Split Bikini Beachwear,Women's Dinosaur Printed Sexy Split Bikini Beachwear,14.0,EUR,14.0,EUR,16,4,,,5.0,0.0,,,,,,,,,,,green,s,48,Livraison standard,4.0,false,,50,,,CN,consistent,consistent,"87 % avis positifs (6,291 notes)",6291,4.09998410427595,59365f858b9602732939f751,,,https://www.wish.com/c/60128bf50dfa1f916edee94f,https://canary.contestimg.wish.com/api/webimage/60128bf50dfa1f916edee94f-medium.jpg,60128bf50dfa1f916edee94f
2020 Nouveau 6 Couleurs Mignon Bébé Filles Hit Couleur Robe Longue Enfants Casual Coton Beachwear Maxi Robe fit,2020 New 6 Colors Cute Baby Girls Hit Color Long Dress Children Casual Cotton Beachwear Maxi Dress fit,5.0,EUR,5.0,EUR,6,10,,,3.4782608695652173,23.0,7,6,4,3,3,,,,,,red,xs,1,Livraison standard,2.0,false,,50,,,CN,zhongdou,zhongdou,"82 % avis positifs (1,315 notes)",1315,3.906463878326996,5d46591f56a26046061bc3e7,,,https://www.wish.com/c/5eae74389fa06f4b7b85051c,https://canary.contestimg.wish.com/api/webimage/5eae74389fa06f4b7b85051c-medium.jpg,5eae74389fa06f4b7b85051c
Femmes Deux Pièces Tankini Ensemble Maillot De Bain Maillot De Bain Maillots De Bain Monokini Bikini Beachwear Maillot De Bain Plus La Taille XS-8XL,Womens Two Pieces Tankini Set Swimsuit Swimming Suit Swimwear Monokini Bikini Beachwear Swimdress  Plus Size XS-8XL,10.0,EUR,10.0,EUR,12,10,,,4.176470588235294,17.0,11,2,1,2,1,,,,,,black&white,xs,50,Livraison standard,3.0,false,,50,true,Quantité limitée !,CN,Teng pre trade,tengpretrade,93 % avis positifs (15 notes),15,4.266666666666667,5e43c286d91aba645497695c,,,https://www.wish.com/c/5f6ea0deb312250a58fd1a2d,https://canary.contestimg.wish.com/api/webimage/5f6ea0deb312250a58fd1a2d-medium.jpg,5f6ea0deb312250a58fd1a2d
Femmes drapeau américain impression push-up rembourré soutien-gorge plage bikini ensemble maillot de bain beachwear maillots de bain,Women American Flag Print Push-Up Padded Bra Beach Bikini Set Swimsuit Beachwear Swimwear,15.0,EUR,46.0,EUR,17,10,,,3.075268817204301,93.0,27,13,18,10,25,,,,,,,1-s,23,Livraison standard,5.0,false,,50,,,CN,htaassw,htaassw,"89 % avis positifs (4,916 notes)",4916,4.184296175752644,5a5f153e430b71500d87877c,,,https://www.wish.com/c/5ee7182829120705cc460541,https://canary.contestimg.wish.com/api/webimage/5ee7182829120705cc460541-medium.jpg,5ee7182829120705cc460541
Femmes Grande Taille Monokini Gothic Black Skull Black Skull Beachwear Halter Halter Backless Push up Maillots de bain une pièce Maillot de bain une pièce,Women Plus Size Monokini Gothic Black Skull Beachwear Halter Backless Push up Swimwear One piece Bathing suit,15.0,EUR,15.0,EUR,18,10,,,5.0,1.0,1,0,0,0,0,,,,,,multicolor,m,50,Livraison standard,5.0,false,,50,,,CN,bessshop,bessshop,81 % avis positifs (548 notes),548,3.841240875912409,56418e2edfb6b15e4973870a,,,https://www.wish.com/c/5d68d64b29d462137b65868f,https://canary.contestimg.wish.com/api/webimage/5d68d64b29d462137b65868f-medium.jpg,5d68d64b29d462137b65868f
2021 Women's Fashion Bikini  Plus Size Women Gold Lock Bikini Pure Color High Waist Padded Swimsuit Bikini Set Brazilian Beachwear Push Up Bikinis ,2021 Women's Fashion Bikini  Plus Size Women Gold Lock Bikini Pure Color High Waist Padded Swimsuit Bikini Set Brazilian Beachwear Push Up Bikinis ,7.0,EUR,7.0,EUR,8,10,,,3.0,1.0,0,0,1,0,0,,,,,,white,eyepatch,3,Livraison standard,2.0,false,,50,true,Quantité limitée !,CN,Cherish 5,cherish5,85 % avis positifs (13 notes),13,4.153846153846154,6010b82ab2f86800489153f1,,,https://www.wish.com/c/60488279140196137176e2dc,https://canary.contestimg.wish.com/api/webimage/60488279140196137176e2dc-medium.jpg,60488279140196137176e2dc
Grande taille XS-8XL femmes été Monokini body maillot de bain baigneur vêtements de plage grande taille une pièce maillots de bain maillots de bain maillots de bain ensemble de Bikini,Plus Size XS-8XL Women Summer Monokini Bodysuit Bathing Suit Bather Beachwear Plus Size One Piece Bathing Suits Swimwear Beachwear Bikini Set,10.0,EUR,10.0,EUR,11,10,,,4.10655737704918,122.0,70,21,15,6,10,,,,,,red,s,1,Livraison standard,3.0,false,,50,,,CN,linyanzai,linyanzai,81 % avis positifs (839 notes),839,3.8808104886769965,5d5372ae7ad24232972a9779,,,https://www.wish.com/c/5f39df143441380051a4519d,https://canary.contestimg.wish.com/api/webimage/5f39df143441380051a4519d-medium.jpg,5f39df143441380051a4519d
Maillot de bain une pièce Bikini pour femme imprimé africain Monokini Vintage Push-Up soutien-gorge rembourré vêtements de plage,Womens One Piece Bikini Swimwear Swimsuit African Print Monokini Vintage Push-Up Padded Bra Beachwear,23.0,EUR,82.0,EUR,27,10,,,4.0,1.0,0,1,0,0,0,,,,,,white,sizes,50,Livraison standard,8.0,false,,50,,,CN,hdldong,hdldong,89 % avis positifs (862 notes),862,4.230858468677495,5800530d047bed1b0b9401b8,,,https://www.wish.com/c/5e7dcdb89fdff065892fa8c8,https://canary.contestimg.wish.com/api/webimage/5e7dcdb89fdff065892fa8c8-medium.jpg,5e7dcdb89fdff065892fa8c8
Maillot de bain imprimé femme maillot de bain maillot de bain deux pièces maillot de bain bikini grande taille XS-8XL,Womens Printed Swimwear Swimsuit Bathing Suit Two Pieces Beachwear Bikini Plus Size XS-8XL,7.0,EUR,7.0,EUR,8,10,,,4.333333333333333,6.0,4,0,2,0,0,,,,,,pink,xs,50,Livraison standard,3.0,false,,50,,,CN,tututu  shop,tututushop,"92 % avis positifs (11,319 notes)",11319,4.328297552787348,583fa4290592b847f4e737b3,,,https://www.wish.com/c/5f5b931fbb8f6f26ebd1ee08,https://canary.contestimg.wish.com/api/webimage/5f5b931fbb8f6f26ebd1ee08-medium.jpg,5f5b931fbb8f6f26ebd1ee08
New Fashion Summer Bikini Set Wire Free Triangle Cup Beachwear Halter Bra Low Waist G-string Swimsuit for Women S-2XL,New Fashion Summer Bikini Set Wire Free Triangle Cup Beachwear Halter Bra Low Waist G-string Swimsuit for Women S-2XL,10.0,EUR,10.0,EUR,11,10,,,5.0,0.0,,,,,,,,,,,yellow,s,18,Livraison standard,3.0,false,,50,,,CN,Vogue's Secret,voguessecret,"91 % avis positifs (24,060 notes)",24060,4.271778886118038,55607c4be4e89f0e970be78c,,,https://www.wish.com/c/6052ed959031ae2cffc07515,https://canary.contestimg.wish.com/api/webimage/6052ed959031ae2cffc07515-medium.jpg,6052ed959031ae2cffc07515
New Women's Fashion Summer Swimsuit Ladies Vintage Two Piece Halter Ruched Bikinis High Waist Beachwear Two-piece Bathing Suit ,New Women's Fashion Summer Swimsuit Ladies Vintage Two Piece Halter Ruched Bikinis High Waist Beachwear Two-piece Bathing Suit ,7.0,EUR,7.0,EUR,8,10,,,5.0,0.0,,,,,,,,,,,red,xxs,1,Livraison standard,2.0,false,,50,true,Quantité limitée !,CN,LJHRFS,ljhrfs,82 % avis positifs (285 notes),285,3.9087719298245616,5d5a6255ae9d60775f1e4d84,,,https://www.wish.com/c/605adb8a6612103dc5bd748d,https://canary.contestimg.wish.com/api/webimage/605adb8a6612103dc5bd748d-medium.jpg,605adb8a6612103dc5bd748d
Maillot de bain 3 couleurs style Boho pour femme taille haute imprimé floral taille haute Maillot de bain 2 pièces Maillot de bain bikini ensemble Maillot de bain d'été femme,3 Color Boho Style Swimsuit for Women High Waist Floral Print Swimwear 2 Piece Bikini Set Bathing Suits Summer Beachwear Women,10.0,EUR,10.0,EUR,11,1000,,,4.267267267267267,333.0,198,69,40,9,17,,,,,,black,s,50,Livraison standard,2.0,false,,50,,,CN,Sonick,sonick,"88 % avis positifs (16,188 notes)",16188,4.167840375586854,565c13ad389b9b2df29caa32,,,https://www.wish.com/c/5b73a4103d9e2e3af96d5681,https://canary.contestimg.wish.com/api/webimage/5b73a4103d9e2e3af96d5681-medium.jpg,5b73a4103d9e2e3af96d5681
Femmes Sexy Bikini Imprimé Mode Maillot de bain Femmes Bikini Set Beachwear,Womens Sexy Printed Bikini Fashion Bathing Suit Women Bikini Set Beachwear ,8.0,EUR,15.0,EUR,9,10,,,3.764705882352941,51.0,26,9,3,4,9,,,,,,multicolor,small,8,Livraison standard,3.0,false,,50,,,CN,Lucky EverydayHa,gladlucky,80 % avis positifs (849 notes),849,3.838633686690224,5dab14d98f3ae51fa44f9479,,,https://www.wish.com/c/5e4f8eedb8a5303600bfd79f,https://canary.contestimg.wish.com/api/webimage/5e4f8eedb8a5303600bfd79f-medium.jpg,5e4f8eedb8a5303600bfd79f
Femmes Sexy One Piece Bikini Push Up Soutien-Gorge Maillot De Bain Maillots De Bain Maillot De Bain Serré Sexy Ceinture Blanc Maillot De Bain Une Pièce Profonde V Beachwear,Women Sexy One Piece Bikini Push Up Bra Swimsuit Swimwear Bathing Suit Tight sexy belt white one-piece swimsuit deep V beachwear,28.0,EUR,28.0,EUR,33,0,,,5.0,0.0,,,,,,,,,,,blue,"s,china",50,Livraison standard,8.0,false,,50,,,CA,11368796 CANADA CORPORATION,11368796canadacorporation,"80 % avis positifs (1,166 notes)",1166,3.9382504288164664,5ffb1f43fa8a25c707537989,,,https://www.wish.com/c/5fff20761f9372004820abfd,https://canary.contestimg.wish.com/api/webimage/5fff20761f9372004820abfd-medium.jpg,5fff20761f9372004820abfd
Femmes asymétrique ourlet imprimé cravate avant maillot de bain haut de bain maillot de bain deux pièces Bikini Beachwear grande taille XS-8XL,Womens Asymmetric Hem Printed Tie Front Swimwear Top Swimsuit Bathing Suit Two Pieces Bikini Beachwear Plus Size XS-8XL,8.0,EUR,8.0,EUR,9,10,,,4.027777777777778,36.0,22,3,4,4,3,,,,,,green,xs,50,Livraison standard,3.0,false,,50,true,Quantité limitée !,CN,Young Fashion Stars,youngfashionstars,"87 % avis positifs (13,392 notes)",13392,4.089979091995221,569b6ab23874ab0da794126e,,,https://www.wish.com/c/5f6e9b31915e8d004bc6680a,https://canary.contestimg.wish.com/api/webimage/5f6e9b31915e8d004bc6680a-medium.jpg,5f6e9b31915e8d004bc6680a
Bikini Women Swimwear Bikinis Sexy Biquini Swim Suit Push Up Swimsuit Female Beachwear Swimming Bikini Women купальник женский,Bikini Women Swimwear Bikinis Sexy Biquini Swim Suit Push Up Swimsuit Female Beachwear Swimming Bikini Women купальник женский,14.0,EUR,14.0,EUR,16,0,,,5.0,0.0,,,,,,,,,,,white,"s,poland",50,Livraison standard,10.0,false,,50,true,Quantité limitée !,CA,11368796 CANADA CORPORATION,11368796canadacorporation,"(1,166 notes)",1166,3.9382504288164664,5ffb1f43fa8a25c707537989,,,https://www.wish.com/c/600d8010f64d42b1ce42e11c,https://canary.contestimg.wish.com/api/webimage/600d8010f64d42b1ce42e11c-medium.jpg,600d8010f64d42b1ce42e11c
Fila,,,,,,,,,,,,,,,,,,,,,,,,,,,,,,,,,,,,,,,,,https://www.wish.com/c/5e3b0ba59719eddf0ac7e682,,5e3b0ba59719eddf0ac7e682
Pink Floyd,,,,,,,,,,,,,,,,,,,,,,,,,,,,,,,,,,,,,,,,,https://www.wish.com/c/5e8d2fce9719ed6404967680,,5e8d2fce9719ed6404967680
CHINA Women Pregnant Women One Piece Swimsuit Female Floral Print Bikini Swimwear Summer Pregnancy No Ruffles Beachwear Suit YL5,CHINA Women Pregnant Women One Piece Swimsuit Female Floral Print Bikini Swimwear Summer Pregnancy No Ruffles Beachwear Suit YL5,76.0,EUR,76.0,EUR,91.0,0,,,5.0,0.0,,,,,,,,,,,multicolor,a[771],50,Livraison standard,12.0,false,,50,true,Quantité limitée !,KR,GPOPMALL,gpopmall,69 % avis positifs (16 notes),16,3.6875,600bc259338f835382ad78e9,,,https://www.wish.com/c/606dadbdacae2798bf846b7f,https://canary.contestimg.wish.com/api/webimage/606dadbdacae2798bf846b7f-medium.jpg,606dadbdacae2798bf846b7f
Women Summer Fashion Sexy Bikini Push-Up Pad Swimwear Set Two Piece Swimsuit Beachwear Bathing suit,Women Summer Fashion Sexy Bikini Push-Up Pad Swimwear Set Two Piece Swimsuit Beachwear Bathing suit,10.0,EUR,81.0,EUR,12,4,,,5.0,0.0,,,,,,,,,,,blackgrey,s,50,Livraison standard,3.0,false,,50,,,CN,northstars,northstars,"90 % avis positifs (24,875 notes)",24875,4.223638190954774,55ee44f6c48d9d426a5182c1,,,https://www.wish.com/c/607cf1c194b05716540def42,https://canary.contestimg.wish.com/api/webimage/607cf1c194b05716540def42-medium.jpg,607cf1c194b05716540def42
Femmes Bikini Set Maillot de bain Tankini Beachwear Détail Tribal Print Halter Neck Plus Size XS-5XL,Women Bikini Set Swimsuit Tankini Beachwear Detail Tribal Print Halter Neck Plus Size XS-5XL,4.77,EUR,10.0,EUR,5.78,7,,,5.0,0.0,,,,,,,,,,,yellow,xs,50,Livraison standard,2.0,false,,50,true,Quantité limitée !,CN,xiaoyu2019_88,xiaoyu2019_88,"88 % avis positifs (1,931 notes)",1931,4.153288451579493,5d4d60523db43e2c97bb4718,,,https://www.wish.com/c/5ed9edf5f463e93c10f6ced3,https://canary.contestimg.wish.com/api/webimage/5ed9edf5f463e93c10f6ced3-medium.jpg,5ed9edf5f463e93c10f6ced3
Sexy string effronté bas femmes maillots de bain brésilien Bikini soutien-gorge maillots de bain bain S M L XL,Sexy Thong Cheeky Bottom Women Beachwear Brazilian Bikini Bra Swimwear Bathing S M L XL,4.79,EUR,57.0,EUR,5.8100000000000005,10,,,3.2,10.0,3,1,2,3,1,,,,,,pink,s,50,Livraison standard,1.0,false,,50,,,US,Whatsmore,whatsmore,"89 % avis positifs (5,704 notes)",5704,4.217215988779803,5a0d04d53eb22a4737ff143a,,,https://www.wish.com/c/5aaa41b87ddb06226b29a6d7,https://canary.contestimg.wish.com/api/webimage/5aaa41b87ddb06226b29a6d7-medium.jpg,5aaa41b87ddb06226b29a6d7
New Brazilian High Waist Two Pieces Bikini Set Push Up Swimwear Female Women Beachwear Swimsuit Bather Bathing Suit,New Brazilian High Waist Two Pieces Bikini Set Push Up Swimwear Female Women Beachwear Swimsuit Bather Bathing Suit,12.0,EUR,12.0,EUR,14,10,,,5.0,0.0,,,,,,,,,,,black,xs,50,Livraison standard,3.0,false,,50,true,Quantité limitée !,CN,VCAN,vcan,"89 % avis positifs (19,411 notes)",19411,4.216578228839318,57b42e000bc8180a35ec0c89,,,https://www.wish.com/c/605900a8f01af472eadb7c85,https://canary.contestimg.wish.com/api/webimage/605900a8f01af472eadb7c85-medium.jpg,605900a8f01af472eadb7c85
CHINA Piece 2020 1 biquini bather купальник bikini swimwear beachwear cover_40088638,CHINA Piece 2020 1 biquini bather купальник bikini swimwear beachwear cover_40088638,69.0,EUR,69.0,EUR,83.0,0,,,5.0,0.0,,,,,,,,,,,multicolor,onecolor,50,Livraison standard,12.0,false,,50,true,Quantité limitée !,KR,GPOPMALL,gpopmall,69 % avis positifs (16 notes),16,3.6875,600bc259338f835382ad78e9,,,https://www.wish.com/c/606d78d87d28a4fbd0e374a3,https://canary.contestimg.wish.com/api/webimage/606d78d87d28a4fbd0e374a3-medium.jpg,606d78d87d28a4fbd0e374a3
Robe de couverture de bikini sexy en dentelle florale creuse pour les vêtements de plage à manches longues en perspective d'été,Sexy Hollow Floral Lace Bikini Cover Up Dress For Summer Perspective Long Sleeve Beachwear,15.0,EUR,57.0,EUR,18,10,,,5.0,0.0,,,,,,,,,,,white,onesize,50,Livraison standard,5.0,false,,50,,,CN,Shhssvv,shhssvv,"91 % avis positifs (11,986 notes)",11986,4.3280493909561155,580f3c8cbb227259f2b95e75,,,https://www.wish.com/c/5f58d6b0b907042004e613ff,https://canary.contestimg.wish.com/api/webimage/5f58d6b0b907042004e613ff-medium.jpg,5f58d6b0b907042004e613ff
Femmes S-exy Bikini Maillots De Bain Femme Maillot De Bain Noir Maillot de bain Vintage Weave Biquini Vente Chaude,Women S-exy Bikini Swimwear Female Swimsuit Black Bathing Suit Vintage Weave Biquini Hot Sale,3.04,EUR,13.0,EUR,3.69,5000,,,4.417667238421956,1166.0,774,228,88,29,47,,,,,,tan,xxs(outofstock),1,Livraison standard,1.0,false,,50,,,CN,New song,newsong,"88 % avis positifs (7,703 notes)",7703,4.174088017655459,58b16d4423ef7222d4bf6bf7,,,https://www.wish.com/c/58c7511b560e115298d85c31,https://canary.contestimg.wish.com/api/webimage/58c7511b560e115298d85c31-medium.jpg,58c7511b560e115298d85c31
Femmes deux pièces maillot de bain maillots de bain maillot de bain Tankini Bikini Monokini maillot de bain maillots de bain grande taille XS-8XL,Women Two Pieces Swimsuit Swimwear Bathing Suit Tankini Bikini Monokini Swimming Suit Beachwear Plus Size XS-8XL,3.0,EUR,3.0,EUR,3,10,,,4.0,9.0,5,1,2,0,1,,,,,,multicolor,sizexs,7,Livraison standard,1.0,false,,50,,,CN,Bright Eye Fashion TOP,brighteyefashiontop,"90 % avis positifs (8,305 notes)",8305,4.205538832028898,56f52b8027a7461dad277be2,,,https://www.wish.com/c/5e0c331a48636a8d49dcf2f0,https://canary.contestimg.wish.com/api/webimage/5e0c331a48636a8d49dcf2f0-medium.jpg,5e0c331a48636a8d49dcf2f0
Nouveau Vêtements de plage pour femmes Sexy Plissé Gradient Print Natation rembourrée Tankini monokini maillots de bain Set S-5XL,New Women Beachwear Sexy Pleated Gradient Print Padded Swim Tankini monokini swimwear  Set S-5XL,10.0,EUR,10.0,EUR,11,1000,,,4.14795008912656,561.0,286,151,68,33,23,,,,,,red,xs,50,Livraison standard,2.0,false,,50,,,CN,Honest Fashion shopping,honestfashionshopping,"(11,010 notes)",11010,4.237511353315168,570d017b1b4ca758e18e407d,,,https://www.wish.com/c/5af1152d08462b4c93edc767,https://canary.contestimg.wish.com/api/webimage/5af1152d08462b4c93edc767-medium.jpg,5af1152d08462b4c93edc767
Maillot de bain rembourré à la mode deux pièces pour femmes,Two Piece Women's Fashion Print Padded Swimsuit Swimwear Bathing Suit Backless Bikini Swimdress Tankini Set  Push Up Bikini Swimsuit Beachwear Plus Size XS-8XL,3.16,EUR,4.0,EUR,3.83,10,,,4.173913043478261,23.0,12,8,0,1,2,,,,,,red,xs,2,Livraison standard,1.0,false,,50,,,CN,tongxiaojuan110123,tongxiaojuan110123,79 % avis positifs (154 notes),154,3.883116883116883,5ddb88f3e4ce2300ce77f9ef,,,https://www.wish.com/c/5fe2f1dcff9a9b0aa8529770,https://canary.contestimg.wish.com/api/webimage/5fe2f1dcff9a9b0aa8529770-medium.jpg,5fe2f1dcff9a9b0aa8529770
Maillot de bain sexy sud-africain imprimé doré licou bikini taille haute deux pièces maillots de bain femmes maillot de bain bikini ensemble,Sexy Swimsuit South African Golden Print Halter Bikini High Waist Two Pieces Swimwear Women Bathing Suit Bikini Set,10.0,EUR,10.0,EUR,11,5000,,,4.131560531840448,2858.0,1652,535,294,149,228,,,,,,green,s,50,Livraison standard,2.0,false,,50,,,CN,Sweat moly,sweatmoly,"91 % avis positifs (71,690 notes)",71690,4.295801366996792,589ae185ad330a4feb2b6dd5,,,https://www.wish.com/c/599e9345064610593dba223e,https://canary.contestimg.wish.com/api/webimage/599e9345064610593dba223e-medium.jpg,599e9345064610593dba223e
Femmes drapeau américain impression bandage Bikini ensemble soutien-gorge push-up maillot de bain maillot de bain,Women American Flag Printing Bandage Bikini Set Push-up Bra Swimsuit Bathing Beachwear,10.0,EUR,19.0,EUR,11,10,,,3.6666666666666665,3.0,2,0,0,0,1,,,,,,,xxs,50,Livraison standard,2.0,false,,50,,,CN,chennayingmeihong,chennayingmeihong,89 % avis positifs (692 notes),692,4.151734104046243,59ece6a5ef7b893cad383005,,,https://www.wish.com/c/5b1e91d55220130191bb535c,https://canary.contestimg.wish.com/api/webimage/5b1e91d55220130191bb535c-medium.jpg,5b1e91d55220130191bb535c
Plus Size Lady Fashion Striped Bikini Women Maillot de bain deux pièces Summer Beachwear Maillot de bain,Plus Size Lady Fashion Striped Bikini Women Two-piece Swimsuit Summer Beachwear Swimming Suit,10.0,EUR,38.0,EUR,12,10,,,4.083333333333333,12.0,6,3,2,0,1,,,,,,yellow,s,19,Livraison standard,3.0,false,,50,,,CN,rtgh,rtgh710402e4b24511e6b69106d0c1a90220,"85 % avis positifs (49,396 notes)",49396,4.019778929467973,5836e38728f25753fe6af6a8,,,https://www.wish.com/c/5ec36ce70640de36c18580e3,https://canary.contestimg.wish.com/api/webimage/5ec36ce70640de36c18580e3-medium.jpg,5ec36ce70640de36c18580e3
Sexy Bikini 2021  Swimsuit Female Swimwear Women Bikini Set Bather Swimming Beachwear for Bathing Suit купальники женские,Sexy Bikini 2021  Swimsuit Female Swimwear Women Bikini Set Bather Swimming Beachwear for Bathing Suit купальники женские,15.0,EUR,15.0,EUR,18,0,,,5.0,0.0,,,,,,,,,,,multi,"m,poland",50,Livraison standard,5.0,false,,50,,,CA,11368796 CANADA CORPORATION,11368796canadacorporation,"80 % avis positifs (1,166 notes)",1166,3.9382504288164664,5ffb1f43fa8a25c707537989,,,https://www.wish.com/c/601553baaef6b8821700f51e,https://canary.contestimg.wish.com/api/webimage/601553baaef6b8821700f51e-medium.jpg,601553baaef6b8821700f51e
Sexy léopard Patchwork maillots de bain femmes mode deux pièces ensemble maillot de bain maillot de bain maillot de bain Tankinis col en v Bikini,Sexy Leopard Patchwork Swimwear Women Fashion Two Piece Set Swimsuit Bathing Suit Beachwear Tankinis V-Neck Bikini,8.0,EUR,9.0,EUR,9,10,,,4.375,8.0,6,1,0,0,1,,,,,,black,xl,50,Livraison standard,3.0,false,,50,,,CN,LLpp,llpp,"85 % avis positifs (3,725 notes)",3725,4.021744966442953,5d5f4780bd01a83fca39e0db,,,https://www.wish.com/c/5f04162812c20403dd32adcd,https://canary.contestimg.wish.com/api/webimage/5f04162812c20403dd32adcd-medium.jpg,5f04162812c20403dd32adcd
Maillot de bain deux pièces femme Bikini Cut Flower Pushups Maillots de bain Beachwear,Women's Bikini Cut Flower Two Piece Swimsuit Pushups Swimwear Beachwear,10.0,EUR,83.0,EUR,11,10,,,4.310344827586207,29.0,19,3,5,1,1,,,,,,orange,s,20,Livraison standard,3.0,false,,50,,,CN,Crystalhousee,crystalhousee,"90 % avis positifs (15,066 notes)",15066,4.237488384441789,59802a908ee78d7ec44d192a,,,https://www.wish.com/c/5ceb892ba24a0f04545c69cd,https://canary.contestimg.wish.com/api/webimage/5ceb892ba24a0f04545c69cd-medium.jpg,5ceb892ba24a0f04545c69cd
Maillot de bain imprimé femme maillot de bain maillot de bain deux pièces maillots de bain Bikini Tankini grande taille XS-8XL,Womens Printed Swimwear Swimsuit Bathing Suit Two Pieces Beachwear Bikini Tankini Plus Size XS-8XL,10.0,EUR,10.0,EUR,12,10,,,4.285714285714286,7.0,3,3,1,0,0,,,,,,blue,xs,50,Livraison standard,3.0,false,,50,,,CN,Bees flying butterfly,beesflyingbutterfly,"91 % avis positifs (6,285 notes)",6285,4.305489260143198,5826f19f20a9402c37313979,,,https://www.wish.com/c/5f7d53e0363f51087247fba6,https://canary.contestimg.wish.com/api/webimage/5f7d53e0363f51087247fba6-medium.jpg,5f7d53e0363f51087247fba6
Été Nouvelles Femmes Tankini Maillot De Bain Maillot De Bain Beachwear Maillot De Bain Maillots De Bain Plus La Taille De Mode Dot Imprimer Maillot De Bain,Summer New Women Tankini Swimsuit Swimdress Beachwear Bathing Suit Swimwear Plus Size Fashion Dot Print Swimsuit,10.0,EUR,21.0,EUR,11,10,,,3.5405405405405403,37.0,15,6,6,4,6,,,,,,purple,m,11,Livraison standard,3.0,false,,50,,,CN,lgswan,lgswan,"86 % avis positifs (6,575 notes)",6575,4.0577946768060835,594c9c0bff3e804e98973457,,,https://www.wish.com/c/5cb530011cf0707400d5cc27,https://canary.contestimg.wish.com/api/webimage/5cb530011cf0707400d5cc27-medium.jpg,5cb530011cf0707400d5cc27
Mode d'été Beachwear Sexy Bandage Maillot de bain une pièce Collants une épaule,Summer Fashion Beachwear Sexy Bandage One-piece Swimsuit One-shoulder Tights,7.0,EUR,7.0,EUR,8,10,,,3.4444444444444446,27.0,13,2,2,4,6,,,,,,white,xs,50,Livraison Express,8.0,true,,50,,,CN,Fancy_Everyday,fancy_days,"88 % avis positifs (16,011 notes)",16011,4.132783711198551,5a4b00966ecee00d0c46937d,,,https://www.wish.com/c/5c231f614449d664d6f9acd4,https://canary.contestimg.wish.com/api/webimage/5c231f614449d664d6f9acd4-medium.jpg,5c231f614449d664d6f9acd4
Femme Dentelle Crochet Bikini Maillot de bain d'été Cover Up Sarong Kaftan Beach Dress fzw2017-ZFN,Women Lace Crochet Bikini Cover Up Summer Beachwear Sarong Kaftan Beach Dress fzw2017-ZFN,12.0,EUR,24.0,EUR,14,10000,,,4.043940795559667,2162.0,1112,466,303,129,152,,,,,,white,,50,Livraison standard,3.0,false,,50,,,CN,choicet,choicet,"92 % avis positifs (3,906 notes)",3906,4.286482334869432,5848401bc08740089fba194d,,,https://www.wish.com/c/58fec767929cc11a0b2c2d6b,https://canary.contestimg.wish.com/api/webimage/58fec767929cc11a0b2c2d6b-medium.jpg,58fec767929cc11a0b2c2d6b
