title,title_orig,discount_price,discount_price_currency,retail_price,retail_price_currency,discount_price_in_original_currency,nb_cart_orders_approx,nb_units_purchased_approx,uses_ad_boosts,rating,rating_count,rating_five_count,rating_four_count,rating_three_count,rating_two_count,rating_one_count,badges_count,badge_local_product,badge_product_quality,badge_fast_shipping,tags,product_color,product_variation_size_id,product_variation_inventory,shipping_option_name,shipping_option_price,shipping_is_express,countries_shipped_to,inventory_total,has_urgency_banner,urgency_text,origin_country,merchant_title,merchant_name,merchant_info_subtitle,merchant_rating_count,merchant_rating,merchant_id,merchant_has_profile_picture,merchant_profile_picture,product_url,product_picture,product_id
2021 Sexy couleur Bikini femmes maillots de bain Bandeau Biquini maillot de bain femme maillot de bain Push Up Bikini ensemble maillots de bain купальники,2021 Sexy Color Bikini Women Swimwear Bandeau Biquini Swimsuit Female Bathing Suit Push Up Bikini Set Beachwear купальники,16.0,EUR,16.0,EUR,19,0,,,5.0,0.0,,,,,,,,,,,multi,"s,poland",50,Livraison standard,5.0,false,,50,,,CA,11368796 CANADA CORPORATION,11368796canadacorporation,"80 % avis positifs (1,166 notes)",1166,3.9382504288164664,5ffb1f43fa8a25c707537989,,,https://www.wish.com/c/601c47d4b1a558d1e0485510,https://canary.contestimg.wish.com/api/webimage/601c47d4b1a558d1e0485510-medium.jpg,601c47d4b1a558d1e0485510
Femmes Mode Deux Pièces Tankini Maillots De Bain Col V Halter Maillots De Bain Dos Nu Beachwear Maillot De Bain et Shorts Maillots De Bain Décontractés Plus La Taille S-8XL,Women Fashion Two Pieces Tankini Swimwear V-neck Halter Bathing Suits Backless Beachwear Swimdress and Shorts Casual Swimsuits Plus Size S-8XL,6.0,EUR,6.0,EUR,7,10,,,3.1818181818181817,11.0,3,3,1,1,3,,,,,,green,sizexxs,2,Livraison standard,2.0,false,,50,true,Quantité limitée !,CN,ruierhuashhai,ruierhuashhai,"83 % avis positifs (1,866 notes)",1866,3.9442658092175775,5957e4679579d819c0d2547a,,,https://www.wish.com/c/5e5348d0f39535ab61128496,https://canary.contestimg.wish.com/api/webimage/5e5348d0f39535ab61128496-medium.jpg,5e5348d0f39535ab61128496
Maillot de bain une pièce Femme Ananas Imprimé Épaule Maillot de bain Maillot de bain Monokini Tankini Maillot de bain Monokini Taille Plus XS-8XL,Women One Piece Swimsuit Pineapple Printed Off Shoulder Bathing Suit Beachwear Monokini Tankini Bathing Suit Plus Size XS-8XL,10.0,EUR,10.0,EUR,11,1000,,,4.457081545064377,466.0,317,92,28,11,18,,,,,,pine&black,xs,50,Livraison standard,2.0,false,,50,,,CN,Facing the sea,facingthesea,"89 % avis positifs (19,938 notes)",19938,4.1657137125087775,5760bd976238335e38551943,,,https://www.wish.com/c/5c401522c86a9109231b21e6,https://canary.contestimg.wish.com/api/webimage/5c401522c86a9109231b21e6-medium.jpg,5c401522c86a9109231b21e6
Femmes grande taille rayé Tankini maillot de bain maillot de bain Beachwear maillots de bain rembourrés S-5XL,Women Plus Size Striped Tankini Swimjupmsuit Swimsuit Beachwear Padded Swimwear S-5XL,11.0,EUR,132.0,EUR,13,10,,,5.0,1.0,1,0,0,0,0,,,,,,black,s,50,Livraison standard,3.0,false,,50,true,Quantité limitée !,CN,aihualaonian,aihualaonian,85 % avis positifs (334 notes),334,4.07185628742515,5b00d2cc9a338512336d3da6,,,https://www.wish.com/c/5ce20c825ea312408c67a7fe,https://canary.contestimg.wish.com/api/webimage/5ce20c825ea312408c67a7fe-medium.jpg,5ce20c825ea312408c67a7fe
2020 mode féminine léopard Bikini Tube haut maillot de bain fendu maillot de bain vêtements de plage,2020 Women's Fashion Leopard Bikini Tube Top Split Swimsuit Swimming Suit Beachwear,8.0,EUR,8.0,EUR,9,10,,,4.75,4.0,3,1,0,0,0,,,,,,coolblack,xxs,1,Livraison standard,3.0,false,,50,true,Quantité limitée !,VE,Markecap,markecap,89 % avis positifs (74 notes),74,4.256756756756757,5de2ea1129e7862d6edd6b9a,,,https://www.wish.com/c/5e06c49eb911c203b240c621,https://canary.contestimg.wish.com/api/webimage/5e06c49eb911c203b240c621-medium.jpg,5e06c49eb911c203b240c621
6 couleurs été femmes sexy bikini ensemble mode feuille imprimé deux pièces split maillot de bain beachwear,6 Colors Summer Women Sexy Bikini Set Fashion Leaf Printed Two Piece Split Bathing Suit Beachwear,4.73,EUR,5.0,EUR,5.73,1000,,,4.01,200.0,112,33,24,7,24,,,,,,pink,xs,1,Livraison standard,1.0,false,,50,,,CN,Qulo,qulo,"84 % avis positifs (2,342 notes)",2342,3.976088812980359,5947bed57fe2417e7057da6f,,,https://www.wish.com/c/5e1ed2b5e7ceea0f1210a068,https://canary.contestimg.wish.com/api/webimage/5e1ed2b5e7ceea0f1210a068-medium.jpg,5e1ed2b5e7ceea0f1210a068
Maillots de bain pour femmes New Black Sexy Gauze Backless Elastic Beachwear,Women Swimwear New Black Sexy Gauze Backless Elastic  Beachwear,11.0,EUR,25.0,EUR,13,1000,,,4.2733739837398375,984.0,590,206,99,45,44,,,,,,,s,20,Livraison standard,3.0,false,,50,,,CN,Pretty Spot,prettyspot,"91 % avis positifs (29,723 notes)",29723,4.281532819701915,5600ed46293a5b0145a3e1af,,,https://www.wish.com/c/58f48a5bdc138b11b549bdce,https://canary.contestimg.wish.com/api/webimage/58f48a5bdc138b11b549bdce-medium.jpg,58f48a5bdc138b11b549bdce
Hot 2019 maillot de bain en coton pour plage vêtements de plage Mini robe femmes maillot de bain couvertures femme maillots de bain plage couvrir,Hot 2019 Cotton swimsuit for Beach Beachwear Mini Dress Women Swimsuit Cover-ups Woman Swimwear Beach Cover up,10.0,EUR,71.0,EUR,12,10,,,4.0,11.0,6,2,1,1,1,,,,,,black,,50,Livraison standard,3.0,false,,50,true,Quantité limitée !,CN,"Shenzhen Winone Technology Co., Ltd",shenzhenwinonetechnologycoltd,(566 notes),566,4.104240282685512,54d877ea7851092831ee8303,,,https://www.wish.com/c/5e024c4ab69b2e0028520c02,https://canary.contestimg.wish.com/api/webimage/5e024c4ab69b2e0028520c02-medium.jpg,5e024c4ab69b2e0028520c02
2021 femmes mode imprimé Bikini deux pièces licou ourlet maillot de bain maillots de bain maillot de bain Bikini,2021 Women's Fashion Print Bikini Two Piece Halter Hem Swimdress Beachwear Swimsuit Bikini,5.0,EUR,5.0,EUR,6,10,,,3.7,10.0,4,3,0,2,1,,,,,,black,5xl.,1,Livraison standard,2.0,false,,50,true,Quantité limitée !,US,objecucfy,objecucfy,79 % avis positifs (73 notes),73,3.7945205479452055,5e63600598286555b88477d3,,,https://www.wish.com/c/60179b7ead3acee2e34ee998,https://canary.contestimg.wish.com/api/webimage/60179b7ead3acee2e34ee998-medium.jpg,60179b7ead3acee2e34ee998
Maillot de bain femme maillot de bain maillot de bain Tankini Bikini Monokini maillot de bain maillot de bain grande taille,Women Swimsuit Swimwear Bathing Suit Tankini Bikini Monokini Swimming Suit Beachwear Plus Size,3.95,EUR,4.0,EUR,4.79,1000,,,3.700906344410876,331.0,145,64,47,28,47,,,,,,rose&black,xxs,2,Livraison standard,1.0,false,,50,,,CN,jingman,jingman,"77 % avis positifs (1,580 notes)",1580,3.7272151898734176,58bd6d5d9eed0a5ba364d256,,,https://www.wish.com/c/5e38f88f87e96b0480736e45,https://canary.contestimg.wish.com/api/webimage/5e38f88f87e96b0480736e45-medium.jpg,5e38f88f87e96b0480736e45
Maillot de bain femme Maillots de bain Maillot de bain Bikini Tankini Beachwear Plus Size,Women's Swimsuit Swimwear Bathing Suit Bikini Tankini Beachwear Plus Size,5.0,EUR,7.0,EUR,6,10,,,4.25,16.0,8,4,4,0,0,,,,,,red,xs,50,Livraison standard,2.0,false,,50,,,CN,xiaoweishuaishuai,xiaoweishuaishuai,89 % avis positifs (335 notes),335,4.155223880597015,5d622bd03d24b76a3c9d3bea,,,https://www.wish.com/c/5d6a397d9456933d9d6d365d,https://canary.contestimg.wish.com/api/webimage/5d6a397d9456933d9d6d365d-medium.jpg,5d6a397d9456933d9d6d365d
Femmes Kaftan Maxi Dress Kaftan Antoinette Robe sans manches en marine Courte Sans Manches Summer Party Beachwear Caftan Looseware Dressses Casual Boho Nouvelles Dames Kimono Tunique Tops Vacances,Womens Kaftan Maxi Dress Kaftan Antoinette sleeveless dress in marine Short Sleeveless Summer Party Beachwear Caftan Looseware Dressses Casual Boho New Ladies Kimono Tunic Tops Holidays,33.0,EUR,33.0,EUR,39.99,0,,,5.0,0.0,,,,,,,,,,,marine,l,1,Livraison standard,10.0,false,,1,,,GB,Diamantine,diamantine,100 % avis positifs (1 notes),1,4.0,5d987cea48ea3c02fce8ba4e,,,https://www.wish.com/c/5daae86ed786b51d3cbd0d5a,https://canary.contestimg.wish.com/api/webimage/5daae86ed786b51d3cbd0d5a-medium.jpg,5daae86ed786b51d3cbd0d5a
Dolce & Gabbana Maillot De Bain Femme Floral Bas Bikini Beachwear Blanc BIK1022,Dolce & Gabbana Women's Floral Swimsuit Bottom Bikini Beachwear White BIK1022,114.0,EUR,114.0,EUR,138.04,0,,,5.0,0.0,,,,,,,,,,,,it1|xs,1,Livraison standard,14.94,false,,1,,,GB,Top Labels Online,toplabelsonline,100 % avis positifs (3 notes),3,5.0,5faa798c6b5102a926e06a8d,,,https://www.wish.com/c/5fadbbef4b099f005767b62e,https://canary.contestimg.wish.com/api/webimage/5fadbbef4b099f005767b62e-medium.jpg,5fadbbef4b099f005767b62e
Nouvelles femmes Sling V-Neck Dress Long Beachwear Cocktail Party Dress Robes sans manches,New Women Sling V-neck Dress Long Beachwear Cocktail Party Dress Sleeveless Dresses,4.82,EUR,85.0,EUR,5.84,10,,,3.8372093023255816,43.0,23,7,3,3,7,,,,,,white,xs,1,Livraison standard,1.0,false,,50,,,CN,aiqianxiege,aiqianxiege,"92 % avis positifs (14,790 notes)",14790,4.339080459770115,5b41be818e210d22facca0bd,,,https://www.wish.com/c/5def4c3919126f04737b373b,https://canary.contestimg.wish.com/api/webimage/5def4c3919126f04737b373b-medium.jpg,5def4c3919126f04737b373b
Ensemble de bikini de mode pour femmes Maillot de bain d'été Maillot de bain décontracté Plus la taille,Women's Fashion Bikini Set Summer Beachwear Bathing Suit Casual Swimsuit Plus Size,10.0,EUR,10.0,EUR,11,1000,,,3.945075757575758,528.0,271,102,64,37,54,,,,,,blue,s,50,Livraison standard,2.0,false,,50,,,CN,Rell Mail,rellmail,"88 % avis positifs (18,794 notes)",18794,4.141055656060445,56455b13b15aab129db58cb7,,,https://www.wish.com/c/5c528bd46cf9961be9e9e5c3,https://canary.contestimg.wish.com/api/webimage/5c528bd46cf9961be9e9e5c3-medium.jpg,5c528bd46cf9961be9e9e5c3
Ever-Pretty,,,,,,,,,,,,,,,,,,,,,,,,,,,,,,,,,,,,,,,,,https://www.wish.com/c/5f1abf72eb31f966cc288dc8,,5f1abf72eb31f966cc288dc8
Femmes Deux Pièces Tankini Ensemble Maillot De Bain Maillot De Bain Maillots De Bain Monokini Bikini Beachwear Plus La Taille XS-8XL,Womens Two Pieces Tankini Set Swimsuit Swimming Suit Swimwear Monokini Bikini Beachwear Plus Size XS-8XL,7.0,EUR,7.0,EUR,8,10,,,4.5,40.0,26,10,3,0,1,,,,,,purple,sizexs,50,Livraison standard,2.0,false,,50,,,CN,Superman Fashion Store,supermanfashionstore,"90 % avis positifs (1,321 notes)",1321,4.226343679031037,570cfe55a18a3f4630d18c02,,,https://www.wish.com/c/5df71ecfdc959e0224e1b651,https://canary.contestimg.wish.com/api/webimage/5df71ecfdc959e0224e1b651-medium.jpg,5df71ecfdc959e0224e1b651
Été Plus La Taille Femmes Sexy Sling V-cou Robe Longue Beachwear Spaghetti Strap Robe d'été Maxi Cocktail Party Dress,Summer Plus Size Women Sexy Sling V-neck Dress Long Beachwear Spaghetti Strap Sundress Maxi Cocktail Party Dress,12.0,EUR,18.0,EUR,14,5000,,,3.8456189151599443,1438.0,643,322,222,110,141,,,,,,white,xs,50,Livraison standard,3.0,false,,50,,,CN,FashionForChanny ,guangzhouchannytradecoltd,"90 % avis positifs (168,178 notes)",168178,4.254730107386222,53a2a09ad91139519161a267,,,https://www.wish.com/c/5799bcd5fab791781413fb8a,https://canary.contestimg.wish.com/api/webimage/5799bcd5fab791781413fb8a-medium.jpg,5799bcd5fab791781413fb8a
Hirigin Women Beachwear Swimwear Bikini Cover Up Beach Wear Chiffon Cardigan Ladies Summer Long Dress Bathing Suit,Hirigin Women Beachwear Swimwear Bikini Cover Up Beach Wear Chiffon Cardigan Ladies Summer Long Dress Bathing Suit,21.0,EUR,21.0,EUR,25.0,0,,,5.0,0.0,,,,,,,,,,,red,onesize,50,Livraison standard,0.0,false,,50,true,Quantité limitée !,CA,Loom,loom,81 % avis positifs (403 notes),403,4.054590570719603,60108516d38ac0468d48a860,,,https://www.wish.com/c/601597bb73750b2689381d04,https://canary.contestimg.wish.com/api/webimage/601597bb73750b2689381d04-medium.jpg,601597bb73750b2689381d04
Women Floral Print Bikini Set Swimming Two Piece Swimsuits Swimwear Beach  Bathing Suit  Beachwear maillot de bain femme#40,Women Floral Print Bikini Set Swimming Two Piece Swimsuits Swimwear Beach  Bathing Suit  Beachwear maillot de bain femme#40,15.0,EUR,15.0,EUR,18,3,,,5.0,0.0,,,,,,,,,,,yellow,m,50,Livraison standard,11.0,false,,50,,,CA,11368796 CANADA CORPORATION,11368796canadacorporation,"80 % avis positifs (1,166 notes)",1166,3.9382504288164664,5ffb1f43fa8a25c707537989,,,https://www.wish.com/c/60154f36f7e1d92c3359313b,https://canary.contestimg.wish.com/api/webimage/60154f36f7e1d92c3359313b-medium.jpg,60154f36f7e1d92c3359313b
Maillots de bain musulmans modestes tout noir Burkinis Islam maillot de bain Bikini couverture complète Hijab maillots de bain maillots de bain grande taille 3 pièces,Modest Muslim Swimwear All Black Burkinis Islam Swimsuit Bikini Full Coverage Hijab Beachwear Swimwear Plus Size 3PCS,50.0,EUR,50.0,EUR,60.0,0,,,5.0,0.0,,,,,,,,,,,navyblue,s,50,Livraison standard,0.0,false,,50,,,CA,Loom,loom,81 % avis positifs (403 notes),403,4.054590570719603,60108516d38ac0468d48a860,,,https://www.wish.com/c/601587ee5532160055e96cdf,https://canary.contestimg.wish.com/api/webimage/601587ee5532160055e96cdf-medium.jpg,601587ee5532160055e96cdf
XS-5XL femmes maillot de bain d'été maillots de bain maillot de bain imprimé Bikini Beachwear grande taille,XS-5XL Women Summer Swimsuit Swimwear Bathing Suit Printed Bikini Beachwear Plus Size ,10.0,EUR,42.0,EUR,11,10,,,3.75,16.0,6,3,5,1,1,,,,,,blue,xs,1,Livraison standard,2.0,false,,50,true,Quantité limitée !,CN,"Women wardrobe Apparel Trade Co., Ltd.",womenwardrobeappareltradecoltd,"91 % avis positifs (21,794 notes)",21794,4.254611360925026,551c02310570552bbd036dbb,,,https://www.wish.com/c/5e6c53d37b67a214828b7629,https://canary.contestimg.wish.com/api/webimage/5e6c53d37b67a214828b7629-medium.jpg,5e6c53d37b67a214828b7629
Nouvelle mode femmes été décontracté fête robe de plage Beachwear Bikini Cover-Up,New Fashion Women Summer Casual Party Beach Dress Beachwear Bikini Cover-Up,13.0,EUR,15.0,EUR,15,9,,,5.0,0.0,,,,,,,,,,,white,s,50,Livraison standard,4.0,false,,50,,,CN,666xx666,666xx666,"87 % avis positifs (1,159 notes)",1159,4.016393442622951,581c327c9c719141803ea30a,,,https://www.wish.com/c/5f0d5cca95eb7f3640492741,https://canary.contestimg.wish.com/api/webimage/5f0d5cca95eb7f3640492741-medium.jpg,5f0d5cca95eb7f3640492741
Colorful Crochet Skirt Women Summer Beach Bikini Swim Bathing Suit Cover Up Beachwear,Colorful Crochet Skirt Women Summer Beach Bikini Swim Bathing Suit Cover Up Beachwear,28.0,EUR,28.0,EUR,33,1,,,5.0,0.0,,,,,,,,,,,red,onesize,50,Livraison standard,9.0,false,,50,,,CA,11368796 CANADA CORPORATION,11368796canadacorporation,"80 % avis positifs (1,166 notes)",1166,3.9382504288164664,5ffb1f43fa8a25c707537989,,,https://www.wish.com/c/601559881a8ed0b9dadd2b53,https://canary.contestimg.wish.com/api/webimage/601559881a8ed0b9dadd2b53-medium.jpg,601559881a8ed0b9dadd2b53
Flying Tomato,,,,,,,,,,,,,,,,,,,,,,,,,,,,,,,,,,,,,,,,,https://www.wish.com/c/5e8d2fd29719ed640496769e,,5e8d2fd29719ed640496769e
Sexy Femmes Bikini Set Bandage Push Up Maillot De Bain Rembourré Maillot De Bain Maillot De Bain Beachwear,Sexy Women Bikini Set Bandage Push Up Padded Swimwear Swimsuit Bathing Beachwear,5.0,EUR,5.0,EUR,6,10,,,3.5,2.0,0,1,1,0,0,,,,,,black,s1,5,Livraison standard,2.0,false,,50,,,US,MishulaofUv,mishulaofuv,"(1,024 notes)",1024,4.1962890625,5e6b89a13c17f48980bade22,,,https://www.wish.com/c/6042f85c6fa86086e12ff79d,https://canary.contestimg.wish.com/api/webimage/6042f85c6fa86086e12ff79d-medium.jpg,6042f85c6fa86086e12ff79d
Femmes deux pièces imprimé tankini maillot de bain maillots de bain maillot de bain maillot de bain et shorts grande taille maillots de bain,Women Two Piece Printed Tankini Swimsuit Swimwear Bathing Suit Swimdress and Shorts Plus Size Beachwear,6.0,EUR,47.0,EUR,7,10,,,3.769230769230769,65.0,25,18,11,4,7,,,,,,blue,xs,50,Livraison standard,2.0,false,,50,,,CN,green grass and trees,greengrassandtrees,"92 % avis positifs (11,883 notes)",11883,4.318185643356055,5844db310d44637f504acf91,,,https://www.wish.com/c/5d09af0850ffa55545b27f42,https://canary.contestimg.wish.com/api/webimage/5d09af0850ffa55545b27f42-medium.jpg,5d09af0850ffa55545b27f42
2021 taille haute Bikinis maillots de bain femmes Push Up maillots de bain maillot de bain Biquini Bikini brésilien nouveau beachwear купальник женский,2021 High Waist Bikinis Swimsuits Women Push Up Swimwear Bathing Suit Biquini Brazilian Bikini  New Beachwear купальник женский,16.0,EUR,16.0,EUR,19,0,,,5.0,0.0,,,,,,,,,,,blue,"s,poland",50,Livraison standard,12.0,false,,50,true,Quantité limitée !,CA,11368796 CANADA CORPORATION,11368796canadacorporation,"80 % avis positifs (1,166 notes)",1166,3.9382504288164664,5ffb1f43fa8a25c707537989,,,https://www.wish.com/c/600d811130a04bdf3a0d1a1e,https://canary.contestimg.wish.com/api/webimage/600d811130a04bdf3a0d1a1e-medium.jpg,600d811130a04bdf3a0d1a1e
CHINA Women's Sexy One Piece Patchwork Jack Bikini Swimwear Bathing Suit Beachwear,CHINA Women's Sexy One Piece Patchwork Jack Bikini Swimwear Bathing Suit Beachwear,58.0,EUR,58.0,EUR,70.0,0,,,5.0,0.0,,,,,,,,,,,multicolor,red[10],50,Livraison standard,12.0,false,,50,true,Quantité limitée !,KR,GPOPMALL,gpopmall,69 % avis positifs (16 notes),16,3.6875,600bc259338f835382ad78e9,,,https://www.wish.com/c/606d9003983666232779d4e3,https://canary.contestimg.wish.com/api/webimage/606d9003983666232779d4e3-medium.jpg,606d9003983666232779d4e3
4 couleurs mode femmes push up bikini ensemble sexy couleur unie été maillot de bain chaud maillot de bain casual beachwear soutien-gorge + bas de bikini,4 Colors Fashion Women Push Up Bikini Set Sexy Solid Color Summer Hot Bathing Suit Swimsuit Casual Beachwear Bra + Bikini Bottom,7.0,EUR,7.0,EUR,8,10,,,3.8875,80.0,39,17,9,6,9,,,,,,grey,s,50,Livraison standard,2.0,false,,50,true,Quantité limitée !,CN,Super Daily Deals,superdailydeals,"87 % avis positifs (40,708 notes)",40708,4.12732141102486,57297d26e4cdb8596082329c,,,https://www.wish.com/c/5d2edfb47006210cbcc71d55,https://canary.contestimg.wish.com/api/webimage/5d2edfb47006210cbcc71d55-medium.jpg,5d2edfb47006210cbcc71d55
Femmes asymétrique ourlet imprimé cravate avant maillot de bain haut de bain maillot de bain deux pièces Bikini Beachwear grande taille XS-8XL,Womens Asymmetric Hem Printed Tie Front Swimwear Top Swimsuit Bathing Suit Two Pieces Bikini Beachwear Plus Size XS-8XL,10.0,EUR,10.0,EUR,12,10,,,4.454545454545454,11.0,7,3,0,1,0,,,,,,green,xs,50,Livraison standard,3.0,false,,50,,,CN,Jingka,jingka,"91 % avis positifs (4,730 notes)",4730,4.249471458773784,5ac0310597223354603de223,,,https://www.wish.com/c/5f6e9b01b6e6b909270ff210,https://canary.contestimg.wish.com/api/webimage/5f6e9b01b6e6b909270ff210-medium.jpg,5f6e9b01b6e6b909270ff210
Femmes enceintes One Piece Maternité Bikini Été Solide Volants Maillots De Bain Sexy Tankinis Maillot De Bain Maillot De Bain Grossesse Beachwear,Pregnant Women One Piece Maternity Bikini Summer Solid Ruffles Swimwear Sexy Tankinis Swimsuit Bathing Suit Pregnancy Beachwear,13.0,EUR,13.0,EUR,15,4,,,5.0,1.0,1,0,0,0,0,,,,,,pink,s,5,Livraison standard,4.0,false,,50,,,CN,tianlan,tianlan,"90 % avis positifs (2,965 notes)",2965,4.274198988195615,5b2b6096c6025e03acaa4dbb,,,https://www.wish.com/c/5e01ff67a66c6b00db62ca32,https://canary.contestimg.wish.com/api/webimage/5e01ff67a66c6b00db62ca32-medium.jpg,5e01ff67a66c6b00db62ca32
New Summer Women Bikini Set Imprimer Maillots de bain rembourrés Maillot de bain Beachwear,New Summer  Women Bikini Set Print Padded Swimwear Bathing Swimsuit Beachwear,10.0,EUR,91.0,EUR,12,3,,,5.0,1.0,1,0,0,0,0,,,,,,black,s,10,Livraison standard,3.0,false,,50,true,Quantité limitée !,CN,wonderfulwords,wonderfulwords,"81 % avis positifs (1,421 notes)",1421,3.8789584799437016,59a69cd1eea5c56bc77c7f57,,,https://www.wish.com/c/5e736309f56f79a07b3bc365,https://canary.contestimg.wish.com/api/webimage/5e736309f56f79a07b3bc365-medium.jpg,5e736309f56f79a07b3bc365
Sexy Bikini 2021  Swimsuit Female Swimwear Women Bikini Set Bather Swimming Beachwear for Bathing Suit купальники женские,Sexy Bikini 2021  Swimsuit Female Swimwear Women Bikini Set Bather Swimming Beachwear for Bathing Suit купальники женские,17.0,EUR,17.0,EUR,20,0,,,5.0,0.0,,,,,,,,,,,black,"s,poland",50,Livraison standard,12.0,false,,50,,,CA,11368796 CANADA CORPORATION,11368796canadacorporation,"80 % avis positifs (1,166 notes)",1166,3.9382504288164664,5ffb1f43fa8a25c707537989,,,https://www.wish.com/c/60154e5ef2da9e7dfa3a8ff0,https://canary.contestimg.wish.com/api/webimage/60154e5ef2da9e7dfa3a8ff0-medium.jpg,60154e5ef2da9e7dfa3a8ff0
Sexy Femmes Bikini Ensemble Bandage Push Up Maillot De Bain Rembourré Maillot De Bain Bain D'été Beachwear,Sexy Women Bikini Set Bandage Push Up Padded Swimwear Swimsuit Bathing Summer Beachwear,8.0,EUR,8.0,EUR,9,10,,,4.235294117647059,17.0,10,4,1,1,1,,,,,,white,s,50,Livraison Express,7.0,true,,50,,,CN,betterlife2014,betterlife2014,"(221,758 notes)",221758,4.160909640238458,557a74d8baa01a2b54e43ae7,,,https://www.wish.com/c/5d073d8cf945bd571254c4d1,https://canary.contestimg.wish.com/api/webimage/5d073d8cf945bd571254c4d1-medium.jpg,5d073d8cf945bd571254c4d1
CHINA 2020 Men Sexy Imitation Leather Briefs Swimwear Men Swimwear Beachwear Swimming Trunks Underwear Swim Shorts Traje de Baño,CHINA 2020 Men Sexy Imitation Leather Briefs Swimwear Men Swimwear Beachwear Swimming Trunks Underwear Swim Shorts Traje de Baño,66.0,EUR,66.0,EUR,79.0,0,,,5.0,0.0,,,,,,,,,,,multicolor,gold[350850],50,Livraison standard,12.0,false,,50,true,Quantité limitée !,KR,GPOPMALL,gpopmall,69 % avis positifs (16 notes),16,3.6875,600bc259338f835382ad78e9,,,https://www.wish.com/c/606d9e8551ee2906e9c90937,https://canary.contestimg.wish.com/api/webimage/606d9e8551ee2906e9c90937-medium.jpg,606d9e8551ee2906e9c90937
2019 Femmes Mode Été Plage Sous-Vêtements Casual Bikini Sexy Maillots De Bain Bas Évider Bandage Bikini Sexy Slip Beachwear Briefs,2019 Women Fashion Summer Beach Underwear Casual Bikini Sexy Swimwear Bottom Hollow Out Bandage Bikini Sexy Underpants Beachwear Briefs,4.72,EUR,5.0,EUR,5.72,1000,,,4.514150943396227,212.0,141,47,18,4,2,,,,,,black,s,50,Livraison standard,2.0,false,,50,,,CN,hjlln110809,hjlln110809,"84 % avis positifs (1,145 notes)",1145,3.963318777292576,5acaca45b9605f6d1f129145,,,https://www.wish.com/c/5c9c2f2665cb013da0bd806d,https://canary.contestimg.wish.com/api/webimage/5c9c2f2665cb013da0bd806d-medium.jpg,5c9c2f2665cb013da0bd806d
2021 nouveaux hommes mode cordon rayé imprimé Slim Fit maillot de bain maillot de bain maillots de bain Shorts grande taille S-5XL,2021 New Men's Fashion Drawstring Striped Print Slim Fit Swim Trunk Swimsuit Beachwear Shorts Plus Size S-5XL,7.0,EUR,7.0,EUR,8,10,,,3.1578947368421053,19.0,5,3,6,0,5,,,,,,red,s,50,Livraison standard,2.0,false,,50,,,CN,liushiqiangw222288888888,liushiqiangw222288888888,"85 % avis positifs (7,622 notes)",7622,4.0188926790868535,5b8e19ad9058ed22fdc30621,,,https://www.wish.com/c/5fdc648bb84f88256294f8e2,https://canary.contestimg.wish.com/api/webimage/5fdc648bb84f88256294f8e2-medium.jpg,5fdc648bb84f88256294f8e2
Betty Boop,,,,,,,,,,,,,,,,,,,,,,,,,,,,,,,,,,,,,,,,,https://www.wish.com/c/5e8d2fd89719ed64049676c3,,5e8d2fd89719ed64049676c3
Mode féminine Sexy Bandage Maillots de bain Push Up Bikini 2019 Cross Patchwork Maillots de bain Maillot de bain Halter Top Biquini Maillots de bain Colorblock Bikini Ensembles Beachwear,Women's Fashion Sexy Bandage SwimSuits Push Up Bikini 2019 Cross Patchwork Swimwear Swimsuit Halter Top Biquini Bathing Suits Colorblock Bikini Sets Beachwear,10.0,EUR,25.0,EUR,11,10,,,5.0,0.0,,,,,,,,,,,red,s,50,Livraison standard,3.0,false,,50,true,Quantité limitée !,CN,NARUTONARO,narutonaro,"89 % avis positifs (7,816 notes)",7816,4.198183213920164,593921006a74d23963838445,,,https://www.wish.com/c/5cd3f45bdb2932176892a39b,https://canary.contestimg.wish.com/api/webimage/5cd3f45bdb2932176892a39b-medium.jpg,5cd3f45bdb2932176892a39b
Ecko Unlimited (Unltd.),,,,,,,,,,,,,,,,,,,,,,,,,,,,,,,,,,,,,,,,,https://www.wish.com/c/5ed7830e90b8a6318c2d72c3,,5ed7830e90b8a6318c2d72c3
Maillot de bain pour femmes Couvrir Casual Kaftan Tyffanie Robe en vert Loose Boho Beachwear Bikini Cover ups Tops Maillots de bain Dames Maxi Summer Swimming Costume Kaftan Loungewear Beachwear,Womens Swimsuit Cover up Casual Kaftan Tyffanie Dress in Green Loose Boho Beachwear Bikini Cover ups Tops Swimwear Ladies Maxi Summer Swimming Costume Kaftan Loungewear Beachwear,33.0,EUR,33.0,EUR,39.99,0,,,5.0,0.0,,,,,,,,,,,green,s,2,Livraison standard,10.0,false,,6,,,GB,Diamantine,diamantine,100 % avis positifs (1 notes),1,4.0,5d987cea48ea3c02fce8ba4e,,,https://www.wish.com/c/5daae86e46f23a743ba46ef2,https://canary.contestimg.wish.com/api/webimage/5daae86e46f23a743ba46ef2-medium.jpg,5daae86e46f23a743ba46ef2
Luxe Bling strass ruban Bikini ensemble cristal diamant Sexy femmes maillot de bain licou Push Up Bandage maillots de bain maillots de bain,Luxury Bling Rhinestone Sliver Bikini Set Crystal Diamond Sexy Women Bathing Swimsuit Halter Push Up Bandage Swimwear Beachwear,25.0,EUR,25.0,EUR,30,1,,,5.0,0.0,,,,,,,,,,,black,l,50,Livraison standard,14.0,false,,50,true,Quantité limitée !,CA,11368796 CANADA CORPORATION,11368796canadacorporation,"80 % avis positifs (1,166 notes)",1166,3.9382504288164664,5ffb1f43fa8a25c707537989,,,https://www.wish.com/c/5ffde301e34748d8e21f9e78,https://canary.contestimg.wish.com/api/webimage/5ffde301e34748d8e21f9e78-medium.jpg,5ffde301e34748d8e21f9e78
