title,title_orig,discount_price,discount_price_currency,retail_price,retail_price_currency,discount_price_in_original_currency,nb_cart_orders_approx,nb_units_purchased_approx,uses_ad_boosts,rating,rating_count,rating_five_count,rating_four_count,rating_three_count,rating_two_count,rating_one_count,badges_count,badge_local_product,badge_product_quality,badge_fast_shipping,tags,product_color,product_variation_size_id,product_variation_inventory,shipping_option_name,shipping_option_price,shipping_is_express,countries_shipped_to,inventory_total,has_urgency_banner,urgency_text,origin_country,merchant_title,merchant_name,merchant_info_subtitle,merchant_rating_count,merchant_rating,merchant_id,merchant_has_profile_picture,merchant_profile_picture,product_url,product_picture,product_id
Sexy One-piece Swimsuit Solid Color Bikini Swimsuits for Women Swimwear Bathing Suit Swimming Suit Beachwear Women Bathing Suit Maillot De Bain Femme Monokini Swimsuits,Sexy One-piece Swimsuit Solid Color Bikini Swimsuits for Women Swimwear Bathing Suit Swimming Suit Beachwear Women Bathing Suit Maillot De Bain Femme Monokini Swimsuits,7.0,EUR,36.0,EUR,8,10,,,4.0,1.0,0,1,0,0,0,,,,,,red,xs-,3,Livraison standard,3.0,false,,50,true,Quantité limitée !,CN,Vitality-YAY,vitalityyay,"(6,820 notes)",6820,4.228739002932551,59423b486fffc703212b5287,,,https://www.wish.com/c/60584b639cee8f703a35741e,https://canary.contestimg.wish.com/api/webimage/60584b639cee8f703a35741e-medium.jpg,60584b639cee8f703a35741e
Mode Femmes Push Up Bikini Set Sexy Solid Color Summer Suit Maillot de bain Casual Beachwear Bra + Bikini Bottom,Fashion Women Push Up Bikini Set Sexy Solid Color Summer Suit Swimsuit Casual Beachwear Bra + Bikini Bottom,12.0,EUR,16.0,EUR,14,1000,,,3.412811387900356,281.0,97,52,55,24,53,,,,,,blue,s,50,Livraison standard,3.0,false,,50,,,CN,tingshen,tingshen,"83 % avis positifs (10,639 notes)",10639,3.8985806936742176,58ff26fc42fc6a113afae083,,,https://www.wish.com/c/5e463a13b7394e37bed500b0,https://canary.contestimg.wish.com/api/webimage/5e463a13b7394e37bed500b0-medium.jpg,5e463a13b7394e37bed500b0
Fantastique femmes maillots de bain bikini une pièce push-up rembourré maillot de bain dos nu,Fantastic Women Swimwear Bikini One Piece Push-Up Padded Bathing Backless Beachwear,10.0,EUR,50.0,EUR,11,10,,,3.6812227074235806,229.0,98,44,32,26,29,,,,,,black,xs,20,Livraison standard,3.0,false,,50,,,CN,vobshoppingpark,vobshoppingpark,"88 % avis positifs (81,087 notes)",81087,4.138012258438468,55e40d40c9f8234229401ce9,,,https://www.wish.com/c/5aeff0365ce1805b944fd6c9,https://canary.contestimg.wish.com/api/webimage/5aeff0365ce1805b944fd6c9-medium.jpg,5aeff0365ce1805b944fd6c9
Maillot de bain de plage pour femme Maillot de bain Maillot de bain Tankini Deux pièces Maillot de bain Tankini Beachwear Plus Size XS-8XL,Womens Beach Swimsuit Swimwear Bathing Suit Tankini Two Pieces Bathing Suit Tankini Beachwear Plus Size XS-8XL,10.0,EUR,10.0,EUR,11,10,,,4.382352941176471,34.0,24,2,6,1,1,,,,,,blue,sizexs,50,Livraison standard,3.0,false,,50,,,CN,Bright Eye Fashion TOP,brighteyefashiontop,"90 % avis positifs (8,305 notes)",8305,4.205538832028898,56f52b8027a7461dad277be2,,,https://www.wish.com/c/5e1ea661553f110a17ba62b4,https://canary.contestimg.wish.com/api/webimage/5e1ea661553f110a17ba62b4-medium.jpg,5e1ea661553f110a17ba62b4
2021 NEW Summer Luxury Rhinestone Bandage Beachwear Push Up Bra Bikini Set Fashion Women Summer Diamond Swimsuit Bathing Suit for Women,2021 NEW Summer Luxury Rhinestone Bandage Beachwear Push Up Bra Bikini Set Fashion Women Summer Diamond Swimsuit Bathing Suit for Women,10.0,EUR,10.0,EUR,11,4,,,5.0,0.0,,,,,,,,,,,yellow,s,9,Livraison standard,2.0,false,,50,,,CN,zgszyouth0102,zgszyouth0102,"78 % avis positifs (1,962 notes)",1962,3.7879714576962282,59f299fc68788b1e11714fc2,,,https://www.wish.com/c/60810a37beba25bdbd731bd7,https://canary.contestimg.wish.com/api/webimage/60810a37beba25bdbd731bd7-medium.jpg,60810a37beba25bdbd731bd7
25# Swimsuit Flower Print Bikini Women Bandage Bikini Set Push-up Padded Bra Brazilian Swimwear Beachwear Купальники Женские,25# Swimsuit Flower Print Bikini Women Bandage Bikini Set Push-up Padded Bra Brazilian Swimwear Beachwear Купальники Женские,11.0,EUR,11.0,EUR,13.0,0,,,5.0,0.0,,,,,,,,,,,beige,s,50,Livraison standard,0.0,false,,50,,,CA,Loom,loom,81 % avis positifs (403 notes),403,4.054590570719603,60108516d38ac0468d48a860,,,https://www.wish.com/c/60639b04787d8590d8a1951f,https://canary.contestimg.wish.com/api/webimage/60639b04787d8590d8a1951f-medium.jpg,60639b04787d8590d8a1951f
New Summer Women Bikini Set Colorblock High Waist Swimming Bottom Casual Female Beachwear Bathing Suit Swimsuit Underwear,New Summer Women Bikini Set Colorblock High Waist Swimming Bottom Casual Female Beachwear Bathing Suit Swimsuit Underwear,13.0,EUR,13.0,EUR,15,10,,,5.0,1.0,1,0,0,0,0,,,,,,green,xxs,50,Livraison standard,4.0,false,,50,,,CN,I AM WATCHING YOU,iamwatchingyou,"91 % avis positifs (13,599 notes)",13599,4.2734024560629456,58983b96ca35834ffcc73b7a,,,https://www.wish.com/c/60333dd521d9c38a3ec4cb5d,https://canary.contestimg.wish.com/api/webimage/60333dd521d9c38a3ec4cb5d-medium.jpg,60333dd521d9c38a3ec4cb5d
Maillot de bain une pièce à volants Femme Ananas Imprimé sur l'épaule Maillot de bain une pièce,Women One Piece flounce Swimsuit Pineapple Printed Off Shoulder Bathing Suit,7.0,EUR,7.0,EUR,8,5000,,,4.437720848056537,2264.0,1542,399,182,54,87,,,,,,pine&white,xs,50,Livraison standard,3.0,false,,50,true,Quantité limitée !,CN,tututu  shop,tututushop,"92 % avis positifs (11,319 notes)",11319,4.328297552787348,583fa4290592b847f4e737b3,,,https://www.wish.com/c/59f6a5b528685a2dc18cc8bb,https://canary.contestimg.wish.com/api/webimage/59f6a5b528685a2dc18cc8bb-medium.jpg,59f6a5b528685a2dc18cc8bb
Dos nu String Sexy Femmes String Maillot De Bain Une Pièce Bains Maillots De Bain Fused Maillots De Bain Femme Baigneuse Beachwear Monokini,Backless Thong Sexy Women String One Piece Swimsuit Baths Bathing Suits Fused Swimwear Female Bather Beachwear Monokini,5.0,EUR,8.0,EUR,6,10,,,4.00990099009901,101.0,51,25,9,7,9,,,,,,white,xxs,50,Livraison standard,2.0,false,,50,true,Quantité limitée !,US,MuchMore-Outlet,muchmoreoutlet,"87 % avis positifs (2,009 notes)",2009,4.140368342458935,5962f43848912c6cc0b9d1ae,,,https://www.wish.com/c/5ae0a3a2cd968d207100688e,https://canary.contestimg.wish.com/api/webimage/5ae0a3a2cd968d207100688e-medium.jpg,5ae0a3a2cd968d207100688e
Bikinis taille haute 2021 Maillots de bain Bandeau Maillots de bain Femme Splicing Biquini Beachwear Maillots de bain Nouveau купальник женский купальник,igh Waist Bikinis 2021 Swimsuits Bandeau Swimwear Women Splicing Biquini Beachwear Bathing Suits New купальник женский купальник,16.0,EUR,16.0,EUR,19,0,,,5.0,0.0,,,,,,,,,,,silver,"s,poland",50,Livraison standard,12.0,false,,50,,,CA,11368796 CANADA CORPORATION,11368796canadacorporation,"80 % avis positifs (1,166 notes)",1166,3.9382504288164664,5ffb1f43fa8a25c707537989,,,https://www.wish.com/c/600d8e40e9ad3bf1dee76fbf,https://canary.contestimg.wish.com/api/webimage/600d8e40e9ad3bf1dee76fbf-medium.jpg,600d8e40e9ad3bf1dee76fbf
Femmes Halter Maillots De Bain Deux Pièces Maillot De Bain Tankini Top Boyshorts Maillot De Bain Beachwear Plus La Taille XS-8XL,Women Halter Swimwear Two Pieces Bathing Suit Tankini Top Boyshorts Swimsuit Beachwear Plus Size XS-8XL,13.0,EUR,13.0,EUR,15,10,,,4.8,10.0,8,2,0,0,0,,,,,,red,sizexxl,3,Livraison standard,4.0,false,,50,,,CN,tututu  shop,tututushop,"92 % avis positifs (11,319 notes)",11319,4.328297552787348,583fa4290592b847f4e737b3,,,https://www.wish.com/c/5e285ed62997df141ce2b1ec,https://canary.contestimg.wish.com/api/webimage/5e285ed62997df141ce2b1ec-medium.jpg,5e285ed62997df141ce2b1ec
Sexy Bikini 2021  Swimsuit Female Swimwear Women Bikini Set Bather Swimming Beachwear for Bathing Suit купальники женские,Sexy Bikini 2021  Swimsuit Female Swimwear Women Bikini Set Bather Swimming Beachwear for Bathing Suit купальники женские,16.0,EUR,16.0,EUR,19,0,,,5.0,0.0,,,,,,,,,,,green,"s,poland",50,Livraison standard,5.0,false,,50,,,CA,11368796 CANADA CORPORATION,11368796canadacorporation,"80 % avis positifs (1,166 notes)",1166,3.9382504288164664,5ffb1f43fa8a25c707537989,,,https://www.wish.com/c/601554b4c19f7757d61be49a,https://canary.contestimg.wish.com/api/webimage/601554b4c19f7757d61be49a-medium.jpg,601554b4c19f7757d61be49a
Femmes deux pièces maillot de bain imprimé maillot de bain maillot de bain deux pièces maillots de bain Bikini Tankini grande taille XS-8XL,Womens Two Pieces Printed Swimwear Swimsuit Bathing Suit Two Pieces Beachwear Bikini Tankini Plus Size XS-8XL,7.0,EUR,7.0,EUR,8,10,,,4.416666666666667,12.0,7,3,2,0,0,,,,,,pink&green,xs,50,Livraison standard,3.0,false,,50,,,CN,qinqinwodebaobei,qinqinwodebaobei,"91 % avis positifs (4,093 notes)",4093,4.2575128267774245,583ea562ef56287ad317830f,,,https://www.wish.com/c/5f68bc71c438adccf4729e19,https://canary.contestimg.wish.com/api/webimage/5f68bc71c438adccf4729e19-medium.jpg,5f68bc71c438adccf4729e19
Maillot de bain femme maillot de bain maillot de bain Tankini Bikini Monokini maillot de bain maillot de bain grande taille,Women Swimsuit Swimwear Bathing Suit Tankini Bikini Monokini Swimming Suit Beachwear Plus Size,15.0,EUR,15.0,EUR,18,1000,,,3.6619047619047618,420.0,190,77,43,41,69,,,,,,rose&black,xs-,9,Livraison standard,5.0,false,,50,,,CN,Alliteration 2 specially sold cowboys,alliteration2speciallysoldcowboys,"80 % avis positifs (6,053 notes)",6053,3.809185527837436,591712644d435708ffb57143,,,https://www.wish.com/c/5e1eb06145e2bd0b691dff3a,https://canary.contestimg.wish.com/api/webimage/5e1eb06145e2bd0b691dff3a-medium.jpg,5e1eb06145e2bd0b691dff3a
Femmes deux pièces maillot de bain maillots de bain maillot de bain Tankini Bikini Monokini maillot de bain maillots de bain grande taille XS-8XL,Women Two Pieces Swimsuit Swimwear Bathing Suit Tankini Bikini Monokini Swimming Suit Beachwear Plus Size XS-8XL,8.0,EUR,8.0,EUR,9,10,,,4.176470588235294,51.0,27,13,7,1,3,,,,,,multicolor,s,50,Livraison standard,3.0,false,,50,,,CN,Honest Fashion shopping,honestfashionshopping,"91 % avis positifs (11,010 notes)",11010,4.237511353315168,570d017b1b4ca758e18e407d,,,https://www.wish.com/c/5e0c33466473918cb50f8d01,https://canary.contestimg.wish.com/api/webimage/5e0c33466473918cb50f8d01-medium.jpg,5e0c33466473918cb50f8d01
Maillots de bain Femmes Triangle Bikini Set Bandage Push-Up Maillot de bain Baignade Beachwear,Swimwear Women Triangle Bikini Set Bandage Push-Up Swimsuit Bathing Beachwear,10.0,EUR,82.0,EUR,11,10,,,3.3676470588235294,68.0,24,11,13,6,14,,,,,,,s,50,Livraison standard,2.0,false,,50,,,CN,expectation,expectation,"93 % avis positifs (41,271 notes)",41271,4.429744857163626,5682677fab3afa6f14032367,,,https://www.wish.com/c/5cb33f88bec77768244f09d0,https://canary.contestimg.wish.com/api/webimage/5cb33f88bec77768244f09d0-medium.jpg,5cb33f88bec77768244f09d0
Mini robe d'été décontractée sans manches pour femmes sexy,Sexy Women's Summer Casual Sleeveless Evening Party Backless Beachwear Mini Dress,7.0,EUR,7.0,EUR,8,1000,,,4.049930651872399,721.0,376,159,87,44,55,,,,,,gray,s,50,Livraison standard,2.0,false,,50,,,CN,211670008@qq.com,211670008qqcom,"91 % avis positifs (45,993 notes)",45993,4.272584958580653,578866243a698c1713f2d19c,,,https://www.wish.com/c/5abb2dcdd236a572c57192f8,https://canary.contestimg.wish.com/api/webimage/5abb2dcdd236a572c57192f8-medium.jpg,5abb2dcdd236a572c57192f8
Sexy Bikini Femme Maillot de bain Maillot de bain Push Up Plaid Maillot de bain Maillot de bain d'été FEE,Sexy Bikini Women Swimsuit Swimwear Push Up Plaid Bathing Suit Summer Beachwear  FEE,10.0,EUR,55.0,EUR,11,10000,,,4.27447474295932,2237.0,1410,389,221,76,141,,,,,,red,s,50,Livraison standard,3.0,false,,50,,,CN,Feeling2017,feeling2017,"93 % avis positifs (5,878 notes)",5878,4.388567539979585,589ac47e46ad294ff0bb4267,,,https://www.wish.com/c/58f877da530daf19b1e468d2,https://canary.contestimg.wish.com/api/webimage/58f877da530daf19b1e468d2-medium.jpg,58f877da530daf19b1e468d2
Maillot de bain femme deux pièces maillot de bain maillot de bain Tankini haut maillots de bain maillots de bain grande taille XS-8XL,Women's Two Pieces Bathing Suit Swimsuit Swimdress Tankini Top Swimwear beachwear Plus Size XS-8XL,10.0,EUR,10.0,EUR,11,10,,,5.0,0.0,,,,,,,,,,,blue,xs,50,Livraison standard,2.0,false,,50,,,CN,rhsrtjktfkuydykt,rhsrtjktfkuydykt,84 % avis positifs (31 notes),31,4.258064516129032,5e4a6aca29e7866540370384,,,https://www.wish.com/c/5e6a3bdc9b38b87e172304dc,https://canary.contestimg.wish.com/api/webimage/5e6a3bdc9b38b87e172304dc-medium.jpg,5e6a3bdc9b38b87e172304dc
Femmes imprimé Tankini ensemble maillot de bain maillot de bain maillot de bain maillot de bain maillot de bain deux pièces multicolore maillot de bain Bikini grande taille XS-8XL,Womens Print Tankini Set Swimsuit Swimwear Bathing Suit Beachwear Swimdress Two Pieces Multicolor Swimdress Bikini Plus Size XS-8XL,6.0,EUR,6.0,EUR,7,10,,,4.0,2.0,1,0,1,0,0,,,,,,purple,sizexs,5,Livraison standard,2.0,false,,50,,,CN,Facing the sea,facingthesea,"89 % avis positifs (19,938 notes)",19938,4.1657137125087775,5760bd976238335e38551943,,,https://www.wish.com/c/5fcb3f1e71c488021d936320,https://canary.contestimg.wish.com/api/webimage/5fcb3f1e71c488021d936320-medium.jpg,5fcb3f1e71c488021d936320
RIDERACT,,,,,,,,,,,,,,,,,,,,,,,,,,,,,,,,,,,,,,,,,https://www.wish.com/c/5f2a918f90b8a6806b950572,,5f2a918f90b8a6806b950572
2021 New Korean Solid Swimwear Women Summer Sexy Beachwear Bandage Lace Top Two Piece Swimsuit Bikini Set Swimskirt,2021 New Korean Solid Swimwear Women Summer Sexy Beachwear Bandage Lace Top Two Piece Swimsuit Bikini Set Swimskirt,24.0,EUR,24.0,EUR,29,0,,,5.0,0.0,,,,,,,,,,,pink,s,50,Livraison standard,13.0,false,,50,,,CA,11368796 CANADA CORPORATION,11368796canadacorporation,"80 % avis positifs (1,166 notes)",1166,3.9382504288164664,5ffb1f43fa8a25c707537989,,,https://www.wish.com/c/60154e0b997701a350444695,https://canary.contestimg.wish.com/api/webimage/60154e0b997701a350444695-medium.jpg,60154e0b997701a350444695
Femmes deux pièces maillot de bain maillots de bain maillot de bain Tankini Bikini Monokini maillot de bain maillots de bain grande taille XS-8XL,Womens Two Pieces Swimsuit Swimwear Bathing Suit Tankini Bikini Monokini Swimming Suit Beachwear Plus Size XS-8XL,10.0,EUR,10.0,EUR,12,10,,,3.576923076923077,26.0,12,5,1,2,6,,,,,,yellow,xs,50,Livraison standard,3.0,false,,50,,,CN,Bees flying butterfly,beesflyingbutterfly,"91 % avis positifs (6,285 notes)",6285,4.305489260143198,5826f19f20a9402c37313979,,,https://www.wish.com/c/5e9a92926efc6f188027073a,https://canary.contestimg.wish.com/api/webimage/5e9a92926efc6f188027073a-medium.jpg,5e9a92926efc6f188027073a
CHINA PERONA Plus Size Tankini Set Women Swimwear Sexy Two Piece Swimsuit Print Beachwear Padded Bandage Bathing Suit Swimdress,CHINA PERONA Plus Size Tankini Set Women Swimwear Sexy Two Piece Swimsuit Print Beachwear Padded Bandage Bathing Suit Swimdress,82.0,EUR,82.0,EUR,99.0,0,,,5.0,0.0,,,,,,,,,,,multicolor,onecolor,50,Livraison standard,12.0,false,,50,,,KR,GPOPMALL,gpopmall,69 % avis positifs (16 notes),16,3.6875,600bc259338f835382ad78e9,,,https://www.wish.com/c/606d8b2f1243c484a5f84575,https://canary.contestimg.wish.com/api/webimage/606d8b2f1243c484a5f84575-medium.jpg,606d8b2f1243c484a5f84575
Sexy Femmes Monopièce sans dos Push Up Bikini Pansement Pansement Monokini BeachWear pour femmes,Sexy Women Backless One-Piece Push Up Bikini Swimwear Bandage Monokini BeachWear,11.0,EUR,82.0,EUR,13,1000,,,4.280388978930308,617.0,364,131,78,19,25,,,,,,multicolor,s,50,Livraison standard,3.0,false,,50,,,CN,Athena_,athena_,"85 % avis positifs (21,224 notes)",21224,4.00499434602337,587713bedfa6bc28678f18e6,,,https://www.wish.com/c/589d8929f3a2636db97cac00,https://canary.contestimg.wish.com/api/webimage/589d8929f3a2636db97cac00-medium.jpg,589d8929f3a2636db97cac00
Women Summer Fantastic Women Swimwear Bikini One Piece Push-Up Push-Up Padded Bathing Backless Beachwear,Women Summer Fantastic Women Swimwear Bikini One Piece Push-Up Padded Bathing Backless Beachwear,10.0,EUR,53.0,EUR,12,1000,,,3.5182186234817814,494.0,178,94,102,46,74,,,,,,black,m,19,Livraison standard,3.0,false,,50,,,CN,vobshoppingpark,vobshoppingpark,"88 % avis positifs (81,087 notes)",81087,4.138012258438468,55e40d40c9f8234229401ce9,,,https://www.wish.com/c/5a8038110e63fa2eec3d6fd8,https://canary.contestimg.wish.com/api/webimage/5a8038110e63fa2eec3d6fd8-medium.jpg,5a8038110e63fa2eec3d6fd8
INGAGA Push Up Bikinis Swimsuits High Waist Biquini Swimwear Women Sexy Leopard Bathers Bathing Suits 2020 Patchwork Beachwear,INGAGA Push Up Bikinis Swimsuits High Waist Biquini Swimwear Women Sexy Leopard Bathers Bathing Suits 2020 Patchwork Beachwear,29.0,EUR,29.0,EUR,35,0,,,5.0,0.0,,,,,,,,,,,black,s,40,Livraison standard,12.0,false,,50,,,CA,11368796 CANADA CORPORATION,11368796canadacorporation,"80 % avis positifs (1,166 notes)",1166,3.9382504288164664,5ffb1f43fa8a25c707537989,,,https://www.wish.com/c/6016dbc7792c79e6b8d3fb0f,https://canary.contestimg.wish.com/api/webimage/6016dbc7792c79e6b8d3fb0f-medium.jpg,6016dbc7792c79e6b8d3fb0f
CHINA GANYANR Brand Men Swimwear Boxer Sexy Men Swimwear Designed Beachwear Sea Surf Gay Penis Pouch Swim Trunks 2017 Bulge,CHINA GANYANR Brand Men Swimwear Boxer Sexy Men Swimwear Designed Beachwear Sea Surf Gay Penis Pouch Swim Trunks 2017 Bulge,76.0,EUR,76.0,EUR,92.0,0,,,5.0,0.0,,,,,,,,,,,multicolor,onecolor,50,Livraison standard,12.0,false,,50,,,KR,GPOPMALL,gpopmall,69 % avis positifs (16 notes),16,3.6875,600bc259338f835382ad78e9,,,https://www.wish.com/c/606d9bf07d28a40ad3e36ed7,https://canary.contestimg.wish.com/api/webimage/606d9bf07d28a40ad3e36ed7-medium.jpg,606d9bf07d28a40ad3e36ed7
Mode d'été correspondant famille maillot de bain maman et fille imprimé floral une pièce maillots de bain femmes Monokini enfants fille une pièce Bikini maillot de bain maillots de bain,Summer Fashion Matching Family Swimming Suit Mom and Daughter Floral Print One Piece Swimwear Women Monokini Kids Girl One Piece Bikini Bathing Suit Beachwear,10.0,EUR,24.0,EUR,11,10,,,4.0,17.0,8,6,0,1,2,,,,,,blue,baby-size2-3y,50,Livraison standard,3.0,false,,50,true,Quantité limitée !,CN,Cenic Beauty,cenicbeauty,"87 % avis positifs (47,085 notes)",47085,4.10920675374323,564d8a9ac0f55a1276cd96f8,,,https://www.wish.com/c/5ccab512a36d1558a5b94f72,https://canary.contestimg.wish.com/api/webimage/5ccab512a36d1558a5b94f72-medium.jpg,5ccab512a36d1558a5b94f72
Femmes deux pièces maillot de bain maillots de bain maillot de bain Tankini Bikini Monokini maillot de bain BeachwearTribal Print Halter taille haute Bikini Set Plus Size XS-8XL,Womens Two Pieces Swimsuit Swimwear Bathing Suit Tankini Bikini Monokini Swimming Suit BeachwearTribal Print Halter High Waist Bikini Set Plus Size XS-8XL,6.0,EUR,6.0,EUR,7,1000,,,4.190311418685121,289.0,169,54,37,10,19,,,,,,green,xs,50,Livraison standard,2.0,false,,50,true,Quantité limitée !,CN,green grass and trees,greengrassandtrees,"92 % avis positifs (11,883 notes)",11883,4.318185643356055,5844db310d44637f504acf91,,,https://www.wish.com/c/5ebfdec48a351e28933f0355,https://canary.contestimg.wish.com/api/webimage/5ebfdec48a351e28933f0355-medium.jpg,5ebfdec48a351e28933f0355
2020 Sexy couleur unie Bikini femmes maillots de bain Bandeau Biquini maillot de bain femme maillot de bain Push Up Bikini ensemble maillots de bain,2020 Sexy Solid Color Bikini Women Swimwear Bandeau Biquini Swimsuit Female Bathing Suit Push Up Bikini Set Beachwear,21.0,EUR,21.0,EUR,25,0,,,5.0,0.0,,,,,,,,,,,black,s,50,Livraison standard,6.0,false,,50,,,CA,11368796 CANADA CORPORATION,11368796canadacorporation,"80 % avis positifs (1,166 notes)",1166,3.9382504288164664,5ffb1f43fa8a25c707537989,,,https://www.wish.com/c/5ffdcc5e250adaad596f7c2e,https://canary.contestimg.wish.com/api/webimage/5ffdcc5e250adaad596f7c2e-medium.jpg,5ffdcc5e250adaad596f7c2e
Women Sexy Bathing Suits Bikini Fashion Halter Bikini Push Up Swimwear Fashion Beach Swimming Bikini 9 Colors,Women Sexy Bathing Suits Bikini Fashion Halter Bikini Push Up Swimwear Fashion Beach Swimming Bikini 9 Colors,11.0,EUR,15.0,EUR,13,5000,,,4.273934951901054,2183.0,1343,415,219,92,114,,,,,,red&black,xs,50,Livraison standard,3.0,false,,50,,,CN,Shanghai beautiful clothes store,shanghaibeautifulclothesstore,"86% Positive Feedback (12,385 ratings)",12385,4.048930157448527,574be50dcf4cf75c95f22947,,,https://www.wish.com/c/591fbc6e924fee0d8b52b018,https://canary.contestimg.wish.com/api/webimage/591fbc6e924fee0d8b52b018-medium.jpg,591fbc6e924fee0d8b52b018
Sexy Femmes Bikini Set Bandage Push Up Maillot De Bain Rembourré Maillot De Bain Maillot De Bain Beachwear,Sexy Women Bikini Set Bandage Push Up Padded Swimwear Swimsuit Bathing Beachwear,4.74,EUR,38.0,EUR,5.75,5000,,,4.298398835516739,1374.0,845,265,152,53,59,,,,,,,xs,2,Livraison standard,2.0,false,,50,,,CN,leiston,leiston,"84 % avis positifs (144,810 notes)",144810,3.9402941785788275,5708773c3c02161b3f8c7900,,,https://www.wish.com/c/5a828c42570859595660048e,https://canary.contestimg.wish.com/api/webimage/5a828c42570859595660048e-medium.jpg,5a828c42570859595660048e
Maillot de bain femme maillot de bain maillot de bain imprimé Bikini Beachwear grande taille XS-5XL,Women Swimsuit Swimwear Bathing Suit Printed Bikini Beachwear Plus Size XS-5XL,10.0,EUR,10.0,EUR,11,10,,,3.2432432432432434,74.0,27,12,7,8,20,,,,,,blue,xs,50,Livraison standard,2.0,false,,50,,,CN,cyh888,cyh888,"(1,855 notes)",1855,3.6517520215633423,59a8267535e73b1fe45b702e,,,https://www.wish.com/c/5e49ec9021ede6947f0c1648,https://canary.contestimg.wish.com/api/webimage/5e49ec9021ede6947f0c1648-medium.jpg,5e49ec9021ede6947f0c1648
Hyfve,,,,,,,,,,,,,,,,,,,,,,,,,,,,,,,,,,,,,,,,,https://www.wish.com/c/5e3b0ba69719eddf0ac7e696,,5e3b0ba69719eddf0ac7e696
16 Couleur Mère Fille Maillot De Bain Femmes Enfants Filles Maillots De Bain Maillot De Bain Bikini Beachwear,16 Color Mother Daughter Swimsuit Women Kids Girls Swimwear Bathing Suit Bikini Beachwear,10.0,EUR,183.0,EUR,11,10,,,4.144444444444445,90.0,56,13,9,2,10,,,,,,darkgreen,92(1-2year),1,Livraison standard,3.0,false,,50,true,Quantité limitée !,CN,Paise Jik Store,paisejikstore,"88 % avis positifs (16,971 notes)",16971,4.106593600848506,58046ef419034359a915cec0,,,https://www.wish.com/c/5c2ec7dc2694e322a7a1ec0f,https://canary.contestimg.wish.com/api/webimage/5c2ec7dc2694e322a7a1ec0f-medium.jpg,5c2ec7dc2694e322a7a1ec0f
Évider une pièce maillot de bain femmes léopard Bandage maillot de bain body Sexy licou maillots de bain femme maillot de bain Bikini maillots de bain,Hollow Out One Piece Swimsuit Women Leopard Bandage Bathing Suit Bodysuit Sexy Halter Beachwear Female Swim Suit Bikini Swimwear,10.0,EUR,12.0,EUR,11,10,,,4.0,21.0,12,4,1,1,3,,,,,,,xs,50,Livraison standard,2.0,false,,50,,,CN,VCAN,vcan,"(19,411 notes)",19411,4.216578228839318,57b42e000bc8180a35ec0c89,,,https://www.wish.com/c/5fb12aa81f5a37e73b663515,https://canary.contestimg.wish.com/api/webimage/5fb12aa81f5a37e73b663515-medium.jpg,5fb12aa81f5a37e73b663515
Maillots de bain pour femmes 2021 maillot de bain imprimé léopard Patchwork mode Split licou grande taille maillot de bain brésilien natation maillots de bain,Women's Swimwear 2021 Leopard Print Swimsuit Patchwork Fashion Split Halter Plus Size Bathing Suit Brazilian Swimming Beachwear,22.0,EUR,22.0,EUR,26,0,,,5.0,0.0,,,,,,,,,,,black,"xl,unitedstates",50,Livraison standard,7.0,false,,50,true,Quantité limitée !,CA,11368796 CANADA CORPORATION,11368796canadacorporation,"80 % avis positifs (1,166 notes)",1166,3.9382504288164664,5ffb1f43fa8a25c707537989,,,https://www.wish.com/c/60082854a0560771267c2cd4,https://canary.contestimg.wish.com/api/webimage/60082854a0560771267c2cd4-medium.jpg,60082854a0560771267c2cd4
Maillot de bain à la mode pour hommes 2021 Slim Fit Maillot de bain Beachwear,2021 Men's Fashion Slim Fit Swim Trunk Swimsuit Beachwear,8.0,EUR,8.0,EUR,9,10,,,4.142857142857143,7.0,4,2,0,0,1,,,,,,navyblue,s,50,Livraison standard,3.0,false,,50,true,Quantité limitée !,CN,skyewomen,skyewomen,"83 % avis positifs (6,039 notes)",6039,3.9698625600264945,57a46c8983326718b2f0a3a5,,,https://www.wish.com/c/5fc07f9ac2952b4cb236ed5b,https://canary.contestimg.wish.com/api/webimage/5fc07f9ac2952b4cb236ed5b-medium.jpg,5fc07f9ac2952b4cb236ed5b
Femmes imprimé Tankini ensemble maillot de bain maillot de bain maillot de bain maillot de bain maillot de bain deux pièces multicolore maillot de bain Bikini grande taille XS-8XL,Womens Print Tankini Set Swimsuit Swimwear Bathing Suit Beachwear Swimdress Two Pieces Multicolor Swimdress Bikini Plus Size XS-8XL,14.0,EUR,14.0,EUR,16,10,,,4.0,1.0,0,1,0,0,0,,,,,,multicolor,xs,5,Livraison standard,4.0,false,,50,true,Quantité limitée !,CN,zheng gege shop,zhenggegeshop,"91 % avis positifs (8,676 notes)",8676,4.282964499769479,583fe3d80299bc2a62473b85,,,https://www.wish.com/c/5fcb440e70c349469a5bef99,https://canary.contestimg.wish.com/api/webimage/5fcb440e70c349469a5bef99-medium.jpg,5fcb440e70c349469a5bef99
Robe de bain et short XS-8XL à pois à large lanière pour dames de taille plus grande,plus size Women Ladies Fashion Wide Strap Polka Dot Swimdress and Short XS-8XL,10.0,EUR,10.0,EUR,11,10000,,,4.156171284634761,2779.0,1628,515,296,122,218,,,,,,red,xs,50,Livraison standard,2.0,false,,50,,,CN,Bees flying butterfly,beesflyingbutterfly,"91 % avis positifs (6,285 notes)",6285,4.305489260143198,5826f19f20a9402c37313979,,,https://www.wish.com/c/5ba4f816c1a38516a0cb12d9,https://canary.contestimg.wish.com/api/webimage/5ba4f816c1a38516a0cb12d9-medium.jpg,5ba4f816c1a38516a0cb12d9
