title,title_orig,discount_price,discount_price_currency,retail_price,retail_price_currency,discount_price_in_original_currency,nb_cart_orders_approx,nb_units_purchased_approx,uses_ad_boosts,rating,rating_count,rating_five_count,rating_four_count,rating_three_count,rating_two_count,rating_one_count,badges_count,badge_local_product,badge_product_quality,badge_fast_shipping,tags,product_color,product_variation_size_id,product_variation_inventory,shipping_option_name,shipping_option_price,shipping_is_express,countries_shipped_to,inventory_total,has_urgency_banner,urgency_text,origin_country,merchant_title,merchant_name,merchant_info_subtitle,merchant_rating_count,merchant_rating,merchant_id,merchant_has_profile_picture,merchant_profile_picture,product_url,product_picture,product_id
Coupeur de bord rond de 180 mm niveau de qualité standard fonction mixte d'outils de bonsaï en acier inoxydable 3Cr13 à bord rond et droit,180 mm round edge cutter standard quality level mixed function of round & straight edge 3Cr13 Stainless Steel bonsai tools,42.0,CHF,42.0,CHF,46,0,,,5.0,0.0,,,,,,,,,,,stainless,,8,Livraison standard,17.0,false,,8,,,CA,11368796 CANADA CORPORATION,11368796canadacorporation,"80 % avis positifs (1,166 notes)",1166,3.9382504288164664,5ffb1f43fa8a25c707537989,,,https://www.wish.com/c/60019a18cb3e80a2cb94ed1b,https://canary.contestimg.wish.com/api/webimage/60019a18cb3e80a2cb94ed1b-medium.jpg,60019a18cb3e80a2cb94ed1b
60x30 cm Grand Art Tout Noir / Blanc Tapis de souris XXL En Caoutchouc Ordinateur Gamer Gaming MousePad Verrouillage Bord Clavier clavier Ordinateur Portable Bureau Tapis,60x30cm Large Art All Black /White Mouse Pad XXL Rubber Computer Gamer Gaming MousePad Locking Edge Keyboard pad Laptop Desk Mat,13.0,CHF,14.0,CHF,14,10,,,3.6666666666666665,12.0,5,2,3,0,2,,,,,,white,,50,Livraison standard,3.0,false,,50,true,Quantité limitée !,CN,funeveryday,funeveryday,"96 % avis positifs (1,205 notes)",1205,4.5103734439834025,59c22e43b77173721769dad8,,,https://www.wish.com/c/5e7c7ba77303c0570818135a,https://canary.contestimg.wish.com/api/webimage/5e7c7ba77303c0570818135a-medium.jpg,5e7c7ba77303c0570818135a
Cool Tiger Cat Mobile Phone Bags étui pour Coque iPhone XR XS XS Max pour Samsung Galaxy Note 9 A6 Plus A8 A9 A9 A7 2018 S9 S8 Plus S6 S7 Edge J7 J5 J3 2016 2017 Tiger Cases pour iPhone X 8 7 6 6S Plus 5 5S pour Xiaomi Pocophone F1 Redmi 5A Cover for Huawei P9 Lite 2017 Mate 20 Fundas Pro Capa,Cool Tiger Cat Mobile Phone Bags Case for Coque iPhone XR XS Max for Samsung Galaxy Note 9 A6 Plus A8 A9 A7 2018 S9 S8 Plus S6 S7 Edge J7 J5 J3 2016 2017 Tiger Cases for IPhone X 8 7 6 6S Plus 5 5S for Xiaomi Pocophone F1 Redmi 5A Cover for Huawei P9 Lite 2017 Mate 20 Pro Fundas Capa,4.31,CHF,5.0,CHF,4.74,1000,,,4.5310077519379846,774.0,564,119,53,14,24,,,,,,grey,iphone5/5s/se,50,Livraison standard,1.0,false,,50,true,Quantité limitée !,CN,haohaodexingfuni,haohaodexingfuni,"(93,366 notes)",93366,4.4740055266371055,5adc16f12dde5e4a7f359074,,,https://www.wish.com/c/5bd9ad16a032022c7f11d886,https://canary.contestimg.wish.com/api/webimage/5bd9ad16a032022c7f11d886-medium.jpg,5bd9ad16a032022c7f11d886
Wasserfeste Handy-Hülle für das iPhone X XS Max XR 6 7 8 Plus / Samsung S10 / S10 Plus / S9 / S9 Plus / S8 / S8 Plus / S7 / S7 Edge / S6 / Note 9 / Note 8,Water Resistant Cell Phone Running Armband Case For iPhone X XS Max XR 6 7 8 Plus / Samsung S10 / S10 Plus / S9 / S9 Plus / S8 / S8 Plus / S7 / S7 Edge / S6 / Note 9 / Note 8 ,3.0,CHF,26.0,CHF,3,1000,,,4.306581059390048,623.0,364,153,65,15,26,,,,,,pink,samsunggalaxya3(2016),3,Livraison standard,1.0,false,,50,,,CN,ChinaCases,chinacases,"93% Positives Feedback (103,709 Bewertungen)",103709,4.4612135880203265,589c79e3c5841a63f634e46c,,,https://www.wish.com/c/5c77480e9a57903fbdb5aa7f,https://canary.contestimg.wish.com/api/webimage/5c77480e9a57903fbdb5aa7f-medium.jpg,5c77480e9a57903fbdb5aa7f
atFoliX 3x Protecteur d'écran compatible avec le film protecteur transparent Garmin Edge Explore,atFoliX 3x Screen Protector compatible with Garmin Edge Explore clear Protector Film,7.0,CHF,12.0,CHF,7.48,1,,,5.0,0.0,,,,,,,,,,,,,50,Livraison standard,6.87,false,,50,,,DE,atFoliX,atfolix,"72 % avis positifs (1,880 notes)",1880,3.6398936170212766,5e4d359729e786526133b5d2,,,https://www.wish.com/c/5efd4ef53c862200567a1d00,https://canary.contestimg.wish.com/api/webimage/5efd4ef53c862200567a1d00-medium.jpg,5efd4ef53c862200567a1d00
2 pièces anneaux en Silicone pour hommes bandes de mariage étape bord en caoutchouc bague de mariage hommes femmes sport Active Fitness équitation escalade travail taille 7-14,2Pcs Silicone Rings For Men Wedding Bands Step Edge Rubber Wedding Ring Men Women Sports Active Fitness Riding Climbing Work Size 7-14,3.0,CHF,3.0,CHF,3,10,,,4.172043010752688,93.0,57,14,10,5,7,,,,,,bronze,8,50,Livraison standard,1.0,false,,50,,,CN,iChenYong,ichenyong,"(22,462 notes)",22462,4.1705547146291515,56e7cb302d53db75041dab8b,,,https://www.wish.com/c/5fd9708b904725763f08e62c,https://canary.contestimg.wish.com/api/webimage/5fd9708b904725763f08e62c-medium.jpg,5fd9708b904725763f08e62c
Gradient Color Reinforced Corners TPU Cover Shockproof Phone Case for Motorola Moto G40 G30 G10 G G9 G8 Stylus Play Power 2021 5G Plus / Moto Edge E7i E7 E6i E6S E  Power Plus / One Fusion Vision Macro Hyper 5G Plus Silicone Coque Shell Fundas,Gradient Color Reinforced Corners TPU Cover Shockproof Phone Case for Motorola Moto G40 G30 G10 G G9 G8 Stylus Play Power 2021 5G Plus / Moto Edge E7i E7 E6i E6S E  Power Plus / One Fusion Vision Macro Hyper 5G Plus Silicone Coque Shell Fundas,3.46,CHF,4.0,CHF,3.8,10,,,5.0,0.0,,,,,,,,,,,transparent,motog8power,26,Livraison standard,1.0,false,,50,,,CN,"Atom Bros Tech Ltm CO.,",atombrostechltmco,"92 % avis positifs (18,120 notes)",18120,4.405518763796909,54d637d37851092832ee3cfd,,,https://www.wish.com/c/6055bbc270d6097bbf1897e5,https://canary.contestimg.wish.com/api/webimage/6055bbc270d6097bbf1897e5-medium.jpg,6055bbc270d6097bbf1897e5
Magnetische 2-in-1-Reißverschluss-Ledertasche für Iphone X 5 5S SE 6 6S 7 8 Plus Samsung Galaxy S5 S6 S7 Edge S8 Plus Hinweis 5 8 Abnehmbare Handyhülle Multifunktions-Handyhüllen,Magnetic 2 in 1 Zipper Leather Wallet Case For Iphone X 5 5S SE 6 6S 7 8 Plus Samsung Galaxy S5 S6 S7 Edge S8 Plus Note 5 8 Detachable Phone Cover Multifunction Cell Phone Cases,11.0,USD,30.0,USD,11,1000,,,4.270029673590504,337.0,232,38,26,8,33,,,,,,red,samsunggalaxys6edge,2,Livraison standard,2.0,false,,50,true,Quantité limitée !,CN,Guangzhou Lee-fashion Co. Ltd,guangzhouleefashioncoltd,"(5,044 Bewertungen)",5044,4.396312450436162,54e0759bbbac340527293394,,,https://www.wish.com/c/58bf8058fdedaf58f17de84b,https://canary.contestimg.wish.com/api/webimage/58bf8058fdedaf58f17de84b-medium.jpg,58bf8058fdedaf58f17de84b
Luxus Brieftasche Hülle PU Leder Kartensteckplätze Halter Flip Cover W / Lanyard Für iPhone SE 2020 6 / 6S / 7/8 Plus 11 Pro Max X XS Max XR / Samsung Galaxy S20 Ultra S10 / S9 / S8 Plus S7 Edge Note8 / 9/10 J330 / J530 / J730 A10 / A20 / A20E / A30 / A30S / A40 / A50 / A70 / A51 / A71 / Huawei P30 / P40 / Mate30 (Lite) (Pro) / Honor 9A / 9S / Xiaomi Redmi,Luxury Wallet Case PU Leather Card Slots Holder Flip Cover W/Lanyard For iPhone SE 2020 6/6S/7/8 Plus 11 Pro Max X XS Max XR/Samsung Galaxy S20 Ultra S10/S9/S8 Plus S7 Edge Note8/9/10 J330/J530/J730 A10/A20/A20E/A30/A30S/A40/A50/A70/A51/A71/Huawei P30/P40/Mate30(Lite)(Pro)/Honor 9A/9S/Xiaomi Redmi,3.0,CHF,8.0,CHF,3,10,,,4.345679012345679,81.0,55,11,7,4,4,,,,,,blue,xiaomiredmi7,1,Livraison standard,1.0,false,,50,,,US,jaybotsford9,jaybotsford9,81% Positives Feedback (997 Bewertungen),997,3.8776328986960884,5e9a4ac225c3d445ed56b505,,,https://www.wish.com/c/5f12ae111e6efb18f9756de1,https://canary.contestimg.wish.com/api/webimage/5f12ae111e6efb18f9756de1-medium.jpg,5f12ae111e6efb18f9756de1
Chemin de table élégant motif floral doré bord gland 83x12,Elegant Table Runner Gold Floral Pattern Tassel Edge 83x12,18.0,CHF,46.0,CHF,19,10,,,4.666666666666667,9.0,6,3,0,0,0,,,,,,,,50,Livraison standard,5.0,false,,50,,,CN,Well Network Co,wellnetworkco,"92 % avis positifs (6,773 notes)",6773,4.377971356858113,53f5b3c59020ee5d23d56ffe,,,https://www.wish.com/c/5ba04e8a97cbf32bb54e6b4f,https://canary.contestimg.wish.com/api/webimage/5ba04e8a97cbf32bb54e6b4f-medium.jpg,5ba04e8a97cbf32bb54e6b4f
Modische Seide Leder Geldbörse Geldbörse Kartenhalter Folio Schutztasche Handytasche Cover Edge Case für iPhone XR XS/ X 8 7 6S 5S 7Plus Samsung Gaalxy S7 Edge S7 S8 S8 S8 Plus S9 Plus Note 9 (2017) A8 (2018) Note 8 A6 J3 Star/Huawei Mate 20 Lite P20 Lite P Smart Plus Nova 3 Ehre 9/Xiaomi F1 etc.,Fashion Silk Leather Wallet Wallet Card Holder Folio Protective Mobile Phone Bag Cover Edge Case for iPhone XR XS/ X 8 7 6S 5S 7Plus Samsung Gaalxy S7 Edge S7 S8 S8 Plus S9 Plus Note 9 J3 (2017)  A8 (2018) Note 8 A6 J3 Star/Huawei Mate 20 Lite P20 Lite P Smart Plus Nova 3 Honor 9/Xiaomi F1 etc.,8.0,CHF,8.0,CHF,8,5000,,,4.424006908462867,1158.0,786,208,84,29,51,,,,,,black,iphone7,50,Livraison standard,2.0,false,,50,,,CN,Global-Susan,globalsusan,"(47,781 Bewertungen)",47781,4.346078985370754,57dfe5d019273b11d5b683dd,,,https://www.wish.com/c/5bbec8b496cf222c9fe93930,https://canary.contestimg.wish.com/api/webimage/5bbec8b496cf222c9fe93930-medium.jpg,5bbec8b496cf222c9fe93930
"Coque de protection pour téléphone portable Roblox Design pour Apple iPhone 4 / 4S / 5 / 5S / 5C / 6/6 Plus / 6S / 6S Plus / 7/7 Plus / 8/8 plus / iphone X, Samsung Galaxy S3 / S4 / S5 / S6 / S6 Edge / S7 / S7 Edge / S8 / S8 Plus, Note 2/3/4/5/8, Huawei.","Roblox Design Mobile Cell Phone Cases cover for Apple iPhone 4/4S/5/5S/5C/6/6 Plus/6S/6S Plus/7/7 Plus/8/8 plus/iphone X,Samsung Galaxy S3/S4/S5/S6/S6 Edge/S7/S7 Edge/S8/S8 Plus,Note 2/3/4/5/8,Huawei.",11.0,CHF,22.0,CHF,12,10,,,4.666666666666667,6.0,5,0,1,0,0,,,,,,black,samsunggalaxys10,50,Livraison standard,3.0,false,,50,true,Quantité limitée !,CN,Vit Trading Shop,vittradingshop,97 % avis positifs (305 notes),305,4.632786885245902,58edf958442828105e149945,,,https://www.wish.com/c/5becccb5cec804651ec908c7,https://canary.contestimg.wish.com/api/webimage/5becccb5cec804651ec908c7-medium.jpg,5becccb5cec804651ec908c7
Protecteur d'écran incurvé complet pour Samsung Galaxy S10 Plus S10e S10 5G S9 S9 Plus S8 S8 Plus S7 Edge Note 9 8 Film en verre trempé,Full Curved Screen Protector for Samsung Galaxy S10 Plus S10e S10 5G S9 S9 Plus S8 S8 Plus S7 Edge Note 9 8 Tempered Glass Film,2.46,CHF,9.0,CHF,2.7,10,,,3.508771929824561,57.0,26,10,4,1,16,,,,,,transparent,1pconeplus7tpro,50,Livraison standard,1,false,,50,,,CN,oct,oct,"89 % avis positifs (19,319 notes)",19319,4.2424038511310105,59638359d44a9b0412a7bf58,,,https://www.wish.com/c/5e9d79af54050505f958b131,https://canary.contestimg.wish.com/api/webimage/5e9d79af54050505f958b131-medium.jpg,5e9d79af54050505f958b131
"Emily Blunt, Tom Cruise aux arrivées pour Edge Of Tomorrow Premiere, Amc Loews Lincoln Square Imax, New York, Ny, 28 mai 2014. Photo par Andres OteroEverett Collection Celebrity","Emily Blunt, Tom Cruise At Arrivals For Edge Of Tomorrow Premiere, Amc Loews Lincoln Square Imax, New York, Ny May 28, 2014. Photo By Andres OteroEverett Collection Celebrity",21.0,CHF,21.0,CHF,23,0,,,5.0,0.0,,,,,,,,,,,,8x10,50,Livraison standard,6.0,false,,50,,,US,Posterazzi,posterazzi,"77 % avis positifs (5,643 notes)",5643,3.8628389154704945,55c0deb64e6a0874f22b3167,,,https://www.wish.com/c/5b7af155a140db0989ad4626,https://canary.contestimg.wish.com/api/webimage/5b7af155a140db0989ad4626-medium.jpg,5b7af155a140db0989ad4626
جراب هاتف بغطاء فضي من مازيراتي لهاتف Iphone 12 12 Mini 11 12 Pro Max X Xr Xs Max 8 7 6 6s 5 Plus 4 حافظة Samsung S20 Plus S20ulrta S6 S7 Edge S8 S9 S10 Note 8 9 10 Huawei Mate 20 Mate30 P30 P40 Pro,Maserati Silver Cover Phone Case for Iphone 12 case 12 Mini 11 12 Pro Max X Xr Xs Max 8 7 6 6s 5 Plus 4 case Samsung S20 Plus S20ulrta S6 S7 Edge S8 S9 S10 Note 8 9 10 Huawei Mate 20 Mate30 P30 P40 Pro Case Cover,12.0,CHF,12.0,CHF,13,10,,,3.6363636363636362,22.0,11,4,1,0,6,,,,,,multicolor,iphone4,50,Livraison standard,3.0,false,,50,,,CN,zhangjisheng fashion,zhangjishengfashion,(تقييمات 236),236,4.283898305084746,5417eab04ad3ab27d454c527,,,https://www.wish.com/c/5f9fccadb33971a186fe302a,https://canary.contestimg.wish.com/api/webimage/5f9fccadb33971a186fe302a-medium.jpg,5f9fccadb33971a186fe302a
1 Stück DIY Spatel Kuchenschaber Kantenglätter Kunststoffcreme Fondant Mousse Gebäck Backwerkzeuge,1 Piece DIY Spatula Cake Scraper Edge Smoother Plastic Cream Fondant Mousse Pastry Baking Tools,3.47,CHF,4.0,CHF,3.81,20000,,,4.575031133250311,3212.0,2374,494,226,53,65,,,,,,,a,50,Livraison standard,1.0,false,,50,true,Quantité limitée !,CN,liyunjing,liyunjing,"94% Positives Feedback (6,803 Bewertungen)",6803,4.434514184918418,58f5c9406ed7c567d5617ac2,,,https://www.wish.com/c/5b51cc8e12a2ab166f9b1f14,https://canary.contestimg.wish.com/api/webimage/5b51cc8e12a2ab166f9b1f14-medium.jpg,5b51cc8e12a2ab166f9b1f14
3Pcs/set Plastic Dough Knife Icing Fondant Scraper Jagged Edge Plain Smooth Cake Paddle Cake Spatulas Baking Pastry Tools,3Pcs/set Plastic Dough Knife Icing Fondant Scraper Jagged Edge Plain Smooth Cake Paddle Cake Spatulas Baking Pastry Tools,3.0,CHF,7.0,CHF,3,5000,,,4.403622250970246,773.0,504,146,77,23,23,,,,,,white,,50,Livraison standard,1.0,false,,50,,,CN,Gold&Egg,tigerwood,"94% Positive Feedback (4,024 ratings)",4024,4.419731610337972,5c023cdb07aa256a6c1d4f03,,,https://www.wish.com/c/5d11d2266357266e65dfa4fc,https://canary.contestimg.wish.com/api/webimage/5d11d2266357266e65dfa4fc-medium.jpg,5d11d2266357266e65dfa4fc
Nerf,,,,,,,,,,,,,,,,,,,,,,,,,,,,,,,,,,,,,,,,,https://www.wish.com/c/5e8d300c9719ed640496780d,,5e8d300c9719ed640496780d
Guardians Of The Galaxy,,,,,,,,,,,,,,,,,,,,,,,,,,,,,,,,,,,,,,,,,https://www.wish.com/c/5e8d2fff9719ed64049677b5,,5e8d2fff9719ed64049677b5
غطاء هاتف كرتوني لغطاء خلفي صلب رفيع للغاية من Softe Edge غطاء مقاوم للصدمات لهاتف iphone11 Caseiphone11procase و iphone11promaxcase و iphonexscase و iphonexrcase و iphonexsmaxcase و iphonexcase و iphone8766scase و Huaweimate1020case و huaweiP10P20P30case و Samsungs6s7s8,"Cartoon Phone Cover for Transparent Ultra Thin Sofe Edge Hard Back Phone Caes Shockproof Cover For iphone11 caseiphone11procase,iphone11promaxcase ,iphonexscase,iphonexrcase,iphonexsmaxcase,iphonexcase,iphone8766scase,Huaweimate1020case,huaweiP10P20P30case,Samsungs6s7s8s9 s10case,",3.0,CHF,6.0,CHF,3,1000,,,4.651982378854625,227.0,178,31,10,4,4,,,,,,yellow,iphone4/4s,50,Livraison standard,1.0,false,,50,,,CN,Baby Mom,dongguanprimitiveecommercelimited,"(تقييمات 6,765)",6765,4.040354767184035,55b09406a13a384077eb09ad,,,https://www.wish.com/c/5d858e9dcde96726de76f061,https://canary.contestimg.wish.com/api/webimage/5d858e9dcde96726de76f061-medium.jpg,5d858e9dcde96726de76f061
Mode und exquisites Leder Reißverschluss Brieftasche Brieftasche Kartensteckplatz Samsung S20 / S10 / S9 / S8 Plus S10e S7 / S6 Rand Hinweis 20 Ultra / 10 Plus / 9/8 A10 / A10E / A20 ... A71 5G / iPhone 12/11 Pro max XS Max X XR 6 / 6S / 7/8 Plus SE 2020 / Huawei P40 / P30 / P20 Lite / Pro Mate 20/10 Lite / Pro,Fashion And Exquisite Leather Zipper Wallet Wallet Card Slot Samsung S20/S10/S9/S8 Plus S10e S7/ S6 edge Note 20 Ultra/10 Plus/9/8 A10/A10E/A20 ... A71 5G/iPhone 12/11 Pro Max XS Max X XR 6/6S /7/8 Plus SE 2020/Huawei P40/P30/P20 Lite/Pro Mate 20/10 Lite/Pro,5.0,CHF,13.0,CHF,5,10,,,4.1521739130434785,92.0,56,15,9,3,9,,,,,,black,forsamsungs20,50,Livraison standard,2.0,false,,50,,,CN,LAM 2017,lam2017,"94% Positives Feedback (24,411 Bewertungen)",24411,4.437712506656835,5900624320d4d5112536cef8,,,https://www.wish.com/c/5f5ee78d994a2200407fefd9,https://canary.contestimg.wish.com/api/webimage/5f5ee78d994a2200407fefd9-medium.jpg,5f5ee78d994a2200407fefd9
Bricolage à la main moulin bord cire en cuir bord de polissage cire en cuir meulage outil de sculpture en cuir artisanat 3 couleurs disponibles,DIY Handmade Mill Edge Wax Leather Edge Polishing Wax Leather Grinding Carving Tool Leather Craft 3 Colors Available,15.0,CHF,15.0,CHF,16,0,,,5.0,0.0,,,,,,,,,,,brown,,50,Livraison standard,9.0,false,,50,true,Quantité limitée !,CA,11368796 CANADA CORPORATION,11368796canadacorporation,"80 % avis positifs (1,166 notes)",1166,3.9382504288164664,5ffb1f43fa8a25c707537989,,,https://www.wish.com/c/6012de3417f56d39005c5a2d,https://canary.contestimg.wish.com/api/webimage/6012de3417f56d39005c5a2d-medium.jpg,6012de3417f56d39005c5a2d
Etui portefeuille en cuir de luxe pour iPhone X 8 7 / SE / 5S / 6S / 6S / 6S Plus / 7 Plus pour Samsung Galaxy S8 S7 S6 S6 Edge Plus Note8 S5 S4 S7 Edge S8 Plus A3 A5 A7 A8 J1 J1 Ace J2 Premier J3 J5 J7 A310 A510 A710 J5 Premier J3 J7 Pour Sony Z3 Z5 XA XZ Pour HTC M9 Wallet Flip Cover ,Luxury Leather Wallet Flip Cover Case For iPhone X 8 7/SE/5S/6/6S/6S Plus/7 Plus For Samsung Galaxy S8 S7 S6 S6 Edge Plus Note8 S5 S4 S7 Edge S8 Plus A3 A5 A7 A8 A9 J1 J1 Ace J2 J3 J5 J7 A310 A510 A710 J5 prime J3 J7 prime For Sony Z3 Z4 Z5 XA XZ For HTC M9 Wallet Flip Cover ,6.0,USD,41.0,USD,6,10000,,,4.237339055793991,2330.0,1442,432,197,85,174,,,,,,black,samsunggalaxys7,50,Livraison standard,2.0,false,,50,,,CN,shenzhenrongdaerkejiyouxiangongsi,深圳荣达尔科技有限公司,"(6,516 notes)",6516,4.345303867403315,5473e96c1280fa48e29a27bb,,,https://www.wish.com/c/56923e165049375aa7f79fb5,https://canary.contestimg.wish.com/api/webimage/56923e165049375aa7f79fb5-medium.jpg,56923e165049375aa7f79fb5
britto,,,,,,,,,,,,,,,,,,,,,,,,,,,,,,,,,,,,,,,,,https://www.wish.com/c/5ed7832890b8a6318c2d7357,,5ed7832890b8a6318c2d7357
30/40/50 Blatt Sofortbildkamera Original Fuji Fujifilm Instax Mini Fotopapier 8 White Edge Film für Mini 9 7 S 90 25 55 Share SP-1,30/40/50 Sheets Instant Camera Original Fuji Fujifilm Instax Mini Photo Paper 8 White Edge Film for Mini 9 7 S 90 25 55 Share SP-1,28.0,USD,166.0,USD,28,1000,,,4.636798088410992,837.0,673,90,36,10,28,,,,,,,30sheets,50,Livraison standard,8.0,false,,50,,,CN,song yan shop,songyanshop,(844 Bewertungen),844,4.475118483412322,5d4fe9b6933fb16bc6b8bee4,,,https://www.wish.com/c/5d69d278d873f657406e70b2,https://canary.contestimg.wish.com/api/webimage/5d69d278d873f657406e70b2-medium.jpg,5d69d278d873f657406e70b2
Luxe Smart Clear View Plating Mirror Phone Case Flip Housse en cuir pour Samsung Galaxy A10 A20 A30 A40 A50 A70 S10Plus S10 S10e S9Plus S9 S8Plus S8 S7Edge S7 Note 10 Plus pour Huawei P30 P20 Mate 30 Mate 20 Pro Lite pour Xiaomi Redmi Note 8 Pro 7 pour iPhone 11 Pro Max XS Max XR X 8 7 6 6S Plus,Luxury Smart Clear View Plating Mirror Phone Case Flip Leather Cover Case for Samsung Galaxy A10 A20 A30 A40 A50 A70 S10Plus S10 S10e S9Plus S9 S8Plus S8 S7Edge S7 Note 10 Plus for Huawei P30 P20 Mate 30 Mate 20 Pro Lite for Xiaomi Redmi Note 8 Pro 7 for iPhone 11 Pro Max XS Max XR X 8 7 6 6S Plus,4.4,CHF,46.0,CHF,4.83,1000,,,3.987878787878788,495.0,264,86,66,33,46,,,,,,blue,huaweihonor10lite,20,Livraison standard,1.0,false,,50,,,CN,youxuanzhan,youxuanzhan,"93 % avis positifs (4,501 notes)",4501,4.403688069317929,5d79e88c7412014f6ffe4d2c,,,https://www.wish.com/c/5d9f2c57ab9ed3226a87d03c,https://canary.contestimg.wish.com/api/webimage/5d9f2c57ab9ed3226a87d03c-medium.jpg,5d9f2c57ab9ed3226a87d03c
Outil professionnel d'art des ongles Pinces à ongles Pinces à cuticules Cisaille coupe-bordures Ciseaux pour manucure Ciseaux de coupe manucure ,Professional Nail Art Tool Nail Cuticle Nippers Clipper Edge Cutter Shear Manicure Trimmer Scissor ,6.0,CHF,19.0,CHF,6,10,,,4.523809523809524,21.0,16,1,3,1,0,,,,,,,,50,Livraison standard,2.0,false,,50,,,CN,pioneer2,pioneer2,"89 % avis positifs (6,987 notes)",6987,4.212537569772435,5836b722ef562809246be88e,,,https://www.wish.com/c/5d00a011c76d5249541b3245,https://canary.contestimg.wish.com/api/webimage/5d00a011c76d5249541b3245-medium.jpg,5d00a011c76d5249541b3245
"Garmin 010-02060-00 Edge 530 GPS Cycling Computer Bundle with Screen Protector Scratch Resistant T, One Color_One Size, One Color_One Size, One Color","Garmin 010-02060-00 Edge 530 GPS Cycling Computer Bundle with Screen Protector Scratch Resistant T, One Color_One Size, One Color_One Size, One Color",1258.0,CHF,1258.0,CHF,1381.0,0,,,5.0,0.0,,,,,,,,,,,,,50,Livraison standard,12.0,false,,50,,,KR,Stay_Gorgeous Korea,stay_gorgeouskorea,100 % avis positifs (5 notes),5,4.8,5fd76ab639ab348c49576bf2,,,https://www.wish.com/c/60327adaae182e003ef27296,https://canary.contestimg.wish.com/api/webimage/60327adaae182e003ef27296-medium.jpg,60327adaae182e003ef27296
Friends Don't Lie Stranger Things Housse en TPU pour IPhone 11 Pro Max 8 Plus 7 Plus 6S 5S SE Plus X XS MAX XR Coque Concha et Samsung Galaxy S6 Edge S7 Edge S8 Plus S9 Plus S10 Plus Note 8 Note 9,Friends Don't Lie Stranger Things  Phone Case TPU Covers for IPhone 11 Pro Max 8 Plus 7 Plus 6S 5S SE Plus X XS MAX XR Coque Concha and Samsung Galaxy S6 Edge S7 Edge S8 Plus S9 Plus S10 Plus Note 8 Note 9,3.47,CHF,23.0,CHF,3.81,10,,,4.372549019607843,51.0,35,7,4,3,2,,,,,,acorn,iphonese,50,Livraison standard,1.0,false,,50,true,Quantité limitée !,CN,yangujia569,yangujia569,"89 % avis positifs (2,726 notes)",2726,4.212032281731474,5d58d7d81d862957c042f545,,,https://www.wish.com/c/5e1940da37dc5b07806838d4,https://canary.contestimg.wish.com/api/webimage/5e1940da37dc5b07806838d4-medium.jpg,5e1940da37dc5b07806838d4
Tapis de jeu Gamer Space Space Lock Edge Tapis de souris étanche Taille pour 300 * 800 * 2mm et 400 * 900 * 3mm Design Grand tapis de souris,Outer Space Gamer Play Mats Lock Edge Waterproof Mousepad Size for 300*800*2mm and 400*900*3mm Design Large Mouse Pad,8.0,USD,39.0,USD,8,1000,,,4.43598615916955,289.0,201,46,23,5,14,,,,,,,250x290x2mm,50,Livraison standard,3.0,false,,50,,,CN,Jim custom shop,jimcustomshop,"(4,997 notes)",4997,4.281969181508905,5832fbba970430073dc78a33,,,https://www.wish.com/c/5d3d0ce77db86902207fc0ff,https://canary.contestimg.wish.com/api/webimage/5d3d0ce77db86902207fc0ff-medium.jpg,5d3d0ce77db86902207fc0ff
Nuovo proteggi schermo in vetro temperato Fullcover Edge Flim per Samsung Galaxy Note 10 / Note 10 Plus / Note 9 / S8 / S8 Plus / Note 8 / S9 / S9 Plus / S10 / S10 Plus / A50 A70 A90 A80 A60 A40 A30 A20 A10,New Tempered Glass Screen Protector Fullcover Edge Flim For Samsung Galaxy Note 10 / Note 10 Plus / Note 9 / S8 / S8 Plus / Note 8 / S9 / S9 Plus / S10 / S10 Plus/ A50 A70 A90 A80 A60 A40 A30 A20 A10,7.0,CHF,20.0,CHF,7,10,,,3.8372093023255816,86.0,44,16,7,6,13,,,,,,black,galaxya10,50,Livraison standard,2.0,false,,50,,,CN,yuanshen,yuanshen,"(1,982 valutazioni)",1982,4.20686175580222,5d6239dd40defd75b988807a,,,https://www.wish.com/c/5e0a03c015f57d5a1cdfb895,https://canary.contestimg.wish.com/api/webimage/5e0a03c015f57d5a1cdfb895-medium.jpg,5e0a03c015f57d5a1cdfb895
Neca,,,,,,,,,,,,,,,,,,,,,,,,,,,,,,,,,,,,,,,,,https://www.wish.com/c/5efc6cf8eb31f9cd145e0ece,,5efc6cf8eb31f9cd145e0ece
Benchmade C07 Taktische Messer AUTO EDC Spring Assist Messer Feststehende Klingen Doppelkanten-Überlebensmesser Camping Jagd Schneidmesser Schnelles Öffnen,Benchmade C07 Tactical Knives AUTO EDC Spring Assist Knife Fixed Blades Double Edge Survival Knifes Camping Hunting Cutting Knifes Fast Opening,13.0,CHF,13.0,CHF,14,10,,,4.173913043478261,23.0,12,7,1,2,1,,,,,,,stylebblack,50,Livraison standard,4.0,false,,50,,,US,TosupportthecastrationjX,tosupportthecastrationjx,(462 Bewertungen),462,4.08008658008658,5f501aa80808b24923655f81,,,https://www.wish.com/c/5fddb484a16d5df7de5632e6,https://canary.contestimg.wish.com/api/webimage/5fddb484a16d5df7de5632e6-medium.jpg,5fddb484a16d5df7de5632e6
NBA Youngboy Never Broke Again Coque en TPU pour IPhone 11 Pro Max 8 Plus 7 Plus 6S 5S SE Plus X XS MAX XR Coque Concha et Samsung Galaxy S6 Edge S7 Edge S8 Plus S9 Plus S10 Plus Note 8 Note 9,NBA Youngboy Never Broke Again  Phone Case TPU Covers for IPhone 11 Pro Max 8 Plus 7 Plus 6S 5S SE Plus X XS MAX XR Coque Concha and Samsung Galaxy S6 Edge S7 Edge S8 Plus S9 Plus S10 Plus Note 8 Note 9,3.51,CHF,23.0,CHF,3.86,10,,,4.4363636363636365,55.0,40,7,3,2,3,,,,,,acorn,iphonese,50,Livraison standard,1.0,false,,50,,,CN,goxx96,goxx96,"90 % avis positifs (4,711 notes)",4711,4.310337507960093,5d56f6ad1d862918a4377d65,,,https://www.wish.com/c/5ea286d38c0e5145f28e60b4,https://canary.contestimg.wish.com/api/webimage/5ea286d38c0e5145f28e60b4-medium.jpg,5ea286d38c0e5145f28e60b4
Volkswagen,,,,,,,,,,,,,,,,,,,,,,,,,,,,,,,,,,,,,,,,,https://www.wish.com/c/5ed7831b90b8a6318c2d7309,,5ed7831b90b8a6318c2d7309
atFoliX 3x Screen Protector compatible with Garmin Edge 705 matt&shockproof Protector Film,atFoliX 3x Screen Protector compatible with Garmin Edge 705 matt&shockproof Protector Film,7.0,CHF,11.0,CHF,6.99,0,,,5.0,0.0,,,,,,,,,,,,,50,Livraison standard,6.87,false,,50,,,DE,atFoliX,atfolix,"72 % avis positifs (1,880 notes)",1880,3.6398936170212766,5e4d359729e786526133b5d2,,,https://www.wish.com/c/5efd4dc9c9ccb20059f62632,https://canary.contestimg.wish.com/api/webimage/5efd4dc9c9ccb20059f62632-medium.jpg,5efd4dc9c9ccb20059f62632
12g Waterproof Hair Shadow Powder Edge Control 3 Colors Hair Line Powder With Puff Makeup Hair Concealer Cover Hair,12g Waterproof Hair Shadow Powder Edge Control 3 Colors Hair Line Powder With Puff Makeup Hair Concealer Cover Hair,7.0,CHF,8.0,CHF,7,10,,,4.606060606060606,33.0,25,6,0,1,1,,,,,,coffee,,50,Livraison standard,2.0,false,,50,true,Quantité limitée !,CN,"Network Technology shanghai Co., Ltd.",networktechnologyshanghaicoltd,"(1,021 ratings)",1021,4.221351616062684,575776e012dfe62fa06ffe7b,,,https://www.wish.com/c/5f68a7b6359e97004e1af398,https://canary.contestimg.wish.com/api/webimage/5f68a7b6359e97004e1af398-medium.jpg,5f68a7b6359e97004e1af398
