title,title_orig,discount_price,discount_price_currency,retail_price,retail_price_currency,discount_price_in_original_currency,nb_cart_orders_approx,nb_units_purchased_approx,uses_ad_boosts,rating,rating_count,rating_five_count,rating_four_count,rating_three_count,rating_two_count,rating_one_count,badges_count,badge_local_product,badge_product_quality,badge_fast_shipping,tags,product_color,product_variation_size_id,product_variation_inventory,shipping_option_name,shipping_option_price,shipping_is_express,countries_shipped_to,inventory_total,has_urgency_banner,urgency_text,origin_country,merchant_title,merchant_name,merchant_info_subtitle,merchant_rating_count,merchant_rating,merchant_id,merchant_has_profile_picture,merchant_profile_picture,product_url,product_picture,product_id
Protecteur d'écran atFoliX 3x compatible avec le film protecteur transparent Garmin Edge 130 Plus,atFoliX 3x Screen Protector compatible with Garmin Edge 130 Plus clear Protector Film,7.0,CHF,11.0,CHF,6.87,1,,,5.0,0.0,,,,,,,,,,,,,50,Livraison standard,6.87,false,,50,true,Quantité limitée !,DE,atFoliX,atfolix,"72 % avis positifs (1,880 notes)",1880,3.6398936170212766,5e4d359729e786526133b5d2,,,https://www.wish.com/c/5efd4ebd99c04500a08af911,https://canary.contestimg.wish.com/api/webimage/5efd4ebd99c04500a08af911-medium.jpg,5efd4ebd99c04500a08af911
8-teiliger Kindersicherheits-Eckschutz Weiche PVC-Tischtischschutzkantenschutzabdeckung,8Pcs Child Safety Corner Protector Soft PVC Desk Table Guard Edge Protection Cover,3.38,CHF,6.0,CHF,3.71,1000,,,4.384615384615385,65.0,41,14,6,2,2,,,,,,,4pcs,50,Livraison standard,1.0,false,,50,,,CN,Nanfangyouni,nanfangyouni,93% Positives Feedback (395 Bewertungen),395,4.440506329113924,5f9ba64023aaec7b0da51c69,,,https://www.wish.com/c/5fe993c2fa31442368c3b07c,https://canary.contestimg.wish.com/api/webimage/5fe993c2fa31442368c3b07c-medium.jpg,5fe993c2fa31442368c3b07c
Mehrfarbige Silikonhülle für Garmin Edge 1030 GPS-Fahrradcomputer FEM,Multi-color Silicone Skin Case Cover For Garmin Edge 1030 GPS Cycling Computer FEM,6.0,CHF,6.0,CHF,6,10,,,4.571428571428571,21.0,15,3,3,0,0,,,,,,yellow,,50,Livraison standard,2.0,false,,50,,,CN,Female's shop,femalesshop,"91% Positives Feedback (1,527 Bewertungen)",1527,4.355599214145383,5874b67983cdfa67abda86f4,,,https://www.wish.com/c/5eaffc6c8f0a5509ba7c455c,https://canary.contestimg.wish.com/api/webimage/5eaffc6c8f0a5509ba7c455c-medium.jpg,5eaffc6c8f0a5509ba7c455c
Proteggi schermo in vetro temperato da 2 pezzi per Motorola Moto G9 G8 G7 Riproduci G8 G7 G6 Plus G8 G7 power G6 E7 E6 E5 E4 Plus Edge Oen 5g fusion hyper X4 Z4 Z3 Z2 Z Pellicola protettiva,2 Pcs Full Cover Tempered Glass Screen Protector for Motorola Moto G9 G8 G7 Play G8 G7 G6 Plus G8 G7 power G6 E7 E6 E5 E4 Plus Edge Oen 5g fusion hyper X4 Z4 Z3 Z2 Z Protective Film,6.0,CHF,6.0,CHF,6,5000,,,4.38422247446084,1762.0,1248,231,115,48,120,,,,,,black,2pcsmotog9play/motog9,20,Livraison standard,2.0,false,,50,,,CN,Adreams,adreams,"(17,607 valutazioni)",17607,4.378826603055603,557537bb0c49c819f0369358,,,https://www.wish.com/c/5b6d2eee3d9e2e752265b403,https://canary.contestimg.wish.com/api/webimage/5b6d2eee3d9e2e752265b403-medium.jpg,5b6d2eee3d9e2e752265b403
TUSITA Case Compatible with Garmin Edge 830 - Anti Drop Silicone Protective Cover - Cycling GPS Computer Accessories,TUSITA Case Compatible with Garmin Edge 830 - Anti Drop Silicone Protective Cover - Cycling GPS Computer Accessories,60.0,CHF,77.0,CHF,64.99,2,,,5.0,0.0,,,,,,,,,,,,,2,Livraison standard,20.0,false,,2,true,Quantité limitée !,GB,Giftenza,giftenza,(336 ratings),336,3.8660714285714284,5e778af629e7865cfc55bd63,,,https://www.wish.com/c/5fad2ead66251a8f2d75ff7b,https://canary.contestimg.wish.com/api/webimage/5fad2ead66251a8f2d75ff7b-medium.jpg,5fad2ead66251a8f2d75ff7b
BSN,,,,,,,,,,,,,,,,,,,,,,,,,,,,,,,,,,,,,,,,,https://www.wish.com/c/5eaaefd79719ed25a17f44a0,,5eaaefd79719ed25a17f44a0
Jeu de jeu de rôle du MDN Dice Ensembles de dés à miroir polyédrique à 7 matrices avec bords tranchants et belles inclusions pour joueur de RPG,DND Role Playing Game Dice  7-Die Polyhedral Mirror Dice Sets with Sharp Edges and Beautiful Inclusions For RPG Player,17.0,CHF,17.0,CHF,18,10,,,4.181818181818182,11.0,8,1,0,0,2,,,,,,,1pcsofdarkd6,50,Livraison standard,5.0,false,,50,,,CN,AUSPDICE,auspdice,(6 notes),6,4.333333333333333,5ecb580b29e78652f7815fca,,,https://www.wish.com/c/5fe2b25e790a08570c61b02a,https://canary.contestimg.wish.com/api/webimage/5fe2b25e790a08570c61b02a-medium.jpg,5fe2b25e790a08570c61b02a
atFoliX 3x Screen Protector compatible with Garmin Edge 510 clear Protector Film,atFoliX 3x Screen Protector compatible with Garmin Edge 510 clear Protector Film,7.0,CHF,12.0,CHF,7.12,0,,,5.0,0.0,,,,,,,,,,,,,50,Livraison standard,6.87,false,,50,,,DE,atFoliX,atfolix,"72 % avis positifs (1,880 notes)",1880,3.6398936170212766,5e4d359729e786526133b5d2,,,https://www.wish.com/c/5efd4ded56f95100def63507,https://canary.contestimg.wish.com/api/webimage/5efd4ded56f95100def63507-medium.jpg,5efd4ded56f95100def63507
GemRed,,,,,,,,,,,,,,,,,,,,,,,,,,,,,,,,,,,,,,,,,https://www.wish.com/c/5f77086890b8a68eb0355564,,5f77086890b8a68eb0355564
Housse de protection antichoc de luxe dégradé couleur 360 ° pour iPhone XSMax XS XR X 8 8Plus 7 7Plus 6s 6sPlus 6 6Plus SE 5S 5 / Samsung Galaxy S9 S9Plus S8 S8Plus S7 S7Edge S6 S6Edge S5 Note8 Note5,Luxury Gradient Color 360° Protection Shockproof Case Cover for iPhone XSMax XS XR X 8 8Plus 7 7Plus 6s 6sPlus 6 6Plus SE 5S 5 / Samsung Galaxy S9 S9Plus S8 S8Plus S7 S7Edge S6 S6Edge S5 Note8 Note5,2.51,CHF,8.0,CHF,2.76,10,,,4.2125,160.0,109,15,15,3,18,,,,,,blue&yellow,iphone5,50,Livraison standard,1,false,,50,true,Quantité limitée !,CN,Covo,covo,"(28,030 notes)",28030,4.455190866928291,59887e67776ab9243dbd1cd7,,,https://www.wish.com/c/5c1fdd4cb18065214bcb2bbc,https://canary.contestimg.wish.com/api/webimage/5c1fdd4cb18065214bcb2bbc-medium.jpg,5c1fdd4cb18065214bcb2bbc
Nail Art Clipper Cutter Gel UV Faux Ongles Conseils Edge Cutters U One Word Clippers Manucure Outil Pour DIY Français Ongles,Professional Nail Art Clipper Cutter UV Gel False Nail Tips Edge Cutters  U One Word Clippers Manicure Tool For DIY French Nails,3.39,CHF,4.0,CHF,3.7199999999999998,10,,,4.585365853658536,41.0,30,6,4,1,0,,,,,,lightblue,type1,50,Livraison standard,1.0,false,,50,,,CN,Small Ornament World,smallornamentworld,92 % avis positifs (343 notes),343,4.402332361516035,5b8a06f6a3b4ea21f926be6f,,,https://www.wish.com/c/5f60c94dae2539004893784f,https://canary.contestimg.wish.com/api/webimage/5f60c94dae2539004893784f-medium.jpg,5f60c94dae2539004893784f
"Luxuriöse klassische einfarbige Litschi-Ledertasche Schmutzabweisende Geldbörsenkarten Fotohalterung Hülle Coque für Samsung Galaxy J2 J3 J4 J6 J7 Plus 2016 2017 2018,A3 A5 A6 A7 A8 A9 Plus 2016 2017 2018,A10 A20 A30 A40 A50 A70,S5 S6 S7 S8 S9 S10e S10e S10 Rand plus Handytasche","Luxury Classic Solid Color Litchi Leather Case Dirt Drop Resistant Wallet Card Photo Holders Case Cover Coque For Samsung Galaxy J2 J3 J4 J5 J6 J7 Plus 2016 2017 2018,A3 A5 A6 A7 A8 A9 Plus 2016 2017 2018,A10 A20 A30 A40 A50 A70,S5 S6 S7 S8 S9 S10e S10 edge plus Mobile Phone Bag",4.28,CHF,14.0,CHF,4.7,5000,,,4.322302158273382,1390.0,871,296,109,28,86,,,,,,red,samsunggalaxyj3,50,Livraison standard,1.0,false,,50,,,CN,Smart Equipment,smartequipment,"94% Positives Feedback (37,837 Bewertungen)",37837,4.439252583450062,5959c3d9905fdb6fb79671a9,,,https://www.wish.com/c/5cba76bef3fae839c4a04c6d,https://canary.contestimg.wish.com/api/webimage/5cba76bef3fae839c4a04c6d-medium.jpg,5cba76bef3fae839c4a04c6d
Dentelle Bord Bordure En Métal De Coupe Matrices Couper Die Moule Décoration Scrapbook Papier Artisanat Couteau Moule Lame,Lace Edge Border Metal Cutting Dies Cut Die Mold Decoration Scrapbook Paper Craft Knife Mould Blade,3.52,CHF,4.0,CHF,3.87,10,,,4.628571428571429,70.0,51,14,3,2,0,,,,,,,,50,Livraison standard,1.0,false,,50,,,CN,dianpujiushishenghuo,dianpujiushishenghuo,"92 % avis positifs (2,013 notes)",2013,4.390958768007948,5ae04cb808a2241406185366,,,https://www.wish.com/c/5d5a7249a5fa2407972b4aa0,https://canary.contestimg.wish.com/api/webimage/5d5a7249a5fa2407972b4aa0-medium.jpg,5d5a7249a5fa2407972b4aa0
"Navigateur GPS EDGE 520 PLUS GARMIN 010-02083-10 2,3 ","Navigateur GPS EDGE 520 PLUS GARMIN 010-02083-10 2,3 ",250.0,EUR,250.0,EUR,302.41,9,,,5.0,1.0,1,0,0,0,0,,,,,,,,50,Livraison standard,35.96,false,,50,,,FR,Soukdeals,soukdeals,69 % avis positifs (13 notes),13,3.769230769230769,5a6e5ebe20231065bc89802b,,,https://www.wish.com/c/5fff47faf793603d9b6f94e0,https://canary.contestimg.wish.com/api/webimage/5fff47faf793603d9b6f94e0-medium.jpg,5fff47faf793603d9b6f94e0
"Étui de protection robuste en métal pour réservoir de luxe étanche à la saleté pour Samsung Galaxy S20 Note 20 Ultra Lite S8 S9 Plus S10E S7 S6 Edge S5 Note 9 8 5 4 3, iPhone 12 11 Pro Max XS Max XR XS X 8 7 6S 6 Plus Couverture antichoc Coque Coque Funda","Luxury Tank Waterproof Dirtproof Armor Metal Heavy Duty Protection Case for Samsung Galaxy S20 Note 20 Ultra Lite S8 S9 Plus S10E S7 S6 Edge S5 Note 9 8 5 4 3,iPhone 12 11 Pro Max  XS Max XR XS X 8 7 6S 6 Plus Cover Shockproof Shell Coque Funda",9.0,CHF,9.0,CHF,9,10,,,4.234375,64.0,42,8,7,1,6,,,,,,red,galaxynote3,6,Livraison standard,3.0,false,,50,,,CN,Adreams,adreams,"(17,607 notes)",17607,4.378826603055603,557537bb0c49c819f0369358,,,https://www.wish.com/c/5be10a226d0df71a64fa6a9b,https://canary.contestimg.wish.com/api/webimage/5be10a226d0df71a64fa6a9b-medium.jpg,5be10a226d0df71a64fa6a9b
10D Film de protection souple pour Samsung Galaxy S10 S9 S8 Plus S10e S7 edge S6 edge Protecteur d'écran Note 10 9 8 Nano Hydrogel Film Not Glass,10D Soft Protective Film for Samsung Galaxy S10 S9 S8 Plus S10e S7 edge S6 edge Screen Protector Note 10 9 8 Nano Hydrogel Film Not Glass,2.48,CHF,3.0,CHF,2.7199999999999998,10,,,3.8448275862068964,58.0,30,7,9,6,6,,,,,,transparent,samsungs10,50,Livraison standard,1,false,,50,,,CN,Global world,globalworld,"90 % avis positifs (2,649 notes)",2649,4.237070592676481,590b39a4226103223613f024,,,https://www.wish.com/c/5dcbd36d4bc1a6051986ec4c,https://canary.contestimg.wish.com/api/webimage/5dcbd36d4bc1a6051986ec4c-medium.jpg,5dcbd36d4bc1a6051986ec4c
2018 Charmant voile de mariage de tulle de tulle à deux épaisseurs en stock Voile de mariage Voile de mariage Mariage Voile de mariée Accessoires de mariage,2018 Charming Two Layers Beaded Edge Tulle Bridal Wedding Veils In Stock Wedding Voile Mariage Bridal Veils Accessories,12.0,CHF,41.0,CHF,13,1000,,,4.234624145785877,439.0,282,65,39,19,34,,,,,,ivory,,50,Livraison standard,3.0,false,,50,,,CN,Rebecca's commerce,rebeccascommerce,"94 % avis positifs (3,028 notes)",3028,4.455085865257596,54f92fb0a0086e226cf93e2d,,,https://www.wish.com/c/5a6307512495d47f0edd60ee,https://canary.contestimg.wish.com/api/webimage/5a6307512495d47f0edd60ee-medium.jpg,5a6307512495d47f0edd60ee
atFoliX 3x Screen Protector compatible with Motorola Edge+ clear&flexible Protector Film,atFoliX 3x Screen Protector compatible with Motorola Edge+ clear&flexible Protector Film,10.0,CHF,14.0,CHF,9.89,0,,,5.0,0.0,,,,,,,,,,,,,50,Livraison standard,6.87,false,,50,true,Quantité limitée !,DE,atFoliX,atfolix,"72 % avis positifs (1,880 notes)",1880,3.6398936170212766,5e4d359729e786526133b5d2,,,https://www.wish.com/c/6030be259efdbac101c1e712,https://canary.contestimg.wish.com/api/webimage/6030be259efdbac101c1e712-medium.jpg,6030be259efdbac101c1e712
FLOVEME Étui en cuir de deuxième couche pour Huawei Ascend P9/P10/P10 Plus/Mate 9 pour iphone X 5 5S SE 6 6S 6S 6 Plus 8 7 7 7 Plus pour Samsung Galaxy Note 8/S8/S8 Plus/S7/S7 Edge/S6/S6 Edge/S6 Edge Plus/Note 5 4 3 Nouvelle pochette multifonctions 2 en 1 ,FLOVEME Brand Second Layer Leather Case for Huawei Ascend P9/P10/P10 Plus/Mate 9 for iphone X 5 5S SE 6 6S 6 Plus 8 7 7 Plus for Samsung Galaxy Note 8/S8/S8 Plus/S7/S7 Edge/S6/S6 Edge/S6 Edge Plus/Note 5 4 3 New Multi Functional 2 in 1 Leather Stand Wallet Cover ,14.0,CHF,79.0,CHF,15,20000,,,4.323244552058111,2478.0,1599,436,221,89,133,,,,,,black,iphonese,50,Livraison standard,4.0,false,,50,true,Quantité limitée !,CN,xiangxiangdianshang,湘湘电商,"(15,213 notes)",15213,4.428252152764084,55138f778e8def1e30ac2594,,,https://www.wish.com/c/5757983742e7bf636cc50985,https://canary.contestimg.wish.com/api/webimage/5757983742e7bf636cc50985-medium.jpg,5757983742e7bf636cc50985
Verre de protection incurvé 1000D pour Samsung Galaxy Note10 Plus S10 S10e S8 S9 S6 S7 edge Plus Protecteur d'écran en verre trempé sur Note 8 9 M30 M20 A50 A70 A80 A90 Film,1000D Full Curved Protective glass on for Samsung Galaxy Note10 Plus S10 S10e S8 S9 S6 S7 edge Plus Screen Protector Tempered Glass on Note 8 9  M30 M20 A50 A70 A80 A90 Film,1.82,CHF,71.0,CHF,2.0,1000,,,3.8790035587188614,281.0,158,39,25,10,49,,,,,,black,iphone6,50,Livraison standard,1,false,,50,,,BR,PauloS,paulos,87 % avis positifs (277 notes),277,4.184115523465704,5fb53270aef9b8df227e6449,,,https://www.wish.com/c/5fc313ab60ab16b0e923d643,https://canary.contestimg.wish.com/api/webimage/5fc313ab60ab16b0e923d643-medium.jpg,5fc313ab60ab16b0e923d643
Étui portefeuille en cuir plié rétro de marque d'origine pour iPhone 12 Mini 11 Pro Max XS Max XR XS X 8 7 6S 6 Plus 5 5S SE pour Samsung Galaxy S20 Ultra Note 20 10 Plus 9 8 S10E S10 S9 S8 Plus S7 S6 Edge Plus / Note 5 / Note 4 / Note 3 Boucle en métal Flip Stand,Original Brand Retro Folded Leather Wallet Cover Case for iPhone 12 Mini 11 Pro Max XS Max XR XS X 8 7 6S 6 Plus 5 5S SE for Samsung Galaxy S20 Ultra Note 20 10 Plus 9 8 S10E S10 S9 S8 Plus S7 S6 Edge Plus/Note 5/Note 4/Note 3 Flip Stand Metal Buckle,17.0,CHF,172.0,CHF,18,10,,,4.0,124.0,68,23,13,5,15,,,,,,black,iphone6,50,Livraison standard,5.0,false,,50,,,CN,xiangxiangdianshang,湘湘电商,"94 % avis positifs (15,213 notes)",15213,4.428252152764084,55138f778e8def1e30ac2594,,,https://www.wish.com/c/564eda13e104624e7bf1680c,https://canary.contestimg.wish.com/api/webimage/564eda13e104624e7bf1680c-medium.jpg,564eda13e104624e7bf1680c
6 Stück 3 Flöte 90-Grad-HSS-Metalle Titan Drei-Kanten-Fase Fasenbohrer Set Senkbohrmühle Bohrer,6pcs 3 Flute 90 Degree HSS Metals Titanium Three Edge Chamfer Chamfering Drill Bit Set Countersink Drilling Mill Drill,11.0,CHF,11.0,CHF,11,10000,,,4.4500716674629714,2093.0,1356,462,190,31,54,,,,,,silver,0.19kg,50,Livraison standard,2.0,false,,50,,,CN,shenzhenshiguokemaoyiyouxiangongsi,深圳市过客贸易有限公司,"95% Positives Feedback (13,116 Bewertungen)",13116,4.459057639524246,564ec534dfe8f604d9aef4c3,,,https://www.wish.com/c/5669375ee864390f1048da6d,https://canary.contestimg.wish.com/api/webimage/5669375ee864390f1048da6d-medium.jpg,5669375ee864390f1048da6d
Hot Cute FIRST CLASS PLANE TICKET Telefonhülle Silikon Transparente Telefonhülle TPU-Abdeckungen für IPhone 11 Pro Max 8 Plus 7 Plus 6S 5S SE Plus X XS MAX XR Coque Concha und Samsung Galaxy S6 Edge S7 Edge S8 Plus S9 Plus S10 Plus Note 8 Hinweis 9,Hot Cute FIRST CLASS PLANE TICKET Phone Case Silicone Transparent Phone Case TPU Covers for IPhone 11 Pro Max 8 Plus 7 Plus 6S 5S SE Plus X XS MAX XR Coque Concha and Samsung Galaxy S6 Edge S7 Edge S8 Plus S9 Plus S10 Plus Note 8 Note 9,3.32,CHF,23.0,CHF,3.65,1000,,,3.6439688715953307,514.0,228,95,58,46,87,,,,,,acorn,iphonese,50,Livraison standard,1.0,false,,50,,,CN,yangujia569,yangujia569,"(2,726 Bewertungen)",2726,4.212032281731474,5d58d7d81d862957c042f545,,,https://www.wish.com/c/5e60b8adf48451ce9ec015f1,https://canary.contestimg.wish.com/api/webimage/5e60b8adf48451ce9ec015f1-medium.jpg,5e60b8adf48451ce9ec015f1
TINKSKY 100pcs Filets à cheveux Invisible Elastic Edge Mesh Black,TINKSKY 100pcs Hair Nets Invisible Elastic Edge Mesh Black,6.0,USD,6.0,USD,6,10,,,4.666666666666667,3.0,2,1,0,0,0,,,,,,black,100pcs,50,Livraison standard,2.0,false,,50,true,Quantité limitée !,CN,Tinymall,pickegglimited,"92 % avis positifs (82,010 notes)",82010,4.332691135227411,555710b57899c6338f045b59,,,https://www.wish.com/c/5e05aa0ebfb7f8018b5f0da8,https://canary.contestimg.wish.com/api/webimage/5e05aa0ebfb7f8018b5f0da8-medium.jpg,5e05aa0ebfb7f8018b5f0da8
Claviers à bord de verrouillage de vitesse de grande taille Final Fantasy VII pour 600700750800 900mm,Final Fantasy VII  Large Size Speed Locking Edge Keyboards Mat Size for 600 700 750 800 900mm,11.0,CHF,11.0,CHF,11,10,,,4.92,100.0,93,6,1,0,0,,,,,,,30x60cm,50,Livraison standard,2.0,false,,50,,,CN,Alian3cshop,alian3cshop,"94 % avis positifs (1,400 notes)",1400,4.435714285714286,5d85b94835b44918cd2cf862,,,https://www.wish.com/c/5e561285f0c47c3bc5353ff1,https://canary.contestimg.wish.com/api/webimage/5e561285f0c47c3bc5353ff1-medium.jpg,5e561285f0c47c3bc5353ff1
Câble de chargeur de charge rapide de données USB 1.5M pour accessoires de téléphone Samsung Galaxy S6 S7 Edge,1.5M USB Data Fast Charging Charger Cable for Samsung Galaxy S6 S7 Edge Phone accessories,4.43,CHF,5.0,CHF,4.87,1000,,,4.481481481481482,702.0,500,101,60,21,20,,,,,,black,,50,Livraison standard,1.0,false,,50,true,Quantité limitée !,CN,"guangzhou manyi trade co.,Ltd",guangzhoumanyitradecoltd,"93 % avis positifs (183,342 notes)",183342,4.369789791755299,55fd10378d034042efeb152d,,,https://www.wish.com/c/583542759733f8630fddfeaa,https://canary.contestimg.wish.com/api/webimage/583542759733f8630fddfeaa-medium.jpg,583542759733f8630fddfeaa
Rick And Morty,,,,,,,,,,,,,,,,,,,,,,,,,,,,,,,,,,,,,,,,,https://www.wish.com/c/5f7ef16ceb31f9bb1aeaab1f,,5f7ef16ceb31f9bb1aeaab1f
Coque de protection complète de luxe 360 pour Samsung Galaxy A11 A21S A31 A41 A10 A20 A30 A40 A50 A70 A51 A71 A10S A20S pour Samsung S20 Plus S20 Ultra S10 S9 S8 Plus S7 Edge Note 10 Lite Note 9 8 avec protecteur d'écran,Luxury 360 Full Protective Cover Phone Case for Samsung Galaxy A11 A21S A31 A41 A10 A20 A30 A40 A50 A70 A51 A71 A10S A20S for Samsung S20 Plus S20 Ultra S10 S9 S8 Plus S7 Edge Note 10 Lite Note 9 8 with Screen Protector ,4.01,EUR,6.0,EUR,4.86,1000,,,3.49375,480.0,208,66,69,29,108,,,,,,gold,samsunggalaxys7,50,Livraison standard,1.0,false,,50,true,Quantité limitée !,CN,Gaby's shop,gabysshop,"86 % avis positifs (1,305 notes)",1305,4.09272030651341,5d47a94bb87ed83e628bcd14,,,https://www.wish.com/c/5f5602d6ddc8068807ca1d2e,https://canary.contestimg.wish.com/api/webimage/5f5602d6ddc8068807ca1d2e-medium.jpg,5f5602d6ddc8068807ca1d2e
"5 iarde (4,6 m) di alta qualità in cotone bianco all'uncinetto con rifiniture in pizzo nastro cucito fai da te decorazione bordo fiore",5 Yards(4.6m) High Quality White Cotton Crochet Lace Trim Ribbon DIY Sewing Fabric Flower Edge Decoration,5.0,CHF,14.0,CHF,5,10,,,4.569620253164557,79.0,59,12,4,2,2,,,,,,,no.1-width8mm,50,Livraison standard,2.0,false,,50,,,CN,66season,66season,"97% feedback positivi (3,539 recensioni)",3539,4.642836959593105,59755762ec40ae58bd909ca5,,,https://www.wish.com/c/5caaff438ddca22a27cc39df,https://canary.contestimg.wish.com/api/webimage/5caaff438ddca22a27cc39df-medium.jpg,5caaff438ddca22a27cc39df
"Nuovi occhiali da lettura anti-luce blu con taglio senza cornice Occhiali da taglio con diamanti Occhiali senza montatura Occhiali da lettura per donna Uomo Grado completo +1 +1,5 +2 +2,5 +3 +3,5 +4",New Frameless Cut-edge Anti-bluelight Reading Glasses Diamond Trimming Glasses Frameless Glasses Reading Glasses for Women Men Full Degree +1 +1.5 +2 +2.5 +3 +3.5 +4,3.0,CHF,3.0,CHF,3,1000,,,4.422459893048129,187.0,128,29,19,3,8,,,,,,black,+0,50,Livraison standard,1.0,false,,50,,,CN,joqygskvm,joqygskvm,93% feedback positivi (292 recensioni),292,4.424657534246576,5f6ef72f02ab06f593d17cbe,,,https://www.wish.com/c/5fbcae8b316d1a95fc298bff,https://canary.contestimg.wish.com/api/webimage/5fbcae8b316d1a95fc298bff-medium.jpg,5fbcae8b316d1a95fc298bff
Tischdecke Leinen und Baumwolle Lace Edge Rechteckige Tischdecke Home Hotel Textile Daisy Flower Pattern,Tablecloth Linen and Cotton Lace Edge Rectangular Table Cloth Home Hotel Textile Daisy Flower Pattern ,15.0,CHF,15.0,CHF,16,10,,,4.5,26.0,20,3,1,0,2,,,,,,,140x140cm,50,Livraison standard,4.0,false,,50,,,CN,Value Time,valuetime,"91% Positives Feedback (1,897 Bewertungen)",1897,4.28887717448603,5958548a146110422276ad16,,,https://www.wish.com/c/5c24e82e95febe22a7127769,https://canary.contestimg.wish.com/api/webimage/5c24e82e95febe22a7127769-medium.jpg,5c24e82e95febe22a7127769
ZOTAC Gaming GeForce RTX 3060 TWIN Edge OC 12GB,ZOTAC Gaming GeForce RTX 3060 TWIN Edge OC 12GB,1221.0,EUR,1221.0,EUR,1480.0,0,,,5.0,0.0,,,,,,,,,,,,,50,Livraison standard,12.0,false,,50,,,KR,DAESE01,daese01,66 % avis positifs (110 notes),110,3.390909090909091,5ed762f3f4010f0bc3876499,,,https://www.wish.com/c/606d0f8f9f4c4e004414a786,https://canary.contestimg.wish.com/api/webimage/606d0f8f9f4c4e004414a786-medium.jpg,606d0f8f9f4c4e004414a786
8cm/10cm*10m Transparent Clear Mousse Surrounding Edge Wrapping Tape Baking Cake Dessert Collar DIY Cake Decorating Tools Hard Bound Cake Edges Baking Tools,8cm/10cm*10m Transparent Clear Mousse Surrounding Edge Wrapping Tape Baking Cake Dessert Collar DIY Cake Decorating Tools Hard Bound Cake Edges Baking Tools,5.14,CHF,6.0,CHF,5.65,1000,,,4.42080378250591,423.0,285,75,35,12,16,,,,,,transparent,8cmby10m,50,Livraison standard,1.0,false,,50,,,CN,yuexinhappy,yuexinhappy,"(11,552 ratings)",11552,4.173649584487535,5d524d0e27752b15183d906e,,,https://www.wish.com/c/5db83d0c1c788609c874c267,https://canary.contestimg.wish.com/api/webimage/5db83d0c1c788609c874c267-medium.jpg,5db83d0c1c788609c874c267
Étui de luxe en cuir pour Xiaomi Redmi 7 6 6 6A 5 Note 7 6 pour iPhone XS Max XR X 8 7 6 6 6S Plus pour Samsung Galaxy S10 Plus S10e S10e S10 5G S9 S8 Plus S7 Edge A6 A7 A8 Plus 2018 A10 A20 A30 A50 M10 pour Huawei P30 Pro P30 Lite P20 P20 Pro P20 Lite Nova 2i 3e 4e Phone Case avec Card Slot,Luxury Retro Flip Wallet Leather Case for Xiaomi Redmi 7 6 6A 5 Note 7 6 for iPhone XS Max XR X 8 7 6 6S Plus for Samsung Galaxy S10 Plus S10e S10 5G S9 S8 Plus S7 Edge A6 A7 A8 Plus 2018 A10 A20 A30 A50 M10 for Huawei P30 P30 Pro P30 Lite P20 P20 Pro P20 Lite Nova 2i 3e 4e Phone Case with Card Slot,7.0,CHF,24.0,CHF,7,10000,,,4.555607476635514,2140.0,1567,362,110,35,66,,,,,,rosered,iphone5,50,Livraison standard,2.0,false,,50,,,CN,Ebaby shop,yousuka,"(7,219 notes)",7219,4.471810500069262,5aad2f1fc1d5185027eb5dc9,,,https://www.wish.com/c/5cb728dfa94960126d90144b,https://canary.contestimg.wish.com/api/webimage/5cb728dfa94960126d90144b-medium.jpg,5cb728dfa94960126d90144b
2 PCS Protecteur d'écran en verre trempé à couverture complète pour Motorola Moto G9 G8 G7 G6 Power Plus Play / E7 E6s E6 E5 2020 Edge Play Plus Z4 Z3 Play / G Fast Stylus / One Fusion Plus Film de verre d'action Hyper Marco,2 PCS Full Coverage Tempered Glass Screen Protector For Motorola Moto G9 G8 G7 G6 Power Plus Play / E7 E6s E6 E5 2020 Edge Play Plus Z4 Z3 Play /G Fast Stylus / One Fusion Plus Hyper Marco Action Glass Film,5.0,CHF,5.0,CHF,5,10,,,4.653846153846154,26.0,21,3,0,2,0,,,,,,black,motog9plus(2pcs),16,Livraison standard,2.0,false,,50,,,CN,cute Angel,cuteangel,"90 % avis positifs (1,714 notes)",1714,4.279463243873979,57dfba9b934597103597bd70,,,https://www.wish.com/c/5f8fe71abd52e1004f766b65,https://canary.contestimg.wish.com/api/webimage/5f8fe71abd52e1004f766b65-medium.jpg,5f8fe71abd52e1004f766b65
"6,0 pouces moins cher Meisha professionnel ciseaux de toilettage pour animaux de compagnie ensemble ciseaux pour animaux de compagnie JP440C ciseaux de coupe ciseaux pour chiens courbés ciseaux à bord tranchant, HB0006","6.0Inch Cheaper Meisha Professional Pet Grooming Scissors Set Pet Scissors JP440C Cutting Scissors Curved Dog Shears Sharp Edge Scissors,HB0006",9.0,CHF,46.0,CHF,9,10,,,5.0,1.0,1,0,0,0,0,,,,,,silver,6.0inchupcurvedcuttingscissorsnobag,50,Livraison standard,3.0,false,,50,true,Quantité limitée !,CN,Meisha2016,meisha2016,"94 % avis positifs (1,781 notes)",1781,4.445816956765862,5835bb9511a2a0247fd07296,,,https://www.wish.com/c/591acb51e20f702c645a68b4,https://canary.contestimg.wish.com/api/webimage/591acb51e20f702c645a68b4-medium.jpg,591acb51e20f702c645a68b4
Coque de protection complète de luxe 360 pour iPhone 12 Pro Max XR XS X iPhone 8 Plus 7 6 6S Plus / Samsung Galaxy S20 S10 S9 S8 Plus S7 S6 Edge Note 10 9 8 Pro A10 A10S A20 A30 A40 A50 A60 A70 M30 M20 A6 A8 A9 A7 2018 / Huawei P30 P20 Pro Lite avec film en verre trempé gratuit,Luxury 360 Full Protection Phone Case for iPhone 12 Pro Max XR XS X iPhone 8 Plus 7 6 6S Plus  / Samsung Galaxy S20 S10 S9 S8 Plus S7 S6 Edge Note 10 9 8 Pro A10 A10S A20 A30 A40 A50 A60 A70 M30 M20  A6 A8 A9 A7 2018 / Huawei P30 P20 Pro Lite with Free Tempered Glass Film,2.0,CHF,2.0,CHF,2,1000,,,3.6485355648535567,239.0,116,35,25,14,49,,,,,,purple,samsunggalaxym20,50,Livraison standard,1,false,,50,,,CN,Haodonerwll,haodonerwll,(339 notes),339,4.147492625368732,5dafc6e0b7ddb40a7d6037ac,,,https://www.wish.com/c/5fdf16712e9113be43769827,https://canary.contestimg.wish.com/api/webimage/5fdf16712e9113be43769827-medium.jpg,5fdf16712e9113be43769827
NORTH EDGE hommes montre numérique hommes montres de sport double temps podomètre réveil étanche 50 M montre numérique horloge militaire,NORTH EDGE Men Digital Watch Men's Sports Watches Dual Time Pedometer Alarm Clock Waterproof 50M Digital Watch Military Clock,25.0,CHF,25.0,CHF,27,10,,,4.5,18.0,13,3,1,0,1,,,,,,yellow,,50,Livraison standard,8.0,false,,50,true,Quantité limitée !,CN,NORTH EDGE Official Store est un vendeur agréé,northedgeofficialstore,89 % avis positifs (113 notes),113,4.31858407079646,5fa3e96c771e968d66bbeeda,,,https://www.wish.com/c/5fad3a9df22c716b266b2f99,https://canary.contestimg.wish.com/api/webimage/5fad3a9df22c716b266b2f99-medium.jpg,5fad3a9df22c716b266b2f99
