title,title_orig,discount_price,discount_price_currency,retail_price,retail_price_currency,discount_price_in_original_currency,nb_cart_orders_approx,nb_units_purchased_approx,uses_ad_boosts,rating,rating_count,rating_five_count,rating_four_count,rating_three_count,rating_two_count,rating_one_count,badges_count,badge_local_product,badge_product_quality,badge_fast_shipping,tags,product_color,product_variation_size_id,product_variation_inventory,shipping_option_name,shipping_option_price,shipping_is_express,countries_shipped_to,inventory_total,has_urgency_banner,urgency_text,origin_country,merchant_title,merchant_name,merchant_info_subtitle,merchant_rating_count,merchant_rating,merchant_id,merchant_has_profile_picture,merchant_profile_picture,product_url,product_picture,product_id
"Vous le méritez vraiment, humidificateur à four de lampe de parfum d'huile de 5ML / 10ML de plantes de fruit d'huiles essentielles solubles dans l'eau","You definitely deserve it,5ML/10ML Fruit Plant Essential Oils Water Soluble Oil Fragrance Lamp Furnace Humidifier",3.84,EUR,10.0,EUR,4.66,10000,,,3.81203007518797,1064.0,544,154,148,58,160,,,,,,,lavender-10ml,50,Livraison standard,1.0,false,,50,true,Quantité limitée !,CN,guangdong simei,guangdongsimei,"88 % avis positifs (3,317 notes)",3317,4.206210431112451,5adc9141b9605f65934eee9d,,,https://www.wish.com/c/5d07660b3cfc757885828492,https://canary.contestimg.wish.com/api/webimage/5d07660b3cfc757885828492-medium.jpg,5d07660b3cfc757885828492
4 pièces japonais et coréen Style paille de blé cuillère baguettes bol plat assiette maison Suite Anti chute isolation thermique vaisselle en plastique,4 Pcs Japanese and Korea Style Wheat Straw Spoon Chopsticks Bowl Dish Plate Home Suite Anti Falling Heat Insulation Plastic Tableware,3.93,EUR,4.0,EUR,4.76,10,,,4.636363636363637,11.0,8,2,1,0,0,,,,,,,spoon-4pcs,50,Livraison standard,1.0,false,,50,,,CN,jianyun3,jianyun3,96 % avis positifs (85 notes),85,4.529411764705882,5e7304d5ba53ce4cb9b6b430,,,https://www.wish.com/c/5f1a796e73aa6e053ad54116,https://canary.contestimg.wish.com/api/webimage/5f1a796e73aa6e053ad54116-medium.jpg,5f1a796e73aa6e053ad54116
Yoda à ma femme je tombe toujours pour vous tous les jours affiche Yoda affiche femme affiche cadeau spécial pour femme horizontal toile / papier affiche sans cadre pleine taille,Yoda To My Wife I Still Fall For You Every Day Poster Yoda Poster Wife Poster Special Gift For Wife Horizontal Wrapped Canvas/ Paper Poster Without Framed Full Size,23.0,EUR,23.0,EUR,27,10,,,4.7272727272727275,11.0,10,0,0,1,0,,,,,,,posternoframe11''x17'',50,Livraison standard,7.0,false,,50,true,Quantité limitée !,VN,omyg,omyg,92 % avis positifs (545 notes),545,4.388990825688073,5f3c9e0e5d39de6847ec6318,,,https://www.wish.com/c/5f482544a6d5d617ebc6ef1b,https://canary.contestimg.wish.com/api/webimage/5f482544a6d5d617ebc6ef1b-medium.jpg,5f482544a6d5d617ebc6ef1b
Game Of Thrones,,,,,,,,,,,,,,,,,,,,,,,,,,,,,,,,,,,,,,,,,https://www.wish.com/c/5e8d300e9719ed6404967819,,5e8d300e9719ed6404967819
Sexy Dames Dentelle Floral Moulante Strap Débardeur Gilet Chemise Chemisier Sans Manches Femmes Casual Strappy Cami NOUVEAU S M L XL,Sexy Ladies Lace Floral Bodycon Strap Tank Top Vest Shirt Blouse Sleeveless Women Casual Strappy Cami NEW S M L XL,8.0,EUR,8.0,EUR,9,10000,,,3.8468468468468466,2553.0,1202,455,450,195,251,,,,,,black,s.,50,Livraison standard,3.0,false,,50,,,CN,Zakra,zakra,"90 % avis positifs (169,442 notes)",169442,4.237756872558162,572b246e3ad3b35922faa906,,,https://www.wish.com/c/58a556e40e010d7471b4c0fe,https://canary.contestimg.wish.com/api/webimage/58a556e40e010d7471b4c0fe-medium.jpg,58a556e40e010d7471b4c0fe
Scooby Doo | Taie d'oreiller classique Pose,Scooby Doo | Classic Pose Throw Pillow case,6.0,EUR,43.0,EUR,7,10,,,4.666666666666667,9.0,7,1,1,0,0,,,,,,,"16""by16""",50,Livraison standard,2.0,false,,50,,,CN,Share Beauty,sharebeauty,97 % avis positifs (199 notes),199,4.597989949748744,584a34d24f2cf94cbae062d5,,,https://www.wish.com/c/58d0cf57b59dc46d48f20b24,https://canary.contestimg.wish.com/api/webimage/58d0cf57b59dc46d48f20b24-medium.jpg,58d0cf57b59dc46d48f20b24
New England Patriots,,,,,,,,,,,,,,,,,,,,,,,,,,,,,,,,,,,,,,,,,https://www.wish.com/c/5e542cfb9719ed19e8484868,,5e542cfb9719ed19e8484868
Plus Size S-6XL Femmes Automne Hiver Femme Chemises décontractées Col rond Manches longues Tops Femme Mode Mode Parchemin irrégulier Chemisier Chemisier Sweatshirts T-shirts amples en coton,Plus Size S-6XL Women Autumn Winter Casual Shirts Round Neck Long Sleeve Tops Ladies Fashion Irregular Parchwork Blouse Sweatshirts Loose Cotton T-shirts,5.0,EUR,5.0,EUR,6,10000,,,3.6466011466011468,2442.0,977,486,421,255,303,,,,,,armygreen,xs,5,Livraison standard,2.0,false,,50,true,Quantité limitée !,CN,superheros,superheros,"88 % avis positifs (10,874 notes)",10874,4.101802464594446,57aeb5fb5a4ac218de83b64d,,,https://www.wish.com/c/5bc6fc93f24c4b57f4a38c2d,https://canary.contestimg.wish.com/api/webimage/5bc6fc93f24c4b57f4a38c2d-medium.jpg,5bc6fc93f24c4b57f4a38c2d
NOUVEAU Housse de protection semi-enveloppée en plastique coloré pour Sony Xperia 5 5 II 10 10 II 1 1 II / Xperia XA2 Ultra XA2 XA1 XA1 Plus Ultra étui texturé mat dur antidérapant pour Xperia L4 L3 L2 L1 / E5 Z5 Premium Compact Housse Coque Funda Shell,NEW Colorful Plastic half-wrapped Protection cover For Sony Xperia 5  5 II 10 10 II 1 1 II /Xperia XA2 Ultra XA2 XA1 XA1 Plus Ultra Non-Slip Anti-Fall Hard Matte Textured  Case For Xperia L4 L3 L2 L1 /  E5 Z5 Premium Compact Cover Coque Funda Shell,2.19,EUR,3.0,EUR,2.65,10,,,4.469387755102041,49.0,32,12,3,0,2,,,,,,red,xperiac5ultra,13,Livraison standard,1,false,,50,,,VE,Pasta con caraota,pastaconcaraota,"91 % avis positifs (1,661 notes)",1661,4.375075255869958,5d937084ce58d054c0606d50,,,https://www.wish.com/c/5f6ae6492c81d910d3510534,https://canary.contestimg.wish.com/api/webimage/5f6ae6492c81d910d3510534-medium.jpg,5f6ae6492c81d910d3510534
10 Heads Peony Bouquet Artificial Plant DIY Autumn Fake Tea Rose Silk Flower Fall Artificial Plastic Flower for Wedding Home Accessories Decoration Room Decor,10 Heads Peony Bouquet Artificial Plant DIY Autumn Fake Tea Rose Silk Flower Fall Artificial Plastic Flower for Wedding Home Accessories Decoration Room Decor,3.18,EUR,4.0,EUR,3.86,10,,,5.0,1.0,1,0,0,0,0,,,,,,purple,1piece,50,Livraison standard,1.0,false,,50,,,CN,hngcyouth0131,hngcyouth0131,93 % avis positifs (130 notes),130,4.3307692307692305,5a1e81f1471c1423fbdb1b9a,,,https://www.wish.com/c/6055b90b96983f7474cb4806,https://canary.contestimg.wish.com/api/webimage/6055b90b96983f7474cb4806-medium.jpg,6055b90b96983f7474cb4806
18 * 18in arc-en-ciel taie d'oreiller housse de coussin coloré géométrique polyester jet oreillers pour lits coussin,18*18in Rainbow Pillow Case Cushion Cover Colorful Geometric Polyester Throw Pillows for Beds Cushion,3.14,EUR,46.0,EUR,3.81,10,,,4.5,10.0,8,1,0,0,1,,,,,,,1,3,Livraison standard,1.0,false,,50,,,CN,Merrylee,merrylee,"90 % avis positifs (3,574 notes)",3574,4.240906547285954,5d3e5d67ab0c797f4da594cd,,,https://www.wish.com/c/5e97cb93f3ff9c25dcc00f57,https://canary.contestimg.wish.com/api/webimage/5e97cb93f3ff9c25dcc00f57-medium.jpg,5e97cb93f3ff9c25dcc00f57
"Guirlandes d'automne 80/60/40 Leds Thanksgiving Harvest Guirlandes d'automne, Guirlandes d'automne en feuille d'érable (paquet de 2)","80/60/40 Leds Thanksgiving Harvest Fall Garlands String Lights,Fall Maple Leaf String Lights(2Pack)",7.0,EUR,7.0,EUR,8,10,,,4.5,12.0,8,2,2,0,0,,,,,,,20led(2pack),50,Livraison standard,3.0,false,,50,true,Quantité limitée !,CN,HUA SHAO JIA JU,huashaojiaju,"91 % avis positifs (6,796 notes)",6796,4.30562095350206,57dffa0be0de0d1041d8086c,,,https://www.wish.com/c/5d53b011dd0f2f2c77e8d493,https://canary.contestimg.wish.com/api/webimage/5d53b011dd0f2f2c77e8d493-medium.jpg,5d53b011dd0f2f2c77e8d493
Bohème Style Mandala Imprimé Taie d'oreiller Vintage Style Ethnique Housse de Coussin Linge Taie d'oreiller Pour La Décoration Intérieure,Bohemian Style Mandala Printed Pillow Cover Vintage Ethnic Style Cushion Cover Linen Pillow Case For Home Decor,5.0,EUR,5.0,EUR,6,1000,,,3.825503355704698,149.0,73,31,12,12,21,,,,,,,3,50,Livraison standard,2.0,false,,50,,,CN,Brother Compay Store,brothercompaystore,"94 % avis positifs (8,059 notes)",8059,4.470405757538156,587f439835f0c94cee08a7f1,,,https://www.wish.com/c/589988ea368392519c2697ad,https://canary.contestimg.wish.com/api/webimage/589988ea368392519c2697ad-medium.jpg,589988ea368392519c2697ad
2.5 M Guirlande Suspendue Automne Rose Artificielle Fleurs Décoratives Soie Rose Fleur De Mariage Événements Décor À La Maison,2.5M Hanging Garland Fall Rose Artificial Decorative Flowers Silk Rose Flower Wedding Events Home Decor,7.0,EUR,7.0,EUR,8,5000,,,4.005780346820809,865.0,465,149,122,49,80,,,,,,,type1,50,Livraison standard,7.0,false,,50,,,CN,coolucky,coolucky,"94 % avis positifs (23,115 notes)",23115,4.449232100367727,5b9b64023ee9cf383059fbe6,,,https://www.wish.com/c/5ba1e714e8829f2de5bebe38,https://canary.contestimg.wish.com/api/webimage/5ba1e714e8829f2de5bebe38-medium.jpg,5ba1e714e8829f2de5bebe38
Classic Home Decoration Art Yellow Gray Geometric Cotton Printed Sofa & Car Bed Chair Couch Waist Cushion Cover Bedroom Office Seat Scandinavia Style Bedding Decor Throw Pillow Case,Classic Home Decoration Art Yellow Gray Geometric Cotton Printed Sofa & Car Bed Chair Couch Waist Cushion Cover Bedroom Office Seat Scandinavia Style Bedding Decor Throw Pillow Case,4.69,EUR,5.0,EUR,5.6899999999999995,1000,,,4.245901639344262,183.0,116,31,14,9,13,,,,,,multicolor,b,50,Livraison standard,2.0,false,,50,,,CN,Super Store 007,superstore007,"92% Positive Feedback (29,094 ratings)",29094,4.3414793428198255,57f34ffad090557554c4cede,,,https://www.wish.com/c/5945ec4e561b9970a0d56346,https://canary.contestimg.wish.com/api/webimage/5945ec4e561b9970a0d56346-medium.jpg,5945ec4e561b9970a0d56346
Automne nouvelle mode Cool Anime Re: impression 3D zéro hommes et femmes col rond sweats à capuche hauts amoureux chemises sweatshirts,Fall New Fashion Cool Anime Re:Zero 3D Printing Men's and Women's Round Neck Hoodies Tops Lovers Shirts Sweatshirts,13.0,EUR,13.0,EUR,15,10,,,5.0,2.0,2,0,0,0,0,,,,,,white,xs,50,Livraison standard,4.0,false,,50,,,CN,hufirneuwed,hufirneuwed,89 % avis positifs (63 notes),63,4.253968253968254,5e8e8a68b63f8232ecd5c6b4,,,https://www.wish.com/c/5f8795ff6eaf6800483eb71e,https://canary.contestimg.wish.com/api/webimage/5f8795ff6eaf6800483eb71e-medium.jpg,5f8795ff6eaf6800483eb71e
Military Fall Protection Headphone Earphone Case For Apple AirPods 1/2 Pro Cover Bluetooth Wireless Charging Shockproof Shell,Military Fall Protection Headphone Earphone Case For Apple AirPods 1/2 Pro Cover Bluetooth Wireless Charging Shockproof Shell,12.0,EUR,12.0,EUR,14,5,,,5.0,0.0,,,,,,,,,,,gold,unitedstates,50,Livraison standard,4.0,false,,50,,,CA,11368796 CANADA CORPORATION,11368796canadacorporation,"80 % avis positifs (1,166 notes)",1166,3.9382504288164664,5ffb1f43fa8a25c707537989,,,https://www.wish.com/c/6004400a1f062ed2faaa332b,https://canary.contestimg.wish.com/api/webimage/6004400a1f062ed2faaa332b-medium.jpg,6004400a1f062ed2faaa332b
Emoji,,,,,,,,,,,,,,,,,,,,,,,,,,,,,,,,,,,,,,,,,https://www.wish.com/c/5e8d30199719ed6404967867,,5e8d30199719ed6404967867
Nouvelle mode féminine Vintage Sanderson Sisters Drôle Hocus Pocus Halloween Chemise d'automne,New Women's Fashion Vintage Sanderson Sisters Funny Hocus Pocus Halloween Fall Shirt,10.0,EUR,24.0,EUR,11,1000,,,3.6420118343195265,338.0,142,64,56,21,55,,,,,,red,xs,50,Livraison standard,3.0,false,,50,,,CN,XUCHUNQINGfind,xuchunqingfind,"87 % avis positifs (7,605 notes)",7605,4.1008547008547005,5c7f702fd7e44b29c1d8b338,,,https://www.wish.com/c/5d8ed8eb27ffc12ad63d3938,https://canary.contestimg.wish.com/api/webimage/5d8ed8eb27ffc12ad63d3938-medium.jpg,5d8ed8eb27ffc12ad63d3938
"New Twinkle Star Meteor Shower Rain Lights, 30cm 8 Tubes 384 LED Falling Raindrop Fairy String Light, Waterproof Plug in Icicle Lights Outdoor for Halloween Christmas Holiday Party Patio Decor","New Twinkle Star Meteor Shower Rain Lights, 30cm 8 Tubes 384 LED Falling Raindrop Fairy String Light, Waterproof Plug in Icicle Lights Outdoor for Halloween Christmas Holiday Party Patio Decor",7.0,EUR,7.0,EUR,8,10,,,5.0,0.0,,,,,,,,,,,multicolor,10cm(batterybox),3,Livraison standard,3.0,false,,50,,,US,AdrianBingsNmZsK,adrianbingsnmzsk,100 % avis positifs (5 notes),5,4.4,5e8d85b3e46f01dd84dafed8,,,https://www.wish.com/c/6049724a509f1134c06cd1f1,https://canary.contestimg.wish.com/api/webimage/6049724a509f1134c06cd1f1-medium.jpg,6049724a509f1134c06cd1f1
Blue Sea Animals Turtle Octopus Jellyfish Pattern Cotton Linen Throw Pillow Decorative Sofa Bedding Square Cushion Cover Living Room Bedroom Decor Pillow Case,Blue Sea Animals Turtle Octopus Jellyfish Pattern Cotton Linen Throw Pillow Decorative Sofa Bedding Square Cushion Cover Living Room Bedroom Decor Pillow Case,4.76,EUR,5.0,EUR,5.77,10,,,4.583333333333333,12.0,10,1,0,0,1,,,,,,,1,50,Livraison standard,2.0,false,,50,,,CN,XunYuStores,xunyustores,"95% Positive Feedback (10,291 ratings)",10291,4.485667087746575,580ee4113874c8329821a3e5,,,https://www.wish.com/c/5998f5f4f191a3268ec3f356,https://canary.contestimg.wish.com/api/webimage/5998f5f4f191a3268ec3f356-medium.jpg,5998f5f4f191a3268ec3f356
2018 Automne et Hiver Nouvelle Manches Chauve-Souris Grande Taille Longue Tricot Cardigan Pull Femmes Veste,2018 Autumn and Winter New Bat Sleeve Large Size Long Knit Cardigan Sweater Women's Jacket,14.0,EUR,14.0,EUR,16,20000,,,3.7427466150870408,2068.0,948,381,287,163,289,,,,,,green,xs,50,Livraison Express,9.0,true,,50,,,CN,lilu520,lilu520,"(1,918 notes)",1918,4.005213764337852,5b582878ae8a9b3ec0cadc23,,,https://www.wish.com/c/5b721e39ff07e11f9f350b65,https://canary.contestimg.wish.com/api/webimage/5b721e39ff07e11f9f350b65-medium.jpg,5b721e39ff07e11f9f350b65
Corde de sécurité extérieure corde d'escalade corde d'escalade corde d'escalade survie équipement de corde de protection contre les chutes,Outdoor safety rope climbing cycle sling rope climbing rope survival fall protection rope equipment,10.0,EUR,10.0,EUR,11,10,,,4.75,8.0,6,2,0,0,0,,,,,,red,60cm,50,Livraison standard,3.0,false,,50,,,CN,Caffeboom,caffeboom,"92 % avis positifs (2,649 notes)",2649,4.314835787089468,59896db08696be45fbc17f01,,,https://www.wish.com/c/5dd7956e3ef0b2c0436d58de,https://canary.contestimg.wish.com/api/webimage/5dd7956e3ef0b2c0436d58de-medium.jpg,5dd7956e3ef0b2c0436d58de
 Femmes Dames OL Bureau Chemises À Manches Longues Col En V À Volants À Manches Évasées Tops Chic Blouse Plus, Womens Ladies OL Office Shirts Long Sleeve V Neck Ruffled Flared Sleeve Tops Chic Blouse Plus,15.0,EUR,19.0,EUR,17,1000,,,4.249307479224377,361.0,225,63,33,18,22,,,,,,black,s,25,Livraison Express,6.0,true,,50,,,CN,mybigbiggirl,bigbiggirlwish,"90 % avis positifs (39,659 notes)",39659,4.2320280390327545,54d2e34f7f3c16120e8c0277,,,https://www.wish.com/c/5e69b588e2d5f4301bb03e00,https://canary.contestimg.wish.com/api/webimage/5e69b588e2d5f4301bb03e00-medium.jpg,5e69b588e2d5f4301bb03e00
Femmes Casual Hiver Épaississement À Manches Longues Mode Cachemire Veste Cardigan Manteau Tricoté Manteau,Women Casual Winter Thickening Long Sleeve Fashion Cashmere Jacket Cardigan Coat Knitted Coat,12.0,EUR,12.0,EUR,14,10000,,,3.978166695546699,5771.0,2812,1293,840,380,446,,,,,,grey,xxs,4,Livraison standard,3.0,false,,50,,,CN,Fuzhou excellent Trading Company,fuzhouexcellenttradingcompany,"86 % avis positifs (11,699 notes)",11699,4.027865629540987,576fcff40825917571f60809,,,https://www.wish.com/c/5846424c764f480dcfa761f8,https://canary.contestimg.wish.com/api/webimage/5846424c764f480dcfa761f8-medium.jpg,5846424c764f480dcfa761f8
Jeu de société d'automne de Teenage Mutant Ninja Turtles City,Teenage Mutant Ninja Turtles City Fall Board Game,149.0,EUR,149.0,EUR,180.0,0,,,5.0,0.0,,,,,,,,,,,,,3,Livraison standard,12.0,false,,3,,,AU,LatestBuy,latestbuy,93 % avis positifs (777 notes),777,4.543114543114543,5e6b5cb88d68d28867a06b9d,,,https://www.wish.com/c/5f6d849e13100210bb5f5afa,https://canary.contestimg.wish.com/api/webimage/5f6d849e13100210bb5f5afa-medium.jpg,5f6d849e13100210bb5f5afa
Masterpan,,,,,,,,,,,,,,,,,,,,,,,,,,,,,,,,,,,,,,,,,https://www.wish.com/c/5e8d302a9719ed64049678cf,,5e8d302a9719ed64049678cf
2021 Date DC Imprimé Femmes Survêtements À Manches Longues Zipper À Capuche Costume Deux Pièces Ensemble Sportsuit Jogging Costume,2021 Newest DC Printed Women Tracksuits Long Sleeve Zipper Hooded Suit Two Piece Set Sportsuit Jogging Suit,20.0,EUR,20.0,EUR,24,10,,,3.5357142857142856,28.0,12,4,5,1,6,,,,,,grey,s,50,Livraison standard,6.0,false,,50,,,CN,rongshitingshang,rongshitingshang,85 % avis positifs (60 notes),60,4.0,5edf537ee9933279c453d896,,,https://www.wish.com/c/5f51d885b957980cead2fcfa,https://canary.contestimg.wish.com/api/webimage/5f51d885b957980cead2fcfa-medium.jpg,5f51d885b957980cead2fcfa
Sac de rangement pour fil à tricoter Étui Crochets Crochet Kits de couture de fil Sacs organisateur,Knitting Yarn Storage Bag Case Crochet Hooks Thread Sewing Kits Organizer Bags,13.0,EUR,13.0,EUR,15,10,,,4.75,8.0,6,2,0,0,0,,,,,,,og,50,Livraison Express,10.0,true,,50,,,US,Nastasia,nastasia,89 % avis positifs (56 notes),56,4.321428571428571,5f727833f880630cc45a7120,,,https://www.wish.com/c/5fdaf7e14a09a6e1ac32d51e,https://canary.contestimg.wish.com/api/webimage/5fdaf7e14a09a6e1ac32d51e-medium.jpg,5fdaf7e14a09a6e1ac32d51e
Femmes Mode Perles Crochet Dentelle Évider T-shirt À Manches Longues Automne Hiver Slim Tops,Women Fashion Beading Crochet Lace Hollow-out Long Sleeve T Shirt Fall Winter Slim Tops,8.0,EUR,8.0,EUR,9,1000,,,4.091176470588235,680.0,386,124,75,36,59,,,,,,yellow,xxs,28,Livraison standard,3.0,false,,50,,,CN,SZLTHT999,szltht999,"88 % avis positifs (69,063 notes)",69063,4.103861691499066,55542b4b662da7114d591723,,,https://www.wish.com/c/5d63799a09b6274e71f0410e,https://canary.contestimg.wish.com/api/webimage/5d63799a09b6274e71f0410e-medium.jpg,5d63799a09b6274e71f0410e
Sons Of Anarchy,,,,,,,,,,,,,,,,,,,,,,,,,,,,,,,,,,,,,,,,,https://www.wish.com/c/5e8d30289719ed64049678be,,5e8d30289719ed64049678be
10/20 pcs Pile De Bois Nom Place Titulaires de la Carte De Mariage Photo Clip Home Party Table Décor,10/20pcs Wood Pile Name Place Card Holders Wedding Photo Clip Home Party Table Decor,5.0,EUR,50.0,EUR,6,1000,,,4.424581005586592,179.0,125,25,15,8,6,,,,,,,10pcs,50,Livraison standard,2.0,false,,50,true,Quantité limitée !,CN,yiwulanshifushiyouxiangongsi,义乌岚诗服饰有限公司,"94 % avis positifs (30,280 notes)",30280,4.459015852047556,556d66e09fb8ca1a0b4d8213,,,https://www.wish.com/c/5dd361377f7f2a605e3f7a98,https://canary.contestimg.wish.com/api/webimage/5dd361377f7f2a605e3f7a98-medium.jpg,5dd361377f7f2a605e3f7a98
ZANZEA Dames À Manches Longues Col Rond Automne Irrégularité Ourlet Chemise Chemisier Chemises Décontractées Tops M-5XL,ZANZEA Ladies Long Sleeve Round Neck Autumn Irregularity Hem Shirt Blouse Casual Shirts Tops M-5XL,12.0,EUR,12.0,EUR,14,1000,,,4.069277108433735,332.0,179,70,39,15,29,,,,,,white,m,50,Livraison standard,3.0,false,,50,,,CN,balabobo,balabobo,"(18,274 notes)",18274,4.159242639816132,5898240369b8584f668a188b,,,https://www.wish.com/c/5e05f2fe6c78dd002d557389,https://canary.contestimg.wish.com/api/webimage/5e05f2fe6c78dd002d557389-medium.jpg,5e05f2fe6c78dd002d557389
Coque de téléphone pour iPhone 6 6S 7 8 Plus 11 12 Mini X XS XR SE PRO MAX 2020 antichoc Anti-chute mat Transparent couleur bonbon couverture,Phone Case For iPhone 6 6S 7 8 Plus 11 12 Mini X XS XR SE PRO MAX 2020 Shockproof Anti-Fall Matte Transparent Candy Color Cover,2.3,EUR,3.0,EUR,2.79,10,,,4.583333333333333,12.0,10,1,0,0,1,,,,,,pink,iphone6,50,Livraison standard,1,false,,50,,,CN,junreny,junreny,(45 notes),45,4.555555555555555,601b58bd2f6b051627816d67,,,https://www.wish.com/c/602ba2a756f7aa81c5682a04,https://canary.contestimg.wish.com/api/webimage/602ba2a756f7aa81c5682a04-medium.jpg,602ba2a756f7aa81c5682a04
Femme Oxford imperméable à l'eau version mise à niveau Cosmetic Case Beauty Brush Organizer Makeup Sac de maquillage,Female Oxford Waterproof Upgraded Version Cosmetic Case Beauty Brush Organizer Makeup Bag,15.0,EUR,65.0,EUR,18,10000,,,4.483722871452421,2396.0,1709,379,162,50,96,,,,,,black,minitwolayers25.5x23x9cm,50,Livraison standard,5.0,false,,50,,,CN,xiayuanyuan,xiayuanyuan,"93 % avis positifs (4,659 notes)",4659,4.4301352221506765,5980949721187f108e43c843,,,https://www.wish.com/c/5a2ddb56f718e00dd48a2a61,https://canary.contestimg.wish.com/api/webimage/5a2ddb56f718e00dd48a2a61-medium.jpg,5a2ddb56f718e00dd48a2a61
1pc Taie d'Oreiller Géométrique en Polyester Couvre Coussin de Taille Couvre Coussin Déco Décoration Maison,1pc Geometric Polyester Pillow Case Waist Throw Cushion Cover Home Decor,4.0,EUR,4.0,EUR,4,5000,,,4.405797101449275,828.0,562,137,70,21,38,,,,,,,1,50,Livraison standard,1.0,false,,50,true,Quantité limitée !,CN,1-jiaju-Household articles,1家居householdarticles,"92 % avis positifs (8,411 notes)",8411,4.340030911901082,5752b221ca5f4b5cd8ba21b5,,,https://www.wish.com/c/5c6625ef44f42947ca0f9297,https://canary.contestimg.wish.com/api/webimage/5c6625ef44f42947ca0f9297-medium.jpg,5c6625ef44f42947ca0f9297
Pour Samsung S10 S10Plus S10e S9 S9Plus S8 S8Plus Note8 Note9 Note10 Gradient Verre Trempé Housse de protection pour Huawei P30 P30Lite P30Pro P20 P20Lite P20Pro Mate20Pro Housse anti-chute pour iPhone X Xs Xr Xs Max Etc,For Samsung S10 S10Plus S10e S9 S9Plus S8 S8Plus Note8 Note9 Note10 Gradient Tempered Glass Phone Case For Huawei P30 P30Lite P30Pro P20 P20Lite P20Pro Mate20Pro Anti-fall Cover For iPhone X Xs Xr Xs Max Etc,2.25,EUR,18.0,EUR,2.73,1000,,,4.286140089418778,671.0,425,125,54,22,45,,,,,,red&black,foriphone6/6s,50,Livraison standard,1,false,,50,,,CN,mycase,mycase,"(31,244 notes)",31244,4.356260401997184,552535e767041209bb730258,,,https://www.wish.com/c/5d2057e7d048de7f74ab3cb0,https://canary.contestimg.wish.com/api/webimage/5d2057e7d048de7f74ab3cb0-medium.jpg,5d2057e7d048de7f74ab3cb0
Bosch,,,,,,,,,,,,,,,,,,,,,,,,,,,,,,,,,,,,,,,,,https://www.wish.com/c/5e8d30209719ed640496788e,,5e8d30209719ed640496788e
GEEK LIGHTING,,,,,,,,,,,,,,,,,,,,,,,,,,,,,,,,,,,,,,,,,https://www.wish.com/c/5f8d71d8eb31f9a6cce12c2b,,5f8d71d8eb31f9a6cce12c2b
Hommes Jeans Jeans de moto Riding on the road Jeans automne quatre pièces Protection Dropshipping (,Men Jeans Motorcycle jeans Riding on the road Fall jeans four-piece Protection Dropshipping(,23.0,EUR,569.0,EUR,27,10,,,3.9193548387096775,62.0,30,14,8,3,7,,,,,,black,xs,27,Livraison standard,7.0,false,,50,,,CN,feimingjing,feimingjing,(706 notes),706,3.944759206798867,5ac09b5508a224193328b4f6,,,https://www.wish.com/c/5d16ab5ba1dfe653bcdb5d35,https://canary.contestimg.wish.com/api/webimage/5d16ab5ba1dfe653bcdb5d35-medium.jpg,5d16ab5ba1dfe653bcdb5d35
Printemps automne genou haute bottes militaires hommes en cuir artificiel bottes de moto hommes genou haute en cuir bottes équitation armée chaussures,Spring Fall  Knee High Military Boots Men Artificial Leather Motorcycle Boots Mens Knee High Leather Boots Riding Army Shoes,35.0,EUR,67.0,EUR,42,10,,,4.68,25.0,19,4,2,0,0,,,,,,black,36,50,Livraison standard,12.0,false,,50,,,CN,yuanbo0716,yuanbo0716,"93 % avis positifs (1,490 notes)",1490,4.415436241610738,5944b621e81e8a0fc8279592,,,https://www.wish.com/c/5e79d2814d059724c0b07bbd,https://canary.contestimg.wish.com/api/webimage/5e79d2814d059724c0b07bbd-medium.jpg,5e79d2814d059724c0b07bbd
"Guirlande de guirlandes d'automne de récolte de Thanksgiving, guirlandes de feuille d'érable d'automne","Thanksgiving Harvest Fall Garlands String Lights,Fall Maple Leaf String Lights",5.0,EUR,5.0,EUR,6,10000,,,4.550127442650807,2354.0,1681,416,175,35,47,,,,,,,10leds,50,Livraison standard,2.0,false,,50,,,CN,Baby002 est un vendeur agréé,baby002,"88 % avis positifs (19,169 notes)",19169,4.160050080859722,59e6b8dfef7b890d5a1643ba,,,https://www.wish.com/c/5bbedfe5d4534716f07d5151,https://canary.contestimg.wish.com/api/webimage/5bbedfe5d4534716f07d5151-medium.jpg,5bbedfe5d4534716f07d5151
Coca-Cola,,,,,,,,,,,,,,,,,,,,,,,,,,,,,,,,,,,,,,,,,https://www.wish.com/c/5f3bb4ffeb31f9e234cf1392,,5f3bb4ffeb31f9e234cf1392
Hommes Mode Pantalon Amant Cool Harem Pantalon Street Style Casual Baggy Coton Lin Hakama Pantalon Lâche Pantalon S-XXXXXL,Men Fashion Pants Lover's Cool Harem Pants Street Style Casual Baggy Cotton Linen Hakama Loose Pants Trousers S-XXXXXL,6.0,EUR,81.0,EUR,7,1000,,,3.8789473684210525,190.0,95,31,30,14,20,,,,,,armygreen,xxs,2,Livraison standard,2.0,false,,50,,,CN,Cream cake,creamcake,"87 % avis positifs (6,222 notes)",6222,4.136451301832208,5c245c42f77b855ceb8b834a,,,https://www.wish.com/c/5d5f86c4ed578a09266fab25,https://canary.contestimg.wish.com/api/webimage/5d5f86c4ed578a09266fab25-medium.jpg,5d5f86c4ed578a09266fab25
Étanche hommes suspendus trousse de toilette en Nylon organisateur de voyage sac cosmétique pour femmes grands nécessités trousse de maquillage lavage trousse de maquillage,Waterproof Men Hanging Toiletry Bag Nylon Travel Organizer Cosmetic Bag For Women Large Necessaries Make Up Case Wash Makeup Bag,6.0,EUR,6.0,EUR,7,10,,,4.39622641509434,159.0,105,31,12,3,8,,,,,,black,,50,Livraison standard,2.0,false,,50,,,CN,easy_lucky,easy_lucky,"(230,680 notes)",230680,4.350624241373331,53f6b9901f50630534664625,,,https://www.wish.com/c/5dad29a871c25d00316faa5e,https://canary.contestimg.wish.com/api/webimage/5dad29a871c25d00316faa5e-medium.jpg,5dad29a871c25d00316faa5e
