title,title_orig,discount_price,discount_price_currency,retail_price,retail_price_currency,discount_price_in_original_currency,nb_cart_orders_approx,nb_units_purchased_approx,uses_ad_boosts,rating,rating_count,rating_five_count,rating_four_count,rating_three_count,rating_two_count,rating_one_count,badges_count,badge_local_product,badge_product_quality,badge_fast_shipping,tags,product_color,product_variation_size_id,product_variation_inventory,shipping_option_name,shipping_option_price,shipping_is_express,countries_shipped_to,inventory_total,has_urgency_banner,urgency_text,origin_country,merchant_title,merchant_name,merchant_info_subtitle,merchant_rating_count,merchant_rating,merchant_id,merchant_has_profile_picture,merchant_profile_picture,product_url,product_picture,product_id
Hippie Boho Style Vintage Mandala imprimé housse de coussin Style ethnique canapé housse de coussin salon chambre décor lin taie d'oreiller,Hippie Boho Style Vintage Mandala Printed Pillow Cover Ethnic Style Sofa Cushion Cover Living Room Bedroom Decor Linen Pillow Case,4.76,EUR,5.0,EUR,5.77,10,,,4.235294117647059,17.0,12,2,0,1,2,,,,,,,1,50,Livraison standard,2.0,false,,50,,,CN,yiwushihaohaodianzishangwuyouxiangongsi,义乌市灏灏电子商务有限公司,"92 % avis positifs (32,320 notes)",32320,4.379207920792079,56678c06ccd523268c3d18bc,,,https://www.wish.com/c/5940e303fc876f20d889c640,https://canary.contestimg.wish.com/api/webimage/5940e303fc876f20d889c640-medium.jpg,5940e303fc876f20d889c640
Housse de coussin moutarde jaune géométrique automne automne housse de coussin décoratif,Mustard Pillow Case Yellow Geometric Fall Autumn Cushion Cover  Decorative,4.66,EUR,57.0,EUR,5.65,10,,,5.0,2.0,2,0,0,0,0,,,,,,,a,50,Livraison standard,2.0,false,,50,,,CN,honour house,honourhouse,"87 % avis positifs (1,812 notes)",1812,4.126379690949228,593e481225c4f55bb7e4a54e,,,https://www.wish.com/c/5c5a87d03afcda4aebeefab5,https://canary.contestimg.wish.com/api/webimage/5c5a87d03afcda4aebeefab5-medium.jpg,5c5a87d03afcda4aebeefab5
Hard Case For JBL Charge 3 JBL Imperméable à l'eau sans fil Bluetooth Haut-parleur de stockage portable,Hard Case For JBL Charge 3 Waterproof Wireless Bluetooth Speaker Portable Storage,12.0,EUR,42.0,EUR,14,10000,,,3.502021563342318,1484.0,672,218,144,83,367,,,,,,black,jblcharge3box,50,Livraison standard,3.0,false,,50,,,US,keeptrying363,keeptrying363,"86 % avis positifs (6,388 notes)",6388,4.079367564182843,5a00059e5d6f3414e1dc1024,,,https://www.wish.com/c/5a56b99c2495d4063d9a9c75,https://canary.contestimg.wish.com/api/webimage/5a56b99c2495d4063d9a9c75-medium.jpg,5a56b99c2495d4063d9a9c75
XS-8XL Chemises à la mode de grande taille Vêtements d'automne et d'hiver pour femmes T-shirts décontractés à manches longues Pulls molletonnés à col en V profond Blouses de couleur unie pour femmes T-shirts en coton en vrac,XS-8XL Plus Size Fashion Shirts Autumn and Winter Clothes Women's Casual Long Sleeve Tops Pullover Sweatshirts Deep V-neck Blouses Ladies Solid Color Button Up Loose Cotton T-shirts,4.0,EUR,4.0,EUR,4,1000,,,3.626334519572954,281.0,120,50,41,26,44,,,,,,white,xs,1,Livraison standard,1.0,false,,50,,,SG,Recherche.sg,recherchesg,"(6,123 notes)",6123,3.9500244977951984,5810aa5bde5bf01b645c909e,,,https://www.wish.com/c/5f15398571b21f1279f97615,https://canary.contestimg.wish.com/api/webimage/5f15398571b21f1279f97615-medium.jpg,5f15398571b21f1279f97615
Ugears,,,,,,,,,,,,,,,,,,,,,,,,,,,,,,,,,,,,,,,,,https://www.wish.com/c/5eec9b0aeb31f9cc968f2a68,,5eec9b0aeb31f9cc968f2a68
Nouvelles dames mode décontracté lâche tricoté gland chandail hauts tricots,New Ladies Fashion Casual Loose Knitted Tassel Sweater Tops Knitwear,12.0,EUR,21.0,EUR,14,20000,,,3.5596763317599462,1483.0,560,290,265,156,212,,,,,,khaki,m,50,Livraison standard,4.0,false,,50,true,Quantité limitée !,CN,hotsale201510,hotsale201510,"(41,315 notes)",41315,4.149969744644802,562eeb5541618e0fd77bb502,,,https://www.wish.com/c/5b8f866fe0187a300d2cee52,https://canary.contestimg.wish.com/api/webimage/5b8f866fe0187a300d2cee52-medium.jpg,5b8f866fe0187a300d2cee52
NOUVEAU Support d'aspiration réglable à 360 ° Support de salle de bain Support de ventouse Support de rail de douche Support de curseur universel ABS Support de non-chute Accessoires de salle de bain,NEW 360°Adjustable Suction Bracket Bathroom Bracket Suction cup holder Shower Rail Head Slider Holder Universal ABS Not Fall Off Bracket Bathroom Accessories,6.0,EUR,6.0,EUR,7,10,,,4.318181818181818,22.0,14,4,2,1,1,,,,,,silver,packof1,50,Livraison standard,2.0,false,,50,,,CN,nakupendawewe,nakupendawewe,"95 % avis positifs (16,449 notes)",16449,4.456137151194602,59845f94ec40ae0e50c362ed,,,https://www.wish.com/c/60404e942f440e56acfa66ae,https://canary.contestimg.wish.com/api/webimage/60404e942f440e56acfa66ae-medium.jpg,60404e942f440e56acfa66ae
Chandail confortable à manches longues Boho à manches longues et cardigans chauds en pointelle pour femmes,Women's Boho Long Sleeve Open Front Chunky Warm Cardigans Pointelle Pullover Cozy Sweater,19.0,EUR,19.0,EUR,22,20000,,,3.5012106537530268,7434.0,2645,1516,1329,808,1136,,,,,,winered,s,13,Livraison standard,6.0,false,,50,true,Quantité limitée !,CN,wofu_network_technology,huaracheairfactory,"87 % avis positifs (73,611 notes)",73611,4.003328306910652,547465748edcfa6ceab14f70,,,https://www.wish.com/c/5997eade0f2d083d725a42a5,https://canary.contestimg.wish.com/api/webimage/5997eade0f2d083d725a42a5-medium.jpg,5997eade0f2d083d725a42a5
FiftGuy,,,,,,,,,,,,,,,,,,,,,,,,,,,,,,,,,,,,,,,,,https://www.wish.com/c/5fad16a72dd53c000f648bf0,,5fad16a72dd53c000f648bf0
Vente chaude mandala taie d'oreiller motif de géométrie créative rectangle taie d'oreiller couverture femmes hommes taie d'oreiller garçons filles pleurant saule cas taille 50 * 30 cm,Hot sale mandala pillow case creative geometry pattern  rectangle pillow case cover women men  Pillow case  boys girls weeping willow case size 50*30cm,3.0,EUR,17.0,EUR,3,1000,,,3.7653631284916202,179.0,87,31,19,16,26,,,,,,,1,50,Livraison standard,1.0,false,,50,true,Quantité limitée !,CN,li shuang an,lishuangan,"90 % avis positifs (6,494 notes)",6494,4.289190021558362,5ad2e1392fbbdc5fecae5c6c,,,https://www.wish.com/c/5b559e31760d4016e3234fae,https://canary.contestimg.wish.com/api/webimage/5b559e31760d4016e3234fae-medium.jpg,5b559e31760d4016e3234fae
Boîte de rangement de pilule mensuelle portable non toxique de sécurité 32 grilles compartiment de conception pour tablette pilule support de boîte de médecine étui de rangement de médicaments,Safety Non-toxic Portable Monthly Pill Organizer Box 32 Grids Design Compartment For Tablet Pill Medicine Box Holder Medicine Storage Organizer Case,19.0,EUR,19.0,EUR,22,10,,,4.782608695652174,23.0,20,1,2,0,0,,,,,,,,50,Livraison standard,6.0,false,,50,,,CN,Hilona,hilona,"88 % avis positifs (6,655 notes)",6655,4.218482344102179,599ea1b80415f866abd350d2,,,https://www.wish.com/c/5f1150ccf090b94f6becc150,https://canary.contestimg.wish.com/api/webimage/5f1150ccf090b94f6becc150-medium.jpg,5f1150ccf090b94f6becc150
Chickens Rooster It'S The Most Wonderful Time Of The Years Fall Autumn Vintage Bedding Cover With 2 Pillowcases 100% Polyester,Chickens Rooster It'S The Most Wonderful Time Of The Years Fall Autumn Vintage Bedding Cover With 2 Pillowcases 100% Polyester,39.0,EUR,67.0,EUR,46.2,0,,,5.0,0.0,,,,,,,,,,,,twin65×71inchesbeddingset,50,Livraison standard,8.99,false,,50,,,VN,maccc,maccc,90 % avis positifs (303 notes),303,4.32013201320132,5ffea615fa9415150cb997db,,,https://www.wish.com/c/6063e9a8dc7450a8b4b19bc1,https://canary.contestimg.wish.com/api/webimage/6063e9a8dc7450a8b4b19bc1-medium.jpg,6063e9a8dc7450a8b4b19bc1
Boîtes à tiroirs en plastique durables boîte à chaussures transparente boîte à chaussures organisateur à la maison baskets organisation rangement armoire à chaussures,Durable Plastic Drawer Boxes Case Transparent Shoes Box Home Organizer Sneakers Organization Storage Shoe Cabinet,12.0,EUR,12.0,EUR,14,10,,,2.375,16.0,3,2,1,2,8,,,,,,,2pcs,50,Livraison standard,4.0,false,,50,,,CN,pickers_luck,pickers_luck,"(7,387 notes)",7387,4.191417354812509,5b4d992a633e987287fde127,,,https://www.wish.com/c/5efd80ab877bff61d7a936ee,https://canary.contestimg.wish.com/api/webimage/5efd80ab877bff61d7a936ee-medium.jpg,5efd80ab877bff61d7a936ee
Geek,,,,,,,,,,,,,,,,,,,,,,,,,,,,,,,,,,,,,,,,,https://www.wish.com/c/5ed8d48690b8a634bae4fd82,,5ed8d48690b8a634bae4fd82
2021 New Sportsuit Men's Casual Sportsuit Two Piece Hoodie + Trouser Sportsuit Fall/Winter Hooded Sweatshirt (M-3XL),2021 New Sportsuit Men's Casual Sportsuit Two Piece Hoodie + Trouser Sportsuit Fall/Winter Hooded Sweatshirt (M-3XL),14.0,EUR,14.0,EUR,16,9,,,5.0,2.0,2,0,0,0,0,,,,,,white,m,50,Livraison standard,5.0,false,,50,true,Quantité limitée !,CN,Jisn,jisn,,0,5.0,60436d357ef05726c0732ca5,,,https://www.wish.com/c/6051a85442bea1fe2e5b9fa6,https://canary.contestimg.wish.com/api/webimage/6051a85442bea1fe2e5b9fa6-medium.jpg,6051a85442bea1fe2e5b9fa6
Étuis en métal 360º pour Iphone 12 12Pro 12Pro Max 12Mini Étui Installation de la boucle Double face en verre pour 11 11Pro 11 Pro Max Étui Funda Coque de luxe Housse de téléphone,Metal 360º Cases for Iphone 12 12Pro 12Pro Max 12Mini Case Buckle Installation Double Side Glass for 11 11Pro 11 Pro Max Case Funda Luxury Coque Cover Phone Case,12.0,EUR,12.0,EUR,14,10,,,3.7142857142857144,21.0,13,1,1,0,6,,,,,,black,iphone11pro,50,Livraison standard,3.0,false,,50,true,Quantité limitée !,CN,Drawing,drawing,"(12,164 notes)",12164,4.315603419927656,5901eafdf95b562a6a6e4649,,,https://www.wish.com/c/5fd3058545b2d5c0de1d3530,https://canary.contestimg.wish.com/api/webimage/5fd3058545b2d5c0de1d3530-medium.jpg,5fd3058545b2d5c0de1d3530
Pink Floyd,,,,,,,,,,,,,,,,,,,,,,,,,,,,,,,,,,,,,,,,,https://www.wish.com/c/5e8d2fce9719ed6404967680,,5e8d2fce9719ed6404967680
1PC mode lunettes titulaire Portable unisexe lunettes boîte lunettes fermeture éclair pochette lunettes étui lunettes de soleil étui,1PC Fashion Glasses Holder Portable Unisex Glasses Box Glasses Zipper Pouch Eyeglasses Case Sun glasses Case,3.14,EUR,4.0,EUR,3.8,10,,,4.571428571428571,28.0,21,4,1,2,0,,,,,,green,,50,Livraison standard,1.0,false,,50,true,Quantité limitée !,CN,poshkid,poshkid,"94 % avis positifs (6,194 notes)",6194,4.471262512108492,56fe1b523a698c27a4a6bc95,,,https://www.wish.com/c/5d6e10bfb11b470f01ac9ea2,https://canary.contestimg.wish.com/api/webimage/5d6e10bfb11b470f01ac9ea2-medium.jpg,5d6e10bfb11b470f01ac9ea2
Automne et hiver lâche mignon à manches longues pull pulls couleur unie décontracté dos nu bandage hauts pour femmes tricot Blouses,Autumn and Winter Loose Cute Long Sleeve Pullover Sweaters Solid Color Casual Backless Bandage Tops for Women Knitting Blouses,17.0,EUR,124.0,EUR,20,20000,,,3.891115564462258,1497.0,712,315,214,107,149,,,,,,grey,s,50,Livraison standard,6.0,false,,50,,,CN,juybsabar,juybsabar,"(26,820 notes)",26820,3.8988814317673377,583155a70d446310bcfe9f52,,,https://www.wish.com/c/5b8f4f9a50011c32a8264047,https://canary.contestimg.wish.com/api/webimage/5b8f4f9a50011c32a8264047-medium.jpg,5b8f4f9a50011c32a8264047
ZANZEA Fashion Chemise à manches longues imprimée à rayures Hauts Chemisier à poche ample à ourlet irrégulier,ZANZEA Fashion Long Sleeve Striped Printed Shirt Tops Irregular Hem Loose Pocket Blouse,8.0,EUR,14.0,EUR,9,1000,,,3.915983606557377,488.0,213,128,75,37,35,,,,,,black,s,50,Livraison Express,6.0,true,,50,,,CN,UKseller,guangzhouqiannitradecoltd,"89 % avis positifs (36,478 notes)",36478,4.213142167882011,547be84d90c77622b3a51441,,,https://www.wish.com/c/5e0ef3798ed2f30b09fc36f6,https://canary.contestimg.wish.com/api/webimage/5e0ef3798ed2f30b09fc36f6-medium.jpg,5e0ef3798ed2f30b09fc36f6
Mode Femmes Cachemire Tricoté À Manches Longues Veste Cardigan À Capuche Épaississement Manteau Plus La Taille,Fashion Women Cashmere Knitted Long Sleeve Jacket Cardigan Hooded Thickening Coat Plus Size,10.0,EUR,24.0,EUR,11,10000,,,4.0631360723709005,5306.0,2839,1078,674,315,400,,,,,,navyblue,xs,50,Livraison standard,2.0,false,,50,,,CN,Shanghai beautiful clothes store,shanghaibeautifulclothesstore,"(12,385 notes)",12385,4.048930157448527,574be50dcf4cf75c95f22947,,,https://www.wish.com/c/581d5e6e3f99535816f0965a,https://canary.contestimg.wish.com/api/webimage/581d5e6e3f99535816f0965a-medium.jpg,581d5e6e3f99535816f0965a
12 grilles / ensemble ongles paillettes scintillantes automne feuilles d'érable paillettes paillettes pour Nail Art décorations décalcomanies accessoires polonais,12 Grids/Set Nail Sparkly Flakes Fall Maple Leaves Glitter Sequins for Nail Art Decorations Decals Polish Accessories,3.08,EUR,4.0,EUR,3.73,10,,,4.380952380952381,21.0,14,4,1,1,1,,,,,,,1gridrandom,50,Livraison standard,1.0,false,,50,,,CN,Bagrace,bagrace,"(8,213 notes)",8213,4.271886034335809,53da4eacd911391c3b21feeb,,,https://www.wish.com/c/5f589b6f1925090f1e421cb4,https://canary.contestimg.wish.com/api/webimage/5f589b6f1925090f1e421cb4-medium.jpg,5f589b6f1925090f1e421cb4
XS-8XL grande taille mode hauts vêtements d'automne et d'hiver chemises à manches longues décontractées pour femmes chemisiers à col rond couleur unie dames pulls en vrac pulls en coton T-shirts en coton,XS-8XL Plus Size Fashion Tops Autumn and Winter Clothes Women's Casual Long Sleeve Shirts Solid Color O-neck Blouses Ladies Loose Pullover Sweatshirts Cotton T-shirts,3.89,EUR,4.0,EUR,4.71,1000,,,3.4517045454545454,352.0,132,65,52,36,67,,,,,,green,xs,1,Livraison standard,1.0,false,,50,,,CN,hcczhiqiang,hcczhiqiang,"87 % avis positifs (4,013 notes)",4013,4.088711687017194,5808e2beff6c57435af7df2d,,,https://www.wish.com/c/5f1540736d0047073b751a0b,https://canary.contestimg.wish.com/api/webimage/5f1540736d0047073b751a0b-medium.jpg,5f1540736d0047073b751a0b
Mode féminine Tricoter au-dessus du genou Bottes longues Cuissardes Chaussettes chaudes mignonnes bas en tricot,Women Fashion Knit Over Knee Long Boot Thigh-High Warm Socks cute knit stockings,5.0,EUR,5.0,EUR,5,1000,,,4.10655737704918,244.0,137,45,29,17,16,,,,,,black,,50,Livraison standard,1.0,false,,50,,,CN,Starry_Dream,starry_dream,"90 % avis positifs (18,219 notes)",18219,4.25824688511993,5a964463b722cf610ba38476,,,https://www.wish.com/c/5ae29d1930a7eb4096548394,https://canary.contestimg.wish.com/api/webimage/5ae29d1930a7eb4096548394-medium.jpg,5ae29d1930a7eb4096548394
Plantes Succulentes En Plastique Feuilles D'automne Artificielles Flores DIY Suculentas Artificiais Décoration De Mariage Plantes Faux Couronne Florale,Plastic Succulent Plants Artificial Fall Leaves Flores DIY Suculentas Artificiais Wedding Decoration Plants Fake Floral Wreath,3.99,EUR,17.0,EUR,4.84,10,,,4.833333333333333,6.0,5,1,0,0,0,,,,,,winered,,50,Livraison standard,1.0,false,,50,,,CN,universe2017,universe2017,"95 % avis positifs (4,412 notes)",4412,4.534904805077063,5964b4089579d80ac27f0147,,,https://www.wish.com/c/5af54c7064fef65734f16c2a,https://canary.contestimg.wish.com/api/webimage/5af54c7064fef65734f16c2a-medium.jpg,5af54c7064fef65734f16c2a
7 jours médecine boîte pilule stockage tablette pilule boîte avec couvercles clip médecine organisateur pilule cas diviseurs stockage hebdomadaire,7 Days Medicine Box Pill Storage Tablet Pill Box with Lids Clip Medicine Organizer Pill Case Splitters Storage Weekly,4.0,EUR,4.0,EUR,4,1000,,,4.518624641833811,349.0,252,55,22,11,9,,,,,,red,,50,Livraison Express,8.0,true,,50,true,Quantité limitée !,CN,Chinese style_GQ,chinesestyle_gq,"90 % avis positifs (21,856 notes)",21856,4.255627745241581,590189980094b829518713b8,,,https://www.wish.com/c/5c27364d5b2d89481a063df6,https://canary.contestimg.wish.com/api/webimage/5c27364d5b2d89481a063df6-medium.jpg,5c27364d5b2d89481a063df6
32 Couleurs Doux Solide Velours Coussin Couverture De Luxe Coussin Couverture pour Canapé De Voiture Décoratif Canapé Taie D'oreiller,32 Colors Soft Solid Velvet Cushion Cover Luxury Throw Pillow Cover for Sofa Car Decorative Sofa Pillow Case,3.0,EUR,24.0,EUR,3,1000,,,4.350282485875706,354.0,243,54,22,8,27,,,,,,darkpurple,30x50cm,50,Livraison standard,1.0,false,,50,true,Quantité limitée !,CN,Guangbo Store,guangbostore,(516 notes),516,4.436046511627907,5aded8f2b9605f3e225dcc19,,,https://www.wish.com/c/5d23fc4de2fd4d7e63021ec1,https://canary.contestimg.wish.com/api/webimage/5d23fc4de2fd4d7e63021ec1-medium.jpg,5d23fc4de2fd4d7e63021ec1
18 Pouces Décoration Oreiller Motif Dinosaure Mélange De Lin Jeter Taie d'oreiller Salon Canapé Housse de Coussin,18 Inches Decoration Pillow Dinosaur Pattern Linen Blend Throw Pillow Case Living Room Sofa Cushion Cover,5.0,EUR,5.0,EUR,5,10,,,4.25,16.0,11,1,2,1,1,,,,,,multicolor,1,50,Livraison standard,2.0,false,,50,,,CN,Exotic shops,exoticshops,"97 % avis positifs (6,329 notes)",6329,4.598514773265919,5832b96c81089110ae6439fb,,,https://www.wish.com/c/590bf31607797b7263c9254c,https://canary.contestimg.wish.com/api/webimage/590bf31607797b7263c9254c-medium.jpg,590bf31607797b7263c9254c
Femmes chemisier en mousseline de soie élégante dentelle blanc chemises de travail à manches longues solides hauts décontractés femmes femmes vêtements,Women Chiffon Blouse Elegant Lace White Work Shirts Long Sleeve Solid Casual Tops Female Women Clothes,14.0,EUR,24.0,EUR,16,1000,,,3.985663082437276,279.0,144,57,35,16,27,,,,,,white,s,50,Livraison standard,5.0,false,,50,,,CN,guokai,guokai,"88 % avis positifs (5,822 notes)",5822,4.122466506355204,55ddc39ca119a8104783d4fd,,,https://www.wish.com/c/5afc5f24bd2427041885e292,https://canary.contestimg.wish.com/api/webimage/5afc5f24bd2427041885e292-medium.jpg,5afc5f24bd2427041885e292
Housse d'Oreiller Hot Pet Pug Housse d'Oreiller Coussin de Voiture Housse d'Oreiller Décoration Maison Housse d'Oreiller,Hot Pet Pug Pillow Cover Sofa Car Cushion Cover Home Decor Pillow Case,3.0,EUR,5.0,EUR,3,5000,,,4.336129032258064,1550.0,1007,263,147,60,73,,,,,,,1,50,Livraison standard,1.0,false,,50,,,CN,kajeerusa,kajeerusa,"95 % avis positifs (17,502 notes)",17502,4.501942635127414,58ad39975d44995823fa6b91,,,https://www.wish.com/c/59fd6427dd36eb0cd4057564,https://canary.contestimg.wish.com/api/webimage/59fd6427dd36eb0cd4057564-medium.jpg,59fd6427dd36eb0cd4057564
Bébé fille / garçon distribution anti-dérapant genouillère bébé trucs ramper étape Anti chute coude et genou Protection outil gaine,Baby Girl/boy Dispensing Anti Slip Kneepad Baby Stuff Crawling Step Anti Falling Elbow and Knee Protection Tool Sheath,3.85,EUR,9.0,EUR,4.67,10,,,4.333333333333333,9.0,6,1,1,1,0,,,,,,green,0to3yearsold,5,Livraison standard,1.0,false,,33,,,CN,cool gift world,coolgiftworld,"95 % avis positifs (1,832 notes)",1832,4.570414847161572,5e1ac7e79de8e6418de97474,,,https://www.wish.com/c/5f9c26ea24ca8d2d1381b94c,https://canary.contestimg.wish.com/api/webimage/5f9c26ea24ca8d2d1381b94c-medium.jpg,5f9c26ea24ca8d2d1381b94c
ZANZEA Plus Size Feminino Gola de Lapela Manga Longa Camisa Solta Blusa Cor Sólida,ZANZEA Plus Size Womens Lapel Collar Long Sleeve Loose Shirt Solid Color Blouse,10.0,EUR,12.0,EUR,12,10,,,4.346534653465347,101.0,64,18,12,4,3,,,,,,black,s,50,Livraison standard,3.0,false,,50,true,Quantité limitée !,CN,Zuikeai,bestforman,"(2,279 avaliações)",2279,4.151382185168933,5ba1b8f973d9347e013e170c,,,https://www.wish.com/c/5e5647f27074455f0dfe7c41,https://canary.contestimg.wish.com/api/webimage/5e5647f27074455f0dfe7c41-medium.jpg,5e5647f27074455f0dfe7c41
Automne et hiver Sweats à capuche Ensembles athlétiques Ensemble de survêtement décontracté pour hommes,Autumn and Winter Hooded Sweatshirts Athletic Sets Mens Casual Tracksuit Suit Set,11.0,EUR,25.0,EUR,13,10,,,3.8378378378378377,37.0,16,12,2,1,6,,,,,,darkgrey&black,xxxs,50,Livraison standard,3.0,false,,50,true,Quantité limitée !,CN,Hedy Molly,litterstarlitterstar,"(1,170 notes)",1170,4.103418803418803,5af19ef3e139d722ffe89e7b,,,https://www.wish.com/c/5d60fa8031020d264e554473,https://canary.contestimg.wish.com/api/webimage/5d60fa8031020d264e554473-medium.jpg,5d60fa8031020d264e554473
1 PC Portable Brosse À Dents Boîte De Rangement Voyage Camping Brosse À Dents Cas Couverture Sécurité Santé Salle De Bains Rangement Organisateur Boîte,1PC Portable ToothBrush Storage Box Travel Camping Toothbrush Case Cover Safety Health Bathroom Storage Organizer Box,3.9,EUR,82.0,EUR,4.73,10,,,4.129032258064516,31.0,21,3,2,0,5,,,,,,blue,,50,Livraison standard,1.0,false,,50,,,CN,mens fashion shirt,yanmeiyue,"86 % avis positifs (28,783 notes)",28783,4.042559844352569,556573c0dd81fe1ca122c703,,,https://www.wish.com/c/5df840d389d8f302f5fc3c45,https://canary.contestimg.wish.com/api/webimage/5df840d389d8f302f5fc3c45-medium.jpg,5df840d389d8f302f5fc3c45
Nueva fiesta de bodas para niñas de flores Chaqueta de novia de piel sintética Chaqueta de noche Bolero Otoño Invierno Chaquetas de encogimiento de hombros para niños Capa de niños,New Flower Girls Wedding Party Faux Fur Bridal Jacket Coat Evening Bolero Fall Winter Kids Shrug Jackets Children Cape,12.0,EUR,17.0,EUR,14,10,,,4.5375,80.0,59,10,7,3,1,,,,,,ivory,2-3years,50,Livraison standard,4.0,false,,50,true,Quantité limitée !,CN,Cutekidstore,cutekidstore,89% retroalimentación positiva (196 calificaciones),196,4.372448979591836,56dd227bd783b002edc5597d,,,https://www.wish.com/c/5b717d0702cb9b57eb3b8285,https://canary.contestimg.wish.com/api/webimage/5b717d0702cb9b57eb3b8285-medium.jpg,5b717d0702cb9b57eb3b8285
Hisense,,,,,,,,,,,,,,,,,,,,,,,,,,,,,,,,,,,,,,,,,https://www.wish.com/c/5efb1b82eb31f93761263157,,5efb1b82eb31f93761263157
New Fashion Flip Cover With Stand Card Slot Anti Falling Leather Case For iPhone 12 Pro Max 12 Mini 11 Pro Max XS Max XR X SE2020 8/7/6S/6 Plus/5S/SE/Samsung S21 S21Plus S21Ultra S20FE/S10/S9/S8 Plus/Note20/10/9/8 A01Core/A02/A02S/A10/A11/A12.....A32/A42 5G/A51/A52/A71/A72 5G/A9 2018/M21/M31/M51,New Fashion Flip Cover With Stand Card Slot Anti Falling Leather Case For iPhone 12 Pro Max 12 Mini 11 Pro Max XS Max XR X SE2020 8/7/6S/6 Plus/5S/SE/Samsung S21 S21Plus S21Ultra S20FE/S10/S9/S8 Plus/Note20/10/9/8 A01Core/A02/A02S/A10/A11/A12.....A32/A42 5G/A51/A52/A71/A72 5G/A9 2018/M21/M31/M51,4.0,EUR,9.0,EUR,4,10,,,5.0,0.0,,,,,,,,,,,black,foriphone12,50,Livraison standard,1.0,false,,50,true,Quantité limitée !,CN,YuMin0608,yumin0608,"94 % avis positifs (19,308 notes)",19308,4.402631033768386,5ba224b526957067dcf235f4,,,https://www.wish.com/c/605fe5e9ae3cd1de82ea97a7,https://canary.contestimg.wish.com/api/webimage/605fe5e9ae3cd1de82ea97a7-medium.jpg,605fe5e9ae3cd1de82ea97a7
Sippy Cup Baby Feeding Cup Anti-Fall No Spill Cups Eau potable pour enfant en bas âge,Sippy Cup Baby Feeding Cup Anti-Fall No Spill Cups Drinking Water for Toddler Kid fash,14.0,EUR,14.0,EUR,16,2,,,5.0,0.0,,,,,,,,,,,,,50,Livraison Express,8.0,true,,50,,,CN,fashionhousehh,fashionhousehh,"91 % avis positifs (3,517 notes)",3517,4.333238555587148,5afbd2b45bc05c31af4d3dfa,,,https://www.wish.com/c/5f8c99d45334b3003ad2211e,https://canary.contestimg.wish.com/api/webimage/5f8c99d45334b3003ad2211e-medium.jpg,5f8c99d45334b3003ad2211e
Mengni,,,,,,,,,,,,,,,,,,,,,,,,,,,,,,,,,,,,,,,,,https://www.wish.com/c/5f8ec35ceb31f9a070804b56,,5f8ec35ceb31f9a070804b56
 2017 nouveau printemps été Gravity Falls dessin animé américain Mabel Dipper Pines Cosplay Cool Baseball maille casquettes réglable Sport chapeau, 2017 New Spring Summer Gravity Falls U.S Cartoon Mabel Dipper Pines Cosplay Cool Baseball Mesh Caps Adjustable Sport Hat,11.0,EUR,17.0,EUR,13,10,,,4.7631578947368425,38.0,32,5,0,0,1,,,,,,pink,,50,Livraison standard,3.0,false,,50,,,CN,S&S House,sshouse,"90 % avis positifs (18,740 notes)",18740,4.332123799359659,569cf1678283890dc5343ff5,,,https://www.wish.com/c/598421a1312d577122ca72ce,https://canary.contestimg.wish.com/api/webimage/598421a1312d577122ca72ce-medium.jpg,598421a1312d577122ca72ce
Audi,,,,,,,,,,,,,,,,,,,,,,,,,,,,,,,,,,,,,,,,,https://www.wish.com/c/5ed782f790b8a6318c2d723a,,5ed782f790b8a6318c2d723a
Kiren Moisture Nature Treatment Fall au Calendula 500 ml,Kiren Moisture Nature Treatment Fall in Calendula 500ml,26.0,EUR,26.0,EUR,31.0,0,,,5.0,0.0,,,,,,,,,,,,,50,Livraison standard,9.0,false,,50,,,KR,woo_korea,woo_korea,100 % avis positifs (2 notes),2,5.0,5fd9cf6be3c38640101e3795,,,https://www.wish.com/c/5fdfa4652e79e17884d4b448,https://canary.contestimg.wish.com/api/webimage/5fdfa4652e79e17884d4b448-medium.jpg,5fdfa4652e79e17884d4b448
16 rangées / étui faux cils Soft Extension Lashes extension de cils professionnels TOUTE épaisseur C D curl Extension de cils individuels,16 rows/case false eyelashes Soft Extension Lashes professional eyelashes extension ALL thickness C D curl Individual Eyelash Extension,3.08,EUR,4.0,EUR,3.73,1000,,,4.368421052631579,190.0,132,28,11,6,13,,,,,,,0.05-c-8mm,16,Livraison standard,1.0,false,,50,,,CN,komhyueqiao,komhyueqiao,"94 % avis positifs (36,575 notes)",36575,4.479726589200274,5b7ab067bbbffb11d5382a27,,,https://www.wish.com/c/5e846085ea32915eee60eda1,https://canary.contestimg.wish.com/api/webimage/5e846085ea32915eee60eda1-medium.jpg,5e846085ea32915eee60eda1
Mode féminine automne à manches longues col en V longs cils imprimer T-shirt hauts décontracté lâche tuniques avec poche,Women Fashion Fall Long Sleeve V Neck Long Eyelashes Print T-shirt Tops Casual Loose Tunics With Pocket,15.0,EUR,24.0,EUR,18,10,,,3.625,16.0,7,2,3,2,2,,,,,,grey,s,50,Livraison standard,5.0,false,,50,true,Quantité limitée !,CN,LETSRUNWILD,letsrunwild,82 % avis positifs (387 notes),387,3.9819121447028425,5e7dbd834c449477c2c4ebc3,,,https://www.wish.com/c/5fbe1c8ab4cc993069055367,https://canary.contestimg.wish.com/api/webimage/5fbe1c8ab4cc993069055367-medium.jpg,5fbe1c8ab4cc993069055367
CHUANGDIAN,,,,,,,,,,,,,,,,,,,,,,,,,,,,,,,,,,,,,,,,,https://www.wish.com/c/5f8d71d5eb31f9a6cce12c1a,,5f8d71d5eb31f9a6cce12c1a
