title,title_orig,discount_price,discount_price_currency,retail_price,retail_price_currency,discount_price_in_original_currency,nb_cart_orders_approx,nb_units_purchased_approx,uses_ad_boosts,rating,rating_count,rating_five_count,rating_four_count,rating_three_count,rating_two_count,rating_one_count,badges_count,badge_local_product,badge_product_quality,badge_fast_shipping,tags,product_color,product_variation_size_id,product_variation_inventory,shipping_option_name,shipping_option_price,shipping_is_express,countries_shipped_to,inventory_total,has_urgency_banner,urgency_text,origin_country,merchant_title,merchant_name,merchant_info_subtitle,merchant_rating_count,merchant_rating,merchant_id,merchant_has_profile_picture,merchant_profile_picture,product_url,product_picture,product_id
Nouvelle mode unisexe en cuir véritable téléphone sac étui ceinture étui ceinture taille sac en cuir sac à main téléphone portefeuille,New Fashion Unisex Genuine Leather Phone Bag Holster Belt Case Belt Waist Bag Leather Purse Phone Wallet,3.15,EUR,41.0,EUR,3.8200000000000003,1000,,,3.7832167832167833,143.0,64,29,23,9,18,,,,,,,navyblue,5,Livraison standard,1.0,false,,50,,,US,holliwbjbaumbachqfg,holliwbjbaumbachqfg,"85 % avis positifs (4,025 notes)",4025,4.0511801242236025,5e9a24d771486420055255f6,,,https://www.wish.com/c/5fd30f3347d860d7d50b9ac4,https://canary.contestimg.wish.com/api/webimage/5fd30f3347d860d7d50b9ac4-medium.jpg,5fd30f3347d860d7d50b9ac4
Tapis de sol imprimé moderne avec support en mousse de Gel antidérapant Jackson tapis et tapis pour salon salle à manger,Modern Printed Area Rug Gel Foam Backing Anti Slip Jackson Carpet and Rugs for Living Room Dining Room,8.0,EUR,29.0,EUR,9,1000,,,3.5443037974683542,316.0,135,52,42,24,63,,,,,,,40x60cm,50,Livraison standard,3.0,false,,50,,,CN,xiangltd,xiangltd,"(2,339 notes)",2339,3.6002565198802907,5d5766581d8629494642ede0,,,https://www.wish.com/c/5e913316fb3f5329544e63d5,https://canary.contestimg.wish.com/api/webimage/5e913316fb3f5329544e63d5-medium.jpg,5e913316fb3f5329544e63d5
Vase en plastique moderne accessoires de décoration de la maison maison Vase succulent créatif nordique épaissi Vases résistant aux chutes décor à la maison,Modern Plastic Vase Home Decoration Accessories Home Creative Succulent Vase Nordic Thickened Fall Resistant Vases Home Decor,12.0,EUR,12.0,EUR,14,0,,,5.0,0.0,,,,,,,,,,,white,,44,Livraison standard,4.0,false,,50,,,CA,11368796 CANADA CORPORATION,11368796canadacorporation,"(1,166 notes)",1166,3.9382504288164664,5ffb1f43fa8a25c707537989,,,https://www.wish.com/c/6022b8f45a660ff515615a1e,https://canary.contestimg.wish.com/api/webimage/6022b8f45a660ff515615a1e-medium.jpg,6022b8f45a660ff515615a1e
Nouveau jacke damen automne hiver femmes manteau à capuche cachemire cardigan pull manteau dame couleur unie manteau épais doux mode veste longue grande taille pardessus strickjacke damen,New jacke damen Autumn Winter Women Hooded Coat Cashmere Cardigan Sweater Coat Lady Solid Color Coat Thick Soft Fashion Jacket Long Plus Size Overcoat strickjacke damen,5.0,EUR,5.0,EUR,5,10000,,,3.304368698991839,2083.0,712,352,340,216,463,,,,,,yellow,xs,22,Livraison standard,2.0,false,,50,,,CN,peiqii,peiqii,"81 % avis positifs (7,828 notes)",7828,3.859734287174246,59db223e0ec30f1630c6c108,,,https://www.wish.com/c/5d7f25209e65cd254ed865b5,https://canary.contestimg.wish.com/api/webimage/5d7f25209e65cd254ed865b5-medium.jpg,5d7f25209e65cd254ed865b5
9 Styles Anti Fall Flower Vase Vase En Plastique Blanc Imitation Céramique Pot De Fleur Panier De Fleurs Décoration Nordique Vases Décoration De La Maison (Fleur Non Inclus),9 Styles Anti Fall Flower Vase Plastic Vase White Imitation Ceramic Flower Pot Flower Basket Nordic Decoration Vases Home Room Decoration(Flower Not Included),5.0,EUR,5.0,EUR,5,10,,,3.7222222222222223,36.0,15,10,3,2,6,,,,,,white,a(timelimitedprice),5,Livraison standard,1.0,false,,50,,,CN,Allchallenges,allchallenges,"88 % avis positifs (5,905 notes)",5905,4.175783234546994,59c0dae60415f802595858ee,,,https://www.wish.com/c/5fe2f4dae1f51c09042554a8,https://canary.contestimg.wish.com/api/webimage/5fe2f4dae1f51c09042554a8-medium.jpg,5fe2f4dae1f51c09042554a8
Valise Cachet Autocollant Rétro En-tête Timbre Autocollant Voyage Valise Autocollant Personnalité Trolley Case Guitare Graffiti Autocollant,Suitcase Postmark Sticker Retro Letterhead Stamp Sticker Travel Suitcase Sticker Personality Trolley Case Guitar Graffiti Sticker,2.0,EUR,8.0,EUR,2,1000,,,4.383458646616542,266.0,170,52,30,4,10,,,,,,,15pcs,50,Livraison standard,1,false,,50,,,CN,lijunmin,lijunmin,"95 % avis positifs (7,189 notes)",7189,4.4929753790513285,5b7ea1186394f516c81e8dea,,,https://www.wish.com/c/5c7f279890c3eb448b4d5e39,https://canary.contestimg.wish.com/api/webimage/5c7f279890c3eb448b4d5e39-medium.jpg,5c7f279890c3eb448b4d5e39
XS-8XL Plus La Taille Vêtements De Mode Automne et Hiver Vêtements Pour Femmes T-shirts À Manches Longues Lâche Dentelle Couture Tops Casual Solide Couleur O-cou Blouses Dames Pulls Coton Sweatshirts,XS-8XL Plus Size Fashion Clothes Autumn and Winter Women's Clothing Long Sleeve T-shirts Loose Lace Stitching Tops Casual Solid Color O-neck Blouses Ladies Pullovers Cotton Sweatshirts,4.7,EUR,5.0,EUR,5.7,5000,,,4.031784841075795,818.0,447,146,107,40,78,,,,,,white,xs,3,Livraison standard,1.0,false,,50,true,Quantité limitée !,CN,champion_28,champion_28,"84 % avis positifs (10,185 notes)",10185,3.9640648011782034,5810c46f02b01e15f8a10e38,,,https://www.wish.com/c/5d771013555c293d863f0bda,https://canary.contestimg.wish.com/api/webimage/5d771013555c293d863f0bda-medium.jpg,5d771013555c293d863f0bda
Housse de coussin décorative géométrique gris argenté décor à la maison housse de coussin en velours pour canapé 45 * 45 cm décor à la maison taie d'oreiller géométrique,Silver Grey Geometric Decorative Cushion Cover Home Decor Velvet Pillow Cover for Sofa 45*45cm Home Decor Geometric Pillows Case,3.14,EUR,4.0,EUR,3.8,1000,,,3.7012658227848103,395.0,186,60,58,27,64,,,,,,,style1,1,Livraison standard,1.0,false,,50,,,CN,zxdfhgsfgfgh,zxdfhgsfgfgh,"86 % avis positifs (1,558 notes)",1558,4.105263157894737,5b1f732d43b3b62ca8e9ba17,,,https://www.wish.com/c/5d5529227595483bd6db3caf,https://canary.contestimg.wish.com/api/webimage/5d5529227595483bd6db3caf-medium.jpg,5d5529227595483bd6db3caf
Garden Gnome Statues Outdoor Decor Dinosaur Eating Gnomes Garden Art Outdoor for Fall Winter Garden Decor Outdoor Statue for Patio Lawn Yard Art Decoration Housewarming Garden Gift,Garden Gnome Statues Outdoor Decor Dinosaur Eating Gnomes Garden Art Outdoor for Fall Winter Garden Decor Outdoor Statue for Patio Lawn Yard Art Decoration Housewarming Garden Gift,21.0,EUR,21.0,EUR,25,1,,,5.0,0.0,,,,,,,,,,,,smallsize(15x6x5cm)/standardquality,5,Livraison standard,6.0,false,,50,true,Quantité limitée !,US,Carol K Capozzi,carolkcapozzi,,0,5.0,5e9fd1bc06920231053df15e,,,https://www.wish.com/c/607ea72351e5216cb3aa7c87,https://canary.contestimg.wish.com/api/webimage/607ea72351e5216cb3aa7c87-medium.jpg,607ea72351e5216cb3aa7c87
Accueil canapé chaise décor flamant rose taie d'oreiller jeter taie d'oreiller taille housses de coussin,Home Sofa Chair Decor Flamingo Pillowcase Throw Pillow Case Waist Cushion Covers,4.68,EUR,19.0,EUR,5.68,1000,,,4.632478632478633,234.0,172,44,14,2,2,,,,,,,a,50,Livraison standard,1.0,false,,50,true,Quantité limitée !,CN,ocean5for8ZH,ocean5for8zh,"93 % avis positifs (79,237 notes)",79237,4.383520325100648,5817f156d8ef7848c3b400cc,,,https://www.wish.com/c/59a0dbfabd904b2e6d2aec58,https://canary.contestimg.wish.com/api/webimage/59a0dbfabd904b2e6d2aec58-medium.jpg,59a0dbfabd904b2e6d2aec58
Hiver Automne Tendance Vêtements Accessoires Poignets Dentelle Plissée Corne Chemise Amovible Faux Bracelet Manchettes Manchettes Faux Manches pour Femmes Chandail Décoration,Winter Fall Trendy Clothing Accessories  Wrist Cuffs Lace Pleated Horn Detachable Shirt Fake Bracelet Sleeve Cuffs False Sleeves for Women Sweater Decoration,6.0,EUR,6.0,EUR,7,10,,,5.0,1.0,1,0,0,0,0,,,,,,,c,47,Livraison standard,2.0,false,,50,,,CN,Binc Xiangxiang,bincxiangxiang,"95 % avis positifs (1,361 notes)",1361,4.585598824393828,5b66ced103523d3d9384f0e7,,,https://www.wish.com/c/5f89a87d1453672b9dde08c8,https://canary.contestimg.wish.com/api/webimage/5f89a87d1453672b9dde08c8-medium.jpg,5f89a87d1453672b9dde08c8
 Kits de taies d'oreiller de maintien de crochet de loquet de cheval de lapin de broderie de bricolage, Diy Embroidery Rabbit Horse Latch Hook Hold pillow case Kits ,14.0,EUR,14.0,EUR,16,10,,,4.504065040650406,123.0,85,27,4,2,5,,,,,,,zd1025,50,Livraison standard,5.0,false,,50,,,CN,YanWen company,yanwencompany,"93 % avis positifs (7,845 notes)",7845,4.410579987253027,55857dcef6788d4170967173,,,https://www.wish.com/c/5af6654c8ed57f1ed2bd4d0d,https://canary.contestimg.wish.com/api/webimage/5af6654c8ed57f1ed2bd4d0d-medium.jpg,5af6654c8ed57f1ed2bd4d0d
MDSTOP Fishing Rod Case Canvas Reel Organizer Travel Carry Pole Tools Bag,MDSTOP Fishing Rod Case Canvas Reel Organizer Travel Carry Pole Tools Bag,21.0,EUR,21.0,EUR,25,1000,,,4.400377714825307,1059.0,684,221,88,26,40,,,,,,green,,50,Livraison standard,7.0,false,,50,,,CN,MDSTOP,mdstop,"(1,951 notes)",1951,4.322911327524347,5a72c4396be8733f1145d0ec,,,https://www.wish.com/c/5add67392dde5e787d359202,https://canary.contestimg.wish.com/api/webimage/5add67392dde5e787d359202-medium.jpg,5add67392dde5e787d359202
8 couleurs femmes casual lâche chemise à manches longues volants o-cou pull mode mini robe plus la taille (XS-5XL),8 Colors Women's Casual Loose Long Sleeve Shirt Ruffles O-neck Pullover Fashion Mini Dress Plus Size (XS-5XL),6.0,EUR,6.0,EUR,7,20000,,,3.4499816334027185,8167.0,2838,1577,1539,848,1365,,,,,,grey,xxs,2,Livraison standard,2.0,false,,50,,,CN,LeCo Clothes,lecoclothes,"84 % avis positifs (23,358 notes)",23358,3.9027742101207297,57b5b0c644ee7f4fe70b61d9,,,https://www.wish.com/c/583e49d33d6ce6799b299d03,https://canary.contestimg.wish.com/api/webimage/583e49d33d6ce6799b299d03-medium.jpg,583e49d33d6ce6799b299d03
Joseph Joseph,,,,,,,,,,,,,,,,,,,,,,,,,,,,,,,,,,,,,,,,,https://www.wish.com/c/5f4b86fa90b8a686609f4804,,5f4b86fa90b8a686609f4804
Portable voyage petit kit de couture maison étui fil aiguille ciseaux ensemble cadeau pour les mères,Portable Travel Small Home Sewing Kit Case Needle Thread Scissor Set Gift for Mothers,4.02,EUR,5.0,EUR,4.87,1000,,,3.8823529411764706,102.0,52,15,17,7,11,,,,,,black,style1,50,Livraison Express,7.0,true,,50,,,CN,LIHUIpurple999,lihuipurple999,81 % avis positifs (386 notes),386,3.9145077720207255,5f61b241020c239b37f0224b,,,https://www.wish.com/c/5f6d9b4ee7a2dc1af3383590,https://canary.contestimg.wish.com/api/webimage/5f6d9b4ee7a2dc1af3383590-medium.jpg,5f6d9b4ee7a2dc1af3383590
"To My Daughter Fall Asleep Tonight With Nothing But Love And Forgiveness In Your Heart Soft Premium Blanket 30”- 90""/ Polyester Fabric 45""-91"" Quilt","To My Daughter Fall Asleep Tonight With Nothing But Love And Forgiveness In Your Heart Soft Premium Blanket 30”- 90""/ Polyester Fabric 45""-91"" Quilt",34.0,EUR,58.0,EUR,40,0,,,5.0,0.0,,,,,,,,,,,,"fleeceblanket47""×35""",50,Livraison standard,11.0,false,,50,true,Quantité limitée !,VN,lightshin,lightshin,94 % avis positifs (999 notes),999,4.4724724724724725,5f8562a519c13da3b5ecfe1f,,,https://www.wish.com/c/607004227f26ca9bd827ad1b,https://canary.contestimg.wish.com/api/webimage/607004227f26ca9bd827ad1b-medium.jpg,607004227f26ca9bd827ad1b
Plus Size S-5XL Women Fashion Sexy Chandail à col en V profond avec fermeture éclair Pull manches chauve-souris Chemisier manches longues T-shirt à manches longues,Plus Size S-5XL Women Fashion Sexy Deep V Collar Zipper Sweater Batwing Sleeve Blouse Long Sleeved T-shirt,6.0,EUR,6.0,EUR,7,50000,,,3.9044029192397143,12469.0,5685,2807,2101,852,1024,,,,,,black,xxs,5,Livraison standard,2.0,false,,50,,,CN,LeCo Clothes,lecoclothes,"84 % avis positifs (23,358 notes)",23358,3.9027742101207297,57b5b0c644ee7f4fe70b61d9,,,https://www.wish.com/c/57fc98541fbe8f246816aff4,https://canary.contestimg.wish.com/api/webimage/57fc98541fbe8f246816aff4-medium.jpg,57fc98541fbe8f246816aff4
2018 California Fallout Republic 3 x 5 Drapeau Bannière Drapeau Ours à 2 têtes,2018 California Fallout Republic 3x 5 Flag Banner 2 Headed Bear Flag,7.0,EUR,21.0,EUR,8,10,,,4.702702702702703,111.0,92,12,3,1,3,,,,,,,,50,Livraison standard,2.0,false,,50,true,Quantité limitée !,CN,genmi,genmi,"95 % avis positifs (1,410 notes)",1410,4.5312056737588655,5996f2e30ec30f79d0a29d5b,,,https://www.wish.com/c/5b0e87f107c2d34846d05134,https://canary.contestimg.wish.com/api/webimage/5b0e87f107c2d34846d05134-medium.jpg,5b0e87f107c2d34846d05134
4 couleurs multi-fonction pare-soleil pare-soleil lunettes cas Bill stockage support boîte accessoires de voiture,4 Colors Multi-function Sun Visor Sunglasses Case Bill Storage Bracket Box Car Accessories ,10.0,EUR,15.0,EUR,11,10,,,4.290076335877862,131.0,73,37,12,4,5,,,,,,coolblack,,50,Livraison standard,2.0,false,,50,,,CN,Juicekkipal,juicekkipal,77 % avis positifs (960 notes),960,3.8020833333333335,5d6f81d44adcfd09171f4e93,,,https://www.wish.com/c/5dd26367ef324f07bbe18bbf,https://canary.contestimg.wish.com/api/webimage/5dd26367ef324f07bbe18bbf-medium.jpg,5dd26367ef324f07bbe18bbf
1 Pcs En Cuir Tabac Sac Portable Cigarette Roulant Pipe Sac Tabac Pochette Étui Portefeuille Fumeurs Accessoires,1Pcs Leather Tobacco Bag Portable Cigarette Rolling Pipe Bag Tobacco Pouch Case Wallet  Smoking Accessories,4.82,EUR,10.0,EUR,5.84,1000,,,4.2663755458515285,229.0,137,49,21,11,11,,,,,,lightbrown,,50,Livraison standard,2.0,false,,50,,,CN,jackzhuli,jackzhuli,"90 % avis positifs (7,478 notes)",7478,4.286707675849158,5aeadb638aaf7a24d38e258f,,,https://www.wish.com/c/5d2893486a630b22bdfaff12,https://canary.contestimg.wish.com/api/webimage/5d2893486a630b22bdfaff12-medium.jpg,5d2893486a630b22bdfaff12
2018 Les derniers styles Sept RIVAL Gants de motocross Respirant Vélo Gants à doigts longs tombant rapidement Drop Drop Gants,2018 The Latest Styles Seven RIVAL Motocross Gloves Breathable Bicycle Long Finger Gloves Falling Fast Drop Pull Gloves,5.0,EUR,30.0,EUR,6,10,,,4.310526315789474,190.0,115,46,12,7,10,,,,,,yellow,sizexs,10,Livraison standard,2.0,false,,50,,,CN,Dream Spaces,dreamspaces,"92 % avis positifs (1,917 notes)",1917,4.325508607198748,5d4a80b15c6fb24f0360c813,,,https://www.wish.com/c/5d707bb1a7042525d44df2f6,https://canary.contestimg.wish.com/api/webimage/5d707bb1a7042525d44df2f6-medium.jpg,5d707bb1a7042525d44df2f6
Combinaisons décontractées de couleur unie S-5XL col en V à manches courtes automne femmes Wrap longues barboteuses,Casual Solid Color Jumpsuits S-5XL V-neck Short Sleeve Autumn Women Wrap Long Rompers,12.0,EUR,18.0,EUR,14,10,,,3.7983193277310923,119.0,58,14,21,17,9,,,,,,grey,s,50,Livraison Express,6.0,true,,50,,,CN,Zuikeai,bestforman,"(2,279 notes)",2279,4.151382185168933,5ba1b8f973d9347e013e170c,,,https://www.wish.com/c/5d9466022c35fc6a6ad7d856,https://canary.contestimg.wish.com/api/webimage/5d9466022c35fc6a6ad7d856-medium.jpg,5d9466022c35fc6a6ad7d856
GT 2018 Automne Automne Hiver Hot Sale Nouvelle Mode Femme Bottes Martini Bottes Bottines Classic Zipper Bottines Bottines Classic Cheville Grind Crumbly Warm Plush Chaussures Femmes,GT 2018 Autumn Winter Hot Sale New Fashion Women Martini Boots Boots Classic Zipper Ankle Boots Grind Crumbly Warm Plush Women Shoes,14.0,EUR,14.0,EUR,16,5000,,,3.7422266800401203,1994.0,862,439,288,127,278,,,,,,black,35,50,Livraison standard,9.0,false,,50,true,Quantité limitée !,CN,liurujun,liurujun,"87 % avis positifs (9,759 notes)",9759,4.07111384363152,5acf31fae05388453af602a2,,,https://www.wish.com/c/5bdfb8a55cb8d317446e5b71,https://canary.contestimg.wish.com/api/webimage/5bdfb8a55cb8d317446e5b71-medium.jpg,5bdfb8a55cb8d317446e5b71
 Banshee 58mm 9g automne manivelle pêche à l'achigan plongée peu profonde appâts de pêche Wobbler leurre de pêche appât artificiel pour la pêche à la truite, Banshee 58mm 9g Fall Crankbait Bass Fishing Shallow Diving Crankbaits Wobbler Fishing Lure Artificial Bait for Trout Fishing,4.73,EUR,5.0,EUR,5.73,10,,,4.589285714285714,56.0,42,8,3,3,0,,,,,,,tigerblaze,50,Livraison standard,1.0,false,,50,,,CN,kunlishangmao,kunlishangmao,"95 % avis positifs (1,467 notes)",1467,4.496250852079073,5d107a0e2379d37cdebf122a,,,https://www.wish.com/c/5d15ec2c2850794f8d427a2e,https://canary.contestimg.wish.com/api/webimage/5d15ec2c2850794f8d427a2e-medium.jpg,5d15ec2c2850794f8d427a2e
"Veste à capuche en molleton Varsity Baseball à manches contrastées pour femmes, plus la taille XS-4XL",Womens Contrast Sleeve Fleece Varsity Baseball Hoodie Jacket plus size XS-4XL,12.0,EUR,25.0,EUR,14,1000,,,4.162684869169511,879.0,489,192,105,38,55,,,,,,navyblue,women-xs,50,Livraison standard,4.0,false,,50,,,CN,CRTECH,crtech,"(46,565 notes)",46565,3.992612477182433,56ff4b9a06265e58cc582f15,,,https://www.wish.com/c/59929036f1eb535797b6153c,https://canary.contestimg.wish.com/api/webimage/59929036f1eb535797b6153c-medium.jpg,59929036f1eb535797b6153c
Demon Slayer Kimetsu No Yaiba Patrtern Oreiller Canapé Voiture Lit Taie d'oreiller Chambre Décoration Rectangle Housse de Coussin Démon Lame Taie d'oreiller,Demon Slayer Kimetsu No Yaiba Patrtern Pillow Sofa Car Bed Pillow Case Bedroom Decoration Rectangle Cushion Cover 鬼滅の刃 枕カバー,3.03,EUR,4.0,EUR,3.67,1000,,,3.916883116883117,385.0,164,87,94,18,22,,,,,,,no.1-12x20in,50,Livraison standard,1.0,false,,50,,,CN,mgcmcae,mgcmcae,"92 % avis positifs (9,758 notes)",9758,4.3212748514039765,5b5be0702909732aa08a012e,,,https://www.wish.com/c/5ec799bf1126a449a6074d26,https://canary.contestimg.wish.com/api/webimage/5ec799bf1126a449a6074d26-medium.jpg,5ec799bf1126a449a6074d26
Flip Cover With Card Slot Stand Anti Falling New Fashion Leather Case For Samsung Galaxy S21 S21Plus S21Ultra S20FE/S10/S9/S8 Plus/Note20 Ultra/10 Lite/9/8 A01 Core/A02/A02S/A10/ A11/A12/A20/A20E/A20S/A21/A21S/A30/A31/A32 5G/A42 5G/A50/A51/A52/A70/A71/A72/A7 2018/A8 2018/M21/M31/M31S/M40S/M51,Flip Cover With Card Slot Stand Anti Falling New Fashion Leather Case For Samsung Galaxy S21 S21Plus S21Ultra S20FE/S10/S9/S8 Plus/Note20 Ultra/10 Lite/9/8 A01 Core/A02/A02S/A10/ A11/A12/A20/A20E/A20S/A21/A21S/A30/A31/A32 5G/A42 5G/A50/A51/A52/A70/A71/A72/A7 2018/A8 2018/M21/M31/M31S/M40S/M51,4.0,EUR,9.0,EUR,4,10,,,4.0,1.0,0,1,0,0,0,,,,,,black,forsamsungs21,50,Livraison standard,1.0,false,,50,,,CN,naizi2018case,naizi2018case,"94 % avis positifs (13,140 notes)",13140,4.459665144596651,5baf3dc19dfbcc25bad6e1f2,,,https://www.wish.com/c/605fe7b8a735701228a42eb7,https://canary.contestimg.wish.com/api/webimage/605fe7b8a735701228a42eb7-medium.jpg,605fe7b8a735701228a42eb7
20 couleurs laine béret tricot chapeau béret français des années 1920 mode chaud chapeau d'hiver femmes béret chapeau automne accessoire,20 Colors Wool Beret Knit Hat French Beret 1920s Fashion Warm Winter Hat Women's Beret Hat Fall Accessory,5.0,EUR,7.0,EUR,6,1000,,,4.422897196261682,428.0,289,78,29,17,15,,,,,,darkpink,,50,Livraison standard,2.0,false,,50,,,CN,Crossing Store,crossingstore,"92 % avis positifs (18,669 notes)",18669,4.339225453961112,55f05b38655d3b4274a67068,,,https://www.wish.com/c/5a09647cff96b66fb9bbcb00,https://canary.contestimg.wish.com/api/webimage/5a09647cff96b66fb9bbcb00-medium.jpg,5a09647cff96b66fb9bbcb00
Automne Mode Femmes Casual À Manches Longues Lettre Imprimer Sport Sweat À Capuche Plus La Taille Pull Tops Pull,Autumn Fashion Women Casual Long Sleeve Letter Print Sport Hooded Sweatshirt Plus Size Pullover Tops Sweater,10.0,EUR,10.0,EUR,11,1000,,,3.6083188908145583,577.0,234,107,103,42,91,,,,,,red,s,50,Livraison standard,2.0,false,,50,true,Quantité limitée !,CN,dongyalei1251,dongyalei1251,"(2,067 notes)",2067,4.168359941944848,584d7b2a728de62317df1322,,,https://www.wish.com/c/5ddc88768dacdf0024752883,https://canary.contestimg.wish.com/api/webimage/5ddc88768dacdf0024752883-medium.jpg,5ddc88768dacdf0024752883
Universel 7/8/9/10 pouces Durable 360 degrés rotatif PU Housse en cuir Housse de protection Housse anti-rayures pour PC tablette (10 couleurs),Universal 7/8/9/10 Inches Durable 360 Degree Rotating PU Leather Case Cover Protective Case Anti-scratch Tablet PC Case(10 Colors),3.98,EUR,4.0,EUR,4.82,1000,,,3.8583333333333334,600.0,285,129,77,34,75,,,,,,white,4inch,50,Livraison standard,1.0,false,,50,,,CN,asIcross,asicross,"89 % avis positifs (7,031 notes)",7031,4.186175508462523,59c1ca3c2351342b5569f5dc,,,https://www.wish.com/c/5c19c86f6b452a54e15c3025,https://canary.contestimg.wish.com/api/webimage/5c19c86f6b452a54e15c3025-medium.jpg,5c19c86f6b452a54e15c3025
Céramique Bouddha Main Série Encens Falls Brûleur D'encens Intérieur Fumée Cascade Porte-Encens Creative Backflow Brûleur D'encens,Ceramic Buddha Hand Series Incense Falls Incense Burner Indoor Smoke Waterfall Incense Holder Creative Backflow Incense Burner,19.0,EUR,19.0,EUR,22,10,,,4.944444444444445,18.0,17,1,0,0,0,,,,,,,size1teapot,50,Livraison standard,5.0,false,,50,true,Quantité limitée !,CN,"Jane Co,Ltd",janecoltd484c9464631711e7b21f061c1deec940,(28 notes),28,4.678571428571429,595f8b02dba4dc2c1de02e17,,,https://www.wish.com/c/5f4e653f6c9cc49eefa9b456,https://canary.contestimg.wish.com/api/webimage/5f4e653f6c9cc49eefa9b456-medium.jpg,5f4e653f6c9cc49eefa9b456
Gravity Falls Journal 3 Diepsloot journal LOGO collier lien chaîne tour de cou alliage pendentif colliers enfants bijoux,Gravity Falls Journal 3 Diepsloot Diary LOGO Necklace Link Chain Choker Alloy Pendant Necklaces Children Jewelry ,3.15,EUR,4.0,EUR,3.8200000000000003,1000,,,4.602666666666667,375.0,282,59,20,6,8,,,,,,,1,50,Livraison standard,1.0,false,,50,,,CN,Hawyou Store,hawyoustore,"86 % avis positifs (19,656 notes)",19656,4.150132275132275,58eb6f2120061d0fb2a78343,,,https://www.wish.com/c/591e8b80b9cbd627f78ad803,https://canary.contestimg.wish.com/api/webimage/591e8b80b9cbd627f78ad803-medium.jpg,591e8b80b9cbd627f78ad803
Célèbre Jeu En Ligne Fallout 4 Power Armor Action Figure Legacy Collection PVC Figure Modèle Jouet,Famous Online Game Fallout 4 Power Armor Action Figure Legacy Collection PVC Figure Model Toy,14.0,EUR,16.0,EUR,16,1000,,,4.460580912863071,723.0,495,136,48,18,26,,,,,,,,8,Livraison standard,5.0,false,,8,,,CN,GadgetsParadise,linksoonecommercecompany,"(25,833 notes)",25833,4.42290868269268,534e0a3434067e5e87b8a9dc,,,https://www.wish.com/c/56f4b3c0d3ff0c6a7453ebd3,https://canary.contestimg.wish.com/api/webimage/56f4b3c0d3ff0c6a7453ebd3-medium.jpg,56f4b3c0d3ff0c6a7453ebd3
The Peanut Snoopy Fall In Love Cute Sweetheart Cute Snoopy Black Mug 11oz 15oz Ceramic Coffee Cup,The Peanut Snoopy Fall In Love Cute Sweetheart Cute Snoopy Black Mug 11oz 15oz Ceramic Coffee Cup,10.0,EUR,25.0,EUR,11.89,1,,,5.0,0.0,,,,,,,,,,,,11oz,50,Livraison standard,9.99,false,,50,,,VN,maccc,maccc,90 % avis positifs (303 notes),303,4.32013201320132,5ffea615fa9415150cb997db,,,https://www.wish.com/c/603c88b15427214b3712b6a9,https://canary.contestimg.wish.com/api/webimage/603c88b15427214b3712b6a9-medium.jpg,603c88b15427214b3712b6a9
2020 nouveau 30 pièces Nature pommes de pin Lodge pôle décoratif automne hiver vacances ménage décor noël arbre ornements,2020 New 30pcs Nature Pine Cones Lodge Pole Decorative Fall Winter Holiday Household Decor Christmas Tree Ornaments,4.71,EUR,5.0,EUR,5.71,10,,,3.2857142857142856,7.0,3,0,2,0,2,,,,,,,hotsale,50,Livraison standard,1.0,false,,50,,,US,WALDICC,waldicc,92 % avis positifs (847 notes),847,4.304604486422668,59c0d54b21064f59bacb9640,,,https://www.wish.com/c/5f3e3c151d523f5cf1ee6fb2,https://canary.contestimg.wish.com/api/webimage/5f3e3c151d523f5cf1ee6fb2-medium.jpg,5f3e3c151d523f5cf1ee6fb2
Plus Size Camo Leopard Duas Peças Set Mulheres Rave Festival Jacket Tops Calças Queda 2 Peça Conjuntos de Correspondência Sexy Clube de Aniversário Outfits,Plus Size Camo Leopard Two Piece Set Women Rave Festival Jacket Tops Pants Fall 2 Piece Matching Sets Sexy Birthday Club Outfits,17.0,EUR,17.0,EUR,20,10,,,4.065573770491803,61.0,35,10,8,1,7,,,,,,armygreen,xs,50,Livraison standard,6.0,false,,50,,,CN,Fashion charm Leading Lady dress,qiyuetop,87% Feedback positivo (778 avaliações),778,4.109254498714653,5b49ab131d3bdc21bc67c699,,,https://www.wish.com/c/5dc283a42f80b211ace8f9d6,https://canary.contestimg.wish.com/api/webimage/5dc283a42f80b211ace8f9d6-medium.jpg,5dc283a42f80b211ace8f9d6
Porte-cartes de visite en bois étui à cartes professionnel en noyer marron pour table de bureau en bois support de cartes organisateur,Wood Business Card Display Holder Professional Brown Walnut Cards Case for Desktop Wooden Card Stand Tables Organizer,5.0,EUR,10.0,EUR,6,10,,,4.944444444444445,18.0,17,1,0,0,0,,,,,,yellow,1pcs,50,Livraison standard,2.0,false,,50,,,CN,wowhz,wowhz,"93 % avis positifs (2,764 notes)",2764,4.380607814761215,5951de5d7fe2414edbfcd50b,,,https://www.wish.com/c/5be430fc01d3f04edd3bfba3,https://canary.contestimg.wish.com/api/webimage/5be430fc01d3f04edd3bfba3-medium.jpg,5be430fc01d3f04edd3bfba3
1 bouquet de fleurs artificielles Rose lavande hortensia marguerite automne bouquet hybride pour la maison mariage décor de noël automne soie fausse fleur,1 Bunch Artificial Flowers Rose Lavender Hydrangea Daisy Autumn Hybrid Bouquet for Home Wedding Christmas Decor Fall Silk Fake Flower,3.86,EUR,4.0,EUR,4.68,10,,,5.0,0.0,,,,,,,,,,,orange,1pcs,50,Livraison standard,1.0,false,,50,,,CN,Liuxin1234665,liuxin1234665,81 % avis positifs (79 notes),79,3.8607594936708862,5fe2cd622a31cb43bff42c1b,,,https://www.wish.com/c/5ff7d6add012ff2dc7e251d5,https://canary.contestimg.wish.com/api/webimage/5ff7d6add012ff2dc7e251d5-medium.jpg,5ff7d6add012ff2dc7e251d5
