title,title_orig,discount_price,discount_price_currency,retail_price,retail_price_currency,discount_price_in_original_currency,nb_cart_orders_approx,nb_units_purchased_approx,uses_ad_boosts,rating,rating_count,rating_five_count,rating_four_count,rating_three_count,rating_two_count,rating_one_count,badges_count,badge_local_product,badge_product_quality,badge_fast_shipping,tags,product_color,product_variation_size_id,product_variation_inventory,shipping_option_name,shipping_option_price,shipping_is_express,countries_shipped_to,inventory_total,has_urgency_banner,urgency_text,origin_country,merchant_title,merchant_name,merchant_info_subtitle,merchant_rating_count,merchant_rating,merchant_id,merchant_has_profile_picture,merchant_profile_picture,product_url,product_picture,product_id
2020 grande taille ensembles femmes automne nouveau à manches longues lâche pantalon à capuche costume décontracté sweat à capuche décontracté mode hiver à capuche pull ample pantalon,2020 Plus Size Sets Women's Fall New Long-sleeved Loose Hooded Pants Casual Suit Casual Hoodie Fashion Winter Hoodie Loose Sweater Pants,19.0,EUR,19.0,EUR,23,10,,,4.163934426229508,61.0,37,8,9,3,4,,,,,,purple,xs,50,Livraison standard,6.0,false,,50,,,US,SenseoftaxbindingaJ,senseoftaxbindingaj,89 % avis positifs (150 notes),150,4.3,5f5010025987a2ecd5b6aa66,,,https://www.wish.com/c/5f92f40db22d812257f078d6,https://canary.contestimg.wish.com/api/webimage/5f92f40db22d812257f078d6-medium.jpg,5f92f40db22d812257f078d6
Mode décontractée pour femmes lâche manches longues chauve-souris tricoté cardigan chandail hauts vêtements d'extérieur manteau,Women's Fashion Casual Loose Long Bat Sleeve Knitted Cardigan Sweater Tops Outwear Coat,16.0,EUR,75.0,EUR,19,5000,,,4.2313749242883105,1651.0,972,346,175,59,99,,,,,,red,xs,50,Livraison standard,6.0,false,,50,,,CN,ONLYZY,onlyzy,"82 % avis positifs (18,839 notes)",18839,3.887414406284835,59aaa4d39fbc514dc80328e3,,,https://www.wish.com/c/5b8618e24b6dd01629ce0e08,https://canary.contestimg.wish.com/api/webimage/5b8618e24b6dd01629ce0e08-medium.jpg,5b8618e24b6dd01629ce0e08
Housse de couette imprimée animal chat chaton 3D avec taie d'oreiller ensemble de literie blanc,3D Kitten Cat Animal Print Quilt Duvet Cover with Pillow Case Bedding Set White,14.0,EUR,14.0,EUR,16,10,,,3.125,24.0,8,2,5,3,6,,,,,,,baby133x70,50,Livraison standard,4.0,false,,50,true,Quantité limitée !,CN,L4zhuyi,l4zhuyi,78 % avis positifs (293 notes),293,3.8088737201365186,5d4e2170b8ad134d0b93b0d4,,,https://www.wish.com/c/5f1f866b19447c0384dce1d1,https://canary.contestimg.wish.com/api/webimage/5f1f866b19447c0384dce1d1-medium.jpg,5f1f866b19447c0384dce1d1
Paw Patrol,,,,,,,,,,,,,,,,,,,,,,,,,,,,,,,,,,,,,,,,,https://www.wish.com/c/5e3b0ba49719eddf0ac7e67a,,5e3b0ba49719eddf0ac7e67a
Avengers,,,,,,,,,,,,,,,,,,,,,,,,,,,,,,,,,,,,,,,,,https://www.wish.com/c/5ed782eb90b8a6318c2d71f8,,5ed782eb90b8a6318c2d71f8
Conteneur d'oeufs Porte-oeufs Conteneur de stockage hermétique Réfrigérateur Cas d'oeufs Accessoires de cuisine en plastique Double couche,Eggcontainer Eggs Holder Airtight Storage Container Refrigerator eggs case Plastic Kitchen Accessories Double Layer,12.0,EUR,12.0,EUR,14,10,,,4.6390532544378695,169.0,134,22,6,1,6,,,,,,green,,50,Livraison Express,9.0,true,,50,,,CN,Warm Smile,warmsmile,"88 % avis positifs (2,808 notes)",2808,4.1648860398860394,58c62cb14f5bb75cd4a6a1ae,,,https://www.wish.com/c/59a1459bec9eeb4994afd538,https://canary.contestimg.wish.com/api/webimage/59a1459bec9eeb4994afd538-medium.jpg,59a1459bec9eeb4994afd538
To My Wonderful Wife Bedding Set Falling In Love With You Valentine Gift Bedding Cover With 2 Pillowcases 100% Polyester Size 175 cm x 265 cm,To My Wonderful Wife Bedding Set Falling In Love With You Valentine Gift Bedding Cover With 2 Pillowcases 100% Polyester Size 175 cm x 265 cm,38.0,EUR,38.0,EUR,44.99,0,,,5.0,0.0,,,,,,,,,,,,"twin(68""x86"")",50,Livraison standard,8.99,false,,50,,,VN,maccc,maccc,90 % avis positifs (303 notes),303,4.32013201320132,5ffea615fa9415150cb997db,,,https://www.wish.com/c/600f035efeeffacb6d4a7874,https://canary.contestimg.wish.com/api/webimage/600f035efeeffacb6d4a7874-medium.jpg,600f035efeeffacb6d4a7874
Case Ih Print Casquette de baseball Mode Hommes Femmes Summer Golf Cap Trucker Cap,Case Ih Print Baseball Cap Fashion Men Women Summer Golf Cap Trucker Cap,7.0,EUR,7.0,EUR,8,10,,,4.555555555555555,18.0,12,5,0,1,0,,,,,,black,one,50,Livraison standard,3.0,false,,50,,,CN,gfdsds,gfdsds,88 % avis positifs (657 notes),657,4.12937595129376,5d4c08715575bf3d225b9f8c,,,https://www.wish.com/c/5d70fe08fd3a6b3df47e8b03,https://canary.contestimg.wish.com/api/webimage/5d70fe08fd3a6b3df47e8b03-medium.jpg,5d70fe08fd3a6b3df47e8b03
Me Contro Te sac à dos sacs d'école mode Me Contro Te impression sac à dos sac à bandoulière étui à crayons étudiants garçons filles 3 pièces ensemble fournitures scolaires,Me Contro Te Backpack School Bags Fashion Me Contro Te Printing Backpack Shoulder Bag Pencil Case Students Boys Girls 3pcs Set School Supplies,17.0,EUR,17.0,EUR,20,10,,,4.387096774193548,93.0,62,16,7,5,3,,,,,,,1,50,Livraison standard,6.0,false,,50,,,CN,liminminli,liminminli,"91 % avis positifs (5,192 notes)",5192,4.290639445300462,587e175a274c414cada4f402,,,https://www.wish.com/c/5efab494e19a35274bc1c303,https://canary.contestimg.wish.com/api/webimage/5efab494e19a35274bc1c303-medium.jpg,5efab494e19a35274bc1c303
Ensemble pantalon large deux pièces pour l'automne hiver à l'automne de la femme,Wide pants two-piece set for the fall winter in the fall of the woman,102.0,EUR,102.0,EUR,123.0,0,,,5.0,0.0,,,,,,,,,,,gray,xl(66),50,Livraison standard,12.0,false,,50,,,KR,All of Korea,allofkorea,,0,5.0,5fd561db4706204525206b0f,,,https://www.wish.com/c/5fe764f2e70c4100423d0c52,https://canary.contestimg.wish.com/api/webimage/5fe764f2e70c4100423d0c52-medium.jpg,5fe764f2e70c4100423d0c52
Falling in Reverse - Drug in Me Is You [CD],Falling in Reverse - Drug in Me Is You [CD],17.0,EUR,27.0,EUR,20,2,,,5.0,1.0,1,0,0,0,0,,,,,,,,3,Livraison standard,6.0,false,,3,true,Quantité limitée !,US,DeepDiscountIntl,deepdiscountintl,"95 % avis positifs (4,096 notes)",4096,4.605224609375,593abd6720d56c2f0e3f3af0,,,https://www.wish.com/c/5b4343f8cb16cb165a6342cd,https://canary.contestimg.wish.com/api/webimage/5b4343f8cb16cb165a6342cd-medium.jpg,5b4343f8cb16cb165a6342cd
"Horseshoe Falls avec arc-en-ciel, Niagara Falls, Ontario, Canada Poster","Horseshoe Falls with rainbow, Niagara Falls, Ontario, Canada Poster Print",20.0,EUR,20.0,EUR,24,0,,,5.0,0.0,,,,,,,,,,,,27x9,50,Livraison standard,6.0,false,,50,,,US,Posterazzi,posterazzi,"77 % avis positifs (5,643 notes)",5643,3.8628389154704945,55c0deb64e6a0874f22b3167,,,https://www.wish.com/c/590d6f7cef6b445e407f6b92,https://canary.contestimg.wish.com/api/webimage/590d6f7cef6b445e407f6b92-medium.jpg,590d6f7cef6b445e407f6b92
Automne 2020 Nouvelle mode féminine Impression 3D T-shirt à manches longues et col rond Chemise décontractée ample Vêtements sociaux pour femmes.,Fall 2020 New Women's Fashion 3D Printing Long Sleeve Crew Neck T-shirt Loose Casual Shirt Women's Social Wear.,3.93,EUR,106.0,EUR,4.76,10,,,3.4761904761904763,21.0,6,6,5,0,4,,,,,,green,xxs,1,Livraison standard,1.0,false,,50,,,US,NeipingguaneGu,neipingguanegu,(164 notes),164,3.9146341463414633,5e6caa7c5510406669a391ae,,,https://www.wish.com/c/5fc72360a2859598dc692b22,https://canary.contestimg.wish.com/api/webimage/5fc72360a2859598dc692b22-medium.jpg,5fc72360a2859598dc692b22
8PCS / 1SET 30CM / 50CM étanche LED Meteor Shower Rain Lights Falling String Lights pour Outdoor Home Garden Wedding Party Holiday Christmas Lights,8PCS/1SET 30CM/50CM Waterproof LED Meteor Shower Rain Lights Falling String Lights for Outdoor Home Garden Wedding Party Holiday Christmas Lights ,2.25,EUR,3.0,EUR,2.73,1000,,,4.379454926624738,477.0,309,98,37,8,25,,,,,,green,10cmauplug,1,Livraison standard,1,false,,50,,,US,FishingforLuwF,fishingforluwf,92 % avis positifs (584 notes),584,4.385273972602739,5f500ef8bfc92cae5e0e7969,,,https://www.wish.com/c/5f96d983eef3adacf7ccf177,https://canary.contestimg.wish.com/api/webimage/5f96d983eef3adacf7ccf177-medium.jpg,5f96d983eef3adacf7ccf177
Mode Hiver Chaud Femmes Tricot Crochet Coton Couleur Unie Doux Épais Chaussettes Longues Cuissardes Leggings,Fashion Winter Warm Women Knit Crochet Cotton Solid color Soft Thick Long Socks Thigh-High Leggings,4.83,EUR,5.0,EUR,5.86,50000,,,4.060333896872359,9464.0,4950,1894,1450,581,589,,,,,,black,kneelength13.8in,50,Livraison Express,7.0,true,,50,,,CN,happy_holiday,happy_holiday,"90 % avis positifs (189,237 notes)",189237,4.225230795246173,53f2c9489020ee034d6d7394,,,https://www.wish.com/c/57aed9821ec1897b88ea585e,https://canary.contestimg.wish.com/api/webimage/57aed9821ec1897b88ea585e-medium.jpg,57aed9821ec1897b88ea585e
Falling Skies: la troisième saison complète [Blu-ray],Falling Skies: The Complete Third Season [Blu-ray],25.0,EUR,58.0,EUR,30,1,,,5.0,0.0,,,,,,,,,,,,,1,Livraison standard,9.0,false,,1,,,US,DeepDiscountIntl,deepdiscountintl,"95 % avis positifs (4,096 notes)",4096,4.605224609375,593abd6720d56c2f0e3f3af0,,,https://www.wish.com/c/5b40929e2b0a400eb3ffa025,https://canary.contestimg.wish.com/api/webimage/5b40929e2b0a400eb3ffa025-medium.jpg,5b40929e2b0a400eb3ffa025
Coussins de sol en mandala indien Coussins de coussin bohèmes ronds couvrent un énorme cas,Indian Mandala Floor Pillows Round Bohemian Cushion Pillows Cover Huge Case ,5.0,EUR,28.0,EUR,5,10,,,3.3636363636363638,33.0,9,9,5,5,5,,,,,,blue,,14,Livraison standard,2.0,false,,28,,,CN,badydog,badydog,"91 % avis positifs (35,656 notes)",35656,4.302389499663451,561e07fad9b51a0f5e304344,,,https://www.wish.com/c/5bf28051c7a69d17408256ca,https://canary.contestimg.wish.com/api/webimage/5bf28051c7a69d17408256ca-medium.jpg,5bf28051c7a69d17408256ca
Chaussures bateau plates Chaussures Princess Chaussures Princess Chaussures décontractées à bout rond Chaussures décontractées pour femmes Chaussures décontractées à bouts ronds Plus Grande Taille,Women's Fashion Candy color Shallow Mouth Flat Boat Shoes Flats Princess Shoes casual round toe daily casual shoe Plus Size,8.0,EUR,8.0,EUR,9,5000,,,3.971619365609349,1198.0,616,245,147,67,123,,,,,,red,7.5,50,Livraison standard,3.0,false,,50,,,CN,liaishenhou,liaishenhou,"89 % avis positifs (6,950 notes)",6950,4.203021582733813,5ad00d9acd968d0acc1eebd8,,,https://www.wish.com/c/5ae40032246bb01c25ec6963,https://canary.contestimg.wish.com/api/webimage/5ae40032246bb01c25ec6963-medium.jpg,5ae40032246bb01c25ec6963
Summer Punk Cropped T-shirt Soutien-Gorge Sans Manche Col Montant Camis Femme Wetlook Slim Crop Tops Automne Gilet,Summer Punk Cropped Tank Top Bra Sleeveless Stand Collar Camis Women Wetlook Slim Crop Tops Fall Vest,10.0,EUR,38.0,EUR,11,10,,,4.158940397350993,151.0,88,28,16,9,10,,,,,,,s,50,Livraison standard,3.0,false,,50,true,Quantité limitée !,CN,BoutiqueMarket,boutiquemarket,"94 % avis positifs (5,692 notes)",5692,4.401440618411806,597ef6900ec30f6129979aec,,,https://www.wish.com/c/5b3ed2bd1b361206de72e7e9,https://canary.contestimg.wish.com/api/webimage/5b3ed2bd1b361206de72e7e9-medium.jpg,5b3ed2bd1b361206de72e7e9
Affiche du film Timber Falls (11 x 17),Timber Falls Movie Poster (11 x 17),23.0,EUR,23.0,EUR,27,0,,,5.0,0.0,,,,,,,,,,,,11x17,50,Livraison standard,7.0,false,,50,,,US,Posterazzi,posterazzi,"77 % avis positifs (5,643 notes)",5643,3.8628389154704945,55c0deb64e6a0874f22b3167,,,https://www.wish.com/c/590535b29d70be25acc49974,https://canary.contestimg.wish.com/api/webimage/590535b29d70be25acc49974-medium.jpg,590535b29d70be25acc49974
Automne Wimter Tik Tok femmes hommes haute qualité 3D flamme impression survêtement à capuche / sweatshirts + joggers pantalon costume,Autumn Wimter Tik Tok Women Men High Quality 3D Flame Printing Tracksuit Hoodie/Sweatshirts+joggers Pants Suit,10.0,EUR,40.0,EUR,12,10,,,3.96,25.0,14,3,4,1,3,,,,,,green,s,4,Livraison standard,3.0,false,,50,,,CN,Laernlei Boysclothes,laernleiboysclothes,89 % avis positifs (109 notes),109,4.128440366972477,5dee0aa589ccae06ae9a7d1e,,,https://www.wish.com/c/5fcd97db31f152992244458d,https://canary.contestimg.wish.com/api/webimage/5fcd97db31f152992244458d-medium.jpg,5fcd97db31f152992244458d
Gants courts en cuir de motocross d'été moto coque rigide respirant anti-chute gants de course de cross-country en plein air,Summer Motocross Leather Short Gloves Motorcycle Hard Shell Breathable Anti-fall Outdoor Cross Country Racing Gloves,19.0,EUR,42.0,EUR,22,10,,,4.453608247422681,97.0,61,24,9,1,2,,,,,,red,m,42,Livraison standard,5.0,false,,50,true,Quantité limitée !,CN,MOTO Knight supplies,motoknightsupplies,"91 % avis positifs (5,166 notes)",5166,4.340301974448316,5d414692fe55c8298ee29871,,,https://www.wish.com/c/5d63b01986e21502069d0c86,https://canary.contestimg.wish.com/api/webimage/5d63b01986e21502069d0c86-medium.jpg,5d63b01986e21502069d0c86
Femmes Lanterne Chemisier À Manches Longues Col Haut Arc Casual Lâche Élégant Chemise De Bureau Plus La Taille Tops Blusas,Women Lantern Long Sleeve Blouse High Collar Bow Casual Loose Elegant Office Shirt Plus Size Tops Blusas,12.0,EUR,12.0,EUR,14,1000,,,3.9589371980676327,414.0,217,69,61,28,39,,,,,,winered,s,50,Livraison Express,6.0,true,,50,,,CN,Fannystore2016,fannystore2016,"89 % avis positifs (31,425 notes)",31425,4.159045346062053,582bd2fde18c0f0a402ba101,,,https://www.wish.com/c/5d760cfcbaba6a2537b70108,https://canary.contestimg.wish.com/api/webimage/5d760cfcbaba6a2537b70108-medium.jpg,5d760cfcbaba6a2537b70108
2020 nouvelle mise à niveau housse de canapé élastique pour salon housse de meubles extensible housse de canapé universelle housse de canapé pas cher 1/2/3 places,2020 New Upgrade Elastic Sofa Cover for Living Room Stretch Furniture Cover Universal Couch Cover Case Sofa Slipcover Cheap 1/2/3 Seater,7.0,EUR,61.0,EUR,8,10,,,3.8214285714285716,84.0,33,22,17,5,7,,,,,,olive,1seat,2,Livraison standard,2.0,false,,50,,,CN,StrongYuanZhen2,strongyuanzhen2,"89 % avis positifs (1,240 notes)",1240,4.145161290322581,5d8082e11c4dc653b907199c,,,https://www.wish.com/c/5e7ab357b7cc0719ce57e079,https://canary.contestimg.wish.com/api/webimage/5e7ab357b7cc0719ce57e079-medium.jpg,5e7ab357b7cc0719ce57e079
Femmes Echarpes d'Automne Hiver Surdimensionné Luxe Marque de luxe Tendance Soie chinoise Echarpe Longue Echarpe Châle Enveloppe Nouveau Vin Vin Nouveau Echarpe Tête Rouge Foulard Tête Rouge,Women Scarves Fall Winter Oversized Luxury Brand Trendy Chinese Silk Long Scarf Shawl Wrap New Wine Red Neck Head Scarf,7.0,EUR,16.0,EUR,8,1000,,,4.480362537764351,993.0,721,137,70,21,44,,,,,,navyblue,190cmby80cm,50,Livraison standard,2.0,false,,50,true,Quantité limitée !,CN,China Silk Mall,chinasilkmall,"94 % avis positifs (5,430 notes)",5430,4.506077348066299,5685ddbb5fa9ee26b6645f25,,,https://www.wish.com/c/59e1d4291b304a7cc339b51e,https://canary.contestimg.wish.com/api/webimage/59e1d4291b304a7cc339b51e-medium.jpg,59e1d4291b304a7cc339b51e
5 couches Anti-chute en métal Séchage Pan Pot Rack Couverture Couvercle Reste Stand Cuillère Titulaire Cuisine Outils,5 Layer Anti-fall Metal Drying Pan Pot Rack Cover Lid Rest Stand Spoon Holder Kitchen Tools,21.0,EUR,83.0,EUR,25,10,,,5.0,2.0,2,0,0,0,0,,,,,,,,50,Livraison standard,6.0,false,,50,,,CN,taomeimei,taomeimei,93 % avis positifs (358 notes),358,4.430167597765363,5a4776d8149ff87833bf7af8,,,https://www.wish.com/c/5f97bea3f4f41c03504adf55,https://canary.contestimg.wish.com/api/webimage/5f97bea3f4f41c03504adf55-medium.jpg,5f97bea3f4f41c03504adf55
50x32mm 40 pcs Conception de Triangle Creux Sculpture Motif Connecteurs Métal Artisanat Bijoux Accessoires DIY Livre Photo Album Cas Jambe Coin Décoratif Protecteur Gadgets,50x32mm 40pcs Design of Triangle Hollow Carving Pattern Connectors Metal Crafts Jewelry Accessories DIY Book Photo Album Case Leg Corner Decorative Protector Gadgets,3.99,EUR,4.0,EUR,4.83,1000,,,4.718,500.0,407,60,24,3,6,,,,,,,gold,50,Livraison standard,1.0,false,,50,true,Quantité limitée !,CN,wangpc,wangpc,"(10,103 notes)",10103,4.555379590220727,591d407c3d39a15dab6bc5b0,,,https://www.wish.com/c/599fb60991c5c97a08f15f53,https://canary.contestimg.wish.com/api/webimage/599fb60991c5c97a08f15f53-medium.jpg,599fb60991c5c97a08f15f53
LED Meteor Shower Rain Lights 30CM 50CM Waterproof Xmas Decoration Light Falling String Lights for Wedding Party Christmas Lights 8pcs/set,LED Meteor Shower Rain Lights 30CM 50CM Waterproof Xmas Decoration Light Falling String Lights for Wedding Party Christmas Lights 8pcs/set,7.0,EUR,7.0,EUR,8,10,,,5.0,0.0,,,,,,,,,,,white,bottlelight-3cm(just1pcs),1,Livraison standard,2.0,false,,50,,,CN,happy life for all,happylifeforall,,0,5.0,5e63b48429e786751705c9a8,,,https://www.wish.com/c/605eb47a6863b8bcf3546c59,https://canary.contestimg.wish.com/api/webimage/605eb47a6863b8bcf3546c59-medium.jpg,605eb47a6863b8bcf3546c59
Étoiles filantes bleu vif dans le ciel nocturne - Kit d'enveloppe de vinyle autocollant de peau compatible avec les gobelets refroidisseur Yeti Rambler,Vivid Blue Falling Stars in the Night Sky - Skin Decal Vinyl Wrap Kit compatible with the Yeti Rambler Cooler Tumbler Cups,14.0,EUR,14.0,EUR,16,10,,,2.8,20.0,6,2,3,0,9,,,,,,,10ozlowball,50,Livraison standard,5.0,false,,50,,,US,CoveredAir,coveredair,56 % avis positifs (263 notes),263,3.041825095057034,5e7050197999e04240b30264,,,https://www.wish.com/c/5f1dd44ad83d081ff65865d1,https://canary.contestimg.wish.com/api/webimage/5f1dd44ad83d081ff65865d1-medium.jpg,5f1dd44ad83d081ff65865d1
Naturehike,,,,,,,,,,,,,,,,,,,,,,,,,,,,,,,,,,,,,,,,,https://www.wish.com/c/5f293ff8eb31f9a50852fe7b,,5f293ff8eb31f9a50852fe7b
John Lennon,,,,,,,,,,,,,,,,,,,,,,,,,,,,,,,,,,,,,,,,,https://www.wish.com/c/5e8d2fd29719ed640496769d,,5e8d2fd29719ed640496769d
 Curseurs de cadre en aluminium de moto Crash protecteur de chute pour Yamaha MT-07 MT-09 MT 07 MT 09 2014-2019-2020, Motorcycle Aluminum Frame Sliders Crash Falling Protector For Yamaha MT-07 MT-09 MT 07 MT 09 2014-2019-2020,34.0,EUR,42.0,EUR,41,10,,,5.0,2.0,2,0,0,0,0,,,,,,,mt07black,50,Livraison standard,11.0,false,,50,,,CN,MOWOK,mowok,"(1,274 notes)",1274,4.520408163265306,5be53409eefe0a2edf70278b,,,https://www.wish.com/c/5fb726aa8dbe0b6d0ea270ba,https://canary.contestimg.wish.com/api/webimage/5fb726aa8dbe0b6d0ea270ba-medium.jpg,5fb726aa8dbe0b6d0ea270ba
2021 nouvelle mise à niveau 360 Pages A5 couverture en cuir PU Journal de voyage carnet de notes doublé papier journal cadeau de noël,2021 New Upgrade 360 Pages A5 PU Leather Cover Traveler Journal Notebook Lined Paper Diary Christmas Gift,3.91,EUR,4.0,EUR,4.74,1000,,,4.519417475728155,206.0,153,33,5,4,11,,,,,,black,onlypen,50,Livraison standard,1.0,false,,50,true,Quantité limitée !,US,kallie.osinski,kallieosinski,92 % avis positifs (267 notes),267,4.348314606741573,5f53cbaac0decf003de9e43e,,,https://www.wish.com/c/5f8bc68557d8494bc4910c31,https://canary.contestimg.wish.com/api/webimage/5f8bc68557d8494bc4910c31-medium.jpg,5f8bc68557d8494bc4910c31
Minimaliste Vintage Texture Taie d'oreiller Géométrie Style Décoratif Oreiller Plante Motif Abstrait Taie D'oreiller Doux Housse de Coussin Canapé Taie d'oreiller,Minimalist Vintage Texture Pillow Cover Geometry Style Decorative Pillow Plant Abstract Pattern Pillowcase Soft Cushion Cover Sofa Pillow Case ,3.08,EUR,5.0,EUR,3.73,1000,,,3.928030303030303,264.0,131,59,29,14,31,,,,,,,1,50,Livraison standard,1.0,false,,50,true,Quantité limitée !,CN,meironga,meironga,"87 % avis positifs (4,350 notes)",4350,4.107126436781609,590482f686ccee21d943deca,,,https://www.wish.com/c/5de4b3cf51fe45c72bc3f801,https://canary.contestimg.wish.com/api/webimage/5de4b3cf51fe45c72bc3f801-medium.jpg,5de4b3cf51fe45c72bc3f801
"Hommes nouveaux pantalons pour hommes automne 2019, pantalons décontractés à grandes poches Hip Hop, pantalons cargo","Men's New Men's Fall 2019 Pants, Hip Hop Large Pockets Casual Pants, Cargo Pants",19.0,EUR,19.0,EUR,23,1000,,,4.451515151515151,330.0,239,46,19,7,19,,,,,,red,m,50,Livraison standard,6.0,false,,50,true,Quantité limitée !,CN,jingjiashanggui,景佳商柜,"(1,310 notes)",1310,4.1,56e030a050a07a16c81a51c7,,,https://www.wish.com/c/5d74db0bc7a6411a2756ef9d,https://canary.contestimg.wish.com/api/webimage/5d74db0bc7a6411a2756ef9d-medium.jpg,5d74db0bc7a6411a2756ef9d
Bureau Creux En Métal Porte-Stylo Cas Multifonctionnel Organisateur Bureau À Domicile École Papeterie Décor Cosmétique De Stockage,Desk Hollow Metal Pen Holder Case Multifunctional Organizer Home Office School Stationery Decor Cosmetic Storage,5.0,EUR,5.0,EUR,6,10,,,4.533333333333333,15.0,12,1,0,2,0,,,,,,,a-9.5x8x8cm,50,Livraison standard,2.0,false,,50,true,Quantité limitée !,CN,longyipu,longyipu,"90 % avis positifs (8,613 notes)",8613,4.279577383025659,5b987aedaa34c31e4abd4c52,,,https://www.wish.com/c/5ee074131eb7d6321a6a5a8a,https://canary.contestimg.wish.com/api/webimage/5ee074131eb7d6321a6a5a8a-medium.jpg,5ee074131eb7d6321a6a5a8a
"Chemise pour homme décontractée à la mode d'automne, chemise pour homme de couleur unie sociale d'entreprise avec revers.","Fall fashion casual men's shirt, business social solid color men's shirt with lapel.",4.69,EUR,14.0,EUR,5.6899999999999995,10,,,3.142857142857143,7.0,2,1,2,0,2,,,,,,armygreen,s,2,Livraison standard,2.0,false,,50,,,CN,Aomstli,008casual,"79 % avis positifs (2,327 notes)",2327,3.7589170605930384,5d901e6c05d47d46e689b9ea,,,https://www.wish.com/c/5f796cfdb17b8e003f09d169,https://canary.contestimg.wish.com/api/webimage/5f796cfdb17b8e003f09d169-medium.jpg,5f796cfdb17b8e003f09d169
T-shirt décontracté à manches longues pour femmes,Women Summer Leisure Holiday Tees Ladies Basic Shinny Top Studded Hollow Out Long Sleeve Casual T-Shirt,5.0,EUR,42.0,EUR,6,5000,,,4.097797356828194,1135.0,625,222,143,64,81,,,,,,black,xs,16,Livraison standard,2.0,false,,50,,,CN,all li,allli,"89 % avis positifs (1,747 notes)",1747,4.192329708070979,580b717138fd671ab1685783,,,https://www.wish.com/c/5d0c6003c565a825e817cdac,https://canary.contestimg.wish.com/api/webimage/5d0c6003c565a825e817cdac-medium.jpg,5d0c6003c565a825e817cdac
Manteau en tricot à capuche à manches longues pour femmes,women Hooded Long Sleeve Cardigan Sweater Coat,19.0,EUR,47.0,EUR,23,20000,,,3.072123640526617,1747.0,517,260,279,214,477,,,,,,darkgrey,,50,Livraison standard,6.0,false,,50,,,,freebird,fashionshow,"(852,711 notes)",852711,4.103545046328709,52bd3ddb34067e4620a4c62d,,,https://www.wish.com/c/52c281717360467b6c558927,https://canary.contestimg.wish.com/api/webimage/52c281717360467b6c558927-medium.jpg,52c281717360467b6c558927
Etui à clés de voiture en cuir Couvercle d'entrée sans clé Télécommande Fob Protector Shell Accessoires pour Renault Koleos Kadjar Scenic Megane Sandero,Leather Car Key Case Keyless Entry Cover Remote Fob Protector Shell Accessories for Renault Koleos Kadjar Scenic Megane Sandero,7.0,EUR,21.0,EUR,8,1000,,,4.60377358490566,265.0,196,43,19,4,3,,,,,,red,,50,Livraison standard,2.0,false,,50,,,CN,Wonderful hut,wonderfulhut2518d5228ae911e6a09d0699b001cba4,(484 notes),484,4.464876033057851,57f4da4f9d1683102e88b98c,,,https://www.wish.com/c/5b28a5a8c56f890ce3e23add,https://canary.contestimg.wish.com/api/webimage/5b28a5a8c56f890ce3e23add-medium.jpg,5b28a5a8c56f890ce3e23add
Trousse de toilette pour femmes,8 Colors Women's Fashion Makeup Case Toiletry Kits Practical Travel Cosmetic Bag,3.92,EUR,12.0,EUR,4.75,10,,,4.267857142857143,56.0,36,8,5,5,2,,,,,,multicolor,multicolorlips&black,50,Livraison standard,1.0,false,,50,true,Quantité limitée !,CN,justenjoyit,mingchuantradeltd,"(13,452 notes)",13452,4.4373327386262265,544de67b8edcfa4c546f4f8b,,,https://www.wish.com/c/55dc01dc6d77812fc8510b08,https://canary.contestimg.wish.com/api/webimage/55dc01dc6d77812fc8510b08-medium.jpg,55dc01dc6d77812fc8510b08
36 Pcs 3mm / 5mm Lettre et Numéro Poinçon Timbre Alphabet En Acier Estampage Kit De Pressage Ensemble Poinçon Outil Cas Artisanat,36Pcs 3mm/5mm Letter & Number Punch Stamp Steel Alphabet Stamping Pressing Kit Set Punch  Tool Case Craft,19.0,EUR,20.0,EUR,22,10,,,4.355212355212355,259.0,162,56,23,7,11,,,,,,,3mm,8,Livraison standard,5.0,false,,8,,,CN,kathey,kathey,"90 % avis positifs (28,849 notes)",28849,4.268848140316822,585a49adef562825df0e07c2,,,https://www.wish.com/c/5985b599d7d4ab55e2d5e396,https://canary.contestimg.wish.com/api/webimage/5985b599d7d4ab55e2d5e396-medium.jpg,5985b599d7d4ab55e2d5e396
Décorations de Thanksgiving allumé guirlande d'automne -10 / 20/30 LED décor de Thanksgiving Halloween lumières de la chaîne,Thanksgiving Decorations Lighted Fall Garland -10/ 20/30 LED Thanksgiving Decor Halloween String Lights,5.0,EUR,5.0,EUR,6,10000,,,4.565721256480634,3279.0,2387,554,209,64,65,,,,,,,10leds,50,Livraison standard,2.0,false,,50,,,CN,dream009 est un vendeur agréé,dream009,"89 % avis positifs (13,160 notes)",13160,4.264589665653496,59a408c53eb22a65ac9b6e92,,,https://www.wish.com/c/5bd561add5936e29594c0fd0,https://canary.contestimg.wish.com/api/webimage/5bd561add5936e29594c0fd0-medium.jpg,5bd561add5936e29594c0fd0
10 couleurs automne et hiver mode vêtements pour femmes grande taille à manches longues chandails tricotés couleur unie hauts,10 Colors Autumn And Winter Fashion Women's Clothing Plus Size Long Sleeve Knitted Sweaters Solid Color Tops,3.0,EUR,3.0,EUR,3,20000,,,3.774193548387097,3689.0,1715,662,548,292,472,,,,,,black,s,1,Livraison standard,1.0,false,,50,,,CN,gaoshunyong,gaoshunyong,"87 % avis positifs (8,151 notes)",8151,4.103177524230156,591fe85420a2106df8efb306,,,https://www.wish.com/c/5badca2679b48c1a589b482a,https://canary.contestimg.wish.com/api/webimage/5badca2679b48c1a589b482a-medium.jpg,5badca2679b48c1a589b482a
