title,title_orig,discount_price,discount_price_currency,retail_price,retail_price_currency,discount_price_in_original_currency,nb_cart_orders_approx,nb_units_purchased_approx,uses_ad_boosts,rating,rating_count,rating_five_count,rating_four_count,rating_three_count,rating_two_count,rating_one_count,badges_count,badge_local_product,badge_product_quality,badge_fast_shipping,tags,product_color,product_variation_size_id,product_variation_inventory,shipping_option_name,shipping_option_price,shipping_is_express,countries_shipped_to,inventory_total,has_urgency_banner,urgency_text,origin_country,merchant_title,merchant_name,merchant_info_subtitle,merchant_rating_count,merchant_rating,merchant_id,merchant_has_profile_picture,merchant_profile_picture,product_url,product_picture,product_id
Nasal Sprays Chronic Rhinitis Sinusitis Spray Herb Chinese Medicine Fast Effect,Nasal Sprays Chronic Rhinitis Sinusitis Spray Herb Chinese Medicine Fast Effect,5.0,EUR,5.0,EUR,6,3,,,5.0,0.0,,,,,,,,,,,,hotsale,50,Livraison standard,2.0,false,,50,true,Quantité limitée !,US,DongYueKongoR,dongyuekongor,94 % avis positifs (18 notes),18,4.555555555555555,5f5018a75987a22fcbb6aa3e,,,https://www.wish.com/c/5f5c8d3229e4305103f799d7,https://canary.contestimg.wish.com/api/webimage/5f5c8d3229e4305103f799d7-medium.jpg,5f5c8d3229e4305103f799d7
1L / 2L Botella de agua de viaje para deportes al aire libre Portátil a prueba de fugas Ciclismo Camping Taza de agua Impresión de letras Taza para deportes al aire libre a prueba de fugas con filtro,1L / 2L Outdoor Sports Travel Water Bottle Portable Leak-proof Cycling Camping Water Cup Letter Print Leakproof Outdoor Sports Readily Cup with Filter,12.0,EUR,57.0,EUR,14,10,,,4.625,40.0,30,6,3,1,0,,,,,,pink,1000ml,50,Livraison standard,4.0,false,,50,,,CN,Gulanly,1flyangel,(346 calificaciones),346,4.471098265895954,5ac3637b18435443640b7677,,,https://www.wish.com/c/5d73c8a13128230db6f52a4d,https://canary.contestimg.wish.com/api/webimage/5d73c8a13128230db6f52a4d-medium.jpg,5d73c8a13128230db6f52a4d
Nature Queen,,,,,,,,,,,,,,,,,,,,,,,,,,,,,,,,,,,,,,,,,https://www.wish.com/c/5eda260090b8a631048f8c03,,5eda260090b8a631048f8c03
"Mason Naturals Hall Herb Beet Root Magnesium Tablets, 100 Packs, 1 Pack (please check the description)","Mason Naturals Hall Herb Beet Root Magnesium Tablets, 100 Packs, 1 Pack (please check the description)",58.0,EUR,58.0,EUR,70.0,0,,,5.0,0.0,,,,,,,,,,,,,6,Livraison standard,12.0,false,,6,,,KR,K-Mild,kmild,63 % avis positifs (8 notes),8,3.0,5ff5ca506fb1f4d5c07d6fd6,,,https://www.wish.com/c/60129b6590a2a2a14fba93d5,https://canary.contestimg.wish.com/api/webimage/60129b6590a2a2a14fba93d5-medium.jpg,60129b6590a2a2a14fba93d5
"Dr Today 37.5 Herbal Herb Wrist-Haired Poultice Pack Navy, 1","Dr. Today 37.5 Herbal Herb Wrist-Haired Poultice Pack Navy, 1",74.0,EUR,74.0,EUR,89.0,0,,,5.0,0.0,,,,,,,,,,,,,10,Livraison standard,12.0,false,,10,true,Quantité limitée !,KR,abckorea,abckorea,50 % avis positifs (2 notes),2,3.0,5ff1208a858e8522e2389e39,,,https://www.wish.com/c/5ffd3a815e093f677b4e1795,https://canary.contestimg.wish.com/api/webimage/5ffd3a815e093f677b4e1795-medium.jpg,5ffd3a815e093f677b4e1795
Nouvelle passoire à thé filtre saveur totale thé infuseur outils tourbillonner raide Stir Press Herbe saine Puer thé et café accessoires Gadget 35812,New Tea Strainer Filter Flavor Total Tea Infuser Tools Swirl Steep Stir Press Healthy Herb Puer Tea&Coffee Accessories Gadget 35812,3.14,EUR,6.0,EUR,3.81,1000,,,4.335060449050086,579.0,362,112,62,23,20,,,,,,,,50,Livraison standard,1.0,false,,50,,,CN,Felixss Shop,felixssshop,89 % avis positifs (625 notes),625,4.2448,5d3f9ed60ff7f90ae1ef962d,,,https://www.wish.com/c/5e0ef1feb62af60b1a86b4bc,https://canary.contestimg.wish.com/api/webimage/5e0ef1feb62af60b1a86b4bc-medium.jpg,5e0ef1feb62af60b1a86b4bc
Mini tuyaux de fumée en métal de qualité supérieure durables Fumer des tuyaux de tabac à herbes avec couvercle couleur aléatoire,Durable Top quality Mini Metal Smoke Pipes Smoking Pipe Herb Tobacco Pipes with Lid Random Color,5.0,EUR,5.0,EUR,5,1000,,,4.5,218.0,156,38,11,3,10,,,,,,,1pcs,50,Livraison standard,2.0,false,,50,true,Quantité limitée !,CN,xuxiuling,xuxiuling,"95 % avis positifs (2,053 notes)",2053,4.497808085728202,5ae9274bc4721417e0286887,,,https://www.wish.com/c/5b35172ac94cb91712bd992e,https://canary.contestimg.wish.com/api/webimage/5b35172ac94cb91712bd992e-medium.jpg,5b35172ac94cb91712bd992e
Ginger Herbs Anti Chute De Cheveux Croissance Des Cheveux Essence Huile Réparation Des Cheveux Shampooing Rapide,Ginger Herbs Anti Hair Loss Hair Growth Essence Oil Hair Repair Shampoo Fast,4.0,EUR,5.0,EUR,4.85,10,,,3.851063829787234,47.0,25,7,6,1,8,,,,,,,growthessence20ml,50,Livraison standard,1.0,false,,50,,,CN,efox,efoxebusinessinternationalcoltd,"88 % avis positifs (110,722 notes)",110722,4.174102707682303,53d8e270ff4d6d369ece5cba,,,https://www.wish.com/c/5f05632c3d293632228545f6,https://canary.contestimg.wish.com/api/webimage/5f05632c3d293632228545f6-medium.jpg,5f05632c3d293632228545f6
"4.5 ""GHOST MAGIC COLLECTIBLE TOBACCO GLASS PIPE FUMING HERB BOWL TUYAUX À MAIN","4.5"" GHOST MAGIC COLLECTIBLE TOBACCO GLASS PIPE SMOKING HERB BOWL HAND PIPES",24.0,EUR,58.0,EUR,28,10,,,4.284848484848485,330.0,226,38,28,10,28,,,,,,ivory,packof1,50,Livraison standard,8.0,false,,50,,,US,JCHATS,jchats,"92 % avis positifs (10,180 notes)",10180,4.445874263261297,5be0ecca58512119a812e8b2,,,https://www.wish.com/c/5c2ecd4856b7272edb2677c6,https://canary.contestimg.wish.com/api/webimage/5c2ecd4856b7272edb2677c6-medium.jpg,5c2ecd4856b7272edb2677c6
1 paquet de fine tisane fumée thé noir cigarette fine pour arrêter de fumer 100% sans tabac -100% sans nicotine,1Pack of Fine Herbal Tea Smoke Black Tea Fine Cigarette to Quit smoking  100% Tobacco Free -100% Nicotine Free,4.77,EUR,5.0,EUR,5.78,1000,,,3.7784615384615385,325.0,165,44,45,21,50,,,,,,,random1pack,50,Livraison standard,2.0,false,,50,true,Quantité limitée !,CN,Bagrace,bagrace,"90 % avis positifs (8,213 notes)",8213,4.271886034335809,53da4eacd911391c3b21feeb,,,https://www.wish.com/c/5f4e16525c0d0e03de39fa4a,https://canary.contestimg.wish.com/api/webimage/5f4e16525c0d0e03de39fa4a-medium.jpg,5f4e16525c0d0e03de39fa4a
Moulin à herbes à 4 couches avec couvercle magnétique en alliage de zinc,4-Layer Herb Grinder with Magnetic Lid Zinc Alloy,10.0,EUR,10.0,EUR,12,10,,,2.25,4.0,0,0,2,1,1,,,,,,green,,50,Livraison standard,3.0,false,,50,,,CN,moon rolling papers,moonrollingpapers,"96 % avis positifs (19,953 notes)",19953,4.567283115321004,569750bc73c0e07b958e8b60,,,https://www.wish.com/c/5f3e5a70dfad64b1b64ed2fb,https://canary.contestimg.wish.com/api/webimage/5f3e5a70dfad64b1b64ed2fb-medium.jpg,5f3e5a70dfad64b1b64ed2fb
Blood Sugar Support Supplement - Helps with Blood Glucose & Weight Loss - Natural Herb Health Level Formula - 60 Capsule Pills - High Amounts of Cinnamon Bark Powder,Blood Sugar Support Supplement - Helps with Blood Glucose & Weight Loss - Natural Herb Health Level Formula - 60 Capsule Pills - High Amounts of Cinnamon Bark Powder,74.0,EUR,74.0,EUR,89.0,0,,,5.0,0.0,,,,,,,,,,,,,3,Livraison standard,12.0,false,,3,,,KR,tongrou,tongrou,100 % avis positifs (1 notes),1,4.0,5fa2655960b29f003e882eb0,,,https://www.wish.com/c/607aac63a9d881ad49bd940b,https://canary.contestimg.wish.com/api/webimage/607aac63a9d881ad49bd940b-medium.jpg,607aac63a9d881ad49bd940b
"4.5 ""PURPLE DONUT TOBACCO GLASS PIPE SMOKING HERB BOWL TUYAUX À MAIN","4.5"" PURPLE DONUT TOBACCO GLASS PIPE SMOKING HERB BOWL HAND PIPES",24.0,EUR,49.0,EUR,28,10,,,4.598130841121495,214.0,168,23,12,5,6,,,,,,purple,packof1,45,Livraison standard,8.0,false,,45,,,US,JCHATS,jchats,"92 % avis positifs (10,180 notes)",10180,4.445874263261297,5be0ecca58512119a812e8b2,,,https://www.wish.com/c/5dc8ca75a00e1e68ca9acbec,https://canary.contestimg.wish.com/api/webimage/5dc8ca75a00e1e68ca9acbec-medium.jpg,5dc8ca75a00e1e68ca9acbec
4 couches de broyeur de tabac en alliage d'aluminium d'herbes sèches aux épices mauvaises herbes Broyeur d'herbes de fumée aux herbes à base de plantes manivelle Muller Mill Pollinator,4 Layer Tobacco Grinder  Aluminum Alloy Dry Herb Spice Weeds Grass Grinder Smoke Herbal Herb Hand Crank Muller Mill Pollinator,10.0,EUR,50.0,EUR,11,10000,,,4.41602634467618,1822.0,1245,308,137,46,86,,,,,,blue,25mmby15mm,50,Livraison standard,3.0,false,,50,true,Quantité limitée !,CN,amberdef,amberdef,"89 % avis positifs (41,161 notes)",41161,4.223026651441899,5ac88d1dc989490ac65b8842,,,https://www.wish.com/c/5be3a8ebbad9092beaf62b29,https://canary.contestimg.wish.com/api/webimage/5be3a8ebbad9092beaf62b29-medium.jpg,5be3a8ebbad9092beaf62b29
New Hand-operated Grain Grinder Machine Corn Soy Herb Nut Grinder Electric Pepper Mills Kitchen Tool,New Hand-operated Grain Grinder Machine Corn Soy Herb Nut Grinder Electric Pepper Mills Kitchen Tool,14.0,EUR,14.0,EUR,16,10,,,5.0,0.0,,,,,,,,,,,black,typea,50,Livraison standard,4.0,false,,50,,,CN,Warmnamiy123,warmnamiy123,"93 % avis positifs (14,467 notes)",14467,4.39800926245939,59841949947e4115a3bec4a4,,,https://www.wish.com/c/6064728f82473a3a6732e1ad,https://canary.contestimg.wish.com/api/webimage/6064728f82473a3a6732e1ad-medium.jpg,6064728f82473a3a6732e1ad
50/100/100/200/300/400/500pcs Papier à rouler transparent Papier à rouler Créatif Pratique Papier à rouler Créatif Papier à rouler Herbes à fumer Papiers à rouler Cigarettes(Taille:110mm/78mm) ,50/100/200/300/400/500pcs Transparent Rolling Paper Convenient Creative Cigarette Rolling Paper Herb Smoking Rolling Papers Cigarette Papers(Size:110mm/78mm) ,3.09,EUR,4.0,EUR,3.75,1000,,,4.2843601895734595,211.0,139,33,17,4,18,,,,,,,50pcs(78mm),50,Livraison standard,1.0,false,,50,true,Quantité limitée !,CN,wowlamingo,wowlamingo,"92 % avis positifs (18,089 notes)",18089,4.351705456354691,59002176b3e3224d05a1765d,,,https://www.wish.com/c/5d27f880d91ac075f9382238,https://canary.contestimg.wish.com/api/webimage/5d27f880d91ac075f9382238-medium.jpg,5d27f880d91ac075f9382238
Éliminateur d'acariens Anti-acariens Éliminateur de punaises de lit en poudre Contrôleur d'acariens en poudre Éliminateur d'acariens feuilles d'absinthe,Mite Eliminator Anti-mite Bed Bug Eliminator Powder Mite Controller Powder Mite Eliminator Herb Wormwood Leaves,5.0,EUR,5.0,EUR,5,10,,,4.2,10.0,5,4,0,0,1,,,,,,,small(2pcs)experiencepackage,50,Livraison standard,1.0,false,,50,,,CN,LFU Specialty Store,lfuspecialtystore,"90 % avis positifs (1,065 notes)",1065,4.317370892018779,5d3d4cc970327a246dfcd6f2,,,https://www.wish.com/c/5f69c69b19a737037c2770b7,https://canary.contestimg.wish.com/api/webimage/5f69c69b19a737037c2770b7-medium.jpg,5f69c69b19a737037c2770b7
Herbalife nouvelle mode femmes Polo Shirt Slim Casual revers chemise à manches courtes Top Sports Golf Tennis T-shirts à séchage rapide pour femmes S-2XL,Herbalife New Fashion Women's Polo Shirt Slim Casual Lapel Short Sleeve Shirt Top Sports Golf Tennis Quick-drying Tee T-Shirts for Women S-2XL,16.0,EUR,24.0,EUR,19,10,,,4.056338028169014,71.0,44,8,6,5,8,,,,,,blue,s,50,Livraison standard,6.0,false,,50,,,CN,Gulanly,1flyangel,92 % avis positifs (346 notes),346,4.471098265895954,5ac3637b18435443640b7677,,,https://www.wish.com/c/5b60387779724814156881b0,https://canary.contestimg.wish.com/api/webimage/5b60387779724814156881b0-medium.jpg,5b60387779724814156881b0
Lotte Mock Candy Herb Mixed Berry 243g x 1 sac chacun (2 sacs au total),Lotte Mock Candy Herb Mixed Berry 243g x 1 bag each (2 bags in total),26.0,EUR,26.0,EUR,31,0,,,5.0,0.0,,,,,,,,,,,,,3,Livraison standard,9.0,false,,3,,,KR,All of Korea,allofkorea,,0,5.0,5fd561db4706204525206b0f,,,https://www.wish.com/c/5fe1decba9beddccf1129426,https://canary.contestimg.wish.com/api/webimage/5fe1decba9beddccf1129426-medium.jpg,5fe1decba9beddccf1129426
Couteaux de cuisine multifonctions en acier inoxydable Couteaux de cuisine multicouches Ciseaux Sushi Ciseaux à sushi Échalotes déchiquetées Ciseaux à herbes et épices Ciseaux de cuisine Outils de cuisson,Multi-functional Stainless Steel Kitchen Knives Multi-Layers Scissors Sushi Shredded Scallion Cut Herb Spices Scissors Cooking Tools,3.94,EUR,4.0,EUR,4.78,5000,,,4.185087255420412,1891.0,1087,354,254,105,91,,,,,,,3layers,50,Livraison standard,1.0,false,,50,true,Quantité limitée !,CN,Faybin,faybin,"(30,921 notes)",30921,4.16432198182465,593148339dc28c2a7808ba3a,,,https://www.wish.com/c/5a6ac1e748456061122b1273,https://canary.contestimg.wish.com/api/webimage/5a6ac1e748456061122b1273-medium.jpg,5a6ac1e748456061122b1273
AHC Herb Solution Rose Toner,AHC Herb Solution Rose Toner,35.0,EUR,35.0,EUR,42.0,0,,,5.0,0.0,,,,,,,,,,,,,13,Livraison standard,9.0,false,,13,,,KR,ThinkerValue,thinkervalue,67 % avis positifs (3 notes),3,3.6666666666666665,5fc5ff4c3e691f2727facac4,,,https://www.wish.com/c/5fe704340c8471ee057d82a1,https://canary.contestimg.wish.com/api/webimage/5fe704340c8471ee057d82a1-medium.jpg,5fe704340c8471ee057d82a1
Diamètre 63mm 2.48 pouces 4 couches de broyage en métal broyeur de tabac broyeur d'épices broyeur d'herbes,Diameter 63mm 2.48 Inches 4 Layers Metal Grinding Tobacco Grinder Spices Crusher Herb Grinder,10.0,EUR,46.0,EUR,11,10,,,4.764705882352941,17.0,14,2,1,0,0,,,,,,,black,50,Livraison standard,3.0,false,,50,true,Quantité limitée !,CN,A_Corner,a_corner,94 % avis positifs (487 notes),487,4.441478439425051,5a0ffed67b584e5b3b8aa91b,,,https://www.wish.com/c/5d15b498314a435a57d05eb5,https://canary.contestimg.wish.com/api/webimage/5d15b498314a435a57d05eb5-medium.jpg,5d15b498314a435a57d05eb5
1 pc / 2 pièces / 3 pièces crème de traitement des varices vascularite phlébite araignée jambe pommade herbe plâtre médical,1pc/2pcs/3pcs Varicose Veins Treatment Cream Vasculitis Phlebitis Spider Leg Ointment Herb Medical Plaster ,3.06,EUR,4.0,EUR,3.71,10,,,4.166666666666667,12.0,6,3,2,1,0,,,,,,,1pc,50,Livraison standard,1.0,false,,50,,,CN,wanglixin45678,wanglixin45678,"82 % avis positifs (1,279 notes)",1279,3.947615324472244,5b8e0e3613336861b42e06bc,,,https://www.wish.com/c/5fc9e0bdaccb7f14439b05f2,https://canary.contestimg.wish.com/api/webimage/5fc9e0bdaccb7f14439b05f2-medium.jpg,5fc9e0bdaccb7f14439b05f2
"Paradise Herbs Muscle Energy with Tribulus Paradise Herbs Muscle Energy with Tribulus 60 Capsules, 1 Set, 0.18lb","Paradise Herbs Muscle Energy with Tribulus Paradise Herbs Muscle Energy with Tribulus 60 Capsules, 1 Set, 0.18lb",114.0,EUR,114.0,EUR,137.0,0,,,5.0,0.0,,,,,,,,,,,,,50,Livraison standard,12.0,false,,50,,,KR,awesomekorea,awesomekorea,100 % avis positifs (1 notes),1,5.0,600f907c35473d26e050c7dd,,,https://www.wish.com/c/604efb10661677bc35c6d566,https://canary.contestimg.wish.com/api/webimage/604efb10661677bc35c6d566-medium.jpg,604efb10661677bc35c6d566
Double Recycler Dab Rigs Hélice Perc Verre Bleu Vert Violet Heady Verre Tuyaux D'eau Plate-Forme Pétrolière Avec 14mm Bol Recycler Rig,Double Recycler Dab Rigs Propeller Perc Glass Blue Green Purple Heady Glass Water Pipes Oil Rig With 14mm Bowl Recycler Rig,34.0,EUR,34.0,EUR,41,1000,,,3.9066339066339064,407.0,230,60,34,15,68,,,,,,blue,,50,Livraison standard,12.0,false,,50,,,CN,hijkyu,kmmworld,"(5,605 notes)",5605,4.24085637823372,5ad1a47428a2b332c02a6d2a,,,https://www.wish.com/c/5bdffd181bcb49171830f12b,https://canary.contestimg.wish.com/api/webimage/5bdffd181bcb49171830f12b-medium.jpg,5bdffd181bcb49171830f12b
Diabetic Support - 12 AYURVEDIC Herbs - Organic Ashwagandha - Neem - Bitter Melon - Cinnamon - Triphala - Amla Berry - Fenugreek - Giloy - Gymnema Sylvestre - Nopal Cactus - Made in The USA,Diabetic Support - 12 AYURVEDIC Herbs - Organic Ashwagandha - Neem - Bitter Melon - Cinnamon - Triphala - Amla Berry - Fenugreek - Giloy - Gymnema Sylvestre - Nopal Cactus - Made in The USA,90.0,EUR,90.0,EUR,108.0,0,,,5.0,0.0,,,,,,,,,,,,,3,Livraison standard,12.0,false,,3,,,KR,ssamssfm,ssamssfm,100 % avis positifs (11 notes),11,4.909090909090909,5ff175cd149d7e6e6a4ed023,,,https://www.wish.com/c/602a8fe2c5f6eff40ff5436e,https://canary.contestimg.wish.com/api/webimage/602a8fe2c5f6eff40ff5436e-medium.jpg,602a8fe2c5f6eff40ff5436e
Moule de broyeur d'herbes en résine époxy bricolage feuille d'herbes à base de plantes broyeur d'épices moule en Silicone,Epoxy Resin Herb Grinder Mold DIY Leaf Herbal Herb Grinder Spice Crusher Silicone Mould,5.0,EUR,5.0,EUR,6,10,,,5.0,2.0,2,0,0,0,0,,,,,,,1pc,50,Livraison standard,2.0,false,,50,,,CN,Complex and Jen,complexandjen,"92 % avis positifs (24,301 notes)",24301,4.333278465906753,56a9c955170dc10edd415675,,,https://www.wish.com/c/600a64cfe25b57d4fc14100a,https://canary.contestimg.wish.com/api/webimage/600a64cfe25b57d4fc14100a-medium.jpg,600a64cfe25b57d4fc14100a
Herb Plus Shiatsu Peanut Massage Ball Black,Herb Plus Shiatsu Peanut Massage Ball Black,21.0,EUR,21.0,EUR,25,0,,,5.0,0.0,,,,,,,,,,,,,40,Livraison standard,6.0,false,,40,,,KR,huinayuna,huinayuna,,0,5.0,5fd268ed4b35fb269ab253ab,,,https://www.wish.com/c/5fe0ed656ac7620318fd5644,https://canary.contestimg.wish.com/api/webimage/5fe0ed656ac7620318fd5644-medium.jpg,5fe0ed656ac7620318fd5644
"Nouveau broyeur de tabac en métal à 4 couches à la mode, broyeur à herbes à base de plantes, moulin à main Muller",NEW Fashionable 4 Layers Metal Tobacco Crusher Smoke Herbal Herb Grinder Hand Muller,10.0,EUR,42.0,EUR,11,10,,,4.894736842105263,19.0,17,2,0,0,0,,,,,,yellow,,50,Livraison standard,2.0,false,,50,,,US,dnfjkirw,dnfjkirw,"87 % avis positifs (9,339 notes)",9339,4.124424456579933,59f6d8aedd0329339d8d53c1,,,https://www.wish.com/c/5e8c379385bb565683d6d9cf,https://canary.contestimg.wish.com/api/webimage/5e8c379385bb565683d6d9cf-medium.jpg,5e8c379385bb565683d6d9cf
Gotu Kola Capsules - 90 Kosher Vegan Caps with 400mg Organic Gotu Kola Herb,Gotu Kola Capsules - 90 Kosher Vegan Caps with 400mg Organic Gotu Kola Herb,74.0,EUR,74.0,EUR,89.0,0,,,5.0,0.0,,,,,,,,,,,,,3,Livraison standard,12.0,false,,3,true,Quantité limitée !,KR,haebangnal,haebangnal,100 % avis positifs (1 notes),1,5.0,600ac8d8194ee2c44d03f9c6,,,https://www.wish.com/c/603b513559b347ec7835c5bf,https://canary.contestimg.wish.com/api/webimage/603b513559b347ec7835c5bf-medium.jpg,603b513559b347ec7835c5bf
I Love Herb Multipurpose Herbal Pack So Khaki,I Love Herb Multipurpose Herbal Pack So Khaki,57.0,EUR,57.0,EUR,68.0,0,,,5.0,0.0,,,,,,,,,,,,,50,Livraison standard,9.0,false,,50,,,KR,woo_korea,woo_korea,100 % avis positifs (2 notes),2,5.0,5fd9cf6be3c38640101e3795,,,https://www.wish.com/c/5fe70e4518ea8135abda7510,https://canary.contestimg.wish.com/api/webimage/5fe70e4518ea8135abda7510-medium.jpg,5fe70e4518ea8135abda7510
Herb Guru Cool Down Chinese Herbs 60 Capsules - Skullcap Herbal Supplement Oriental Medicine,Herb Guru Cool Down Chinese Herbs 60 Capsules - Skullcap Herbal Supplement Oriental Medicine,141.0,EUR,141.0,EUR,170.0,0,,,5.0,0.0,,,,,,,,,,,,,3,Livraison standard,12.0,false,,3,true,Quantité limitée !,KR,haebangnal,haebangnal,100 % avis positifs (1 notes),1,5.0,600ac8d8194ee2c44d03f9c6,,,https://www.wish.com/c/603db8f46dc9326f83cc4f2a,https://canary.contestimg.wish.com/api/webimage/603db8f46dc9326f83cc4f2a-medium.jpg,603db8f46dc9326f83cc4f2a
1 PC Jardin Herbe Artificielle Plastique Plante Fleur Feuilles Persianleave Dekopflanze,1PC Garden Artificial Grass Plastic Plant Flower Leaves Persianleave Dekopflanze,2.0,EUR,5.0,EUR,2,10,,,4.5,28.0,18,8,1,0,1,,,,,,,,50,Livraison standard,1,false,,50,,,CN,cohenwei,cohenwei,"94 % avis positifs (5,597 notes)",5597,4.3964623905663744,59118fb30cfae24d87c0ad39,,,https://www.wish.com/c/5935b9168f7b0861f93fc5f2,https://canary.contestimg.wish.com/api/webimage/5935b9168f7b0861f93fc5f2-medium.jpg,5935b9168f7b0861f93fc5f2
6 couleurs créative Mini bière métal fumée tabac tuyaux Portable créatif fumer tuyau herbe tabac tuyaux cadeaux narguilé broyeur fumée,6 Color Creative Mini Beer Metal Smoke Tobacco Pipes Portable Creative Smoking Pipe Herb Tobacco Pipes Gifts Narguile Grinder Smoke,3.0,EUR,3.0,EUR,3,20000,,,4.378986005964671,4359.0,2885,713,451,148,162,,,,,,black,s,50,Livraison standard,1.0,false,,50,true,Quantité limitée !,CN,yueyue's store,yueyuesstore,"93 % avis positifs (15,126 notes)",15126,4.369562342985588,593aab2025c4f52b9d831e4d,,,https://www.wish.com/c/5a5c89d72b0a1c3162744697,https://canary.contestimg.wish.com/api/webimage/5a5c89d72b0a1c3162744697-medium.jpg,5a5c89d72b0a1c3162744697
"Lampe de poche électrique de haute qualité pour concasseur de tabac, concasseur d'herbes et concasseur d'herbes",High Quality Electric Grinder Herb Tabacco Crusher Grinder Cracker Flashlight,7.0,EUR,13.0,EUR,8,1000,,,4.21021897810219,685.0,421,122,63,23,56,,,,,,black,,50,Livraison standard,2.0,false,,50,true,Quantité limitée !,CN,liyxs,liyxs,"86 % avis positifs (11,573 notes)",11573,4.076384688499092,59ad09fa0415f84207b60369,,,https://www.wish.com/c/59b20a540a0a7b076290fe20,https://canary.contestimg.wish.com/api/webimage/59b20a540a0a7b076290fe20-medium.jpg,59b20a540a0a7b076290fe20
Lot Instock Wolesale 50PCS / 100PCS 3.5g Blanc Runtz Rose Runtz OG V Gruntz Rose + Runts Peach Kobbler Smell Proof Sacs 420 Herbes Sèches Fleurs,Lot Instock Wolesale 50PCS/100PCS 3.5g White Runtz Pink Runtz OG V Gruntz Pink+ Runts Peach Kobbler Smell Proof Bags 420 Dry Herb Flowers,7.0,EUR,7.0,EUR,8,10,,,4.416666666666667,24.0,18,3,0,1,2,,,,,,multicolor,1pcrandom,27,Livraison standard,2.0,false,,50,,,CN,zhyinban,zhyinban,(87 notes),87,4.080459770114943,5f01534d248a7a223659c5dc,,,https://www.wish.com/c/5f505bbe2c4c3c08bb60cc3f,https://canary.contestimg.wish.com/api/webimage/5f505bbe2c4c3c08bb60cc3f-medium.jpg,5f505bbe2c4c3c08bb60cc3f
Herb Guru CHI Recharge for Women 60 Capsules - Rehmannia Chinese Herbs Female Health Supplement,Herb Guru CHI Recharge for Women 60 Capsules - Rehmannia Chinese Herbs Female Health Supplement,124.0,EUR,124.0,EUR,150.0,0,,,5.0,0.0,,,,,,,,,,,,,3,Livraison standard,12.0,false,,3,,,KR,ssamssfm,ssamssfm,100 % avis positifs (11 notes),11,4.909090909090909,5ff175cd149d7e6e6a4ed023,,,https://www.wish.com/c/602a91a4c84c84ca56ed46f0,https://canary.contestimg.wish.com/api/webimage/602a91a4c84c84ca56ed46f0-medium.jpg,602a91a4c84c84ca56ed46f0
Sumifun 6 pièces / sac 6 pièces-72 pièces Patch diabétique stabilise l'équilibre de la glycémie Patch de glycémie Contenu d'herbes naturelles Patch de plâtre de diabète,Sumifun 6 Pcs/Bag 6PCS-72PCS Diabetic Patch Stabilizes Blood Sugar Balance Blood Glucose Patch Natural Herbs Content Diabetes Plaster Patch,3.04,EUR,4.0,EUR,3.69,10,,,4.833333333333333,6.0,5,1,0,0,0,,,,,,,6pcs(1bag),33,Livraison standard,1.0,false,,50,true,Quantité limitée !,CN,thujytju,thujytju,92 % avis positifs (225 notes),225,4.386666666666667,5de37c3fd30dac4c40e358f4,,,https://www.wish.com/c/5f49be4b1eaa5d004b527972,https://canary.contestimg.wish.com/api/webimage/5f49be4b1eaa5d004b527972-medium.jpg,5f49be4b1eaa5d004b527972
Nature's Way Eyelight Herb 430mg Vegterian Capsules,Nature's Way Eyelight Herb 430mg Vegterian Capsules,33.0,EUR,33.0,EUR,39,0,,,5.0,0.0,,,,,,,,,,,,,6,Livraison standard,11.0,false,,6,,,KR,K_market,k_market,80 % avis positifs (5 notes),5,3.6,5fb0fa5e3852e8c5c9fdc753,,,https://www.wish.com/c/5fda52b2ec35da88ad30679e,https://canary.contestimg.wish.com/api/webimage/5fda52b2ec35da88ad30679e-medium.jpg,5fda52b2ec35da88ad30679e
Pond'S,,,,,,,,,,,,,,,,,,,,,,,,,,,,,,,,,,,,,,,,,https://www.wish.com/c/5eec9b09eb31f9cc968f2a64,,5eec9b09eb31f9cc968f2a64
Grinder Stars 1 Pièce Herb Crusher Smoke Tobacco Spice Metal New,Grinder Stars 1 Piece Herb Crusher Smoke Tobacco Spice Metal New,11.0,EUR,11.0,EUR,13,10,,,4.450549450549451,91.0,60,18,8,4,1,,,,,,,2,50,Livraison standard,3.0,false,,50,true,Quantité limitée !,CN,chaonanpai,chaonanpai,"92 % avis positifs (2,415 notes)",2415,4.3461697722567285,5853a08f0a1dc24ca91a4d56,,,https://www.wish.com/c/5901cd12e070d42922a005e7,https://canary.contestimg.wish.com/api/webimage/5901cd12e070d42922a005e7-medium.jpg,5901cd12e070d42922a005e7
(4 Type) 30cm Joint de verre fait main lumineux 14.5mm eau narguilé Bomg tuyau barboteur pour fumer outil cadeau,(4 Type)30cm Luminous Handmade Glass Joint 14.5mm Water Hookah Bomg Pipe Bubbler for Smoking Tool Gift,33.0,EUR,33.0,EUR,40,1000,,,4.441481481481482,675.0,504,70,42,13,46,,,,,,,typeb,50,Livraison standard,11.0,false,,50,,,CN,xicha,blitzwolf17828,"89 % avis positifs (7,547 notes)",7547,4.2363853186696705,59a3b4fa439a9869cc3cf6ad,,,https://www.wish.com/c/5d37c577410a122d46929b7f,https://canary.contestimg.wish.com/api/webimage/5d37c577410a122d46929b7f-medium.jpg,5d37c577410a122d46929b7f
"Gaia Herbs Women'S Libido, flacon de 60 capsules","Gaia Herbs Women'S Libido, 60-capsule Bottle",77.0,EUR,77.0,EUR,93.0,0,,,5.0,0.0,,,,,,,,,,,,,3,Livraison standard,12.0,false,,3,,,KR,jjingosuda,jjingosuda,100 % avis positifs (5 notes),5,4.6,600aff5a739c8f04b76a4425,,,https://www.wish.com/c/6014e68f44b5b89bd73b8e6b,https://canary.contestimg.wish.com/api/webimage/6014e68f44b5b89bd73b8e6b-medium.jpg,6014e68f44b5b89bd73b8e6b
1 pièce soins de santé peau champignon Anti bactérien crème herbes chinoises naturelles crème onitment pour psoriasis dermatite eczéma traitement,1 Piece Health Care Skin Fungus Anti Bacterial Cream Natural Chinese Herbs Cream Onitment for Psoriasis Dermatitis Eczema Treatment,3.04,EUR,4.0,EUR,3.6799999999999997,1000,,,4.3140794223826715,277.0,178,48,28,6,17,,,,,,,15g,50,Livraison standard,1.0,false,,50,,,CN,Uilzstore,uilzstore,"84 % avis positifs (3,764 notes)",3764,4.039054197662062,5d661cd163ad460bc20da8ac,,,https://www.wish.com/c/5ee2dd927bdbdbc14ad2360b,https://canary.contestimg.wish.com/api/webimage/5ee2dd927bdbdbc14ad2360b-medium.jpg,5ee2dd927bdbdbc14ad2360b
