title,title_orig,discount_price,discount_price_currency,retail_price,retail_price_currency,discount_price_in_original_currency,nb_cart_orders_approx,nb_units_purchased_approx,uses_ad_boosts,rating,rating_count,rating_five_count,rating_four_count,rating_three_count,rating_two_count,rating_one_count,badges_count,badge_local_product,badge_product_quality,badge_fast_shipping,tags,product_color,product_variation_size_id,product_variation_inventory,shipping_option_name,shipping_option_price,shipping_is_express,countries_shipped_to,inventory_total,has_urgency_banner,urgency_text,origin_country,merchant_title,merchant_name,merchant_info_subtitle,merchant_rating_count,merchant_rating,merchant_id,merchant_has_profile_picture,merchant_profile_picture,product_url,product_picture,product_id
broyeur à manivelle de tabac broyeur d'herbes broyeur de broyeur de fines herbes d'épices de piment,grinder  Hand Crank Tobacco Herb Grinder Chili Pepper Spice Herbal Shredder Crusher,13.0,EUR,13.0,EUR,15,10,,,4.0,12.0,6,3,1,1,1,,,,,,,,50,Livraison standard,4.0,false,,50,,,CN,mirdubdhgc,mirdubdhgc,"88 % avis positifs (1,964 notes)",1964,4.220468431771894,5d5a4a05560eca427bf1d8d7,,,https://www.wish.com/c/5e50c6998532b006413d1d18,https://canary.contestimg.wish.com/api/webimage/5e50c6998532b006413d1d18-medium.jpg,5e50c6998532b006413d1d18
Sumifun 6-60 Pcs Patch Diabétique Stabilise L'équilibre De La Sucre Sanguine Glucose Patch Patch Naturel Herbes Contenu Diabète Plâtre Patchs,Sumifun 6-60Pcs Diabetic Patch Stabilizes Blood Sugar Balance Blood Glucose Patch Natural Herbs Content Diabetes Plaster Patches,2.37,EUR,3.0,EUR,2.87,10,,,3.4545454545454546,11.0,5,2,0,1,3,,,,,,,6pcs,9,Livraison standard,1,false,,50,,,CN,dfrtgh,dfrtgh,92 % avis positifs (166 notes),166,4.403614457831325,5dc91b14e25671732fb1ae4b,,,https://www.wish.com/c/5eec569eb4b5dc119e72361a,https://canary.contestimg.wish.com/api/webimage/5eec569eb4b5dc119e72361a-medium.jpg,5eec569eb4b5dc119e72361a
Broyeur à herbes à base de plantes en métal 4 couches broyeur de tabac broyeur outil de fumer fournitures de cigarettes,4 Layer Metal Herbal Herb Grinder Tobacco Grinder Crusher Smoking Tool Cigarette Supplies,7.0,EUR,7.0,EUR,8,10,,,4.2682926829268295,41.0,25,9,3,1,3,,,,,,,40mmrandom,34,Livraison standard,3.0,false,,50,,,CN,caihaobin,caihaobin,86 % avis positifs (334 notes),334,4.12874251497006,5d4d74f2933fb120585f27c3,,,https://www.wish.com/c/5efc53ac19a9a6517b803837,https://canary.contestimg.wish.com/api/webimage/5efc53ac19a9a6517b803837-medium.jpg,5efc53ac19a9a6517b803837
"Green Artificial Grass Rug Grass Carpert Rug 200x400CM, Realistic Fake Grass Deluxe Turf Synthetic Turf Thick Lawn Pet Turf -Perfect for Indoor/Outdoor","Green Artificial Grass Rug Grass Carpert Rug 200x400CM, Realistic Fake Grass Deluxe Turf Synthetic Turf Thick Lawn Pet Turf -Perfect for Indoor/Outdoor",32.0,EUR,32.0,EUR,38,10,,,4.0,1.0,0,1,0,0,0,,,,,,,100x200cm,50,Livraison standard,11.0,false,,50,,,CN,channy trade,channytrade,"(534,915 notes)",534915,4.3202452726134055,53a7dea9d911391c5ea20024,,,https://www.wish.com/c/60659b97bdd945b3cc4cb8c1,https://canary.contestimg.wish.com/api/webimage/60659b97bdd945b3cc4cb8c1-medium.jpg,60659b97bdd945b3cc4cb8c1
Roue de fil d'acier de 6/8 po,6/8 Inch Steel Wire Wheel Grass Cutter Trimmer Parts General Wear-Resistant Multi-Function Steel Wire Rust Removal Weeding Plate Mower Head Blade,13.0,EUR,13.0,EUR,15,10,,,4.208333333333333,168.0,99,40,10,3,16,,,,,,,6inch(150mm),50,Livraison Express,6.0,true,,50,,,CN,Please hold your time,pleaseholdyourtime,"(76,443 notes)",76443,4.346362649294245,585cc0288da1f052c8462a87,,,https://www.wish.com/c/5d75a59be44be216edae0ba9,https://canary.contestimg.wish.com/api/webimage/5d75a59be44be216edae0ba9-medium.jpg,5d75a59be44be216edae0ba9
Crème pour augmenter la croissance 2021 pour Green Health Life,2021 increase growth cream Cream for Green Health Life,7.0,EUR,82.0,EUR,8,10,,,3.9,10.0,6,1,0,2,1,,,,,,,packof1,50,Livraison standard,3.0,false,,50,,,PE,Salar41,salar41,85 % avis positifs (354 notes),354,4.0508474576271185,5e866ed9d9c52d62b7c6ab51,,,https://www.wish.com/c/5fbdb2719a03aa0043c4c4be,https://canary.contestimg.wish.com/api/webimage/5fbdb2719a03aa0043c4c4be-medium.jpg,5fbdb2719a03aa0043c4c4be
100ml Hairlos Hairlos Hair Salon Hair Growth Essence Herbs Hair Growth Liquid Natural ,100ml Hairlos Hair Salon Hair Growth Essence Herbs Hair Growth Liquid Natural ,4.83,EUR,5.0,EUR,5.85,1000,,,4.14878892733564,578.0,328,108,74,36,32,,,,,,,20ml,50,Livraison standard,1.0,false,,50,,,CN,myOriginaldesign,myoriginaldesign,"86 % avis positifs (3,669 notes)",3669,4.097846824747887,5989a0e350df611d5e5cbb6b,,,https://www.wish.com/c/5b960f76b3b2537fb8fe4566,https://canary.contestimg.wish.com/api/webimage/5b960f76b3b2537fb8fe4566-medium.jpg,5b960f76b3b2537fb8fe4566
Séchoir à légumes d'épineur de salade de légumes pour l'entretien ménager d'herbe de nourriture de cuisine,Vegetable Salad Spinner Vegetable Dryer  For Kitchen Food Herb Housekeeping,10.0,EUR,10.0,EUR,12,10,,,4.176470588235294,51.0,33,7,4,1,6,,,,,,green,randomcolor,50,Livraison standard,3.0,false,,50,,,CN,Oran_Nade,poet_fanta,93 % avis positifs (449 notes),449,4.461024498886414,59bf9f499d8c654c94aab1f5,,,https://www.wish.com/c/5a433900149ff8040604b839,https://canary.contestimg.wish.com/api/webimage/5a433900149ff8040604b839-medium.jpg,5a433900149ff8040604b839
Huile médicamenteuse Kwan loong 28ml | pour un soulagement rapide de la douleur - Herbes naturelles chinoises - Soulagement de la fièvre,Kwan loong Medicated Oil 28ml | for Fast Pain Relief - Chinese Natural Herbs - Fever Relief,14.0,EUR,14.0,EUR,16,10,,,4.75,8.0,6,2,0,0,0,,,,,,,,50,Livraison standard,4.0,false,,50,,,TH,SiamMarketPlace,siammarketplace,"95 % avis positifs (1,506 notes)",1506,4.575033200531209,5aa6904928a2b34937faa88f,,,https://www.wish.com/c/5dd7b935af8da4afbaeae423,https://canary.contestimg.wish.com/api/webimage/5dd7b935af8da4afbaeae423-medium.jpg,5dd7b935af8da4afbaeae423
Mediheal,,,,,,,,,,,,,,,,,,,,,,,,,,,,,,,,,,,,,,,,,https://www.wish.com/c/5f7313f390b8a6de20a3b203,,5f7313f390b8a6de20a3b203
"Sleep Aid, Natural Herb Sleeping Pill for Adults -Stress, Insomnia, Anxiety Relief - Faster Absorption Dissolve Tablets Easy to Take, Maximum Strength Supplement, Helps Sleep Better & Wake Up Restored","Sleep Aid, Natural Herb Sleeping Pill for Adults -Stress, Insomnia, Anxiety Relief - Faster Absorption Dissolve Tablets Easy to Take, Maximum Strength Supplement, Helps Sleep Better & Wake Up Restored",70.0,EUR,70.0,EUR,84.0,0,,,5.0,0.0,,,,,,,,,,,,,3,Livraison standard,12.0,false,,3,,,KR,rehobot,rehobot,100 % avis positifs (5 notes),5,4.8,5f8864ab13bbf3e51c64df1a,,,https://www.wish.com/c/6062921bfd3b7f82def6d25d,https://canary.contestimg.wish.com/api/webimage/6062921bfd3b7f82def6d25d-medium.jpg,6062921bfd3b7f82def6d25d
Kidney Sure Health Supplement by Dimmak Herbs | Kidney Blend Detoxifier & Regenerator for Complete Balance – Care - Health – Protection | Chinese Medicine Herbs & Healing Solutions – 650mg,Kidney Sure Health Supplement by Dimmak Herbs | Kidney Blend Detoxifier & Regenerator for Complete Balance – Care - Health – Protection | Chinese Medicine Herbs & Healing Solutions – 650mg,71.0,EUR,71.0,EUR,86.0,0,,,5.0,0.0,,,,,,,,,,,,,3,Livraison standard,12.0,false,,3,,,KR,haebangnal,haebangnal,100 % avis positifs (1 notes),1,5.0,600ac8d8194ee2c44d03f9c6,,,https://www.wish.com/c/603b5062d115a4004234e899,https://canary.contestimg.wish.com/api/webimage/603b5062d115a4004234e899-medium.jpg,603b5062d115a4004234e899
Hayoung Herb Mugwort Tea Set 900g Mugwort Artemisia Artemisia Angelica Cinnamon Ginger,Hayoung Herb Mugwort Tea Set 900g Mugwort Artemisia Artemisia Angelica Cinnamon Ginger,76.0,EUR,76.0,EUR,92.0,0,,,5.0,0.0,,,,,,,,,,,,,50,Livraison standard,12.0,false,,50,,,KR,Stay_Gorgeous Korea,stay_gorgeouskorea,100 % avis positifs (5 notes),5,4.8,5fd76ab639ab348c49576bf2,,,https://www.wish.com/c/60196157b90daa3772d6d318,https://canary.contestimg.wish.com/api/webimage/60196157b90daa3772d6d318-medium.jpg,60196157b90daa3772d6d318
Métal alliage de zinc 40mm broyeur à tabac arc-en-ciel belle herbe à base de plantes broyeur à épices fumer pipe accessoires broyeur,Metal Zinc Alloy 40mm Tobacco Grinder Rainbow Color Beautiful Herb Herbal Spice Crusher Smoking Pipe Accessories Grinder,7.0,EUR,15.0,EUR,8,10,,,4.235294117647059,17.0,12,1,2,0,2,,,,,,,3layer,50,Livraison standard,3.0,false,,50,true,Quantité limitée !,CN,DQZ Weed World,dqzweedworld,"89 % avis positifs (2,388 notes)",2388,4.189698492462312,5e0efd3d3723e91143dea83b,,,https://www.wish.com/c/5e21598aa22c170a6ad102b1,https://canary.contestimg.wish.com/api/webimage/5e21598aa22c170a6ad102b1-medium.jpg,5e21598aa22c170a6ad102b1
Panier suspendu 4/6/8 couches avec fermeture à glissière pliante sèche rack Herb Drying Net séchoir sac maille pour herbes fleurs bourgeons plantes,Hanging Basket 4/6/8 Layers with Zipper Folding Dry Rack Herb Drying Net Dryer Bag Mesh For Herbs Flowers Buds Plants,19.0,EUR,19.0,EUR,22,10,,,4.631578947368421,133.0,106,16,5,1,5,,,,,,black,4layer,50,Livraison standard,6.0,false,,50,true,Quantité limitée !,CN,PrettyU est un vendeur agréé,prettyu,"91 % avis positifs (7,150 notes)",7150,4.278881118881118,5a13fe717a4f3b6c407aaf9e,,,https://www.wish.com/c/5dbab4517537310f8b7881d0,https://canary.contestimg.wish.com/api/webimage/5dbab4517537310f8b7881d0-medium.jpg,5dbab4517537310f8b7881d0
Nouveau 63mm / 2.48 pouces En Alliage D'aluminium En Métal 4 Couches Moulin À Tabac Broyeur À Herbes Broyeur Épices Broyeur,New 63mm/2.48inches Aluminum Alloy Metal 4 Layers Tobacco Grinder Herb Grinder Spices Crusher,15.0,EUR,40.0,EUR,17,10,,,4.697916666666667,96.0,78,12,3,1,2,,,,,,grey,,50,Livraison standard,5.0,false,,50,,,CN,Bin_Go,bin_go,"94 % avis positifs (3,096 notes)",3096,4.4366925064599485,5a3605f7d024992d745ea4cb,,,https://www.wish.com/c/5d5e07e56a454136575332cc,https://canary.contestimg.wish.com/api/webimage/5d5e07e56a454136575332cc-medium.jpg,5d5e07e56a454136575332cc
Plaque de rangement de modèle de plateau roulant de conception unique pour le broyeur d'herbes fumant le plateau de conteneur de cigarettes Handroller | Accessoires de cigarettes,Unique Design Rolling Tray Pattern Storage Plate For Smoking Herb Grinder Cigarette Container Tray Handroller|Cigarette Accessories,2.0,EUR,2.0,EUR,2,10,,,4.3076923076923075,26.0,17,3,4,1,1,,,,,,,1,45,Livraison standard,1,false,,50,,,CN,Vegetable chicken,vegetablechicken,"81 % avis positifs (5,860 notes)",5860,3.8706484641638226,5d428dca72b0c923c03a8669,,,https://www.wish.com/c/600bc6c3664a69d700a5160c,https://canary.contestimg.wish.com/api/webimage/600bc6c3664a69d700a5160c-medium.jpg,600bc6c3664a69d700a5160c
Golden Herb Fish Collagen Peptide,Golden Herb Fish Collagen Peptide,60.0,EUR,60.0,EUR,72.0,0,,,5.0,0.0,,,,,,,,,,,,,17,Livraison standard,15.0,false,,17,,,KR,KoreanBox,koreanbox,80 % avis positifs (10 notes),10,3.8,5feeec90695fde32a5447541,,,https://www.wish.com/c/60005ddd4415094529a3139c,https://canary.contestimg.wish.com/api/webimage/60005ddd4415094529a3139c-medium.jpg,60005ddd4415094529a3139c
40mm NOUVEAU Style Feuille Métal Herbe Toabcco Grinder Herb Spice Grinder 3/4 Pièce avec Pollen Catcher Free Scraper - Silver / Bronze / Rainbow Color,40mm NEW Style Leaf Metal Herb Toabcco Grinder Herb Spice Grinder 3/4 Piece with Pollen Catcher Free Scraper - Silver/Bronze/Rainbow Color,5.0,EUR,5.0,EUR,6,1000,,,4.0830769230769235,325.0,196,43,37,15,34,,,,,,silver,3layers,50,Livraison standard,2.0,false,,50,,,CN,funshoppinghere,funshoppinghere,"92 % avis positifs (16,210 notes)",16210,4.347008019740901,5822bf81d3e3fa1d54024750,,,https://www.wish.com/c/5de8a7c6c4125d2e6a7a49d7,https://canary.contestimg.wish.com/api/webimage/5de8a7c6c4125d2e6a7a49d7-medium.jpg,5de8a7c6c4125d2e6a7a49d7
L'augmentation de thé de médecine chinoise de thé d'hommes renforce l'épaississement de longue durée,Men Tea Chinese Medicine Tea Increase Strengthen Thicken Long-lasting,7.0,EUR,42.0,EUR,8,1000,,,4.015037593984962,133.0,71,29,11,8,14,,,,,,,30teabags,50,Livraison standard,2.0,false,,50,,,CN,Tofu,tofu,"(5,176 notes)",5176,4.082109737248841,59255f28fc9cce18f51bc4b6,,,https://www.wish.com/c/5d8c2cc83b00610befed61f1,https://canary.contestimg.wish.com/api/webimage/5d8c2cc83b00610befed61f1-medium.jpg,5d8c2cc83b00610befed61f1
16 pouces de long porte-cigarette à long manche en bois tabac herbe pipe avec boîte,16inch Long Cigarette Holder Long Handle Wooden Tobacco Herb Smoking Pipe with Box,14.0,EUR,14.0,EUR,16,10,,,3.5714285714285716,7.0,3,1,1,1,1,,,,,,red,,50,Livraison standard,4.0,false,,50,,,CN,You Mu,youmu,"90 % avis positifs (8,905 notes)",8905,4.280516563728242,556d2ddec00cd72787ff01f4,,,https://www.wish.com/c/5e5613940f55163fdfe79af8,https://canary.contestimg.wish.com/api/webimage/5e5613940f55163fdfe79af8-medium.jpg,5e5613940f55163fdfe79af8
100pcs sachets filtre à thé sachets de thé jetables filtres de joint de cordon sachet de thé vide pour le thé en feuilles et les herbes,100pcs Tea Filter Bags Disposable Teabags Drawstring Seal Filters Empty Tea Bag for Loose Leaf Tea and Herb,4.01,EUR,5.0,EUR,4.86,1000,,,4.6369426751592355,314.0,236,48,25,4,1,,,,,,,s--5.5cmx7cm,50,Livraison standard,1.0,false,,50,,,CN,farrokh15,farrokh15,"92 % avis positifs (45,151 notes)",45151,4.371043830701424,58a01f7c6e6f064fef883fb8,,,https://www.wish.com/c/5c9d7a164c90236d36594cac,https://canary.contestimg.wish.com/api/webimage/5c9d7a164c90236d36594cac-medium.jpg,5c9d7a164c90236d36594cac
1 Pcs Métal Aluminium Presser Compresseur Herb Grinder Tabac Spice Crusher,1 Pcs Metal Aluminum Presser Compressor Herb Grinder Tobacco Spice Crusher,10.0,EUR,20.0,EUR,12,10,,,4.625,16.0,13,1,1,1,0,,,,,,,,50,Livraison standard,3.0,false,,50,,,CN,LDU supermarket,yiwujinouelectroniccommercecoltd,"90 % avis positifs (17,030 notes)",17030,4.229242513211979,5586aa5613702b3f7728894b,,,https://www.wish.com/c/5929419a5b3cde782d2718db,https://canary.contestimg.wish.com/api/webimage/5929419a5b3cde782d2718db-medium.jpg,5929419a5b3cde782d2718db
Siler Skin Cleanser Dietary Supplement 500mg 100 Capsules (Qing Shang Fang Feng Tang) J05 100% Natural Herbs,Siler Skin Cleanser Dietary Supplement 500mg 100 Capsules (Qing Shang Fang Feng Tang) J05 100% Natural Herbs,123.0,EUR,123.0,EUR,148.0,0,,,5.0,0.0,,,,,,,,,,,,,3,Livraison standard,12.0,false,,3,,,KR,himnaezae,himnaezae,100 % avis positifs (2 notes),2,5.0,600b04deb5a7cc068d29b0d1,,,https://www.wish.com/c/602f3478db3d4c6e0da2eff0,https://canary.contestimg.wish.com/api/webimage/602f3478db3d4c6e0da2eff0-medium.jpg,602f3478db3d4c6e0da2eff0
Paquet aléatoire de 3/5/10 à partir de 15 sortes de papier à rouler à saveur de frelon Flavers Hornet,Random 3 / 5/ 10 Pack From 15 Kinds Flavers Hornet  Flavored Smoking Rolling Paper,4.0,EUR,4.0,EUR,4,10000,,,4.063402385436284,3186.0,1804,508,413,194,267,,,,,,,3pack(150pcs),50,Livraison standard,1.0,false,,50,,,CN,Rosyca est un vendeur agréé,rosyca,"90 % avis positifs (16,687 notes)",16687,4.272068076946126,5b59a75467fd60384a37d652,,,https://www.wish.com/c/5c75fd7dcba00d4c2632e456,https://canary.contestimg.wish.com/api/webimage/5c75fd7dcba00d4c2632e456-medium.jpg,5c75fd7dcba00d4c2632e456
 Titanium Nails Vaporisateur d'herbes sèches Crème de fumée Vaporisateur à combustion sèche avec filtre à narguilé Verre de quartz Accessoires de cigarette électronique adaptés pour SOC vape (avec boîte de rangement portable), Titanium Nails Dry Herb Vaporizer Smoke Cream Dry Burning Vaporizer with Hookah Filter Quartz Glass Suitable Electronic Cigarette Accessories Set for SOC vape (with Portable Storage Box),52.0,EUR,83.0,EUR,63.0,10,,,4.042553191489362,47.0,29,4,7,1,6,,,,,,green,justglasstube,50,Livraison standard,12.0,false,,50,true,Quantité limitée !,CN,pdlejsd,pdlejsd,74 % avis positifs (608 notes),608,3.648026315789474,5dba63fe36a8ca0a802f1384,,,https://www.wish.com/c/5ead25c09fa06f1b008433cb,https://canary.contestimg.wish.com/api/webimage/5ead25c09fa06f1b008433cb-medium.jpg,5ead25c09fa06f1b008433cb
Double recycleur Dab Rig hélice Percolater 10 pouces en verre bleu-vert avec machine de vannage de bol de 14 mm,Double Recycler Dab Rig Propeller Percolater 10 Inch Blue Green Glass with 14mm Bowl winnowing machine,33.0,EUR,33.0,EUR,39,1000,,,3.959124087591241,685.0,415,84,44,27,115,,,,,,green,,50,Livraison standard,11.0,false,,50,true,Quantité limitée !,CN,hijkyu,kmmworld,"88 % avis positifs (5,605 notes)",5605,4.24085637823372,5ad1a47428a2b332c02a6d2a,,,https://www.wish.com/c/5bbf0a76e94b29350e87a00e,https://canary.contestimg.wish.com/api/webimage/5bbf0a76e94b29350e87a00e-medium.jpg,5bbf0a76e94b29350e87a00e
Haute qualité à la main frelon palissandre tabac broyeur 60 MM 4 couches tranchantes en aluminium diamant dents fumer herbe broyeur,High quality handmade hornet rosewood tobacco grinder 60MM 4 layers sharp aluminum diamond teeth smoking herb grinder,21.0,EUR,21.0,EUR,25,10,,,3.888888888888889,9.0,5,1,1,1,1,,,,,,,,50,Livraison standard,6.0,false,,50,true,Quantité limitée !,CN,WXDSA,wxdsa,"93 % avis positifs (6,488 notes)",6488,4.356812577065352,58feba1037d23b112cbf5baf,,,https://www.wish.com/c/5dce664478c5ea2ec308b977,https://canary.contestimg.wish.com/api/webimage/5dce664478c5ea2ec308b977-medium.jpg,5dce664478c5ea2ec308b977
"Artemisinin HPLC Standardized to 98 Percent - Non-GMO, Vegan, and Gluten Free - 90 Veggie Capsules 150 milligrams - Pure Sweet Wormwood Extract - Chinese Worm Wood - Sweet Annie Herb","Artemisinin HPLC Standardized to 98 Percent - Non-GMO, Vegan, and Gluten Free - 90 Veggie Capsules 150 milligrams - Pure Sweet Wormwood Extract - Chinese Worm Wood - Sweet Annie Herb",77.0,EUR,77.0,EUR,93.0,0,,,5.0,0.0,,,,,,,,,,,,,3,Livraison standard,12.0,false,,3,,,KR,myomee,myomee,,0,5.0,60068da7efe8f52116c89a7a,,,https://www.wish.com/c/603b43ebf6ed7dd3154d2785,https://canary.contestimg.wish.com/api/webimage/603b43ebf6ed7dd3154d2785-medium.jpg,603b43ebf6ed7dd3154d2785
1Pcs Portable Green Glass Smoke Pipe Mini Cigarette End Glassware Herb Glass Crafts Tube Nozzle Shisha Pipe Hookah Accessories,1Pcs Portable Green Glass Smoke Pipe Mini Cigarette End Glassware Herb Glass Crafts Tube Nozzle Shisha Pipe Hookah Accessories,3.09,EUR,4.0,EUR,3.75,10,,,5.0,0.0,,,,,,,,,,,,1pcsstyle1random,50,Livraison standard,1.0,false,,50,,,CN,mguomingxia52166,mguomingxia52166,(560 notes),560,4.069642857142857,5f49f2b6b7a9a1c50bc1e94e,,,https://www.wish.com/c/604736b403c388ba5f476123,https://canary.contestimg.wish.com/api/webimage/604736b403c388ba5f476123-medium.jpg,604736b403c388ba5f476123
Grosses soldes !!! Pipe en métal de poche fumer / mauvaises herbes / tabac à pipe avec broyeur filtre à mailles tuyau de fumage tuyau de fer （couleur aléatoire）,Hot Sale !!! Pocket Metal Pipe Smoking /weeds/ Pipe Tobacco with Grinder Mesh Filter  Smoker Pipe Iron Pipe （random Color）,3.15,EUR,4.0,EUR,3.8200000000000003,10,,,4.357142857142857,140.0,89,30,11,2,8,,,,,,,1(1pcpipeand1pcmesh),50,Livraison standard,1.0,false,,50,,,CN,Shiny supermarket,shinysupermarket,"93 % avis positifs (34,575 notes)",34575,4.340477223427332,59434fec9904e34b845e3aca,,,https://www.wish.com/c/5e01b63c92d55a009649bccc,https://canary.contestimg.wish.com/api/webimage/5e01b63c92d55a009649bccc-medium.jpg,5e01b63c92d55a009649bccc
Nesipic Fresh Herb Origin Serum,Nesipic Fresh Herb Origin Serum,36.0,EUR,36.0,EUR,43.0,0,,,5.0,0.0,,,,,,,,,,,,,8,Livraison standard,9.0,false,,8,true,Quantité limitée !,KR,ThinkerValue,thinkervalue,67 % avis positifs (3 notes),3,3.6666666666666665,5fc5ff4c3e691f2727facac4,,,https://www.wish.com/c/5fe7640c31371f486424e869,https://canary.contestimg.wish.com/api/webimage/5fe7640c31371f486424e869-medium.jpg,5fe7640c31371f486424e869
12PCS / 6PCS / 3PCS Huile Essentielle avec Humidificateur Compte-gouttes Ensemble d'huile pour diffuseur d'arôme Huile d'aromathérapie Humidificateur 3ML Parfum Essentiel Pure Herbes Herbes Huiles Humidificateur Solution d'eau Huile pour la maison / hôtel Spa Relaxant,12PCS/6PCS/3PCS Essential Oil with Dropper Humidifier Oil Set for Aroma Diffuser Aromatherapy Oil Humidifier 3ML Fragrance Essential Pure Plant Herbs Oils Humidifier Water Solution Oil for Home/Hotel Spa Relaxing,3.18,EUR,4.0,EUR,3.86,1000,,,4.17741935483871,62.0,34,11,12,4,1,,,,,,,3pcs,50,Livraison standard,1.0,false,,50,true,Quantité limitée !,CN,zhangxiuhua3355,zhangxiuhua3355,"(3,856 notes)",3856,4.346732365145228,5d9d758f52e02426b925f683,,,https://www.wish.com/c/5faa1437e30a250047bd6260,https://canary.contestimg.wish.com/api/webimage/5faa1437e30a250047bd6260-medium.jpg,5faa1437e30a250047bd6260
"Herb Time Diffuser Refill, Red Fruit, 120ml","Herb Time Diffuser Refill, Red Fruit, 120ml",50.0,EUR,50.0,EUR,60.0,0,,,5.0,0.0,,,,,,,,,,,,,24,Livraison standard,9.0,false,,24,true,Quantité limitée !,KR,woo_korea,woo_korea,100 % avis positifs (2 notes),2,5.0,5fd9cf6be3c38640101e3795,,,https://www.wish.com/c/5fedb22c240bf6718289ed29,https://canary.contestimg.wish.com/api/webimage/5fedb22c240bf6718289ed29-medium.jpg,5fedb22c240bf6718289ed29
NATURE REPUBLIC Spray coiffant aux herbes,NATURE REPUBLIC Herb Styling Hair Spray,17.0,EUR,17.0,EUR,20,0,,,5.0,0.0,,,,,,,,,,,,,30,Livraison standard,6.0,false,,30,,,KR,huinayuna,huinayuna,,0,5.0,5fd268ed4b35fb269ab253ab,,,https://www.wish.com/c/5fdf4491e936b4e9c8af73c3,https://canary.contestimg.wish.com/api/webimage/5fdf4491e936b4e9c8af73c3-medium.jpg,5fdf4491e936b4e9c8af73c3
1 pc / 2 pièces crème de traitement des varices vascularite phlébite araignée jambe pommade herbe plâtre médical,1pc/2pcs Varicose Veins Treatment Cream Vasculitis Phlebitis Spider Leg Ointment Herb Medical Plaster ,3.89,EUR,4.0,EUR,4.72,10,,,4.857142857142857,7.0,6,1,0,0,0,,,,,,,1pc,50,Livraison standard,1.0,false,,50,,,CN,duxianqiulan,duxianqiulan,"75 % avis positifs (2,041 notes)",2041,3.6599706026457617,5de754b229e78670409f000a,,,https://www.wish.com/c/5ff6a8b87cdb8a0bdf19ad1e,https://canary.contestimg.wish.com/api/webimage/5ff6a8b87cdb8a0bdf19ad1e-medium.jpg,5ff6a8b87cdb8a0bdf19ad1e
Mug rouge herbe aux coeurs 340ml,Red mug herb with hearts 340ml,14.0,EUR,14.0,EUR,16.8,0,,,5.0,0.0,,,,,,,,,,,,,50,Livraison standard,5.0,false,,50,,,CZ,CzechBeadsExclusive,czechbeadsexclusive,"94 % avis positifs (1,342 notes)",1342,4.522354694485842,59f6f4037b584e6cfa9a8f9e,,,https://www.wish.com/c/5ff76f5dd4ec54539da762d9,https://canary.contestimg.wish.com/api/webimage/5ff76f5dd4ec54539da762d9-medium.jpg,5ff76f5dd4ec54539da762d9
4 couches métal broyeur de tabac mauvaises herbes broyeur main Muller fumée à base de plantes broyeur d'herbes accessoires de fumer,4 Layers Metal Tobacco Crusher Weeds Grinder Hand Muller Smoke Herbal Herb Grinder Smoking Accessories,5.0,EUR,24.0,EUR,6,5000,,,4.005973715651135,837.0,438,164,113,46,76,,,,,,black,typea,50,Livraison standard,2.0,false,,50,true,Quantité limitée !,CN,"Ipbusy business Co.,LTD",ipbusybusinesscoltd,"93 % avis positifs (70,296 notes)",70296,4.369053715716399,559f9bc3577ce1196df8258e,,,https://www.wish.com/c/5caf22df9adda723dfcd3ff1,https://canary.contestimg.wish.com/api/webimage/5caf22df9adda723dfcd3ff1-medium.jpg,5caf22df9adda723dfcd3ff1
56mm Biodegradable Herb GrinderTwo-layer Cookies Plastic  Tobacco Crusher,56mm Biodegradable Herb GrinderTwo-layer Cookies Plastic  Tobacco Crusher,5.0,EUR,5.0,EUR,6,10,,,5.0,0.0,,,,,,,,,,,black,,50,Livraison standard,2.0,false,,50,true,Quantité limitée !,CN,RachelHand,rachelhand,"95 % avis positifs (14,168 notes)",14168,4.5106578204404295,5ac83e396be8735e97ece47d,,,https://www.wish.com/c/604c9645b62ab99d2b85d04f,https://canary.contestimg.wish.com/api/webimage/604c9645b62ab99d2b85d04f-medium.jpg,604c9645b62ab99d2b85d04f
"Samsara Herbs Herba-V Immune (16oz/454g) - Herbal Immune Support Formula with 18 Powerful Herbal Extracts - Including Dan Shen, Skullcap, Licorice, Isatis, Resveratrol, Astragalus, Rhodiola and Kudzu","Samsara Herbs Herba-V Immune (16oz/454g) - Herbal Immune Support Formula with 18 Powerful Herbal Extracts - Including Dan Shen, Skullcap, Licorice, Isatis, Resveratrol, Astragalus, Rhodiola and Kudzu",194.0,EUR,194.0,EUR,234.0,0,,,5.0,0.0,,,,,,,,,,,,,3,Livraison standard,12.0,false,,3,,,KR,jjingosuda,jjingosuda,100 % avis positifs (5 notes),5,4.6,600aff5a739c8f04b76a4425,,,https://www.wish.com/c/6014e74a5f58098bad26788d,https://canary.contestimg.wish.com/api/webimage/6014e74a5f58098bad26788d-medium.jpg,6014e74a5f58098bad26788d
1 pièce plante artificielle herbe verte herbe artificielle plante en plastique décor à la maison faux plante pour la fête de mariage jardin fleur artificielle,1piece artificial plant green grass artificial grass plastic plant Home Decor fake plant for wedding party garden artificial flower,10.0,EUR,10.0,EUR,11,10,,,5.0,0.0,,,,,,,,,,,,,9,Livraison standard,2.0,false,,9,,,CN,floralsky,floralsky,"93 % avis positifs (4,969 notes)",4969,4.3545985107667535,564d317308db77126637d858,,,https://www.wish.com/c/5f210ea2b4567204788cee3e,https://canary.contestimg.wish.com/api/webimage/5f210ea2b4567204788cee3e-medium.jpg,5f210ea2b4567204788cee3e
Grand moulin à épices d'herbe de tabac de broyeur de fumée plat à quatre couches en alliage d'aluminium CN de 75 mm,Large 75mm Aluminum Alloy CN Four-layer Flat Smoke Grinder Tobacco Grinder  Herb Spice Mill,13.0,EUR,56.0,EUR,15,10,,,4.916666666666667,12.0,11,1,0,0,0,,,,,,black,,50,Livraison standard,4.0,false,,50,,,CN,DQZ Weed World,dqzweedworld,"89 % avis positifs (2,388 notes)",2388,4.189698492462312,5e0efd3d3723e91143dea83b,,,https://www.wish.com/c/5e8e8961fdca330476418b46,https://canary.contestimg.wish.com/api/webimage/5e8e8961fdca330476418b46-medium.jpg,5e8e8961fdca330476418b46
