title,title_orig,discount_price,discount_price_currency,retail_price,retail_price_currency,discount_price_in_original_currency,nb_cart_orders_approx,nb_units_purchased_approx,uses_ad_boosts,rating,rating_count,rating_five_count,rating_four_count,rating_three_count,rating_two_count,rating_one_count,badges_count,badge_local_product,badge_product_quality,badge_fast_shipping,tags,product_color,product_variation_size_id,product_variation_inventory,shipping_option_name,shipping_option_price,shipping_is_express,countries_shipped_to,inventory_total,has_urgency_banner,urgency_text,origin_country,merchant_title,merchant_name,merchant_info_subtitle,merchant_rating_count,merchant_rating,merchant_id,merchant_has_profile_picture,merchant_profile_picture,product_url,product_picture,product_id
"Planetary Herbs Glucosamine MSM Herbal 1000mg Tablets, 180ea, 1ea (please check the description)","Planetary Herbs Glucosamine MSM Herbal 1000mg Tablets, 180ea, 1ea (please check the description)",68.0,EUR,68.0,EUR,82.0,0,,,5.0,0.0,,,,,,,,,,,,,2,Livraison standard,12.0,false,,2,,,KR,K-Mild,kmild,63 % avis positifs (8 notes),8,3.0,5ff5ca506fb1f4d5c07d6fd6,,,https://www.wish.com/c/604f4bd212e0676b7db5e91f,https://canary.contestimg.wish.com/api/webimage/604f4bd212e0676b7db5e91f-medium.jpg,604f4bd212e0676b7db5e91f
Broyeur à tabac en métal broyeur de fines herbes broyeur de fumée,Metal Tobacco Grinder Herbal Herb Grinder Smoke Crusher ,8.0,EUR,8.0,EUR,9,10,,,4.428571428571429,7.0,5,1,0,1,0,,,,,,green,40mm,50,Livraison standard,3.0,false,,50,,,CN,MengXiangYuShop,mengxiangyushop,"90 % avis positifs (3,387 notes)",3387,4.280188957779746,5b9b1f4a26957048486921e1,,,https://www.wish.com/c/5fc9d2fe33436b11492a7cf8,https://canary.contestimg.wish.com/api/webimage/5fc9d2fe33436b11492a7cf8-medium.jpg,5fc9d2fe33436b11492a7cf8
2021 nouveau granit pilon et mortier ensemble pierre herbe épices broyeur solide broyeur maison cuisine accessoires 4 couleurs,2021 New Granite Pestle and Mortar Set Stone Herb Spice Grinder Solid Crusher Home Kitchen Accessories 4 Colors,12.0,EUR,12.0,EUR,14,10,,,4.5,4.0,2,2,0,0,0,,,,,,,brown-small,49,Livraison standard,4.0,false,,50,true,Quantité limitée !,CN,wangziqian,wangziqian,93 % avis positifs (15 notes),15,3.8666666666666667,5ea3f3e6cba264a2b2b007af,,,https://www.wish.com/c/60515633689caf1ed7ea11be,https://canary.contestimg.wish.com/api/webimage/60515633689caf1ed7ea11be-medium.jpg,60515633689caf1ed7ea11be
Longevity Blood Pressure Formula [120 Capsules] - with 12+ Natural Herbs. Best Blood Pressure Supplement,Longevity Blood Pressure Formula [120 Capsules] - with 12+ Natural Herbs. Best Blood Pressure Supplement,71.0,EUR,71.0,EUR,86.0,1,,,1.0,1.0,0,0,0,0,1,,,,,,,,2,Livraison standard,12.0,false,,2,,,KR,baelyeo,baelyeo,67 % avis positifs (3 notes),3,3.6666666666666665,5fc28bdc1d0178b750570571,,,https://www.wish.com/c/60613045d29beb8887c33b3a,https://canary.contestimg.wish.com/api/webimage/60613045d29beb8887c33b3a-medium.jpg,60613045d29beb8887c33b3a
"Nouveau broyeur de tabac à base de plantes à épices manuel, broyeur à tabac en alliage de zinc solide, léger et facile à stocker et à transporter","New Manual spice herb herbal tobacco grinder Strong zinc alloy grinder tobacco pipe set, lightweight and easy to store and carry",15.0,EUR,15.0,EUR,18,10,,,4.666666666666667,12.0,10,0,2,0,0,,,,,,,,50,Livraison standard,5.0,false,,50,,,CN,Ruixinda International Limited,ruixindainternationallimited,"92 % avis positifs (25,883 notes)",25883,4.312946721786501,555b2bb8b021370ea57733c3,,,https://www.wish.com/c/5ffc32bd6e98388cac6528de,https://canary.contestimg.wish.com/api/webimage/5ffc32bd6e98388cac6528de-medium.jpg,5ffc32bd6e98388cac6528de
"Chinese Mugwort ai ye 艾葉艾蒿 aihao Ganghwa Medicine Mugwort Tea Oriental Wormwood 100 Natural Dried Bulk Herbs 3 Oz 88g, One Size, One Color","Chinese Mugwort ai ye 艾葉艾蒿 aihao Ganghwa Medicine Mugwort Tea Oriental Wormwood 100 Natural Dried Bulk Herbs 3 Oz 88g, One Size, One Color",182.0,EUR,182.0,EUR,220.0,0,,,5.0,0.0,,,,,,,,,,,,,20,Livraison standard,12.0,false,,20,,,KR,Stay_Gorgeous Korea,stay_gorgeouskorea,100 % avis positifs (5 notes),5,4.8,5fd76ab639ab348c49576bf2,,,https://www.wish.com/c/601960ec6bd8beb743b2a050,https://canary.contestimg.wish.com/api/webimage/601960ec6bd8beb743b2a050-medium.jpg,601960ec6bd8beb743b2a050
 Grand moulin à herbes 4 couches en alliage de zinc avec récupérateur de pollen, Zinc Alloy 4-Layer Herb Grinder Large with Pollen Catcher,7.0,EUR,7.0,EUR,8,10,,,3.849056603773585,53.0,27,10,5,3,8,,,,,,silver,,50,Livraison standard,3.0,false,,50,true,Quantité limitée !,CN,Xiuyi,xiuyi,"92 % avis positifs (47,619 notes)",47619,4.34990234990235,57872be116b28907f9b4f63e,,,https://www.wish.com/c/5c4eaf77bcfa9948b1c85e7b,https://canary.contestimg.wish.com/api/webimage/5c4eaf77bcfa9948b1c85e7b-medium.jpg,5c4eaf77bcfa9948b1c85e7b
"20 tiges, véritable bouquet d'herbe de pampa séchée, décoration de mariage, bouquet de fleurs, plantes naturelles, décoration d'intérieur, utilisation de mariage, décor de bureau, décor d'automne, cadeau de Noël","20 stems,Real Dried Pampas Grass Bouquet,Wedding Decor,Flower Bunch,Natural Plants,Home Decor,Wedding Use,Office Decor,Fall Decor,Christmas Gift",19.0,EUR,42.0,EUR,22,10,,,4.03125,32.0,20,2,3,5,2,,,,,,primary,10stems,50,Livraison standard,6.0,false,,50,,,CN,Pampas Grass Thinker,pampasgrassthinker,(590 notes),590,4.389830508474576,5e10e925c2f1634d4253115d,,,https://www.wish.com/c/5f62131d48c468d6723b2380,https://canary.contestimg.wish.com/api/webimage/5f62131d48c468d6723b2380-medium.jpg,5f62131d48c468d6723b2380
Hachoir Alimentaire Manuel 5 Lames Tirez Cordon Robot culinaire Hachoir À Légumes Oignon Hachoir Robot culinaire Mélangeur Hachoir À Viande Fruit Oignon Ail Et Trancheuse À Herbes Pour Salade,Manual Food Chopper 5 Blades Pull String Food Processor Vegetable Chopper Onion Chopper Food Processor Blender Meat Mincer Fruit Onion Garlic And Herb Slicer For Salad,15.0,EUR,15.0,EUR,18,10,,,4.533333333333333,15.0,10,3,2,0,0,,,,,,blue,normalquality,1,Livraison Express,5.0,true,,11,,,CN,HBDREAM,hbdream,"81 % avis positifs (9,175 notes)",9175,3.896566757493188,573d29927bc16e5957f708c8,,,https://www.wish.com/c/5df49be972cca000e9257f8c,https://canary.contestimg.wish.com/api/webimage/5df49be972cca000e9257f8c-medium.jpg,5df49be972cca000e9257f8c
Grand moulin à herbes 4 couches en alliage de zinc avec récupérateur de pollen,Zinc Alloy 4-Layer Herb Grinder Large with Pollen Catcher,7.0,EUR,7.0,EUR,8,10,,,4.217391304347826,138.0,85,23,13,9,8,,,,,,grey,,50,Livraison standard,2.0,false,,50,,,CN,Haavone007,havana007,"90 % avis positifs (8,694 notes)",8694,4.240050609615827,59f96e24448a52158f1d343c,,,https://www.wish.com/c/5d32e1a623048d42014cbbfc,https://canary.contestimg.wish.com/api/webimage/5d32e1a623048d42014cbbfc-medium.jpg,5d32e1a623048d42014cbbfc
GNC Herb Plus Milk Thistle 1300mg 120caps,GNC Herb Plus Milk Thistle 1300mg 120caps,158.0,EUR,158.0,EUR,191.0,0,,,5.0,0.0,,,,,,,,,,,,,1,Livraison standard,12.0,false,,1,,,KR,huinayuna,huinayuna,,0,5.0,5fd268ed4b35fb269ab253ab,,,https://www.wish.com/c/5fe1cdfb6086feabac96576e,https://canary.contestimg.wish.com/api/webimage/5fe1cdfb6086feabac96576e-medium.jpg,5fe1cdfb6086feabac96576e
Super Upgrade Artificial Grass Carpet Outdoor Fake Grass Mat Lawn Natural Realistic Garden Synthetic Turf,Super Upgrade Artificial Grass Carpet Outdoor Fake Grass Mat Lawn Natural Realistic Garden Synthetic Turf,7.0,EUR,7.0,EUR,8,10,,,5.0,0.0,,,,,,,,,,,,50x50cm,50,Livraison standard,2.0,false,,50,,,US,Karmamedia,karmamedia,100 % avis positifs (1 notes),1,5.0,5fe61fe44b77d657f5810124,,,https://www.wish.com/c/605fd531a1c7b8c73c855e65,https://canary.contestimg.wish.com/api/webimage/605fd531a1c7b8c73c855e65-medium.jpg,605fd531a1c7b8c73c855e65
1pc/2pcs/3pcs  Varicose Veins Treatment Cream Vasculitis Phlebitis Spider Leg Ointment Herb Medical Plaster,1pc/2pcs/3pcs  Varicose Veins Treatment Cream Vasculitis Phlebitis Spider Leg Ointment Herb Medical Plaster,6.0,EUR,30.0,EUR,7,6,,,5.0,0.0,,,,,,,,,,,,lowquality-1pc,50,Livraison standard,2.0,false,,50,,,US,Oerry,oerry,88 % avis positifs (34 notes),34,4.470588235294118,5fe1e6885265269017de8a3c,,,https://www.wish.com/c/60508aeb7b8e2f26393b721c,https://canary.contestimg.wish.com/api/webimage/60508aeb7b8e2f26393b721c-medium.jpg,60508aeb7b8e2f26393b721c
Newfangled couleur Borosilicate de couleur en verre Herb Tobacco Smoking Pipes Pipe Holder Pipe Filtres pour hommes,Newfangled Color Borosilicate Glass Herb Tobacco Smoking Pipes Holder Pipe Filters For Men,10.0,EUR,10.0,EUR,12,5000,,,4.696734059097978,1286.0,1059,138,49,6,34,,,,,,,,11,Livraison standard,3.0,false,,11,,,CN,Lanscake,lanscake,"(9,968 notes)",9968,4.266753611556982,5901b85471a2f211c4f930b3,,,https://www.wish.com/c/5b3b415580f4896c644bde1e,https://canary.contestimg.wish.com/api/webimage/5b3b415580f4896c644bde1e-medium.jpg,5b3b415580f4896c644bde1e
4 pouces lueur dans le tuyau de brûleur à mazout en verre foncé tuyaux à main Scorpion Pipe à fumer lumineuse,4 inch Glow in the Dark Glass Oil Burner Pipe Scorpion Hand Pipes Luminous Smoking Pipe,7.0,EUR,7.0,EUR,8,10000,,,4.542478242851223,2413.0,1815,322,142,38,96,,,,,,black,,50,Livraison standard,2.0,false,,50,,,CN,jjbang,jjbang,"92 % avis positifs (52,203 notes)",52203,4.345382449284524,56fbacc085558c2865934590,,,https://www.wish.com/c/5b8fa941ce78a6136d13c09d,https://canary.contestimg.wish.com/api/webimage/5b8fa941ce78a6136d13c09d-medium.jpg,5b8fa941ce78a6136d13c09d
"Amazing Herbs Black Seed Oil 90 Softgel Capsules, 500 mg","Amazing Herbs Black Seed Oil 90 Softgel Capsules, 500 mg",73.0,EUR,73.0,EUR,88.0,0,,,5.0,0.0,,,,,,,,,,,,,3,Livraison standard,12.0,false,,3,,,KR,tongrou,tongrou,100 % avis positifs (1 notes),1,4.0,5fa2655960b29f003e882eb0,,,https://www.wish.com/c/607aacab98b79abbc940ed2a,https://canary.contestimg.wish.com/api/webimage/607aacab98b79abbc940ed2a-medium.jpg,607aacab98b79abbc940ed2a
100Pcs/Lot Sachets de thé vides Sachet à cordon de serrage Sachet de thé 5.5 x 7CM Filtre d'étanchéité pour Medcine Cook Herb Spice Tea Bag en vrac,100Pcs/Lot Empty Scented Tea Bags Drawstring Pouch Bag 5.5 x 7CM Seal Filter for Medcine Cook Herb Spice Loose Tea Bag,3.04,EUR,4.0,EUR,3.6799999999999997,10,,,4.538461538461538,13.0,9,2,2,0,0,,,,,,,,50,Livraison standard,1.0,false,,50,,,CN,llzzmm,llzzmm,"90 % avis positifs (14,952 notes)",14952,4.272940074906367,5aa766d367d25c6bc146b586,,,https://www.wish.com/c/6011296c480a6852d7570972,https://canary.contestimg.wish.com/api/webimage/6011296c480a6852d7570972-medium.jpg,6011296c480a6852d7570972
Nouveau Porte-Cigarette Rétractable Mini Pipes À Fumer Portable Pipe À Tabac En Métal Cadeaux Tige Télescopique Tiges À Tige Courte 2 Tailles,New Retractable Cigarette Holder Mini Portable Smoking Pipes Metal Tobacco Pipe Gifts Telescopic Rod Short Rod Pipes 2 Sizes,3.08,EUR,9.0,EUR,3.73,10000,,,3.8235831809872027,2188.0,1100,343,297,155,293,,,,,,,s,50,Livraison standard,1.0,false,,50,true,Quantité limitée !,CN,shiliandi,shiliandi,"(2,445 notes)",2445,4.1235173824130875,5d7f010f3f0bbc5f22ebf3ee,,,https://www.wish.com/c/5dd0ed6b7e7284305d3bfcc2,https://canary.contestimg.wish.com/api/webimage/5dd0ed6b7e7284305d3bfcc2-medium.jpg,5dd0ed6b7e7284305d3bfcc2
"4.5 ""PINK DICHRO TWIST COLLECTIBLE TOBACCO GLASS SMOKING HERB BOWL HAND TIPES CADEAU","4.5"" PINK DICHRO TWIST COLLECTIBLE TOBACCO GLASS SMOKING HERB BOWL HAND PIPES GIFT",28.0,EUR,28.0,EUR,33,10,,,4.666666666666667,15.0,11,3,1,0,0,,,,,,pink,packof1,17,Livraison standard,9.0,false,,17,,,US,JCHATS,jchats,"92 % avis positifs (10,180 notes)",10180,4.445874263261297,5be0ecca58512119a812e8b2,,,https://www.wish.com/c/5f75340d47fa9743ffc44b86,https://canary.contestimg.wish.com/api/webimage/5f75340d47fa9743ffc44b86-medium.jpg,5f75340d47fa9743ffc44b86
Broyeur de tabac avec lames de coupe broyeur à bois broyeur d'herbes,Tobacco Crusher with Cutting Blades Wood Grinder Herb Grinder,4.0,EUR,4.0,EUR,4,10,,,4.166666666666667,18.0,10,4,1,3,0,,,,,,red,small,50,Livraison standard,1.0,false,,50,,,CN,fefwec,fefwec,(22 notes),22,4.409090909090909,5ea0f7d3eba731237efe8fa1,,,https://www.wish.com/c/5f1bebd33e75bb02f98341c6,https://canary.contestimg.wish.com/api/webimage/5f1bebd33e75bb02f98341c6-medium.jpg,5f1bebd33e75bb02f98341c6
Mode coloré Long manche Silicone tabac fumer tuyaux herbe cigarette pipe accessoires pour fumer,Fashion Colourful Long handle Silicone Tobacco Smoking Pipes Herb Cigarette Pipe Smoking Accessories,7.0,EUR,15.0,EUR,8,10,,,3.6666666666666665,3.0,2,0,0,0,1,,,,,,,randomstyledelivery,50,Livraison standard,2.0,false,,50,,,CN,Hornet_,hornet_,88 % avis positifs (277 notes),277,4.223826714801444,5d4eb56a1d9a8e23883019a3,,,https://www.wish.com/c/5d64dccfbb2cfb0ec002ed8a,https://canary.contestimg.wish.com/api/webimage/5d64dccfbb2cfb0ec002ed8a-medium.jpg,5d64dccfbb2cfb0ec002ed8a
Sumifun 6-60 pièces Patch diabétique herbes naturelles patchs équilibre teneur en glucose glycémie stabilise le diabète patchs en plâtre médical chinois,Sumifun 6-60pcs Diabetic Patch Natural Herbs Patches Balance Glucose Content  Blood Sugar Stabilizes Diabetes Plaster Patches Chinese Medical,3.15,EUR,17.0,EUR,3.8200000000000003,10,,,2.75,4.0,1,0,1,1,1,,,,,,,6pcs/1bag,50,Livraison standard,1.0,false,,50,,,CN,thujytju,thujytju,92 % avis positifs (225 notes),225,4.386666666666667,5de37c3fd30dac4c40e358f4,,,https://www.wish.com/c/601119bdacfaec3d05150b27,https://canary.contestimg.wish.com/api/webimage/601119bdacfaec3d05150b27-medium.jpg,601119bdacfaec3d05150b27
"Cheongmyeong Herb Moringa Leaf, 300g, Feuille","Cheongmyeong Herb Moringa Leaf, 300g, Leaf",19.0,EUR,19.0,EUR,23.0,1,,,5.0,0.0,,,,,,,,,,,,,9,Livraison standard,17.0,false,,9,,,KR,atcmart,atcmart,67 % avis positifs (6 notes),6,3.8333333333333335,5fe2119d5265268f81dec682,,,https://www.wish.com/c/5ff34ce9411caf257abb7ad9,https://canary.contestimg.wish.com/api/webimage/5ff34ce9411caf257abb7ad9-medium.jpg,5ff34ce9411caf257abb7ad9
"Gaia Herbs Women'S Libido, flacon de 60 capsules","Gaia Herbs Women'S Libido, 60-capsule Bottle",71.0,EUR,71.0,EUR,86.0,0,,,5.0,0.0,,,,,,,,,,,,,3,Livraison standard,12.0,false,,3,,,KR,ssamssfm,ssamssfm,100 % avis positifs (11 notes),11,4.909090909090909,5ff175cd149d7e6e6a4ed023,,,https://www.wish.com/c/60006aaf6f89a8004c0a37ae,https://canary.contestimg.wish.com/api/webimage/60006aaf6f89a8004c0a37ae-medium.jpg,60006aaf6f89a8004c0a37ae
10ML Swiss Just 31 Herb Oleo,10ML Swiss Just 31 Herb Oleo,4.82,EUR,5.0,EUR,5.84,10,,,1.0,2.0,0,0,0,0,2,,,,,,,1pcs,50,Livraison standard,2.0,false,,50,,,CN,zhuangyang159258,zhuangyang159258,69 % avis positifs (29 notes),29,3.5517241379310347,5f1660a92fc89460c974eb69,,,https://www.wish.com/c/5fc4ea5e9f47bbc4f5159d7d,https://canary.contestimg.wish.com/api/webimage/5fc4ea5e9f47bbc4f5159d7d-medium.jpg,5fc4ea5e9f47bbc4f5159d7d
Huile d'essence de croissance d'herbes 10 ml,10ML Herb Growth Essence Oil,5.0,EUR,5.0,EUR,6,1000,,,3.685185185185185,54.0,21,14,8,3,8,,,,,,,1pcs,50,Livraison standard,2.0,false,,50,,,CN,TMALLCOM,tmallcom,92 % avis positifs (192 notes),192,4.25,5d595d8840defd0e59aca4bb,,,https://www.wish.com/c/5db686a21881123599d68948,https://canary.contestimg.wish.com/api/webimage/5db686a21881123599d68948-medium.jpg,5db686a21881123599d68948
"[Overseas Books] Rosemary Gladstar's Medicinal Herbs, Storey Books","[Overseas Books] Rosemary Gladstar's Medicinal Herbs, Storey Books",27.0,EUR,27.0,EUR,32.0,0,,,5.0,0.0,,,,,,,,,,,,,3,Livraison standard,17.0,false,,3,,,KR,atcmart,atcmart,67 % avis positifs (6 notes),6,3.8333333333333335,5fe2119d5265268f81dec682,,,https://www.wish.com/c/60098f18300327e6f8580d00,https://canary.contestimg.wish.com/api/webimage/60098f18300327e6f8580d00-medium.jpg,60098f18300327e6f8580d00
Bouquet Garni Himalayan Herb Nard Repair Treatment,Bouquet Garni Himalayan Herb Nard Repair Treatment,43.0,EUR,43.0,EUR,51.0,0,,,5.0,0.0,,,,,,,,,,,,,50,Livraison standard,9.0,false,,50,true,Quantité limitée !,KR,woo_korea,woo_korea,100 % avis positifs (2 notes),2,5.0,5fd9cf6be3c38640101e3795,,,https://www.wish.com/c/5fdf96278906e23ec21dd76c,https://canary.contestimg.wish.com/api/webimage/5fdf96278906e23ec21dd76c-medium.jpg,5fdf96278906e23ec21dd76c
Accessoires de tabac magnétiques en métal de pipe de cuillère portative multicolore pour le cadeau,Multicolor Portable Spoon Smoking Pipe Magnetic Metal Tobacco Accessories For Gift,6.0,EUR,8.0,EUR,7,1000,,,4.292307692307692,845.0,563,128,58,30,66,,,,,,green,,50,Livraison standard,2.0,false,,50,true,Quantité limitée !,CN,AAAAZZZZZ,aaaazzzzz,"(6,551 notes)",6551,4.44405434284842,5b7ba07591d0044e730761e5,,,https://www.wish.com/c/5bb38675a1fa8216b4599681,https://canary.contestimg.wish.com/api/webimage/5bb38675a1fa8216b4599681-medium.jpg,5bb38675a1fa8216b4599681
The Herbal Smoking Regular Flavor Fabriqué à partir de thé) pour arrêter de fumer 100% sans tabac -100% sans nicotine (200 pièces),The Herbal Smoking Regular Flavor Made from tea )to Quit smoking 100% Tobacco Free -100% Nicotine Free (200Pcs),13.0,EUR,13.0,EUR,15,1000,,,4.143396226415095,265.0,165,35,30,8,27,,,,,,,chenpipuer,50,Livraison standard,4.0,false,,50,true,Quantité limitée !,CN,zhuguangji306,zhuguangji306,93 % avis positifs (266 notes),266,4.469924812030075,5d4bc39f8388974a2c4d3d77,,,https://www.wish.com/c/5f462763de3c80111a0dc3ff,https://canary.contestimg.wish.com/api/webimage/5f462763de3c80111a0dc3ff-medium.jpg,5f462763de3c80111a0dc3ff
Portable Bowling Métal Fumer Tuyaux Creative Fumer Pipe Herb Tabac Tuyaux Narguilé Fumée Hommes Cadeaux,Portable Bowling Metal Smoking Pipes Creative Smoking Pipe Herb Tobacco Pipes Hookah Smoke Men Gifts,5.0,EUR,5.0,EUR,5,1000,,,4.462165308498254,859.0,616,126,55,22,40,,,,,,black,,50,Livraison standard,1.0,false,,50,,,CN,erkino,erkino,"(29,293 notes)",29293,4.482675041818864,579094204c20bc43b90256f7,,,https://www.wish.com/c/5b8dd833151bb02736bf71f3,https://canary.contestimg.wish.com/api/webimage/5b8dd833151bb02736bf71f3-medium.jpg,5b8dd833151bb02736bf71f3
Broyeur à épices de tabac en métal Rainbow Herb Grinder 4 Part Layer Stack Leaf Thème Amsterdam,Rainbow Herb Grinder Metal Tobacco Spice Crusher 4 Part Layer Stack Leaf Amsterdam Theme,9.0,EUR,9.0,EUR,9.85,4,,,3.0,1.0,0,0,1,0,0,,,,,,,,6,Livraison standard,13.83,false,,6,,,GB,Fenny's Creations,fennyscreations,100 % avis positifs (2 notes),2,5.0,600863398aa3ac082f310e14,,,https://www.wish.com/c/60099ed592f40afb09d6f88c,https://canary.contestimg.wish.com/api/webimage/60099ed592f40afb09d6f88c-medium.jpg,60099ed592f40afb09d6f88c
Mini Cartoon Animation Herb Grinder New Tobacco Crusher 4 Layer Cigarette Rolling Holder Metal Trays Smoke Accessories,Mini Cartoon Animation Herb Grinder New Tobacco Crusher 4 Layer Cigarette Rolling Holder Metal Trays Smoke Accessories,5.0,EUR,40.0,EUR,6,10,,,4.173913043478261,23.0,15,3,2,0,3,,,,,,,tray,50,Livraison standard,2.0,false,,50,true,Quantité limitée !,CN,joyeille,joyeille,93 % avis positifs (152 notes),152,4.3618421052631575,5e7583a2ba7ff1310f4b4e1d,,,https://www.wish.com/c/5ee5d8ae3ce72e344beb3303,https://canary.contestimg.wish.com/api/webimage/5ee5d8ae3ce72e344beb3303-medium.jpg,5ee5d8ae3ce72e344beb3303
11.02 pouces Transparent Lumious / Pipe à eau en verre normal pour herbe Narguilé Shisha Brûleur à mazout Pipes Tabac à base de plantes Bol,11.02 Inch Transparent  Lumious/Normal Water Glass Pipe For Herb Hookah Shisha Oil Burner Smoking Pipes Tobacco Herbal Bowl,15.0,EUR,15.0,EUR,17,10,,,2.75,4.0,1,0,1,1,1,,,,,,,c-normal,50,Livraison standard,5.0,false,,50,,,CN,Wingdaying,wingdaying,"87 % avis positifs (9,688 notes)",9688,4.164327002477291,5ba59db8e5e89b18ef7cce04,,,https://www.wish.com/c/5fbb5bccd25b642bae1a9756,https://canary.contestimg.wish.com/api/webimage/5fbb5bccd25b642bae1a9756-medium.jpg,5fbb5bccd25b642bae1a9756
Nouvel outil de contrôle de la température des herbes sèches PATHFINDERII Ele-c Vista (UNIQUEMENT POUR les herbes sèches),NEW Dry Herb Temp Control Tool PATHFINDERII Ele-c Vista (ONLY FOR Dry Herb),14.0,EUR,14.0,EUR,16,10,,,5.0,0.0,,,,,,,,,,,red,good.,3,Livraison standard,5.0,false,,50,,,CN,drggd,drggd,84 % avis positifs (349 notes),349,4.0573065902578795,5d5a953d33f0b42881c0aa3e,,,https://www.wish.com/c/601cb8c144fb9ee66089cb4f,https://canary.contestimg.wish.com/api/webimage/601cb8c144fb9ee66089cb4f-medium.jpg,601cb8c144fb9ee66089cb4f
Broyeur à herbes en forme de batterie Incognito concasseur en métal à base de plantes d'épices de fumée cachée à la main,Battery shape Herb Grinder Incognito Hand Hidden Smoke Spice Herbal Metal Crusher,10.0,EUR,12.0,EUR,11,10,,,3.5,18.0,8,2,3,1,4,,,,,,,,50,Livraison standard,3.0,false,,50,,,CN,oldtimes,oldtimes,"91 % avis positifs (11,983 notes)",11983,4.3319702912459315,5626604764dd671121313a83,,,https://www.wish.com/c/5a2ad45d5dcd0210a68f1105,https://canary.contestimg.wish.com/api/webimage/5a2ad45d5dcd0210a68f1105-medium.jpg,5a2ad45d5dcd0210a68f1105
Bob Marley - Sticker herbe fumée - Multicolore,Bob Marley - Smoke Herb Decal - Multicolored,19.0,EUR,19.0,EUR,23,10,,,4.0,1.0,0,1,0,0,0,,,,,,multicolored,,15,Livraison standard,6.0,false,,15,,,,Old Glory,oldglory,"94 % avis positifs (20,078 notes)",20078,4.474001394561212,512c0a9f1d3b484430b6c0d6,,,https://www.wish.com/c/5334811f220e680c6c934608,https://canary.contestimg.wish.com/api/webimage/5334811f220e680c6c934608-medium.jpg,5334811f220e680c6c934608
Wood Raised Garden Bed Planter Elevated Box Kit Vegetable Flower Herbs Yard,Wood Raised Garden Bed Planter Elevated Box Kit Vegetable Flower Herbs Yard,32.0,EUR,32.0,EUR,38,1,,,5.0,0.0,,,,,,,,,,,,s,50,Livraison Express,10.0,true,,50,true,Quantité limitée !,CN,Tbnmoshop,tbnmoshop,"94 % avis positifs (2,467 notes)",2467,4.4406161329550065,5b5c217c5d12795cf68f3893,,,https://www.wish.com/c/607ea525880029732c903578,https://canary.contestimg.wish.com/api/webimage/607ea525880029732c903578-medium.jpg,607ea525880029732c903578
Tisane fine fumée thé noir Cigarette fine pour arrêter de fumer 100% sans tabac -100% sans nicotine,Fine Herbal Tea Smoke Black Tea Fine Cigarette to Quit smoking  100% Tobacco Free -100% Nicotine Free,12.0,EUR,12.0,EUR,14,10,,,4.09375,64.0,33,17,6,3,5,,,,,,,5packsofblacktea,20,Livraison standard,3.0,false,,50,true,Quantité limitée !,CN,qijokminh,qijokminh,"86 % avis positifs (1,313 notes)",1313,4.093678598629094,5d491eb87ad2421287ba05e3,,,https://www.wish.com/c/5ebf51ff3fcaba1391331454,https://canary.contestimg.wish.com/api/webimage/5ebf51ff3fcaba1391331454-medium.jpg,5ebf51ff3fcaba1391331454
"CADEAU DE TUYAUX À MAIN EN VERRE TABAC À FUMER EN VERRE TABAC À FUMER DE 5 ""","5"" RED CAP MUSHROOM COLLECTIBLE TOBACCO GLASS SMOKING HERB BOWL HAND PIPES GIFT",28.0,EUR,41.0,EUR,33,10,,,4.590308370044053,227.0,179,27,7,4,10,,,,,,multicolor,packof1,50,Livraison standard,8.0,false,,50,,,US,JCHATS,jchats,"92 % avis positifs (10,180 notes)",10180,4.445874263261297,5be0ecca58512119a812e8b2,,,https://www.wish.com/c/5f75402147fa9755d7c44e6e,https://canary.contestimg.wish.com/api/webimage/5f75402147fa9755d7c44e6e-medium.jpg,5f75402147fa9755d7c44e6e
Broyeur de tabac en plastique et en métal 3/4 couches mauvaises herbes 40 MM moulin à herbes à base de fumée à la main Muller,3/4 Layers plastic&Metal Tobacco Crusher Weeds 40MM Hand Muller Smoke Herbal Herb Grinder,3.12,EUR,4.0,EUR,3.7800000000000002,10,,,3.142857142857143,21.0,9,1,2,2,7,,,,,,black,1pcplastic&randomcolor,5,Livraison standard,1.0,false,,50,,,CN,hebing811,hebing811,"(4,300 notes)",4300,4.381395348837209,58c3cfbce4595e6db95e6c6d,,,https://www.wish.com/c/5f8d59cdc509d49a9f3646f5,https://canary.contestimg.wish.com/api/webimage/5f8d59cdc509d49a9f3646f5-medium.jpg,5f8d59cdc509d49a9f3646f5
Sumifun 6-60 Pcs Patch Diabétique Stabilise L'équilibre De La Sucre Sanguine Glucose Patch Patch Naturel Herbes Contenu Diabète Plâtre Patchs,Sumifun 6-60Pcs Diabetic Patch Stabilizes Blood Sugar Balance Blood Glucose Patch Natural Herbs Content Diabetes Plaster Patches,3.0,EUR,3.0,EUR,3,1000,,,4.342789598108747,423.0,262,88,47,8,18,,,,,,,6pcs,50,Livraison standard,1.0,false,,50,,,CN,utoemd26f,utoemd26f,"92 % avis positifs (1,312 notes)",1312,4.295731707317073,5dc3d67e910e6e008062c1be,,,https://www.wish.com/c/5e1577a20fbff504f1727d4b,https://canary.contestimg.wish.com/api/webimage/5e1577a20fbff504f1727d4b-medium.jpg,5e1577a20fbff504f1727d4b
L'augmentation de thé de médecine chinoise de thé d'hommes renforce l'épaississement de longue durée,Men Tea Chinese Medicine Tea Increase Strengthen Thicken Long-lasting,5.0,EUR,5.0,EUR,6,1000,,,4.0234375,128.0,69,19,24,6,10,,,,,,,30g,50,Livraison standard,2.0,false,,50,true,Quantité limitée !,CN,zhuguli,zhuguli,"87 % avis positifs (3,179 notes)",3179,4.063541994337842,57b9a36f4cba4b18dca8b9ed,,,https://www.wish.com/c/5f3755c7ce7d13003cf6b7b8,https://canary.contestimg.wish.com/api/webimage/5f3755c7ce7d13003cf6b7b8-medium.jpg,5f3755c7ce7d13003cf6b7b8
POUDRE AUX HERBES DE WORMWOOD BIO,WORMWOOD HERB POWDER ORGANIC,77.0,EUR,77.0,EUR,93.0,0,,,5.0,0.0,,,,,,,,,,,,,3,Livraison standard,12.0,false,,3,true,Quantité limitée !,KR,jjingosuda,jjingosuda,100 % avis positifs (5 notes),5,4.6,600aff5a739c8f04b76a4425,,,https://www.wish.com/c/6014e81d1488e27e3e973284,https://canary.contestimg.wish.com/api/webimage/6014e81d1488e27e3e973284-medium.jpg,6014e81d1488e27e3e973284
Kan Herbs - Four Marvels 300 tabs,Kan Herbs - Four Marvels 300 tabs,178.0,EUR,178.0,EUR,215.0,0,,,5.0,0.0,,,,,,,,,,,,,3,Livraison standard,12.0,false,,3,,,KR,tongrou,tongrou,100 % avis positifs (1 notes),1,4.0,5fa2655960b29f003e882eb0,,,https://www.wish.com/c/607aaaecde73718831abe697,https://canary.contestimg.wish.com/api/webimage/607aaaecde73718831abe697-medium.jpg,607aaaecde73718831abe697
