title,title_orig,discount_price,discount_price_currency,retail_price,retail_price_currency,discount_price_in_original_currency,nb_cart_orders_approx,nb_units_purchased_approx,uses_ad_boosts,rating,rating_count,rating_five_count,rating_four_count,rating_three_count,rating_two_count,rating_one_count,badges_count,badge_local_product,badge_product_quality,badge_fast_shipping,tags,product_color,product_variation_size_id,product_variation_inventory,shipping_option_name,shipping_option_price,shipping_is_express,countries_shipped_to,inventory_total,has_urgency_banner,urgency_text,origin_country,merchant_title,merchant_name,merchant_info_subtitle,merchant_rating_count,merchant_rating,merchant_id,merchant_has_profile_picture,merchant_profile_picture,product_url,product_picture,product_id
"Moulinet de pêche Baitcasting 17,6 Lbs 10 + 1 Roulements à billes 6,3: 1 Rapport d'engrenage Moulinet haute vitesse avec système de freinage magnétique Frein en fibre de carbone plus résistant Léger et compact Accessoire de pêche FlySand pour eau douce et eau salée - Droitier / gaucher En option",Baitcasting Fishing Reel 17.6 Lbs 10+1 Ball Bearings 6.3:1 Gear Ratio High Speed Reel with Magnetic Brake System Stronger Carbon Fiber Drag Lightweight Compact Design FlySand Fishing Accessory for Freshwater and Saltwater - Right/Left Handed Optional,8.0,EUR,8.0,EUR,9,10,,,5.0,0.0,,,,,,,,,,,,figure1-lefthand,50,Livraison Express,7.0,true,,50,,,CN,All over the word,allovertheword,"87 % avis positifs (6,868 notes)",6868,4.089400116482237,5d521d0d8f85fa57d3b02680,,,https://www.wish.com/c/606bf66071b112f87041a239,https://canary.contestimg.wish.com/api/webimage/606bf66071b112f87041a239-medium.jpg,606bf66071b112f87041a239
50 Pcs Pochettes D'alcool En Plastique Flacons À Boire Sacs À Bec Liquide Réutilisables Poche Liquide Dissimulable Léger,50Pcs Plastic Liquor Pouches Drinking Flasks Reusable Liquid Spout Bags Lightweight Concealable Liquid Pouch Wine Bottle,15.0,EUR,15.0,EUR,18,10,,,4.411764705882353,17.0,13,2,0,0,2,,,,,,,200ml-50pcs,50,Livraison standard,5.0,false,,50,true,Quantité limitée !,CN,Plutoheart,phoenixsun,"92 % avis positifs (101,269 notes)",101269,4.32404783299924,54d5dd417851092832ee30e5,,,https://www.wish.com/c/5ef172baa6a5c01f2f5d75da,https://canary.contestimg.wish.com/api/webimage/5ef172baa6a5c01f2f5d75da-medium.jpg,5ef172baa6a5c01f2f5d75da
Summer Fashion Open-toed Platform Wedge Slippers Home Casual Flip-Flops Lightweight and Versatile Sandals 4 Colors,Summer Fashion Open-toed Platform Wedge Slippers Home Casual Flip-Flops Lightweight and Versatile Sandals 4 Colors,3.96,EUR,19.0,EUR,4.8,10,,,3.0,3.0,1,0,0,2,0,,,,,,yellow,34,20,Livraison standard,1.0,false,,50,,,CN,fashion show yeah,fashionshowyeah,"(1,214 notes)",1214,4.118616144975288,5d56c1874a4e223c83dc3ec1,,,https://www.wish.com/c/604c725c3919c8453544ffb9,https://canary.contestimg.wish.com/api/webimage/604c725c3919c8453544ffb9-medium.jpg,604c725c3919c8453544ffb9
12 couleurs femmes été papillon / fleur chaussures de plage évider sandales confortables sandales intérieures / extérieures légères taille 36-42,12 Colors Women Summer Butterfly/flower Beach Shoes Hollow-out Comfortable Sandals Indoor/outdoor Lightweight Slippers Size 36-42,4.74,EUR,5.0,EUR,5.75,10,,,4.428571428571429,14.0,10,2,1,0,1,,,,,,pink,eur36,50,Livraison standard,2.0,false,,50,,,CN,liliangl,liliangl,"94 % avis positifs (2,307 notes)",2307,4.4971824880797575,5ae2e72b9d5e977ffcd6b099,,,https://www.wish.com/c/5eddaab8c45f3b5b0c18040b,https://canary.contestimg.wish.com/api/webimage/5eddaab8c45f3b5b0c18040b-medium.jpg,5eddaab8c45f3b5b0c18040b
Sony,,,,,,,,,,,,,,,,,,,,,,,,,,,,,,,,,,,,,,,,,https://www.wish.com/c/5e3b0ba29719eddf0ac7e65c,,5e3b0ba29719eddf0ac7e65c
Nouveaux shorts de mode pour femmes d'été avec poches couleur pure unie et shorts imprimés cordon de serrage taille élastique pantalon court plage léger pantalon de salon court Shorts décontractés,New Summer Women Fashion Shorts with Pockets Plain Pure Color and Print Shorts Drawstring Elastic Waist Short Pants Beach Lightweight Short Lounge Pants Casual Shorts,4.74,EUR,5.0,EUR,5.75,10,,,3.4,15.0,6,2,3,0,4,,,,,,leopardprint,xs,1,Livraison standard,2.0,false,,50,,,CN,qianzhihe,qianzhihe,"92 % avis positifs (7,684 notes)",7684,4.302186361270172,565816328f5f02126ad6e2ae,,,https://www.wish.com/c/5feac41743f89154050238f8,https://canary.contestimg.wish.com/api/webimage/5feac41743f89154050238f8-medium.jpg,5feac41743f89154050238f8
Nouveau mode hommes chaussures de randonnée léger antidérapant baskets en plein air pour la marche Trekking Camping Trail chaussures de course,New Fashion Men Hiking Shoes Lightweight Non-Slip Outdoor Sneaker for Walking Trekking Camping Trail Running Shoes,10.0,EUR,10.0,EUR,11,1000,,,4.221875,320.0,182,77,32,8,21,,,,,,grey,37,1,Livraison standard,2.0,false,,50,,,CN,ZENGHUI1990,waternoose,"92 % avis positifs (11,385 notes)",11385,4.314975845410628,5abdd07ca6f62e6e3949db61,,,https://www.wish.com/c/5ce3d09bb9e3021121f2e2e0,https://canary.contestimg.wish.com/api/webimage/5ce3d09bb9e3021121f2e2e0-medium.jpg,5ce3d09bb9e3021121f2e2e0
Nouvelle mode impression fermeture éclair vers le bas gilet unisexe Couple veste sans manches gilets légers,New Fashion Print Zipper Down Vest Unisex Couple Sleeveless Jacket Lightweight Waistcoats,14.0,EUR,14.0,EUR,16,10,,,3.111111111111111,9.0,2,2,2,1,2,,,,,,armygreen,m.,1,Livraison standard,4.0,false,,50,,,CN,diebushixingshi,diebushixingshi,77 % avis positifs (64 notes),64,3.640625,5eda0bdce3a89a0881ab5f82,,,https://www.wish.com/c/5f866fdeb4319a0687387197,https://canary.contestimg.wish.com/api/webimage/5f866fdeb4319a0687387197-medium.jpg,5f866fdeb4319a0687387197
Lightweight down padding,Lightweight down padding,92.0,EUR,92.0,EUR,111.0,0,,,5.0,0.0,,,,,,,,,,,beige,l(no.9),5,Livraison standard,12.0,false,,5,,,KR,abckorea,abckorea,50 % avis positifs (2 notes),2,3.0,5ff1208a858e8522e2389e39,,,https://www.wish.com/c/6042f3f610b98d857a0496b0,https://canary.contestimg.wish.com/api/webimage/6042f3f610b98d857a0496b0-medium.jpg,6042f3f610b98d857a0496b0
Boys Sneakers for Kids Shoes Baby Girls Toddler Shoes Fashion Casual Lightweight Breathable Soft Sport Running Children's Shoes Size 21-30,Boys Sneakers for Kids Shoes Baby Girls Toddler Shoes Fashion Casual Lightweight Breathable Soft Sport Running Children's Shoes Size 21-30,6.0,EUR,6.0,EUR,7,10,,,5.0,0.0,,,,,,,,,,,black,21,1,Livraison standard,2.0,false,,50,true,Quantité limitée !,CN,XIAOER-ZAHUOPU,xiaoerzahuopu,91 % avis positifs (139 notes),139,4.287769784172662,5d6259ef283abc63d14ddc64,,,https://www.wish.com/c/605ea8a386bed29d17363cbb,https://canary.contestimg.wish.com/api/webimage/605ea8a386bed29d17363cbb-medium.jpg,605ea8a386bed29d17363cbb
Grande taille femmes printemps / automne léger colorblock fermeture éclair à travers la veste à manches longues cordon de serrage chiné sweat à capuche manteau,Plus Size Women Spring/Autumn Lightweight Colorblock Zipper Through Jacket Long Sleeve Drawstring Heathered Hooded Sweatshirt Coat,8.0,EUR,8.0,EUR,9,1000,,,3.644536652835408,723.0,302,131,123,65,102,,,,,,purple,xs,10,Livraison standard,3.0,false,,50,,,US,The Teaching Toy Box,theteachingtoybox,"85 % avis positifs (6,572 notes)",6572,3.971850273889227,595f8e68abea911c379583f6,,,https://www.wish.com/c/5b4849d2760d1755caaf90e3,https://canary.contestimg.wish.com/api/webimage/5b4849d2760d1755caaf90e3-medium.jpg,5b4849d2760d1755caaf90e3
Écharpe Infinity Loop de couleur unie pour femmes,Plain Solid Color Women's Infinity Loop Scarf Soft Lightweight,10.0,EUR,25.0,EUR,12,10,,,3.5714285714285716,7.0,3,2,0,0,2,,,,,,white,,15,Livraison standard,3.0,false,,50,,,CN,Honghu,honghu,97 % avis positifs (375 notes),375,4.616,53ae5ec5ff4d6d2b708b1494,,,https://www.wish.com/c/55b0fd8ae00cb2405cd0917d,https://canary.contestimg.wish.com/api/webimage/55b0fd8ae00cb2405cd0917d-medium.jpg,55b0fd8ae00cb2405cd0917d
Nusing Clogs Chaussures de gommage antidérapantes pour hommes pour femmes Pantoufles légères Chaussures de jardin,Nusing Clogs Non-slip Men's Women's Scrub Shoes Lightweight Slippers Garden Shoes ,14.0,EUR,14.0,EUR,16,10,,,3.7,10.0,6,0,1,1,2,,,,,,white,5,50,Livraison standard,5.0,false,,50,true,Quantité limitée !,CN,oiunhuzsgcdscg,oiunhuzsgcdscg,88 % avis positifs (24 notes),24,4.083333333333333,5e8813078782b5cd803dbdea,,,https://www.wish.com/c/5ed7c3d9a7296650d745c2cf,https://canary.contestimg.wish.com/api/webimage/5ed7c3d9a7296650d745c2cf-medium.jpg,5ed7c3d9a7296650d745c2cf
BOTVELA Casquette Gavroche À Chevrons En Lin Bakerboy Casquettes Hommes Femmes Léger Respirant Chapeau Plat Apple Beret Chapeaux 007,BOTVELA Newsboy Cap Herringbone Linen Bakerboy Caps Men Women Lightweight Breathable Flat Hat Apple Beret Hats 007,11.0,EUR,11.0,EUR,13,10,,,5.0,1.0,1,0,0,0,0,,,,,,black,56-57cm,50,Livraison standard,3.0,false,,50,,,CN,"PuJiang BinDi Trading Co., Ltd",pujiangbinditradingcoltd,"95 % avis positifs (14,307 notes)",14307,4.438736282938422,53ec3198104dae0adb7e2149,,,https://www.wish.com/c/5ee1ff93cb814950bc96adf3,https://canary.contestimg.wish.com/api/webimage/5ee1ff93cb814950bc96adf3-medium.jpg,5ee1ff93cb814950bc96adf3
3 pièces adolescentes sacs de livres légers sacs d'école sac à dos ensemble toile impression sac à dos femmes mignon moyen haut,3pcs Teenage Girls Lightweight Bookbags School Bags Backpack Set Canvas Printing Backpack Women Cute Middle High,7.0,EUR,7.0,EUR,8,10,,,5.0,0.0,,,,,,,,,,,purple,,50,Livraison Express,5.0,true,,50,,,CN,jdzjhfgsjfmeiblc,jdzjhfgsjfmeiblc,86 % avis positifs (412 notes),412,4.131067961165049,5ed745ff74c1c90705fd4a55,,,https://www.wish.com/c/5f9931c78061e21af05655e5,https://canary.contestimg.wish.com/api/webimage/5f9931c78061e21af05655e5-medium.jpg,5f9931c78061e21af05655e5
Chaussures de sport pour hommes Chaussures de basket-ball en plein air Chaussures de course INS Chaussures à tricoter volantes légères,Men's Sports Shoes Outdoor Basketball Shoes Running Shoes INS Lightweight Flying Knitting Shoes Fashion Height Increase Shoes,15.0,EUR,15.0,EUR,17,10,,,3.7037037037037037,27.0,13,5,2,2,5,,,,,,black&green,us6.5,5,Livraison standard,5.0,false,,50,,,CN,ys1314hb,ys1314hb,(125 notes),125,4.12,5f49c3a7ca20110dd245d2d4,,,https://www.wish.com/c/5f9633f7abe361003d879301,https://canary.contestimg.wish.com/api/webimage/5f9633f7abe361003d879301-medium.jpg,5f9633f7abe361003d879301
"The Buzz Honeypot Wasp Trap with Bait (Lightweight, Strong ABS Plastic, Effective Wasp Attractant)","The Buzz Honeypot Wasp Trap with Bait (Lightweight, Strong ABS Plastic, Effective Wasp Attractant)",54.0,EUR,70.0,EUR,64.99,0,,,5.0,0.0,,,,,,,,,,,,,3,Livraison standard,19.99,false,,3,true,Quantité limitée !,GB,Giftenza,giftenza,79 % avis positifs (336 notes),336,3.8660714285714284,5e778af629e7865cfc55bd63,,,https://www.wish.com/c/60356dcccd04de644271eb1a,https://canary.contestimg.wish.com/api/webimage/60356dcccd04de644271eb1a-medium.jpg,60356dcccd04de644271eb1a
Chaussures de randonnée pour hommes Chaussures d'escalade en plein air Chaussures d'eau à séchage rapide Chaussures de trekking en maille respirantes et décontractées légères (Taille: 39 ~ 47),Men's Hiking Shoes Outdoor Climbing Shoes Quick-drying Water Shoes Lightweight Casual Breathable Mesh Trekking Shoes(Size:39~47),8.0,EUR,247.0,EUR,9,10,,,4.349775784753363,223.0,129,58,27,3,6,,,,,,green,33,1,Livraison standard,3.0,false,,50,,,CN,jnbhgfmi,jnbhgfmi,90 % avis positifs (318 notes),318,4.172955974842767,5e5de87ecb7f72462c9d3e77,,,https://www.wish.com/c/5eb8f6e6137a7d37ef71a9ec,https://canary.contestimg.wish.com/api/webimage/5eb8f6e6137a7d37ef71a9ec-medium.jpg,5eb8f6e6137a7d37ef71a9ec
Rimmel London Stay Matte Lightweight Face Powder Mattifying 9Hr 14g Creamy Beige # 018,Rimmel London Stay Matte Lightweight Face Powder Mattifying 9Hr 14g Creamy Beige #018,3.0,EUR,5.0,EUR,3.31,1,,,4.0,4.0,3,0,0,0,1,,,,,,,,3,Livraison standard,12.3,false,,3,,,GB,Direct Cosmetics,directcosmetics,"96 % avis positifs (8,061 notes)",8061,4.64644585039077,595227f92c6a476e955dba8f,,,https://www.wish.com/c/5f16c9a5aed367535c95e8e1,https://canary.contestimg.wish.com/api/webimage/5f16c9a5aed367535c95e8e1-medium.jpg,5f16c9a5aed367535c95e8e1
Couple d'été Shorts Pantalon en lin pour hommes Pantalons Shorts en coton de couleur unie Shorts décontractés légers pour hommes,Summer Couple Shorts Men'S Linen Pants Pants Solid Color Cotton Shorts Men'S Lightweight Casual Shorts,5.0,EUR,38.0,EUR,6,10,,,3.981818181818182,110.0,52,33,8,5,12,,,,,,darkgreen,xs,26,Livraison standard,2.0,false,,50,,,CN,Boutique clothing boutique,boutiqueclothingboutique,"86 % avis positifs (3,242 notes)",3242,4.1795188155459595,5ac0879428a2b34da2e59780,,,https://www.wish.com/c/5e673a7950cbaf4a30434681,https://canary.contestimg.wish.com/api/webimage/5e673a7950cbaf4a30434681-medium.jpg,5e673a7950cbaf4a30434681
5 mètres / lot (5.4 yards) Léger Non-Woven Fusible Interlining Tissu Vêtements Couture Accessoire DIY,5 meters/lot (5.4 yards) Lightweight Non-Woven Fusible Interlining Fabric Apparel Sewing DIY Accessory,10.0,EUR,10.0,EUR,11,1000,,,4.30028328611898,353.0,238,47,30,12,26,,,,,,white,,50,Livraison standard,3.0,false,,50,,,CN,Beibei Store,beibeistore,"95 % avis positifs (3,311 notes)",3311,4.505587435819994,565db8b66f77df32d0c4e1f0,,,https://www.wish.com/c/5b418e3355bf851b21aab90d,https://canary.contestimg.wish.com/api/webimage/5b418e3355bf851b21aab90d-medium.jpg,5b418e3355bf851b21aab90d
"Chaussures de sport pour hommes, baskets respirantes, chaussures de sport légères, chaussures de course, plus la taille 37-48",Men's Fashion Casual Shoes Sneakers Breathable Lightweight Sport Shoes Running Fitness Shoes Plus Size 37-48,21.0,EUR,21.0,EUR,25,1000,,,3.896860986547085,669.0,321,152,78,42,76,,,,,,red,5.5,50,Livraison standard,7.0,false,,50,true,Quantité limitée !,CN,Yang868,yang868,"86 % avis positifs (7,680 notes)",7680,4.065364583333333,59faeb94471c142829f11267,,,https://www.wish.com/c/5de8a7fe4fde762f0150fa47,https://canary.contestimg.wish.com/api/webimage/5de8a7fe4fde762f0150fa47-medium.jpg,5de8a7fe4fde762f0150fa47
Couverture de plage de poche étanche au sable et à l'eau en plein air,Outdoor Sand-proof and Waterproof Pocket Beach Blanket Portable Compact Multifunctional Lightweight Outdoor Travel Blanket  Nylon Mat for Beach Picnic Camping Hiking Activities,6.0,EUR,21.0,EUR,7,1000,,,4.218944099378882,644.0,390,117,70,22,45,,,,,,blue,100x100cm(39.3x39.3inch),6,Livraison standard,2.0,false,,50,,,CN,SHHUIZFIA9586,xiaoya888,"94 % avis positifs (4,646 notes)",4646,4.397331037451571,5b80fee2008a3e2f6ec81563,,,https://www.wish.com/c/5e7dcf204fb94d0505f3af99,https://canary.contestimg.wish.com/api/webimage/5e7dcf204fb94d0505f3af99-medium.jpg,5e7dcf204fb94d0505f3af99
10/20/50 pièces masque anti-poussière KF94 masque buccal 4 couches de protection bouche-moufle pour enfants enfants KF94 type de poisson masque pour enfants masque de sécurité visage masque léger confortable,10/20/50PCS Anti Dust Face Mask KF94 Mouth Mask 4-Layers Protective Mouth-muffle for Children Kids KF94 Fish Type Children's Mask Face Safety Mask Comfortable Lightweight Mask,3.87,EUR,4.0,EUR,4.6899999999999995,10,,,3.75,4.0,2,1,0,0,1,,,,,,black,10pcs,50,Livraison standard,1.0,false,,50,,,US,Michele Hunt,michelehunt,"87 % avis positifs (1,211 notes)",1211,4.1304706853839805,5e932ae62522bca434c76755,,,https://www.wish.com/c/601267f103712332495035c3,https://canary.contestimg.wish.com/api/webimage/601267f103712332495035c3-medium.jpg,601267f103712332495035c3
"19 Mizuno JPX 919 Hot Metal Lightweight Steel 7 Iron (JAPAN)-Male/Parallel, Lightweight Steel R_7i(5~P.Sw)","19 Mizuno JPX 919 Hot Metal Lightweight Steel 7 Iron (JAPAN)-Male/Parallel, Lightweight Steel R_7i(5~P.Sw)",1286.0,EUR,1286.0,EUR,1558.0,0,,,5.0,0.0,,,,,,,,,,,,,50,Livraison standard,12.0,false,,50,,,KR,KoreanOasis,koreanoasis,100 % avis positifs (4 notes),4,5.0,601a4fde2dfa3d21b8cc2d66,,,https://www.wish.com/c/601cc7722494560fc3003236,https://canary.contestimg.wish.com/api/webimage/601cc7722494560fc3003236-medium.jpg,601cc7722494560fc3003236
Naturehike matelas d'air léger résistant à l'humidité en Nylon TPU coussin de couchage matelas gonflable tapis de camping pour 2 personnes NH19Z055-P,Naturehike Lightweight Moisture-proof Air Mattress Nylon TPU Sleeping Pad Inflatable Mattress Camping Mat For 2-Person NH19Z055-P,42.0,EUR,77.0,EUR,50.11,10,,,3.7,10.0,4,3,1,0,2,,,,,,blue,standardmat,50,Livraison standard,35.39,false,,50,true,Quantité limitée !,CN,Naturehike Brand Store est un vendeur agréé,naturehikebrandstore,95 % avis positifs (587 notes),587,4.534923339011925,5f1a79d52f42aeec3755e7e9,,,https://www.wish.com/c/5fb73726d59d5b2afc7ef977,https://canary.contestimg.wish.com/api/webimage/5fb73726d59d5b2afc7ef977-medium.jpg,5fb73726d59d5b2afc7ef977
Women's Mesh Sneakers Lightweight Breathable Athletic Running Shoes Lace Up Womens Walking Tennis Shoes Casual Shoes for Women,Women's Mesh Sneakers Lightweight Breathable Athletic Running Shoes Lace Up Womens Walking Tennis Shoes Casual Shoes for Women,4.69,EUR,5.0,EUR,5.68,10,,,4.611111111111111,18.0,14,1,3,0,0,,,,,,pink,34,2,Livraison standard,1.0,false,,50,,,CN,well for,wellfor,"85% Positive Feedback (5,754 ratings)",5754,4.016684045881126,53dfb86fd911395f66d72fe8,,,https://www.wish.com/c/5e8d33860bfda50f40c47a68,https://canary.contestimg.wish.com/api/webimage/5e8d33860bfda50f40c47a68-medium.jpg,5e8d33860bfda50f40c47a68
Femmes tendance mode léger Sport chaussures de course respirant maille Tenis Feminino décontracté noir blanc baskets pour femmes,Womens Trending Fashion Lightweight Sport Running Shoes Breathable Mesh Tenis Feminino Casual Black White Sneakers for Women ,6.0,EUR,15.0,EUR,7,10,,,4.3125,16.0,10,2,3,1,0,,,,,,white,34,5,Livraison standard,2.0,false,,50,true,Quantité limitée !,CN,WGJ,wgj,92 % avis positifs (595 notes),595,4.294117647058823,5b17c8e3daac456ecd9a4914,,,https://www.wish.com/c/5f771d6eca11a51de0533498,https://canary.contestimg.wish.com/api/webimage/5f771d6eca11a51de0533498-medium.jpg,5f771d6eca11a51de0533498
Moulinet Goture pour la pêche à la mouche 3/4 5/6 7/8 9/10 2 + 1BB Max Drag 8kg Moulinet léger gauche / droit à grande tige usiné CNC + bobine de rechange,Goture Fly Fishing Reel 3/4 5/6 7/8 9/10 2+1BB Max Drag 8kg Lightweight CNC-machined Large Arbor Left/Right Fly Reel+Spare Spool,25.0,EUR,25.0,EUR,30,10,,,3.7796610169491527,59.0,32,9,3,3,12,,,,,,silver,3/4flyreel,8,Livraison standard,8.0,false,,50,true,Quantité limitée !,CN,Goture Fishing Store,goturefishingstore,"95 % avis positifs (1,577 notes)",1577,4.530754597336715,59c0d073439a9858ffdc66f1,,,https://www.wish.com/c/5b0ccc75096b8219cf0d9f59,https://canary.contestimg.wish.com/api/webimage/5b0ccc75096b8219cf0d9f59-medium.jpg,5b0ccc75096b8219cf0d9f59
Regatta Pull en polaire de marche en plein air Highton Strech léger 1/2 Zip pour homme,Regatta Mens Highton Strech Lightweight 1/2 Zip Outdoor Walking Fleece Pullover,27.0,EUR,47.0,EUR,32.5,0,,,5.0,0.0,,,,,,,,,,,navy,3xl,1,Livraison standard,5.95,false,,1,,,GB,Avenue 85,avenue85,92 % avis positifs (548 notes),548,4.452554744525547,5e4bc14054040a425ca9d14d,,,https://www.wish.com/c/5f8fd83b75ceaa0048cb820b,https://canary.contestimg.wish.com/api/webimage/5f8fd83b75ceaa0048cb820b-medium.jpg,5f8fd83b75ceaa0048cb820b
Blouson aviateur d'extérieur à capuche imperméable léger Regatta pour hommes Ladomir - Navy,Regatta Mens Ladomir Lightweight Waterproof Hooded Outdoor Bomber Jacket - Navy,33.0,EUR,70.0,EUR,39.5,0,,,5.0,0.0,,,,,,,,,,,navy,l,4,Livraison standard,5.95,false,,23,,,GB,Avenue 85,avenue85,92 % avis positifs (548 notes),548,4.452554744525547,5e4bc14054040a425ca9d14d,,,https://www.wish.com/c/5f8fd7f877b9ae004538d04c,https://canary.contestimg.wish.com/api/webimage/5f8fd7f877b9ae004538d04c-medium.jpg,5f8fd7f877b9ae004538d04c
Gigabyte,,,,,,,,,,,,,,,,,,,,,,,,,,,,,,,,,,,,,,,,,https://www.wish.com/c/5f4a356d90b8a61c953a6cfc,,5f4a356d90b8a61c953a6cfc
Nouvelles chaussures de sécurité à bout en acier léger pour hommes de mode ultra-léger fond souple respirant coussin d'air chaussures de sécurité taille 36-48,New Fashion Men's Lightweight Steel Toe Safety Shoes Ultralight Soft Bottom Breathable Air Cushion Safety Shoes Size 36-48,14.0,EUR,247.0,EUR,16,10,,,4.5,2.0,1,1,0,0,0,,,,,,blue,cn36,1,Livraison standard,5.0,false,,50,,,CN,zuiaishijia,zuiaishijia,"91 % avis positifs (1,080 notes)",1080,4.270370370370371,598bc4b38696be125b6d69db,,,https://www.wish.com/c/601a5213283c2a28d4f26041,https://canary.contestimg.wish.com/api/webimage/601a5213283c2a28d4f26041-medium.jpg,601a5213283c2a28d4f26041
Écharpe Shemagh KeffIyeh de l'armée du désert tactique arabe militaire légère de mode,Fashion Lightweight Military Arab Tactical Desert Army Shemagh KeffIyeh Scarf,5.0,EUR,5.0,EUR,6,10,,,5.0,0.0,,,,,,,,,,,red,,50,Livraison Express,7.0,true,,50,,,CN,weiweishenhou,weiweishenhou,"91 % avis positifs (9,082 notes)",9082,4.279784188504735,5ad0166840626a6afa8ead6b,,,https://www.wish.com/c/5de4cce1c64691c87d98dce5,https://canary.contestimg.wish.com/api/webimage/5de4cce1c64691c87d98dce5-medium.jpg,5de4cce1c64691c87d98dce5
Naturehike Enveloppe Sac de couchage pour adultes 3 saisons Sacs de couchage rectangulaires imperméables et portables légers pour Camping en plein air Randonnée Sac à dos,Naturehike Envelope Sleeping Bag for Adults  3 Season  Lightweight Portable Waterproof Rectangular Sleeping Bags for Outdoor Camping Hiking Backpacking,20.0,EUR,58.0,EUR,23.99,10,,,5.0,2.0,2,0,0,0,0,,,,,,navyblue,standard,50,Livraison standard,19.31,false,,50,,,CN,Naturehike Brand Store est un vendeur agréé,naturehikebrandstore,95 % avis positifs (587 notes),587,4.534923339011925,5f1a79d52f42aeec3755e7e9,,,https://www.wish.com/c/600692b6f2af0d88847c67bd,https://canary.contestimg.wish.com/api/webimage/600692b6f2af0d88847c67bd-medium.jpg,600692b6f2af0d88847c67bd
CubicSeven,,,,,,,,,,,,,,,,,,,,,,,,,,,,,,,,,,,,,,,,,https://www.wish.com/c/5f994fc2f82dcc00109ede86,,5f994fc2f82dcc00109ede86
 Imperméable à l'eau des produits pour animaux de compagnie grand couvercle de cage à oiseaux respirant (seul couvercle) 130 * 60 cm, Waterproof  Lightweight Pet Products Large Breathable Bird Cage Cover (Only Cover) 130*60 cm,16.0,EUR,16.0,EUR,19,10,,,5.0,0.0,,,,,,,,,,,blue,,50,Livraison Express,7.0,true,,50,,,CN,fashionforgirls,guangzhouchanny,"88 % avis positifs (156,397 notes)",156397,4.129938553808577,53aa664438d3046ee44a5024,,,https://www.wish.com/c/605dac1167cb8c84c93b3999,https://canary.contestimg.wish.com/api/webimage/605dac1167cb8c84c93b3999-medium.jpg,605dac1167cb8c84c93b3999
Léger pour iPhone OTG USB 2.0 connecteur de câble femelle câble adaptateur adaptateur USB 8 broches,Lightweight For iPhone OTG USB 2.0 Female Cable Connector 8 Pin USB Adapter Adapter Cable,7.0,EUR,7.0,EUR,8,10,,,3.5555555555555554,27.0,13,3,3,2,6,,,,,,white,,50,Livraison standard,3.0,false,,50,true,Quantité limitée !,CN,qingchun,qingchun,84 % avis positifs (61 notes),61,3.9344262295081966,57a304618b06c8188e885ced,,,https://www.wish.com/c/5d9d4fc3b0641c375ba55f2b,https://canary.contestimg.wish.com/api/webimage/5d9d4fc3b0641c375ba55f2b-medium.jpg,5d9d4fc3b0641c375ba55f2b
1 PCS léger surligneur transparent illuminateur radiant maquillage lueur shimmer visage bronzant Contour cosmétique,1 PCS Lighweight Sheer Highlighter Radiant Illuminator Glow Makeup Shimmer Facial Bronzer Contour Cosmetic,3.08,EUR,7.0,EUR,3.73,1000,,,3.7777777777777777,72.0,39,6,11,4,12,,,,,,,1,50,Livraison standard,1.0,false,,50,true,Quantité limitée !,CN,Weichancky,weichancky,82 % avis positifs (129 notes),129,4.108527131782946,5f6ecaf2c4fbcd7b80fed8e4,,,https://www.wish.com/c/5fafae86b563c970e9bc5b95,https://canary.contestimg.wish.com/api/webimage/5fafae86b563c970e9bc5b95-medium.jpg,5fafae86b563c970e9bc5b95
"Tapis de camping de randonnée portable ultra-léger pour une personne, kaki","Portable ultra-lightweight single-person backpacking camping mat, khaki",158.0,EUR,158.0,EUR,191.0,0,,,5.0,0.0,,,,,,,,,,,khaki,,50,Livraison standard,12.0,false,,50,,,KR,TheDayHARU,thedayharu,,0,5.0,5ff04d7c50b15e4066156731,,,https://www.wish.com/c/60017e5fe627f61f0af09ce3,https://canary.contestimg.wish.com/api/webimage/60017e5fe627f61f0af09ce3-medium.jpg,60017e5fe627f61f0af09ce3
D555 Mens John Big Tall King Size Lightweight Cotton Cargo Shorts,D555 Mens John Big Tall King Size Lightweight Cotton Cargo Shorts,25.0,EUR,41.0,EUR,29.5,0,,,5.0,0.0,,,,,,,,,,,black,1xluk/xlus,3,Livraison standard,5.95,false,,50,true,Quantité limitée !,GB,Avenue 85,avenue85,92 % avis positifs (548 notes),548,4.452554744525547,5e4bc14054040a425ca9d14d,,,https://www.wish.com/c/5e55c31f4879be11ab1a1a3c,https://canary.contestimg.wish.com/api/webimage/5e55c31f4879be11ab1a1a3c-medium.jpg,5e55c31f4879be11ab1a1a3c
7 couleurs Camouflage Pare-soleil Net Armée Filets De Maille Léger Durable Pare-soleil Patio Jardin Décoration Pour La Chasse Tir à l'aveugle Camping Photographie Jungle 10 Taille Sélectionnez,7Colors Camouflage Sunshade Net Army Mesh Nets Lightweight Durable Sunshade Patio Garden Decoration For Hunting Blind Shooting Camping Photography Jungle 10 Size Select,8.0,EUR,10.0,EUR,9,10,,,5.0,0.0,,,,,,,,,,,jungle,1.5x2m,50,Livraison standard,3.0,false,,50,,,CN,Helloalien,helloalien,"87 % avis positifs (2,677 notes)",2677,4.117669032499066,598a832769eced643fb2f92b,,,https://www.wish.com/c/60488992240fa218acd9a562,https://canary.contestimg.wish.com/api/webimage/60488992240fa218acd9a562-medium.jpg,60488992240fa218acd9a562
Electronic Scale Lightweight Car Key Shape Metal Accurate Digital Pocket Scale,Electronic Scale Lightweight Car Key Shape Metal Accurate Digital Pocket Scale,8.0,EUR,8.0,EUR,9,10,,,1.0,1.0,0,0,0,0,1,,,,,,,100g/0.01g,50,Livraison Express,6.0,true,,50,,,CN,Charlton,charlton,"(5,560 notes)",5560,4.28273381294964,56dd2d691cff03167cfd9a2a,,,https://www.wish.com/c/6038597146f88e0054aa71f9,https://canary.contestimg.wish.com/api/webimage/6038597146f88e0054aa71f9-medium.jpg,6038597146f88e0054aa71f9
