title,title_orig,discount_price,discount_price_currency,retail_price,retail_price_currency,discount_price_in_original_currency,nb_cart_orders_approx,nb_units_purchased_approx,uses_ad_boosts,rating,rating_count,rating_five_count,rating_four_count,rating_three_count,rating_two_count,rating_one_count,badges_count,badge_local_product,badge_product_quality,badge_fast_shipping,tags,product_color,product_variation_size_id,product_variation_inventory,shipping_option_name,shipping_option_price,shipping_is_express,countries_shipped_to,inventory_total,has_urgency_banner,urgency_text,origin_country,merchant_title,merchant_name,merchant_info_subtitle,merchant_rating_count,merchant_rating,merchant_id,merchant_has_profile_picture,merchant_profile_picture,product_url,product_picture,product_id
Chaussures de sport haut de gamme pour hommes Chaussures de sport légères pour hommes,Premium Sport Athletic Sneakers Shoes Men Lightweight Casual Shoes,19.0,EUR,140.0,EUR,23,5000,,,3.9822616407982263,1353.0,711,256,172,79,135,,,,,,black,39,50,Livraison standard,6.0,false,,50,true,Quantité limitée !,CN,China Chengdu pure handmade  shoes,chinachengdupurehandmadeshoes,"85 % avis positifs (2,268 notes)",2268,4.060846560846561,5964e8aec2508147eaccca0f,,,https://www.wish.com/c/599639cf16af9124e216c335,https://canary.contestimg.wish.com/api/webimage/599639cf16af9124e216c335-medium.jpg,599639cf16af9124e216c335
Sac à bandoulière simple léger pour femme Sac de voyage décontracté (6 couleurs),Women's Lightweight Simple Shoulder Bag Casual Travel Messenger Bag (6 Colors),10.0,EUR,10.0,EUR,11,10,,,3.9375,16.0,9,1,3,2,1,,,,,,,random,50,Livraison standard,3.0,false,,50,,,CN,Lovely Night Dance,lovelynightdance,87 % avis positifs (477 notes),477,4.1257861635220126,58aab63d8e851f50f5024b35,,,https://www.wish.com/c/5ed9fba8a4ff2942ad5b37ec,https://canary.contestimg.wish.com/api/webimage/5ed9fba8a4ff2942ad5b37ec-medium.jpg,5ed9fba8a4ff2942ad5b37ec
Chaussures de travail légères et respirantes pour hommes Capuchon en acier Chaussures de sécurité décontractées Chaussures de protection Chaussures de sécurité Bottes de travail,Men's Women's Breathable Lightweight Work Shoes Steel Toe Cap Casual Safety Shoes Hiking Protective Footwear Safety boots Working Boots,11.0,EUR,11.0,EUR,13,10,,,4.472527472527473,182.0,129,31,10,3,9,,,,,,red,36,50,Livraison standard,3.0,false,,50,true,Quantité limitée !,CN,lylshop,lylshop,"94 % avis positifs (2,787 notes)",2787,4.427700035880876,5811f0ce5250a24ded8180b9,,,https://www.wish.com/c/5d46d2b59d48615441306692,https://canary.contestimg.wish.com/api/webimage/5d46d2b59d48615441306692-medium.jpg,5d46d2b59d48615441306692
JBL,,,,,,,,,,,,,,,,,,,,,,,,,,,,,,,,,,,,,,,,,https://www.wish.com/c/5e8d300f9719ed640496781f,,5e8d300f9719ed640496781f
Hiseeu,,,,,,,,,,,,,,,,,,,,,,,,,,,,,,,,,,,,,,,,,https://www.wish.com/c/5f8c206ceb31f9c6391a6279,,5f8c206ceb31f9c6391a6279
Finery Unisex Lightweight Plaid Tassel Arab Desert Shemagh KeffIyeh Scarf Wrap Pashmina,Finery Unisex Lightweight Plaid Tassel Arab Desert Shemagh KeffIyeh Scarf Wrap Pashmina,4.8,EUR,5.0,EUR,5.82,10000,,,3.9163729573854535,3121.0,1572,562,458,212,317,,,,,,white,,50,Livraison standard,1.0,false,,50,,,CN,fanstybuliding,fanstybuliding,"90% Positive Feedback (6,018 ratings)",6018,4.240611498836823,58f5afeae2a53b4882709ee8,,,https://www.wish.com/c/5b0379a591d2cf21cada6d4e,https://canary.contestimg.wish.com/api/webimage/5b0379a591d2cf21cada6d4e-medium.jpg,5b0379a591d2cf21cada6d4e
"Чехол-клавиатура для Samsung Galaxy Tab A7 10,4 '' 2020 SM-T500 / T505, тонкая легкая крышка-подставка с магнитно-съемной беспроводной клавиатурой для Galaxy Tab A 10.1 2019 T510 / A 8.0 2019 T290 / Tab S6 Lite P610 / S7 11 '' T870","Keyboard Case for Samsung Galaxy Tab A7 10.4'' 2020 SM-T500/T505, Slim Lightweight Stand Cover with Magnetically Detachable Wireless Keyboard for Galaxy Tab A 10.1 2019 T510/A 8.0 2019 T290/Tab S6 Lite P610/S7 11'' T870",16.0,EUR,16.0,EUR,19,10,,,3.875,16.0,8,4,1,0,3,,,,,,black,samsungtaba8.02019t290(nokeyboard),28,Livraison standard,6.0,false,,50,,,CN,NiceDay2018,niceday2018,"90% положительных отзывов (5,604 рейтинг)",5604,4.291399000713776,5adee0bc18d92169fd5184d3,,,https://www.wish.com/c/5fa3a7caaad093e7681fd561,https://canary.contestimg.wish.com/api/webimage/5fa3a7caaad093e7681fd561-medium.jpg,5fa3a7caaad093e7681fd561
New Fashion Walking Shoes for Women Lightweight Athletic Slip-On Lace-Up Closure Lightly Padded Insole Sneakers,New Fashion Walking Shoes for Women Lightweight Athletic Slip-On Lace-Up Closure Lightly Padded Insole Sneakers,10.0,EUR,10.0,EUR,12,10,,,2.0,1.0,0,0,0,1,0,,,,,,red,16,2,Livraison standard,3.0,false,,50,,,CN,Guo01shop,guo01shop,90 % avis positifs (440 notes),440,4.259090909090909,5d3c640dab0c794324a592f0,,,https://www.wish.com/c/603f3b4bdbf559e435714d55,https://canary.contestimg.wish.com/api/webimage/603f3b4bdbf559e435714d55-medium.jpg,603f3b4bdbf559e435714d55
"Air Queen Breathable and lightweight nano mask Large-Summer mask recommended, 30","Air Queen Breathable and lightweight nano mask Large-Summer mask recommended, 30",49.0,EUR,49.0,EUR,59.0,0,,,5.0,0.0,,,,,,,,,,,,,50,Livraison standard,0.0,false,,50,,,KR,Stay_Gorgeous Korea,stay_gorgeouskorea,100 % avis positifs (5 notes),5,4.8,5fd76ab639ab348c49576bf2,,,https://www.wish.com/c/60291cbc5f8142e21dc90f3c,https://canary.contestimg.wish.com/api/webimage/60291cbc5f8142e21dc90f3c-medium.jpg,60291cbc5f8142e21dc90f3c
Couverture en molleton de taille reine toutes saisons 240GSM jet léger pour le lit Extra doux brosse tissu hiver chaud canapé couverture,Fleece Queen Size Blanket All Season 240GSM Lightweight Throw for The Bed Extra Soft Brush Fabric Winter Warm Sofa Blanket ,10.0,EUR,10.0,EUR,11,10,,,3.891891891891892,37.0,21,3,6,2,5,,,,,,darkpurple,100by140cm,50,Livraison standard,2.0,false,,50,,,CN,Qiuling studio,qiulingstudio,91 % avis positifs (383 notes),383,4.276762402088773,5d3fdc9972b0c925e4750c43,,,https://www.wish.com/c/5f43acccbf35d4004a0cd20e,https://canary.contestimg.wish.com/api/webimage/5f43acccbf35d4004a0cd20e-medium.jpg,5f43acccbf35d4004a0cd20e
Femmes Casual Mince Automne Manteau Floral Feuille Imprimé Veste Légère Zip Up Court Bomber Vestes,Women Casual Thin Autumn Coat Floral Leaf Printed Jacket Lightweight Zip Up Short Bomber Jackets,3.0,EUR,3.0,EUR,3,10,,,3.4545454545454546,22.0,8,4,3,4,3,,,,,,red,2xs,2,Livraison standard,1.0,false,,50,true,Quantité limitée !,CN,wodeyueyaquan,wodeyueyaquan,"80 % avis positifs (4,870 notes)",4870,3.776386036960986,595635c988709f21035d7b35,,,https://www.wish.com/c/5f0e7b5e2dd7f8050988302a,https://canary.contestimg.wish.com/api/webimage/5f0e7b5e2dd7f8050988302a-medium.jpg,5f0e7b5e2dd7f8050988302a
"Deti Cordless Mini Iron Portable Lightweight, Basic","Deti Cordless Mini Iron Portable Lightweight, Basic",417.0,EUR,417.0,EUR,505.0,0,,,5.0,0.0,,,,,,,,,,,,,50,Livraison standard,12.0,false,,50,,,KR,allkoreastore,allkoreastore,,0,5.0,5ff3fb84e8cfdf1c6737bbf3,,,https://www.wish.com/c/600ed645512a2e79afc2552a,https://canary.contestimg.wish.com/api/webimage/600ed645512a2e79afc2552a-medium.jpg,600ed645512a2e79afc2552a
2019 Nouvelles chaussures de sécurité Kraft de tête en acier standard européen Chaussures de travail isolantes légères respirantes anti-écrasement anti-perçage,2019 New European Standard Steel Head Kraft Safety Shoes Lightweight Breathable Anti-smashing Anti-piercing Insulation Work Shoes,10.0,EUR,330.0,EUR,12,1000,,,4.334448160535117,299.0,186,64,27,7,15,,,,,,black,us3(eu35),1,Livraison standard,3.0,false,,50,,,CN,ice apple,iceapple,"88 % avis positifs (1,457 notes)",1457,4.152367879203844,5d5219bd27752b7c7d93cba6,,,https://www.wish.com/c/5d79dee3b033510c3c9237e9,https://canary.contestimg.wish.com/api/webimage/5d79dee3b033510c3c9237e9-medium.jpg,5d79dee3b033510c3c9237e9
Tianxun,,,,,,,,,,,,,,,,,,,,,,,,,,,,,,,,,,,,,,,,,https://www.wish.com/c/5f7ef164eb31f9bb1aeaab0a,,5f7ef164eb31f9bb1aeaab0a
Couverture de lit en molleton de flanelle espace trou couverture de jet de galaxie couverture légère confortable en peluche pour chambre salons canapé canapé,Flannel Fleece Bed Blanket Space Hole Galaxy Throw Blanket Lightweight Cozy Plush Blanket for Bedroom Living Rooms Sofa Couch,15.0,EUR,112.0,EUR,18,10,,,4.3125,16.0,11,1,3,0,1,,,,,,,80x120cm,50,Livraison standard,5.0,false,,50,,,CN,leeyyshop,leeyyshop,"84 % avis positifs (1,724 notes)",1724,4.028422273781903,5d527ded15275425026095c4,,,https://www.wish.com/c/5e82a7273266ad0f2eecb04d,https://canary.contestimg.wish.com/api/webimage/5e82a7273266ad0f2eecb04d-medium.jpg,5e82a7273266ad0f2eecb04d
NOUVEAU Hommes Runner Athletic Jogging Sneakers Léger Sport Running Chaussures De Marche pour Femmes Mesh Respirant Confort Mode Unisexe Florescent Tennis Chaussures Plus La Taille,NEW Men Runner Athletic Jogging Sneakers Lightweight Sport Running Walking Shoes for Women Mesh Breathable Comfort Fashion Unisex Florescent Tennis Shoes Plus Size,7.0,EUR,7.0,EUR,8,10,,,4.168674698795181,83.0,46,21,7,2,7,,,,,,grey,4.5,1,Livraison standard,2.0,false,,50,,,CN,Chu8,chu8,"(2,170 notes)",2170,4.115668202764977,5acf4ba1cd968d3c39fe79db,,,https://www.wish.com/c/5ed5cc2bb6f2812dd887c4f2,https://canary.contestimg.wish.com/api/webimage/5ed5cc2bb6f2812dd887c4f2-medium.jpg,5ed5cc2bb6f2812dd887c4f2
Mode unisexe plage chaussures de Sport aquatique chaussures légères à séchage rapide Aqua pour la plongée natation exercice chaussures d'eau chaussures de plein air pour hommes,Fashion Unisex Beach Water Sport Shoes Lightweight Quick-Dry Aqua Shoes for Diving Swimming Exercise Water Shoes Men's Outdoor Shoes,3.88,EUR,4.0,EUR,4.7,10,,,4.369230769230769,65.0,40,16,5,1,3,,,,,,rosepink,eu28r,1,Livraison standard,1.0,false,,50,,,CN,chenxiaodi.520,chenxiaodi520,89 % avis positifs (235 notes),235,4.182978723404255,5d00b7ec3c669637272e3e48,,,https://www.wish.com/c/5e634cfa88c42d39bd148d68,https://canary.contestimg.wish.com/api/webimage/5e634cfa88c42d39bd148d68-medium.jpg,5e634cfa88c42d39bd148d68
Andoer,,,,,,,,,,,,,,,,,,,,,,,,,,,,,,,,,,,,,,,,,https://www.wish.com/c/5f65e4e290b8a63c12c7b9bb,,5f65e4e290b8a63c12c7b9bb
Étui Kobo Clara HD - Étui ultra mince léger et élégant Smart Shell Stand Cover pour tablette Kobo Clara HD Ereader 6 pouces,Kobo Clara HD Case- Ultra Slim Lightweight Folio Smart Shell Stand Cover Case for Kobo Clara HD Ereader 6 inch Tablet,14.0,EUR,14.0,EUR,16,10,,,5.0,2.0,2,0,0,0,0,,,,,,purple,koboclarahd,27,Livraison standard,4.0,false,,50,,,CN,HAPPYSHZ2018888,nihao2018,"91 % avis positifs (1,616 notes)",1616,4.310024752475248,5af3a3ebfffdcb1568718495,,,https://www.wish.com/c/5b4486a77fea001b3592be49,https://canary.contestimg.wish.com/api/webimage/5b4486a77fea001b3592be49-medium.jpg,5b4486a77fea001b3592be49
Stylo de retrait d'acné de conception pratique et légère d'acné de peau de visage de lumière bleue électronique réparant la machine de beauté et de sécurité,Electronic Blue Light Face Skin Acne Convenient And Lightweight Design Acne Removal Pen Repairing Beauty And Security Machine,5.0,EUR,5.0,EUR,6,10,,,4.05,20.0,12,1,5,0,2,,,,,,,standardversion,7,Livraison Express,6.0,true,,50,,,CN,Ita Shop,itashop,"(4,790 notes)",4790,4.241753653444676,5672d38e93148826991d21da,,,https://www.wish.com/c/5fbdb301701fd6004720dc8f,https://canary.contestimg.wish.com/api/webimage/5fbdb301701fd6004720dc8f-medium.jpg,5fbdb301701fd6004720dc8f
2020 plus récent soucoupe volante hamac en Nylon portable léger pour Camping maison chaise suspendue jardin décoration extérieure intérieure,2020 Newest Flying Saucer Lightweight Portable Nylon Hammock for Camping Home hanging chair garden indoor outdoor decoration,75.0,EUR,75.0,EUR,90.0,10,,,5.0,0.0,,,,,,,,,,,green,flyingsaucerswingchair,50,Livraison standard,12.0,false,,50,,,CN,JKHDFIKJSD,jkhdfikjsd,"76 % avis positifs (3,091 notes)",3091,3.738272403752831,5da2cbcdc095e11e44d17625,,,https://www.wish.com/c/5f9398b84f626d07daa215fa,https://canary.contestimg.wish.com/api/webimage/5f9398b84f626d07daa215fa-medium.jpg,5f9398b84f626d07daa215fa
BTS Fan Art Super doux léger chaud couverture en flanelle canapé canapé couverture en peluche adapté au voyage Camping maison BTS002,BTS Fan Art Super Soft Lightweight Warm Flannel Blanket Sofa Sofa Plush Blanket Suitable for Travel Camping Home BTS002,12.0,EUR,12.0,EUR,14,10,,,4.0,9.0,5,2,0,1,1,,,,,,white,80x100cm,50,Livraison standard,4.0,false,,50,,,CN,jinqi1996PANG,jinqi1996pang,59 % avis positifs (155 notes),155,3.1161290322580646,5f604e558aa8627c8b52d19c,,,https://www.wish.com/c/5fae1ff7292a14da3ee22cfd,https://canary.contestimg.wish.com/api/webimage/5fae1ff7292a14da3ee22cfd-medium.jpg,5fae1ff7292a14da3ee22cfd
10 colors Spring Summer Loose Top Three-quarter Sleeve Cardigan kimono Couple Student Jacket Dragon Koi Printing Lightweight Top Plus Size XS-5XL,10 colors Spring Summer Loose Top Three-quarter Sleeve Cardigan kimono Couple Student Jacket Dragon Koi Printing Lightweight Top Plus Size XS-5XL,3.07,EUR,4.0,EUR,3.7199999999999998,10,,,2.6666666666666665,3.0,0,1,1,0,1,,,,,,coolblack,xxs,1,Livraison standard,1.0,false,,50,,,CN,haha888_ha,haha888_ha,"89 % avis positifs (1,870 notes)",1870,4.242245989304813,57d0365f7e10335a5afffa6d,,,https://www.wish.com/c/60408973fc4581e06bf71247,https://canary.contestimg.wish.com/api/webimage/60408973fc4581e06bf71247-medium.jpg,60408973fc4581e06bf71247
GREENSINDOOR,,,,,,,,,,,,,,,,,,,,,,,,,,,,,,,,,,,,,,,,,https://www.wish.com/c/5f8d71e9eb31f9a6cce12c7f,,5f8d71e9eb31f9a6cce12c7f
Portable Phone Tripod for Phone Gopro Compact Video Camera Lightweight Travel Mobile Phone Stand Holder Desktop Mini TripodeMobile Phone Photograph Portable Video Professional Tripod Selfie,Portable Phone Tripod for Phone Gopro Compact Video Camera Lightweight Travel Mobile Phone Stand Holder Desktop Mini TripodeMobile Phone Photograph Portable Video Professional Tripod Selfie,10.0,EUR,10.0,EUR,11,10,,,5.0,0.0,,,,,,,,,,,,black-noremotecontrol,4,Livraison standard,3.0,false,,38,,,CN,xiaoxiaojun22,leexiaojun,74 % avis positifs (116 notes),116,3.6379310344827585,5e09a22e6a434395823c7012,,,https://www.wish.com/c/60472859e175449219c020e8,https://canary.contestimg.wish.com/api/webimage/60472859e175449219c020e8-medium.jpg,60472859e175449219c020e8
Nouveau dernier casque Sennheiser HD 201 HIFI léger sur l'oreille,NEW Latest Sennheiser HD 201 HIFI Lightweight Over Ear  Headphones,22.0,EUR,149.0,EUR,26,10,,,4.171052631578948,76.0,45,17,4,2,8,,,,,,black,,50,Livraison standard,7.0,false,,50,,,CN,liuzizheng66058,liuzizheng66058,79 % avis positifs (136 notes),136,3.985294117647059,5de1dd9ba0f20264f60060c6,,,https://www.wish.com/c/5df939048119e703e0f31d97,https://canary.contestimg.wish.com/api/webimage/5df939048119e703e0f31d97-medium.jpg,5df939048119e703e0f31d97
O.TWO.O Matte Lip Gloss Maquillage Lèvres Imperméable Léger Longue Durée,O.TWO.O Matte Lip Gloss Lightweight Long Lasting Waterproof  Lips Makeup,2.0,EUR,2.0,EUR,2.1,10,,,4.769230769230769,13.0,11,1,1,0,0,,,,,,,01blushnude,50,Livraison standard,2.16,false,,50,,,CN,O.TWO.O Beauty Store est un vendeur agréé,otwoobeautystore,95 % avis positifs (441 notes),441,4.5646258503401365,5f8e7c4c432783b5cc3f0632,,,https://www.wish.com/c/5f9ff00e4fa79d9fd40e90f6,https://canary.contestimg.wish.com/api/webimage/5f9ff00e4fa79d9fd40e90f6-medium.jpg,5f9ff00e4fa79d9fd40e90f6
Femmes ' s Mode coussin d' air Chaussures de course léger Mesh respirant Tissu Chaussures Chaussures Casual,Women's Fashion Air Cushion Running Shoes Lightweight Breathable Mesh Fabric Shoes Casual Shoes,11.0,EUR,11.0,EUR,13,10,,,4.020833333333333,48.0,28,8,4,1,7,,,,,,red,35,5,Livraison standard,3.0,false,,50,,,CN,Idyllic impression,idyllicimpression,"86 % avis positifs (2,393 notes)",2393,4.070622649394066,5b99d3231e9eea0b5b307648,,,https://www.wish.com/c/5cdd1558ee0d385d77ecd6be,https://canary.contestimg.wish.com/api/webimage/5cdd1558ee0d385d77ecd6be-medium.jpg,5cdd1558ee0d385d77ecd6be
"Good-looking, large top angle, easy to coordinate, lightweight glasses horn frame AM-0035","Good-looking, large top angle, easy to coordinate, lightweight glasses horn frame AM-0035",66.0,EUR,66.0,EUR,80.0,0,,,5.0,0.0,,,,,,,,,,,black,,43,Livraison standard,12.0,false,,43,,,KR,abckorea,abckorea,50 % avis positifs (2 notes),2,3.0,5ff1208a858e8522e2389e39,,,https://www.wish.com/c/602b31c32e3a9c33392fa7a7,https://canary.contestimg.wish.com/api/webimage/602b31c32e3a9c33392fa7a7-medium.jpg,602b31c32e3a9c33392fa7a7
Chaussures de course pour hommes Mode Sneakers respirantes Maille Semelle souple Casual Athlétique Chaussures de marche légères,Men's Running Shoes Fashion Breathable Sneakers Mesh Soft Sole Casual Athletic Lightweight Walking Shoes,14.0,EUR,14.0,EUR,16,1000,,,4.2326530612244895,245.0,153,39,28,7,18,,,,,,red,38,1,Livraison standard,5.0,false,,50,,,CN,Longjie Fashion 1989,longjiefashion1989,"92 % avis positifs (2,675 notes)",2675,4.310654205607476,5ad6a5c775599a13f037b344,,,https://www.wish.com/c/5ae0739ff3bcca6bd74d1ad7,https://canary.contestimg.wish.com/api/webimage/5ae0739ff3bcca6bd74d1ad7-medium.jpg,5ae0739ff3bcca6bd74d1ad7
Regatta Manteau de veste de marche en plein air matelassé en duvet léger pour homme Whitehill,Regatta Mens Whitehill Lightweight Down Fill Quilted Outdoor Walking Jacket Coat,62.0,EUR,116.0,EUR,74.5,0,,,5.0,0.0,,,,,,,,,,,black,s,1,Livraison standard,5.95,false,,11,,,GB,Avenue 85,avenue85,92 % avis positifs (548 notes),548,4.452554744525547,5e4bc14054040a425ca9d14d,,,https://www.wish.com/c/5fae4248a177ad286ecc3e20,https://canary.contestimg.wish.com/api/webimage/5fae4248a177ad286ecc3e20-medium.jpg,5fae4248a177ad286ecc3e20
1 Pcs Mini Poche Soleil Parapluie De Pluie Portable Léger Coupe-Vent 5 Parapluie Pliable De Protection Solaire,1 Pcs Mini Pocket Sun Rain Umbrella Portable Lightweight Windproof 5 Folding Sunscreen Umbrella,7.0,EUR,7.0,EUR,8,1000,,,4.0588235294117645,187.0,97,41,26,9,14,,,,,,black,1pcs,50,Livraison standard,3.0,false,,50,,,CN,Life at Best,lifeatbest,"(36,907 notes)",36907,4.29268160511556,58b2974896f1bb140c844cdb,,,https://www.wish.com/c/5f44df0d3c27750be9305695,https://canary.contestimg.wish.com/api/webimage/5f44df0d3c27750be9305695-medium.jpg,5f44df0d3c27750be9305695
2020 nouveaux hommes en acier à bout en acier anti-smash et anti-crevaison isolation électrique bottes de sécurité respirantes légères taille 36-48,2020 new men's steel toe anti-smash and anti-puncture electrical insulation lightweight breathable safety boots size 36-48,21.0,EUR,413.0,EUR,25,10,,,4.7272727272727275,11.0,9,1,1,0,0,,,,,,black,eu36/us5,50,Livraison standard,6.0,false,,50,,,CN,DrizztXiao,drizztxiao,90 % avis positifs (176 notes),176,4.3125,5d41adc2e4b65d6c0b0e368b,,,https://www.wish.com/c/5f6a0a2dfefb710d51f9fd3f,https://canary.contestimg.wish.com/api/webimage/5f6a0a2dfefb710d51f9fd3f-medium.jpg,5f6a0a2dfefb710d51f9fd3f
Femmes Baskets Ultra Léger Mesh Gym Running Marche Tennis Chaussures,Women Sneakers Ultra Lightweight Mesh Gym Running Walking Tennis Shoes,7.0,EUR,7.0,EUR,8,10,,,4.516129032258065,31.0,23,5,1,0,2,,,,,,black,34,5,Livraison standard,3.0,false,,50,,,CN,shijiaxiaojun,shijiaxiaojun,"91 % avis positifs (1,906 notes)",1906,4.261804826862539,5b31a117b5de3c1d521ce70f,,,https://www.wish.com/c/5d0746a387829069025406f4,https://canary.contestimg.wish.com/api/webimage/5d0746a387829069025406f4-medium.jpg,5d0746a387829069025406f4
Couverture drôle de chien de carlin coloré couverture légère de couette de sieste de couchage pour canapé-lit de voyage de camping,Colorful Pug Dogs Funny Blanket Lightweight Sleeping Napping Quilt Blanket for Couch Sofa Bed Travelling Camping,15.0,EUR,15.0,EUR,17,10,,,4.607142857142857,28.0,21,5,1,0,1,,,,,,,80cmby100cm,50,Livraison standard,5.0,false,,50,,,CN,yuanyltd,yuanyltd,87 % avis positifs (77 notes),77,4.12987012987013,5d5e6b591377315081866c13,,,https://www.wish.com/c/5f335a92601f35004bc7f542,https://canary.contestimg.wish.com/api/webimage/5f335a92601f35004bc7f542-medium.jpg,5f335a92601f35004bc7f542
Nouvelle mode femmes chaussures décontractées baskets de sport en plein air légères à enfiler des chaussures en maille,New Fashion Women Casual Shoes Lightweight Outdoor Sport Sneakers Slip on Mesh Shoes,10.0,EUR,33.0,EUR,12,10,,,5.0,0.0,,,,,,,,,,,black,eu36&us6,50,Livraison standard,3.0,false,,50,,,CN,Lxyoneshop,lxyoneshop,82 % avis positifs (375 notes),375,3.9226666666666667,5dd8b720a0371305f77f4944,,,https://www.wish.com/c/5f487dab2d04d4003b918e7e,https://canary.contestimg.wish.com/api/webimage/5f487dab2d04d4003b918e7e-medium.jpg,5f487dab2d04d4003b918e7e
Enfants baskets de course légères garçons filles chaussures de sport respirantes chaussures de marche antidérapantes formateurs pour enfants,Children Lightweight Running Sneakers Boys Girls Breathable Sports Shoes Anti-slip Walking Shoes Trainers for Kids,2.36,EUR,3.0,EUR,2.86,10,,,5.0,0.0,,,,,,,,,,,black,22.,2,Livraison standard,1,false,,50,,,CN,DEWYUT,dewyut,,0,5.0,5e8bf0d0311072a1826302c7,,,https://www.wish.com/c/6068098c34a898024b2c4db9,https://canary.contestimg.wish.com/api/webimage/6068098c34a898024b2c4db9-medium.jpg,6068098c34a898024b2c4db9
2019 Durable imperméable pliable pliable voyage léger sac à dos de randonnée sac à dos sacs à dos,2019 Durable Waterproof Folding Packable Lightweight Travel Hiking Backpack Daypacks Rucksack,7.0,EUR,7.0,EUR,8,10,,,4.238095238095238,21.0,14,3,1,1,2,,,,,,red,,50,Livraison standard,3.0,false,,50,,,CN,guangzhoulangyuanjingmaoyiyouxiangongsi,广州阆苑景贸易有限公司,"90 % avis positifs (2,118 notes)",2118,4.297922568460812,55b339b7dc7fbc4090988eb4,,,https://www.wish.com/c/5d3e89c762c37c34fe67bb4e,https://canary.contestimg.wish.com/api/webimage/5d3e89c762c37c34fe67bb4e-medium.jpg,5d3e89c762c37c34fe67bb4e
5L léger marathon course à vélo course d'hydratation gilet sac à dos d'hydratation avec sac à vessie 1.5L,5L Lightweight Marathon Running Cycle Race Hydration Vest Hydration Pack Backpack with 1.5L Water Bladder Bag,24.0,EUR,66.0,EUR,28,10,,,4.560975609756097,205.0,137,53,10,3,2,,,,,,blue,,50,Livraison standard,8.0,false,,50,true,Quantité limitée !,CN,HAIBITAO,haibitao,"94 % avis positifs (1,083 notes)",1083,4.466297322253001,5821e09596585e3bbb4ee5f7,,,https://www.wish.com/c/598ab1763eb22a47aa094d48,https://canary.contestimg.wish.com/api/webimage/598ab1763eb22a47aa094d48-medium.jpg,598ab1763eb22a47aa094d48
Sac à dos de randonnée Sac à dos de voyage léger pliable et pliable durable,Hiking Backpack Durable Folding Packable Lightweight Travel Daypack,7.0,EUR,25.0,EUR,8,10,,,4.5,16.0,12,2,1,0,1,,,,,,blue,,50,Livraison standard,2.0,false,,50,,,CN,Allget,优宜得网络科技有限公司,"91 % avis positifs (85,591 notes)",85591,4.254664625953663,556473f276cde50ebb7a7151,,,https://www.wish.com/c/5a829518da0037768b639037,https://canary.contestimg.wish.com/api/webimage/5a829518da0037768b639037-medium.jpg,5a829518da0037768b639037
Logitech,,,,,,,,,,,,,,,,,,,,,,,,,,,,,,,,,,,,,,,,,https://www.wish.com/c/5e8d2ff49719ed6404967772,,5e8d2ff49719ed6404967772
2021 Mode Femme Mocassins Plats Confortables Mocassins Bottes Doux Fausse Fourrure Hiver Bottes Chaudes Décontractées Légères Dames Chaussures Slip-On Slip-On Pantoufles En Plein Air Chaussures Plate-Forme Antidérapantes,2021 Women's Fashion Comfy Flat Loafers Moccasins Boots Soft Faux Fur Winter Warm Boots Casual Lightweight Ladies Shoes Slip-On Slides Slippers Outdoor Anti-Slip Platform Shoes,4.0,EUR,73.0,EUR,4,10,,,3.625,16.0,9,2,0,0,5,,,,,,red,3.5,3,Livraison standard,1.0,false,,50,true,Quantité limitée !,CN,Nainfangyuan,nainfangyuan,82 % avis positifs (969 notes),969,3.9432404540763675,5f2936230c36741963eeab53,,,https://www.wish.com/c/5fe8420cce991600b4cba45b,https://canary.contestimg.wish.com/api/webimage/5fe8420cce991600b4cba45b-medium.jpg,5fe8420cce991600b4cba45b
Womens Casual Running Shoes Breathable Knit Sneakers for Ladies Ultra Lightweight Sports Shoes Walking Shoes Size 35-42,Womens Casual Running Shoes Breathable Knit Sneakers for Ladies Ultra Lightweight Sports Shoes Walking Shoes Size 35-42,1.0,EUR,1.0,EUR,1,10,,,5.0,1.0,1,0,0,0,0,,,,,,white,2,4,Livraison standard,1,false,,50,true,Quantité limitée !,CN,Southern Great Bear,southerngreatbear,91 % avis positifs (474 notes),474,4.208860759493671,5dda2afd8da0103a3296c3c9,,,https://www.wish.com/c/6041d1569dbee7b07ed75df3,https://canary.contestimg.wish.com/api/webimage/6041d1569dbee7b07ed75df3-medium.jpg,6041d1569dbee7b07ed75df3
JVC HAS160V Flats Lightweight Folding Headphones On Ear Violet,JVC HAS160V Flats Lightweight Folding Headphones On Ear Violet,19.0,EUR,33.0,EUR,22,1,,,5.0,0.0,,,,,,,,,,,,,3,Livraison standard,5.0,false,,3,,,US,DeepDiscountIntl,deepdiscountintl,"95 % avis positifs (4,096 notes)",4096,4.605224609375,593abd6720d56c2f0e3f3af0,,,https://www.wish.com/c/5baf4cd19401ae30ac181f14,https://canary.contestimg.wish.com/api/webimage/5baf4cd19401ae30ac181f14-medium.jpg,5baf4cd19401ae30ac181f14
Camping en plein air chasse hache de montagne tactique auto-défense portable léger haute dureté hache hache de camp hache de camping hache de camping （Plusieurs options disponibles）,Outdoor camping hunting mountain axe Tactical self-defense portable lightweight high hardness axe  fire axe camp axe camping axe （Multiple options available）,28.0,EUR,99.0,EUR,33,10,,,4.594936708860759,79.0,55,17,6,1,0,,,,,,,hammerandaxe,50,Livraison standard,8.0,false,,50,,,CN,cnjefhiu,cnjefhiu,81 % avis positifs (203 notes),203,3.955665024630542,5f35112b240c9b11752a1639,,,https://www.wish.com/c/5f51a1a9fdf4910050ab69c3,https://canary.contestimg.wish.com/api/webimage/5f51a1a9fdf4910050ab69c3-medium.jpg,5f51a1a9fdf4910050ab69c3
