title,title_orig,discount_price,discount_price_currency,retail_price,retail_price_currency,discount_price_in_original_currency,nb_cart_orders_approx,nb_units_purchased_approx,uses_ad_boosts,rating,rating_count,rating_five_count,rating_four_count,rating_three_count,rating_two_count,rating_one_count,badges_count,badge_local_product,badge_product_quality,badge_fast_shipping,tags,product_color,product_variation_size_id,product_variation_inventory,shipping_option_name,shipping_option_price,shipping_is_express,countries_shipped_to,inventory_total,has_urgency_banner,urgency_text,origin_country,merchant_title,merchant_name,merchant_info_subtitle,merchant_rating_count,merchant_rating,merchant_id,merchant_has_profile_picture,merchant_profile_picture,product_url,product_picture,product_id
"Adusa Reacher Grabber Pick up Tool, 32 ""Pliable Léger Aide à la mobilité Long Duty, Outil de saisie pour les personnes âgées, Claw Trash Picker - Paquet de 2","Adusa Reacher Grabber Pick up Tool,32"" Foldable Lightweight Long Duty Mobility Aid, Grabber Tool for Elderly,Claw Trash Garbage Picker - 2 Pack",21.0,EUR,21.0,EUR,25,10,,,4.333333333333333,15.0,9,4,1,0,1,,,,,,blue,,49,Livraison standard,6.0,false,,49,,,CN,FFHPET,ffhpet,100 % avis positifs (15 notes),15,4.533333333333333,5d6e27864adcfd79b679c851,,,https://www.wish.com/c/5d8072b035cfb03574cbf58a,https://canary.contestimg.wish.com/api/webimage/5d8072b035cfb03574cbf58a-medium.jpg,5d8072b035cfb03574cbf58a
2019 hommes et femmes chaussures nouveau couple baskets montantes chaussures de basket-ball légères chaussures de course respirantes résistantes à l'usure,2019 Men and Women Shoes New Couple High-top Sneakers Lightweight Basketball Shoes Wear-resistant Breathable Running Shoes,16.0,EUR,106.0,EUR,19,10,,,4.222222222222222,54.0,37,5,4,3,5,,,,,,black,35,2,Livraison standard,6.0,false,,50,,,CN,ZVMVN30,zvmvn30,87 % avis positifs (330 notes),330,4.1454545454545455,5af177777824ca0cc6ce6fea,,,https://www.wish.com/c/5d1ffaf55dc40067f48af0c0,https://canary.contestimg.wish.com/api/webimage/5d1ffaf55dc40067f48af0c0-medium.jpg,5d1ffaf55dc40067f48af0c0
"Zapatillas cómodas de absorción de impactos transpirables para correr para hombre más nuevas, zapatillas de tenis deportivas ligeras para exteriores, multicolor",Newest Men's Breathable Running Shock Absorption Comfortable Sneakers Lightweight Outdoor Sports Athletic Tennis Shoes Multicolor,10.0,EUR,33.0,EUR,11,10,,,4.365384615384615,52.0,36,9,2,0,5,,,,,,black,eu39&us6.5,50,Livraison standard,2.0,false,,50,,,CN,hqlts,hqlts,81% retroalimentación positiva (326 calificaciones),326,3.8987730061349692,5dc4dc9bb0a3640542a4029e,,,https://www.wish.com/c/5f62ca5fbca6cd088994a9e1,https://canary.contestimg.wish.com/api/webimage/5f62ca5fbca6cd088994a9e1-medium.jpg,5f62ca5fbca6cd088994a9e1
Casque de jeu filaire G10 3.5mm casque d'éclairage USB avec Microphone transportant facilement une pièce d'écouteur léger pour PC PS4,G10 3.5mm Wired Gaming Headphone USB Lighting Headset with Microphone Easily Carrying Lightweight Earphone Part for PS4 PC,31.0,EUR,31.0,EUR,37,2,,,5.0,0.0,,,,,,,,,,,green,china,4,Livraison standard,15.0,false,,50,,,CA,11368796 CANADA CORPORATION,11368796canadacorporation,"80 % avis positifs (1,166 notes)",1166,3.9382504288164664,5ffb1f43fa8a25c707537989,,,https://www.wish.com/c/600d8c97b28dfacfa6dc61a8,https://canary.contestimg.wish.com/api/webimage/600d8c97b28dfacfa6dc61a8-medium.jpg,600d8c97b28dfacfa6dc61a8
High-end sports wheelchair disabled lightweight folding aluminum alloy quick release manual sports and leisure wheelchair,High-end sports wheelchair disabled lightweight folding aluminum alloy quick release manual sports and leisure wheelchair,1620.0,EUR,1620.0,EUR,1963.0,0,,,5.0,0.0,,,,,,,,,,,white,,50,Livraison standard,37.0,false,,50,,,CA,11368796 CANADA CORPORATION,11368796canadacorporation,"80 % avis positifs (1,166 notes)",1166,3.9382504288164664,5ffb1f43fa8a25c707537989,,,https://www.wish.com/c/602eb7b634b0fb42ea4242f9,https://canary.contestimg.wish.com/api/webimage/602eb7b634b0fb42ea4242f9-medium.jpg,602eb7b634b0fb42ea4242f9
2 PCS Mini Oreille Intérieure Aide Auditive Légère Invisible Amplificateur Sonore Portable Aide Auditive Amplificateur Sonore Invisible Aide Auditive Numérique Sans Fil Amplificateur Sonore Voix Rechargeable pour Personnes Âgées Perte sévère Écoutez les outils de soins de l'oreille,2 PCS Mini Inner Ear Invisible Lightweight Hearing Aid Portable Sound Amplifier Hearing Aid Invisible Sound Amplifier Wireless Digital Hearing Aid Rechargeable Voice Sound Amplifier for Elder Severe Loss Hear Ear Care Tools,14.0,EUR,14.0,EUR,16,10,,,3.2,45.0,17,4,7,5,12,,,,,,,2pcs,50,Livraison standard,4.0,false,,50,,,CN,niuniu4466,niuniu4466,"88 % avis positifs (1,711 notes)",1711,4.1589713617767385,5d4651f156a260482e1bb783,,,https://www.wish.com/c/5face2d7a96458bf6e471e88,https://canary.contestimg.wish.com/api/webimage/5face2d7a96458bf6e471e88-medium.jpg,5face2d7a96458bf6e471e88
Couverture en molleton Haikyuu doux et chaud salon chambre lit léger couverture de canapé pour bébé et adulte,Haikyuu Fleece Blanket Soft Warm Living Room Bedroom Lightweight Bed Couch Blanket for Baby and Adult,14.0,EUR,149.0,EUR,16,10,,,4.111111111111111,18.0,9,4,3,2,0,,,,,,,a-100x80cm,50,Livraison standard,5.0,false,,50,,,CN,zzltd,zzltd,"89 % avis positifs (1,612 notes)",1612,4.212779156327543,5d5e3f6561ae394150482473,,,https://www.wish.com/c/5f55f3d4341c962ff306e819,https://canary.contestimg.wish.com/api/webimage/5f55f3d4341c962ff306e819-medium.jpg,5f55f3d4341c962ff306e819
Unité de dizaines 28 Modes Stimulation électrique Massage Thérapie musculaire Soulagement de la douleur Affichage LCD léger réglable Argent Gris Compact,Tens Unit 28 Modes Electric Stimulation Massage Muscle Therapy Pain Relief Adjustable Lightweight LCD Display Silver Grey Compact,26.0,EUR,26.0,EUR,31,10,,,3.5,8.0,5,0,0,0,3,,,,,,,auplug,50,Livraison standard,9.0,false,,50,,,CN,shenzhenshiwantengkejiyouxiangongsi,深圳市万腾科技有限公司,"92 % avis positifs (42,791 notes)",42791,4.31520646864995,55e1d1d70eeb2a43f14ac5cf,,,https://www.wish.com/c/5dc53005c5a08a003536b576,https://canary.contestimg.wish.com/api/webimage/5dc53005c5a08a003536b576-medium.jpg,5dc53005c5a08a003536b576
Chaussures de course de sport en maille pour hommes respirants en dentelle baskets de marche décontractées athlétiques légères,fashion breathable men mesh sport running shoes lace lightweight athletic casual walking sneakers,8.0,EUR,25.0,EUR,9,10,,,4.548387096774194,62.0,43,13,4,1,1,,,,,,red,us16/eu50/300mm,2,Livraison standard,3.0,false,,50,,,CN,mengxiang shoes,mengxiangshoes,"(9,548 notes)",9548,4.226434855467113,58a91000c78c775186c45191,,,https://www.wish.com/c/5dad23a441eb543e2ddc9254,https://canary.contestimg.wish.com/api/webimage/5dad23a441eb543e2ddc9254-medium.jpg,5dad23a441eb543e2ddc9254
Buff unisexe adulte léger marino laine chaud bonnet d'hiver - noir solide,Buff Unisex Adults Lightweight Marino Wool Warm Winter Beanie Hat - Solid Black,24.0,EUR,26.0,EUR,28.5,0,,,5.0,0.0,,,,,,,,,,,black,onesize,15,Livraison standard,5.95,false,,15,,,GB,Avenue 85,avenue85,92 % avis positifs (548 notes),548,4.452554744525547,5e4bc14054040a425ca9d14d,,,https://www.wish.com/c/5fbf736248f00eee0b5f17cb,https://canary.contestimg.wish.com/api/webimage/5fbf736248f00eee0b5f17cb-medium.jpg,5fbf736248f00eee0b5f17cb
Unité de machine multifonctionnelle blanche de dizaines de masseur électrique stimulateur musculaire d'impulsion soulagement des douleurs dorsales,Multifunctional White Tens Machine Unit Electrical Massager Pulse Muscle Stimulator Back Pain Relief,11.0,EUR,11.0,EUR,13,1000,,,4.239074550128534,389.0,246,62,40,10,31,,,,,,white,,50,Livraison Express,8.0,true,,50,true,Quantité limitée !,US,MuhaoganaW,muhaoganaw,88 % avis positifs (635 notes),635,4.166929133858268,5e7eb88ca75829b6c07b1053,,,https://www.wish.com/c/5f5f20b071616fc5a7c4c5dc,https://canary.contestimg.wish.com/api/webimage/5f5f20b071616fc5a7c4c5dc-medium.jpg,5f5f20b071616fc5a7c4c5dc
Costume de pantalon élégant pour femme Costume de bureau d'affaires Veste formelle jambe large légère,Women's Smart Trouser Suit Business Office Suit Formal Jacket Wide Leg Lightweight,65.0,EUR,149.0,EUR,78.0,1,,,4.0,1.0,0,1,0,0,0,,,,,,black,uk14,2,Livraison standard,12.0,false,,5,,,GB,icecoolfashion.uk,icecoolfashionuk,100 % avis positifs (27 notes),27,4.62962962962963,5e5925956fa779af9e02413c,,,https://www.wish.com/c/5e70e9186a767d4598b534eb,https://canary.contestimg.wish.com/api/webimage/5e70e9186a767d4598b534eb-medium.jpg,5e70e9186a767d4598b534eb
Suaoki,,,,,,,,,,,,,,,,,,,,,,,,,,,,,,,,,,,,,,,,,https://www.wish.com/c/5e3b0ba49719eddf0ac7e675,,5e3b0ba49719eddf0ac7e675
[Style Moomoo] Mocassins en cuir de vachette ultra-légers,[Moomoo Style] Ultra-lightweight air-shoe cowhide loafers,77.0,EUR,77.0,EUR,93.0,0,,,5.0,0.0,,,,,,,,,,,pink,,50,Livraison standard,12.0,false,,50,,,CA,othep,othep,60 % avis positifs (5 notes),5,3.2,5ff04c48c9720a6520e73166,,,https://www.wish.com/c/6013d259c77faa907bd6d640,https://canary.contestimg.wish.com/api/webimage/6013d259c77faa907bd6d640-medium.jpg,6013d259c77faa907bd6d640
Hommes Femmes Unisexe Vestes À Capuche Été Printemps Respirant Causal Coupe-Vent Femme Homme Couple Basique Vestes Manteaux Hoodies Zipper Veste Léger Sport Sweat Bomber Famale Plus La Taille,Men Women's Unisex Hooded Jackets Summer Spring Breathable Causal Windbreaker Woman Man Couple Basic Jackets Coats Hoodies Zipper Jacket Lightweight Sports Sweatshirt Bomber Famale Plus Size,5.0,EUR,5.0,EUR,6,10,,,3.9,10.0,6,1,1,0,2,,,,,,gray,xxs,1,Livraison standard,2.0,false,,50,,,US,peckoayyv,peckoayyv,"85 % avis positifs (1,132 notes)",1132,4.020318021201414,5e954c6a76b18102132cd989,,,https://www.wish.com/c/5ebcf44251a25f436d83b58c,https://canary.contestimg.wish.com/api/webimage/5ebcf44251a25f436d83b58c-medium.jpg,5ebcf44251a25f436d83b58c
"15,6 pouces ordinateur portable sac fourre-tout léger mode femmes sac à main voyage sac à bandoulière Bussiness porte-documents sac à provisions",15.6 inch Laptop Tote Bag Lightweight Fashion Women Handbag Travel Shoulder Bag Bussiness Briefcase Shopping Bag,23.0,EUR,23.0,EUR,27,10,,,4.653153153153153,222.0,170,36,11,1,4,,,,,,black,,50,Livraison standard,8.0,false,,50,,,CN,HONGXIANGWUJIN,hongxiangwujin,"95 % avis positifs (2,821 notes)",2821,4.578163771712159,5b47170e49c8e61f402b7682,,,https://www.wish.com/c/5d15b83372f7c77e8f59f464,https://canary.contestimg.wish.com/api/webimage/5d15b83372f7c77e8f59f464-medium.jpg,5d15b83372f7c77e8f59f464
8 colores para mujer Moda Floral Hoja Impreso Chaqueta fina Casual Ligero Cremallera corta Chaqueta de bombardero Abrigo Talla grande XS-8XL,8 Colors Womens Fashion Floral Leaf Printed Thin Jacket Casual Lightweight Zip Up Short Bomber Jacket Coat Plus Size XS-8XL,6.0,EUR,6.0,EUR,7,10,,,3.848101265822785,79.0,31,25,11,4,8,,,,,,blue,xs,1,Livraison standard,2.0,false,,50,,,CN,niping123,niping123,(693 calificaciones),693,3.948051948051948,5dd63306703f615a8437f254,,,https://www.wish.com/c/5ed0a8d72450131e28931897,https://canary.contestimg.wish.com/api/webimage/5ed0a8d72450131e28931897-medium.jpg,5ed0a8d72450131e28931897
Télescope léger à poche pliante jumelles de jour et nuit 30x60,30x60 Day And Night Binoculars Folding Pocket Lightweight Telescope,13.0,EUR,13.0,EUR,15,5000,,,3.8876755070202806,1282.0,635,230,193,86,138,,,,,,,lowversion,5,Livraison Express,4.0,true,,5,,,CN,blackgall,hongkongnewcamrytechnologycolimited,"92 % avis positifs (31,470 notes)",31470,4.310867492850334,5577db1d38553819f99231e4,,,https://www.wish.com/c/583dca9d4532423b8aef5366,https://canary.contestimg.wish.com/api/webimage/583dca9d4532423b8aef5366-medium.jpg,583dca9d4532423b8aef5366
2 pièces en alliage d'aluminium détachable léger lame nervurée kayak pagaies bateau avirons 50in à 96in,2Pcs Aluminium Alloy Detachable Lightweight Ribbed Blade Kayak Paddles Boat Oars 50in to 96in,19.0,EUR,19.0,EUR,22,10,,,3.6666666666666665,3.0,1,0,2,0,0,,,,,,,,50,Livraison standard,5.0,false,,50,,,CN,Anspringstore,assspiringstore,91 % avis positifs (988 notes),988,4.369433198380567,5b054c4e8b8be9076f22218e,,,https://www.wish.com/c/5f843215422af80041603b42,https://canary.contestimg.wish.com/api/webimage/5f843215422af80041603b42-medium.jpg,5f843215422af80041603b42
Chaussures de sport en cuir respirant pour femmes Baskets décontractées Chaussures de marche légères,Women's Breathable Leather Sports Shoes Casual Sneakers Lightweight Running Walking Shoes ,7.0,EUR,281.0,EUR,8,10,,,4.356643356643357,143.0,89,30,16,2,6,,,,,,grey&blue,34,1,Livraison standard,2.0,false,,50,,,CN,yihangfashion,yihangfashion,93 % avis positifs (553 notes),553,4.325497287522604,5d64bd18bff2df2f1afa0037,,,https://www.wish.com/c/5de7869ccb3347132bfb6a67,https://canary.contestimg.wish.com/api/webimage/5de7869ccb3347132bfb6a67-medium.jpg,5de7869ccb3347132bfb6a67
2021 nouvelle mode chaussures de sécurité respirantes Anti-smashing Anti-crevaison chaussures de travail de sécurité légères pour hommes grande taille 35-48,2021 New Fashion Breathable Safety Shoes Anti-smashing Anti-puncture Lightweight Safety Work Shoes for Men Plus Size 35-48,23.0,EUR,165.0,EUR,27,10,,,4.410958904109589,73.0,48,14,7,1,3,,,,,,red,eu35,20,Livraison standard,7.0,false,,50,,,US,osh926,osh926,"90 % avis positifs (1,520 notes)",1520,4.209868421052631,598866ab2351347863b994ab,,,https://www.wish.com/c/5f741d59db4faf1288f4ad10,https://canary.contestimg.wish.com/api/webimage/5f741d59db4faf1288f4ad10-medium.jpg,5f741d59db4faf1288f4ad10
Pantalon capri de jogging léger 3/4 pour femme Camouflage Sport Fitness pantalon pantalon Legging grande taille XS-8XL,Women's 3/4 Lightweight Jogging Capri Pants Camouflage Sport Fitness Pants Trousers Legging Plus Size XS-8XL,5.0,EUR,5.0,EUR,5,10,,,5.0,3.0,3,0,0,0,0,,,,,,red,xs,50,Livraison standard,2.0,false,,50,true,Quantité limitée !,CN,Green Style Fashion Store,greenstylefashionstore,"86 % avis positifs (4,123 notes)",4123,4.080281348532622,560c040db307de0d8cd3fdb7,,,https://www.wish.com/c/5e9dbb2c235d341500461641,https://canary.contestimg.wish.com/api/webimage/5e9dbb2c235d341500461641-medium.jpg,5e9dbb2c235d341500461641
Tendance mode baskets montantes pour hommes chaussures respirantes augmenter les baskets confortables chaussures de sport maille chaussures de marche légères,Trend Fashion Men's High-Top Sneakers Breathable Shoes  Heighten Comfortable Sneakers Sports Shoes Mesh Lightweight Walking Shoes,12.0,EUR,12.0,EUR,14,1000,,,4.424929178470255,353.0,256,49,15,8,25,,,,,,yellow,eur38/us6,1,Livraison standard,3.0,false,,50,,,CN,megshow,megshow,"(7,062 notes)",7062,4.329934862645143,58363854e2928653f8b5c7cf,,,https://www.wish.com/c/5def180e3025d107a184cb8c,https://canary.contestimg.wish.com/api/webimage/5def180e3025d107a184cb8c-medium.jpg,5def180e3025d107a184cb8c
Femmes Little Day Pack Mini sac à dos en nylon léger petit sac à dos noir imperméable filles décontracté,Women Little Day Pack Lightweight Nylon Mini Backpack Small Rucksack Black Waterproof Girls Casual,7.0,EUR,7.0,EUR,8,10,,,3.4705882352941178,17.0,8,1,3,1,4,,,,,,,,50,Livraison standard,2.0,false,,50,,,CN,aameimei,aameimei,"92 % avis positifs (3,865 notes)",3865,4.356791720569211,59083f46d94b5a2500dd6a35,,,https://www.wish.com/c/5cff06a1e73c301d52bde695,https://canary.contestimg.wish.com/api/webimage/5cff06a1e73c301d52bde695-medium.jpg,5cff06a1e73c301d52bde695
S-8XL Shorts d'été pour femmes avec poches Plain Pure Color et Print Shorts Cordon de serrage Taille élastique Pantalon court Plage Léger Pantalon de salon court Short décontracté,S-8XL Summer Women Shorts with Pockets Plain Pure Color and Print Shorts Drawstring Elastic Waist Short Pants Beach Lightweight Short Lounge Pants Casual Shorts,3.97,EUR,30.0,EUR,4.8100000000000005,1000,,,3.8220338983050848,118.0,55,25,13,12,13,,,,,,pink,s,50,Livraison standard,1.0,false,,50,,,US,jessicap,jessicap,(228 notes),228,4.135964912280702,59147451387dd12e952ba0a5,,,https://www.wish.com/c/5ead7b65945bc41b8466b9f2,https://canary.contestimg.wish.com/api/webimage/5ead7b65945bc41b8466b9f2-medium.jpg,5ead7b65945bc41b8466b9f2
2021 nouvelle mode hommes baskets décontractées respirant maille chaussures de Sport chaussures de course athlétiques légères pour hommes,2021 New Fashion Men Casual Sneakers Breathable Mesh Sport Shoes Men's Lightweight Athletic Running Shoes,7.0,EUR,7.0,EUR,8,10,,,4.5,2.0,1,1,0,0,0,,,,,,white,6.,1,Livraison standard,3.0,false,,50,true,Quantité limitée !,CN,Ashleyouy,ashleyouy,"90 % avis positifs (1,638 notes)",1638,4.256410256410256,5dd3957388f1f3039374a966,,,https://www.wish.com/c/5faa0293cabfde3dcc6b8da4,https://canary.contestimg.wish.com/api/webimage/5faa0293cabfde3dcc6b8da4-medium.jpg,5faa0293cabfde3dcc6b8da4
 Cool BATFOX léger respirant vtt cyclisme vélo Sports de plein air casque de sécurité, Cool BATFOX Lightweight Breathable MTB Cycling Bicycle Outdoor Sports Safety Helmet,19.0,EUR,26.0,EUR,23,10,,,5.0,2.0,2,0,0,0,0,,,,,,pink,,5,Livraison Express,6.0,true,,38,,,CN,topeka,topeka,"90 % avis positifs (5,060 notes)",5060,4.254545454545455,564316cfdfb6b1288753f8f4,,,https://www.wish.com/c/5ffd53ced3b67ab0d6432bf9,https://canary.contestimg.wish.com/api/webimage/5ffd53ced3b67ab0d6432bf9-medium.jpg,5ffd53ced3b67ab0d6432bf9
Sac à dos transparent Sac d'école transparent Sac à dos décontracté en PVC Voyage Sac à dos léger Sac à dos transparent pour étudiants / garçons / filles,Clear Backpack Transparent School Bag PVC Casual Daypack Travel Lightweight Bookbag See-Through Rucksack for Students/Boys / Girls,10.0,EUR,10.0,EUR,11,10,,,4.05,60.0,28,19,7,0,6,,,,,,black,,50,Livraison standard,3.0,false,,50,,,CN,chucuezhaji,chucuezhaji,"91 % avis positifs (2,498 notes)",2498,4.325460368294635,5acd7a2f40626a314c132bda,,,https://www.wish.com/c/5d5533efde263a6357edc0da,https://canary.contestimg.wish.com/api/webimage/5d5533efde263a6357edc0da-medium.jpg,5d5533efde263a6357edc0da
New Fashion Lightweight Sneaker Steel Toe Shoes Kevlar Fiber Safety Shoes Breathable Deodorant Steel Toe Work Shoes for Men/Women Plus Size,New Fashion Lightweight Sneaker Steel Toe Shoes Kevlar Fiber Safety Shoes Breathable Deodorant Steel Toe Work Shoes for Men/Women Plus Size,12.0,EUR,247.0,EUR,14,10,,,5.0,1.0,1,0,0,0,0,,,,,,blue,36,1,Livraison standard,3.0,false,,50,,,CN,hualala2018,hualala2018,"(2,680 notes)",2680,4.230597014925373,596dba5fc25081367dfa1334,,,https://www.wish.com/c/6034b278f65b0dc226850927,https://canary.contestimg.wish.com/api/webimage/6034b278f65b0dc226850927-medium.jpg,6034b278f65b0dc226850927
"2021 Hot-Selling 17 couleurs Sherpa Throw Couverture, Couverture en molleton flou très doux, Couverture en microfibre de velours en flanelle confortable pour canapé-lit, Couverture réversible très chaude et confortable, léger","2021 Hot-Selling 17 Colors Sherpa Throw Blanket, Super Soft Fuzzy Fleece Blanket, Cozy Flannel Velvet Microfiber Blanket for Couch Bed Sofa, Super Warm Comfy Reversible Blanket, Lightweight ",10.0,EUR,10.0,EUR,11,10,,,3.6666666666666665,3.0,2,0,0,0,1,,,,,,pink,50*70cm,50,Livraison standard,3.0,false,,50,,,CN,windmuch,windmuch,77 % avis positifs (166 notes),166,3.825301204819277,5e9a9e48a67777d9baeac747,,,https://www.wish.com/c/602e22947564f1bc722ecc76,https://canary.contestimg.wish.com/api/webimage/602e22947564f1bc722ecc76-medium.jpg,602e22947564f1bc722ecc76
"Share The Love Ultra-Soft Micro Fleece Blanket Throw Fuzzy Lightweight Hypoallergenic Plush Blanket Perfect for Couch, Sofa, Bed","Share The Love Ultra-Soft Micro Fleece Blanket Throw Fuzzy Lightweight Hypoallergenic Plush Blanket Perfect for Couch, Sofa, Bed",14.0,EUR,149.0,EUR,16,6,,,5.0,0.0,,,,,,,,,,,,120x80cm,50,Livraison standard,5.0,false,,50,,,CN,zzltd,zzltd,"89 % avis positifs (1,612 notes)",1612,4.212779156327543,5d5e3f6561ae394150482473,,,https://www.wish.com/c/5fe9812c5985a934a87ba1ee,https://canary.contestimg.wish.com/api/webimage/5fe9812c5985a934a87ba1ee-medium.jpg,5fe9812c5985a934a87ba1ee
INCERUN Plus Peignoir en satin de soie pour hommes Peignoir long Vêtements de nuit légers,INCERUN Plus Men's Silk Satin Robe Long Bathrobe Lightweight Sleepwear,14.0,EUR,14.0,EUR,16,10,,,3.935251798561151,139.0,67,31,20,7,14,,,,,,black,xxs,50,Livraison Express,6.0,true,,50,true,Quantité limitée !,CN,ZanzeaFashion,zanzeafashion,"(40,115 notes)",40115,4.245568989156176,58be241991fd205b2462acc3,,,https://www.wish.com/c/5c343a3ab3fab406227aa96d,https://canary.contestimg.wish.com/api/webimage/5c343a3ab3fab406227aa96d-medium.jpg,5c343a3ab3fab406227aa96d
"Cooler Master MM711 60G Souris de jeu blanc brillant avec coque en nid d'abeille légère Câble Ultraweave 16000 DPI optique -B07Z9RQLDL, noir mat","Cooler Master MM711 60G Glossy White Gaming Mouse with Lightweight Honeycomb Shell Ultraweave Cable 16000 DPI Optical -B07Z9RQLDL, Matte Black",269.0,EUR,269.0,EUR,325.0,0,,,5.0,0.0,,,,,,,,,,,,,50,Livraison standard,12.0,false,,50,true,Quantité limitée !,KR,SENWELL KOREA,senwellkorea,,0,5.0,5ff3d3a14361b919d75df3e2,,,https://www.wish.com/c/6001a010881090b1576199e9,https://canary.contestimg.wish.com/api/webimage/6001a010881090b1576199e9-medium.jpg,6001a010881090b1576199e9
Foulard unisexe léger à glands unisexe Shemagh KeffIyeh Shemagh KeffIyeh Stole Shawl Bufanda Pashmina écharpe en tissu à franges,Unisex Lightweight Plaid Tassel Arab Desert Shemagh KeffIyeh Stole Shawl Bufanda Scarf Wrap Pashmina,4.72,EUR,5.0,EUR,5.72,5000,,,3.9186746987951806,1660.0,793,346,261,113,147,,,,,,white,,50,Livraison Express,6.0,true,,50,,,CN,pasadena,pasadena,"90 % avis positifs (23,164 notes)",23164,4.21991020549128,56408f64fc2b645ad2fb6a41,,,https://www.wish.com/c/5a8fb4e51c6def2c9a705287,https://canary.contestimg.wish.com/api/webimage/5a8fb4e51c6def2c9a705287-medium.jpg,5a8fb4e51c6def2c9a705287
Portable Heavy Bass In-Ear Filaire Musique Écouteurs Légers Écouteur Ergonomique de Sport avec Micro,Portable Heavy Bass In-Ear Wired Music Lightweight Earphones Ergonomic Sports Earpiece with Mic,5.0,EUR,5.0,EUR,5,1000,,,4.574204946996466,566.0,438,66,31,11,20,,,,,,red,,50,Livraison standard,1.0,false,,50,,,CN,huhuanhuan19860111,eonix003,"(2,939 notes)",2939,4.26811840762164,5dad51d1636f43013adae79c,,,https://www.wish.com/c/5ece32b1142dca47152a24f0,https://canary.contestimg.wish.com/api/webimage/5ece32b1142dca47152a24f0-medium.jpg,5ece32b1142dca47152a24f0
Shimano Polarized Sports Men Sunglasses Fishing Driving Sun Glasses UV400 Lightweight Safety Goggles Male Fishing Glasses,Shimano Polarized Sports Men Sunglasses Fishing Driving Sun Glasses UV400 Lightweight Safety Goggles Male Fishing Glasses,10.0,EUR,10.0,EUR,11,10,,,5.0,0.0,,,,,,,,,,,,1#,50,Livraison standard,2.0,false,,50,,,US,Crabs In A Barrel NY,crabsinabarrelny,0 % avis positifs (1 notes),1,2.0,601a2168bee4003868273c46,,,https://www.wish.com/c/605adc1e7fa7cd40648f1af5,https://canary.contestimg.wish.com/api/webimage/605adc1e7fa7cd40648f1af5-medium.jpg,605adc1e7fa7cd40648f1af5
New Women's Sports Shoes Fashion Walking Shoes High Quality Mesh Breathable Casual Shoes Lightweight Running Shoes,New Women's Sports Shoes Fashion Walking Shoes High Quality Mesh Breathable Casual Shoes Lightweight Running Shoes,0.65,EUR,1.0,EUR,0.79,10,,,5.0,0.0,,,,,,,,,,,grey,34,1,Livraison standard,1,false,,50,,,VE,Guerrero Motors,guerreromotors,50 % avis positifs (2 notes),2,3.5,5e4a28a854040a1046a9d22f,,,https://www.wish.com/c/60487012b42e70de11791e02,https://canary.contestimg.wish.com/api/webimage/60487012b42e70de11791e02-medium.jpg,60487012b42e70de11791e02
LARNMERN Chaussures de sécurité pour hommes Construction à embout d'acier Chaussures de protection légères 3D antichoc Travail Sneaker Chaussures respirantes,LARNMERN Men's Safety Shoes Steel Toe Construction Protective Footwear Lightweight 3D Shockproof Work Sneaker Breathable Shoes,28.0,EUR,28.0,EUR,33,10,,,4.304347826086956,46.0,24,14,6,2,0,,,,,,pink,36eu/4.5us,3,Livraison standard,9.0,false,,50,,,CN,Yuefe Shoe,yuefeshoe,94 % avis positifs (347 notes),347,4.455331412103747,5d48ef49ead194642a665f06,,,https://www.wish.com/c/5e5f64f9163c4c07b2174492,https://canary.contestimg.wish.com/api/webimage/5e5f64f9163c4c07b2174492-medium.jpg,5e5f64f9163c4c07b2174492
Pantoufles décontractées pour hommes de mode appartements chaussures à bascule plage loisirs légers tongs chaussures,Fashion Men's Casual Slippers Flats Flip-flop Shoes Beach Leisure Lightweight Thongs Shoes ,12.0,EUR,49.0,EUR,14,10,,,4.8,10.0,8,2,0,0,0,,,,,,grey,39,50,Livraison standard,3.0,false,,50,true,Quantité limitée !,US,pykswi,pykswi,100 % avis positifs (12 notes),12,4.583333333333333,5e7c3c952260a93fa9728774,,,https://www.wish.com/c/5fbcb09d1afa679b6b916f41,https://canary.contestimg.wish.com/api/webimage/5fbcb09d1afa679b6b916f41-medium.jpg,5fbcb09d1afa679b6b916f41
2021 New Fashion Women Casual Shoes Lightweight Outdoor Sport Sneakers Slip on Mesh Shoes size:35-43,2021 New Fashion Women Casual Shoes Lightweight Outdoor Sport Sneakers Slip on Mesh Shoes size:35-43,5.0,EUR,5.0,EUR,5,10,,,4.5,2.0,1,1,0,0,0,,,,,,black,32,1,Livraison standard,2.0,false,,50,,,CH,FeirFy,feirfy,86 % avis positifs (7 notes),7,4.0,5fbce99c8d94f356b1087838,,,https://www.wish.com/c/603c97f7482e5773d03c0595,https://canary.contestimg.wish.com/api/webimage/603c97f7482e5773d03c0595-medium.jpg,603c97f7482e5773d03c0595
1 PC extérieur léger bouilloire ceinture transporteur porte-bouteille d'eau couvercle de tasse en nylon,1 PC Outdoor Lightweight Kettle Belt Carrier Water Bottle Holder Nylon Cup Cover,3.96,EUR,4.0,EUR,4.8,10,,,4.5,4.0,2,2,0,0,0,,,,,,armygreen,,50,Livraison standard,7.0,false,,50,,,CN,Starry_Dream,starry_dream,"90 % avis positifs (18,219 notes)",18219,4.25824688511993,5a964463b722cf610ba38476,,,https://www.wish.com/c/5f211e6c55734d1365af6ea1,https://canary.contestimg.wish.com/api/webimage/5f211e6c55734d1365af6ea1-medium.jpg,5f211e6c55734d1365af6ea1
Bestrunner,,,,,,,,,,,,,,,,,,,,,,,,,,,,,,,,,,,,,,,,,https://www.wish.com/c/5f94096090b8a6379ab5c927,,5f94096090b8a6379ab5c927
