title,title_orig,discount_price,discount_price_currency,retail_price,retail_price_currency,discount_price_in_original_currency,nb_cart_orders_approx,nb_units_purchased_approx,uses_ad_boosts,rating,rating_count,rating_five_count,rating_four_count,rating_three_count,rating_two_count,rating_one_count,badges_count,badge_local_product,badge_product_quality,badge_fast_shipping,tags,product_color,product_variation_size_id,product_variation_inventory,shipping_option_name,shipping_option_price,shipping_is_express,countries_shipped_to,inventory_total,has_urgency_banner,urgency_text,origin_country,merchant_title,merchant_name,merchant_info_subtitle,merchant_rating_count,merchant_rating,merchant_id,merchant_has_profile_picture,merchant_profile_picture,product_url,product_picture,product_id
Γυναικεία μόδα Κινέζικο στιλ Μπλουζάκια Floral Tee Backless αμάνικο λαιμό αγκράφα Slim Sexy Summer Streetwear Crop Top Tank,Fashion Ladies Chinese Style Tops Dragon Floral Tee Backless Sleeveless Neck Buckle Slim Sexy Summer Streetwear Crop Top Tank,15.0,CHF,23.0,CHF,15.58,10,,,4.5,2.0,1,1,0,0,0,,,,,,black,s,50,Livraison standard,7.27,false,,50,,,ES,Madrid Modas Fashion,madridmodasfashion,(14 αξιολογήσεις),14,4.642857142857143,5f842b3253268b99cced7627,,,https://www.wish.com/c/5fefd280858e85f23538a1ce,https://canary.contestimg.wish.com/api/webimage/5fefd280858e85f23538a1ce-medium.jpg,5fefd280858e85f23538a1ce
Under Armour UA Hommes HeatGear Compression Top à manches courtes Gym Fitness T-Shirt Top,Under Armour UA Mens HeatGear Compression Short Sleeve Gym Fitness T-Shirt Top,27.0,CHF,32.0,CHF,29.5,10,,,3.8,5.0,1,2,2,0,0,,,,,,navy,s,11,Livraison standard,0.0,false,,26,,,GB,Avenue 85,avenue85,92 % avis positifs (548 notes),548,4.452554744525547,5e4bc14054040a425ca9d14d,,,https://www.wish.com/c/5e55a68555b20b004a992b6e,https://canary.contestimg.wish.com/api/webimage/5e55a68555b20b004a992b6e-medium.jpg,5e55a68555b20b004a992b6e
"2019-es nyári női alkalmi ujjatlan felső vállpólók Női divatos, nyomtatott laza pólók hát nélküli pamut Tank felsők",2019 Summer Women Casual Sleeveless Tops Off Shoulder Shirts Ladies Fashion Printed Loose T-shirts Backless Cotton Tank Tops,5.22,CHF,6.0,CHF,5.75,10000,,,4.274,2000.0,1220,391,211,73,105,,,,,,navyblue,xs,48,Livraison standard,2.0,false,,50,,,CN,yangaiqun,yangaiqun,"89% pozitív visszajelzés (16,039 minősítés)",16039,4.15437371407195,58106cfce516491e6e5f1e53,,,https://www.wish.com/c/5c84bd33d8694176615f7019,https://canary.contestimg.wish.com/api/webimage/5c84bd33d8694176615f7019-medium.jpg,5c84bd33d8694176615f7019
2016 Neue Mode Damen Schaufelhals Crop Tops Kurzarm Bare Midriff Casual Bluse T-Shirt,2016 New Fashion Women Scoop Neck Crop Tops Short Sleeve Bare Midriff Casual Blouse T-Shirt,3.0,CHF,3.0,CHF,3,5000,,,4.392611683848798,1164.0,722,267,111,38,26,,,,,,white,s,50,Livraison standard,1.0,false,,50,,,CN,Lily Fashion1,topnewcompany,"(17,992 Bewertungen)",17992,4.244219653179191,544b41989719cd33291a722d,,,https://www.wish.com/c/5ae46a602716f0174aa55579,https://canary.contestimg.wish.com/api/webimage/5ae46a602716f0174aa55579-medium.jpg,5ae46a602716f0174aa55579
Damen Sexy Cutout Front Neckholder Weste Crisscross Knit Crop Tops,Womens Sexy Cutout Front Halter Vest Crisscross Knit Crop Tops,7.0,CHF,7.0,CHF,7,10,,,4.048387096774194,62.0,34,12,7,3,6,,,,,,white,s,1,Livraison standard,2.0,false,,50,,,CN,Youth House,youthhouse,"(1,901 Bewertungen)",1901,4.319831667543398,54814891b9b7e7041e7a1155,,,https://www.wish.com/c/5d2c3955493e8b07226a3d9e,https://canary.contestimg.wish.com/api/webimage/5d2c3955493e8b07226a3d9e-medium.jpg,5d2c3955493e8b07226a3d9e
NUOVI vestiti alla moda Estate Donna Casual Top Scollo a V allentato T-Shirt Camicie senza maniche tinta unita Canotta moda donna Pullover Canotta Plus Size XS-8XL,NEW Fashion Clothes Summer Women Casual Tops Loose V-neck T-shirt Solid Color Sleeveless Shirts Ladies Fashion Chiffon Pullover Tank Top Plus Size XS-8XL ,7.0,CHF,7.0,CHF,7,1000,,,3.5141242937853105,177.0,71,29,30,14,33,,,,,,grey,s,50,Livraison standard,2.0,false,,50,,,CN,Wang Flag Fashion,wangflagfashion,"84% feedback positivi (3,897 recensioni)",3897,3.9779317423659224,5d46cdb476befe7f781dd1af,,,https://www.wish.com/c/5e60d173933a4edd1cf5fe5f,https://canary.contestimg.wish.com/api/webimage/5e60d173933a4edd1cf5fe5f-medium.jpg,5e60d173933a4edd1cf5fe5f
5 colori moda donna casual carino maglioni di puro colore signore ragazze manica lunga con cappuccio pullover in maglia outwear adatto fino a S-5XL,5 Colors Women Fashion Casual Cute Pure Color Sweaters Ladies Girls Long Sleeve Hooded Pullover Knitted Tops Outwear Fits Up To S-5XL,19.0,CHF,19.0,CHF,20,20000,,,3.7353801169590644,4104.0,1745,865,650,351,493,,,,,,white,xxxxl,50,Livraison standard,6.0,false,,50,true,Quantité limitée !,CN,owiner,owiner,"85% feedback positivi (26,590 recensioni)",26590,4.0037984204588195,566a47bfe9fa8a31b3ef5141,,,https://www.wish.com/c/5b7fd1c944965a50e789c288,https://canary.contestimg.wish.com/api/webimage/5b7fd1c944965a50e789c288-medium.jpg,5b7fd1c944965a50e789c288
La Légende de Zelda Imprimé À Capuche Lumineux Hommes Femmes Coton À Capuche De Mode Casual Hommes Femmes Lumineux Hoodies Sweatshirt Tops Pull,The Legend of Zelda Printed Luminous Hoodie Men's Women Cotton Hoodie Fashion Casual Men Women Luminous Hoodies Sweatshirt Tops Pullover,15.0,CHF,26.0,CHF,16,10,,,4.101694915254237,118.0,65,24,15,4,10,,,,,,,1-xxs,50,Livraison standard,4.0,false,,50,,,CN,liminminli,liminminli,"91 % avis positifs (5,192 notes)",5192,4.290639445300462,587e175a274c414cada4f402,,,https://www.wish.com/c/5c95fa4acaedb77e3a86b8e1,https://canary.contestimg.wish.com/api/webimage/5c95fa4acaedb77e3a86b8e1-medium.jpg,5c95fa4acaedb77e3a86b8e1
Tommy Hilfiger,,,,,,,,,,,,,,,,,,,,,,,,,,,,,,,,,,,,,,,,,https://www.wish.com/c/5e8d2fcf9719ed640496768a,,5e8d2fcf9719ed640496768a
Damen Damen Kurzarm Crop Top elegant Plain Basic Tank Top Frauen Tank Party Bodycon Stretch Bandage Weste T-Shirt Damen Tunika,Women ladies Short Sleeve Crop top elegant Plain basic debardeur femme Tank Party bodycon bandage stretch Vest Tee tunique femme,17.0,CHF,17.0,CHF,18,8,,,5.0,0.0,,,,,,,,,,,black,s,50,Livraison Express,10.0,true,,50,,,CA,11368796 CANADA CORPORATION,11368796canadacorporation,"80% Positives Feedback (1,166 Bewertungen)",1166,3.9382504288164664,5ffb1f43fa8a25c707537989,,,https://www.wish.com/c/5ffdbafac98f1f9b4e7f1c2c,https://canary.contestimg.wish.com/api/webimage/5ffdbafac98f1f9b4e7f1c2c-medium.jpg,5ffdbafac98f1f9b4e7f1c2c
Damen Mode Tight Kurzarm T-Shirt Sommer Sexy Solid Color Halbkragen Tank Top Casual Tops Plus Size,Women Fashion Tight Short Sleeve T-shirt Summer Sexy Solid Color Half Collar Tank Top Casual Tops Plus Size,7.0,CHF,7.0,CHF,7,10,,,3.0,2.0,0,0,2,0,0,,,,,,green,s,50,Livraison standard,2.0,false,,50,,,CN,keidjur,keidjur,"(1,673 Bewertungen)",1673,3.8398087268380157,5d51381f933fb16c06bb9d71,,,https://www.wish.com/c/5e1549fc797fd00235672fb6,https://canary.contestimg.wish.com/api/webimage/5e1549fc797fd00235672fb6-medium.jpg,5e1549fc797fd00235672fb6
Nouveau T-Shirts Mode Femme T-Shirts Funny BASIC WITCH Letters Lettres Imprimé Chemise Casual Plus Grande Taille Tops en coton,New Fashion Women T-Shirts Funny BASIC WITCH Letters Printed Shirt Casual Plus Size Cotton Tops,8.0,CHF,44.0,CHF,8,5000,,,4.336,1500.0,913,327,159,53,48,,,,,,grey,xs,50,Livraison standard,2.0,false,,50,,,CN,one sunshine store,onesunshinestore,"90 % avis positifs (4,110 notes)",4110,4.246228710462287,583fe0646339b46c26efc18d,,,https://www.wish.com/c/5a571dd6eceb0863f464f1d1,https://canary.contestimg.wish.com/api/webimage/5a571dd6eceb0863f464f1d1-medium.jpg,5a571dd6eceb0863f464f1d1
Herbst und Winter Frauen Mode Langarm Strickoberteil Lässige Strickwaren Plus Size Bottoming Sweater Bluse,Autumn and Winter Women Fashion Long Sleeve Knit Top Casual Knitwear Plus Size Bottoming Sweater Blouse,13.0,CHF,13.0,CHF,14,10,,,4.142857142857143,21.0,11,5,3,1,1,,,,,,grey,xs,2,Livraison standard,4.0,false,,50,,,CN,"Guangzhou Stefanie co.,ltd",guangzhoustefaniecoltd,"86% Positives Feedback (11,722 Bewertungen)",11722,3.9723596655860773,5714a116b2d43a55e7824ada,,,https://www.wish.com/c/5fa0bda7f1517c4a219f784a,https://canary.contestimg.wish.com/api/webimage/5fa0bda7f1517c4a219f784a-medium.jpg,5fa0bda7f1517c4a219f784a
Sudadera con capucha para mujer Sudadera con capucha lisa Pullover Top corto corto,Ladies Hoodie Plain Hooded Sweatshirt Pullover Short Crop Top,8.0,CHF,8.0,CHF,8,5000,,,4.054954954954955,1110.0,577,233,163,58,79,,,,,,lightgrey,s,50,Livraison standard,2.0,false,,50,,,CN,Beach_Vibe,beach_dream,"(21,841 calificaciones)",21841,4.110068220319582,5b3b07d7d3db32158cdda5e2,,,https://www.wish.com/c/5bd7e31ddbedfe589f815639,https://canary.contestimg.wish.com/api/webimage/5bd7e31ddbedfe589f815639-medium.jpg,5bd7e31ddbedfe589f815639
Lace Stitching Sleeveless V Neck Loose Pullover Plus Size Women Summer Casual Tank Tops,Lace Stitching Sleeveless V Neck Loose Pullover Plus Size Women Summer Casual Tank Tops,4.0,CHF,4.0,CHF,4,10,,,5.0,0.0,,,,,,,,,,,grey,xs,2,Livraison standard,1.0,false,,50,,,CN,longfeifengwu,龙飞凤舞,"(133,356 notes)",133356,3.9481688113020788,5667f9745eec70268023940b,,,https://www.wish.com/c/603db9bf6578176248a3731a,https://canary.contestimg.wish.com/api/webimage/603db9bf6578176248a3731a-medium.jpg,603db9bf6578176248a3731a
 Plus Size S-5XL Damen Sommer Tops Freizeit V-Ausschnitt Kurzarm Shirts Damen Baumwolle Lose T-Shirt Süßigkeiten Farbe Damen Pullover Bluse, Plus Size S-5XL Women Summer Tops Casual V-Neck Short Sleeve Shirts Ladies Cotton Loose T Shirt Candy Color Lady Pullovers Blouse,6.0,CHF,6.0,CHF,6,5000,,,3.7520278099652375,863.0,372,174,147,71,99,,,,,,white,s,15,Livraison standard,2.0,false,,50,,,CN,guangzhouweishiweifushiyouxiangongsi,广州唯适唯服饰有限公司,"82% Positives Feedback (39,110 Bewertungen)",39110,3.8790079263615445,558c2cdc89d53c4005ea2920,,,https://www.wish.com/c/5cb8136006879f55b0ff0df0,https://canary.contestimg.wish.com/api/webimage/5cb8136006879f55b0ff0df0-medium.jpg,5cb8136006879f55b0ff0df0
Intimo donna fitness intimo sexy Canotta imbottita Canotta Lady floreale pizzo Bralette Crop Top,Fashion Women Fitness Underwear Sexy Camisole Padded Tank Tops  Lady Floral Lace Bralette Crop Top,4.31,CHF,19.0,CHF,4.74,10000,,,4.120473537604457,1436.0,825,272,147,71,121,,,,,,blue,,50,Livraison standard,1.0,false,,50,,,CN,Sun Sugar,sunsugar,"(6,013 valutazioni)",6013,4.310826542491269,593f5bc925c4f57281c63593,,,https://www.wish.com/c/5c3845c9b7d2d26e8b409f02,https://canary.contestimg.wish.com/api/webimage/5c3845c9b7d2d26e8b409f02-medium.jpg,5c3845c9b7d2d26e8b409f02
Womail Vintage Style ethnique hommes chemise impression en vrac coton à manches courtes col montant respirant hauts chemises hawaïennes nouveau,Womail Vintage Ethnic Style Men Shirt Printing Loose Cotton Short Sleeve Stand Collar Breathable Tops Hawaiian Shirts  New,14.0,CHF,14.0,CHF,15,10,,,4.0,22.0,13,3,2,1,3,,,,,,,xxxl,50,Livraison standard,4.0,false,,50,,,CN,feifei123,feifei123,82 % avis positifs (867 notes),867,4.021914648212226,56c70d25b7e254136d2d428a,,,https://www.wish.com/c/5e19c55fb2b3a6155820032c,https://canary.contestimg.wish.com/api/webimage/5e19c55fb2b3a6155820032c-medium.jpg,5e19c55fb2b3a6155820032c
"Je m'en fiche, je suis un tshirt chemise licorne licorne",Mir egal ich bin ein Einhorn Unicorn Shirt Tshirt top,18.0,CHF,18.0,CHF,19.36,10,,,4.177777777777778,45.0,26,7,9,0,3,,,,,,,xs,50,Livraison Express,15.32,true,,50,,,DE,Shirtbude,shirtbude,"95 % avis positifs (1,901 notes)",1901,4.5917937927406625,59f730029aee090a5e84e158,,,https://www.wish.com/c/5a0959bc7b584e6642e9b53b,https://canary.contestimg.wish.com/api/webimage/5a0959bc7b584e6642e9b53b-medium.jpg,5a0959bc7b584e6642e9b53b
Moda donna 3 colori Maglione lavorato a maglia spesso Dolcevita da donna Colore puro lavorato a maglia Sottile Autunno Inverno Crop Top Maglione Casual Maglione a maniche lunghe caldo Collo carino Maglione pullover Maglioni di cardigan di cotone Stile punk Canotta taglie forti,Women's Fashion 3 Color Thicken Knitted Sweater Women Turtleneck Pure Color Knitted Slim Autumn Winter Crop Top Sweater Casual  Warm Long Sleeve Sweater Cute Collar Pullover Sweater Cotton Cardigan Sweaters Punk Style Plus Size Tank Top,19.0,CHF,19.0,CHF,20,10000,,,3.5905044510385755,674.0,258,133,124,67,92,,,,,,black,xl,50,Livraison standard,6.0,false,,50,,,CN,maleibss,maleibss,"(38,405 valutazioni)",38405,4.125999218851712,58b26461373409504d3d4c89,,,https://www.wish.com/c/5a00309359835126a69f8941,https://canary.contestimg.wish.com/api/webimage/5a00309359835126a69f8941-medium.jpg,5a00309359835126a69f8941
New Women's Fashion V Neck Blouse Diamonds Printed Tops Short Sleeve Sexy Zipper T-Shirt Slim Fit Blouses Tops,New Women's Fashion V Neck Blouse Diamonds Printed Tops Short Sleeve Sexy Zipper T-Shirt Slim Fit Blouses Tops,7.0,CHF,63.0,CHF,7,10,,,4.0,2.0,1,0,1,0,0,,,,,,burgundy,xs,1,Livraison standard,2.0,false,,50,,,CN,Yangxiaoxi22,yangxiaoxi22,(89 ratings),89,4.078651685393258,5e6da32729e7862200ddb950,,,https://www.wish.com/c/6052cde1733308d13ae89d9e,https://canary.contestimg.wish.com/api/webimage/6052cde1733308d13ae89d9e-medium.jpg,6052cde1733308d13ae89d9e
2018 Sommermode Damen Tank Tops Sexy Frauen Ärmellos Crop Tops Casual Style Frauen Baumwolle Druck Spitze Stickerei Unregelmäßige Bluse Tops（S-5XL),2018 Summer Fashion Women Tank Tops Sexy Women Sleeveless Crop Tops Casual Style Women Cotton Print Lace Stitching Irregular Blouse Tops（S-5XL),5.32,CHF,6.0,CHF,5.85,50000,,,4.40939853727759,18322.0,12125,3334,1712,541,610,,,,,,green,s,1,Livraison standard,1.0,false,,50,true,Quantité limitée !,CN,hellohorse est un vendeur agréé,hellohorse,"(134,870 Bewertungen)",134870,4.137799362348929,58ad449708de0c6dc59d9e06,,,https://www.wish.com/c/5ad987d8918dae087d633040,https://canary.contestimg.wish.com/api/webimage/5ad987d8918dae087d633040-medium.jpg,5ad987d8918dae087d633040
Chemise décontractée décontractée à imprimé bohème avec haut tribal lâche pour femmes,Women Fashion Loose Tribal Top Boho Print Batwing Casual Shirt,11.0,CHF,11.0,CHF,12,10,,,3.772727272727273,22.0,8,7,3,2,2,,,,,,stripe,s,50,Livraison standard,3.0,false,,50,true,Quantité limitée !,CN,luanxianxian,luanxianxian,89 % avis positifs (797 notes),797,4.1769134253450435,5a3782cf028bbd2128566ab1,,,https://www.wish.com/c/5f168fa0d3f9b90694bd5f19,https://canary.contestimg.wish.com/api/webimage/5f168fa0d3f9b90694bd5f19-medium.jpg,5f168fa0d3f9b90694bd5f19
streetwear mode froncé vert femmes débardeur Sexy haut femme femmes crop top gothique Camis décontracté,streetwear Fashion Ruched Green Women Tank Top Sexy haut femme Women crop top gothic Camis Casual,14.0,CHF,32.0,CHF,14.51,9,,,5.0,0.0,,,,,,,,,,,black,s,50,Livraison standard,7.27,false,,50,,,ES,Madrid Modas Fashion,madridmodasfashion,100 % avis positifs (14 notes),14,4.642857142857143,5f842b3253268b99cced7627,,,https://www.wish.com/c/5feb69dfdfba2254a37ec538,https://canary.contestimg.wish.com/api/webimage/5feb69dfdfba2254a37ec538-medium.jpg,5feb69dfdfba2254a37ec538
Neue Harajuku Leopard Lips Shut Up Letters Gedruckte Frauen Schwarze T-Shirts Casual Tops Sommermode Kurzarm Weibliches T-Shirt,New Harajuku Leopard Lips Shut Up Letters Printed Women Black T-shirts Casual Tops Summer Fashion Short Sleeve Female T Shirt,8.0,CHF,55.0,CHF,8,10,,,4.471698113207547,53.0,37,8,5,2,1,,,,,,white,s,50,Livraison standard,2.0,false,,50,,,CN,jgde,jgde,"(1,221 Bewertungen)",1221,4.413595413595414,5aa3c577a6f62e7b166c771d,,,https://www.wish.com/c/5f292cd03eee7e0b44e8774e,https://canary.contestimg.wish.com/api/webimage/5f292cd03eee7e0b44e8774e-medium.jpg,5f292cd03eee7e0b44e8774e
New Summer Fashion Damen Bodysuit Sexy Spitzenhemd Durchsichtig Lässig Slim Fit Tops Plus Size Kurzarm Tiefes V-Ausschnitt Temperament Top Size S-5XL,New Summer Fashion Women Bodysuit  Sexy Lace Shirt See-through Casual Slim Fit Tops Plus Size Short Sleeve Deep V-neck Temperament Top Size S-5XL,5.22,CHF,45.0,CHF,5.75,10,,,4.043478260869565,23.0,14,3,1,3,2,,,,,,yellow,xs,7,Livraison standard,2.0,false,,50,,,CN,xujiao0802,xujiao0802,"(6,173 Bewertungen)",6173,4.023489389275879,5811f5a29c30df4dc0b6b13a,,,https://www.wish.com/c/5e830c270f171e4a815ee397,https://canary.contestimg.wish.com/api/webimage/5e830c270f171e4a815ee397-medium.jpg,5e830c270f171e4a815ee397
Frauen Deep V-Ausschnitt Sexy Female Camisole BH Baumwoll-BH Solid Crop Top Unterwäsche Push-up Verdickung BH Beach Wear,Women Deep V-neck Sexy Female Camisole Bra Cotton Bra Solid Crop Top Underwear Push-up Thickening Bra Beach Wear,4.24,CHF,5.0,CHF,4.67,1000,,,4.25531914893617,141.0,83,30,16,5,7,,,,,,white,,50,Livraison standard,1.0,false,,50,,,CN,trendy_world,shanghailalanginternationaltradecoltd,"(346,498 Bewertungen)",346498,4.071769534023284,53f2beb39020ee03566d6e18,,,https://www.wish.com/c/5eaa4f6d9bae792edba76ece,https://canary.contestimg.wish.com/api/webimage/5eaa4f6d9bae792edba76ece-medium.jpg,5eaa4f6d9bae792edba76ece
Plus Size Damenmode Loose Casual Blumendruck mit kurzen Ärmeln Aushöhlen von Sommerhemden,Plus Size Women's Fashion Loose Casual Floral print short sleeves Hollow out Summer shirt tops,10.0,CHF,10.0,CHF,11,1000,,,3.9790794979079496,239.0,127,41,31,19,21,,,,,,purple,s,50,Livraison standard,3.0,false,,50,,,CN,hzruanyf,hzruanyf,"81% Positives Feedback (5,650 Bewertungen)",5650,3.8761061946902653,5bd29797d32ed5241007af46,,,https://www.wish.com/c/5eed99a7d14e221d2fd139cf,https://canary.contestimg.wish.com/api/webimage/5eed99a7d14e221d2fd139cf-medium.jpg,5eed99a7d14e221d2fd139cf
Moda donna casual stile bohemien manica lunga off-the-spalla stampa floreale top camicetta estiva allentato camicia da spaghetti spaghetti plus size S-5XL abbigliamento donna,Women Fashion Casual Bohemian Style Long Sleeve Off-the-shoulder Floral Print Top Blouse Summer Loose Spaghetti Strap Shirt Plus Size S-5XL Women Clothes,10.0,CHF,22.0,CHF,11,10,,,3.2388059701492535,67.0,22,12,10,6,17,,,,,,red,m,50,Livraison standard,2.0,false,,50,,,CN,Logenway,logenway,79% feedback positivi (344 recensioni),344,3.7180232558139537,5dc791b08218aa3b06641798,,,https://www.wish.com/c/5ec5df6ca7c93c0e40f35be3,https://canary.contestimg.wish.com/api/webimage/5ec5df6ca7c93c0e40f35be3-medium.jpg,5ec5df6ca7c93c0e40f35be3
Muyogrt Casaul survêtement femmes 2 pièces ensemble haut et pantalon Satin rayé Patchwork fermeture éclair Sexy sweat survêtement,Muyogrt Casaul Tracksuit Women 2 Piece Set Top And Pants Satin Striped Patchwork Zipper Sexy Sweatshirt Sweat Suit,28.0,CHF,28.0,CHF,30.0,8,,,5.0,0.0,,,,,,,,,,,green,s,50,Livraison standard,0.0,false,,50,,,CA,Loom,loom,81 % avis positifs (403 notes),403,4.054590570719603,60108516d38ac0468d48a860,,,https://www.wish.com/c/601817f082b0b74f4969f6e0,https://canary.contestimg.wish.com/api/webimage/601817f082b0b74f4969f6e0-medium.jpg,601817f082b0b74f4969f6e0
Damenmode Kleidung Herbst Winter Lässig Langarm T-Shirts Schulterfrei Lose Bluse Damen Baumwolle bedruckte Schädelhemden Plus Size Tops,Womens Fashion Clothing Autumn Winter Casual Long Sleeved T-shirts Off Shoulder Loose Blouse Ladies Cotton Printed Skull Shirts Plus Size Tops,7.0,CHF,7.0,CHF,7,1000,,,3.88,125.0,64,15,24,11,11,,,,,,white,xs,28,Livraison standard,2.0,false,,50,,,CN,zktrade.co.ltd,zktradecoltd,"86% Positives Feedback (15,914 Bewertungen)",15914,4.0428553474927735,5810b1db3deb94160f5cd4a3,,,https://www.wish.com/c/5f7ffe7607f7370f47e5df1c,https://canary.contestimg.wish.com/api/webimage/5f7ffe7607f7370f47e5df1c-medium.jpg,5f7ffe7607f7370f47e5df1c
4 Styles Men Teens Cartoon Japanese Anime Naruto 3D Print Hoodies Fashion Akatsuki Cloud Logo Print Long Sleeves Hooded Loose Sweatshirt Pullover Tops,4 Styles Men Teens Cartoon Japanese Anime Naruto 3D Print Hoodies Fashion Akatsuki Cloud Logo Print Long Sleeves Hooded Loose Sweatshirt Pullover Tops,13.0,CHF,13.0,CHF,14,10,,,3.7794117647058822,68.0,32,14,7,5,10,,,,,,black,2xs,50,Livraison standard,4.0,false,,50,true,Quantité limitée !,CN,adfhjgasd,adfhjgasd,86% Positive Feedback (71 ratings),71,4.056338028169014,5ee46b971ac2c11ca1ef93b5,,,https://www.wish.com/c/5f964aaccf58bf003b25e17c,https://canary.contestimg.wish.com/api/webimage/5f964aaccf58bf003b25e17c-medium.jpg,5f964aaccf58bf003b25e17c
"Mode féminine décontractée lâche épaule froide hauts à manches longues et chemisiers T-shirts de base, plus la taille S-5XL",Women's Fashion Casual Loose Cold Shoulder Long Sleeve Tops and Blouses Basic T Shirts Plus size S-5XL ,4.4,CHF,5.0,CHF,4.84,5000,,,4.0076726342711,782.0,394,162,122,46,58,,,,,,black,xxs,1,Livraison standard,1.0,false,,50,true,Quantité limitée !,CN,Swan21,swan21,"91 % avis positifs (17,572 notes)",17572,4.300022763487366,58c78041e11cf251087b7587,,,https://www.wish.com/c/5d5b86239c7ec6301f638c38,https://canary.contestimg.wish.com/api/webimage/5d5b86239c7ec6301f638c38-medium.jpg,5d5b86239c7ec6301f638c38
NOUVELLES Automne Et Hiver Femmes Mode Plus La Taille À Manches Longues Chandails Tricotés Couleur Unie Pull Tops,NEW Autumn And Winter Women Fashion Plus Size Long Sleeve Knitted Sweaters Solid Color Pullover Tops,5.29,CHF,6.0,CHF,5.82,10000,,,3.8732083792723264,1814.0,883,351,249,129,202,,,,,,brown,xs,50,Livraison standard,2.0,false,,50,true,Quantité limitée !,CN,dikongge20699kaifang,dikongge20699kaifang,"88 % avis positifs (2,872 notes)",2872,4.147980501392758,5b417fc47d9ee31838c5d699,,,https://www.wish.com/c/5d9eaaf2bb5dd05e8c11d743,https://canary.contestimg.wish.com/api/webimage/5d9eaaf2bb5dd05e8c11d743-medium.jpg,5d9eaaf2bb5dd05e8c11d743
Mode d'été Femmes À Manches Courtes U-cou Slim T-shirt Style Décontracté Coton Pull Femmes Mode Tee Plus La Taille Blouse Tops Tee,Summer Fashion Women Short Sleeve U-neck Slim T-shirt Casual Style Cotton Pullover Women Fashion Tee Plus Size Blouse Tops Tee,7.0,CHF,7.0,CHF,7,10000,,,3.75852534562212,1085.0,503,199,145,94,144,,,,,,winered,l,50,Livraison standard,2.0,false,,50,,,CN,Pure Fashion,purefashionltd,"92 % avis positifs (218,414 notes)",218414,4.33474044704094,5cb636dda7173671aedef051,,,https://www.wish.com/c/5d15731024c17f6b8b9bd97a,https://canary.contestimg.wish.com/api/webimage/5d15731024c17f6b8b9bd97a-medium.jpg,5d15731024c17f6b8b9bd97a
Damenmode Blumendruck Off Schulter Top Bluse Knoten Krawatte Front Chiffon Shirt Flare Sleeve Tops,Women's Fashion Floral Print Off Shoulder Top Blouse Knot Tie Front Chiffon Shirt Flare Sleeve Tops,7.0,CHF,7.0,CHF,7,10,,,3.5945945945945947,37.0,16,5,7,3,6,,,,,,apricot,xs,1,Livraison standard,2.0,false,,50,,,CN,liuhong1653,liuhong1653,79% Positives Feedback (417 Bewertungen),417,3.788968824940048,5ddb6970a0371367d27f4b2a,,,https://www.wish.com/c/5e09c81db99e3c56fe2e3445,https://canary.contestimg.wish.com/api/webimage/5e09c81db99e3c56fe2e3445-medium.jpg,5e09c81db99e3c56fe2e3445
NOUVEAU mode BOB MARLEY cool designe 3D imprimé t-shirt hommes / femmes bonne qualité hauts t-shirt décontracté,NEW fashion BOB MARLEY cool designe 3D Printed  t shirt Men/Women Good Quality Tops casual t shirt,9.0,CHF,9.0,CHF,9,10,,,3.824561403508772,57.0,28,11,7,2,9,,,,,,green,xs,50,Livraison standard,3.0,false,,50,,,CN,haizixuxu,haizixuxu,"88 % avis positifs (5,605 notes)",5605,4.123818019625334,5b6bc903dd0e31378eb81d66,,,https://www.wish.com/c/5e4dfeb8bfb54418800249f4,https://canary.contestimg.wish.com/api/webimage/5e4dfeb8bfb54418800249f4-medium.jpg,5e4dfeb8bfb54418800249f4
Good Vibes Shirt Summer Shirt Rainbow Shirt Rainbow Pattern Shirt Letter Print Shirt Round Neck Short Sleeve Shirt Splicing Shirt Solid Color Cotton Shirt Slim Fit Top Plus Size S-5XL,Good Vibes Shirt Summer Shirt Rainbow Shirt Rainbow Pattern Shirt Letter Print Shirt Round Neck Short Sleeve Shirt Splicing Shirt Solid Colour Cotton Shirt Slim Fit Top Plus Size S-5XL,11.0,CHF,100.0,CHF,12,1000,,,3.989051094890511,274.0,149,47,29,24,25,,,,,,yellow,s,50,Livraison standard,3.0,false,,50,true,Quantité limitée !,CN,wangjiangxu,wangjiangxu,"84 % avis positifs (8,921 notes)",8921,3.9782535590180474,58311e2257e86a1b8863f74c,,,https://www.wish.com/c/5eafcf8a1f07813cd5404b52,https://canary.contestimg.wish.com/api/webimage/5eafcf8a1f07813cd5404b52-medium.jpg,5eafcf8a1f07813cd5404b52
Hauts pour femmes chemisier imprimé à bretelles cou Ombre t-shirt robe décontracté coloré à demi manches grande taille XS-8XL,Womens Tops Blouse Printed Strappy Neck Ombre T Shirt Dress Casual Colorful Half Sleeved Plus Size XS-8XL,3.0,CHF,3.0,CHF,3,10,,,4.411764705882353,34.0,22,8,2,0,2,,,,,,red,sizexs,2,Livraison standard,1.0,false,,50,,,CN,Unforgettable fashion store(factory price),unforgettablefashionstorefactoryprice,"87 % avis positifs (7,369 notes)",7369,4.11371963631429,55311a071a8a220c1b804371,,,https://www.wish.com/c/5fbd1374049eea666802f684,https://canary.contestimg.wish.com/api/webimage/5fbd1374049eea666802f684-medium.jpg,5fbd1374049eea666802f684
Été 2020 à la mode des femmes de couleur unie gilet sans manches licou haut col en V,Summer 2020 Fashionable Women's Solid Color Vest Sleeveless Halter V-Neck Top,6.0,CHF,18.0,CHF,6,1000,,,3.491228070175439,57.0,22,9,11,5,10,,,,,,armygreen,s,50,Livraison standard,2.0,false,,50,true,Quantité limitée !,CN,happyshoooping,happyshoooping,"85 % avis positifs (42,703 notes)",42703,4.011591691450249,56c6f731bc435416ed5984d7,,,https://www.wish.com/c/5eb4dc86fbecd61a46ed6737,https://canary.contestimg.wish.com/api/webimage/5eb4dc86fbecd61a46ed6737-medium.jpg,5eb4dc86fbecd61a46ed6737
