title,title_orig,discount_price,discount_price_currency,retail_price,retail_price_currency,discount_price_in_original_currency,nb_cart_orders_approx,nb_units_purchased_approx,uses_ad_boosts,rating,rating_count,rating_five_count,rating_four_count,rating_three_count,rating_two_count,rating_one_count,badges_count,badge_local_product,badge_product_quality,badge_fast_shipping,tags,product_color,product_variation_size_id,product_variation_inventory,shipping_option_name,shipping_option_price,shipping_is_express,countries_shipped_to,inventory_total,has_urgency_banner,urgency_text,origin_country,merchant_title,merchant_name,merchant_info_subtitle,merchant_rating_count,merchant_rating,merchant_id,merchant_has_profile_picture,merchant_profile_picture,product_url,product_picture,product_id
Femmes Automne Imprimé Col V Profond À Manches Longues Pull Chemise Casual Lâche Cordon De Chemise Tops,Women's Autumn Printed Deep  V-neck Long Sleeve Pullover Shirt Casual Loose Drawstring Shirt Tops,4.37,CHF,5.0,CHF,4.8100000000000005,1000,,,3.3006872852233675,582.0,189,112,95,57,129,,,,,,green,xs,7,Livraison standard,1.0,false,,50,,,CN,King Wolf,kingwolf,"84 % avis positifs (2,333 notes)",2333,3.9948564080582942,5b4ed83fb5c4c418f10d4042,,,https://www.wish.com/c/5d46a5545c23b235f98a2850,https://canary.contestimg.wish.com/api/webimage/5d46a5545c23b235f98a2850-medium.jpg,5d46a5545c23b235f98a2850
Mode féminine col rond manches longues arc creux Tops Pull Lady Pull,Women's Fashion Round Neck Long Sleeve Hollow Bow Tops Pullover Lady Sweater,13.0,CHF,13.0,CHF,14,10,,,3.473684210526316,19.0,7,4,3,1,4,,,,,,black,s,50,Livraison standard,4.0,false,,50,true,Quantité limitée !,CN,Chinese style_GQ,chinesestyle_gq,"90 % avis positifs (21,856 notes)",21856,4.255627745241581,590189980094b829518713b8,,,https://www.wish.com/c/5be166394639cb1a9eea5a9e,https://canary.contestimg.wish.com/api/webimage/5be166394639cb1a9eea5a9e-medium.jpg,5be166394639cb1a9eea5a9e
2017 Novas Mulheres Camiseta Curta Moda Verão Sexy Oco Out Manga Curta Casual Harajuku Top Colheita Rosa Bordado Camisetas Femme,2017 New Women Short T Shirt Summer Fashion Sexy Hollow Out Short Sleeve Casual Harajuku Crop Top Rose Embroidery T-shirts Femme,5.23,CHF,6.0,CHF,5.76,5000,,,4.101101749837978,1543.0,794,360,219,91,79,,,,,,yellow,xs,50,Livraison standard,1.0,false,,50,,,CN,Victory Vivi,victoryvivi,"(18,357 avaliações)",18357,4.157433131775345,5911298c2da1ba73760c951d,,,https://www.wish.com/c/5957679c61802978aa663553,https://canary.contestimg.wish.com/api/webimage/5957679c61802978aa663553-medium.jpg,5957679c61802978aa663553
Cryptographic Solid Sexy Backless One Shoulder Crop Tops für Damenmode New Summer Cut-Out Cropped Feminino Tops Streetwear,Cryptographic Solid Sexy Backless One Shoulder Crop Tops for Women Fashion New Summer Cut-Out Cropped Feminino Tops Streetwear,26.0,CHF,26.0,CHF,28,1,,,5.0,0.0,,,,,,,,,,,black,s,50,Livraison standard,13.0,false,,50,,,CA,11368796 CANADA CORPORATION,11368796canadacorporation,"80% Positives Feedback (1,166 Bewertungen)",1166,3.9382504288164664,5ffb1f43fa8a25c707537989,,,https://www.wish.com/c/60002f9b941c338362955ff3,https://canary.contestimg.wish.com/api/webimage/60002f9b941c338362955ff3-medium.jpg,60002f9b941c338362955ff3
Angriff auf Titan Hoodie Herren Mode Loose Pullover Casaul Tops Übergroße Hoodie Sweatshirts,Attack on Titan Hoodie Men Fashion Loose Pullovers Casaul Tops Oversize Hoodie Sweatshirts,16.0,CHF,16.0,CHF,17,10,,,4.3076923076923075,13.0,8,2,2,1,0,,,,,,black,s,50,Livraison standard,5.0,false,,50,true,Quantité limitée !,VE,daniloburguer,daniloburguer,(117 Bewertungen),117,3.8376068376068377,5dc7fcb3ff832c41809bef53,,,https://www.wish.com/c/5ffc01e479bff0a5a8608729,https://canary.contestimg.wish.com/api/webimage/5ffc01e479bff0a5a8608729-medium.jpg,5ffc01e479bff0a5a8608729
Nova moda legal de verão sexy manga curta manga curta tops de algodão estampado camiseta feminina solta camisetas casuais plus size,New Cool Summer Fashion Sexy Off Shoulder Short Sleeve Cotton Tops Print T-shirt Women Loose Casual Tees Plus Size,6.0,CHF,28.0,CHF,6,10,,,4.214285714285714,14.0,10,1,0,2,1,,,,,,pink,s,50,Livraison standard,2.0,false,,50,true,Quantité limitée !,CN,SHOPWNMON,shopwnmon,"(3,254 avaliações)",3254,4.087584511370621,5dda41a275cf541cc0b6cf99,,,https://www.wish.com/c/5f0197fc1a2a2506e376cd24,https://canary.contestimg.wish.com/api/webimage/5f0197fc1a2a2506e376cd24-medium.jpg,5f0197fc1a2a2506e376cd24
البلوزات العرقية خمر الأبيض الأزهار المطرزة للنساء فضفاض نصف فانوس كم قميص المرأة القطن الكتان بلوزة عادية Blusas,Ethnic Vintage White Floral Embroidered Blouses for Women Loose Half Lantern Sleeve Shirt Women Cotton Linen Top Casual Blusas       ,14.0,CHF,14.0,CHF,15,10,,,3.6027397260273974,73.0,30,16,10,2,15,,,,,,white,onesize,50,Livraison standard,4.0,false,,50,true,Quantité limitée !,CN,Selling-goods,sellinggoods,(تقييمات 767),767,4.417209908735332,577b10d27f1b507484866d6f,,,https://www.wish.com/c/5ce6439bcd872c5542cde2d5,https://canary.contestimg.wish.com/api/webimage/5ce6439bcd872c5542cde2d5-medium.jpg,5ce6439bcd872c5542cde2d5
Acquista Magliette A Maniche Corte Stampate Da Donna Primavera Ed Estate Camicie Casual Con Bottoni Girocollo Da Donna Plus Size Camicetta Di Cotone S-5XL,2020 Spring And Summer Women's Printed Short Sleeve Tops Ladies Round Neck Button Casual Shirts Plus Size Cotton Blouse S-5XL,7.0,CHF,7.0,CHF,7,1000,,,4.090909090909091,154.0,79,36,20,12,7,,,,,,blue,s,50,Livraison standard,2.0,false,,50,,,CN,laibingo666,laibingo666,"82% feedback positivi (2,336 recensioni)",2336,3.932791095890411,5d4ff4193db43e3f297ee02e,,,https://www.wish.com/c/5eb7fe9fc9cf4411c0e1c3c7,https://canary.contestimg.wish.com/api/webimage/5eb7fe9fc9cf4411c0e1c3c7-medium.jpg,5eb7fe9fc9cf4411c0e1c3c7
Été femmes gilet ample imprimé décontracté imprimé étoile gilet hauts sans manches camisole grande taille débardeurs,Summer Women Loose Vest Printed Casual Star Print Vest Tops Sleeveless Camisole Plus Size Tank Tops,9.0,CHF,9.0,CHF,9,1000,,,4.004405286343612,227.0,122,44,24,14,23,,,,,,blue,xs,50,Livraison standard,3.0,false,,50,,,CN,pan-emily,panemily,"81 % avis positifs (6,282 notes)",6282,3.871378541865648,5b1522ab7b94e12ee3d455c9,,,https://www.wish.com/c/5e99687262374f585868ad95,https://canary.contestimg.wish.com/api/webimage/5e99687262374f585868ad95-medium.jpg,5e99687262374f585868ad95
Chemises décontractées à manches longues pour femmes,Women's Long Sleeve Tops V Neck Casual Shirt Flowy Print Shirt Tops,12.0,CHF,12.0,CHF,13,1000,,,3.9047619047619047,588.0,285,109,99,43,52,,,,,,white&black,s,50,Livraison standard,3.0,false,,50,,,CN,GGSCF,ggscf,87 % avis positifs (807 notes),807,4.083023543990087,5d635bc027367861a9ad6953,,,https://www.wish.com/c/5d8d83c25a11665153c78a34,https://canary.contestimg.wish.com/api/webimage/5d8d83c25a11665153c78a34-medium.jpg,5d8d83c25a11665153c78a34
Gilet d'été Halter Crop Tops Casual Sexy Butterfly Print Tops Blancs,Summer Vest  Halter Crop Tops Casual Sexy Butterfly Print Sleeveless White Tops,6.0,CHF,6.0,CHF,6,10,,,4.611111111111111,54.0,40,8,5,1,0,,,,,,yellow,s,50,Livraison standard,2.0,false,,50,true,Quantité limitée !,CN,qinziten,qinziten,"93 % avis positifs (3,520 notes)",3520,4.401988636363637,5b3daf691c89532f58b682fb,,,https://www.wish.com/c/5e9d3a874497c2130f8889da,https://canary.contestimg.wish.com/api/webimage/5e9d3a874497c2130f8889da-medium.jpg,5e9d3a874497c2130f8889da
T-shirt à manches courtes pour femmes élégant d'été à lacets hauts imprimé grande taille chemise chemisier XS-5XL,Short Sleeve Women's T Shirt Elegant Summer Lace Up Tops Print Plus Size Shirt Blouse XS-5XL,6.0,CHF,6.0,CHF,6,10,,,4.254237288135593,59.0,36,11,7,1,4,,,,,,black,xs,6,Livraison standard,2.0,false,,50,true,Quantité limitée !,CN,chaoyang_lulixiang,chaoyang_lulixiang,86 % avis positifs (270 notes),270,4.062962962962963,5e61fdfe48e46d19169a5659,,,https://www.wish.com/c/5ed9caaca4ab8c1e211e66f7,https://canary.contestimg.wish.com/api/webimage/5ed9caaca4ab8c1e211e66f7-medium.jpg,5ed9caaca4ab8c1e211e66f7
2020 néon tops femme fluorescence couleur courte rosée nombril camisole sexy tops streetwear entraînement bralette streetwear crop top,2020 neon tops Woman Fluorescence Color Short Dew Navel Camisole sexy tops streetwear workout bralette streetwear  crop top,18.0,CHF,18.0,CHF,19,0,,,5.0,0.0,,,,,,,,,,,green,s,50,Livraison Express,11.0,true,,50,,,CA,11368796 CANADA CORPORATION,11368796canadacorporation,"80 % avis positifs (1,166 notes)",1166,3.9382504288164664,5ffb1f43fa8a25c707537989,,,https://www.wish.com/c/5ffdd221e34748b8f61f9d9a,https://canary.contestimg.wish.com/api/webimage/5ffdd221e34748b8f61f9d9a-medium.jpg,5ffdd221e34748b8f61f9d9a
Mode Femmes Sexy Épaule Épaule Manches Courtes Casual Top T-Shirt Blouse,Fashion Women Sexy OFF Shoulder Short Sleeve Casual Top T-Shirt Blouse,6.0,CHF,6.0,CHF,6,10,,,4.485148514851486,101.0,74,12,9,2,4,,,,,,white&black,xs,50,Livraison standard,2.0,false,,50,,,CN,1032094907,1032094907,(89 notes),89,4.50561797752809,5ece2e061e45033e429a69c3,,,https://www.wish.com/c/5edd9de4ab01de5c8901a874,https://canary.contestimg.wish.com/api/webimage/5edd9de4ab01de5c8901a874-medium.jpg,5edd9de4ab01de5c8901a874
Novas roupas femininas blusa de chiffon de crochê de renda feminina camisetas coreanas femininas blusas tops camiseta branca blusas slim fit tops,New Women Clothing Chiffon Blouse Lace Crochet Female Korean Shirts Ladies Blusas Tops Shirt White Blouses slim fit Tops,14.0,CHF,14.0,CHF,15.0,1,,,5.0,0.0,,,,,,,,,,,black,s,50,Livraison standard,0.0,false,,50,,,CA,Loom,loom,(403 avaliações),403,4.054590570719603,60108516d38ac0468d48a860,,,https://www.wish.com/c/601acdf755ebb90044015279,https://canary.contestimg.wish.com/api/webimage/601acdf755ebb90044015279-medium.jpg,601acdf755ebb90044015279
Mode 3D aigle imprimé t-shirts unisexe hommes femmes printemps Sunmer décontracté col rond manches courtes Sport hauts XS-5XL,Fashion 3D Eagle Printed T Shirts Unisex Men Women Spring Sunmer Casual Round Neck Short Sleeves Sport Tops XS-5XL,4.0,CHF,4.0,CHF,4,10,,,4.25,24.0,14,6,2,0,2,,,,,,brown,xs,1,Livraison standard,1.0,false,,50,,,CN,wushuai123,wushuai123,72 % avis positifs (538 notes),538,3.54275092936803,5de0adc9555a1905409b581a,,,https://www.wish.com/c/5fdc444430be02fbb4fbbf08,https://canary.contestimg.wish.com/api/webimage/5fdc444430be02fbb4fbbf08-medium.jpg,5fdc444430be02fbb4fbbf08
Crop top da donna con scollo a V e scollo a V a righe da donna Fahsion,Fahsion Women&#39;s V Neck Striped Camisole Crop Tops,5.25,CHF,9.0,CHF,5.78,10000,,,4.089026915113871,2898.0,1503,654,417,144,180,,,,,,whitestripe,s,5,Livraison standard,1.0,false,,50,,,CN,tianjianyingfeng,tianjianyingfeng,"(12,993 valutazioni)",12993,4.2699915339028705,5ad31267ea8764621df718c0,,,https://www.wish.com/c/5b10c4ef431b7342aadace18,https://canary.contestimg.wish.com/api/webimage/5b10c4ef431b7342aadace18-medium.jpg,5b10c4ef431b7342aadace18
ZANZEA Mulheres Camiseta Casual Solto Algodão Linho Blusas Manga Curta Plissado Assimétrico Tops Tee Plus Size,ZANZEA Women T Shirt Casual Loose Cotton Linen Blouses Short Sleeve Asymmetric Ruffle Tops Tee Plus Size,13.0,CHF,18.0,CHF,14,10,,,4.306451612903226,62.0,39,11,8,0,4,,,,,,white,s,50,Livraison standard,3.0,false,,50,,,CN,hotsale201510,hotsale201510,"89% Feedback positivo (41,315 avaliações)",41315,4.149969744644802,562eeb5541618e0fd77bb502,,,https://www.wish.com/c/5eb3d8f8fa5bbb0ca4ddc1e1,https://canary.contestimg.wish.com/api/webimage/5eb3d8f8fa5bbb0ca4ddc1e1-medium.jpg,5eb3d8f8fa5bbb0ca4ddc1e1
 Frauen Sommer Sexy Tops Off Schulterhemden Tank Tops Lässig lose ärmellose T-Shirts rückenfreie Leibchen Sonnenblume gedruckt Hollow Out Halfter Weste, Women Summer Sexy Tops Off Shoulder Shirts Tank Tops Casual Loose Sleeveless T-Shirts Backless Camisole Sunflower Printed Hollow Out Halter Vest,8.0,CHF,8.0,CHF,8,10,,,4.27906976744186,43.0,25,10,5,1,2,,,,,,white,s,50,Livraison standard,2.0,false,,50,,,CN,hhehhwwwm,hhehhwwwm,"88% Positives Feedback (18,234 Bewertungen)",18234,4.1607436656795,5acf025667d25c3ae4907111,,,https://www.wish.com/c/5ee31311b260ba5bc1cfe3c5,https://canary.contestimg.wish.com/api/webimage/5ee31311b260ba5bc1cfe3c5-medium.jpg,5ee31311b260ba5bc1cfe3c5
Mode féminine à lacets sans manches Tube Top été à volants cordon de serrage Crop Top Slim Fit Cami débardeur confortable Camisole gilet grande taille,Women's Fashion Laced Sleeveless Tube Top Summer Ruffle Drawstring Crop Top Slim Fit Cami Tank Top Comfy Camisole Vest Plus Size,8.0,CHF,8.0,CHF,8,1000,,,3.826923076923077,52.0,31,5,2,4,10,,,,,,black,s,50,Livraison standard,2.0,false,,50,,,CN,sunnygee,sunnygee,"83 % avis positifs (36,371 notes)",36371,3.9211184735091145,58db84154f0c6b53626b73ac,,,https://www.wish.com/c/5ed5e9151731b03ee338d0d5,https://canary.contestimg.wish.com/api/webimage/5ed5e9151731b03ee338d0d5-medium.jpg,5ed5e9151731b03ee338d0d5
ArtSu rouge noir blanc chaîne en métal sans manches haut court Sexy Clubwear femmes réglable à lacets évider débardeurs t-shirts Camisole,ArtSu Red Black White Metal Chain Sleeveless Crop Top Sexy Clubwear Women Adjustable Lace Up Hollow Out Tank Tops Tees Camisole,10.0,CHF,10.0,CHF,11,10,,,4.466666666666667,15.0,11,2,1,0,1,,,,,,red,xs,9,Livraison standard,2.0,false,,50,true,Quantité limitée !,CN,chuxinmile,chuxinmile,"85 % avis positifs (4,382 notes)",4382,4.00114103149247,5947799a2eac1104f22e4486,,,https://www.wish.com/c/5ed0a84b45339b46a29b9b8e,https://canary.contestimg.wish.com/api/webimage/5ed0a84b45339b46a29b9b8e-medium.jpg,5ed0a84b45339b46a29b9b8e
S-5XL femmes O cou loisirs 3/4 manches Blouse hauts haut bas chemises en lin chemise solide hauts grande taille t,S-5XL Damen O Neck Freizeit 3/4 Arm Bluse Tops Hoch niedrig Linen Shirts Hemd Solid Tops Plus Size Tee,12.0,CHF,13.0,CHF,13,10,,,3.4,10.0,4,1,2,1,2,,,,,,navy,s,50,Livraison standard,3.0,false,,50,true,Quantité limitée !,CN,AchatImmediat,achatimmediat,"(12,307 notes)",12307,4.21231819289835,58afdeae9bfc1c063fed3118,,,https://www.wish.com/c/5d12ef13dddb7165d565cc3f,https://canary.contestimg.wish.com/api/webimage/5d12ef13dddb7165d565cc3f-medium.jpg,5d12ef13dddb7165d565cc3f
malino,,,,,,,,,,,,,,,,,,,,,,,,,,,,,,,,,,,,,,,,,https://www.wish.com/c/5e8d2fe29719ed6404967704,,5e8d2fe29719ed6404967704
NEW Women's Fashion Sleeveless Stitching T-shirt Round Neck Printing Blouse Ladies Female Plus Size Tops,NEW Women's Fashion Sleeveless Stitching T-shirt Round Neck Printing Blouse Ladies Female Plus Size Tops,7.0,CHF,7.0,CHF,7,10,,,3.8947368421052633,19.0,6,8,3,1,1,,,,,,blue,m,50,Livraison standard,2.0,false,,50,,,CN,shanliangtrade,shanliangtrade,"(2,190 valutazioni)",2190,4.100913242009132,5dc69ae4c4e6e61846dfc2b4,,,https://www.wish.com/c/60540f981ff3e1af4f87cf6d,https://canary.contestimg.wish.com/api/webimage/60540f981ff3e1af4f87cf6d-medium.jpg,60540f981ff3e1af4f87cf6d
Aproms Boho Vintage Tassel Straps Tie Up Basic Camis Women Summer White Square Neck Tank Tops Cool Girls Festival Crop Top 2020,Aproms Boho Vintage Tassel Straps Tie Up Basic Camis Women Summer White Square Neck Tank Tops Cool Girls Festival Crop Top 2020,23.0,CHF,23.0,CHF,25,0,,,5.0,0.0,,,,,,,,,,,white,s,50,Livraison standard,7.0,false,,50,,,CA,11368796 CANADA CORPORATION,11368796canadacorporation,"(1,166 Bewertungen)",1166,3.9382504288164664,5ffb1f43fa8a25c707537989,,,https://www.wish.com/c/6012ef31c5415c94133b59be,https://canary.contestimg.wish.com/api/webimage/6012ef31c5415c94133b59be-medium.jpg,6012ef31c5415c94133b59be
Herrenmode Schädel gedruckt 3D T-Shirt Kurzarm O-Ausschnitt Lustige Gothic Death God Tops,Men's Fashion Skull Printed 3d T Shirt Short Sleeve O-neck Funny Gothic Death God Tops,3.48,CHF,4.0,CHF,3.83,10,,,3.611111111111111,18.0,5,5,5,2,1,,,,,,red,xs,1,Livraison standard,1.0,false,,50,,,US,tarkantk79,tarkantk79,"(3,852 Bewertungen)",3852,3.833073727933541,595df9a56d138f5f66e8c3b0,,,https://www.wish.com/c/6005399ed19ee01985127703,https://canary.contestimg.wish.com/api/webimage/6005399ed19ee01985127703-medium.jpg,6005399ed19ee01985127703
Women's Skull Cotton Plus Size Fitness Vest Shirts Print Hollow Out T Shirt,Women's Skull Cotton Plus Size Fitness Vest Shirts Print Hollow Out T Shirt,10.0,CHF,10.0,CHF,11,10000,,,4.102437009500207,2421.0,1342,466,307,131,175,,,,,,coolblack,s,1,Livraison standard,2.0,false,,50,,,CN,zhangnannann,zhangnannann,"(4,691 ratings)",4691,4.097420592624174,59770c7f30e1f33e13dec425,,,https://www.wish.com/c/5a9a7e336d638a4fb7dc3272,https://canary.contestimg.wish.com/api/webimage/5a9a7e336d638a4fb7dc3272-medium.jpg,5a9a7e336d638a4fb7dc3272
8 Colors Nouveau Mode Femmes Rétro Floral Fermeture À Glissière Veste Blouson Baseball Manteau Décontracté Femmes Tops Plus Size S-8XL,8 Colors Nouveau Mode Femmes Rétro Floral Fermeture À Glissière Veste Blouson Baseball Manteau Décontracté Femmes Tops Plus Size S-8XL,10.0,CHF,10.0,CHF,11,1000,,,3.588235294117647,102.0,36,22,22,10,12,,,,,,lightred,xxs,1,Livraison standard,2.0,false,,50,,,CN,huangyuming1314,huangyuming1314,74 % avis positifs (183 notes),183,3.628415300546448,5ea50b007733e0550d9435a9,,,https://www.wish.com/c/5f277f88c5c925004975c397,https://canary.contestimg.wish.com/api/webimage/5f277f88c5c925004975c397-medium.jpg,5f277f88c5c925004975c397
Femmes mode dessin animé mode imprimé chemise à manches courtes été décontracté col rond blouses amples grande taille hauts,Women Fashion Cartoon Fashion Printed Short Sleeve Shirt Summer Casual Round Neck Loose Blouses Plus Size Tops,9.0,CHF,55.0,CHF,9,5000,,,3.4901960784313726,918.0,334,179,162,89,154,,,,,,white,m,50,Livraison standard,3.0,false,,50,,,CN,wenbao,wenbao,"87 % avis positifs (2,446 notes)",2446,4.0784955028618155,5772693e4e1511743e371036,,,https://www.wish.com/c/5d3b1ed171d2e325658f9976,https://canary.contestimg.wish.com/api/webimage/5d3b1ed171d2e325658f9976-medium.jpg,5d3b1ed171d2e325658f9976
XS-8XL Plus Size Fashion Tops Frühling Sommer Kleidung Damen Casual Loose Langarmhemden Einfarbige tiefe V-Ausschnitt Shirts Damen Button Up Chiffon Blusen,XS-8XL Plus Size Fashion Tops Spring Summer Clothes Womens Casual Loose Long Sleeve Shirts Solid Color Deep V-neck Shirts Ladies Button Up Chiffon Blouses,5.18,CHF,6.0,CHF,5.7,1000,,,3.523404255319149,235.0,94,44,35,15,47,,,,,,white,xs,3,Livraison standard,1.0,false,,50,true,Quantité limitée !,CN,zhoupingastore,zhoupingastore,"82% Positives Feedback (4,556 Bewertungen)",4556,3.919446883230904,59f5481068788b25d0a84068,,,https://www.wish.com/c/5df73456e0ee18040f25276a,https://canary.contestimg.wish.com/api/webimage/5df73456e0ee18040f25276a-medium.jpg,5df73456e0ee18040f25276a
Tendance de la mode d'été 2016 des femmes Tendance de la mode d'été des femmes décontractées laisser deux manches chemise Chemisier à manches chauve-souris Tops amples,2016  Summer Fashion Trend of Women Casual Leave Two Bat Sleeve Shirt Blouse Loose Tops,10.0,CHF,10.0,CHF,11,50000,,,4.0667046750285065,8770.0,4587,1823,1288,502,570,,,,,,coolblack,s,5,Livraison standard,3.0,false,,50,true,Quantité limitée !,CN,MSG,msg,"(19,073 notes)",19073,4.329995281287684,565adc2d12a0431af37b7254,,,https://www.wish.com/c/5790748d9c7201778a17db50,https://canary.contestimg.wish.com/api/webimage/5790748d9c7201778a17db50-medium.jpg,5790748d9c7201778a17db50
Mode Frauen Herbst Winter O-Ausschnitt Casual Tops Langarm Strick Mohair Pullover Cardigan,Fashion Women Autumn Winter O-Neck Casual Tops Long Sleeve Knitted Mohair Sweaters Cardigan,23.0,CHF,91.0,CHF,25,10000,,,3.3704235463029435,1393.0,489,252,234,122,296,,,,,,blue,xs,50,Livraison standard,7.0,false,,50,,,CN,luxian,luxian,"(8,514 Bewertungen)",8514,3.987549917782476,59c0cda3776ab93e42fce57d,,,https://www.wish.com/c/5a602d9d95f79f5434898433,https://canary.contestimg.wish.com/api/webimage/5a602d9d95f79f5434898433-medium.jpg,5a602d9d95f79f5434898433
XS-8XL Plus Size Mode Kleidung Damen Casual ärmellose T-Shirts Einfarbig Off Shoulder Tops Damen Sommer Tops Button Up Camisole Shirts Weste Loose Cotton Tank Tops,XS-8XL Plus Size Fashion Clothes Women's Casual Sleeveless Tee Shirts Solid Color Off Shoulder Tops Ladies Summer Tops Button Up Camisole Shirts Vest Loose Cotton Tank Tops,5.25,CHF,6.0,CHF,5.78,10,,,3.857142857142857,7.0,4,0,2,0,1,,,,,,grey,xs,3,Livraison standard,2.0,false,,50,,,SG,Recherche.sg,recherchesg,"84% Positives Feedback (6,123 Bewertungen)",6123,3.9500244977951984,5810aa5bde5bf01b645c909e,,,https://www.wish.com/c/601f83d09e018dd0288cd956,https://canary.contestimg.wish.com/api/webimage/601f83d09e018dd0288cd956-medium.jpg,601f83d09e018dd0288cd956
2021 Trend New Autumn Damenmode Loose Casual Langarm-Blumenverläufe Bedrucktes Hemd mit V-Ausschnitt und Blusen Tunika-Oberteile,2021 Trend New Autumn Women's Fashion Loose Casual Long Sleeved Floral Gradients Printed V- Neck Shirt & Blouses Tunic Tops,3.33,CHF,80.0,CHF,3.66,1000,,,4.032967032967033,273.0,148,54,28,18,25,,,,,,red,xs,1,Livraison standard,1.0,false,,50,,,CN,jingxiongzhuang80967,jingxiongzhuang80967,"87% Positives Feedback (13,037 Bewertungen)",13037,4.0647388202807395,5ac4af64b125ab788cd1334a,,,https://www.wish.com/c/5fddb8613cc6a1061aac5eb5,https://canary.contestimg.wish.com/api/webimage/5fddb8613cc6a1061aac5eb5-medium.jpg,5fddb8613cc6a1061aac5eb5
Plus Size Frauen Mode Federdruck Schräghals Kalte Schulter T-Shirt Bluse （nur T-Shirt）,Plus Size Women Fashion Feather Print Skew Neck Cold Shoulder T-shirt Blouse（only T-shirt）,5.0,CHF,55.0,CHF,5,5000,,,3.754764930114358,787.0,346,160,119,66,96,,,,,,white,xs,3,Livraison standard,2.0,false,,50,,,CN,Women Clothes Factory,hangzhoulangweigarmentfactory,"(7,037 Bewertungen)",7037,4.098763677703567,5466e6343dabbe66ab062be8,,,https://www.wish.com/c/5d2fe4d55cdae96941f5a9bd,https://canary.contestimg.wish.com/api/webimage/5d2fe4d55cdae96941f5a9bd-medium.jpg,5d2fe4d55cdae96941f5a9bd
Vêtements d'automne et d'hiver Mode Femmes Casual Tops lâches Bouton Couture Col en V Chemises à manches longues Dames Plus la taille Couleur unie Coton Pull T-shirts XS-8XL,Autumn and Winter Clothes Fashion Womens Casual Loose Tops Button Stitching V-neck Long Sleeve Shirts Ladies Plus Size Solid Color Cotton Pullover T-shirts XS-8XL,5.29,CHF,6.0,CHF,5.82,5000,,,3.96158940397351,755.0,376,161,102,45,71,,,,,,apricot,xs,3,Livraison standard,2.0,false,,50,,,CN,guanzhiming44553,guanzhiming44553,"(10,930 notes)",10930,4.083348581884721,5810bc6d61e38656e04e8ba2,,,https://www.wish.com/c/5daff211135eda0405300bf6,https://canary.contestimg.wish.com/api/webimage/5daff211135eda0405300bf6-medium.jpg,5daff211135eda0405300bf6
Chemisier femme manches bouffantes en dentelle blanche chemise à manches longues décontracté lâche hauts à volants,Women Blouse Puff Sleeved White Lace Long Sleeve Shirt Casual Loose Ruffle Tops,14.0,CHF,15.0,CHF,15,10,,,2.8947368421052633,19.0,5,1,6,1,6,,,,,,,m,50,Livraison standard,4.0,false,,50,,,CN,Deal Women,dealwomen,"92 % avis positifs (10,259 notes)",10259,4.342431036163369,56307712f667b9370c800277,,,https://www.wish.com/c/5f06d80db4b01518387a4c73,https://canary.contestimg.wish.com/api/webimage/5f06d80db4b01518387a4c73-medium.jpg,5f06d80db4b01518387a4c73
The Beatles,,,,,,,,,,,,,,,,,,,,,,,,,,,,,,,,,,,,,,,,,https://www.wish.com/c/5e8d2ff89719ed6404967789,,5e8d2ff89719ed6404967789
Plus Size Damen Mode Polka Shirt Casual Dot Loose Herbst S-5XL,Plus Size Women Fashion Polka Shirt Casual Dot Loose Autumn S-5XL,17.0,CHF,20.0,CHF,18,20000,,,4.037978560490046,3265.0,1814,593,354,176,328,,,,,,khaki,l,50,Livraison standard,5.0,false,,50,,,CN,YYW COM,yywcom,"88% Positives Feedback (9,369 Bewertungen)",9369,4.193297043441135,563c5b3d05398a37780be2e2,,,https://www.wish.com/c/5bd144f0b0de8459981dd41c,https://canary.contestimg.wish.com/api/webimage/5bd144f0b0de8459981dd41c-medium.jpg,5bd144f0b0de8459981dd41c
"Női rövid ujjú pólók, felsők, betűkkel nyomtatott pamut, nyári alkalmi pólók, pólók S-5XL",Women Short Sleeve T Shirts Tops Letter Printed Cotton Summer Casual T Shirts Tees S-5XL,7.0,CHF,9.0,CHF,7,5000,,,4.150145772594752,686.0,382,146,82,31,45,,,,,,white,s,30,Livraison standard,2.0,false,,50,,,CN,yuhkgmaal,yuhkgmaal,"80% pozitív visszajelzés (10,667 minősítés)",10667,3.8151307771632137,58314fcb7284901b7ca0d358,,,https://www.wish.com/c/5d6f980190bd5f5694d25a6d,https://canary.contestimg.wish.com/api/webimage/5d6f980190bd5f5694d25a6d-medium.jpg,5d6f980190bd5f5694d25a6d
Maglietta a maniche corte con scollo a V estivo da donna Maglietta a maniche corte con bottoni casual Maglietta basic,Women Summer V Neck Ruffles Short Sleeve T Shirt Casual Button Crop Top Basic T Shirt Tops,5.0,CHF,5.0,CHF,5,10,,,5.0,1.0,1,0,0,0,0,,,,,,blue,s,2,Livraison standard,2.0,false,,50,,,US,KemengtuhT,kemengtuht,(607 valutazioni),607,3.883031301482702,5e6b3cd2ea20ca03da108dac,,,https://www.wish.com/c/5f3cd4cf2f24060042152682,https://canary.contestimg.wish.com/api/webimage/5f3cd4cf2f24060042152682-medium.jpg,5f3cd4cf2f24060042152682
Damen Basic Stripe Camisole verstellbare Spaghettiträger Tank Top Plus Size Shirts,Women's Basic Stripe Camisole Adjustable Spaghetti Strap Tank Top Plus Size Shirts,8.0,CHF,8.0,CHF,8,10,,,4.085714285714285,35.0,21,6,3,0,5,,,,,,blue&white,xs.,50,Livraison standard,3.0,false,,50,,,CN,javee,javee,"88% Positives Feedback (17,737 Bewertungen)",17737,4.140779162203303,544ce53e5f313f774a78d2c2,,,https://www.wish.com/c/601ba5d3580621b0583079f5,https://canary.contestimg.wish.com/api/webimage/601ba5d3580621b0583079f5-medium.jpg,601ba5d3580621b0583079f5
