title,title_orig,discount_price,discount_price_currency,retail_price,retail_price_currency,discount_price_in_original_currency,nb_cart_orders_approx,nb_units_purchased_approx,uses_ad_boosts,rating,rating_count,rating_five_count,rating_four_count,rating_three_count,rating_two_count,rating_one_count,badges_count,badge_local_product,badge_product_quality,badge_fast_shipping,tags,product_color,product_variation_size_id,product_variation_inventory,shipping_option_name,shipping_option_price,shipping_is_express,countries_shipped_to,inventory_total,has_urgency_banner,urgency_text,origin_country,merchant_title,merchant_name,merchant_info_subtitle,merchant_rating_count,merchant_rating,merchant_id,merchant_has_profile_picture,merchant_profile_picture,product_url,product_picture,product_id
ZANZEA Femmes Mode En Velours Côtelé À Manches Longues O-Cou Ourlet Boutons Parti Casual Blouse Lâche Vintage T-shirt Tops Camisas Mujer,ZANZEA Women Fashion Corduroy Long Sleeve O-Neck Hem Buttons Party Casual Blouse Loose Vintage Tshirt Tops Camisas Mujer,10.0,CHF,15.0,CHF,11,1000,,,4.059040590405904,271.0,152,41,39,20,19,,,,,,blue,m,50,Livraison standard,3.0,false,,50,true,Quantité limitée !,CN,genau,genau,"(4,195 notes)",4195,4.14445768772348,58ae9e13ff7522089d48b521,,,https://www.wish.com/c/5ddba9a3aeb36e0517961805,https://canary.contestimg.wish.com/api/webimage/5ddba9a3aeb36e0517961805-medium.jpg,5ddba9a3aeb36e0517961805
Damenmode Langarm Open Front Pailletten Blazer Mantel,Women Fashion Long Sleeve Open Front Sequin Blazer Coat,16.0,CHF,146.0,CHF,17,1000,,,3.3705583756345177,197.0,84,21,26,16,50,,,,,,black,s,50,Livraison standard,5.0,false,,50,,,CN,hanhandedian,hanhandedian,"(2,380 Bewertungen)",2380,4.210504201680672,58afd738e37fc650654f81c1,,,https://www.wish.com/c/5e01a75c10805500343073ab,https://canary.contestimg.wish.com/api/webimage/5e01a75c10805500343073ab-medium.jpg,5e01a75c10805500343073ab
Damen Tops und Blusen 2019 Damen Tops Shirts Plus Size Damen Weiße Spitze Fledermaus Ärmel Tops Für Damen Kleidung Blusas 0033,Womens Tops And Blouses 2019 Ladies Tops Shirts Plus Size Women White Lace Bat Sleeve Tops For Women Clothing Blusas 0033,24.0,CHF,24.0,CHF,26,5,,,5.0,0.0,,,,,,,,,,,white,l,50,Livraison standard,12.0,false,,50,,,CA,11368796 CANADA CORPORATION,11368796canadacorporation,"(1,166 Bewertungen)",1166,3.9382504288164664,5ffb1f43fa8a25c707537989,,,https://www.wish.com/c/6012d9f8364f473528c07a3c,https://canary.contestimg.wish.com/api/webimage/6012d9f8364f473528c07a3c-medium.jpg,6012d9f8364f473528c07a3c
Herbst Winter Damenmode Casual Tops Rose Print Warme Hoodies Loos Einfarbige Langarm-Sweatshirts Pullover,Autumn Winter Women’s Fashion Casual Tops Rose Print Warm Hoodies Loos Solid Color Long Sleeve Sweatshirts Pullovers,7.0,CHF,8.0,CHF,7,5000,,,3.361818181818182,1100.0,394,173,193,117,223,,,,,,blue,xs,3,Livraison standard,2.0,false,,50,,,CN,maligoodsmart est un vendeur agréé,lazzyshop,"(36,935 Bewertungen)",36935,4.103506159469338,5abb2cf26be8733b5bf6844f,,,https://www.wish.com/c/5d6741eba73a18041b413f7b,https://canary.contestimg.wish.com/api/webimage/5d6741eba73a18041b413f7b-medium.jpg,5d6741eba73a18041b413f7b
Plus Size Frauen Damen Casual Kurzarm V-Ausschnitt Slim T-Shirt Neue Mode Einfarbige Baumwolle Sport Yoga Top Grafik T-Shirts,Plus Size Women Ladies Casual Short Sleeve V-neck Slim T-shirt New Fashion Solid Color Cotton Sport Yoga Top Graphic Tees,5.32,CHF,9.0,CHF,5.86,1000,,,4.086261980830671,313.0,176,53,45,13,26,,,,,,yellow,xs,2,Livraison standard,1.0,false,,50,,,CN,houxiandaili,houxiandaili,"(5,631 Bewertungen)",5631,4.096963239211508,5addba5481260b1ddfffe5a3,,,https://www.wish.com/c/5de8e904a1211534d8886111,https://canary.contestimg.wish.com/api/webimage/5de8e904a1211534d8886111-medium.jpg,5de8e904a1211534d8886111
Mode Frauen Rücken Tief V Sexy Rückenlose Weste Tank Ärmellos Slim Tops Damen T-Shirt,Fashion Women Back Deep V Sexy Backless Vest Tank Sleeveless Slim Tops womens Tshirt,6.0,CHF,14.0,CHF,6,50000,,,3.338870431893688,9331.0,3066,1543,1876,1179,1667,,,,,,gray,s,50,Livraison standard,2.0,false,,50,true,Quantité limitée !,,freebird,fashionshow,"(852,711 Bewertungen)",852711,4.103545046328709,52bd3ddb34067e4620a4c62d,,,https://www.wish.com/c/552f840fcea30816e52aabcf,https://canary.contestimg.wish.com/api/webimage/552f840fcea30816e52aabcf-medium.jpg,552f840fcea30816e52aabcf
Sweat à capuche court pour femmes Sweat court Pull uni à capuche Crop Tops Sexy Casual à manches longues à capuche,Womens Cropped Hoodie Short Sweatshirt Plain Pullover Hooded Crop Tops Sexy Casual Long Sleeve Hooded,8.0,CHF,8.0,CHF,8,1000,,,3.6912751677852347,149.0,70,24,20,9,26,,,,,,white,2xl,1,Livraison standard,3.0,false,,50,,,CN,1903,1903,"(3,088 notes)",3088,4.26360103626943,5aa0d89070cf69224afc0ed4,,,https://www.wish.com/c/5e69ebb6f05cb84faaccd552,https://canary.contestimg.wish.com/api/webimage/5e69ebb6f05cb84faaccd552-medium.jpg,5e69ebb6f05cb84faaccd552
7 Farben Vogue V-Ausschnitt Brief einfarbig Frauen Sommer Tops T-Shirts Damenmode Plus Size Slim Fit Tops T-Shirts,7 Colors Vogue V-neck Brief Solid Color Women Summer Tops T-shirts Ladies Fashion Plus Size Slim Fit Tops Tees,14.0,CHF,14.0,CHF,15,1000,,,3.923694779116466,249.0,130,46,26,18,29,,,,,,pink,s,50,Livraison standard,4.0,false,,50,,,CN,Lzara,lzara,"(59,401 Bewertungen)",59401,3.8749010959411456,55a641ddfa6d460ba65ce3b8,,,https://www.wish.com/c/5e37cead2a81e5291dc76c19,https://canary.contestimg.wish.com/api/webimage/5e37cead2a81e5291dc76c19-medium.jpg,5e37cead2a81e5291dc76c19
Nouveau été femmes mode hauts à la mode manches plume imprimé col en v hors épaule Blouse et chemises S-5XL,New Summer Women's Fashion Tops Trendy Sleeve Feather Print V-neck Off Shoulder Blouse &Shirts S-5XL ,2.55,CHF,3.0,CHF,2.81,10,,,3.870967741935484,31.0,14,6,7,1,3,,,,,,armygreen,xs,1,Livraison standard,1,false,,50,,,CN,Prosehome,prosehome,"85 % avis positifs (3,566 notes)",3566,4.0403813796971395,5c80bd2ab1ad6a6fc52a7eb3,,,https://www.wish.com/c/5eb4ed7dbdc7a421d6843127,https://canary.contestimg.wish.com/api/webimage/5eb4ed7dbdc7a421d6843127-medium.jpg,5eb4ed7dbdc7a421d6843127
Plus Size S-5XL Damen einfarbige Hemden Elegante Damen Top T-Shirts Langarmbluse,Plus Size S-5XL Women's Solid Color Shirts Elegant Ladies Top T Shirts Long Sleevel Blouse,6.0,CHF,23.0,CHF,6,1000,,,3.7883597883597884,189.0,93,33,21,14,28,,,,,,white,s,50,Livraison standard,2.0,false,,50,,,CN,Ahadadada,ahadadada,"87% Positives Feedback (2,894 Bewertungen)",2894,4.071527297857637,5ad1f14d40626a47903fe9df,,,https://www.wish.com/c/5cc082d3841c2b45d9d1da4d,https://canary.contestimg.wish.com/api/webimage/5cc082d3841c2b45d9d1da4d-medium.jpg,5cc082d3841c2b45d9d1da4d
La camicia a quadri con scollo a V da donna supera la maglietta da donna taglie forti irregolare,Womens V-neck plaid shirt tops irregular loose plus size ladies T-shirt,5.25,CHF,90.0,CHF,5.78,1000,,,3.887798036465638,713.0,348,142,98,45,80,,,,,,red,xs,4,Livraison standard,2.0,false,,50,true,Quantité limitée !,CN,gaochunxiu,gaochunxiu,"87% feedback positivi (9,433 recensioni)",9433,4.058623979645924,58ad50f3b3bd6d508906e55d,,,https://www.wish.com/c/5a3279accd0e682347d457e5,https://canary.contestimg.wish.com/api/webimage/5a3279accd0e682347d457e5-medium.jpg,5a3279accd0e682347d457e5
Damen Mode Sommer Tank Tops Low Cut Ärmellose Volltonfarbe Off Shoulder Tank Shirt Spaghettiträger Halfter Backless Casual Vest Top,Women Fashion Summer Tank Tops Low Cut Sleeveless Solid Color Off Shoulder Tank Shirt Spaghetti Strap Halter Backless Casual Vest Top,8.0,CHF,8.0,CHF,8,5000,,,3.6315789473684212,532.0,206,107,103,49,67,,,,,,black,s,50,Livraison standard,3.0,false,,50,,,CN,hellocome,hellocome,"(6,290 Bewertungen)",6290,3.95214626391097,578e02bec0e9340e993d13f4,,,https://www.wish.com/c/5cefa120731ea53346708575,https://canary.contestimg.wish.com/api/webimage/5cefa120731ea53346708575-medium.jpg,5cefa120731ea53346708575
S-5XL New Fashion Damen Camouflage Print Tank Tops Bustier BH Weste Sommer Crop Top High Impact Sport BH Bralette Bluse Sling Weste Cami,S-5XL New Fashion Women Camouflage Print Tank Tops Bustier Bra Vest Summer Crop Top High Impact Sports Bra Bralette Blouse Sling Vest Cami,7.0,CHF,7.0,CHF,7,10,,,3.4814814814814814,27.0,13,3,1,4,6,,,,,,pink,xs,1,Livraison standard,2.0,false,,50,,,CN,liufang163,liufang163,"88% Positives Feedback (2,082 Bewertungen)",2082,4.178674351585014,5e6332072fdc77356ee15dfe,,,https://www.wish.com/c/5f44b4812d094c098db04fea,https://canary.contestimg.wish.com/api/webimage/5f44b4812d094c098db04fea-medium.jpg,5f44b4812d094c098db04fea
"ENTSCHULDIGUNG, ICH KANN NICHT SEHR BESETZT sein",SORRY I CAN'T I'M VERY BUSY Letter Print Women Summer Fashion Tops Cute T Shirts Sloth Print Graphic Tee Funny Casual Tee Shirt Girls Tee,9.0,CHF,9.0,CHF,9,10,,,4.488372093023256,43.0,31,6,3,2,1,,,,,,yellow,s,2,Livraison standard,3.0,false,,50,,,CN,zhouzhengnan,zhouzhengnan,"95% Positives Feedback (5,426 Bewertungen)",5426,4.432546995945448,5a71722367d25c52f9156586,,,https://www.wish.com/c/5ebbf6d51acbfa7ae6b106da,https://canary.contestimg.wish.com/api/webimage/5ebbf6d51acbfa7ae6b106da-medium.jpg,5ebbf6d51acbfa7ae6b106da
Mode Frauen Kleidung Frühling Sommer Lässig Ärmellose Unterhemd Tops Einfarbige Baumwolle Button-Down-Shirts Damen Plus Size Loose Cami Tank Top Tiefes V-Ausschnitt Neckholder Bluse,Fashion Women Clothes Spring Summer Casual Sleeveless Camisole Tops Solid Color Cotton Button-down Shirts Ladies Plus Size Loose Cami Tank Top Deep V-neck Halter Blouse,5.32,CHF,6.0,CHF,5.86,1000,,,4.186046511627907,86.0,47,20,12,2,5,,,,,,rosered,xs,50,Livraison standard,2.0,false,,50,,,US,PSCO.VA,pscova,"84% Positives Feedback (8,919 Bewertungen)",8919,3.942482341069627,5810b0ea732c2115f334e72c,,,https://www.wish.com/c/60179a7d067388f20d1a5312,https://canary.contestimg.wish.com/api/webimage/60179a7d067388f20d1a5312-medium.jpg,60179a7d067388f20d1a5312
Mode féminine évider Perspective filet de pêche à manches longues T-shirt discothèque Sexy grand haut court en maille,Women's Fashion Hollow Out Perspective Fishing Net Long Sleeve T-shirt Nightclub Sexy Large Mesh Crop Top,10.0,CHF,91.0,CHF,11,10,,,3.533333333333333,15.0,3,7,1,3,1,,,,,,black,s,50,Livraison standard,2.0,false,,50,true,Quantité limitée !,CN,Taizhou Keelungtrading Company Limited,taizhoukeelungtradingcompanylimited,89 % avis positifs (701 notes),701,4.251069900142653,551a5981a9c77d0d7dcc2fbe,,,https://www.wish.com/c/5b768336b0db42115d4469a2,https://canary.contestimg.wish.com/api/webimage/5b768336b0db42115d4469a2-medium.jpg,5b768336b0db42115d4469a2
Plus Grande Taille XS-6XL Femme Décontractée d'été Décontractée Couleur unie Col V uni Manches courtes Tops Femme Mode Mode Grande Taille Col boutonnière en coton Chemisier à poche à col boutonné,Plus Size XS-6XL Women Summer Casual Loose Solid Color V-neck Short Sleeve Tops Ladies Fashion Plus Size Cotton Lapel Collar Pocket Blouse,8.0,CHF,8.0,CHF,8,1000,,,3.470404984423676,321.0,111,61,66,34,49,,,,,,purple,xs,50,Livraison standard,3.0,false,,50,,,CN,KIMI Clothing Co.,kimiclothingco,"(4,293 notes)",4293,4.164686699277894,54feedcba0086e70c9d90202,,,https://www.wish.com/c/5cb5c5f6b453e25010f51fe8,https://canary.contestimg.wish.com/api/webimage/5cb5c5f6b453e25010f51fe8-medium.jpg,5cb5c5f6b453e25010f51fe8
Mode femmes Yoga haut court Yoga chemises à manches longues entraînement Fitness course Sport T-shirts formation Yoga vêtements de sport hauts,Fashion Women Yoga Crop Tops Yoga Shirts Long Sleeve Workout  Fitness Running Sport T-Shirts Training Yoga Sportswear Tops,10.0,CHF,10.0,CHF,11,10,,,4.6,10.0,8,1,0,1,0,,,,,,grey,s,14,Livraison standard,2.0,false,,50,,,CN,The World Widget Maker International,theworldwidgetmakerinternational,"95 % avis positifs (16,075 notes)",16075,4.439377916018662,53f37c121f50630e192212f6,,,https://www.wish.com/c/5e7f11655328250956a780ab,https://canary.contestimg.wish.com/api/webimage/5e7f11655328250956a780ab-medium.jpg,5e7f11655328250956a780ab
Damenmode Sommer Casual Slim Fit O-Ausschnitt Kurzarm Aushöhlte einfarbige Baumwolle T-Shirts Tops,Women's Fashion Summer Casual Slim Fit O-neck Short Sleeves Hollow-out Solid Color Cotton T Shirts Tops,4.23,CHF,33.0,CHF,4.65,1000,,,3.9551282051282053,156.0,74,33,27,12,10,,,,,,grey,xs,1,Livraison standard,1.0,false,,50,,,CN,Hopcup,hopcup,"(28,484 Bewertungen)",28484,3.889973318354164,587e427d607738783b69bb0b,,,https://www.wish.com/c/5e744313a035d1004e0b9650,https://canary.contestimg.wish.com/api/webimage/5e744313a035d1004e0b9650-medium.jpg,5e744313a035d1004e0b9650
T-shirt à manches longues et manches longues pour dames T-shirt à manches longues et manches courtes T-shirt à manches longues,Women's Fashion Loose Casual  Pullover Long Sleeve Strip T Shirt  Blouse Tops,9.0,CHF,10.0,CHF,9,5000,,,4.527777777777778,972.0,662,214,63,13,20,,,,,,blue,m,28,Livraison standard,4.0,false,,50,true,Quantité limitée !,CN,Pure Fashion,purefashionltd,"92 % avis positifs (218,414 notes)",218414,4.33474044704094,5cb636dda7173671aedef051,,,https://www.wish.com/c/5d0c8db4c72fc54e3989452f,https://canary.contestimg.wish.com/api/webimage/5d0c8db4c72fc54e3989452f-medium.jpg,5d0c8db4c72fc54e3989452f
7 Couleurs S-5XL Femmes ' s Été Soutien-Gorge En Dentelle Col Pointu Soutien-Gorge Été Soutien-Gorge Été Bralettes Crop Tops Lingerie,7 Colors S-5XL Women's Summer Lace Bra Hallter Neck Bikini Bra Summer Tops Halterneck Bralettes Crop Tops Lingerie,4.37,CHF,5.0,CHF,4.8100000000000005,10000,,,3.3377777777777777,1125.0,365,206,206,140,208,,,,,,white,s,50,Livraison standard,1.0,false,,50,,,CN,Chuanpu,chuanpu,"85 % avis positifs (39,504 notes)",39504,4.013188537869583,584bcf7bfef409603f39b619,,,https://www.wish.com/c/5cc67389bb8cfa5f743322bb,https://canary.contestimg.wish.com/api/webimage/5cc67389bb8cfa5f743322bb-medium.jpg,5cc67389bb8cfa5f743322bb
Damen Sommerkleidung Casual Off Shoulder Kurzarm Tops Deep V-Ausschnitt Reißverschluss Blusen Damenmode Einfarbig T-Shirt Loose Plus Size Loose Zipper Shirts,Womens Summer Clothing Casual Off Shoulder Short Sleeved Tops Deep V-neck Zipper Blouses Ladies Fashion Solid Color T-shirt Loose Plus Size Loose Zipper Shirts,7.0,CHF,7.0,CHF,7,10,,,5.0,1.0,1,0,0,0,0,,,,,,white,xs,50,Livraison standard,2.0,false,,50,,,CN,hengfangsales,hengfangsales,"(6,237 Bewertungen)",6237,4.040564373897707,5810a8ee795bb1198442a20d,,,https://www.wish.com/c/605845df87f39755c6e976a7,https://canary.contestimg.wish.com/api/webimage/605845df87f39755c6e976a7-medium.jpg,605845df87f39755c6e976a7
Blusa con cuello en V de manga larga a la moda para mujer Camisa informal con estampado de letras Tops sueltos Tallas grandes,Women Fashion  Long Sleeve V-neck Blouse Letter Print Casual Shirt Loose Tops Plus Sizes,7.0,CHF,36.0,CHF,7,1000,,,3.9615384615384617,104.0,59,13,14,5,13,,,,,,black,xs,50,Livraison standard,2.0,false,,50,,,CN,YUERmoggerZYY,yuermoggerzyy,"89% retroalimentación positiva (3,739 calificaciones)",3739,4.184273870018721,5a9526cf9d5e970a50245fc6,,,https://www.wish.com/c/5e521e758d50385b00c75107,https://canary.contestimg.wish.com/api/webimage/5e521e758d50385b00c75107-medium.jpg,5e521e758d50385b00c75107
Nouveau automne et hiver lâche à capuche à manches longues tie-dye imprimé arc-en-ciel dames pull à capuche sweat,New Autumn and Winter Loose Hooded Long-sleeved Tie-dye Rainbow Print Ladies Sweater Hoodie Sweatshirt,9.0,CHF,9.0,CHF,9,10,,,4.555555555555555,9.0,8,0,0,0,1,,,,,,pink,xxs,1,Livraison standard,3.0,false,,50,,,VE,nicoleschop,nicoleschop,"80 % avis positifs (1,940 notes)",1940,3.872680412371134,5dc41951cda5671ccbca52f7,,,https://www.wish.com/c/5f4f5b6dc8e2d2004c7fd0bb,https://canary.contestimg.wish.com/api/webimage/5f4f5b6dc8e2d2004c7fd0bb-medium.jpg,5f4f5b6dc8e2d2004c7fd0bb
Rundhals-Tunika-Blusen für Frauen mit rundem Hals und unregelmäßigem Saum,Women's round neck  Irregular Hem Tunic Top Flowy Tunics Blouses,5.0,CHF,137.0,CHF,5,1000,,,3.893617021276596,235.0,119,46,27,12,31,,,,,,lightgray,xxs,17,Livraison standard,2.0,false,,50,,,CN,bfmore.com,bfmorecom,"(7,236 Bewertungen)",7236,4.140961857379768,56551c483e2fde1692fd168b,,,https://www.wish.com/c/5d7a0838f9afb6348887dd34,https://canary.contestimg.wish.com/api/webimage/5d7a0838f9afb6348887dd34-medium.jpg,5d7a0838f9afb6348887dd34
Femmes mode automne hiver léopard imprimé chemisier décontracté dames à manches longues T-shirt en vrac pull hauts,Women Fashion Autumn Winter Leopard Printed Casual Blouse Ladies Long Sleeve T-shirt Loose Pullover Tops,8.0,CHF,8.0,CHF,8,1000,,,3.7228915662650603,166.0,70,32,31,14,19,,,,,,purple,s,50,Livraison standard,3.0,false,,50,,,CN,RANRAN FASHION,ranranfashion,85 % avis positifs (344 notes),344,4.058139534883721,5d5aa8cf2736785cd3177f1f,,,https://www.wish.com/c/5f43819ab61d386e0a442b24,https://canary.contestimg.wish.com/api/webimage/5f43819ab61d386e0a442b24-medium.jpg,5f43819ab61d386e0a442b24
Frauen Kapuzen Langarm Tops Loose Fleece gefüttert Casual Plus Long Hoodie Kleid,Women Hooded Long Sleeved Tops Loose Fleece Lined Casual Plus Long Hoodie Dress,13.0,CHF,137.0,CHF,14,10000,,,3.787605633802817,1775.0,806,355,259,141,214,,,,,,black,l,50,Livraison standard,3.0,false,,50,,,CN,hanchang top,hanchangtop,"(29,769 Bewertungen)",29769,4.21129362759918,5711b1570a7d5e59015c1854,,,https://www.wish.com/c/59883208fe60fc6b998b7125,https://canary.contestimg.wish.com/api/webimage/59883208fe60fc6b998b7125-medium.jpg,59883208fe60fc6b998b7125
Été Nouvelles Femmes Mode Suzuki T-shirt Casual Lâche Fille Tops,Summer New Women Fashion Suzuki T Shirt Casual Loose Girl Tops,5.32,CHF,6.0,CHF,5.86,10,,,4.320441988950276,181.0,108,38,25,5,5,,,,,,grey,s,1,Livraison standard,2.0,false,,50,,,CN,caorenliang,caorenliang,82 % avis positifs (914 notes),914,3.822757111597374,5a9fcf49417cee4b68c980f3,,,https://www.wish.com/c/5ce371b6d45d3b19c682dfe0,https://canary.contestimg.wish.com/api/webimage/5ce371b6d45d3b19c682dfe0-medium.jpg,5ce371b6d45d3b19c682dfe0
Femmes Mode Sequin Bowknot Découpé À Manches Longues O-cou Tops Plus La Taille Casual Solide Couleur Tricoté Tops,Women Fashion Sequin Bowknot Cut-out Long Sleeve O-neck Tops Plus Size Casual Solid Color Knitted Tops,18.0,CHF,18.0,CHF,19,10,,,3.8,10.0,4,2,2,2,0,,,,,,black,s,50,Livraison standard,6.0,false,,50,,,CN,cindy,王焕焕,"87 % avis positifs (17,616 notes)",17616,4.0908265213442325,55d480c092e9ba1242bd816a,,,https://www.wish.com/c/5fab626797d0610cd506f6c6,https://canary.contestimg.wish.com/api/webimage/5fab626797d0610cd506f6c6-medium.jpg,5fab626797d0610cd506f6c6
Femmes Mode Sans Manches Coton Angle Lettre Imprimer Crop Tops Gilet D'été Spaghetti Strap Débardeurs Sexy Push Up Sport Yoga Chemise Tops Plus La Taille S-5XL,Women Fashion Sleeveless Cotton Angle Letter Print Crop Tops Vest Summer Spaghetti Strap Tank Tops Sexy Push Up Sport Yoga Shirt Tops Plus Size S-5XL,8.0,CHF,9.0,CHF,8,10,,,5.0,3.0,3,0,0,0,0,,,,,,lightblue,s,50,Livraison standard,3.0,false,,50,,,CN,Papa pig edd,papapigedd,80 % avis positifs (715 notes),715,3.888111888111888,5d5756e60e99cd4108550a9b,,,https://www.wish.com/c/5f16a063b6b15d193b4012dc,https://canary.contestimg.wish.com/api/webimage/5f16a063b6b15d193b4012dc-medium.jpg,5f16a063b6b15d193b4012dc
3D crâne impression mode femmes chemise sans manches été gilet chemise décontracté débardeurs grande taille,3D Skull Print Fashion Women Sleeveless Shirt Summer Vest Shirt Casual Tank Tops Plus Size,10.0,CHF,24.0,CHF,11,1000,,,4.092105263157895,76.0,40,19,7,4,6,,,,,,multicolor,s,50,Livraison standard,3.0,false,,50,true,Quantité limitée !,CN,gositamamabangbang,gositamamabangbang,"87 % avis positifs (3,635 notes)",3635,4.1207702888583215,5d478f9670327a1663ef2739,,,https://www.wish.com/c/5f9915325d696913c678414e,https://canary.contestimg.wish.com/api/webimage/5f9915325d696913c678414e-medium.jpg,5f9915325d696913c678414e
Goth Dark E-Girl Style Patchwork Schwarze T-Shirts Gothic One Shoulder Sleeve Y2k Crop Tops Rüschen Saum Hip Hop Techwear Frauen T-Shirts,Goth Dark E-girl Style Patchwork Black T-shirts Gothic One Shoulder Sleeve Y2k Crop Tops Ruffles Hem Hip Hop Techwear Women Tees,20.0,CHF,20.0,CHF,22,10,,,5.0,1.0,1,0,0,0,0,,,,,,black,s,50,Livraison standard,6.0,false,,50,,,CA,11368796 CANADA CORPORATION,11368796canadacorporation,"(1,166 Bewertungen)",1166,3.9382504288164664,5ffb1f43fa8a25c707537989,,,https://www.wish.com/c/5ffeec154ae23cbd393a6ae6,https://canary.contestimg.wish.com/api/webimage/5ffeec154ae23cbd393a6ae6-medium.jpg,5ffeec154ae23cbd393a6ae6
DC,,,,,,,,,,,,,,,,,,,,,,,,,,,,,,,,,,,,,,,,,https://www.wish.com/c/5e8d2fdd9719ed64049676e8,,5e8d2fdd9719ed64049676e8
Print Casual Off Shoulder T-Shirst Frauen Sommer Printed Casual T-Shirt Ärmellose Loose Tops,Print Casual Off Shoulder T-shirst Women Summer Printed Casual T-shirt Sleeveless Loose Tops,8.0,CHF,8.0,CHF,8,1000,,,4.306859205776173,277.0,175,49,28,13,12,,,,,,black,xs,50,Livraison standard,2.0,false,,50,,,CN,wangzhenguo,wangzhenguo,(361 Bewertungen),361,3.930747922437673,584ad44b9ee1454c8609d94a,,,https://www.wish.com/c/5ee6381249ab4d64a3a70dc2,https://canary.contestimg.wish.com/api/webimage/5ee6381249ab4d64a3a70dc2-medium.jpg,5ee6381249ab4d64a3a70dc2
Nouveau débardeur sans manches en coton imprimé à la mode pour femmes,New Women Fashion Printed Cotton Sleeveless Vest Black Sport T-Shirt Tank Top,8.0,CHF,19.0,CHF,8,10,,,4.1,80.0,46,17,5,3,9,,,,,,white,s,50,Livraison standard,2.0,false,,50,,,CN,LI SHANSHAN78WGV,lishanshan78wgv,82 % avis positifs (447 notes),447,3.9328859060402683,5d50fb2b1d9a8e23e3334c81,,,https://www.wish.com/c/5ef23b3de105fe913611409d,https://canary.contestimg.wish.com/api/webimage/5ef23b3de105fe913611409d-medium.jpg,5ef23b3de105fe913611409d
Frühling New Women Turn Down Kragen Button Down Shirts Lässige einfarbige Langarm Bluse Tops,Spring New Women Turn Down Collar Button Down Shirts Casual Solid Color Long Sleeve Blouse Tops ,13.0,CHF,13.0,CHF,14,1000,,,4.252873563218391,348.0,208,69,39,15,17,,,,,,black,s,50,Livraison standard,4.0,false,,50,true,Quantité limitée !,CN,Seven7Men,seven7men,"91% Positives Feedback (9,817 Bewertungen)",9817,4.258734847713151,58f09931b757f829d121362b,,,https://www.wish.com/c/5e0f18489fe5360e81bb38e8,https://canary.contestimg.wish.com/api/webimage/5e0f18489fe5360e81bb38e8-medium.jpg,5e0f18489fe5360e81bb38e8
2021 New Fashion Damen Plus Size Off-the-Shoulder Faith Shirt Plus Plus Size Lose Casual Grafik T-Shirt Religiöser Segen T-Shirt Top Shirt Frauen Retro Shirt Eine Vielzahl von Farben erhältlich,2021 New Fashion Women's Plus Size Off-the-shoulder Faith Shirt Plus Plus Size Loose Casual Graphic T-shirt Religious Blessing T-shirt Top Shirt Women Retro Shirt A Variety of Colors Available,5.24,CHF,6.0,CHF,5.77,1000,,,3.75,72.0,35,11,10,5,11,,,,,,black,xs,3,Livraison standard,2.0,false,,50,,,CN,hongnana1314,hongnana1314,"(1,392 Bewertungen)",1392,4.047413793103448,5d4933a060c79c115f9052a6,,,https://www.wish.com/c/5fddb68822c19aea5282b7c8,https://canary.contestimg.wish.com/api/webimage/5fddb68822c19aea5282b7c8-medium.jpg,5fddb68822c19aea5282b7c8
Vêtements d'automne pour les femmes bouton T-shirt ananas impression hauts amples à manches longues chemisier hauts et chemisiers,Autumn Clothes for Women Button T-shirt Pineapple Printing Loose Tops Long Sleeve Blouse Tops and Blouses ,4.34,CHF,5.0,CHF,4.78,10,,,3.5180722891566263,83.0,30,18,13,9,13,,,,,,red,xs,50,Livraison standard,1.0,false,,50,,,CN,yutinomupoi,yutinomupoi,"88 % avis positifs (11,215 notes)",11215,4.112438698172091,5acdb384ccf0c86f34c5d539,,,https://www.wish.com/c/5d79e52e840e6e4f5a797b52,https://canary.contestimg.wish.com/api/webimage/5d79e52e840e6e4f5a797b52-medium.jpg,5d79e52e840e6e4f5a797b52
Sexy Damen Neckholder Low Cut Tight Weste Shirt Tank T-Shirt Cami Backless Top Mädchen Unterhemden,Sexy Women's Halter Neck Low Cut Tight Vest Shirt Tank Tee Cami Backless Top Girls Camisoles,6.0,CHF,6.0,CHF,6,20000,,,3.729849424269265,1129.0,497,202,193,102,135,,,,,,green,tags(usxs),50,Livraison standard,2.0,false,,50,,,CN,dreamingfuture ,springwindringltd,"92% Positives Feedback (24,293 Bewertungen)",24293,4.3126003375457955,544dea6b90c77609dd34852c,,,https://www.wish.com/c/54584d5536a4f30eecc278dd,https://canary.contestimg.wish.com/api/webimage/54584d5536a4f30eecc278dd-medium.jpg,54584d5536a4f30eecc278dd
Alfani,,,,,,,,,,,,,,,,,,,,,,,,,,,,,,,,,,,,,,,,,https://www.wish.com/c/5ee8a696eb31f983c6b794d4,,5ee8a696eb31f983c6b794d4
Nouveau sweat à capuche adulte unisexe sweats imprimés hommes et femmes sport décontracté à manches longues pull hauts,New Adult Hoodie Unisex Printed Sweatshirts Men and Women Casual Sports Long Sleeve Pullover Tops,10.0,CHF,24.0,CHF,11,10,,,2.8333333333333335,6.0,1,1,2,0,2,,,,,,white,s,2,Livraison standard,2.0,false,,50,,,CN,haozhenliang,haozhenliang,"85 % avis positifs (1,348 notes)",1348,3.97106824925816,5ac71816c1d5184f5e4d1388,,,https://www.wish.com/c/5edda545856d7d64edf72c1d,https://canary.contestimg.wish.com/api/webimage/5edda545856d7d64edf72c1d-medium.jpg,5edda545856d7d64edf72c1d
S-5XL Ärmellose Bluse Bademode Plus Größe plissiert lose Schleuder Tank Tops Frauen lässig Sommer lose von der Schulter tiefe V-Ausschnitt rückenfreie Weste ,S-5XL Sleeveless Blouse Beachwear Plus Size Pleated Loose Sling Tank Tops  Women Casual Summer Loose Off Shoulder Deep V-Neck Backless Vest ,4.0,CHF,4.0,CHF,4,10000,,,3.203319502074689,1205.0,373,185,233,142,272,,,,,,green,s,19,Livraison standard,1.0,false,,50,,,CN,Sangboo Store,sangboostore,"(14,199 Bewertungen)",14199,3.8794985562363546,582833faea77701b456c786a,,,https://www.wish.com/c/5cb854e30715c33b71bcd318,https://canary.contestimg.wish.com/api/webimage/5cb854e30715c33b71bcd318-medium.jpg,5cb854e30715c33b71bcd318
