title,title_orig,discount_price,discount_price_currency,retail_price,retail_price_currency,discount_price_in_original_currency,nb_cart_orders_approx,nb_units_purchased_approx,uses_ad_boosts,rating,rating_count,rating_five_count,rating_four_count,rating_three_count,rating_two_count,rating_one_count,badges_count,badge_local_product,badge_product_quality,badge_fast_shipping,tags,product_color,product_variation_size_id,product_variation_inventory,shipping_option_name,shipping_option_price,shipping_is_express,countries_shipped_to,inventory_total,has_urgency_banner,urgency_text,origin_country,merchant_title,merchant_name,merchant_info_subtitle,merchant_rating_count,merchant_rating,merchant_id,merchant_has_profile_picture,merchant_profile_picture,product_url,product_picture,product_id
Mode féminine été décontracté sexy couleur unie col en V à manches courtes chemise coton lâche plissé ourlet bouton T-shirt haut chemisier grande taille S-3XL,Women's Fashion Casual Summer Sexy Solid Color V-Neck Short Sleeve Shirt Cotton Loose Pleated Hem Button T-Shirt Top Blouse Plus Size S-3XL,6.0,CHF,7.0,CHF,6,5000,,,4.400264200792602,757.0,500,138,68,24,27,,,,,,darkgreen,s,25,Livraison standard,2.0,false,,50,,,CN,Pure Fashion,purefashionltd,"92 % avis positifs (218,414 notes)",218414,4.33474044704094,5cb636dda7173671aedef051,,,https://www.wish.com/c/5d0c8e7033a4f119d61d72c2,https://canary.contestimg.wish.com/api/webimage/5d0c8e7033a4f119d61d72c2-medium.jpg,5d0c8e7033a4f119d61d72c2
,,,,,,,,,,,,,,,,,,,,,,,,,,,,,,,,,,,,,,,,,https://www.wish.com/c/5fa159d39719ed538b892961,,5fa159d39719ed538b892961
Coton dames T-shirts grande taille Tops pour femmes S-5XL 2020 4 couleurs été nouvelles femmes mode sans manches drôle impression Slim Fit débardeurs,Cotton Ladies T-shirts Plus Size Tops for Women S-5XL 2020 4 Color Summer New Women Fashion Sleeveless Funny Print Slim Fit Tank Tops,7.0,CHF,45.0,CHF,7,10,,,4.451612903225806,31.0,20,8,1,1,1,,,,,,grey,xxl,5,Livraison standard,2.0,false,,50,,,CN,fuchu,fuchu,"82 % avis positifs (1,115 notes)",1115,3.897757847533632,5d68bc6284bdc66c00752947,,,https://www.wish.com/c/5e699d519d798f004991dd2b,https://canary.contestimg.wish.com/api/webimage/5e699d519d798f004991dd2b-medium.jpg,5e699d519d798f004991dd2b
Camicette a tunica alta a tinta unita a maniche corte con taglio a o-collo estivo da donna,Women's Fashion Summer O-neck Cut  Short Sleeve Solid Color HIgh low Tunic Blouses Tops,11.0,CHF,46.0,CHF,12,1000,,,4.00709219858156,141.0,76,26,18,6,15,,,,,,black,s,50,Livraison standard,3.0,false,,50,,,CN,poiuh,poiuh,"78% feedback positivi (22,107 recensioni)",22107,3.7204053014882166,58ad8ae2db4bd16de1e90c05,,,https://www.wish.com/c/5e5a0f3b77e4f90d3427c2fb,https://canary.contestimg.wish.com/api/webimage/5e5a0f3b77e4f90d3427c2fb-medium.jpg,5e5a0f3b77e4f90d3427c2fb
Vaslanda,,,,,,,,,,,,,,,,,,,,,,,,,,,,,,,,,,,,,,,,,https://www.wish.com/c/5f8d71d3eb31f9a6cce12c0f,,5f8d71d3eb31f9a6cce12c0f
Robe pull à manches longues à broderie à la mode pour femmes Slim Fit M-2XL,Women's Fashion Embroidery Long Sleeve Sweater Dress Slim Fit M-2XL,11.0,CHF,11.0,CHF,12,10,,,2.6923076923076925,26.0,7,0,7,2,10,,,,,,black,m,50,Livraison standard,3.0,false,,50,,,CN,xuanxuanshougongdian,xuanxuanshougongdian,"90 % avis positifs (10,758 notes)",10758,4.240751068971928,5b3d9ce98914db61e9e58a39,,,https://www.wish.com/c/5f965a30b8eb9c004bf41e37,https://canary.contestimg.wish.com/api/webimage/5f965a30b8eb9c004bf41e37-medium.jpg,5f965a30b8eb9c004bf41e37
Plus Size Damenmode Rüschen Kurzarm Chiffon Shirt Lässig Sexy V-Ausschnitt Tops Sommer Damen Blusen,Plus Size Womens Fashion Ruffled Short Sleeves Chiffon Shirt Casual Sexy V-neck Tops Summer Ladies Blouses,5.0,CHF,45.0,CHF,5,1000,,,4.01010101010101,198.0,105,36,28,12,17,,,,,,red,xxs,16,Livraison standard,2.0,false,,50,true,Quantité limitée !,CN,Flora boutique,floraboutique,"(10,044 Bewertungen)",10044,3.912186379928315,5684ca0f73c0e02989b91cad,,,https://www.wish.com/c/5ea79aaf56f15a1602b65683,https://canary.contestimg.wish.com/api/webimage/5ea79aaf56f15a1602b65683-medium.jpg,5ea79aaf56f15a1602b65683
XS-8XL Summer Tops Plus Size Fashion Clothes Women's Casual Short Sleeve Tee Shirts Ladies Blouses V-neck Cotton Pullovers Solid Color Loose T-shirts,XS-8XL Summer Tops Plus Size Fashion Clothes Women's Casual Short Sleeve Tee Shirts Ladies Blouses V-neck Cotton Pullovers Solid Color Loose T-shirts,5.31,CHF,6.0,CHF,5.84,10,,,4.5,2.0,1,1,0,0,0,,,,,,khaki,xs,5,Livraison standard,2.0,false,,50,true,Quantité limitée !,CN,hcczhiqiang,hcczhiqiang,"(4,013 notes)",4013,4.088711687017194,5808e2beff6c57435af7df2d,,,https://www.wish.com/c/604b130be209f402b3a0b7f1,https://canary.contestimg.wish.com/api/webimage/604b130be209f402b3a0b7f1-medium.jpg,604b130be209f402b3a0b7f1
Frauen Sexy Sommer ärmellose Strick Crop Tops,Women Sexy Summer Sleeveless Knit Crop Tops,4.0,CHF,4.0,CHF,4,1000,,,4.161616161616162,99.0,62,14,10,3,10,,,,,,grey,s,50,Livraison standard,1.0,false,,50,true,Quantité limitée !,CN,Fancy_Everyday,fancy_days,"88% Positives Feedback (16,011 Bewertungen)",16011,4.132783711198551,5a4b00966ecee00d0c46937d,,,https://www.wish.com/c/5a84c6f122931820cefe2158,https://canary.contestimg.wish.com/api/webimage/5a84c6f122931820cefe2158-medium.jpg,5a84c6f122931820cefe2158
Frauen Mode Loose Casual Sommer T-Shirt Kurzarm Baumwolle Tops Plus Size Off Schulter Schulter T-Shirts,Women Fashion Loose Casual Summer T-shirt Short Sleeve Cotton Tops Plus Size Off Shoulder Print T Shirts ,5.2,CHF,6.0,CHF,5.72,1000,,,3.8058035714285716,448.0,216,86,54,27,65,,,,,,pink,s,15,Livraison standard,2.0,false,,50,,,CN,LALALA FASH,lalalafash,"81% Positives Feedback (6,799 Bewertungen)",6799,3.859979408736579,571b38e66c39b141b1ad43e1,,,https://www.wish.com/c/5ee1cc0e1c1bfb2cc4a8bd4e,https://canary.contestimg.wish.com/api/webimage/5ee1cc0e1c1bfb2cc4a8bd4e-medium.jpg,5ee1cc0e1c1bfb2cc4a8bd4e
Regatta,,,,,,,,,,,,,,,,,,,,,,,,,,,,,,,,,,,,,,,,,https://www.wish.com/c/60108bcb5cc04b000f5b74a2,,60108bcb5cc04b000f5b74a2
Abseits der Schulter Sexy Damen Bluse Shirt Schnürung bis Langarm Weiß Shirts Kurze Bandage Crop Top,Off Shoulder Sexy Women Blouse Shirt Lace Up Long Sleeve White Shirts Short Bandage Crop Top,8.0,CHF,8.0,CHF,8,1000,,,3.797327394209354,898.0,396,188,151,62,101,,,,,,white,s,50,Livraison standard,3.0,false,,50,,,CN,Dengjuxiang,dengjuxiang,"(6,139 Bewertungen)",6139,4.048542107835153,5b4017c763857415ef3ba6c5,,,https://www.wish.com/c/5b7cb86ceae253342c3e5fdf,https://canary.contestimg.wish.com/api/webimage/5b7cb86ceae253342c3e5fdf-medium.jpg,5b7cb86ceae253342c3e5fdf
S-5XL femmes 100% coton à manches longues revers bouton chemises décontracté baggy couleur unie Blouse hauts Blusas Femininas,S-5XL Women 100% Cotton Long Sleeved Lapel Button Shirts Casual Baggy Solid Color Blouse Tops Blusas Femininas,11.0,CHF,36.0,CHF,12,10,,,4.25,12.0,8,1,2,0,1,,,,,,black,s,29,Livraison standard,3.0,false,,50,,,CN,asyouwill,asyouwill,"90 % avis positifs (18,677 notes)",18677,4.21909300208813,583658e928f25754106ae102,,,https://www.wish.com/c/5fdc28d3ef98b3efb24c6666,https://canary.contestimg.wish.com/api/webimage/5fdc28d3ef98b3efb24c6666-medium.jpg,5fdc28d3ef98b3efb24c6666
Neue Damenmode Perfekt unvollkommene T-Shirts Sommer Kurzarm Grafisches T-Shirt Lässige T-Shirts mit O-Ausschnitt Tops Motivationshemd XS-3XL,New Womens Fashion Perfectly Imperfect T-Shirts Summer Short Sleeve Graphic Tee Casual O-neck T Shirts Tops Motivational Shirt XS-3XL,6.0,CHF,26.0,CHF,6,10,,,3.7,20.0,10,2,3,2,3,,,,,,black,xs,2,Livraison standard,2.0,false,,50,true,Quantité limitée !,CN,xy0001,xy0001,82% Positives Feedback (369 Bewertungen),369,3.9295392953929538,5d4c0ee81d9a8e3bab9a14d5,,,https://www.wish.com/c/5fc5d69713424a5bec7e9743,https://canary.contestimg.wish.com/api/webimage/5fc5d69713424a5bec7e9743-medium.jpg,5fc5d69713424a5bec7e9743
Nouveau Dames Vogue Brief Solide Spaghetti Strap Dentelle Soutiens-gorge Sous-Vêtements Mode Plus La Taille Bretelles Lingerie Camisole Dentelle Crop Tops Gilets,New Ladies Vogue Brief Solid Spaghetti Strap Lace Bras Underwear Fashion Plus Size Strappy Lingerie Camisole Lace Crop Tops Vests,7.0,CHF,46.0,CHF,7,1000,,,4.006666666666667,150.0,72,33,27,10,8,,,,,,beige,s,50,Livraison standard,2.0,false,,50,,,CN,WENFENGH,wenfengh,"(2,461 notes)",2461,4.130028443722064,5d536c64eb5ed446b27b4c55,,,https://www.wish.com/c/5e9e9721e2760932a39d8788,https://canary.contestimg.wish.com/api/webimage/5e9e9721e2760932a39d8788-medium.jpg,5e9e9721e2760932a39d8788
Les Lesbian Casual Atmungsaktive Schnalle Kurzbrust Brustbinder Trans Weste Tops Plus Size S-4XL 5XL Brust Wildfang BH Intimates,Les Lesbian Casual Breathable Buckle Short Chest Breast Binder Trans Vest Tops Plus Size S-4XL 5XL Breast Tomboy Bra Intimates,18.0,CHF,18.0,CHF,19,1,,,5.0,0.0,,,,,,,,,,,black,s,50,Livraison standard,11.0,false,,50,,,CA,11368796 CANADA CORPORATION,11368796canadacorporation,"80% Positives Feedback (1,166 Bewertungen)",1166,3.9382504288164664,5ffb1f43fa8a25c707537989,,,https://www.wish.com/c/5fff31e70f42fd73b7d027e1,https://canary.contestimg.wish.com/api/webimage/5fff31e70f42fd73b7d027e1-medium.jpg,5fff31e70f42fd73b7d027e1
"2020 nouvelle mode féminine, plus la taille des anneaux à lacets pailletés débardeur",2020 New Women's Fashion Plus Size Sequined Lace Up Rings Tank Top,10.0,CHF,10.0,CHF,11,10,,,4.590163934426229,61.0,44,13,1,2,1,,,,,,blue,s,50,Livraison standard,2.0,false,,50,,,CN,Romantic1,hzlangweigarmenttradingcoltd,"(35,107 notes)",35107,3.972512604323924,5440ca3d3dabbe25ca9e6bbf,,,https://www.wish.com/c/5f55d258f548d024e411c34a,https://canary.contestimg.wish.com/api/webimage/5f55d258f548d024e411c34a-medium.jpg,5f55d258f548d024e411c34a
Plus Taille S-8XL Mode pour Femmes Casual Tops T-shirt T-shirt Chemisier T-shirt Chemise Sexy à manches longues et manches amples pour femmes avec col en V,Plus Size S-8XL Women's Fashion Casual Chiffon Tops V-neck Solid Color Ladies Sexy Long Sleeve Shirt Loose Tops T Shirt Blouse,5.32,CHF,6.0,CHF,5.85,10000,,,3.33672974284328,2061.0,728,333,337,231,432,,,,,,armygreen,s,50,Livraison standard,2.0,false,,50,true,Quantité limitée !,CN,xiaojubo,xiaojubo,"(7,559 notes)",7559,3.942055827490409,584a9e7421390e4cb68dec18,,,https://www.wish.com/c/5c401febe434453d83320055,https://canary.contestimg.wish.com/api/webimage/5c401febe434453d83320055-medium.jpg,5c401febe434453d83320055
2019 femmes été mode hauts décontractés lâche chemise en coton squelette humain sans manches court débardeur style punk gilet taille S-5XL,2019 Women Summer Fashion Tops Casual Loose Cotton Shirt Human Skeleton Print Sleeveless Short Tank Top Punk Style Vest Size S-5XL,5.28,CHF,6.0,CHF,5.8100000000000005,1000,,,4.293948126801153,347.0,213,71,33,12,18,,,,,,white,xxxxl,6,Livraison standard,2.0,false,,50,true,Quantité limitée !,CN,yuanhuaxiaodaian,yuanhuaxiaodaian,"88 % avis positifs (5,799 notes)",5799,4.159855147439214,5ae00dbf67d25c69bcf0251c,,,https://www.wish.com/c/5cbfdb539f5865397b24f635,https://canary.contestimg.wish.com/api/webimage/5cbfdb539f5865397b24f635-medium.jpg,5cbfdb539f5865397b24f635
Nouveau mode des femmes hauts chauds automne hiver manteau à capuche décontracté sweat ample motif de chat pull sweat,New Women's Fashion Warm tops Autumn Winter Casual Hooded Coat Loose Sweatshirt Cat Pattern Pullover Sweatshirt,8.0,CHF,8.0,CHF,8,10000,,,3.662122687439143,1027.0,435,187,167,99,139,,,,,,white,s,35,Livraison standard,3.0,false,,50,,,CN,Wang Flag Fashion,wangflagfashion,"84 % avis positifs (3,897 notes)",3897,3.9779317423659224,5d46cdb476befe7f781dd1af,,,https://www.wish.com/c/5d96b5f926488e384cf4e4ac,https://canary.contestimg.wish.com/api/webimage/5d96b5f926488e384cf4e4ac-medium.jpg,5d96b5f926488e384cf4e4ac
Donne estate pizzo ali d'angelo indietro magliette cave top pullover casual o-collo,Women Summer Lace Angel Wings Back Hollow T-Shirts Tops Pullover Casual O-Neck,8.0,CHF,12.0,CHF,8,10,,,4.027027027027027,37.0,18,11,3,1,4,,,,,,black,s,50,Livraison standard,3.0,false,,50,,,CN,maaijddp,maaijddp,"86% feedback positivi (1,479 recensioni)",1479,4.098039215686274,591ec78770f6296b58f725e3,,,https://www.wish.com/c/5ee2e2528df15310cfaca9bc,https://canary.contestimg.wish.com/api/webimage/5ee2e2528df15310cfaca9bc-medium.jpg,5ee2e2528df15310cfaca9bc
Y2k Aesthetic Crop Top Corset Cami Top Vests Sexy Black Satin Slim Tops Sleeveless Tank 2021 Club Summer Sling Tube Top Slim,Y2k Aesthetic Crop Top Corset Cami Top Vests Sexy Black Satin Slim Tops Sleeveless Tank 2021 Club Summer Sling Tube Top Slim,13.0,CHF,13.0,CHF,14,6,,,5.0,0.0,,,,,,,,,,,green,s,50,Livraison standard,9.0,false,,50,,,CA,11368796 CANADA CORPORATION,11368796canadacorporation,"80 % avis positifs (1,166 notes)",1166,3.9382504288164664,5ffb1f43fa8a25c707537989,,,https://www.wish.com/c/600d8e89664a69d2e8a51535,https://canary.contestimg.wish.com/api/webimage/600d8e89664a69d2e8a51535-medium.jpg,600d8e89664a69d2e8a51535
Chemises à manches longues à col en V et à la mode pour femmes,Women's Fashion Printed V-neck Long Sleeve Shirts Casual Zipper Turn-down Collar Tunic Tops Ladies Daily Spring Autumn Plus Size Blouses Loose Pullover T-shirts,12.0,CHF,12.0,CHF,13,1000,,,3.9580152671755724,262.0,138,45,35,18,26,,,,,,blue,s,36,Livraison standard,3.0,false,,50,,,CN,Gemini Clothing Store,geminiclothingstore,"89 % avis positifs (10,795 notes)",10795,4.181658175081056,5455e9d83dabbe39f1e5f901,,,https://www.wish.com/c/5fc0d4b7f05b703635b37639,https://canary.contestimg.wish.com/api/webimage/5fc0d4b7f05b703635b37639-medium.jpg,5fc0d4b7f05b703635b37639
S-5XL Damen Plus Größe Kurze Ärmel Tops Lose Bluse V-Ausschnitt Reißverschlüsse Reine Farbe Sommer T-Shirts,S-5XL Women Plus size Short sleeves Tops Casual Loose Blouse V-neck Zippers Pure color Summer T shirts,5.22,CHF,46.0,CHF,5.74,1000,,,4.012875536480687,233.0,110,63,31,11,18,,,,,,black,s,3,Livraison standard,2.0,false,,50,true,Quantité limitée !,CN,Guangzhou xingwang,guangzhouxingwang,"85% Positives Feedback (8,953 Bewertungen)",8953,3.9926281693287167,5709df2cdc53bf590627daff,,,https://www.wish.com/c/5c6663d6da1adc493752c817,https://canary.contestimg.wish.com/api/webimage/5c6663d6da1adc493752c817-medium.jpg,5c6663d6da1adc493752c817
NOVAS mulheres soltas e casuais estampadas em torno do pescoço mangas curtas plus size camisetas tops,NEW Women Loose Casual Printed Round Neck Short Sleeves Plus Size T Shirts Tops,6.0,CHF,6.0,CHF,6,10,,,3.6,50.0,19,13,6,3,9,,,,,,,xxs,48,Livraison standard,2.0,false,,50,true,Quantité limitée !,CN,xueqing shop,xueqingshop,"89% Feedback positivo (2,332 avaliações)",2332,4.124785591766724,5ad847aaa6f62e50911c5007,,,https://www.wish.com/c/5f5ee310d4621b5a8b77e6c9,https://canary.contestimg.wish.com/api/webimage/5f5ee310d4621b5a8b77e6c9-medium.jpg,5f5ee310d4621b5a8b77e6c9
Femmes Débardeur Sous-Vêtements Crop Top Soutien-gorge En Dentelle Soutien-Gorge Tube Top Poitrine Enveloppée,Women Tank Top Underwear Crop Top Brassiere Lace Bra Tube Top Wrapped Chest,4.23,CHF,5.0,CHF,4.66,10000,,,3.9591655570350643,2253.0,1179,400,304,143,227,,,,,,nude,m,50,Livraison standard,1.0,false,,50,,,CN,guixiangzheng,guixiangzheng,"89 % avis positifs (6,049 notes)",6049,4.206645726566375,58f31be6da42631634bc2993,,,https://www.wish.com/c/5cdd7dc9fb2ec04153dfe45e,https://canary.contestimg.wish.com/api/webimage/5cdd7dc9fb2ec04153dfe45e-medium.jpg,5cdd7dc9fb2ec04153dfe45e
Femmes décontracté à manches courtes paillettes t-shirt femmes Bandage élégant T-shirt dames évider Sexy haut court fête d'été,Women Casual Short Sleeve Glitter T Shirt Women Bandage Elegant T-shirt Ladies Hollow Out Sexy Crop Top Summer Party,9.0,CHF,9.0,CHF,9,10,,,4.102564102564102,39.0,21,6,8,3,1,,,,,,,s,50,Livraison standard,3.0,false,,50,,,CN,shiruyu,shiruyu,"87 % avis positifs (2,872 notes)",2872,4.155292479108635,5ac4335d856edf32c3dc966b,,,https://www.wish.com/c/5e75cd3c7b9a1e527fa006c6,https://canary.contestimg.wish.com/api/webimage/5e75cd3c7b9a1e527fa006c6-medium.jpg,5e75cd3c7b9a1e527fa006c6
Mode été femme dame sans manches o-cou bonbons gilet mince débardeurs T-shirt dentelle amour Mini gilet,Fashion Summer Woman Lady Sleeveless O-Neck Candy Vest Slim Tank Tops T-shirt  Lace Love Mini Vest,8.0,CHF,8.0,CHF,8,10,,,5.0,1.0,1,0,0,0,0,,,,,,black,l,50,Livraison standard,2.0,false,,50,,,CN,fashion_store,fashion_store,"(503,051 notes)",503051,4.256749315675747,53b7bace46188e74de5f7e7d,,,https://www.wish.com/c/5f27ad12d3cbb9004a4fdc05,https://canary.contestimg.wish.com/api/webimage/5f27ad12d3cbb9004a4fdc05-medium.jpg,5f27ad12d3cbb9004a4fdc05
Sexy Frauen Sommer Weste Top ärmellose Bluse Freizeit-Tank Tops T-Shirt Besser SS,Sexy Women Summer Vest Top Sleeveless Blouse Casual Tank Tops T Shirt Better SS,6.0,CHF,6.0,CHF,6,50000,,,4.003626384396746,10203.0,5310,1885,1529,693,786,,,,,,grey,s,50,Livraison standard,2.0,false,,50,,,CN,Ice Scream,icescream,"(208,734 Bewertungen)",208734,4.214914676094934,572d45c708fad86678ca1938,,,https://www.wish.com/c/58b7dc3133b0bd5914a62c90,https://canary.contestimg.wish.com/api/webimage/58b7dc3133b0bd5914a62c90-medium.jpg,58b7dc3133b0bd5914a62c90
Women's Daisy Printed Round Neck Comfortable Sports T-shirt Plus Size Casual Short Sleeve Tops Blouse,Women's Daisy Printed Round Neck Comfortable Sports T-shirt Plus Size Casual Short Sleeve Tops Blouse,8.0,CHF,8.0,CHF,8,10,,,5.0,0.0,,,,,,,,,,,purple,s,50,Livraison standard,2.0,false,,50,,,CN,fgdhdhd,fgdhdhd,(48 notes),48,4.0625,5d4d5a143db43e2a2dbb4649,,,https://www.wish.com/c/6062a3c0ccf75aad571e46ad,https://canary.contestimg.wish.com/api/webimage/6062a3c0ccf75aad571e46ad-medium.jpg,6062a3c0ccf75aad571e46ad
Sommer Damenmode Sexy Tops V-Ausschnitt Ärmelloses Shirt Aus Schulter Top Shirts Lose Baumwolle Plissee T-Shirts Freizeit Rückenlose Camisole Mode Damen Träger Tank Top Solid Color Sling Bluse Plus Size Shirts XXS-6XL (12 Farben),Summer Women's Fashion Sexy Tops V Neck Sleeveless Shirt Off Shoulder Top Shirts Loose Cotton Pleated T Shirts Casual Backless Camisole Fashion Ladies Straps Tank Top Solid Color Sling Blouse Plus Size Shirts XXS-6XL (12 Colors ),8.0,CHF,10.0,CHF,8,10000,,,3.998196031268791,1663.0,865,320,229,108,141,,,,,,black,s,50,Livraison standard,2.0,false,,50,true,Quantité limitée !,CN,Wwenliping,wwenliping,"(2,890 Bewertungen)",2890,4.147404844290658,5ae5c3cb4215954239aff8b9,,,https://www.wish.com/c/5b812c6bad9cf525ee514516,https://canary.contestimg.wish.com/api/webimage/5b812c6bad9cf525ee514516-medium.jpg,5b812c6bad9cf525ee514516
XS-8XL Women's Fashion Summer Clothes Casual O-Neck Sleeveless Tops Lace Hem Patchwork Tank Tops Solid Color Camisole Loose Cotton Shirts Ladies Pleated T-shirt Plus Size Tunic Blouses,XS-8XL Women's Fashion Summer Clothes Casual O-Neck Sleeveless Tops Lace Hem Patchwork Tank Tops Solid Color Camisole Loose Cotton Shirts Ladies Pleated T-shirt Plus Size Tunic Blouses,8.0,CHF,8.0,CHF,8,10,,,5.0,0.0,,,,,,,,,,,armygreen,xs,5,Livraison standard,3.0,false,,50,,,CN,ruanjia,ruanjia,60 % avis positifs (42 notes),42,3.1666666666666665,5e54be19d0a3ba544286556d,,,https://www.wish.com/c/606e7634a54ff3b8406f1eb1,https://canary.contestimg.wish.com/api/webimage/606e7634a54ff3b8406f1eb1-medium.jpg,606e7634a54ff3b8406f1eb1
XS-6XL Femmes Vêtements De Mode Printemps Eté Casual T-shirt À Manches Longues Lâche Crâne Imprimé Tops Dames Automne Hiver Col En V Chemises Coton Plus La Taille Blouse,XS-6XL Womens Fashion Clothes Spring Summer Casual Long Sleeved T-shirt Loose Skull Printed Tops Ladies Autumn Winter V-neck Shirts Cotton Plus Size Blouse,5.22,CHF,6.0,CHF,5.75,10,,,3.8392857142857144,56.0,30,7,7,4,8,,,,,,purple,xs,6,Livraison standard,2.0,false,,50,true,Quantité limitée !,CN,yangaiqun,yangaiqun,"89 % avis positifs (16,039 notes)",16039,4.15437371407195,58106cfce516491e6e5f1e53,,,https://www.wish.com/c/5fe19251ebc3903b83ed6bf7,https://canary.contestimg.wish.com/api/webimage/5fe19251ebc3903b83ed6bf7-medium.jpg,5fe19251ebc3903b83ed6bf7
Frauen Sommerhemden Plus ärmelloses Top mit V-Ausschnitt Solid Cami Top Double Layer Front Tank Top,Women Summer Shirts Plus V Neck Sleeveless Top Solid Cami Top Double Layer Front Tank Top,9.0,CHF,9.0,CHF,9,5000,,,3.522114347357066,927.0,327,200,167,96,137,,,,,,burgundy,m,50,Livraison standard,3.0,false,,50,,,CN,Anqiyila,anqiyila,"89% Positives Feedback (13,318 Bewertungen)",13318,4.184637332932873,58f0a6738a60c363c1281d72,,,https://www.wish.com/c/5ccea5c767c5606e6f8022b1,https://canary.contestimg.wish.com/api/webimage/5ccea5c767c5606e6f8022b1-medium.jpg,5ccea5c767c5606e6f8022b1
Women's Fashion Chiffon Irregular Stitehed Tops Summer Casual Short Sleeved Gradients Printed V-Neck Button Shirt & Blouses,Women's Fashion Chiffon Irregular Stitehed Tops Summer Casual Short Sleeved Gradients Printed V-Neck Button Shirt & Blouses,2.0,CHF,2.0,CHF,2,10,,,5.0,0.0,,,,,,,,,,,green,⁢,1,Livraison standard,1,false,,50,,,CN,ahuye,ahuye,"91 % avis positifs (2,244 notes)",2244,4.295900178253119,59170a3d46cd1a2edc0777ef,,,https://www.wish.com/c/6073b4aabe453e1739d5aad3,https://canary.contestimg.wish.com/api/webimage/6073b4aabe453e1739d5aad3-medium.jpg,6073b4aabe453e1739d5aad3
S-5XL Femmes Mode Solide Couleur Longue Sleeeve T-Shirts Blouse Casual Lâche Profonde Col En V Coton Tee Shirt Tops Plus La Taille,S-5XL Women Fashion Solid Color Long Sleeeve T-Shirts Blouse Casual Loose Deep V Neck Cotton Tee Shirt Tops Plus Size,9.0,CHF,78.0,CHF,9,5000,,,3.4517543859649122,456.0,167,79,88,37,85,,,,,,white,s,50,Livraison standard,3.0,false,,50,,,CN,yyll3,yyll3,"78 % avis positifs (1,364 notes)",1364,3.6957478005865103,5d44ec17a5f07b3a66607891,,,https://www.wish.com/c/5e79a128e6abf32800613365,https://canary.contestimg.wish.com/api/webimage/5e79a128e6abf32800613365-medium.jpg,5e79a128e6abf32800613365
XS-8XL Chemises à la mode de grande taille Vêtements d'automne et d'hiver pour femmes T-shirts décontractés à manches longues Pulls molletonnés à col en V profond Blouses de couleur unie pour femmes T-shirts en coton en vrac,XS-8XL Plus Size Fashion Shirts Autumn and Winter Clothes Women's Casual Long Sleeve Tops Pullover Sweatshirts Deep V-neck Blouses Ladies Solid Color Button Up Loose Cotton T-shirts,4.0,CHF,4.0,CHF,4,1000,,,3.626334519572954,281.0,120,50,41,26,44,,,,,,white,xs,2,Livraison standard,1.0,false,,50,,,SG,Recherche.sg,recherchesg,"(6,123 notes)",6123,3.9500244977951984,5810aa5bde5bf01b645c909e,,,https://www.wish.com/c/5f15398571b21f1279f97615,https://canary.contestimg.wish.com/api/webimage/5f15398571b21f1279f97615-medium.jpg,5f15398571b21f1279f97615
Frauen Overbust Korsett Bustier Sexy Tank Vintage Plus Size Top Mode S-6XL,Women's Overbust Corset Bustier  Sexy Tank Vintage Plus Size Top Fashion S-6XL,13.0,CHF,13.0,CHF,14,1000,,,4.092134831460674,445.0,245,90,53,20,37,,,,,,purple,s,50,Livraison standard,3.0,false,,50,,,CN,shenzhenshibaoanqushajingruinuofushishangxing,深圳市宝安区沙井瑞诺服饰商行,"(8,692 Bewertungen)",8692,4.165439484583525,5611e4a5b307de2226a6d796,,,https://www.wish.com/c/5d1c0f77632b5f12e04ea005,https://canary.contestimg.wish.com/api/webimage/5d1c0f77632b5f12e04ea005-medium.jpg,5d1c0f77632b5f12e04ea005
Canottiera da uomo in pelle moda gilet senza maniche bavero zip,Men Fashion Leather Vest Sleeveless  Lapel Zip Vest Men Tops,16.0,CHF,16.0,CHF,17,10,,,3.543859649122807,57.0,23,11,8,4,11,,,,,,white,xs,1,Livraison standard,5.0,false,,50,,,CN,pingmingcheng,pingmingcheng,(149 valutazioni),149,3.7181208053691277,5b4991211e5bc9601acd0077,,,https://www.wish.com/c/5eb9148ee01579790109a343,https://canary.contestimg.wish.com/api/webimage/5eb9148ee01579790109a343-medium.jpg,5eb9148ee01579790109a343
Sommer ärmelloses Hemd für Frauen Unterhemden Tops mit eingebautem gepolstertem BH Basic Breathable Tank Top Tägliches Tragen,Summer Sleeveless Shirt for Women Camisoles Tops with Built In Padded Bra Basic Breathable Tank Top Daily Wearing ,12.0,CHF,45.0,CHF,13,10,,,4.1866666666666665,75.0,48,11,6,2,8,,,,,,black,s,50,Livraison standard,3.0,false,,50,true,Quantité limitée !,CN,Naughty Trendy Her,naughtytrendyher,83% Positives Feedback (745 Bewertungen),745,3.959731543624161,5e1ebfed7f105503935e4c1a,,,https://www.wish.com/c/5ebf80680a8c3b40ab200fcf,https://canary.contestimg.wish.com/api/webimage/5ebf80680a8c3b40ab200fcf-medium.jpg,5ebf80680a8c3b40ab200fcf
Xzaishine,,,,,,,,,,,,,,,,,,,,,,,,,,,,,,,,,,,,,,,,,https://www.wish.com/c/5f994fc7f82dcc00109ede8c,,5f994fc7f82dcc00109ede8c
Grande taille Womens Fashion Empire taille Paisley Floral Vintage imprimé 3/4 manches évasées tunique T-shirts S-5XL,Plus Size Womens Fashion Empire Waist Paisley Floral Vintage Printed 3/4 Sleeve Flared Tunic Tops S-5XL,9.0,CHF,9.0,CHF,9,5000,,,3.8095238095238093,525.0,243,103,73,48,58,,,,,,white,xs,1,Livraison standard,3.0,false,,50,,,CN,qilinshangpu,麒麟商铺,"84 % avis positifs (10,250 notes)",10250,3.918341463414634,57af1773b0960b618a6f50e8,,,https://www.wish.com/c/5dee031c37b11b44356bd1f3,https://canary.contestimg.wish.com/api/webimage/5dee031c37b11b44356bd1f3-medium.jpg,5dee031c37b11b44356bd1f3
RDX t-shirts MMA hauts d'entraînement t-shirt boxe Sparring Grappling cyclisme course à pied exercice de sport décontracté Gym entraînement,RDX T Shirts MMA Training Tops Tee Shirt Boxing Sparring Grappling Cycling Running Sports Exercise Casual Gym Workout,25.0,CHF,53.0,CHF,27,5,,,5.0,2.0,2,0,0,0,0,,,,,,black,m,25,Livraison standard,7.0,false,,25,,,GB,B2Fitness,b2fitness,"96 % avis positifs (11,897 notes)",11897,4.615869546944608,5a0ef362ddda8c16db2693c4,,,https://www.wish.com/c/5d41885572b0c96930f74455,https://canary.contestimg.wish.com/api/webimage/5d41885572b0c96930f74455-medium.jpg,5d41885572b0c96930f74455
