title,title_orig,discount_price,discount_price_currency,retail_price,retail_price_currency,discount_price_in_original_currency,nb_cart_orders_approx,nb_units_purchased_approx,uses_ad_boosts,rating,rating_count,rating_five_count,rating_four_count,rating_three_count,rating_two_count,rating_one_count,badges_count,badge_local_product,badge_product_quality,badge_fast_shipping,tags,product_color,product_variation_size_id,product_variation_inventory,shipping_option_name,shipping_option_price,shipping_is_express,countries_shipped_to,inventory_total,has_urgency_banner,urgency_text,origin_country,merchant_title,merchant_name,merchant_info_subtitle,merchant_rating_count,merchant_rating,merchant_id,merchant_has_profile_picture,merchant_profile_picture,product_url,product_picture,product_id
Horses Faith Hope Love Jesus Flowers Stars Galaxy Christ Animal Bible Black Bedding Cover With 2 Pillowcases 100% Polyester,Horses Faith Hope Love Jesus Flowers Stars Galaxy Christ Animal Bible Black Bedding Cover With 2 Pillowcases 100% Polyester,43.0,EUR,67.0,EUR,51.6,0,,,5.0,0.0,,,,,,,,,,,,twin65×71inchesbeddingset,50,Livraison standard,8.99,false,,50,true,Quantité limitée !,VN,maccc,maccc,90 % avis positifs (303 notes),303,4.32013201320132,5ffea615fa9415150cb997db,,,https://www.wish.com/c/606f2dade3cd1ad4367b7476,https://canary.contestimg.wish.com/api/webimage/606f2dade3cd1ad4367b7476-medium.jpg,606f2dade3cd1ad4367b7476
Je connais les plans que j'ai pour vous citations de la sainte Bible unisexe femmes T-Shirt chrétien décontracté à manches courtes t-shirt imprimé,I Know The Plans I Have For You Holy Bible Quotes Unisex Women Christian T-Shirt Casual Short Sleeves Printed Tee,8.0,EUR,19.0,EUR,9,1000,,,4.653614457831325,332.0,264,39,17,6,6,,,,,,black,s,50,Livraison standard,3.0,false,,50,,,CN,yiwu puer E-commerce,yiwupuerecommerce,"95 % avis positifs (64,434 notes)",64434,4.447139708849365,551df852d3579c0d854e0ad7,,,https://www.wish.com/c/5912acbc89dc4a0f818a243c,https://canary.contestimg.wish.com/api/webimage/5912acbc89dc4a0f818a243c-medium.jpg,5912acbc89dc4a0f818a243c
Baseball Cross Pendant JE PEUX FAIRE TOUTES CHOSES FORCE Bible Verset Collier Pendentif En Acier Inoxydable,Baseball Cross Pendant I CAN DO ALL THINGS STRENGTH Bible Verse Stainless Steel Pendant Necklace,3.96,EUR,4.0,EUR,4.8,10,,,4.483870967741935,31.0,23,3,3,1,1,,,,,,black,,50,Livraison standard,1.0,false,,50,true,Quantité limitée !,CN,BlueKouknitclothing,bluekouknitclothing,"88 % avis positifs (9,827 notes)",9827,4.191207896611377,59fbfe6f3eb22a10fb7af7b1,,,https://www.wish.com/c/5d883423ea145e62c0c3ce19,https://canary.contestimg.wish.com/api/webimage/5d883423ea145e62c0c3ce19-medium.jpg,5d883423ea145e62c0c3ce19
T-shirt à manches courtes à la mode pour femmes & quot; Soyez tranquille et sachez que je suis Dieu & quot; T-shirt imprimé par lettre T-shirt décontracté T-shirt chrétien,Women's Fashion Short Sleeves &quot;Be Still and Know That I Am God &quot;letter Printed T-shirt Tops Casual Tee Shirt Christian T-Shirt Religious Shirts Faith Shirts Bible Verse Tee,10.0,EUR,10.0,EUR,11,10,,,3.4210526315789473,19.0,9,1,2,3,4,,,,,,green,s,50,Livraison standard,3.0,false,,50,,,CN,fashoppy,fashoppy,"77 % avis positifs (4,141 notes)",4141,3.721806326974161,57d7cda72653323efe462664,,,https://www.wish.com/c/5dd4d2d2c9eb7482728ec76e,https://canary.contestimg.wish.com/api/webimage/5dd4d2d2c9eb7482728ec76e-medium.jpg,5dd4d2d2c9eb7482728ec76e
zhehao Plus grand est celui qui est en moi que celui qui est dans le monde. Sticker biblique écritures chrétiennes en vinyle,"zhehao Greater is He that is in me, than he that is in the world. Bible Scripture Christian Vinyl Wall Art Decal",6.0,EUR,6.0,EUR,7,10,,,4.666666666666667,3.0,2,1,0,0,0,,,,,,white,,50,Livraison standard,2.0,false,,50,,,CN,zhehao,zhehao,"92 % avis positifs (4,082 notes)",4082,4.35717785399314,595e31f97fe241256ff1a002,,,https://www.wish.com/c/59cf4b6f0a99611deb64b617,https://canary.contestimg.wish.com/api/webimage/59cf4b6f0a99611deb64b617-medium.jpg,59cf4b6f0a99611deb64b617
"colliers pour hommes Bible croix bague anneau collier, acier inoxydable titane hommes \ 's collier en acier inoxydable, croix collier homme amoureux collier","mens necklaces Bible cross ring ring necklace, titanium steel men\'s stainless steel necklace, cross necklace man lovers necklace",4.0,EUR,4.0,EUR,4,20000,,,4.159070990359334,2282.0,1322,401,302,114,143,,,,,,blue,,50,Livraison standard,1.0,false,,50,true,Quantité limitée !,CN,jewelry,jewelry,"91 % avis positifs (83,504 notes)",83504,4.313242479402184,53a92e58ff4d6d618e7b57bb,,,https://www.wish.com/c/546d682e90c7763421a68c1c,https://canary.contestimg.wish.com/api/webimage/546d682e90c7763421a68c1c-medium.jpg,546d682e90c7763421a68c1c
NOVE JEWELRY Religieux Mode Homme 316L En Acier Inoxydable Verset Bible Anglaise Croix Prière Du Seigneur Hommes Main Chaîne Bracelet Bracelet Manchette Bracelet Noir,NOVE JEWELRY religious men's fashion 316L stainless steel english bible verse cross lord's prayer mens hand chain bracelet wristband cuff bangle black,10.0,EUR,19.0,EUR,11,10,,,4.505952380952381,168.0,115,35,10,4,4,,,,,,,,50,Livraison standard,2.0,false,,50,true,Quantité limitée !,CN,NOVE,nove,"96 % avis positifs (6,866 notes)",6866,4.551558403728517,56e7fd28cde09374e3df4d1f,,,https://www.wish.com/c/584ea0b6131c394f6882a20c,https://canary.contestimg.wish.com/api/webimage/584ea0b6131c394f6882a20c-medium.jpg,584ea0b6131c394f6882a20c
Christian Art Gifts Ceramic Round Ring Dish Jewelry Holder | Give Thanks in Everything ? 1 Thessalonians 5:18 | Bible Verse Trinket Tray Dish for Jewelry and Accessories,Christian Art Gifts Ceramic Round Ring Dish Jewelry Holder | Give Thanks in Everything ? 1 Thessalonians 5:18 | Bible Verse Trinket Tray Dish for Jewelry and Accessories,11.0,EUR,11.0,EUR,12.65,0,,,5.0,0.0,,,,,,,,,,,,,2,Livraison standard,15.95,false,,2,,,US,Atharva Products,atharvaproducts,"96 % avis positifs (3,602 notes)",3602,4.667406996113271,5733bba675f50319c6a1f3b3,,,https://www.wish.com/c/5f4c4ac47da0035ec2421997,https://canary.contestimg.wish.com/api/webimage/5f4c4ac47da0035ec2421997-medium.jpg,5f4c4ac47da0035ec2421997
Noir Argent Vintage Classiques Prière du Seigneur Bible Croix Titane Acier Mode Bague À La Mode Pour Hommes Femmes Bijoux Personnalisés Punk Bagues,Black Silver Vintage Classics Lord's Prayer Bible Cross Titanium Steel Fashion Trendy Ring For Men Women Personalized Jewelry Punk Finger Rings,5.0,EUR,8.0,EUR,6,10,,,4.5,4.0,2,2,0,0,0,,,,,,,7,50,Livraison standard,2.0,false,,50,,,CN,EZMAX,ezmax,"95 % avis positifs (15,975 notes)",15975,4.481001564945227,5409c9b67f086e17ac87d6d4,,,https://www.wish.com/c/5bcae47945286b091f3b2410,https://canary.contestimg.wish.com/api/webimage/5bcae47945286b091f3b2410-medium.jpg,5bcae47945286b091f3b2410
Citation biblique lettres de foi chrétienne masque imprimé pour unisexe hommes femmes,Bible Quote Christian Faith Letters Printed Face Mask for Unisex Men Women,1.0,EUR,4.0,EUR,1.04,10000,,,3.963696369636964,303.0,182,39,21,11,50,,,,,,black,1,50,Livraison standard,2.06,false,,50,,,CN,zhaofang99,zhaofang99,"80 % avis positifs (1,361 notes)",1361,3.8971344599559146,5d428c74e4b65d2680befc16,,,https://www.wish.com/c/5eb8e270fcc85c1e555c97a2,https://canary.contestimg.wish.com/api/webimage/5eb8e270fcc85c1e555c97a2-medium.jpg,5eb8e270fcc85c1e555c97a2
Back off diable j'appartiens à Jésus T-shirt croix T-shirt Diable T-shirt jésus T-shirt Faith T-shirt,Back off devil i belong to jesus T-shirt cross T-shirt Devil T-shirt jesus T-shirt Faith T-shirt,14.0,EUR,41.0,EUR,16,10,,,4.337837837837838,74.0,51,10,5,3,5,,,,,,black,s,50,Livraison standard,4.0,false,,50,,,CN,jinhu yang,jinhuyang,81 % avis positifs (603 notes),603,3.855721393034826,5b0167147d4d8462a090b3a5,,,https://www.wish.com/c/5cd3a3482b1b243f6f50432c,https://canary.contestimg.wish.com/api/webimage/5cd3a3482b1b243f6f50432c-medium.jpg,5cd3a3482b1b243f6f50432c
Nouveaux bijoux exquis 18K classique mode croix jésus pendentif collier pour hommes bijoux de foi,New Exquisite Jewelry 18K Classic Fashion Cross Jesus Pendant Men's Necklace Faith Jewelry,2.22,EUR,5.0,EUR,2.69,10,,,4.666666666666667,6.0,4,2,0,0,0,,,,,,black,1pcs(lowquality),34,Livraison standard,1,false,,50,,,CN,nbmxfytry,nbmxfytry,100 % avis positifs (6 notes),6,4.5,5fa0dc85588f714b93fc6f54,,,https://www.wish.com/c/5ff7f521f20bbf970171360d,https://canary.contestimg.wish.com/api/webimage/5ff7f521f20bbf970171360d-medium.jpg,5ff7f521f20bbf970171360d
Collier Pendentif de Croix bible en acier inoxydable pour homme et femme,Stainless Steel Bible Verse Cross Pendant Necklace for Men Women,3.12,EUR,10.0,EUR,3.7800000000000002,1000,,,4.027027027027027,111.0,63,20,10,4,14,,,,,,,silver,50,Livraison standard,1.0,false,,50,,,CN,Rosewen,rosewen,"(37,038 notes)",37038,4.305173065500297,585f6f4ab7b3514cec763071,,,https://www.wish.com/c/5c88f5a1d379a553fe754e1b,https://canary.contestimg.wish.com/api/webimage/5c88f5a1d379a553fe754e1b-medium.jpg,5c88f5a1d379a553fe754e1b
Philippians 4:13 Cross Pendant Strength Bible Verse Stainless Steel Necklace Snake Chain 22 in,Philippians 4:13 Cross Pendant Strength Bible Verse Stainless Steel Necklace Snake Chain 22 in,95.0,EUR,123.0,EUR,114.99,0,,,5.0,0.0,,,,,,,,,,,,,3,Livraison standard,19.99,false,,3,true,Quantité limitée !,GB,Giftenza,giftenza,79 % avis positifs (336 notes),336,3.8660714285714284,5e778af629e7865cfc55bd63,,,https://www.wish.com/c/60726a7567be3c504516ae42,https://canary.contestimg.wish.com/api/webimage/60726a7567be3c504516ae42-medium.jpg,60726a7567be3c504516ae42
5 couleurs nouvelles femmes mode je suis un enfant de dieu chrétien T-Shirt manches courtes chemises religieuses chemises de foi verset biblique t-shirt grande taille,5 Colors New Women Fashion I Am A Child of God Christian T-Shirt Short Sleeves Religious Shirts Faith Shirts Bible Verse Tee Plus Size,8.0,EUR,10.0,EUR,9,10,,,4.5,2.0,1,1,0,0,0,,,,,,lightpink,xs,2,Livraison standard,3.0,false,,50,,,CN,YRio,yrio,"79 % avis positifs (5,240 notes)",5240,3.759351145038168,565c0ee33a698c766e2bdd82,,,https://www.wish.com/c/5e1c7827f1ef5156cd931a3b,https://canary.contestimg.wish.com/api/webimage/5e1c7827f1ef5156cd931a3b-medium.jpg,5e1c7827f1ef5156cd931a3b
"Plus petite Bible en sténographie, 1654 après J.-C., manuscrit, American Bible Society, NY, USA Poster Print","Smallest Bible In Shorthand, 1654 A.D., Manuscript, American Bible Society, NY, USA Poster Print",34.0,EUR,37.0,EUR,41,0,,,5.0,0.0,,,,,,,,,,,,18x24,50,Livraison standard,11.0,false,,50,,,US,Posterazzi,posterazzi,"77 % avis positifs (5,643 notes)",5643,3.8628389154704945,55c0deb64e6a0874f22b3167,,,https://www.wish.com/c/590e81f89d70be0e213a2179,https://canary.contestimg.wish.com/api/webimage/590e81f89d70be0e213a2179-medium.jpg,590e81f89d70be0e213a2179
Soyez toujours citations inspirantes Art Bible écritures verset chrétien décor imprimable salon chambre cuisine décor affiche murale impression sur toile sans cadres,Be Still Inspirational Quotes Art Bible Scripture Christian Verse Printable Decor Living Room Bedroom Kitchen Decor Poster Wall Mural Canvas Print  Without Frames,10.0,EUR,10.0,EUR,11,10,,,3.8518518518518516,27.0,17,2,1,1,6,,,,,,black,s,50,Livraison standard,2.0,false,,50,,,CN,BigWallArtsCompany,bigwallartscompany,"83 % avis positifs (4,607 notes)",4607,3.9079661384849143,582c13a8728de646fc486d92,,,https://www.wish.com/c/5d4e689cc91ce97c538c88c4,https://canary.contestimg.wish.com/api/webimage/5d4e689cc91ce97c538c88c4-medium.jpg,5d4e689cc91ce97c538c88c4
1 pc or argent Mini sainte Bible porte-clés religieux Miniature papier spirituel chrétien jésus couverture porte-clés cadeau,1pc Gold Silver Mini Holy Bible Keychain Religious Miniature Paper Spiritual Christian Jesus Cover Keyring Gift,3.99,EUR,4.0,EUR,4.84,10,,,3.4375,16.0,7,2,1,3,3,,,,,,gold,1pc,50,Livraison standard,1.0,false,,50,,,CN,zhaolixia963,zhaolixia963,87 % avis positifs (396 notes),396,4.126262626262626,5d5238ff1d9a8e14acd33ef7,,,https://www.wish.com/c/5fcdee446c1b98c97e07f5c7,https://canary.contestimg.wish.com/api/webimage/5fcdee446c1b98c97e07f5c7-medium.jpg,5fcdee446c1b98c97e07f5c7
Argent / Titane Acier Gothique Punk Militaire Religieux Prière du Seigneur Verset Bible Dog Tag Pendentif Croix Collier Pour Hommes Femmes Hip Hop Bijoux 550mm + 50mm Chaîne,Silver / Titanium Steel Gothic Punk Military Religious Lord's Prayer Bible Verse Dog Tag Pendant Cross Necklace For Men Women Hip Hop Jewelry 550mm + 50mm Chain,7.0,EUR,17.0,EUR,8,5,,,5.0,1.0,1,0,0,0,0,,,,,,silver,,50,Livraison standard,2.0,false,,50,true,Quantité limitée !,CN,EZMAX,ezmax,"95 % avis positifs (15,975 notes)",15975,4.481001564945227,5409c9b67f086e17ac87d6d4,,,https://www.wish.com/c/5ab4690a7c2768680c7bc94b,https://canary.contestimg.wish.com/api/webimage/5ab4690a7c2768680c7bc94b-medium.jpg,5ab4690a7c2768680c7bc94b
Bijoux Mode Homme Punk Rock Acier Inoxydable Personnalisé Noir / Argent / Or Discothèque Dominatrice Philippiens 4:13 Religieux Bible Croix Prière du Seigneur Dog Tag Militaire Armée Style Pendentif Collier,Fashion Men's Jewelry Punk Rock Stainless Steel Personalized Black / Silver / Gold NightClub Domineering Philippians 4:13 Religious Bible Cross Lord's Prayer Dog Tag Military Army Style Pendant Necklace,7.0,EUR,27.0,EUR,8,2,,,5.0,0.0,,,,,,,,,,,silver,,50,Livraison standard,2.0,false,,50,true,Quantité limitée !,CN,Lucky Yirui Store,luckyyiruistore,83 % avis positifs (47 notes),47,4.148936170212766,5d53748c7edfad37c3879777,,,https://www.wish.com/c/5ebf5d4b5c05bd2c4b0d84d9,https://canary.contestimg.wish.com/api/webimage/5ebf5d4b5c05bd2c4b0d84d9-medium.jpg,5ebf5d4b5c05bd2c4b0d84d9
St christopher collier Saint Christopher pendentif collier Protection collier collier chrétien bible bijoux jésus bijoux cadeau chrétien,St christopher necklace Saint Christopher Pendant Necklace Protection Necklace Christian necklace bible jewelry jesus jewelry christian gift,5.0,EUR,16.0,EUR,6,10,,,4.0,2.0,0,2,0,0,0,,,,,,,,50,Livraison standard,2.0,false,,50,,,CN,Zhuhai Haobo Trading Company,zhuhaihaobotradingcompany,"96 % avis positifs (1,386 notes)",1386,4.52020202020202,5579b23abaa01a19ea8aa731,,,https://www.wish.com/c/59ca562ea41ccd6ac20da8e0,https://canary.contestimg.wish.com/api/webimage/59ca562ea41ccd6ac20da8e0-medium.jpg,59ca562ea41ccd6ac20da8e0
zhehao Faites confiance au Seigneur de tout votre cœur et ne vous appuyez pas sur votre propre compréhension Proverbes 3: 5-6 Verset biblique Écriture chrétienne Sticker mural Sticker Art Mural Citation de décoration intérieure,zhehao Trust In The Lord With All Your Heart and Lean Not On Your Own Understanding Proverbs 3:5-6 Bible Verse Scripture Christian Wall Decal Sticker Art Mural Home Decor Quote,7.0,EUR,7.0,EUR,8,10,,,4.166666666666667,18.0,12,2,1,1,2,,,,,,white,,50,Livraison standard,2.0,false,,50,true,Quantité limitée !,CN,zhehao,zhehao,"92 % avis positifs (4,082 notes)",4082,4.35717785399314,595e31f97fe241256ff1a002,,,https://www.wish.com/c/5a1936667a4f3b15b8ba075a,https://canary.contestimg.wish.com/api/webimage/5a1936667a4f3b15b8ba075a-medium.jpg,5a1936667a4f3b15b8ba075a
Impression d'art moderne foi espoir amour affiche salon mur Art chambre décor toile Art peinture image Bible verset bureau toile peinture sans cadres,Modern Art Print Faith Hope Love Poster Living Room Wall Art  Room Decor Canvas Art Painting Picture Bible Verse  Office Canvas Painting  Without Frames ,3.98,EUR,4.0,EUR,4.82,1000,,,3.562962962962963,135.0,63,18,16,8,30,,,,,,,faith,50,Livraison standard,1.0,false,,50,true,Quantité limitée !,CN,fenghuiart,fenghuiart,"(1,593 notes)",1593,3.9642184557438793,583192e1728de6105bd47442,,,https://www.wish.com/c/5dc3d9bca313520fb4efef47,https://canary.contestimg.wish.com/api/webimage/5dc3d9bca313520fb4efef47-medium.jpg,5dc3d9bca313520fb4efef47
Religion Christian's Jewelry Stainless Steel Bible Jesus Cross Pendant Necklace,Religion Christian's Jewelry Stainless Steel Bible Jesus Cross Pendant Necklace,14.0,EUR,73.0,EUR,16,0,,,5.0,0.0,,,,,,,,,,,silver,,50,Livraison standard,5.0,false,,50,,,CN,"MAMA market Co.,Ltd",mamamarketcoltd,"93 % avis positifs (3,830 notes)",3830,4.443342036553525,58fc3697e17bc03e5546dfe5,,,https://www.wish.com/c/5caca66d2a4a6a323015722b,https://canary.contestimg.wish.com/api/webimage/5caca66d2a4a6a323015722b-medium.jpg,5caca66d2a4a6a323015722b
Bible Cross Butterfly With God All Things Are Possible Christian Gift Black  Cotton Unisex T Shirt Size S-5XL,Bible Cross Butterfly With God All Things Are Possible Christian Gift Black  Cotton Unisex T Shirt Size S-5XL,12.0,EUR,12.0,EUR,13.5,2,,,5.0,0.0,,,,,,,,,,,black,unisexs,50,Livraison standard,9.99,false,,50,,,VN,maccc,maccc,90 % avis positifs (303 notes),303,4.32013201320132,5ffea615fa9415150cb997db,,,https://www.wish.com/c/604fc05bc2339ec6afae1f7a,https://canary.contestimg.wish.com/api/webimage/604fc05bc2339ec6afae1f7a-medium.jpg,604fc05bc2339ec6afae1f7a
Phare impression Bible verset citation inspirante toile peinture plage nautique décor chrétien mur Art affiche décoration pas de cadre,Lighthouse Print Bible Verse Inspirational Quote Canvas Painting Beach Nautical Decor Christian Wall Art Poster Decoration No Frame,4.0,EUR,4.0,EUR,4,10,,,4.529411764705882,34.0,24,5,4,1,0,,,,,,,20cmby25cm,50,Livraison standard,1.0,false,,50,,,CN,Anlienr,anlienr,"87 % avis positifs (3,276 notes)",3276,4.1300366300366305,59658bf09579d828468b528f,,,https://www.wish.com/c/5e193581132ef0061a83c10c,https://canary.contestimg.wish.com/api/webimage/5e193581132ef0061a83c10c-medium.jpg,5e193581132ef0061a83c10c
Baseball Cross Pendant JE PEUX FAIRE TOUTES CHOSES FORCE Bible Verset Collier Pendentif En Acier Inoxydable,Baseball Cross Pendant I CAN DO ALL THINGS STRENGTH Bible Verse Stainless Steel Pendant Necklace,3.99,EUR,8.0,EUR,4.84,10,,,4.25,4.0,1,3,0,0,0,,,,,,black,,50,Livraison standard,1.0,false,,50,,,CN,yguj~65,yguj65,92 % avis positifs (848 notes),848,4.338443396226415,5de3396512af068bccfeca8f,,,https://www.wish.com/c/5dee055b587af2439ad2a199,https://canary.contestimg.wish.com/api/webimage/5dee055b587af2439ad2a199-medium.jpg,5dee055b587af2439ad2a199
Citation biblique lettres de foi chrétienne masque imprimé pour unisexe hommes femmes,Bible Quote Christian Faith Letters Printed Face Mask for Unisex Men Women,1.0,EUR,4.0,EUR,1.04,10,,,4.6,10.0,9,0,0,0,1,,,,,,black,6,50,Livraison standard,2.11,false,,50,,,CN,liudandan28652,liudandan28652,"84 % avis positifs (6,363 notes)",6363,3.9603960396039604,5b6935c0a1fdaa1dba5a4cd4,,,https://www.wish.com/c/5ea90b9aba28f139e900d3fc,https://canary.contestimg.wish.com/api/webimage/5ea90b9aba28f139e900d3fc-medium.jpg,5ea90b9aba28f139e900d3fc
Wooden Holy Bible Prayer Book Stand Holder Shelf Eid Ramadan Gorgeous Muslim,Wooden Holy Bible Prayer Book Stand Holder Shelf Eid Ramadan Gorgeous Muslim,33.0,EUR,33.0,EUR,39.0,0,,,5.0,0.0,,,,,,,,,,,,,50,Livraison standard,0.0,false,,50,true,Quantité limitée !,CA,Loom,loom,81 % avis positifs (403 notes),403,4.054590570719603,60108516d38ac0468d48a860,,,https://www.wish.com/c/60157852afc59bf9d8ad84f8,https://canary.contestimg.wish.com/api/webimage/60157852afc59bf9d8ad84f8-medium.jpg,60157852afc59bf9d8ad84f8
Jesus Shirt God Shirts Hubby Wifey Church Shirts Blessed by God Blessed by God Spoiled by my Husband Letter Print Women Tshirts Cotton Casual Funny T Shirt for Lady Top Tee Harajuku Wifey Bible Blessed Shirts,Jesus Shirt God Shirts Hubby Wifey Church Shirts Blessed by God Spoiled by my Husband Letter Print Women Tshirts Cotton Casual Funny T Shirt for Lady Top Tee Harajuku Wifey Bible Blessed Shirts,10.0,EUR,74.0,EUR,11,5000,,,4.3053097345132745,1356.0,923,170,112,56,95,,,,,,white,m,50,Livraison standard,3.0,false,,50,,,CN,@Popular jewelry,popularjewelry,"95 % avis positifs (8,082 notes)",8082,4.4180895817866865,583e9ed05022c71b82d1c62b,,,https://www.wish.com/c/58e9f767abbff534b0e8ffa4,https://canary.contestimg.wish.com/api/webimage/58e9f767abbff534b0e8ffa4-medium.jpg,58e9f767abbff534b0e8ffa4
2020 New Be Still and Know That I Am God Long Sleeve T-shirt Twist Women Blouse  New Women Fashion Christian T-Shirt Religious Shirts Faith Shirts Bible Verse Tops,2020 New Be Still and Know That I Am God Long Sleeve T-shirt Twist Women Blouse  New Women Fashion Christian T-Shirt Religious Shirts Faith Shirts Bible Verse Tops,7.0,EUR,75.0,EUR,8,5,,,5.0,0.0,,,,,,,,,,,green,xs,10,Livraison standard,2.0,false,,50,,,CN,ganxiaoyu,ganxiaoyu,84 % avis positifs (516 notes),516,3.9844961240310077,5d770f388c8dc7694ca6ac7d,,,https://www.wish.com/c/5ddf6eb9b3a61f00fd153534,https://canary.contestimg.wish.com/api/webimage/5ddf6eb9b3a61f00fd153534-medium.jpg,5ddf6eb9b3a61f00fd153534
Mode nouveau-né bambin coton bébé bavoirs garçon fille serviette de salive enfants bavoir alimentation,Fashion Newborn Toddler Cotton Baby Bibs Boy Girl Saliva Towel Kids Bib Feeding,3.93,EUR,4.0,EUR,4.76,1000,,,4.609375,192.0,145,27,15,2,3,,,,,,white,round,50,Livraison Express,8.0,true,,50,true,Quantité limitée !,CN,Chinese style_GQ,chinesestyle_gq,"90 % avis positifs (21,856 notes)",21856,4.255627745241581,590189980094b829518713b8,,,https://www.wish.com/c/5a7910fee114ef5e4c42edb6,https://canary.contestimg.wish.com/api/webimage/5a7910fee114ef5e4c42edb6-medium.jpg,5a7910fee114ef5e4c42edb6
"Croix en acier inoxydable et verset biblique prière chien étiquette pendentif collier, porte-clés bijoux chrétiens","Stainless Steel Cross and Bible Verse Prayer Dog Tag Pendant Necklace, Keychain Christian Jewelry",3.17,EUR,4.0,EUR,3.84,10,,,4.538461538461538,13.0,10,2,0,0,1,,,,,,,necklace,50,Livraison standard,1.0,false,,50,,,CN,lovewang,lovewang,"95 % avis positifs (13,354 notes)",13354,4.4853227497379065,596eb87ecdf32954c9ee8d25,,,https://www.wish.com/c/5cf1e69c7a38cc11468df44a,https://canary.contestimg.wish.com/api/webimage/5cf1e69c7a38cc11468df44a-medium.jpg,5cf1e69c7a38cc11468df44a
5 pièces toile mur Art peintures à l'huile giclée Art impression livre biblique sous le soleil peinture moderne photos affiche oeuvre pour chambre salon décor à la maison,5 Piece Canvas Wall Art Oil Paintings Giclee Art Print Bible Book Under The Sun Painting Modern Pictures Poster Artwork for Bedroom Living Room Home Decor,14.0,EUR,73.0,EUR,16,2,,,5.0,0.0,,,,,,,,,,,multicolor,"40""by20""",49,Livraison standard,5.0,false,,50,,,CN,canvaswallartposter,canvaswallartposter,88 % avis positifs (33 notes),33,4.0,5d96d9a57f8b090ac07d8bf7,,,https://www.wish.com/c/5dc063597ba6e355181f1423,https://canary.contestimg.wish.com/api/webimage/5dc063597ba6e355181f1423-medium.jpg,5dc063597ba6e355181f1423
3 couleurs titane acier anneau croix Bible je peux faire toutes les choses anneaux d'église chrétienne,3 Colors Titanium Steel Ring Cross Bible I Can Do All Things Christian Church Rings,2.0,EUR,4.0,EUR,2,1000,,,3.9278846153846154,208.0,123,24,19,7,35,,,,,,black,7,50,Livraison standard,1,false,,50,true,Quantité limitée !,CN,WWWWYT,wwwwyt,85 % avis positifs (269 notes),269,4.074349442379182,5d4a4df47ad2420a91b93ec4,,,https://www.wish.com/c/5dde468c2cd934406fbf9b6f,https://canary.contestimg.wish.com/api/webimage/5dde468c2cd934406fbf9b6f-medium.jpg,5dde468c2cd934406fbf9b6f
Fiole de la Bible,Bible Flask,25.0,EUR,25.0,EUR,30,5,,,5.0,0.0,,,,,,,,,,,black,,5,Livraison standard,9.0,false,,5,true,Quantité limitée !,US,MainMerch,mainmerch,"96 % avis positifs (10,724 notes)",10724,4.56331592689295,56cddd431e15ff78d61e0041,,,https://www.wish.com/c/59c01635b7ff307a782a335d,https://canary.contestimg.wish.com/api/webimage/59c01635b7ff307a782a335d-medium.jpg,59c01635b7ff307a782a335d
John 3:16 Cross Decal - Christian Decal - Cross Wall Decor - Dieu tellement aimé - verset de la Bible autocollant,John 3:16 Cross Decal - Christian Decal - Cross Wall Decor - God so loved - Bible Verse Sticker,5.0,EUR,7.0,EUR,6,10,,,5.0,1.0,1,0,0,0,0,,,,,,white,"13""by17.8""",50,Livraison standard,2.0,false,,50,,,CN,star17,star17,85 % avis positifs (936 notes),936,4.0993589743589745,5a51c3dfddda8c1bdbe00930,,,https://www.wish.com/c/5bd01ae93a6abd5ff7f1d5f6,https://canary.contestimg.wish.com/api/webimage/5bd01ae93a6abd5ff7f1d5f6-medium.jpg,5bd01ae93a6abd5ff7f1d5f6
"Bracelet biblique ""Dieu est mon refuge et ma force, une aide très présente en cas de problème"" bijoux verset biblique versets bibliques Bracelet Achetez-en 1 obtenez-en 1 gratuit","Bible bracelet “God Is My Refuge and Strength, A Very Present Help In Trouble ” bible verse jewelry bible verses Bangle Buy 1 Get 1 Free ",3.02,EUR,10.0,EUR,3.66,1000,,,4.449101796407185,334.0,228,60,25,10,11,,,,,,silver,,50,Livraison standard,1.0,false,,50,true,Quantité limitée !,CN,jelanda,jelanda,"95 % avis positifs (42,671 notes)",42671,4.505472100489794,57e907b619ce3e1343b39bc3,,,https://www.wish.com/c/5c6a18713eb874425257dc0d,https://canary.contestimg.wish.com/api/webimage/5c6a18713eb874425257dc0d-medium.jpg,5c6a18713eb874425257dc0d
Bague en acier inoxydable biblique biblique en acier inoxydable bague en acier au titane en croix rotative,Scripture Bible Stainless Steel Ring Jewelry Rotatable Cross Titanium Steel Ring,7.0,EUR,7.0,EUR,8,2,,,5.0,0.0,,,,,,,,,,,,6#,50,Livraison standard,2.0,false,,50,,,US,comcoupe,comcoupe,88 % avis positifs (250 notes),250,4.128,5e6e6cf529e786488cdd6df8,,,https://www.wish.com/c/5feb3f810058a20042dd0624,https://canary.contestimg.wish.com/api/webimage/5feb3f810058a20042dd0624-medium.jpg,5feb3f810058a20042dd0624
"Bible Auto Kona Couvercle de porte Prévention des égratignures Prévention de la brillance Protège-marche de la porte Moulure Tuning, Kona Gris","Bible Auto Kona Door Cover Scratch Prevention Gloss Prevention Door Step Guard Molding Tuning, Kona Gray",75.0,EUR,75.0,EUR,90.0,0,,,5.0,0.0,,,,,,,,,,,,,50,Livraison standard,12.0,false,,50,,,KR,Stay_Gorgeous Korea,stay_gorgeouskorea,100 % avis positifs (5 notes),5,4.8,5fd76ab639ab348c49576bf2,,,https://www.wish.com/c/5fedda238dbdf8cea2ab8bb4,https://canary.contestimg.wish.com/api/webimage/5fedda238dbdf8cea2ab8bb4-medium.jpg,5fedda238dbdf8cea2ab8bb4
