title,title_orig,discount_price,discount_price_currency,retail_price,retail_price_currency,discount_price_in_original_currency,nb_cart_orders_approx,nb_units_purchased_approx,uses_ad_boosts,rating,rating_count,rating_five_count,rating_four_count,rating_three_count,rating_two_count,rating_one_count,badges_count,badge_local_product,badge_product_quality,badge_fast_shipping,tags,product_color,product_variation_size_id,product_variation_inventory,shipping_option_name,shipping_option_price,shipping_is_express,countries_shipped_to,inventory_total,has_urgency_banner,urgency_text,origin_country,merchant_title,merchant_name,merchant_info_subtitle,merchant_rating_count,merchant_rating,merchant_id,merchant_has_profile_picture,merchant_profile_picture,product_url,product_picture,product_id
Homme Vintage Acier Inoxydable Croix Noire Argent Anglais Bible Seigneurs Prière Lien Bracelet Poignet Anglais Bible Prière Bracelet Croix Noire Bracelet En Acier Inoxydable Hommes,Men's Vintage Stainless Steel Black Cross Silver English Bible Lords Prayer Link Wrist Bracelet English Bible prayer bracelet  black cross stainless steel bracelet men's,7.0,EUR,7.0,EUR,8,10,,,4.666666666666667,6.0,4,2,0,0,0,,,,,,,,50,Livraison standard,3.0,false,,50,true,Quantité limitée !,CN,akuan61o,akuan61o,93 % avis positifs (42 notes),42,4.523809523809524,5e158bba20317a04ca0e5f67,,,https://www.wish.com/c/5e43f158e5c48b4180feeaa5,https://canary.contestimg.wish.com/api/webimage/5e43f158e5c48b4180feeaa5-medium.jpg,5e43f158e5c48b4180feeaa5
15 Styles croix religieuse jésus citation des écritures verset de la Bible chrétienne sculpté en acier inoxydable inspirant la foi Bracelets en Silicone,15 Styles Religious Cross Jesus Scripture Quote Christian Bible Verse Carved Stainless Steel Inspiring Faith Silicone Bracelets,3.9,EUR,4.0,EUR,4.73,10,,,4.888888888888889,9.0,8,1,0,0,0,,,,,,,random,4,Livraison standard,1.0,false,,50,,,CN,yijiashe,yijiashe,"92 % avis positifs (13,567 notes)",13567,4.339131716665438,5853b4414949434d447ff297,,,https://www.wish.com/c/5f06a9361cfc541685e8a413,https://canary.contestimg.wish.com/api/webimage/5f06a9361cfc541685e8a413-medium.jpg,5f06a9361cfc541685e8a413
Christian Bible Bedding Set Christian Jesus Bedding Set Out Of Difficulties Bedding Cover With 2 Pillowcases 100% Polyester,Christian Bible Bedding Set Christian Jesus Bedding Set Out Of Difficulties Bedding Cover With 2 Pillowcases 100% Polyester,39.0,EUR,67.0,EUR,46.2,0,,,5.0,0.0,,,,,,,,,,,,twin65×71inches,50,Livraison standard,8.99,false,,50,,,VN,maccc,maccc,90 % avis positifs (303 notes),303,4.32013201320132,5ffea615fa9415150cb997db,,,https://www.wish.com/c/6036043a9d281ada22b36527,https://canary.contestimg.wish.com/api/webimage/6036043a9d281ada22b36527-medium.jpg,6036043a9d281ada22b36527
"[Overseas Books] How to Read the Bible for All Its Worth, Zondervan","[Overseas Books] How to Read the Bible for All Its Worth, Zondervan",33.0,EUR,33.0,EUR,40.0,0,,,5.0,0.0,,,,,,,,,,,,,7,Livraison standard,17.0,false,,7,,,KR,atcmart,atcmart,67 % avis positifs (6 notes),6,3.8333333333333335,5fe2119d5265268f81dec682,,,https://www.wish.com/c/6008363c146688e384dde214,https://canary.contestimg.wish.com/api/webimage/6008363c146688e384dde214-medium.jpg,6008363c146688e384dde214
"2 pièces collier de verset biblique Dieu est en elle, elle ne tombera pas, citation de bijoux pour les cadeaux de foi chrétienne","2PCS Bible Verse Necklace God is Within Her She Will Not Fall, Quote Jewelry For Christian Faith Gifts",4.0,EUR,12.0,EUR,4,10,,,4.852941176470588,34.0,29,5,0,0,0,,,,,,silver,,50,Livraison standard,1.0,false,,50,,,CN,"FY trade co., LTD",fytradecoltd,"93 % avis positifs (13,142 notes)",13142,4.368208796225841,5841863b879d3669df83e750,,,https://www.wish.com/c/5bf503ea86d5a828a3a90668,https://canary.contestimg.wish.com/api/webimage/5bf503ea86d5a828a3a90668-medium.jpg,5bf503ea86d5a828a3a90668
Or argent Mini Sainte Bible porte-clés religieux Miniature papier spirituel chrétien jésus couverture porte-clés cadeau,Gold Silver Mini Holy Bible Keychain Religious Miniature Paper Spiritual Christian Jesus Cover Keyring Gift,3.07,EUR,4.0,EUR,3.7199999999999998,10,,,4.232142857142857,56.0,35,11,3,2,5,,,,,,gold,,50,Livraison standard,1.0,false,,50,,,CN,yangpingping,yangpingping,"89 % avis positifs (9,796 notes)",9796,4.2253981216823195,58e36a77a46390103f8bffaf,,,https://www.wish.com/c/5d0b1e7500f7d05c00a54765,https://canary.contestimg.wish.com/api/webimage/5d0b1e7500f7d05c00a54765-medium.jpg,5d0b1e7500f7d05c00a54765
Philippians 4:13 Cross Pendant Strength Bible Verse Stainless Steel Necklace,Philippians 4:13 Cross Pendant Strength Bible Verse Stainless Steel Necklace,16.0,EUR,16.0,EUR,19,0,,,5.0,0.0,,,,,,,,,,,silver,,50,Livraison standard,5.0,false,,50,,,CN,Wangquanxin27,wangquanxin27,88 % avis positifs (8 notes),8,3.875,5f67011b7cc0a0ef34d40e0e,,,https://www.wish.com/c/5f8fdebd77698b0288fb2806,https://canary.contestimg.wish.com/api/webimage/5f8fdebd77698b0288fb2806-medium.jpg,5f8fdebd77698b0288fb2806
Foi espoir amour définition affiches verset biblique peintures murales impression toile chambre décoration Design pour peintures murales Art sans cadres,Faith Hope Love Definition Posters Bible Verse Wall Paintings Print Canvas Room Decoration Design for Wall Murals Art Without Frames,3.98,EUR,4.0,EUR,4.82,10,,,3.1,10.0,3,1,2,2,2,,,,,,,faith-21x30cm,50,Livraison standard,1.0,false,,50,,,CN,chengduhuafukejiyouxiangongsi,成都华富科技有限公司,"83 % avis positifs (1,341 notes)",1341,3.9485458612975393,556fb65744368319e96a610a,,,https://www.wish.com/c/5f1a5f08769c3d2b59b85fb0,https://canary.contestimg.wish.com/api/webimage/5f1a5f08769c3d2b59b85fb0-medium.jpg,5f1a5f08769c3d2b59b85fb0
Bijoux religieux homme Titane Acier Noir Classiques Gravé Lettre Anglais Prière du Seigneur Bible Croix Élégant Chaîne Bracelet Manchette Bracelet Hommes Bracelets,Men's Religious Jewelry Titanium Steel Black Classics Engraved Letter English Lord's Prayer Bible Cross Elegant Chain Bracelet Cuff Bangle Mens Wristbands,7.0,EUR,14.0,EUR,8,10,,,4.666666666666667,48.0,40,4,2,0,2,,,,,,,,50,Livraison standard,3.0,false,,50,true,Quantité limitée !,CN,EZMAX,ezmax,"95 % avis positifs (15,975 notes)",15975,4.481001564945227,5409c9b67f086e17ac87d6d4,,,https://www.wish.com/c/583d018715914502de935bb5,https://canary.contestimg.wish.com/api/webimage/583d018715914502de935bb5-medium.jpg,583d018715914502de935bb5
Ne laissez pas votre coeur John citation anglaise autocollant mural décor à la maison vinyle Art décalcomanies,Don't Let Your Heart John English Quote Wall Sticker Home Decor Vinyl Art Decals,4.0,EUR,4.0,EUR,4,10000,,,4.365808823529412,1088.0,739,149,110,39,51,,,,,,,,50,Livraison standard,1.0,false,,50,,,CN,JK2 Factory,jk2factory,"91 % avis positifs (191,705 notes)",191705,4.29341436060614,53bfdb1f46188e25db3fc322,,,https://www.wish.com/c/555a97e8e0ebce0e767b0394,https://canary.contestimg.wish.com/api/webimage/555a97e8e0ebce0e767b0394-medium.jpg,555a97e8e0ebce0e767b0394
6 Pcs Keychain Pendant Bible Keyring Pendant Keychain Ornament Mini Pendant,6 Pcs Keychain Pendant Bible Keyring Pendant Keychain Ornament Mini Pendant,7.0,EUR,7.0,EUR,8,1,,,5.0,0.0,,,,,,,,,,,assorted,4x3.5x1.2cm,9,Livraison standard,3.0,false,,9,true,Quantité limitée !,CN,mape39,mape39,"89 % avis positifs (1,265 notes)",1265,4.2245059288537545,5d7f4f59b6b4c23c83cd30f6,,,https://www.wish.com/c/5fb63de4665568bdc09feb4a,https://canary.contestimg.wish.com/api/webimage/5fb63de4665568bdc09feb4a-medium.jpg,5fb63de4665568bdc09feb4a
NOVE JEWELRY armée style militaire mens mode 18 carats plaqué or en acier inoxydable 316L bible espagnole croix collier de prière du seigneur chien tag pendentif avec chaîne en or,NOVE JEWELRY army military style mens fashion 18k gold plated 316L stainless steel Spanish bible cross lord's prayer necklace dog tag pendant with chain gold,10.0,EUR,19.0,EUR,11,10,,,4.735294117647059,34.0,26,7,1,0,0,,,,,,,,50,Livraison standard,2.0,false,,50,,,CN,NOVE,nove,"96 % avis positifs (6,866 notes)",6866,4.551558403728517,56e7fd28cde09374e3df4d1f,,,https://www.wish.com/c/57e38cf04449682e1d0ad601,https://canary.contestimg.wish.com/api/webimage/57e38cf04449682e1d0ad601-medium.jpg,57e38cf04449682e1d0ad601
Jesus Christ Christian God Saint Bible Be Still And Know That I Am God Full Wrapped Canvas Or Unframed Paper Poster Various Sizes Wall Decor,Jesus Christ Christian God Saint Bible Be Still And Know That I Am God Full Wrapped Canvas Or Unframed Paper Poster Various Sizes Wall Decor,21.0,EUR,43.0,EUR,25,0,,,5.0,0.0,,,,,,,,,,,,"posternoframe11""x17""",50,Livraison standard,6.0,false,,50,,,VN,lightshin,lightshin,(999 notes),999,4.4724724724724725,5f8562a519c13da3b5ecfe1f,,,https://www.wish.com/c/605cd0993b6baf9ea19768f8,https://canary.contestimg.wish.com/api/webimage/605cd0993b6baf9ea19768f8-medium.jpg,605cd0993b6baf9ea19768f8
Nouveau collier de prière du Seigneur en acier inoxydable Vintage croix noire pendentif 22 pouces pour hommes femmes,New Stainless Steel Vintage Black Cross Pendant Lord's Prayer Necklace 22 Inch for men women,2.0,EUR,8.0,EUR,2,5000,,,4.509863429438544,659.0,487,88,41,19,24,,,,,,silver,,50,Livraison standard,1,false,,50,,,CN,emsni,emsni,"86 % avis positifs (1,987 notes)",1987,4.14494212380473,5d50ffe11d9a8e239c336c30,,,https://www.wish.com/c/5d5d06b49febd90a930515bb,https://canary.contestimg.wish.com/api/webimage/5d5d06b49febd90a930515bb-medium.jpg,5d5d06b49febd90a930515bb
Collier pendentif croix de baseball je peux faire toutes les choses force collier amulette verset biblique,Baseball Cross Pendant Necklace I CAN DO ALL THINGS STRENGTH Bible Verse Amulet Necklace,3.19,EUR,8.0,EUR,3.87,10,,,5.0,0.0,,,,,,,,,,,black,,50,Livraison standard,1.0,false,,50,true,Quantité limitée !,CN,VBvcbncgb,vbvcbncgb,92 % avis positifs (146 notes),146,4.383561643835616,5e1446ffbb8540d77ad3c92f,,,https://www.wish.com/c/5e197dd0254f6b0dd18ad606,https://canary.contestimg.wish.com/api/webimage/5e197dd0254f6b0dd18ad606-medium.jpg,5e197dd0254f6b0dd18ad606
"100 Washi Tape Set, Foil Gold Skinny Decorative Masking Washi Tapes, 1-5MM Wide DIY Masking Tape for decoration scrapbook / journal","100 Washi Tape Set,Foil Gold Skinny Decorative Masking Washi Tapes,1-5MM Wide DIY Masking Tape for decorating scrapbook/journal",8.0,EUR,82.0,EUR,9,1000,,,3.953405017921147,279.0,132,64,46,12,25,,,,,,,100rollsrandompattern,50,Livraison standard,3.0,false,,50,,,CN,hehe12595an099,hehe12595an099,"93 % avis positifs (1,253 notes)",1253,4.4277733439744615,5a97e762c3911a1a9d6eb894,,,https://www.wish.com/c/5dcd1b27b1a5bd103d46e967,https://canary.contestimg.wish.com/api/webimage/5dcd1b27b1a5bd103d46e967-medium.jpg,5dcd1b27b1a5bd103d46e967
Disguise,,,,,,,,,,,,,,,,,,,,,,,,,,,,,,,,,,,,,,,,,https://www.wish.com/c/5ef9c9dbeb31f94d86971469,,5ef9c9dbeb31f94d86971469
Mode Noir En Cuir Cahier Journal Journal Carnet De Croquis Épais Pages Blanches Papeterie Fournitures De Bureau Journal Carnet De Notes Cadeau,Fashion Black Leather Notebook Journal Diary Sketchbook Thick Blank Pages Stationery Office Supplies Diary Note Books Gift,13.0,EUR,13.0,EUR,15,1000,,,4.602782071097373,647.0,489,103,30,6,19,,,,,,,,50,Livraison standard,5.0,false,,50,,,CN,Seeyouagain1+1,seeyouagain11,"92 % avis positifs (115,869 notes)",115869,4.326472136637064,56f4df8b3a698c465882e282,,,https://www.wish.com/c/59f3fc08b9c4d672e1d6e8a9,https://canary.contestimg.wish.com/api/webimage/59f3fc08b9c4d672e1d6e8a9-medium.jpg,59f3fc08b9c4d672e1d6e8a9
New Era,,,,,,,,,,,,,,,,,,,,,,,,,,,,,,,,,,,,,,,,,https://www.wish.com/c/5f36a088eb31f9893266984d,,5f36a088eb31f9893266984d
20pcs/lot 20 couleurs Bricolage Scrapbooking Vieux Bricolage Tampons encreurs Tampons encreurs Colorés Tampons encreurs Sceau Timbre Décoration Tampographie,20pcs/lot 20 colors DIY Scrapbooking Vintage Crafts Ink pad Colorful Inkpad Stamps Sealing Decoration Stamp,8.0,EUR,8.0,EUR,9,5000,,,4.497346840328027,2073.0,1433,386,156,48,50,,,,,,multicolor,,50,Livraison standard,3.0,false,,50,,,CN,Heart paradise toy,heartparadisetoy,"93 % avis positifs (13,972 notes)",13972,4.38920698539937,57925080c0e9346667a2e77f,,,https://www.wish.com/c/581ff5dd967fe51de62697a1,https://canary.contestimg.wish.com/api/webimage/581ff5dd967fe51de62697a1-medium.jpg,581ff5dd967fe51de62697a1
Bracelet de chaîne en argent de prière du Seigneur espagnol en acier inoxydable 316L exquis pour hommes Bracelet de mode Bible Cross Bracelets de Milkle Gift,Exquisite 316L Stainless Titanium Steel Spanish Lord's Prayer Silver Chain Bracelet Mens Fashion Bangle Bible Cross Wristbands From Milkle Gift,7.0,EUR,13.0,EUR,8,10,,,3.8,5.0,2,2,0,0,1,,,,,,,,50,Livraison standard,2.0,false,,50,true,Quantité limitée !,CN,Milkle Gift,milkletech,"95 % avis positifs (50,668 notes)",50668,4.504914344359359,536102aa796f6809e8699ee8,,,https://www.wish.com/c/58a2854c34246751a9ef8bff,https://canary.contestimg.wish.com/api/webimage/58a2854c34246751a9ef8bff-medium.jpg,58a2854c34246751a9ef8bff
6 panneaux Design moderne verset de la Bible peintures murales noir blanc citations inspirantes peinture murale impression sur toile pour la décoration de la chambre sans cadres,6 Panels Modern Design Bible Verse Wall Paintings Black White Inspirational Quotes Painting Wall Mural Canvas Print for Room Decor Without Frames,3.0,EUR,3.0,EUR,3,10,,,3.2,5.0,1,2,0,1,1,,,,,,,peace,50,Livraison standard,1.0,false,,50,,,CA,INTELCOL,intelcol,50 % avis positifs (2 notes),2,3.0,5f723df79da017be916e1095,,,https://www.wish.com/c/5fd98c4f7ee76bae5998eea0,https://canary.contestimg.wish.com/api/webimage/5fd98c4f7ee76bae5998eea0-medium.jpg,5fd98c4f7ee76bae5998eea0
"In Christ Alone My Hope Is Found Pendant, Bible Scripture Necklace, Christian Keychain","In Christ Alone My Hope Is Found Pendant, Bible Scripture Necklace, Christian Keychain",4.76,EUR,24.0,EUR,5.77,1,,,5.0,0.0,,,,,,,,,,,,,50,Livraison standard,2.0,false,,50,true,Quantité limitée !,CN,yanhui6168,yanhui6168,92 % avis positifs (89 notes),89,4.49438202247191,5e7d9a277b30da5868f39837,,,https://www.wish.com/c/5f4f75b8364e41f90824338c,https://canary.contestimg.wish.com/api/webimage/5f4f75b8364e41f90824338c-medium.jpg,5f4f75b8364e41f90824338c
Philippiens 4:13 bijoux croix collier Bible verset en acier inoxydable avec chaîne,Philippians 4:13 Jewelry Cross Necklace Bible Verse Stainless Steel with Chain,4.75,EUR,5.0,EUR,5.76,10,,,5.0,2.0,2,0,0,0,0,,,,,,silver,1pc,2,Livraison standard,2.0,false,,4,,,CN,Xue Fengjing 2019,xuefengjing2019,84 % avis positifs (315 notes),315,3.980952380952381,5d52ace83db43e5d4081883c,,,https://www.wish.com/c/5d843e318aa7232d8bb45bda,https://canary.contestimg.wish.com/api/webimage/5d843e318aa7232d8bb45bda-medium.jpg,5d843e318aa7232d8bb45bda
Livre Coffres-forts Simulation Dictionnaire Livre Secret Argent Sécuritaire Argent Bijoux De Stockage Collection Boîte Serrure De Sécurité Taille S / M / L BIBLE,Book Safes Simulation Dictionary Secret Book Safe Money Cash Jewelry Storage Collection Box Security Lock Size S/M/L BIBLE,19.0,EUR,50.0,EUR,23,10,,,4.463414634146342,41.0,26,9,5,1,0,,,,,,,ssize(passwordlock),50,Livraison standard,6.0,false,,50,,,CN,Kedaye,kevin329340422,(510 notes),510,4.484313725490196,59c0a3032351346f89533362,,,https://www.wish.com/c/5abf0f882c3a220ba79f1988,https://canary.contestimg.wish.com/api/webimage/5abf0f882c3a220ba79f1988-medium.jpg,5abf0f882c3a220ba79f1988
Miss Sixty,,,,,,,,,,,,,,,,,,,,,,,,,,,,,,,,,,,,,,,,,https://www.wish.com/c/5f23fa0890b8a6f01782b3a0,,5f23fa0890b8a6f01782b3a0
1 PC Papeterie Masking Tape Cutter Washi Tape Storage Organizer Cutter Office Tape Dispenser Office Supplies,1 PC Stationery Masking Tape Cutter Washi Tape Storage Organizer Cutter Office Tape Dispenser Office Supplies,6.0,EUR,6.0,EUR,7,1000,,,4.460893854748603,358.0,244,62,33,11,8,,,,,,green,tapeholder,50,Livraison standard,2.0,false,,50,,,CN,eletronicmall,eletronicmall,"89 % avis positifs (93,779 notes)",93779,4.200780558547223,5613b80b11efe91d0d2cd20c,,,https://www.wish.com/c/5a1e6cb4a85dc330312bfd44,https://canary.contestimg.wish.com/api/webimage/5a1e6cb4a85dc330312bfd44-medium.jpg,5a1e6cb4a85dc330312bfd44
Vespa,,,,,,,,,,,,,,,,,,,,,,,,,,,,,,,,,,,,,,,,,https://www.wish.com/c/5f746576eb31f9c7cd02eeb5,,5f746576eb31f9c7cd02eeb5
Bavoirs jetables imperméables à l'eau pour le souper,Disposable Waterproof Eat Dinner Bibs,3.0,EUR,12.0,EUR,3,20000,,,4.066382373845061,7035.0,4015,1127,873,385,635,,,,,,,1,50,Livraison standard,1.0,false,,50,,,CN,homesale,homesale,"91 % avis positifs (32,253 notes)",32253,4.30595603509751,54edbcd07d6eba71a3af2e14,,,https://www.wish.com/c/57ee6063219d8b18ceefc1e5,https://canary.contestimg.wish.com/api/webimage/57ee6063219d8b18ceefc1e5-medium.jpg,57ee6063219d8b18ceefc1e5
Hommes en acier inoxydable verset biblique prière du seigneur chrétien bague croix bandes de mariage gravées prier,Men's Stainless Steel Bible Verse Christian Lord's Prayer Cross Ring Wedding Bands Engraved Praying,2.0,EUR,24.0,EUR,2,10,,,4.642857142857143,56.0,44,8,1,2,1,,,,,,black,6,50,Livraison standard,1,false,,50,,,CN,lili fashion jewelry,lilifashionjewelry,"91 % avis positifs (4,762 notes)",4762,4.309113817723645,5b266b1d43b3b659a440d4b6,,,https://www.wish.com/c/5c1fbd94fd262c3a59517cf5,https://canary.contestimg.wish.com/api/webimage/5c1fbd94fd262c3a59517cf5-medium.jpg,5c1fbd94fd262c3a59517cf5
"Couverture de porte en feutre de mélange résistant aux rayures automatique Bible, gris, Kia, k7 Premier juin 2019 ~","Bible Auto Scratch Resistant Mixing Felt Door Cover Gray, Kia, k7 Premier June 2019~",71.0,EUR,71.0,EUR,86.0,0,,,5.0,0.0,,,,,,,,,,,,,4,Livraison standard,12.0,false,,4,,,KR,Stay_Gorgeous Korea,stay_gorgeouskorea,100 % avis positifs (5 notes),5,4.8,5fd76ab639ab348c49576bf2,,,https://www.wish.com/c/5fedda7fd401a4c9b51cb7e2,https://canary.contestimg.wish.com/api/webimage/5fedda7fd401a4c9b51cb7e2-medium.jpg,5fedda7fd401a4c9b51cb7e2
Rose Gold Christ Jesus Believers Stainless Steel Bible Cross Pendant Necklace,Rose Gold Christ Jesus Believers Stainless Steel Bible Cross Pendant Necklace,12.0,EUR,73.0,EUR,14,0,,,5.0,0.0,,,,,,,,,,,silver,,50,Livraison standard,3.0,false,,50,,,CN,"MAMA market Co.,Ltd",mamamarketcoltd,"93 % avis positifs (3,830 notes)",3830,4.443342036553525,58fc3697e17bc03e5546dfe5,,,https://www.wish.com/c/5cb7497f841c2b47130ed383,https://canary.contestimg.wish.com/api/webimage/5cb7497f841c2b47130ed383-medium.jpg,5cb7497f841c2b47130ed383
Tasse à café drôle de numéros d'urgence biblique de 11 oz,Bible Emergency Numbers 11oz Funny Coffee Mug,12.0,EUR,57.0,EUR,14,6,,,2.0,1.0,0,0,0,1,0,,,,,,white,,50,Livraison standard,3.0,false,,50,,,CN,ergeatrer,ergeatrer,97 % avis positifs (96 notes),96,4.510416666666667,5df0b5af80951908269adbf5,,,https://www.wish.com/c/5e20058e56b3960958fa86ec,https://canary.contestimg.wish.com/api/webimage/5e20058e56b3960958fa86ec-medium.jpg,5e20058e56b3960958fa86ec
"Porte-clé de l'écriture, cadeau pour homme, cadeau de gars, pendentif Bible, lorsque vous traversez les eaux profondes, Isa 43: 2, cadeau chrétien, cadeau d'encouragement","Scripture keychain, gift for men, guy gift, Bible Pendant, when you pass through deep waters, Isa 43:2, Christian Gift, Encouragement Gift",3.0,EUR,17.0,EUR,3,10,,,4.9,10.0,9,1,0,0,0,,,,,,black,,50,Livraison standard,1.0,false,,50,,,CN,SmileLoveStore,sharebest,"96 % avis positifs (2,300 notes)",2300,4.585652173913044,5964edce9579d811f97ef9a0,,,https://www.wish.com/c/5bdf0d47f4b6561710c697e9,https://canary.contestimg.wish.com/api/webimage/5bdf0d47f4b6561710c697e9-medium.jpg,5bdf0d47f4b6561710c697e9
"Christian gift mug, bible verse mug, bible verse prints, jesus mug, christian gifts, catholic gifts, church gifts, pastor gift, baptism gift","Christian gift mug, bible verse mug, bible verse prints, jesus mug, christian gifts, catholic gifts, church gifts, pastor gift, baptism gift",12.0,EUR,24.0,EUR,14,0,,,5.0,0.0,,,,,,,,,,,,,50,Livraison standard,3.0,false,,50,,,CN,abcdqwer,abcdqwer,80 % avis positifs (65 notes),65,3.9692307692307693,5e671c6529e7864151176d35,,,https://www.wish.com/c/5e9862d25583532b8fc77a8e,https://canary.contestimg.wish.com/api/webimage/5e9862d25583532b8fc77a8e-medium.jpg,5e9862d25583532b8fc77a8e
Collier verset biblique Pendentif en verre Collier en bois Idée cadeau chrétienne,Bible Verse Necklace Glass Pendant Wooden Necklace Christian Gift Idea,3.08,EUR,12.0,EUR,3.73,10,,,4.54054054054054,37.0,27,5,4,0,1,,,,,,,howgreatthouart,50,Livraison standard,1.0,false,,50,,,CN,wangdink,wangdink,"93 % avis positifs (19,449 notes)",19449,4.389017430202067,597de12051762974780964bc,,,https://www.wish.com/c/5c3aad7a0319457e9c784d9f,https://canary.contestimg.wish.com/api/webimage/5c3aad7a0319457e9c784d9f-medium.jpg,5c3aad7a0319457e9c784d9f
"3PCS anneaux bibliques en acier inoxydable titane de haute qualité pour hommes femmes (couleurs: noir, bleu, argent tailles américaines 6-12)","3PCS High Quality Titanium Stainless Steel Cross Bible Rings for Men Women(Colors:black, blue, silver US Sizes 6-12)",5.0,EUR,5.0,EUR,5,4,,,5.0,1.0,1,0,0,0,0,,,,,,,size6,50,Livraison standard,1.0,false,,50,,,CN,goodzero,goodzero,"92 % avis positifs (9,561 notes)",9561,4.3419098420667295,591ab2eb4cb67649f38020d0,,,https://www.wish.com/c/5fe2f0dbbbcf2b134012db5d,https://canary.contestimg.wish.com/api/webimage/5fe2f0dbbbcf2b134012db5d-medium.jpg,5fe2f0dbbbcf2b134012db5d
"Bijoux de verset biblique, bracelet en cuir tressé noir dôme en verre, cadeau pour chrétien","Bible Verse Jewelry, Glass Dome Black Braided Leather Bracelet, Gift For Christian",3.16,EUR,11.0,EUR,3.83,1000,,,4.5233644859813085,321.0,228,57,22,4,10,,,,,,,iwillwalkbyfaithevenwhenicannotsee,50,Livraison standard,1.0,false,,50,true,Quantité limitée !,CN,wangdink,wangdink,"93 % avis positifs (19,449 notes)",19449,4.389017430202067,597de12051762974780964bc,,,https://www.wish.com/c/5c1a1a92454ba71709e736eb,https://canary.contestimg.wish.com/api/webimage/5c1a1a92454ba71709e736eb-medium.jpg,5c1a1a92454ba71709e736eb
Haute qualité grande taille 8mm 316 acier au titane 18 K argent plaqué or jésus croix lettre Bible bande de mariage anneau hommes femmes,High quality large size 8mm 316 Titanium Steel 18K silver gold plated jesus cross Letter bible wedding band ring men women,3.18,EUR,4.0,EUR,3.86,7,,,5.0,0.0,,,,,,,,,,,gold,6,50,Livraison standard,1.0,false,,50,true,Quantité limitée !,CN,hfgdhfg,hfgdhfg,88 % avis positifs (225 notes),225,4.151111111111111,5f83cdc7a74dab1114df3759,,,https://www.wish.com/c/601f5203c5f7ca54f00449ba,https://canary.contestimg.wish.com/api/webimage/601f5203c5f7ca54f00449ba-medium.jpg,601f5203c5f7ca54f00449ba
"Suivez-vous Jésus cette fin - vinyle adhésif drôle pour voiture / camion / ordinateur portable (achetez-en 2, obtenez-en 1 supplémentaire gratuit)",Do You Follow Jesus This Close - Vinyl Funny Bumper Sticker car / truck / laptop (Buy 2 Get 1 Extra Free),3.0,EUR,10.0,EUR,3,5000,,,4.555776892430279,1004.0,768,122,56,20,38,,,,,,white,,50,Livraison standard,1.0,false,,50,true,Quantité limitée !,CN,Future Store,laishuo,"95 % avis positifs (12,108 notes)",12108,4.5399735711926,5544851a2ffb912ae525313c,,,https://www.wish.com/c/591456f7a599e5235598543c,https://canary.contestimg.wish.com/api/webimage/591456f7a599e5235598543c-medium.jpg,591456f7a599e5235598543c
Artisanat peinture pochoirs modèle lettrage Alphabet Scrapbooking Art mur dessin lettre,Craft Painting Stencils Template Lettering Alphabet Scrapbooking Art Wall Drawing Letter,3.08,EUR,4.0,EUR,3.73,1000,,,4.331818181818182,440.0,288,73,42,11,26,,,,,,,1,50,Livraison standard,1.0,false,,50,,,CN,rongbbin,rongbbin,"94 % avis positifs (5,000 notes)",5000,4.4868,58cb864e27e5430a5e6b2772,,,https://www.wish.com/c/5968af88aa4a0a7885fc934b,https://canary.contestimg.wish.com/api/webimage/5968af88aa4a0a7885fc934b-medium.jpg,5968af88aa4a0a7885fc934b
Nouveau acier inoxydable Vintage noir or argent croix pendentif prière du Seigneur Bible BraceletsBracelets Bracelets en acier inoxydable pour hommes femmes,New Stainless Steel Vintage Black Gold Silver Cross Pendant Lord'S Prayer Bible BraceletsBracelets Stainless Steel Bracelets For Men Women,1.42,EUR,2.0,EUR,1.72,10,,,4.4,15.0,11,1,2,0,1,,,,,,,randomstyle,50,Livraison standard,1,false,,50,true,Quantité limitée !,US,QianzhuiouaWz,qianzhuiouawz,57 % avis positifs (35 notes),35,3.257142857142857,5e840fbc8615628003e1bd45,,,https://www.wish.com/c/5fe43a8000d272f0b3294894,https://canary.contestimg.wish.com/api/webimage/5fe43a8000d272f0b3294894-medium.jpg,5fe43a8000d272f0b3294894
Mode féminine être tranquille et savoir que je suis Dieu chemise T-Shirt chrétien chemises religieuses chemises de foi verset biblique à manches longues col rond tunique t-shirt,Women Fashion Be Still and Know That I Am God Shirt Christian T-Shirt Religious Shirts Faith Shirts Bible Verse Long Sleeve Round Neck Tunic Tee,8.0,EUR,42.0,EUR,9,10,,,4.75,4.0,3,1,0,0,0,,,,,,blue,xs,2,Livraison standard,3.0,false,,50,,,CN,Yuwei,ladiesmallno1,"86 % avis positifs (16,380 notes)",16380,4.037912087912088,5672187daa31dd7de37f042d,,,https://www.wish.com/c/5dea0cc602d0a104deaf61e3,https://canary.contestimg.wish.com/api/webimage/5dea0cc602d0a104deaf61e3-medium.jpg,5dea0cc602d0a104deaf61e3
2020 nouveau collier de balle pendentif bible de mode couple dévissable en acier inoxydable,2020 new stainless steel unscrewable couple fashion bible pendant bullet necklace,5.0,EUR,17.0,EUR,6,10,,,5.0,0.0,,,,,,,,,,,silver,smooth,50,Livraison standard,2.0,false,,50,,,CN,HYQ2020HAPPY,hyq2020happy,92 % avis positifs (71 notes),71,4.309859154929577,5ecf402f2a4a14549a5241ce,,,https://www.wish.com/c/5f5eccb07792030df8584177,https://canary.contestimg.wish.com/api/webimage/5f5eccb07792030df8584177-medium.jpg,5f5eccb07792030df8584177
