title,title_orig,discount_price,discount_price_currency,retail_price,retail_price_currency,discount_price_in_original_currency,nb_cart_orders_approx,nb_units_purchased_approx,uses_ad_boosts,rating,rating_count,rating_five_count,rating_four_count,rating_three_count,rating_two_count,rating_one_count,badges_count,badge_local_product,badge_product_quality,badge_fast_shipping,tags,product_color,product_variation_size_id,product_variation_inventory,shipping_option_name,shipping_option_price,shipping_is_express,countries_shipped_to,inventory_total,has_urgency_banner,urgency_text,origin_country,merchant_title,merchant_name,merchant_info_subtitle,merchant_rating_count,merchant_rating,merchant_id,merchant_has_profile_picture,merchant_profile_picture,product_url,product_picture,product_id
'47,,,,,,,,,,,,,,,,,,,,,,,,,,,,,,,,,,,,,,,,,https://www.wish.com/c/5f33cbe690b8a64127f417c4,,5f33cbe690b8a64127f417c4
"Guide biblique pour la Bible, réseau de spiritualité","Bible guide for the Bible, spirituality network",16.0,EUR,16.0,EUR,19.0,0,,,5.0,0.0,,,,,,,,,,,,,2,Livraison standard,17.0,false,,2,true,Quantité limitée !,KR,atcmart,atcmart,67 % avis positifs (6 notes),6,3.8333333333333335,5fe2119d5265268f81dec682,,,https://www.wish.com/c/600c3954c99428cfecf3c882,https://canary.contestimg.wish.com/api/webimage/600c3954c99428cfecf3c882-medium.jpg,600c3954c99428cfecf3c882
Proverbes 3: 5-6 versets bibliques jésus dieu vinyle stickers muraux chrétien salon chambre maison décoratifs stickers muraux,Proverbs 3:5-6 Bible verses Jesus god vinyl wall stickers Christian living room bedroom Home decorative wall stickers ,8.0,EUR,124.0,EUR,9,4,,,3.0,1.0,0,0,1,0,0,,,,,,white,57x23cm,50,Livraison standard,3.0,false,,50,,,CN,ZINIAN,ziniandf74e18686d811e7993f027fe6e73318,"93 % avis positifs (1,486 notes)",1486,4.411843876177658,599b882f238270454ce5b013,,,https://www.wish.com/c/5ff9774df7d491901dfd0ddb,https://canary.contestimg.wish.com/api/webimage/5ff9774df7d491901dfd0ddb-medium.jpg,5ff9774df7d491901dfd0ddb
Philippiens 4:13 Lettre gravée Verset biblique Sainte Croix de prière du Seigneur Acier inoxydable 316L Femmes Hommes Mode personnalisée Bracelet manchette à la mode Citation de motivation inspirante Bracelet en silicone noir réglable Bracelets Bijoux religieux,Philippians 4:13 Engraved Letter Holy Bible Verse Lord's Prayer Cross 316L Stainless Steel Women Men Personalized Fashion Trendy Cuff Bangle Inspirational Motivational Quote Adjustable Black Silicone Band Bracelet Wristbands Religious Jewelry,4.82,EUR,10.0,EUR,5.84,5,,,5.0,1.0,1,0,0,0,0,,,,,,black,,50,Livraison standard,1.0,false,,50,,,CN,Lometeor,lometeor,92 % avis positifs (211 notes),211,4.436018957345971,5aa92aeca6bf7a1382baff41,,,https://www.wish.com/c/5dbe5c54bacd4b213ddc4f9b,https://canary.contestimg.wish.com/api/webimage/5dbe5c54bacd4b213ddc4f9b-medium.jpg,5dbe5c54bacd4b213ddc4f9b
Gravé croix Seigneur Bible prière pendentif collier religieux en acier inoxydable non vissé balle croix pendentif collier pour noël bijoux cadeaux Religieux Bijoux,Engraved Cross Lord Bible Prayer Pendant Necklace Religious Stainless Steel Unscrewed Bullet Cross Pendant Necklace for Christmas Jewelry Gifts Religieux Bijoux,7.0,EUR,7.0,EUR,8,10,,,4.583333333333333,12.0,10,1,0,0,1,,,,,,stainlesssteel,,50,Livraison standard,2.0,false,,50,,,CN,C&B Jewelry,cbjewelry,"94 % avis positifs (3,663 notes)",3663,4.482937482937483,5970af877fe2414c8d9706d2,,,https://www.wish.com/c/5d9efecdb003ee0e7e6b3e59,https://canary.contestimg.wish.com/api/webimage/5d9efecdb003ee0e7e6b3e59-medium.jpg,5d9efecdb003ee0e7e6b3e59
"6 ""large vinyle autocollant autocollant John 3:16 fenêtre de voiture autocollant Jésus croix Dieu Bible ordinateur portable autocollant","6"" wide Vinyl Decal Sticker John 3:16 Car Window Decal Jesus Cross God Bible Laptop Sticker ",3.17,EUR,5.0,EUR,3.84,1000,,,4.676731793960924,563.0,466,53,20,7,17,,,,,,white,,50,Livraison standard,1.0,false,,50,,,CN,Car Stickers Supermarket--TGC,carstickerssupermarkettgc,"96 % avis positifs (12,974 notes)",12974,4.580776938492369,574d580f7177d85cc8e5f995,,,https://www.wish.com/c/594c925f8d97d86eed5cd97e,https://canary.contestimg.wish.com/api/webimage/594c925f8d97d86eed5cd97e-medium.jpg,594c925f8d97d86eed5cd97e
Collier pour hommes garçons pendentif croix force verset biblique collier en acier inoxydable,Necklace for Men Boys Cross Pendant STRENGTH Bible Verse Stainless Steel Necklace,4.02,EUR,50.0,EUR,4.87,10,,,4.571428571428571,14.0,12,0,1,0,1,,,,,,gold,,50,Livraison standard,1.0,false,,50,,,CN,FMAXFEEL,fmaxfeel,89 % avis positifs (268 notes),268,4.164179104477612,5fd6e0727885467e82393772,,,https://www.wish.com/c/5fdd7859ecad8562711e0dcc,https://canary.contestimg.wish.com/api/webimage/5fdd7859ecad8562711e0dcc-medium.jpg,5fdd7859ecad8562711e0dcc
3 panneaux verset de la Bible affiche Design moderne foi espoir amour peintures peinture murale pour salon chambre sans cadres,3 Panels Bible Verse Poster Modern Design Faith Hope Love Paintings Wall Painting for Living Room Bedroom Without Frames,1.65,EUR,5.0,EUR,2.0,10,,,5.0,0.0,,,,,,,,,,,,faith,50,Livraison standard,1,false,,50,,,US,Avefenixmarkeet,avefenixmarkeet,,0,5.0,5f7ad2e1119147ed482957d8,,,https://www.wish.com/c/60078b63a5a22443030f19fe,https://canary.contestimg.wish.com/api/webimage/60078b63a5a22443030f19fe-medium.jpg,60078b63a5a22443030f19fe
"Vulgate Bible, manuscrit, États-Unis, New York, New York City, American Bible Society, 1250 A.D.","Vulgate Bible,  Manuscript,  USA,  New York,  New York City,  American Bible Society,  1250 A.D. Poster Print",33.0,EUR,37.0,EUR,39,0,,,5.0,0.0,,,,,,,,,,,,18x24,50,Livraison standard,11.0,false,,50,,,US,Posterazzi,posterazzi,"77 % avis positifs (5,643 notes)",5643,3.8628389154704945,55c0deb64e6a0874f22b3167,,,https://www.wish.com/c/590c703b1798812cc1e1fed4,https://canary.contestimg.wish.com/api/webimage/590c703b1798812cc1e1fed4-medium.jpg,590c703b1798812cc1e1fed4
Collier de graines de moutarde - bijoux de graines de moutarde - flacon en verre - collier en verre - collier foi - bijoux foi - cadeau Collège - cadeau de graduation,Mustard seed necklace - mustard seed jewelry - glass vial - glass necklace - faith necklace - faith Jewelry - College gift - graduation gift,4.69,EUR,5.0,EUR,5.68,1000,,,4.476190476190476,231.0,172,28,13,5,13,,,,,,,,50,Livraison standard,1.0,false,,50,true,Quantité limitée !,CN,yufanmemo,yufanmemo,"96 % avis positifs (22,271 notes)",22271,4.589106910331822,5aa3ba1eaac71f4b35976f6c,,,https://www.wish.com/c/5cef5a1fdcf4a85941a9b1e4,https://canary.contestimg.wish.com/api/webimage/5cef5a1fdcf4a85941a9b1e4-medium.jpg,5cef5a1fdcf4a85941a9b1e4
1 PC croix Mini livre biblique pendentif porte-clés anglais Sainte BIBLE religieux chrétien jésus porte-clés,1PC Cross Mini Bible Book Pendant Keychains English HOLY BIBLE Religious Christian Jesus Keyrings,2.37,EUR,3.0,EUR,2.87,10,,,5.0,1.0,1,0,0,0,0,,,,,,black,,50,Livraison standard,1,false,,50,,,CN,YIwuDina,yiwudina,"(4,229 notes)",4229,4.158429888862615,59bf7ba68ee78d7d9f542cdd,,,https://www.wish.com/c/5ab76bc71b3a8268bbc62110,https://canary.contestimg.wish.com/api/webimage/5ab76bc71b3a8268bbc62110-medium.jpg,5ab76bc71b3a8268bbc62110
Hummingbird Bedding Set Christian Bible Under His Wings Christian Gift Bedding Cover With 2 Pillowcases 100% Polyester Size 175 cm x 265 cm,Hummingbird Bedding Set Christian Bible Under His Wings Christian Gift Bedding Cover With 2 Pillowcases 100% Polyester Size 175 cm x 265 cm,38.0,EUR,67.0,EUR,44.99,0,,,5.0,0.0,,,,,,,,,,,,"twin(68""x86"")",50,Livraison standard,9.99,false,,50,true,Quantité limitée !,VN,timk,timk,97 % avis positifs (191 notes),191,4.549738219895288,5ffea39407bb1a786ab43cb2,,,https://www.wish.com/c/603d0cd1f40b373117757f0a,https://canary.contestimg.wish.com/api/webimage/603d0cd1f40b373117757f0a-medium.jpg,603d0cd1f40b373117757f0a
Hairstylist Christ Who Strengthens Through Christ Her Pink Bible T Shirt White Unisex S-6XL,Hairstylist Christ Who Strengthens Through Christ Her Pink Bible T Shirt White Unisex S-6XL,17.0,EUR,17.0,EUR,20,0,,,5.0,0.0,,,,,,,,,,,,unisexs,50,Livraison standard,6.0,false,,50,,,VN,bymerchantee,bymerchantee,92 % avis positifs (13 notes),13,4.769230769230769,6007b24d531067385944e40d,,,https://www.wish.com/c/60084daed3c57b3fc315dda6,https://canary.contestimg.wish.com/api/webimage/60084daed3c57b3fc315dda6-medium.jpg,60084daed3c57b3fc315dda6
Pendentif croix en argent thaïlandais sainte Bible 925 bijoux en argent Sterling avec pierre de grenat rouge naturel nettoyant métrosexuel,Thai Silver Cross Pendant Holy Bible 925 Sterling Silver Jewelry With Natural Red Garnet Stone Cleansing Metrosexual,31.0,EUR,40.0,EUR,37,0,,,5.0,0.0,,,,,,,,,,,,pendantonly,50,Livraison standard,10.0,false,,50,,,CN,Coolala,privatecompany,95 % avis positifs (197 notes),197,4.614213197969543,550a356499d7f31a245c9c51,,,https://www.wish.com/c/5be0000e896a7316f2f83f60,https://canary.contestimg.wish.com/api/webimage/5be0000e896a7316f2f83f60-medium.jpg,5be0000e896a7316f2f83f60
Purple Metallic Croc Purse-Style Bible / Book Cover w/Cross (Large),Purple Metallic Croc Purse-Style Bible / Book Cover w/Cross (Large),23.0,EUR,23.0,EUR,27.44,8,,,5.0,2.0,2,0,0,0,0,,,,,,,large,2,Livraison standard,15.95,false,,2,,,US,Atharva Products,atharvaproducts,"96 % avis positifs (3,602 notes)",3602,4.667406996113271,5733bba675f50319c6a1f3b3,,,https://www.wish.com/c/5f4c49b37df94b3e0cb2cb42,https://canary.contestimg.wish.com/api/webimage/5f4c49b37df94b3e0cb2cb42-medium.jpg,5f4c49b37df94b3e0cb2cb42
IF YOU,,,,,,,,,,,,,,,,,,,,,,,,,,,,,,,,,,,,,,,,,https://www.wish.com/c/5f8d71f7eb31f9a6cce12cc4,,5f8d71f7eb31f9a6cce12cc4
"Silver spoon: Italian food bible, semicolon","Silver spoon: Italian food bible, semicolon",122.0,EUR,122.0,EUR,147.0,0,,,5.0,0.0,,,,,,,,,,,,,32,Livraison standard,17.0,false,,32,,,KR,atcmart,atcmart,67 % avis positifs (6 notes),6,3.8333333333333335,5fe2119d5265268f81dec682,,,https://www.wish.com/c/6009942f6a59224006598be7,https://canary.contestimg.wish.com/api/webimage/6009942f6a59224006598be7-medium.jpg,6009942f6a59224006598be7
Religious Judaism The Holy Bible Key Chains Jewish Gift,Religious Judaism The Holy Bible Key Chains Jewish Gift,16.0,EUR,16.0,EUR,19,0,,,5.0,0.0,,,,,,,,,,,white,6cm,50,Livraison standard,11.0,false,,50,,,CA,11368796 CANADA CORPORATION,11368796canadacorporation,"80 % avis positifs (1,166 notes)",1166,3.9382504288164664,5ffb1f43fa8a25c707537989,,,https://www.wish.com/c/601edd61df77072dcde53ef8,https://canary.contestimg.wish.com/api/webimage/601edd61df77072dcde53ef8-medium.jpg,601edd61df77072dcde53ef8
Removable Modern Letters Proverbs Bible Verse Wall Art Stickers Wall Decal Home Decor joe,Removable Modern Letters Proverbs Bible Verse Wall Art Stickers Wall Decal Home Decor joe,3.94,EUR,4.0,EUR,4.77,4,,,5.0,0.0,,,,,,,,,,,,,50,Livraison standard,1.0,false,,50,,,CN,joeyyy,joeyyy,"93 % avis positifs (1,711 notes)",1711,4.442431326709527,5b076eb6c721a9630e172601,,,https://www.wish.com/c/5f5619442611208735bc7ef4,https://canary.contestimg.wish.com/api/webimage/5f5619442611208735bc7ef4-medium.jpg,5f5619442611208735bc7ef4
T-shirt à manches courtes à col rond imprimé foi et ensembles de pantalons skinny T-shirt chrétien Chemises religieuses Chemises foi Chemise Bible Vers,Faith Print Rouned Neck Short Sleeves T-shirt & Skinny Pants Sets Christian T-Shirt Religious Shirts Faith Shirts Bible Verse Top,16.0,EUR,16.0,EUR,19,1000,,,4.092198581560283,141.0,76,31,14,11,9,,,,,,black,s,50,Livraison standard,5.0,false,,50,true,Quantité limitée !,CN,wushein,wushein,"86 % avis positifs (8,369 notes)",8369,4.048034412713585,58a6f92596f1bb57c40b0d56,,,https://www.wish.com/c/5eaba2ff8cfd9205f45a40ee,https://canary.contestimg.wish.com/api/webimage/5eaba2ff8cfd9205f45a40ee-medium.jpg,5eaba2ff8cfd9205f45a40ee
Une douzaine de mini porte-clés religieux or / argent / noir Sainte Bible,A  dozen Mini Gold/Silver/ Black Holy Bible Religious Keychains ,12.0,EUR,17.0,EUR,14,10,,,4.721052631578948,190.0,159,15,11,4,1,,,,,,gold,spanishlanguage,8,Livraison standard,3.0,false,,50,,,CN,Hongrays,hongrays,93 % avis positifs (469 notes),469,4.535181236673774,573ea067e30b686bc4201f6e,,,https://www.wish.com/c/585e139f6e532b4d99e20471,https://canary.contestimg.wish.com/api/webimage/585e139f6e532b4d99e20471-medium.jpg,585e139f6e532b4d99e20471
"Three Bible scenes for children's chorus: composed by Myung-Hwan Kim, Ye-Sol","Three Bible scenes for children's chorus: composed by Myung-Hwan Kim, Ye-Sol",32.0,EUR,32.0,EUR,38.0,0,,,5.0,0.0,,,,,,,,,,,,,50,Livraison standard,9.0,false,,50,,,KR,woo_korea,woo_korea,100 % avis positifs (2 notes),2,5.0,5fd9cf6be3c38640101e3795,,,https://www.wish.com/c/5ff44f5aa7a402f457bad6cc,https://canary.contestimg.wish.com/api/webimage/5ff44f5aa7a402f457bad6cc-medium.jpg,5ff44f5aa7a402f457bad6cc
5Pcs Stainless Steel Men Pendant Chain Span Bible Cross Necklace Wholesale Lots Bulk Job Fashion Jewelry Paety Wedding Xmas Gift,5Pcs Stainless Steel Men Pendant Chain Span Bible Cross Necklace Wholesale Lots Bulk Job Fashion Jewelry Paety Wedding Xmas Gift,19.0,EUR,19.0,EUR,23,0,,,5.0,0.0,,,,,,,,,,,,,50,Livraison standard,6.0,false,,50,,,CN,Yiwu MingMao jewelry-trade company,yiwumingmaojewelrytradecompany,"92 % avis positifs (8,065 notes)",8065,4.396156230626162,556d377043229a1b55e808db,,,https://www.wish.com/c/5a0d3337e723d876ce2494cf,https://canary.contestimg.wish.com/api/webimage/5a0d3337e723d876ce2494cf-medium.jpg,5a0d3337e723d876ce2494cf
8 pcs Pigma Micron Fine Line Pen 005 01 02 03 04 05 08 PINCEAU Fournitures d'art,8pcs Pigma Micron Fine Line Pen 005 01 02 03 04 05 08 BRUSH Art Supplies,8.0,EUR,8.0,EUR,9,1000,,,3.919753086419753,162.0,80,41,9,12,20,,,,,,,,50,Livraison standard,3.0,false,,50,,,CN,jewels-mall,5,"92 % avis positifs (29,331 notes)",29331,4.318059391087927,53d5289dff4d6d3d895ef4f7,,,https://www.wish.com/c/5631e2488f33e00fd4e47bb5,https://canary.contestimg.wish.com/api/webimage/5631e2488f33e00fd4e47bb5-medium.jpg,5631e2488f33e00fd4e47bb5
2017 Anime Bible noir Reika Kitami 1/6 échelle Sexy adulte PVC Figure à collectionner modèle jouet,2017 Anime Bible Black Reika Kitami 1/6 Scale Sexy Adult PVC Figure Collectible Model Toy,24.0,EUR,24.0,EUR,28,10,,,4.588235294117647,34.0,28,2,1,2,1,,,,,,white,1,50,Livraison standard,8.0,false,,50,true,Quantité limitée !,CN,iamhy,iamhy,"95 % avis positifs (1,746 notes)",1746,4.553264604810996,5923d9e159c94b08af2e1476,,,https://www.wish.com/c/592f0145dec7e8188823dc45,https://canary.contestimg.wish.com/api/webimage/592f0145dec7e8188823dc45-medium.jpg,592f0145dec7e8188823dc45
Citation biblique lettres de foi chrétienne masque imprimé pour unisexe hommes femmes,Bible Quote Christian Faith Letters Printed Face Mask for Unisex Men Women,1.0,EUR,17.0,EUR,1.04,1000,,,3.4788732394366195,71.0,36,6,6,2,21,,,,,,black,1,50,Livraison standard,2.12,false,,50,,,CN,lb bz,lbbz,85 % avis positifs (841 notes),841,3.9964328180737216,5d44ebaaf32040412ba78593,,,https://www.wish.com/c/5ef300289abef244aee50490,https://canary.contestimg.wish.com/api/webimage/5ef300289abef244aee50490-medium.jpg,5ef300289abef244aee50490
KOREA Overseas Delivery New Tungsten Men's Bible Ring Cool Ring Fashion Jewelry,KOREA Overseas Delivery New Tungsten Men's Bible Ring Cool Ring Fashion Jewelry,190.0,EUR,190.0,EUR,230.0,0,,,5.0,0.0,,,,,,,,,,,multicolor,5mm_internationalno.10,50,Livraison standard,12.0,false,,50,,,KR,GPOPMALL,gpopmall,69 % avis positifs (16 notes),16,3.6875,600bc259338f835382ad78e9,,,https://www.wish.com/c/601e727c19cf4008682f989f,https://canary.contestimg.wish.com/api/webimage/601e727c19cf4008682f989f-medium.jpg,601e727c19cf4008682f989f
"""Amour sur la croix"" charme femme gardien pendentif en cristal collier, or 18 carats croix bible pendentif commémoratif bijoux","""Love on the Cross"" charm female guardian crystal pendant necklace, 18K gold cross Bible memorial pendant jewelry ",3.16,EUR,4.0,EUR,3.83,10,,,4.615384615384615,13.0,10,1,2,0,0,,,,,,gold,pendantandchain,50,Livraison standard,1.0,false,,50,,,CN,Danny hover board,dannyhoverboard,"90 % avis positifs (6,552 notes)",6552,4.264041514041514,5d523bde7ad2426d66351dbb,,,https://www.wish.com/c/5ec38546913bf7101b2a3b15,https://canary.contestimg.wish.com/api/webimage/5ec38546913bf7101b2a3b15-medium.jpg,5ec38546913bf7101b2a3b15
Photo verre bijoux Bible citation bijoux chrétiens avec Dieu rien n'est impossible Luc 1:37 citation collier Inspiration bijoux cadeau,Photo Glass Jewelry Bible Quote Christian Jewelry With God nothing is impossible Luke 1:37 Quote Necklace Inspiration Jewelry Gift,2.19,EUR,17.0,EUR,2.65,10,,,4.7272727272727275,44.0,36,6,1,0,1,,,,,,black,,50,Livraison standard,1,false,,50,,,CN,SmileLoveStore,sharebest,"96 % avis positifs (2,300 notes)",2300,4.585652173913044,5964edce9579d811f97ef9a0,,,https://www.wish.com/c/5bdf0de829fb1516b307ab33,https://canary.contestimg.wish.com/api/webimage/5bdf0de829fb1516b307ab33-medium.jpg,5bdf0de829fb1516b307ab33
Creative Spinner Ring Noir Argent 316L Acier Inoxydable Titane Femmes Hommes Mode Gravé Lettre Anneaux Rotatifs Prière Du Seigneur Bible Croix Punk Rock Bijoux Personnalisés De Milkle Cadeau,Creative Spinner Ring Black Silver 316L Stainless Titanium Steel Women Men Fashion Engraved Letter Rotatable Rings Lord's Prayer Bible Cross Punk Rock Personalized Jewelry From Milkle Gift,4.74,EUR,7.0,EUR,5.74,10,,,4.75,20.0,18,0,1,1,0,,,,,,,7,50,Livraison standard,2.0,false,,50,true,Quantité limitée !,CN,Milkle Gift,milkletech,"95 % avis positifs (50,668 notes)",50668,4.504914344359359,536102aa796f6809e8699ee8,,,https://www.wish.com/c/5bdd44a8f3a9f025cf9ed5f9,https://canary.contestimg.wish.com/api/webimage/5bdd44a8f3a9f025cf9ed5f9-medium.jpg,5bdd44a8f3a9f025cf9ed5f9
"Christian porte-clés, porte-clés verset biblique, cadeau d'étude biblique, cadeau d'église","Christian Key Chain, Bible Verse Key Chain, Bible Study Gift, Church Gift",3.02,EUR,12.0,EUR,3.66,10,,,4.508771929824562,57.0,37,14,5,0,1,,,,,,silver,givethankeswithagratefulheart,50,Livraison standard,1.0,false,,50,,,CN,"FY trade co., LTD",fytradecoltd,"93 % avis positifs (13,142 notes)",13142,4.368208796225841,5841863b879d3669df83e750,,,https://www.wish.com/c/5c175a77291ea8232ae0dd7b,https://canary.contestimg.wish.com/api/webimage/5c175a77291ea8232ae0dd7b-medium.jpg,5c175a77291ea8232ae0dd7b
"God and Sex: What the Bible Really Says, Twelve","God and Sex: What the Bible Really Says, Twelve",24.0,EUR,24.0,EUR,29.0,0,,,5.0,0.0,,,,,,,,,,,,,2,Livraison standard,17.0,false,,2,true,Quantité limitée !,KR,atcmart,atcmart,67 % avis positifs (6 notes),6,3.8333333333333335,5fe2119d5265268f81dec682,,,https://www.wish.com/c/6008079284853e9903f2e419,https://canary.contestimg.wish.com/api/webimage/6008079284853e9903f2e419-medium.jpg,6008079284853e9903f2e419
Croix Colliers Chaîne En Acier Inoxydable Bible Verset Christian Bijoux Pendentif Cadeau De Noël Pour Hommes,Cross Necklaces Stainless Steel Chain Bible Verse Christian Jewelry Pendant Christmas Gift For Men,4.81,EUR,14.0,EUR,5.83,5000,,,4.088480801335559,599.0,331,123,66,25,54,,,,,,,silver,50,Livraison standard,1.0,false,,50,,,CN,hongyunshangmao,hongyunshangmao,"88 % avis positifs (1,918 notes)",1918,4.177789363920751,5b0fbab8c2586941f3d80ca8,,,https://www.wish.com/c/5c9c40f927fcb2438fe28ee9,https://canary.contestimg.wish.com/api/webimage/5c9c40f927fcb2438fe28ee9-medium.jpg,5c9c40f927fcb2438fe28ee9
Support de livre portable en bambou Bible livre de cuisine livre de musique support d'ordinateur portable outil de lecture pliant,Bamboo Portable Book Stand Bible Cookbook Music Book laptop Holder Folding Reading Tool,19.0,EUR,19.0,EUR,23,10,,,5.0,4.0,4,0,0,0,0,,,,,,,,50,Livraison Express,6.0,true,,50,,,CN,Woruochengfo,woruochengfo,(639 notes),639,4.267605633802817,5f0fa7f8fafc86d2566222f5,,,https://www.wish.com/c/5f478d89e871260669a559cb,https://canary.contestimg.wish.com/api/webimage/5f478d89e871260669a559cb-medium.jpg,5f478d89e871260669a559cb
Ésaïe 41 10 mur Art Bible verset affiches murales cadeaux chrétiens pour les femmes Bible impression citation A4 sans cadre,Isaiah 41 10 Wall Art Bible Verse Wall Posters Christian Gifts for Women Bible Print Quote A4 UNFRAMED,65.0,EUR,84.0,EUR,77.99,0,,,5.0,0.0,,,,,,,,,,,,,3,Livraison standard,20.0,false,,3,true,Quantité limitée !,GB,Giftenza,giftenza,79 % avis positifs (336 notes),336,3.8660714285714284,5e778af629e7865cfc55bd63,,,https://www.wish.com/c/5f9a0bbf8b39f8003c4db237,https://canary.contestimg.wish.com/api/webimage/5f9a0bbf8b39f8003c4db237-medium.jpg,5f9a0bbf8b39f8003c4db237
45 * 45cm （18 pouces * 18 pouces） Citation chrétienne Verset de la Bible chrétienne Citation inspirante florale chrétienne Citation inspirante en lin Housse de coussin de voiture Housse de coussin pour la maison Taie d'oreiller décorative,45*45cm（18 Inch * 18 Inch）Christian Quote Christian Bible Verse Christian Floral Inspirational Quote Linen Throw Pillow Cover Car Cushion Cover Home Decorative Pillowcase,6.0,EUR,6.0,EUR,7,10,,,4.333333333333333,6.0,2,4,0,0,0,,,,,,,1,50,Livraison standard,2.0,false,,50,true,Quantité limitée !,CN,xingaisha,xingaisha,88 % avis positifs (137 notes),137,4.2773722627737225,5d3daf57ab0c794184a59228,,,https://www.wish.com/c/5ec9cbd6fdf60ebc48aee173,https://canary.contestimg.wish.com/api/webimage/5ec9cbd6fdf60ebc48aee173-medium.jpg,5ec9cbd6fdf60ebc48aee173
HOT Home 4:13 Philippiens mots je peux faire toutes choses citations Bible sticker mural vinyle autocollant Christ,HOT Home 4:13 Philippians Words I Can Do All Things Quotes Bible Wall Decal Vinyl Sticker Christ,4.82,EUR,5.0,EUR,5.84,1,,,5.0,0.0,,,,,,,,,,,,,50,Livraison Express,8.0,true,,50,true,Quantité limitée !,CN,kuaida,kuaida,"88 % avis positifs (5,108 notes)",5108,4.158966327329679,5acb00279d5e971784d00a6a,,,https://www.wish.com/c/5f0697976c23f00b2fa6167b,https://canary.contestimg.wish.com/api/webimage/5f0697976c23f00b2fa6167b-medium.jpg,5f0697976c23f00b2fa6167b
"Biker homme en acier inoxydable argent, or, noir Bible Note Cross anglais Bible seigneurs prière lien bracelet de poignet, 8,7 pouces","Men's Biker Stainless Steel Silver, Gold, Black Bible Note Cross English Bible Lords Prayer Link Wrist Bracelet, 8.7 inch",10.0,EUR,80.0,EUR,11,10,,,4.2,15.0,10,2,1,0,2,,,,,,silver,,50,Livraison standard,3.0,false,,50,,,CN,washi tape,anrichgloballimited,"90 % avis positifs (1,578 notes)",1578,4.310519645120405,546f33481280fa6a4ff34fd4,,,https://www.wish.com/c/5b5f0826aba32b12b51a11f3,https://canary.contestimg.wish.com/api/webimage/5b5f0826aba32b12b51a11f3-medium.jpg,5b5f0826aba32b12b51a11f3
Fantasy Master,,,,,,,,,,,,,,,,,,,,,,,,,,,,,,,,,,,,,,,,,https://www.wish.com/c/5ef726fd90b8a6ddbed06539,,5ef726fd90b8a6ddbed06539
Wosawe,,,,,,,,,,,,,,,,,,,,,,,,,,,,,,,,,,,,,,,,,https://www.wish.com/c/5eb68d62eb31f924831fafe5,,5eb68d62eb31f924831fafe5
Foi Espoir Amour Joie Bible Verset Affiches Peintures Murales Christian Murale Design Moderne pour Salon Salle À Manger Cadeaux De Mariage,Faith Hope Love Joy Bible Verse Posters Wall Paintings Christian Wall Mural Modern Design for Living Room Dining Room Wedding Gifts,4.0,EUR,4.0,EUR,4,20000,,,4.043859649122807,1026.0,606,151,91,64,114,,,,,,,faith,50,Livraison standard,1.0,false,,50,true,Quantité limitée !,CN,eaglew,eaglew,"84 % avis positifs (1,245 notes)",1245,4.05140562248996,58d60fc562982052bca8dc22,,,https://www.wish.com/c/5cd27bf06455a36f8515c4b2,https://canary.contestimg.wish.com/api/webimage/5cd27bf06455a36f8515c4b2-medium.jpg,5cd27bf06455a36f8515c4b2
"Jésus-Christ Bible Religieux ""Pour Dieu tant aimé le monde ..."" Jean 3:16 - Pièce de défi à collectionner recto verso Bonne chance","Jesus Christ Bible Religious ""For God So Loved The World..."" John 3:16 - Good Luck Double Sided Collectible Challenge Coin",7.0,EUR,7.0,EUR,8,10,,,4.745098039215686,51.0,44,4,1,1,1,,,,,,,,50,Livraison standard,2.0,false,,50,true,Quantité limitée !,CN,Global  Coin Discount Store,globalcoindiscountstore,"93 % avis positifs (1,790 notes)",1790,4.470949720670391,5cd3cdf253f2f374ce0cb1b5,,,https://www.wish.com/c/5ce3c0de88e8417943b3dbf2,https://canary.contestimg.wish.com/api/webimage/5ce3c0de88e8417943b3dbf2-medium.jpg,5ce3c0de88e8417943b3dbf2
MP Croix Bracelet Religieux Manchette Bracelet Bible Verset Chrétien Cadeaux Bijoux pour Femmes Hommes,MP Cross Bracelet Religious Cuff Bangle Bible Verse Christian Gifts Jewelry for Women Men,10.0,EUR,10.0,EUR,11,10,,,5.0,0.0,,,,,,,,,,,black,forgodsolovedtheworld.john3.16,50,Livraison standard,2.0,false,,50,,,CN,MPRAINBOW,mprainbow,"95 % avis positifs (4,584 notes)",4584,4.535776614310646,5a1fb5bf67e9be693288cf50,,,https://www.wish.com/c/5ee31d51602ad2dfeb49eb87,https://canary.contestimg.wish.com/api/webimage/5ee31d51602ad2dfeb49eb87-medium.jpg,5ee31d51602ad2dfeb49eb87
God Keychain Christian Keychain ECCLESIASTES 3:1 13:8 19:26 Bible Verse Key Chain Inspirational Cross Religious Gifts,God Keychain Christian Keychain ECCLESIASTES 3:1 13:8 19:26 Bible Verse Key Chain Inspirational Cross Religious Gifts,3.97,EUR,4.0,EUR,4.8100000000000005,3,,,5.0,0.0,,,,,,,,,,,,34,50,Livraison standard,1.0,false,,50,,,CN,"ShenZhen XiaYang Trading Co.,Ltd.",shenzhenxiayangtradingcoltd,"93 % avis positifs (22,482 notes)",22482,4.416333066453163,57240a6a0d130e360863af90,,,https://www.wish.com/c/603720068ef9426136d70e90,https://canary.contestimg.wish.com/api/webimage/603720068ef9426136d70e90-medium.jpg,603720068ef9426136d70e90
MARCHE AVEC JÉSUS Autocollant Fenêtre De Voiture Religieuse Décalque de Vinyle Dieu Empreintes Mignon,WALKING WITH JESUS Sticker Religious Car Window Vinyl Decal God Footprints Cute,2.0,EUR,2.0,EUR,2,5000,,,4.6457654723127035,1228.0,975,158,43,17,35,,,,,,white,,50,Livraison standard,1,false,,50,true,Quantité limitée !,CN,Blue Summer,bluesummer,"97 % avis positifs (38,557 notes)",38557,4.619861503747698,5534e10200bfac0c18150ac0,,,https://www.wish.com/c/578b0d111295ec229393624c,https://canary.contestimg.wish.com/api/webimage/578b0d111295ec229393624c-medium.jpg,578b0d111295ec229393624c
