title,title_orig,discount_price,discount_price_currency,retail_price,retail_price_currency,discount_price_in_original_currency,nb_cart_orders_approx,nb_units_purchased_approx,uses_ad_boosts,rating,rating_count,rating_five_count,rating_four_count,rating_three_count,rating_two_count,rating_one_count,badges_count,badge_local_product,badge_product_quality,badge_fast_shipping,tags,product_color,product_variation_size_id,product_variation_inventory,shipping_option_name,shipping_option_price,shipping_is_express,countries_shipped_to,inventory_total,has_urgency_banner,urgency_text,origin_country,merchant_title,merchant_name,merchant_info_subtitle,merchant_rating_count,merchant_rating,merchant_id,merchant_has_profile_picture,merchant_profile_picture,product_url,product_picture,product_id
Milimetrado My Bible - Carnet de 1280 pages - Classique,Milimetrado My Bible - 1280 page Notebook - Classic,34.0,EUR,34.0,EUR,41,0,,,5.0,0.0,,,,,,,,,,,,,17,Livraison Express,11.0,true,,17,,,NL,ChannelDistribution,channeldistribution,"93 % avis positifs (1,369 notes)",1369,4.445580715850986,59f9adcd67e9be5762e8fb98,,,https://www.wish.com/c/5d64f3cc9c61b2490c0721aa,https://canary.contestimg.wish.com/api/webimage/5d64f3cc9c61b2490c0721aa-medium.jpg,5d64f3cc9c61b2490c0721aa
"Écriture de guérison, bijoux de guérison, collier de verset biblique, cadeau chrétien, pendentif d'écriture, boîte-cadeau gratuite","Healing Scripture, Healing Jewelry, Bible Verse Necklace, Christian Gift, Scripture Pendant, Free Gift Box",2.25,EUR,17.0,EUR,2.73,10,,,4.478260869565218,23.0,18,1,2,1,1,,,,,,black,,50,Livraison standard,1,false,,50,,,CN,SmileLoveStore,sharebest,"96 % avis positifs (2,300 notes)",2300,4.585652173913044,5964edce9579d811f97ef9a0,,,https://www.wish.com/c/5bdf0c9e1ceef616f53f832c,https://canary.contestimg.wish.com/api/webimage/5bdf0c9e1ceef616f53f832c-medium.jpg,5bdf0c9e1ceef616f53f832c
"Le Seigneur est bon Nahum 1: 7 tasse de verset biblique, tasse religieuse","The Lord Is Good Nahum 1:7 Bible Verse Mug, Religious Mug",13.0,EUR,16.0,EUR,15,1,,,5.0,0.0,,,,,,,,,,,,,50,Livraison standard,4.0,false,,50,,,CN,xiaoguang8890,xiaoguang8890,"92 % avis positifs (1,412 notes)",1412,4.351274787535411,5a5c6ce4cefb156cba713457,,,https://www.wish.com/c/5b7b6752ef79a637c49094d3,https://canary.contestimg.wish.com/api/webimage/5b7b6752ef79a637c49094d3-medium.jpg,5b7b6752ef79a637c49094d3
Christian Bible Verses Scripture Quotes Joshua-1-9 Pink Flowers Art - Be Strong and Courageous God Be With You Rideau de douche,Christian Bible Verses Scripture Quotes Joshua-1-9 Pink Flowers Art - Be Strong and Courageous God Be With You Shower Curtain,23.0,EUR,23.0,EUR,27,6,,,5.0,0.0,,,,,,,,,,,,150cmby180cm,50,Livraison standard,7.0,false,,50,,,CN,Fly so high,flysohigh,97 % avis positifs (288 notes),288,4.600694444444445,589ae3daad330a4ff42b6a1b,,,https://www.wish.com/c/5a8a35f607c7b416a9d9b60f,https://canary.contestimg.wish.com/api/webimage/5a8a35f607c7b416a9d9b60f-medium.jpg,5a8a35f607c7b416a9d9b60f
"Crucifix mural autocollant, la vie du Christ Collection affichage croix autocollant, sticker mural Bible religieux accessoires pour cadeau","Sticker Wall Crucifix, The Life of Christ Collection Display Cross Sticker, Wall Decal Religious Bible Accessories for Gift",3.91,EUR,4.0,EUR,4.74,6,,,5.0,0.0,,,,,,,,,,,,20*30cm,50,Livraison standard,1.0,false,,50,,,CN,Womaneer Skirts,womaneerskirts,94 % avis positifs (311 notes),311,4.546623794212219,5ecc741e46567b54a4c6c5a3,,,https://www.wish.com/c/5ffd5fdc87dcf4d00284b6c0,https://canary.contestimg.wish.com/api/webimage/5ffd5fdc87dcf4d00284b6c0-medium.jpg,5ffd5fdc87dcf4d00284b6c0
"Korean-Chinese Bible Complete Book NKR72EMSN (Large Version) (Pearl Vinyl) (Unmarked), Korean Bible Society","Korean-Chinese Bible Complete Book NKR72EMSN (Large Version) (Pearl Vinyl) (Unmarked), Korean Bible Society",23.0,EUR,23.0,EUR,27.0,0,,,5.0,0.0,,,,,,,,,,,,,5,Livraison standard,17.0,false,,5,,,KR,atcmart,atcmart,67 % avis positifs (6 notes),6,3.8333333333333335,5fe2119d5265268f81dec682,,,https://www.wish.com/c/600c2c125846c2cad8d92dbe,https://canary.contestimg.wish.com/api/webimage/600c2c125846c2cad8d92dbe-medium.jpg,600c2c125846c2cad8d92dbe
Conception moderne Bible paix espoir amour définition affiches citations inspirantes décoration murale murale pour salon amour chambre décor sans cadres,Modern Design Bible Peace Hope Love Definition Posters Inspirational Quotes Wall Decoration Mural for Living Room Love Room Decor Without Frames,1.52,EUR,3.0,EUR,1.8399999999999999,10,,,4.5,10.0,8,1,0,0,1,,,,,,,faith,50,Livraison standard,1,false,,50,,,US,QiaofudaolYg,qiaofudaolyg,86 % avis positifs (7 notes),7,4.428571428571429,5e8a9f1ba7b0a9de2c184508,,,https://www.wish.com/c/5fa472395bb5481b7157d82d,https://canary.contestimg.wish.com/api/webimage/5fa472395bb5481b7157d82d-medium.jpg,5fa472395bb5481b7157d82d
Pupitre de haute qualité de la bible chrétienne église pasteur machine serment prière chrétienne pupitre plate-forme de Jésus La plate-forme,High-grade lectern of the Christian bible church pastor machine oath Christian prayer Jesus platform lectern The platform,477.0,EUR,2888.0,EUR,578.0,2,,,5.0,0.0,,,,,,,,,,,transparent,1kg,13,Livraison standard,12.0,false,,13,,,CN,Beautiful display stands,beautifuldisplaystands,93 % avis positifs (42 notes),42,4.404761904761905,5d209a550c5f04412c7d23f3,,,https://www.wish.com/c/5d3f09f541fe307f619e8306,https://canary.contestimg.wish.com/api/webimage/5d3f09f541fe307f619e8306-medium.jpg,5d3f09f541fe307f619e8306
Tom Ford,,,,,,,,,,,,,,,,,,,,,,,,,,,,,,,,,,,,,,,,,https://www.wish.com/c/5e8d2fec9719ed6404967740,,5e8d2fec9719ed6404967740
2 pièces chrétien jésus croix en cuir porte-clés résine anglais espagnol sainte Bible livre porte-clés bijoux pour maman papa cadeau,2pcs Christian Jesus Cross leather Keychain Resin English Spanish Holy Bible Book Key Ring jewelry for mom dad Gift ,6.0,EUR,6.0,EUR,7,4,,,5.0,1.0,1,0,0,0,0,,,,,,,2pcs(randomcolor),50,Livraison standard,2.0,false,,50,true,Quantité limitée !,VE,Bodejafama,bodejafama,83 % avis positifs (41 notes),41,4.195121951219512,5e3f433364c3152a582248a4,,,https://www.wish.com/c/5fd19d0faa139584c6c11cd6,https://canary.contestimg.wish.com/api/webimage/5fd19d0faa139584c6c11cd6-medium.jpg,5fd19d0faa139584c6c11cd6
Rêve sans peur affiche Design moderne Citations d'amour en direct Peintures Décoration murale Photos murales pour la décoration de cuisine Verset biblique Peintures Cuadros Decorativos sans cadres,Dream Without Fear Poster Modern Design Live Love Quotes Paintings Wall Decor Wall Pictures for Kitchen Decoration Bible Verse Paintings Cuadros Decorativos Without Frames,3.95,EUR,4.0,EUR,4.79,10,,,3.730769230769231,26.0,14,3,3,0,6,,,,,,,dream,50,Livraison standard,1.0,false,,50,,,CN,woshuitingstory,woshuitingstory,"(1,946 notes)",1946,4.034429599177801,5847b674ef562826262ce504,,,https://www.wish.com/c/5f3e0d9e55e8b00040717e28,https://canary.contestimg.wish.com/api/webimage/5f3e0d9e55e8b00040717e28-medium.jpg,5f3e0d9e55e8b00040717e28
Vintage Bible livre Photo médaillons pendentifs 18K véritable plaqué or collier ras du cou charmes bijoux croix bijoutier,Vintage Bible Book Photo Lockets Pendants 18K Real Gold Plated Choker Necklace Charms Jewelry Cross Jeweller,14.0,EUR,99.0,EUR,16,10,,,4.8,5.0,4,1,0,0,0,,,,,,gold,,50,Livraison standard,5.0,false,,50,true,Quantité limitée !,CN,etsytopseller,greenstone,"89 % avis positifs (1,868 notes)",1868,4.245717344753747,5445cca78edcfa5a65fc4ee0,,,https://www.wish.com/c/5485746f47aacf26f2763f08,https://canary.contestimg.wish.com/api/webimage/5485746f47aacf26f2763f08-medium.jpg,5485746f47aacf26f2763f08
Masques de protection de la bouche lavables imprimés par Bible chrétienne de haute qualité pour hommes femmes,High Quality Christian Bible Printed Washable Mouth Cover Face Masks for Men Women,1.0,EUR,19.0,EUR,1.04,10,,,4.8,15.0,13,1,1,0,0,,,,,,,1,50,Livraison standard,1.06,false,,50,,,CN,WENFENGH,wenfengh,"87 % avis positifs (2,461 notes)",2461,4.130028443722064,5d536c64eb5ed446b27b4c55,,,https://www.wish.com/c/5ebb8fad7b67b44485e79179,https://canary.contestimg.wish.com/api/webimage/5ebb8fad7b67b44485e79179-medium.jpg,5ebb8fad7b67b44485e79179
Soyez tranquille et sachez que je suis Dieu T-shirt à manches courtes Nouvelles femmes Mode Christian T-Shirt Chemises religieuses Chemises de foi Bible Verset Tee,Be Still and Know That I Am God Short Sleeve T-shirt New Women Fashion Christian T-Shirt Religious Shirts Faith Shirts Bible Verse Tee,5.0,EUR,5.0,EUR,6,1000,,,3.827814569536424,151.0,66,32,27,13,13,,,,,,green,xs,1,Livraison standard,2.0,false,,50,,,CN,yuansaisai,yuansaisai,"88 % avis positifs (15,607 notes)",15607,4.168001537771513,58482e161591452afb9ab923,,,https://www.wish.com/c/5d68be491b88a17f8febbca1,https://canary.contestimg.wish.com/api/webimage/5d68be491b88a17f8febbca1-medium.jpg,5d68be491b88a17f8febbca1
Home 4:13 Philippians Words I Can Do All Things Quotes Bible Wall Decal Vinyl Sticker Christ HOT ,Home 4:13 Philippians Words I Can Do All Things Quotes Bible Wall Decal Vinyl Sticker Christ HOT ,3.84,EUR,4.0,EUR,4.65,10,,,5.0,0.0,,,,,,,,,,,,,50,Livraison standard,1.0,false,,50,,,CN,hehhejfusss,ofooopppf,"90 % avis positifs (5,479 notes)",5479,4.291111516700128,5acac8db81260b7a55389b5d,,,https://www.wish.com/c/5af005ab715e0c1495bcb19a,https://canary.contestimg.wish.com/api/webimage/5af005ab715e0c1495bcb19a-medium.jpg,5af005ab715e0c1495bcb19a
"Silver spoon: Italian food bible, semicolon","Silver spoon: Italian food bible, semicolon",278.0,EUR,278.0,EUR,336.0,0,,,5.0,0.0,,,,,,,,,,,,,16,Livraison standard,12.0,false,,16,,,KR,airkoreamall,airkoreamall,100 % avis positifs (1 notes),1,5.0,602f8df0611a7f3dad95d7c8,,,https://www.wish.com/c/603b5b0cf40b37074e758873,https://canary.contestimg.wish.com/api/webimage/603b5b0cf40b37074e758873-medium.jpg,603b5b0cf40b37074e758873
"Large Print Thinline Reference Bible-ESV-Celtic Cross : English Standard Version Burgundy Celtic Cross TruTone Thinline Reference Bible, Crossway Books","Large Print Thinline Reference Bible-ESV-Celtic Cross : English Standard Version Burgundy Celtic Cross TruTone Thinline Reference Bible, Crossway Books",57.0,EUR,57.0,EUR,68.0,0,,,5.0,0.0,,,,,,,,,,,,,2,Livraison standard,17.0,false,,2,true,Quantité limitée !,KR,atcmart,atcmart,67 % avis positifs (6 notes),6,3.8333333333333335,5fe2119d5265268f81dec682,,,https://www.wish.com/c/6007c09dd696c849f3c009c4,https://canary.contestimg.wish.com/api/webimage/6007c09dd696c849f3c009c4-medium.jpg,6007c09dd696c849f3c009c4
New Titanium Steel Bullet Pendant Necklace Cross Bible Verse Ash Container Memorial Jewelry Openable Put Into Perfume,New Titanium Steel Bullet Pendant Necklace Cross Bible Verse Ash Container Memorial Jewelry Openable Put Into Perfume,7.0,EUR,7.0,EUR,8,2,,,5.0,0.0,,,,,,,,,,,silver,,50,Livraison standard,2.0,false,,50,,,CN,Maryswill456,maryswill456,85 % avis positifs (227 notes),227,4.118942731277533,58d09d57b9675351074014f9,,,https://www.wish.com/c/605ea9c685b5f6a5b89e831c,https://canary.contestimg.wish.com/api/webimage/605ea9c685b5f6a5b89e831c-medium.jpg,605ea9c685b5f6a5b89e831c
"Christian Art Gifts Lot de 6 visages de chiot (Style # 2) Signet de verset biblique magnétique inspirant, taille petit 2,25 ""x 0,75""","Christian Art Gifts Set of 6 Puppy Faces (Style #2) Inspirational Magnetic Bible Verse Bookmark, Size Small 2.25"" x .75""",5.0,EUR,5.0,EUR,6.04,1,,,5.0,0.0,,,,,,,,,,,,,3,Livraison standard,11.64,false,,3,,,US,Atharva Products,atharvaproducts,"96 % avis positifs (3,602 notes)",3602,4.667406996113271,5733bba675f50319c6a1f3b3,,,https://www.wish.com/c/5f4c4b720116f74ad0136ccd,https://canary.contestimg.wish.com/api/webimage/5f4c4b720116f74ad0136ccd-medium.jpg,5f4c4b720116f74ad0136ccd
Beautiful Goods Pratique Excellent Cross Bible Porte-clés Style Porte-clés style Pretty Best Charm Accessory,Beautiful Goods Practical Excellent Cross Bible Keychain Style Pretty Best Charm Accessory,3.06,EUR,4.0,EUR,3.71,10000,,,4.390034364261169,3492.0,2389,486,357,110,150,,,,,,gold,,50,Livraison standard,1.0,false,,50,,,CN,QRX STORE,qrxstore,"(11,535 notes)",11535,4.370004334633723,5899bec8a71b074f5d3328b9,,,https://www.wish.com/c/5a9dfd650548ea37881e0a9e,https://canary.contestimg.wish.com/api/webimage/5a9dfd650548ea37881e0a9e-medium.jpg,5a9dfd650548ea37881e0a9e
480 pages Vintage cahier épais Bible journal livre en cuir Agenda Zakka Caderno Escolar papeterie,480 pages Vintage Thick notebook Bible Diary Book Leather Agenda Zakka Caderno Escolar Stationery,11.0,EUR,33.0,EUR,13,10,,,4.5,2.0,1,1,0,0,0,,,,,,,,15,Livraison standard,3.0,false,,15,true,Quantité limitée !,CN,Hyetsrty96,hyetsrty96,"88 % avis positifs (21,300 notes)",21300,4.18868544600939,5ad465dba71fbf17dd6ac3f5,,,https://www.wish.com/c/5e67575748b41e210284273e,https://canary.contestimg.wish.com/api/webimage/5e67575748b41e210284273e-medium.jpg,5e67575748b41e210284273e
Haute qualité grande taille 18K argent plaqué or jésus lettre Bible bande de mariage anneau hommes femmes mode,High Quality Large Size 18K Silver Gold Plated Jesus Letter Bible Wedding Band Ring Men Women Fashion,4.7,EUR,5.0,EUR,5.7,1000,,,4.522613065326633,199.0,148,25,16,2,8,,,,,,gold&black,8,50,Livraison standard,1.0,false,,50,true,Quantité limitée !,CN,Andy-an,andyan,"93 % avis positifs (17,793 notes)",17793,4.394031360647445,57a18f02039b170f593dee62,,,https://www.wish.com/c/5829a10f1537b71de9177ad1,https://canary.contestimg.wish.com/api/webimage/5829a10f1537b71de9177ad1-medium.jpg,5829a10f1537b71de9177ad1
"Achetez-en 1, obtenez-en 1 gratuit! Collier de verset biblique, croyez, foi, marchez amoureux, pour des cadeaux chrétiens","Buy 1 Get 1 Free! Bible Verse Necklace, Believe, Faith, Walk In Love, For Christian Gifts",3.94,EUR,12.0,EUR,4.77,10,,,4.785714285714286,42.0,37,1,4,0,0,,,,,,silver,believe,50,Livraison standard,1.0,false,,50,,,CN,wangdink,wangdink,"93 % avis positifs (19,449 notes)",19449,4.389017430202067,597de12051762974780964bc,,,https://www.wish.com/c/5bf50a78dfa27f5cb9a9b4ac,https://canary.contestimg.wish.com/api/webimage/5bf50a78dfa27f5cb9a9b4ac-medium.jpg,5bf50a78dfa27f5cb9a9b4ac
Dazoriginal,,,,,,,,,,,,,,,,,,,,,,,,,,,,,,,,,,,,,,,,,https://www.wish.com/c/5f3d069290b8a6576072aa55,,5f3d069290b8a6576072aa55
Nouveau 925 argent exquis Bible jésus croix pendentif collier pour femmes hommes Crucifix charme simulé platine diamant bijoux,New 925 Silver Exquisite Bible Jesus Cross Pendant Necklace for women men Crucifix Charm Simulated Platinum Diamond Jewelry,16.0,EUR,132.0,EUR,19,0,,,5.0,0.0,,,,,,,,,,,white,,50,Livraison standard,6.0,false,,50,,,CN,yc-China You,ycchinayou,"94 % avis positifs (5,090 notes)",5090,4.4693516699410605,5719d548b2d43a329e2bfbe5,,,https://www.wish.com/c/5d4a3f77c36b091ee97c006f,https://canary.contestimg.wish.com/api/webimage/5d4a3f77c36b091ee97c006f-medium.jpg,5d4a3f77c36b091ee97c006f
Eid Book Holder Ramadan Decor En Bois Sainte Bible Stand Titulaire Serre-Livres À La Main,Eid Book Holder Ramadan Decor Wooden Holy Bible Stand Holder Handmade Bookends ,13.0,EUR,13.0,EUR,15,8,,,5.0,1.0,1,0,0,0,0,,,,,,,,11,Livraison standard,4.0,false,,11,true,Quantité limitée !,CN,Kizetenn,kizetenn,"(6,900 notes)",6900,4.159275362318841,5be2b28ac0e3441922951d0d,,,https://www.wish.com/c/5e6b5661c2a2ee61142106d5,https://canary.contestimg.wish.com/api/webimage/5e6b5661c2a2ee61142106d5-medium.jpg,5e6b5661c2a2ee61142106d5
Collier de prière pour homme en or 18 carats / acier inoxydable émail noir avec pendentif croix avec étiquette de chien (chaîne de 22 pouces),Men's Prayer Necklace 18K Gold/Stainless Steel Black Enamel Bible Words Cross Dog Tag Pendant (22 Inch Chain),12.0,EUR,30.0,EUR,14,1000,,,4.701716738197425,466.0,371,66,19,5,5,,,,,,gold,,32,Livraison standard,4.0,false,,50,,,CN,infashionjewelry,infashionjewelry,"94 % avis positifs (13,668 notes)",13668,4.483318700614574,552f7dc18157891d8454ea64,,,https://www.wish.com/c/585a4ebc5784484d5e022669,https://canary.contestimg.wish.com/api/webimage/585a4ebc5784484d5e022669-medium.jpg,585a4ebc5784484d5e022669
24Style Haute Qualité Transparent Outils à découper les timbres de haute qualité Outils à main pour enfants Outils à gratter les décorations de l'album scellés au silicone Diy Toy pour enfants,24Style High Quality Transparent Stamp Cutting Hand Tools Children Diy Toy Silicone Sealed Album Decoration Scraping Tools,2.33,EUR,3.0,EUR,2.8200000000000003,10000,,,4.547408343868521,1582.0,1175,243,76,31,57,,,,,,,1,50,Livraison standard,1,false,,50,true,Quantité limitée !,CN,lictar,lictar,"(3,560 notes)",3560,4.604494382022472,5abcd30f9bda4e2ea39b3f9e,,,https://www.wish.com/c/5c6b9173826e9903b69738eb,https://canary.contestimg.wish.com/api/webimage/5c6b9173826e9903b69738eb-medium.jpg,5c6b9173826e9903b69738eb
Verre Photo collier bijoux religieux collier chrétien classe biblique dames retraite cadeau nautique hébreux 6:19,Glass Photo Necklace Religious Jewelry Christian Necklace Bible Class Ladies Retreat Gift Nautical Hebrews 6:19,4.01,EUR,5.0,EUR,4.86,10,,,4.78030303030303,132.0,111,16,3,1,1,,,,,,silver,,50,Livraison standard,1.0,false,,50,,,CN,liyuna,liyuna,"96 % avis positifs (13,233 notes)",13233,4.546059094687523,589899a3d67e714f770f0d9d,,,https://www.wish.com/c/5979a02f86890219a4016dcb,https://canary.contestimg.wish.com/api/webimage/5979a02f86890219a4016dcb-medium.jpg,5979a02f86890219a4016dcb
5 pièces HD impression mur Art bible musulmane affiche islamique Allah le coran toile peinture pour salon décoration de la maison photo pas de renommée,5 Pieces HD Print Wall Art Muslim Bible Poster Islamic Allah The QurAn Canvas Painting for Living Room Home Decoration Picture No Ftame,12.0,EUR,12.0,EUR,14,9,,,5.0,0.0,,,,,,,,,,,,1,50,Livraison standard,4.0,false,,50,,,CN,love yu,loveyu,(665 notes),665,4.204511278195489,5909e71fe424db256fd96491,,,https://www.wish.com/c/5e497146881a3450086c8bc2,https://canary.contestimg.wish.com/api/webimage/5e497146881a3450086c8bc2-medium.jpg,5e497146881a3450086c8bc2
17 Styles Religieux Croix Jésus Écriture Citation Christian Bible Verset Foi Inspirée En Acier Inoxydable Bracelets En Silicone Pour Hommes Femmes Personnaliser Bijoux Réglables Cadeau,17 Styles Religious Cross Jesus Scripture Quote Christian Bible Verse Inspirational Faith Stainless Steel Silicone Bracelets For Men Women Personalize Adjustable Jewelry Gift,3.13,EUR,4.0,EUR,3.8,1000,,,4.375,72.0,48,14,2,5,3,,,,,,,h07,6,Livraison standard,1.0,false,,6,,,CN,yijiashe,yijiashe,"92 % avis positifs (13,567 notes)",13567,4.339131716665438,5853b4414949434d447ff297,,,https://www.wish.com/c/5dbfcdbb5918274085f352bf,https://canary.contestimg.wish.com/api/webimage/5dbfcdbb5918274085f352bf-medium.jpg,5dbfcdbb5918274085f352bf
Bracelet homme croix de prière biblique en acier inoxydable,Bible prayer cross stainless steel men's Bracelet,6.0,EUR,6.0,EUR,7,10,,,4.5,6.0,4,1,1,0,0,,,,,,,,5,Livraison standard,2.0,false,,5,,,CN,Global E-commerc1,globalecommerc1,95 % avis positifs (43 notes),43,4.651162790697675,5ef0517f24535af53a1e9956,,,https://www.wish.com/c/5f78660ddafb721c1a2c1c46,https://canary.contestimg.wish.com/api/webimage/5f78660ddafb721c1a2c1c46-medium.jpg,5f78660ddafb721c1a2c1c46
50 pièces / ensemble jésus christianisme foi auto-fabriqué autocollant Bible prière croyant étanche papeterie PVC autocollants pour cadeaux,50Pcs/Set Jesus Christianity Faith Self-made Sticker Bible Prayer Believer Waterproof Stationery PVC Stickers For Gifts,4.0,EUR,6.0,EUR,4,10,,,5.0,1.0,1,0,0,0,0,,,,,,,yt70,50,Livraison standard,1.0,false,,50,,,CN,haiwei store,haiweistore,"92 % avis positifs (1,307 notes)",1307,4.343534812547819,5b00111b7d4d840e0190b525,,,https://www.wish.com/c/5ef3869990579b94742304c1,https://canary.contestimg.wish.com/api/webimage/5ef3869990579b94742304c1-medium.jpg,5ef3869990579b94742304c1
"Silver spoon: Italian food bible, semicolon (please check the description)","Silver spoon: Italian food bible, semicolon (please check the description)",182.0,EUR,182.0,EUR,220.0,0,,,5.0,0.0,,,,,,,,,,,,,29,Livraison standard,12.0,false,,29,,,KR,K-Mild,kmild,63 % avis positifs (8 notes),8,3.0,5ff5ca506fb1f4d5c07d6fd6,,,https://www.wish.com/c/601287d8cc10e0697ac94a9d,https://canary.contestimg.wish.com/api/webimage/601287d8cc10e0697ac94a9d-medium.jpg,601287d8cc10e0697ac94a9d
Havaianas,,,,,,,,,,,,,,,,,,,,,,,,,,,,,,,,,,,,,,,,,https://www.wish.com/c/5f7859dfeb31f9451e1de04e,,5f7859dfeb31f9451e1de04e
He will cover you will His feathers and under His wings you will find refuge Psalm 91 4 Necklace Bible Verse Jewelry Gift,He will cover you will His feathers and under His wings you will find refuge Psalm 91 4 Necklace Bible Verse Jewelry Gift,3.04,EUR,7.0,EUR,3.69,5,,,5.0,0.0,,,,,,,,,,,silver,,50,Livraison standard,1.0,false,,50,,,CN,wutongshipin,梧桐饰品,"96 % avis positifs (1,792 notes)",1792,4.55859375,56da46e89a03dc75b60bc361,,,https://www.wish.com/c/5af2fb501dcf4332487f7e7b,https://canary.contestimg.wish.com/api/webimage/5af2fb501dcf4332487f7e7b-medium.jpg,5af2fb501dcf4332487f7e7b
Citations Art mural toile impression verset de la Bible affiche écriture chrétienne Art peinture minimaliste image dieu salon décoration murale pas de cadre,Quotes Wall Art Canvas Print Bible Verse Poster Scripture Christian Art Painting Minimalist Picture God Living Room Wall Decor No Frame,3.9,EUR,4.0,EUR,4.73,10,,,4.0,1.0,0,1,0,0,0,,,,,,,20cmby25cm,50,Livraison standard,1.0,false,,50,true,Quantité limitée !,CN,wantsr,wantsr,"91 % avis positifs (5,979 notes)",5979,4.316942632547248,59635e9fe81e8a293d11ac49,,,https://www.wish.com/c/5e55cf798c00bd182a305cd0,https://canary.contestimg.wish.com/api/webimage/5e55cf798c00bd182a305cd0-medium.jpg,5e55cf798c00bd182a305cd0
"[Overseas Books] Holy Bible: New International Version the Jesus Bible Gray Linen hardback, Zondervan","[Overseas Books] Holy Bible: New International Version the Jesus Bible Gray Linen hardback, Zondervan",64.0,EUR,64.0,EUR,77.0,0,,,5.0,0.0,,,,,,,,,,,,,4,Livraison standard,17.0,false,,4,,,KR,atcmart,atcmart,67 % avis positifs (6 notes),6,3.8333333333333335,5fe2119d5265268f81dec682,,,https://www.wish.com/c/600c1429e10a279fa95df2e1,https://canary.contestimg.wish.com/api/webimage/600c1429e10a279fa95df2e1-medium.jpg,600c1429e10a279fa95df2e1
2020 Fashion Jesus Necklace Silver Color Chain Bible Verse Necklaces Faith Christian Jewelry Gifts,2020 Fashion Jesus Necklace Silver Color Chain Bible Verse Necklaces Faith Christian Jewelry Gifts,14.0,EUR,14.0,EUR,16,0,,,5.0,0.0,,,,,,,,,,,,hxl026-y,50,Livraison standard,5.0,false,,50,,,CA,11368796 CANADA CORPORATION,11368796canadacorporation,"80 % avis positifs (1,166 notes)",1166,3.9382504288164664,5ffb1f43fa8a25c707537989,,,https://www.wish.com/c/60155c8d2513f500413c00d3,https://canary.contestimg.wish.com/api/webimage/60155c8d2513f500413c00d3-medium.jpg,60155c8d2513f500413c00d3
New Stainless Steel Vintage Cross Pendant Lord's Prayer Bible Necklace for Men Women Chain Hip Hop Jump Decoration,New Stainless Steel Vintage Cross Pendant Lord's Prayer Bible Necklace for Men Women Chain Hip Hop Jump Decoration,5.0,EUR,5.0,EUR,6,0,,,5.0,0.0,,,,,,,,,,,,1pcs-3,50,Livraison standard,2.0,false,,50,,,CN,hongshanqin16,hongshanqin16,83 % avis positifs (201 notes),201,4.039800995024875,5e7d88394c44944b0ac4eb4d,,,https://www.wish.com/c/5fa1249af40dc73b07ef567e,https://canary.contestimg.wish.com/api/webimage/5fa1249af40dc73b07ef567e-medium.jpg,5fa1249af40dc73b07ef567e
"Verset biblique foi croix prière porte-clés porte-clés porte-clés pour hommes femmes, cadeau religieux en acier inoxydable","Bible Verse Faith Cross Prayer Keychain Keyring Keychain for Men Women,Stainless Steel Religious Gift",5.0,EUR,9.0,EUR,5,9,,,5.0,0.0,,,,,,,,,,,,,50,Livraison standard,2.0,false,,50,,,CN,BEAUTY SOPHIE,beautysophie,"95 % avis positifs (1,006 notes)",1006,4.526838966202783,5e64de3e2724a8598adc49a0,,,https://www.wish.com/c/5e9b1b8d26640e4fc05116f8,https://canary.contestimg.wish.com/api/webimage/5e9b1b8d26640e4fc05116f8-medium.jpg,5e9b1b8d26640e4fc05116f8
5 couleurs femmes mode Jésus chemise Christian T-Shirt religieux chemises foi chemises Bible verset col en V Tee,5 Colors Women Fashion Jesus Shirt Christian T-Shirt Religious Shirts Faith Shirts Bible Verse V Neck Tee,5.0,EUR,5.0,EUR,6,10,,,4.276190476190476,105.0,69,13,13,3,7,,,,,,black,xs,18,Livraison standard,2.0,false,,50,,,CN,ZHOUkely,zhoukely,"90 % avis positifs (8,334 notes)",8334,4.223902087832974,5c077d9e80508524a1cb3315,,,https://www.wish.com/c/5ddf349d63c07f54ed4070f1,https://canary.contestimg.wish.com/api/webimage/5ddf349d63c07f54ed4070f1-medium.jpg,5ddf349d63c07f54ed4070f1
Citation biblique lettres de foi chrétienne masque imprimé pour unisexe hommes femmes,Bible Quote Christian Faith Letters Printed Face Mask for Unisex Men Women,1.0,EUR,3.0,EUR,1.04,10,,,4.1875,16.0,7,7,1,0,1,,,,,,black,1,50,Livraison standard,2.1,false,,50,,,CN,cloudya,cloudya,85 % avis positifs (840 notes),840,4.055952380952381,5e5dec4430477e47e6838d5d,,,https://www.wish.com/c/5ecf6d8e2dd5e84ca221fc39,https://canary.contestimg.wish.com/api/webimage/5ecf6d8e2dd5e84ca221fc39-medium.jpg,5ecf6d8e2dd5e84ca221fc39
1 / 2pcs Vintage épais papier bloc-notes bloc-notes en cuir Bible journal intime livre rétro portable,1/2pcs Vintage Thick Paper Notebook Notepad Leather Bible Diary Book Retro Notebook,12.0,EUR,40.0,EUR,14,10,,,4.1,10.0,5,3,1,0,1,,,,,,black,typeb(1pcs),13,Livraison standard,4.0,false,,33,,,CN,zhangkx0503,zhangkx0503,"87 % avis positifs (7,109 notes)",7109,4.103108735405824,535fa81c7360466951527ece,,,https://www.wish.com/c/5e69a6b9b6b8da32780df318,https://canary.contestimg.wish.com/api/webimage/5e69a6b9b6b8da32780df318-medium.jpg,5e69a6b9b6b8da32780df318
Batman,,,,,,,,,,,,,,,,,,,,,,,,,,,,,,,,,,,,,,,,,https://www.wish.com/c/5e542cf79719ed19e8484835,,5e542cf79719ed19e8484835
