title,title_orig,discount_price,discount_price_currency,retail_price,retail_price_currency,discount_price_in_original_currency,nb_cart_orders_approx,nb_units_purchased_approx,uses_ad_boosts,rating,rating_count,rating_five_count,rating_four_count,rating_three_count,rating_two_count,rating_one_count,badges_count,badge_local_product,badge_product_quality,badge_fast_shipping,tags,product_color,product_variation_size_id,product_variation_inventory,shipping_option_name,shipping_option_price,shipping_is_express,countries_shipped_to,inventory_total,has_urgency_banner,urgency_text,origin_country,merchant_title,merchant_name,merchant_info_subtitle,merchant_rating_count,merchant_rating,merchant_id,merchant_has_profile_picture,merchant_profile_picture,product_url,product_picture,product_id
Homgeek,,,,,,,,,,,,,,,,,,,,,,,,,,,,,,,,,,,,,,,,,https://www.wish.com/c/5f843756eb31f9d4a552c9dc,,5f843756eb31f9d4a552c9dc
4 Styles multifonctionnel manuel trancheuse à spirale coupe-légumes râpe à fromage tambour à main râpe rotative,4 Styles Multifunctional Manual Spiral Slicer Vegetable Cutter Cheese Grater Hand Drum Rotary Grater,8.0,USD,28.0,USD,8,10,,,5.0,0.0,,,,,,,,,,,red,typea(vegetablefruitslicer),4,Livraison standard,2.0,false,,50,,,CN,05TTT,05ttt,"79 % avis positifs (1,864 notes)",1864,3.8165236051502145,5d402ebb72b0c92ff9752084,,,https://www.wish.com/c/603b668fdb37250f0132b246,https://canary.contestimg.wish.com/api/webimage/603b668fdb37250f0132b246-medium.jpg,603b668fdb37250f0132b246
Forme de cuillère râpe à fromage citron vert citron Wasabi gingembre inoxydable presse à ail outils de meulage Accessoires,Spoon Shape Lime Lemon Cheese Grater Wasabi Ginger Stainless Garlic Press Grinding Tools Accessoires,3.87,EUR,4.0,EUR,4.6899999999999995,1,,,5.0,0.0,,,,,,,,,,,silver,,50,Livraison standard,1.0,false,,50,true,Quantité limitée !,CN,kkuwioozv,kkuwioozv,"93 % avis positifs (1,174 notes)",1174,4.3560477001703575,5aeab46f8aaf7a13428e28b7,,,https://www.wish.com/c/5b4ed966959b6063f2d437b1,https://canary.contestimg.wish.com/api/webimage/5b4ed966959b6063f2d437b1-medium.jpg,5b4ed966959b6063f2d437b1
Raboteuse à fromage en acier inoxydable Râpe à fromage à manivelle Mini raboteuse en plastique Raboteuse polyvalente,Stainless Steel Cheese Planer Hand-cranked Cheese Grater Plastic Mini Cheese Planer Multi-purpose Planer,8.0,USD,8.0,USD,8,10,,,3.6875,16.0,9,1,1,2,3,,,,,,,,50,Livraison standard,2.0,false,,50,,,CN,shinhwa,shinhwa,"93 % avis positifs (52,744 notes)",52744,4.365349613226149,569d98310e708d0db3adcb0d,,,https://www.wish.com/c/5e193534fcc85c2299a0a7d4,https://canary.contestimg.wish.com/api/webimage/5e193534fcc85c2299a0a7d4-medium.jpg,5e193534fcc85c2299a0a7d4
Latest 3 in 1 Manual Vegetable Cutter Slicer Multifunctional Round Mandoline Slicer Potato Cheese Slicer Shredder,Latest 3 in 1 Manual Vegetable Cutter Slicer Multifunctional Round Mandoline Slicer Potato Cheese Slicer Shredder,7.0,EUR,7.0,EUR,8,10,,,2.0,1.0,0,0,0,1,0,,,,,,green,onereplacementcore,1,Livraison standard,2.0,false,,31,,,US,regidcvevly,regidcvevly,61 % avis positifs (33 notes),33,2.9696969696969697,5e67365a5890243880144394,,,https://www.wish.com/c/6041bc52b2bf96762b92ad4c,https://canary.contestimg.wish.com/api/webimage/6041bc52b2bf96762b92ad4c-medium.jpg,6041bc52b2bf96762b92ad4c
Portable 3 In1 coupe-légumes en acier inoxydable accessoires de cuisine multifonctionnel rond pomme de terre fromage outil de cuisine,Portable 3 In1 Stainless Steel Vegetable Cutter Kitchen Accessories Multifunctional Round Potato Cheese Kitchen Tool ,19.0,EUR,19.0,EUR,22,4,,,4.0,1.0,0,1,0,0,0,,,,,,blue,,50,Livraison standard,6.0,false,,50,,,CN,Emerging hardware store,emerginghardwarestore,"91 % avis positifs (68,160 notes)",68160,4.313600352112676,58aedf6b4d038c69bdc02db9,,,https://www.wish.com/c/5fe19e850b3e5062d5c75e84,https://canary.contestimg.wish.com/api/webimage/5fe19e850b3e5062d5c75e84-medium.jpg,5fe19e850b3e5062d5c75e84
Coupe-fromage en acier coupe-fromage en fil de coupe coupe-beurre d'avion à fromage antiadhésif,Steel Cheese Slicer Wire Cheese Cutter Non Stick Cheese Plane Butter Cutter,12.0,EUR,12.0,EUR,14,0,,,5.0,0.0,,,,,,,,,,,,tool,1,Livraison standard,4.0,false,,1,,,CN,tianjianyingfeng,tianjianyingfeng,"91 % avis positifs (12,993 notes)",12993,4.2699915339028705,5ad31267ea8764621df718c0,,,https://www.wish.com/c/5f7be34b51bb690bb4d08cb8,https://canary.contestimg.wish.com/api/webimage/5f7be34b51bb690bb4d08cb8-medium.jpg,5f7be34b51bb690bb4d08cb8
Kitchen Truffle Cheese Adjustable Blade Chocolate Peeler Tool Practical,Kitchen Truffle Cheese Adjustable Blade Chocolate Peeler Tool Practical,7.0,EUR,7.0,EUR,8,0,,,5.0,0.0,,,,,,,,,,,,,50,Livraison standard,3.0,false,,50,true,Quantité limitée !,CN,Odereer,odereer,79 % avis positifs (14 notes),14,3.857142857142857,5f605e863f03422b4b52f865,,,https://www.wish.com/c/5fd0bc4088c5868947c94aa1,https://canary.contestimg.wish.com/api/webimage/5fd0bc4088c5868947c94aa1-medium.jpg,5fd0bc4088c5868947c94aa1
Mac And Cheese Mug Cheese Lover Gift Mac And Cheese Fan Cheese Coffee Mug Cheese Mug Cheese Lover Mug Mac And Cheese Gift Mac N Cheese,Mac And Cheese Mug Cheese Lover Gift Mac And Cheese Fan Cheese Coffee Mug Cheese Mug Cheese Lover Mug Mac And Cheese Gift Mac N Cheese,20.0,EUR,20.0,EUR,24,0,,,5.0,0.0,,,,,,,,,,,white,11oz,50,Livraison Express,6.0,true,,50,,,VN,PaulStore97,paulstore97,63 % avis positifs (8 notes),8,3.5,5f97dad3f78021299c840c3f,,,https://www.wish.com/c/5fc3148d040bdea100980859,https://canary.contestimg.wish.com/api/webimage/5fc3148d040bdea100980859-medium.jpg,5fc3148d040bdea100980859
Coupe-légumes manuel trancheuse multifonctionnelle ronde mandoline trancheuse pommes de terre fromage Gadgets de cuisine FR,Manual Vegetable Cutter Slicer Multifunctional Round Mandoline Slicer Potato Cheese Kitchen Gadgets FR,25.0,EUR,25.0,EUR,30,0,,,5.0,0.0,,,,,,,,,,,,old(onlyvegetableslicer),50,Livraison Express,8.0,true,,50,,,CN,Zebulonmei,zebulonmei,"91 % avis positifs (3,298 notes)",3298,4.341115827774408,5a7ab18d417cee2ca2c1b81b,,,https://www.wish.com/c/5fdad26c37f2ec61ca38c77f,https://canary.contestimg.wish.com/api/webimage/5fdad26c37f2ec61ca38c77f-medium.jpg,5fdad26c37f2ec61ca38c77f
"TPC Cheese Knife 350mm, Mixed Color, 1 pc. (please check the description)","TPC Cheese Knife 350mm, Mixed Color, 1 pc. (please check the description)",168.0,EUR,168.0,EUR,203.0,0,,,5.0,0.0,,,,,,,,,,,,,3,Livraison standard,12.0,false,,3,,,KR,K-Mild,kmild,63 % avis positifs (8 notes),8,3.0,5ff5ca506fb1f4d5c07d6fd6,,,https://www.wish.com/c/60128f20dd40b461ffa3712d,https://canary.contestimg.wish.com/api/webimage/60128f20dd40b461ffa3712d-medium.jpg,60128f20dd40b461ffa3712d
Broyeur de cuisine multifonction Broyeur de légumes rapide Râpe à fil de pomme de terre Râpe Trancheuse Hachoir Râpe à fromage avec 5 lames en acier inoxydable,Multifunction Kitchen Shredder Quick Vegetable Shredder Potato Wire Grater Grater Slicer Food Chopper Cheese Grater with 5 Stainless Steel Blade,15.0,EUR,15.0,EUR,18,4,,,5.0,0.0,,,,,,,,,,,,1set,46,Livraison standard,5.0,false,,47,,,CN,LLLmy18,lllmy18,"80 % avis positifs (2,222 notes)",2222,3.864986498649865,5b90d2335ac1f32fc628cc3d,,,https://www.wish.com/c/5d12ed51e284225d7c14192c,https://canary.contestimg.wish.com/api/webimage/5d12ed51e284225d7c14192c-medium.jpg,5d12ed51e284225d7c14192c
Trancheur d'avion à fromage en acier inoxydable coupe-râpe à beurre à fromage en argent pour outils de cuisine faciles,Stainless Steel Cheese Plane Slicer Silver Cheese Butter Grater Cutter For Easy Kitchen Tools,4.76,USD,88.0,USD,4.76,10,,,4.10655737704918,122.0,76,14,14,5,13,,,,,,multicolor,23.5cmx7.5cm,50,Livraison standard,1.0,false,,50,true,Quantité limitée !,CN,SH Online Shopping,shonlineshopping,"94 % avis positifs (59,683 notes)",59683,4.440125328820602,573af4bf79a6bd592729a0f8,,,https://www.wish.com/c/57a1ed581e4e9b22e9c08479,https://canary.contestimg.wish.com/api/webimage/57a1ed581e4e9b22e9c08479-medium.jpg,57a1ed581e4e9b22e9c08479
Outil multifonctionnel de maison et de cuisine de découpeuse de pain / fromage en acier inoxydable,Stainless Multi-functional Bread/Cheese Slicer Cutting Machine Home & Kitchen Tool,13.0,EUR,13.0,EUR,15,4,,,5.0,1.0,1,0,0,0,0,,,,,,silver,,50,Livraison standard,4.0,false,,50,true,Quantité limitée !,CN,Time_In_Time,time_in_time,"89 % avis positifs (18,246 notes)",18246,4.201030362819248,5a39ff718cf0ed2c83f7b9e9,,,https://www.wish.com/c/5a5f16dfd20e9337c94ecf12,https://canary.contestimg.wish.com/api/webimage/5a5f16dfd20e9337c94ecf12-medium.jpg,5a5f16dfd20e9337c94ecf12
Coupe-légumes Accessoires de cuisine Trancheuse à mandoline Coupe-fruits Éplucheuse de pommes de terre Râpe à carotte Râpe à légumes,Vegetable cutter Kitchen accessories Mandoline Slicer Fruit Cutter Potato Peeler Carrot Cheese Grater vegetable slicer,19.0,EUR,19.0,EUR,23,6,,,4.0,1.0,0,1,0,0,0,,,,,,grey&green,,50,Livraison standard,6.0,false,,50,,,CN,jiaqi*LIjiejie0105,jiaqilijiejie0105,"91 % avis positifs (1,054 notes)",1054,4.314990512333966,5e4506577861e05a638e91b1,,,https://www.wish.com/c/5f3655fe7e20ee003c219045,https://canary.contestimg.wish.com/api/webimage/5f3655fe7e20ee003c219045-medium.jpg,5f3655fe7e20ee003c219045
 Nouvelle coupe de viande en conserve trancheuse de fromage à pâte molle oeuf bouilli fruits nourriture outil de cuisine, New Cutting Canned Meat Soft Cheese Slicer Boiled Egg Fruit Food Kitchen Tool,10.0,EUR,10.0,EUR,12,10,,,5.0,2.0,2,0,0,0,0,,,,,,yellow,,50,Livraison standard,3.0,false,,50,,,CN,tanhuimin,tanhuimin,"91 % avis positifs (2,966 notes)",2966,4.313216453135536,5939618097555e516b20c8e7,,,https://www.wish.com/c/5de2396f1e98ab985435a617,https://canary.contestimg.wish.com/api/webimage/5de2396f1e98ab985435a617-medium.jpg,5de2396f1e98ab985435a617
HB Fromage Trancheuse Beurre Planche À Découper Fil En Acier Inoxydable Faisant Lame À Dessert Durable Cuisine Cuisson Servant Des Outils De Cuisson,HB Cheese Slicer Butter Cutting Board Stainless Steel Wire Making Dessert Blade Durable Kitchen Cooking Serving Baking Tools,14.0,EUR,14.0,EUR,16,10,,,4.8,5.0,4,1,0,0,0,,,,,,silver,,50,Livraison Express,10.0,true,,50,,,CN,hhehhwwwm,hhehhwwwm,"88 % avis positifs (18,234 notes)",18234,4.1607436656795,5acf025667d25c3ae4907111,,,https://www.wish.com/c/5ae95cc3a8160d32da6ff337,https://canary.contestimg.wish.com/api/webimage/5ae95cc3a8160d32da6ff337-medium.jpg,5ae95cc3a8160d32da6ff337
3 in1 multifonctionnel manuel coupe-légumes en spirale râpe à fromage tambour à main râpe rotative coupe-légumes FR,3 in1 Multifunctional Manual Vegetable Spiral Slicer Cheese Grater Hand Drum Rotary Grater Vegetable Cutter FR,24.0,EUR,24.0,EUR,28,0,,,5.0,0.0,,,,,,,,,,,,old,22,Livraison Express,8.0,true,,44,true,Quantité limitée !,CN,Veasy,veasy,"90 % avis positifs (4,176 notes)",4176,4.259578544061303,58d4e1b77586f71608dc5791,,,https://www.wish.com/c/5f1a75de12fb9902c5db57dc,https://canary.contestimg.wish.com/api/webimage/5f1a75de12fb9902c5db57dc-medium.jpg,5f1a75de12fb9902c5db57dc
Plateau de plateau de fromage en bambou et plateau de service avec 4 couverts en acier inoxydable,Bamboo Cheese Board Platter & Serving Tray Including 4 Stainless Steel Knife Cutlery Kit,71.0,EUR,71.0,EUR,85.0,0,,,5.0,0.0,,,,,,,,,,,,,10,Livraison Express,12.0,true,,10,true,Quantité limitée !,CN,chenzhoucheng18899,chenzhoucheng18899,86 % avis positifs (870 notes),870,4.1080459770114945,5aacfcbe2fbbdc4ac0a6d64e,,,https://www.wish.com/c/5fe860843d2a4c184e31bae2,https://canary.contestimg.wish.com/api/webimage/5fe860843d2a4c184e31bae2-medium.jpg,5fe860843d2a4c184e31bae2
Râpe au citron et au fromage roi Delysia,Delysia King Cheese Lemon Grater,4.0,EUR,4.0,EUR,4,10,,,4.411764705882353,17.0,11,4,1,0,1,,,,,,,1pcs,50,Livraison standard,1.0,false,,50,true,Quantité limitée !,CN,We are all aware of your health at all times,weareallawareofyourhealthatalltimes,"94 % avis positifs (20,261 notes)",20261,4.43783623710577,584e5e975b87564eb997d8ef,,,https://www.wish.com/c/5e80601223dc2b50804d975e,https://canary.contestimg.wish.com/api/webimage/5e80601223dc2b50804d975e-medium.jpg,5e80601223dc2b50804d975e
10Kg de chlorure de calcium CaCl2 FCC 77% de fromage soluble de catégorie comestible faisant des flocons de bière,10Kg Calcium Chloride CaCl2 FCC 77% Food Grade Soluble Cheese Making Beer Flakes,162.0,EUR,162.0,EUR,196.0,0,,,5.0,0.0,,,,,,,,,,,,,7,Livraison standard,12.0,false,,7,,,AU,ozdingo,ozdingo,93 % avis positifs (69 notes),69,4.27536231884058,59ed79b3fd9db81eaf6914da,,,https://www.wish.com/c/5fd2fad9d0ece89305e2798d,https://canary.contestimg.wish.com/api/webimage/5fd2fad9d0ece89305e2798d-medium.jpg,5fd2fad9d0ece89305e2798d
couverture à fromage I Love Cheese 28 x 14 cm acrylique / bambou naturel,cheese cover I Love Cheese 28 x 14 cm acrylic/bamboo natural,47.0,EUR,47.0,EUR,56.97,1,,,5.0,0.0,,,,,,,,,,,,,4,Livraison Express,8.96,true,,4,,,NL,Erksononline,erksononline,"90 % avis positifs (1,444 notes)",1444,4.35387811634349,5f8571038ac61df76b7b8380,,,https://www.wish.com/c/5fca31a45833f41e4a223a8a,https://canary.contestimg.wish.com/api/webimage/5fca31a45833f41e4a223a8a-medium.jpg,5fca31a45833f41e4a223a8a
Manual Rotary Vegetable Grater Slicer With 3 Rotating Stainless Steel Blades Vegetable Cutter Grinder For Cheese And Vegetables Gift Kitchen Accessories FR,Manual Rotary Vegetable Grater Slicer With 3 Rotating Stainless Steel Blades Vegetable Cutter Grinder For Cheese And Vegetables Gift Kitchen Accessories FR,23.0,EUR,23.0,EUR,27,0,,,5.0,0.0,,,,,,,,,,,red,typea,45,Livraison Express,7.0,true,,50,true,Quantité limitée !,CN,msfjw,msfjw,,0,5.0,5ff80b886ac4335697adc89a,,,https://www.wish.com/c/6083891882f69f42d856d555,https://canary.contestimg.wish.com/api/webimage/6083891882f69f42d856d555-medium.jpg,6083891882f69f42d856d555
4 pièces couteau Bard ensemble manche en bois couteau à fromage trancheuse Kit cuisine cuisson outil coupeur accessoires utiles,4 PCS Knife Bard Set Wood Handle Cheese Knife Slicer Kit Kitchen Cooking Tool Cutter Useful Accessories,7.0,EUR,7.0,EUR,8,10,,,5.0,2.0,2,0,0,0,0,,,,,,,4pcs,50,Livraison Express,7.0,true,,50,,,CN,full_house,lalang,"90 % avis positifs (571,636 notes)",571636,4.2384297000188935,53b7b1dd46188e74db5f7e80,,,https://www.wish.com/c/5a2fa0e02495d4591ed5fe84,https://canary.contestimg.wish.com/api/webimage/5a2fa0e02495d4591ed5fe84-medium.jpg,5a2fa0e02495d4591ed5fe84
Nouveau inoxydable citron citron légumes zester râpe éplucheur trancheuse cuisine outil,New Stainless Lemon Cheese Vegetable Zester Grater Peeler Slicer Kitchen Tool,4.01,EUR,5.0,EUR,4.86,1000,,,3.8355555555555556,225.0,114,43,20,13,35,,,,,,,,50,Livraison standard,1.0,false,,50,,,CN,meyouton,meyouton,"91 % avis positifs (111,869 notes)",111869,4.283751530808356,56d50e4ae1e6a016021e9771,,,https://www.wish.com/c/5b3dba0bff99186f2a7ea99a,https://canary.contestimg.wish.com/api/webimage/5b3dba0bff99186f2a7ea99a-medium.jpg,5b3dba0bff99186f2a7ea99a
Moule à tofu en plastique bricolage Sup-inn Home Moule à tofu Sup-innde Tofu au caillé de soja,Sup-inn DIY Plastic Tofu Press Mould HomeSup-innde Tofu Mold Soybean Curd Tofu Sup-innking Mold with Cheese Cloth Kitchen Cooking Tool Set,5.0,EUR,5.0,EUR,6,10,,,4.0,1.0,0,1,0,0,0,,,,,,,,50,Livraison Express,7.0,true,,50,true,Quantité limitée !,CN,Sup_inn,viva_la_vida,"92 % avis positifs (28,517 notes)",28517,4.352807097520777,5a3a157e34e7201b2ca29f14,,,https://www.wish.com/c/5ad160d4918dae128e48421d,https://canary.contestimg.wish.com/api/webimage/5ad160d4918dae128e48421d-medium.jpg,5ad160d4918dae128e48421d
outil de chen Tofu Maker moule de presse avec tissu de fromage moule de pressage bricolage,chen Tool Tofu Maker Press Mold With Cheese Cloth DIY Pressing Mould,6.0,EUR,7.0,EUR,7,10,,,5.0,3.0,3,0,0,0,0,,,,,,,,50,Livraison standard,2.0,false,,50,,,CN,fengjian67,fengjian67,"89 % avis positifs (4,023 notes)",4023,4.234153616703952,5acdb734abef957a4c246d7f,,,https://www.wish.com/c/5adb0ecba69e664415a71079,https://canary.contestimg.wish.com/api/webimage/5adb0ecba69e664415a71079-medium.jpg,5adb0ecba69e664415a71079
Fromage de cuisine fine classique d'acier inoxydable / Zesteur de légumes / Peele de citron de râpe,Stainless Steel Classic Fine Kitchen Cheese/Vegetable Zester/Grater Lemon Peele,7.0,EUR,17.0,EUR,8,10,,,4.125,8.0,4,3,0,0,1,,,,,,,,14,Livraison standard,2.0,false,,14,,,CN,happy clan,merryhappy,"96 % avis positifs (17,459 notes)",17459,4.5429291482902805,5642174a906c9c12737e6c80,,,https://www.wish.com/c/5af3d0f02ca6e85c78a95e74,https://canary.contestimg.wish.com/api/webimage/5af3d0f02ca6e85c78a95e74-medium.jpg,5af3d0f02ca6e85c78a95e74
Bamboo Cheese Cutting Board With Knives Fork Shovel Sets Cutlery Kit Kitchen ZZ,Bamboo Cheese Cutting Board With Knives Fork Shovel Sets Cutlery Kit Kitchen ZZ,62.0,EUR,62.0,EUR,75.0,0,,,5.0,0.0,,,,,,,,,,,,,10,Livraison Express,12.0,true,,10,,,CN,NINEOCLOCK,nineoclock,"93 % avis positifs (10,203 notes)",10203,4.400176418700382,58e74a0affbc010f9312d897,,,https://www.wish.com/c/600da70ba4d95e061982b6db,https://canary.contestimg.wish.com/api/webimage/600da70ba4d95e061982b6db-medium.jpg,600da70ba4d95e061982b6db
6pcs bâtons de barbecue fourchettes en acier inoxydable fourchettes à fondue au fromage fourchette à fruits fourchette pour la cuisson cuisson rôtissage (couleur mixte),6pcs Barbecue Sticks Stainless Steel Forks Cheese Fondue Forks Fork Fruit Fork for Cooking Baking Roasting (Mixed Color),10.0,EUR,10.0,EUR,12,10,,,4.0,1.0,0,1,0,0,0,,,,,,assorted,14x1.5x1.5cm,50,Livraison standard,3.0,false,,50,,,CN,LishixianStore,lishixianstore,"89 % avis positifs (1,827 notes)",1827,4.240284619594965,59255e66223fd34a7343b64e,,,https://www.wish.com/c/5f289fc786e6af004414d41a,https://canary.contestimg.wish.com/api/webimage/5f289fc786e6af004414d41a-medium.jpg,5f289fc786e6af004414d41a
Cheese Cutter Cheese Planing Tool Cheese Grater Elegant for Kitchen Cooking,Cheese Cutter Cheese Planing Tool Cheese Grater Elegant for Kitchen Cooking,12.0,EUR,12.0,EUR,14,0,,,5.0,0.0,,,,,,,,,,,,,50,Livraison Express,8.0,true,,50,true,Quantité limitée !,CN,joeyyy,joeyyy,"93 % avis positifs (1,711 notes)",1711,4.442431326709527,5b076eb6c721a9630e172601,,,https://www.wish.com/c/5fc4b84bffd8f7004f802725,https://canary.contestimg.wish.com/api/webimage/5fc4b84bffd8f7004f802725-medium.jpg,5fc4b84bffd8f7004f802725
La Cuisson Camembert Baker w/ Cheese Spreader,La Cuisson Camembert Baker w/ Cheese Spreader,31.0,EUR,31.0,EUR,37,0,,,5.0,0.0,,,,,,,,,,,blue,,6,Livraison standard,10.0,false,,9,,,AU,LatestBuy,latestbuy,93 % avis positifs (777 notes),777,4.543114543114543,5e6b5cb88d68d28867a06b9d,,,https://www.wish.com/c/5f65f7fae53065004cc615f4,https://canary.contestimg.wish.com/api/webimage/5f65f7fae53065004cc615f4-medium.jpg,5f65f7fae53065004cc615f4
Coupe-légumes Accessoires de cuisine Mandoline Slicer Coupe-fruits Éplucheur de pommes de terre Carotte Râpe à fromage Trancheur de légumes Chopper Tool,Vegetable Cutter Kitchen Accessories Mandoline Slicer Fruit Cutter Potato Peeler Carrot Cheese Grater Vegetable Slicer Chopper Tool,21.0,EUR,21.0,EUR,25,10,,,4.909090909090909,22.0,20,2,0,0,0,,,,,,,,50,Livraison standard,6.0,false,,50,true,Quantité limitée !,CN,wanliming,wanliming,90 % avis positifs (227 notes),227,4.348017621145375,598db78450df614413ddc7ee,,,https://www.wish.com/c/5d63d653a9c84602ab428752,https://canary.contestimg.wish.com/api/webimage/5d63d653a9c84602ab428752-medium.jpg,5d63d653a9c84602ab428752
Zyliss,,,,,,,,,,,,,,,,,,,,,,,,,,,,,,,,,,,,,,,,,https://www.wish.com/c/5eaaefe09719ed25a17f44c3,,5eaaefe09719ed25a17f44c3
Meterk,,,,,,,,,,,,,,,,,,,,,,,,,,,,,,,,,,,,,,,,,https://www.wish.com/c/5f0ee1fb90b8a69a5278b3a3,,5f0ee1fb90b8a69a5278b3a3
Boîte en céramique scellée au beurre nordique avec couvercle en bois de tableau blanc de beurre et plateau de récipient de beurre de fromage de couteau,Nordic Butter Sealed Ceramic Box with Butter Whiteboard Wood Cover and Knife Cheese Butter Container Tray,19.0,EUR,35.0,EUR,22,3,,,1.5,2.0,0,0,0,1,1,,,,,,,,50,Livraison standard,6.0,false,,50,true,Quantité limitée !,CN,linjie520,linjie520,93 % avis positifs (929 notes),929,4.331539289558665,59ee00aefd9db819006914e4,,,https://www.wish.com/c/5e6c98f0b73abf41c51b2def,https://canary.contestimg.wish.com/api/webimage/5e6c98f0b73abf41c51b2def-medium.jpg,5e6c98f0b73abf41c51b2def
Multifonctionnel Manuel Légumes Spirale Trancheuse Râpe À Fromage Tambour À Main Rotatif Râpe Coupe-Légumes,Multifunctional Manual Vegetable Spiral Slicer Cheese Grater Hand Drum Rotary Grater Vegetable Cutter,26.0,USD,26.0,USD,26,10,,,4.042253521126761,71.0,40,13,7,3,8,,,,,,green,,50,Livraison standard,7.0,false,,50,,,CN,quotein,quotein,"93 % avis positifs (26,354 notes)",26354,4.376109888441983,59f195535d6f34287c2ec1a3,,,https://www.wish.com/c/5d41002054e8b4600d2023ff,https://canary.contestimg.wish.com/api/webimage/5d41002054e8b4600d2023ff-medium.jpg,5d41002054e8b4600d2023ff
Couteau à beurre de fromage en acier inoxydable applicateur de confiture de dessert couteau à crème outil de dessert de pain grillé outil de petit déjeuner,Stainless Steel Cheese Butter Knife Dessert Jam Applicator Cream Knife Toast Dessert Tool Breakfast Tool,5.0,EUR,7.0,EUR,6,10,,,5.0,0.0,,,,,,,,,,,silver,,50,Livraison standard,2.0,false,,50,true,Quantité limitée !,US,mgciotqi,mgciotqi,90 % avis positifs (60 notes),60,4.216666666666667,5e6748fcbd473e6c37b97f58,,,https://www.wish.com/c/5f49fc372869800c18653de5,https://canary.contestimg.wish.com/api/webimage/5f49fc372869800c18653de5-medium.jpg,5f49fc372869800c18653de5
Tomshine,,,,,,,,,,,,,,,,,,,,,,,,,,,,,,,,,,,,,,,,,https://www.wish.com/c/5f843759eb31f9d4a552c9e3,,5f843759eb31f9d4a552c9e3
Hand Cranked Cheese Planing Tool Cheese Grater Dishwasher Safe For Home Kitchen,Hand Cranked Cheese Planing Tool Cheese Grater Dishwasher Safe For Home Kitchen,15.0,EUR,15.0,EUR,17,0,,,5.0,0.0,,,,,,,,,,,,,10,Livraison Express,5.0,true,,10,true,Quantité limitée !,CN,xunhaishop,xunhaishop,"93 % avis positifs (14,275 notes)",14275,4.388791593695271,58da44bcb7bb136eea0ba553,,,https://www.wish.com/c/6017fcb37496a0c0a7ae2bff,https://canary.contestimg.wish.com/api/webimage/6017fcb37496a0c0a7ae2bff-medium.jpg,6017fcb37496a0c0a7ae2bff
Coupe-légumes manuel trancheuse multifonctionnelle ronde mandoline trancheuse pommes de terre fromage Gadgets de cuisine FR,Manual Vegetable Cutter Slicer Multifunctional Round Mandoline Slicer Potato Cheese Kitchen Gadgets FR,26.0,EUR,26.0,EUR,31,0,,,5.0,0.0,,,,,,,,,,,,1edge,21,Livraison Express,9.0,true,,50,true,Quantité limitée !,CN,chgooseberrly,chgooseberrly,83 % avis positifs (628 notes),628,4.038216560509555,5e60be0ea31ee924a1fe14bd,,,https://www.wish.com/c/5f0d7797313d48425bd60d39,https://canary.contestimg.wish.com/api/webimage/5f0d7797313d48425bd60d39-medium.jpg,5f0d7797313d48425bd60d39
"Ottogi Kok Kok Kok Cheese Stir-fried Cup Noodles 95 g, 12","Ottogi Kok Kok Kok Cheese Stir-fried Cup Noodles 95 g, 12",44.0,EUR,44.0,EUR,53.0,0,,,5.0,0.0,,,,,,,,,,,,,10,Livraison standard,12.0,false,,10,,,KR,HONGVELYSTORY,hongvelystory,100 % avis positifs (1 notes),1,5.0,5fe861284b77d63a9c810115,,,https://www.wish.com/c/6055baaa61d73d5b06097e39,https://canary.contestimg.wish.com/api/webimage/6055baaa61d73d5b06097e39-medium.jpg,6055baaa61d73d5b06097e39
2019 nouveau multifonctionnel manuel coupe-légumes en spirale râpe à fromage tambour à main râpe rotative coupe-légumes,2019 new Multifunctional Manual Vegetable Spiral Slicer Cheese Grater Hand Drum Rotary Grater Vegetable Cutter,15.0,EUR,165.0,EUR,18,10,,,4.0,7.0,4,1,1,0,1,,,,,,green,1.0,1,Livraison standard,5.0,false,,50,,,CN,axdxv65,axdxv65,79 % avis positifs (451 notes),451,3.8181818181818183,5d5b455933f0b4693a3752eb,,,https://www.wish.com/c/5d73116cffc84a20c0ccf41c,https://canary.contestimg.wish.com/api/webimage/5d73116cffc84a20c0ccf41c-medium.jpg,5d73116cffc84a20c0ccf41c
The New 3 in 1 Manual Vegetable Cutter Slicer Multifunctional Round Mandoline Slicer Potato Cheese Slicer Shredder,The New 3 in 1 Manual Vegetable Cutter Slicer Multifunctional Round Mandoline Slicer Potato Cheese Slicer Shredder,6.0,EUR,6.0,EUR,7,5,,,5.0,0.0,,,,,,,,,,,green,onereplacementcore,2,Livraison standard,2.0,false,,32,,,US,regidcvevly,regidcvevly,61 % avis positifs (33 notes),33,2.9696969696969697,5e67365a5890243880144394,,,https://www.wish.com/c/606d42fde8ae0512024d2a19,https://canary.contestimg.wish.com/api/webimage/606d42fde8ae0512024d2a19-medium.jpg,606d42fde8ae0512024d2a19
Fleurs de cerisier Fleurs de cerisier Fond d'anniversaire Photographie d'anniversaire Fond d'écran Photo Fond d'arrière-plan Décoration murale de fête Fond d'écran W-314,Cherry blossoms Castle Birthday Photography Backdrops Photo Background Party Wall Decoration Backdrop W-314,14.0,EUR,14.0,EUR,16,1000,,,4.673267326732673,505.0,401,66,25,3,10,,,,,,,1x1.5m,50,Livraison standard,4.0,false,,50,,,CN,Angelina Backdrop,angelinabackdrop,"94 % avis positifs (1,516 notes)",1516,4.547493403693931,56c9476d1e15ff0d36e175a8,,,https://www.wish.com/c/5a7c0d7f0b432133db98d677,https://canary.contestimg.wish.com/api/webimage/5a7c0d7f0b432133db98d677-medium.jpg,5a7c0d7f0b432133db98d677
Roychen yogurt cheese maker 2 set fermentation container 1 pack set,Roychen yogurt cheese maker 2 set fermentation container 1 pack set,62.0,EUR,62.0,EUR,74.0,0,,,5.0,0.0,,,,,,,,,,,,,6,Livraison standard,12.0,false,,6,,,CA,othep,othep,60 % avis positifs (5 notes),5,3.2,5ff04c48c9720a6520e73166,,,https://www.wish.com/c/6014285f827f310052066e52,https://canary.contestimg.wish.com/api/webimage/6014285f827f310052066e52-medium.jpg,6014285f827f310052066e52
