title,title_orig,discount_price,discount_price_currency,retail_price,retail_price_currency,discount_price_in_original_currency,nb_cart_orders_approx,nb_units_purchased_approx,uses_ad_boosts,rating,rating_count,rating_five_count,rating_four_count,rating_three_count,rating_two_count,rating_one_count,badges_count,badge_local_product,badge_product_quality,badge_fast_shipping,tags,product_color,product_variation_size_id,product_variation_inventory,shipping_option_name,shipping_option_price,shipping_is_express,countries_shipped_to,inventory_total,has_urgency_banner,urgency_text,origin_country,merchant_title,merchant_name,merchant_info_subtitle,merchant_rating_count,merchant_rating,merchant_id,merchant_has_profile_picture,merchant_profile_picture,product_url,product_picture,product_id
Table de coupe de fromage de fromage de planche à découper de beurre de trancheuse de fromage d'acier inoxydable d'argent,Silver Stainless Steel Cheese Slicer Butter Cutting Board Cheese Cheese Cutting Table,15.0,EUR,15.0,EUR,18,2,,,5.0,0.0,,,,,,,,,,,silver,,50,Livraison standard,5.0,false,,50,true,Quantité limitée !,US,CouquebixiongasU,couquebixiongasu,93 % avis positifs (90 notes),90,4.377777777777778,5e6233c9e39d06453f8712e8,,,https://www.wish.com/c/5e8eedfb952ba35fe12a6207,https://canary.contestimg.wish.com/api/webimage/5e8eedfb952ba35fe12a6207-medium.jpg,5e8eedfb952ba35fe12a6207
"Cheese Cutter, Practical High Hardness Stainless Steel Long Handle Design Cheese Planing Tool, for Restaurant Home Kitchen","Cheese Cutter, Practical High Hardness Stainless Steel Long Handle Design Cheese Planing Tool, for Restaurant Home Kitchen",7.0,EUR,7.0,EUR,8,0,,,5.0,0.0,,,,,,,,,,,,,50,Livraison Express,8.0,true,,50,,,CN,zz001store,zz001store,"93 % avis positifs (37,242 notes)",37242,4.360829171365663,57e8e752ecb058131b1f5cab,,,https://www.wish.com/c/6004ad5c815dc747d73bf63e,https://canary.contestimg.wish.com/api/webimage/6004ad5c815dc747d73bf63e-medium.jpg,6004ad5c815dc747d73bf63e
【2021 NOUVEAU】 Trancheuse à légumes manuelle Mandoline rotative Coupe-fruits à légumes Trancheuse Shredder Hachoir à fromage Râpe robot culinaire Gadget de cuisine,【2021 NEW】Manual Vegetables Slicer Rotary Mandoline Vegetable Fruit Cutter Slicer Shredder Cheese Chopper Grater Food Processor Kitchen Gadget,9.0,USD,14.0,USD,9,10,,,2.25,4.0,1,0,0,1,2,,,,,,white,typea(mini),16,Livraison standard,3.0,false,,16,true,Quantité limitée !,CN,Lan mao zi shi pin,lanmaozishipin,"(10,613 notes)",10613,4.149627814943937,5b4c0c8e43486b2c5c1bbd15,,,https://www.wish.com/c/5fe45e5f308e7c1b5ad96056,https://canary.contestimg.wish.com/api/webimage/5fe45e5f308e7c1b5ad96056-medium.jpg,5fe45e5f308e7c1b5ad96056
"2 kinds of Daichi seasoning (cheese flavor curry flavor) 2kg-Fried Chicken French Fries Seasoning Powder Powder, Cheese Seasoning 2kg","2 kinds of Daichi seasoning (cheese flavor curry flavor) 2kg-Fried Chicken French Fries Seasoning Powder Powder, Cheese Seasoning 2kg",121.0,EUR,121.0,EUR,146.0,0,,,5.0,0.0,,,,,,,,,,,,,50,Livraison standard,12.0,false,,50,,,KR,Stay_Gorgeous Korea,stay_gorgeouskorea,100 % avis positifs (5 notes),5,4.8,5fd76ab639ab348c49576bf2,,,https://www.wish.com/c/600458a2815dc72fba3c0da1,https://canary.contestimg.wish.com/api/webimage/600458a2815dc72fba3c0da1-medium.jpg,600458a2815dc72fba3c0da1
Multi‑functional Stainless Steel Cooking Shovel Cheese Spatula Cutter Kitchen Tool Supplies Gold,Multi‑functional Stainless Steel Cooking Shovel Cheese Spatula Cutter Kitchen Tool Supplies Gold,8.0,EUR,8.0,EUR,9,0,,,5.0,0.0,,,,,,,,,,,,,50,Livraison standard,3.0,false,,50,true,Quantité limitée !,CN,GoldenStarry,goldenstarry,"94 % avis positifs (9,484 notes)",9484,4.444010965837199,58ddfde26d7b2974f0a28264,,,https://www.wish.com/c/5fc44f04ca89b25e2e4e4367,https://canary.contestimg.wish.com/api/webimage/5fc44f04ca89b25e2e4e4367-medium.jpg,5fc44f04ca89b25e2e4e4367
Trancheuse à fromage Double fil Fromages Cutter Tranches épaisses et minces pour la cuisine Poignée en plastique blanc,Cheese Slicer Double Wire Cheeses Cutter Thick & Thin Slices For Kitchen White Plastic Handle,3.84,EUR,14.0,EUR,4.66,6,,,5.0,0.0,,,,,,,,,,,white,,50,Livraison standard,1.0,false,,50,,,CN,shenzhenmanmanrimaokejiyouxiangongsi,深圳蔓蔓日茂科技有限公司,"91 % avis positifs (16,227 notes)",16227,4.3267393849756575,55c2b0133a698c5d446c1f9a,,,https://www.wish.com/c/5e6c76ce8f16752ed946b75e,https://canary.contestimg.wish.com/api/webimage/5e6c76ce8f16752ed946b75e-medium.jpg,5e6c76ce8f16752ed946b75e
"18 porte-clés mignon fromage animaux avec beau son, porte-clés led kawaii avec lampe de poche, cadeau pour enfants, cadeaux de Saint Valentin, sac pandent","18Styles Cute Cheese Animal Keychain with Lovely Sound,kawaii led keyring with Flashlight ,Children gift,Valentine's day gifts,Bag pandent",5.0,EUR,5.0,EUR,6,10,,,4.587155963302752,109.0,79,22,3,3,2,,,,,,,a,25,Livraison standard,2.0,false,,50,,,CN,CreativityMonitor,creativitymonitor,"(29,454 notes)",29454,4.41844910708223,5a02bc6c9aee09236877d071,,,https://www.wish.com/c/5ac271b5246bb06196722515,https://canary.contestimg.wish.com/api/webimage/5ac271b5246bb06196722515-medium.jpg,5ac271b5246bb06196722515
Moules à gâteau au fromage de forme ovale antiadhésive en acier au carbone plateau de cuisson moule à gâteau au fromage,Cheese Cake Molds Oval Shape Nonstick Carbon Steell Baking Tray Cheese Cake Pan,12.0,USD,12.0,USD,12,10,,,4.0,1.0,0,1,0,0,0,,,,,,gold,,50,Livraison standard,3.0,false,,50,,,CN,molijeccica,babyfacejeccica,93 % avis positifs (467 notes),467,4.421841541755889,5aebd54bc554b21ffbe5567f,,,https://www.wish.com/c/5ec2ad83a6ffac003f83f820,https://canary.contestimg.wish.com/api/webimage/5ec2ad83a6ffac003f83f820-medium.jpg,5ec2ad83a6ffac003f83f820
AQara,,,,,,,,,,,,,,,,,,,,,,,,,,,,,,,,,,,,,,,,,https://www.wish.com/c/5f7d9ff890b8a6e64603063c,,5f7d9ff890b8a6e64603063c
Planche à découper Fruits en bois et planche à découper planche à fromage gâteau Sushi plateau assiettes outils de cuisine,Chopping Board Wood Fruits and Cutting Board Cheese Board Cake Sushi Tray Plates  Kitchen Tools,35.0,EUR,35.0,EUR,42,1,,,5.0,0.0,,,,,,,,,,,,,50,Livraison standard,12.0,false,,50,true,Quantité limitée !,CN,YOUASDJFAOKF,youasdjfaokf,93 % avis positifs (69 notes),69,4.3768115942028984,5d5b5e38283abc2fc98f5f05,,,https://www.wish.com/c/5fa9fbae6700a03cf26afc01,https://canary.contestimg.wish.com/api/webimage/5fa9fbae6700a03cf26afc01-medium.jpg,5fa9fbae6700a03cf26afc01
Multifonctionnel Manuel Pratique Légumes Spirale Trancheuse Râpe À Fromage Tambour À Main Rotatif Râpe Légumes Cutter Facile Cuisine Outils,Multifunctional Manual Convenient Vegetable Spiral Slicer Cheese Grater Hand Drum Rotary Grater Vegetable Cutter Easy Kitchen Tools,7.0,EUR,149.0,EUR,8,10,,,3.3220338983050848,59.0,22,11,6,4,16,,,,,,green,typeb(minicutter),15,Livraison standard,2.0,false,,50,,,CN,SweetBuy8,sweetbuy8,"90 % avis positifs (13,850 notes)",13850,4.258772563176895,585b8d3398a90e4cac73cf82,,,https://www.wish.com/c/5dc2ba3ad341271adbd3aa10,https://canary.contestimg.wish.com/api/webimage/5dc2ba3ad341271adbd3aa10-medium.jpg,5dc2ba3ad341271adbd3aa10
Bricolage en plastique tofu presse moule maison tofu moule soja caillé tofu faisant moule avec fromage tissu cuisine cuisson outil ensemble haute vie,DIY Plastic Tofu Press Mold Homemade Tofu Mold Soybean curd Tofu Making Mold with Cheese Cloth Kitchen Cooking Tool Set High life,5.0,EUR,13.0,EUR,6,10,,,3.3333333333333335,3.0,1,1,0,0,1,,,,,,,,50,Livraison standard,2.0,false,,50,,,CN,Heart Sweet,heartsweet,"91 % avis positifs (13,215 notes)",13215,4.304199772985244,56d95e3b22709d167a4efe00,,,https://www.wish.com/c/5b4f08600912bb5e4c37d8c9,https://canary.contestimg.wish.com/api/webimage/5b4f08600912bb5e4c37d8c9-medium.jpg,5b4f08600912bb5e4c37d8c9
Orion Market O Real Cheese Chip,Orion Market O Real Cheese Chip,22.0,EUR,22.0,EUR,26,0,,,5.0,0.0,,,,,,,,,,,,,40,Livraison standard,7.0,false,,40,true,Quantité limitée !,KR,huinayuna,huinayuna,,0,5.0,5fd268ed4b35fb269ab253ab,,,https://www.wish.com/c/5fe7397645203313fdff6950,https://canary.contestimg.wish.com/api/webimage/5fe7397645203313fdff6950-medium.jpg,5fe7397645203313fdff6950
Geek,,,,,,,,,,,,,,,,,,,,,,,,,,,,,,,,,,,,,,,,,https://www.wish.com/c/5ed8d48690b8a634bae4fd82,,5ed8d48690b8a634bae4fd82
Cheese Grater Kitchen Supplies Elegant Cheese Cutter for Kitchen Cooking,Cheese Grater Kitchen Supplies Elegant Cheese Cutter for Kitchen Cooking,14.0,EUR,14.0,EUR,16,0,,,5.0,0.0,,,,,,,,,,,,,50,Livraison Express,10.0,true,,50,true,Quantité limitée !,CN,LingFeiXiang,lingfeixiang,86 % avis positifs (501 notes),501,4.127744510978044,5d79e9b7288835520331af20,,,https://www.wish.com/c/5fc47688b3e7fac28c20e1f9,https://canary.contestimg.wish.com/api/webimage/5fc47688b3e7fac28c20e1f9-medium.jpg,5fc47688b3e7fac28c20e1f9
Râpe réglable de raboteuse de beurre d'outil de tranche de coupeur de coupe-fromage avec l'alliage de fil,Adjustable Cheese Slicer Cutter Slice Tool Butter Planer Grater With Wire Alloy,7.0,EUR,7.0,EUR,8,10,,,4.05,80.0,43,18,7,4,8,,,,,,,,50,Livraison standard,3.0,false,,50,,,CN,singbabyxiao,singbabyxiao,"(26,743 notes)",26743,4.36233780802453,584ba296a55ed228e9f5c47a,,,https://www.wish.com/c/5a7a9cda7ddb0636003f673a,https://canary.contestimg.wish.com/api/webimage/5a7a9cda7ddb0636003f673a-medium.jpg,5a7a9cda7ddb0636003f673a
Dynasco,,,,,,,,,,,,,,,,,,,,,,,,,,,,,,,,,,,,,,,,,https://www.wish.com/c/5fb7a25c0ed118000f86d9df,,5fb7a25c0ed118000f86d9df
Manual Frozen Meat Slicer Stainless Steel Food Slicer Meat Slicing Machine For Cheese Bacon Beef Mutton Roll ,Manual Frozen Meat Slicer Stainless Steel Food Slicer Meat Slicing Machine For Cheese Bacon Beef Mutton Roll ,37.0,EUR,37.0,EUR,44,0,,,5.0,0.0,,,,,,,,,,,,,50,Livraison Express,12.0,true,,50,,,CN,FengNa,fengna,91 % avis positifs (300 notes),300,4.346666666666667,5d803b253c59ff3503f31dfe,,,https://www.wish.com/c/5fb66919374593214df43002,https://canary.contestimg.wish.com/api/webimage/5fb66919374593214df43002-medium.jpg,5fb66919374593214df43002
Bricolage en plastique tofu presse moule maison tofu boîte soja caillé tofu faisant moule avec fromage tissu cuisine cuisson tofu moule outil,DIY Plastic Tofu Press Mould Homemade Tofu Box Soybean Curd Tofu Making Mold with Cheese Cloth Kitchen Cooking Tofu Mold Tool,8.0,USD,8.0,USD,8,7,,,5.0,1.0,1,0,0,0,0,,,,,,,,50,Livraison standard,2.0,false,,50,true,Quantité limitée !,CN,I AngelCity,iangelcity,"88 % avis positifs (4,943 notes)",4943,4.207970867893992,584627f5cd7c006932f21e91,,,https://www.wish.com/c/5f9d2081ecea781c2de3b4b5,https://canary.contestimg.wish.com/api/webimage/5f9d2081ecea781c2de3b4b5-medium.jpg,5f9d2081ecea781c2de3b4b5
Hachoir à légumes Trancheur Dicer Cutter & Râpe - 8 lames interchangeables en acier inoxydable - Heavy Duty Multi Fruit Cheese & Oignon Chopper Dicer Kitchen Cutter,Vegetable Chopper Slicer Dicer Cutter & Grater - 8 Interchangeable Stainless Steel Blades - Heavy Duty Multi Fruit Cheese & Onion Chopper Dicer Kitchen Cutter,26.0,EUR,55.0,EUR,31,9,,,5.0,2.0,2,0,0,0,0,,,,,,,,1,Livraison standard,9.0,false,,1,,,CN,duoduostar,duoduostar,89 % avis positifs (57 notes),57,4.2631578947368425,5d7ca01e70c2ca5940df024c,,,https://www.wish.com/c/5d99e9415eb2941b296d4e40,https://canary.contestimg.wish.com/api/webimage/5d99e9415eb2941b296d4e40-medium.jpg,5d99e9415eb2941b296d4e40
Coupe-légumes multifonction Accessoires de cuisine Trancheuse à mandoline Coupe-fruits Éplucheur de pommes de terre Carotte Râpe à fromage Trancheuse à légumes,Multifunction vegetable cutter Kitchen accessories Mandoline Slicer Fruit Cutter Potato Peeler Carrot Cheese Grater vegetable slicer,12.0,EUR,12.0,EUR,14,10,,,3.1142857142857143,35.0,8,10,5,2,10,,,,,,,a,50,Livraison standard,4.0,false,,50,true,Quantité limitée !,CN,Bosueshop,bosueshop,"87 % avis positifs (3,729 notes)",3729,4.111289890050952,5d550aac41ed514a6bcd5eef,,,https://www.wish.com/c/5dd4ef877e728483e73bfaec,https://canary.contestimg.wish.com/api/webimage/5dd4ef877e728483e73bfaec-medium.jpg,5dd4ef877e728483e73bfaec
Crackers de riz à saveur de maïs Miwang 200g 1 sachet Nourriture> Snacks / Snacks Snacks / Serial Cookies / Biscuits / Crackers Cookies,Miwang Corn Cheese Flavored Rice Crackers 200g 1 bag Food> Snacks/Snacks Snacks/Serial Cookies/Biscuits/Crackers Cookies,16.0,EUR,16.0,EUR,19,0,,,5.0,0.0,,,,,,,,,,,,,50,Livraison standard,6.0,false,,50,,,KR,All of Korea,allofkorea,,0,5.0,5fd561db4706204525206b0f,,,https://www.wish.com/c/5fe1131cb21784b869243cf6,https://canary.contestimg.wish.com/api/webimage/5fe1131cb21784b869243cf6-medium.jpg,5fe1131cb21784b869243cf6
Broyeur de fromage de fruits de légumes de râpe multifonction de cuisine d'acier inoxydable,Stainless Steel Kitchen Multi-function Grater Vegetable Fruit Cheese Crusher,7.0,EUR,7.0,EUR,8,0,,,5.0,0.0,,,,,,,,,,,,1set,50,Livraison standard,3.0,false,,50,,,CN,Arashi,arashi,"91 % avis positifs (104,734 notes)",104734,4.2965894551912465,58a3f270e269ee522580e6bb,,,https://www.wish.com/c/5bc5b01f322df2265d22cdff,https://canary.contestimg.wish.com/api/webimage/5bc5b01f322df2265d22cdff-medium.jpg,5bc5b01f322df2265d22cdff
1 Pc Rotatory Convenient Cheese Slicer Exquisite Crafted Cheese Cutter (Black),1 Pc Rotatory Convenient Cheese Slicer Exquisite Crafted Cheese Cutter (Black),12.0,EUR,12.0,EUR,14,1,,,5.0,0.0,,,,,,,,,,,black,15x10cm,50,Livraison standard,4.0,false,,50,,,CN,yjiwheya,yjiwheya,95 % avis positifs (101 notes),101,4.6138613861386135,5f1278ad6e5ec8cb68d30713,,,https://www.wish.com/c/5f975930f93a8602bf9d9996,https://canary.contestimg.wish.com/api/webimage/5f975930f93a8602bf9d9996-medium.jpg,5f975930f93a8602bf9d9996
Trancheuse à gâteau au fromage européenne de style occidental coupe 10 pouces couteau à pain dentelé coupe-pâtisserie outil de cuisson couteau à trancher,Western-style European Cheese Cake Slicer Cutting 10 Inch Serrated Bread Knife Pastry Cutter Baking Tool Slicing Knife,8.0,USD,12.0,USD,8,10,,,3.0,1.0,0,0,1,0,0,,,,,,,coarseteeth,50,Livraison standard,2.0,false,,50,true,Quantité limitée !,US,ELUXBOUTIQUE,eluxboutique,90 % avis positifs (217 notes),217,4.317972350230415,585d2bacaf0e9d52156ca508,,,https://www.wish.com/c/5ea9295f658dc2003de29a39,https://canary.contestimg.wish.com/api/webimage/5ea9295f658dc2003de29a39-medium.jpg,5ea9295f658dc2003de29a39
Stainless Steel Cheese Grater Hand Crank Rotary Blades Vegetable Grinder Kitchen,Stainless Steel Cheese Grater Hand Crank Rotary Blades Vegetable Grinder Kitchen,12.0,EUR,12.0,EUR,14,1,,,5.0,1.0,1,0,0,0,0,,,,,,,a,50,Livraison standard,4.0,false,,50,,,CN,AtesenBetterhealth,atesenbetterhealth,"90 % avis positifs (5,655 notes)",5655,4.221220159151193,58b516c25d5cfc51010c0ed5,,,https://www.wish.com/c/5f5a182d300b61003cb5610c,https://canary.contestimg.wish.com/api/webimage/5f5a182d300b61003cb5610c-medium.jpg,5f5a182d300b61003cb5610c
"Raclette Table Grill, Non-Stick and Durable Cheese Raclette, for Making Cheese for Home Anywhere You Want Kitchen","Raclette Table Grill, Non-Stick and Durable Cheese Raclette, for Making Cheese for Home Anywhere You Want Kitchen",14.0,EUR,14.0,EUR,16,0,,,5.0,0.0,,,,,,,,,,,,,50,Livraison Express,6.0,true,,50,,,CN,Saxgehant,saxgehant,65 % avis positifs (20 notes),20,3.5,5f601ffb5fc755c0b50c0dd7,,,https://www.wish.com/c/5fcd0072ac228c10d52216d7,https://canary.contestimg.wish.com/api/webimage/5fcd0072ac228c10d52216d7-medium.jpg,5fcd0072ac228c10d52216d7
Couteau à beurre Fromage Dessert Confiture Spreaders Couteaux à Crème Ustensile Couverts Dessert Outils pour Toast Cuisine Outils,Butter Knife Cheese Dessert Jam Spreaders Cream Knifes Utensil Cutlery Dessert Tools for Toast Kitchen Tools,4.75,EUR,15.0,EUR,5.76,10,,,5.0,3.0,3,0,0,0,0,,,,,,,,50,Livraison standard,1.0,false,,50,true,Quantité limitée !,CN,Xuehumei Zaily,xuehumeizaily,81 % avis positifs (611 notes),611,3.913256955810147,5e216090a77fd20361a5708d,,,https://www.wish.com/c/5e47bb1a98f89f55b0dab5c8,https://canary.contestimg.wish.com/api/webimage/5e47bb1a98f89f55b0dab5c8-medium.jpg,5e47bb1a98f89f55b0dab5c8
Coupeur réglable de fromage d'épaisseur de trancheuse de fromage d'acier inoxydable pour la cuisine de cuisine,Stainless Steel Cheese Slicer Adjustable Thickness Cheese Cutter for Kitchen Cooking,10.0,EUR,10.0,EUR,11,9,,,4.0,1.0,0,1,0,0,0,,,,,,silver,,50,Livraison standard,8.0,false,,50,,,CN,yoisawngge,yoisawngge,"88 % avis positifs (3,044 notes)",3044,4.126149802890933,5acf00b47c276830de00f941,,,https://www.wish.com/c/5e34d6994b71210328e4de9c,https://canary.contestimg.wish.com/api/webimage/5e34d6994b71210328e4de9c-medium.jpg,5e34d6994b71210328e4de9c
"Pepero Nude Cheese 39g X 40 Imported Confectionery/Large Confectionery/Snack/Human Food/Package Confectionery/Cookie Set/Chocolate Confectionery/Rice Confectionery/Office Snack/Shrimp Cracker, single quantity, single component","Pepero Nude Cheese 39g X 40 Imported Confectionery/Large Confectionery/Snack/Human Food/Package Confectionery/Cookie Set/Chocolate Confectionery/Rice Confectionery/Office Snack/Shrimp Cracker, single quantity, single component",213.0,EUR,213.0,EUR,257.0,0,,,5.0,0.0,,,,,,,,,,,,,50,Livraison standard,12.0,false,,50,,,KR,awesomekorea,awesomekorea,100 % avis positifs (1 notes),1,5.0,600f907c35473d26e050c7dd,,,https://www.wish.com/c/601e6d5353bbeb6989944f9b,https://canary.contestimg.wish.com/api/webimage/601e6d5353bbeb6989944f9b-medium.jpg,601e6d5353bbeb6989944f9b
Râpe à fromage râpe en acier inoxydable de nourriture de fruits de légumes avec cuisine de récipient,Cheese Grater Vegetable Fruit Food Stainless Steel Grater with Container Kitchen,8.0,EUR,8.0,EUR,9,10,,,3.0,2.0,1,0,0,0,1,,,,,,,1set,50,Livraison Express,7.0,true,,50,,,CN,xiaoyaowazi,xiaoyaowazi,"(7,744 notes)",7744,4.298037190082645,58591896064aa96ce5e0d15b,,,https://www.wish.com/c/5f55eebe4b76288415ff7d07,https://canary.contestimg.wish.com/api/webimage/5f55eebe4b76288415ff7d07-medium.jpg,5f55eebe4b76288415ff7d07
Cheese Cutter Durable Cheese Knife Kitchen Tools Sturdy for Bread for Cheese,Cheese Cutter Durable Cheese Knife Kitchen Tools Sturdy for Bread for Cheese,16.0,EUR,16.0,EUR,19,0,,,5.0,0.0,,,,,,,,,,,,,50,Livraison Express,7.0,true,,50,,,CN,Hotsanren,hotsanren,89 % avis positifs (728 notes),728,4.298076923076923,5d5507e741ed51498ecd5e86,,,https://www.wish.com/c/5fca5c7443bd7d2c823ca0ad,https://canary.contestimg.wish.com/api/webimage/5fca5c7443bd7d2c823ca0ad-medium.jpg,5fca5c7443bd7d2c823ca0ad
Gant de four pour macaroni au fromage,Mac and Cheese All Over Oven Mitt,22.0,EUR,22.0,EUR,26,0,,,5.0,0.0,,,,,,,,,,,multicolor,onesize,50,Livraison standard,7.0,false,,50,true,Quantité limitée !,,Old Glory,oldglory,"94 % avis positifs (20,078 notes)",20078,4.474001394561212,512c0a9f1d3b484430b6c0d6,,,https://www.wish.com/c/5aff0289fe167b14ed715ee4,https://canary.contestimg.wish.com/api/webimage/5aff0289fe167b14ed715ee4-medium.jpg,5aff0289fe167b14ed715ee4
Stainless Steel Durable Sharp Truffle Cheese Slicer Chocolate Shaver Wavy Blade Dessert Kitchen Cheese Butter Cutter,Stainless Steel Durable Sharp Truffle Cheese Slicer Chocolate Shaver Wavy Blade Dessert Kitchen Cheese Butter Cutter,7.0,EUR,7.0,EUR,8,1,,,5.0,0.0,,,,,,,,,,,,used,50,Livraison standard,2.0,false,,50,true,Quantité limitée !,CN,lidaxing,lidaxing,"90 % avis positifs (1,497 notes)",1497,4.22378089512358,5ae66874ea8764504c8330ec,,,https://www.wish.com/c/5fe5a90cfd4c298880a79bdf,https://canary.contestimg.wish.com/api/webimage/5fe5a90cfd4c298880a79bdf-medium.jpg,5fe5a90cfd4c298880a79bdf
"Multifunction Shredder Manual Potato Slicer Vegetable Fruit Cutter,Shredder Garlic Meat Chopper Carrot Potato Slicer Cheese Grater Salad Maker Kitchen Gadgets","Multifunction Shredder Manual Potato Slicer Vegetable Fruit Cutter,Shredder Garlic Meat Chopper Carrot Potato Slicer Cheese Grater Salad Maker Kitchen Gadgets",12.0,EUR,12.0,EUR,14,5,,,5.0,0.0,,,,,,,,,,,red,6in1peelerset/red,50,Livraison standard,4.0,false,,50,,,VE,Sirah,sirah,"72 % avis positifs (2,325 notes)",2325,3.5544086021505374,5da509170e1e0f51766e9460,,,https://www.wish.com/c/607557a255b54e1166e2bd4f,https://canary.contestimg.wish.com/api/webimage/607557a255b54e1166e2bd4f-medium.jpg,607557a255b54e1166e2bd4f
Trancheuse à spirale de légumes manuelle multifonctionnelle râpe à fromage tambour à main râpe rotative coupe-légumes FR,Multifunctional Manual Vegetable Spiral Slicer Cheese Grater Hand Drum Rotary Grater Vegetable Cutter FR,33.0,EUR,33.0,EUR,39,0,,,5.0,0.0,,,,,,,,,,,,2018style,1,Livraison Express,11.0,true,,50,true,Quantité limitée !,CN,margotmissyou,margotmissyou,87 % avis positifs (754 notes),754,4.163129973474801,5d4d19d33db43e0e6dbb4887,,,https://www.wish.com/c/5eaaa8483769b82460be35df,https://canary.contestimg.wish.com/api/webimage/5eaaa8483769b82460be35df-medium.jpg,5eaaa8483769b82460be35df
Truffe Fromage Truffe Acier Inoxydable Truffe Au Chocolat,Truffle Cheese Slicer Stainless Steel Chocolate Truffle Shaver,8.0,EUR,8.0,EUR,9,10,,,4.0,7.0,5,0,0,1,1,,,,,,,,50,Livraison standard,3.0,false,,50,,,CN,changyishop,changyishop,"94 % avis positifs (66,997 notes)",66997,4.404436019523263,57712714082591753cf6328e,,,https://www.wish.com/c/5c8a212baba8c75b1a3faf96,https://canary.contestimg.wish.com/api/webimage/5c8a212baba8c75b1a3faf96-medium.jpg,5c8a212baba8c75b1a3faf96
Ménage polyvalent Hand Held Curved Râpe Shredder Ginger Potato Cheese Kitchen Tool,Versatile Housewares Hand Held Curved Grater Shredder Ginger Potato Cheese Kitchen Tool,4.0,EUR,16.0,EUR,4,10,,,4.375,48.0,34,6,4,0,4,,,,,,,,50,Livraison standard,1.0,false,,50,,,CN,southhillpark,southhillpark,"93 % avis positifs (2,018 notes)",2018,4.361248761149653,575109281b62916b89de65f1,,,https://www.wish.com/c/5796b9d04202d4195d52cb69,https://canary.contestimg.wish.com/api/webimage/5796b9d04202d4195d52cb69-medium.jpg,5796b9d04202d4195d52cb69
Intex,,,,,,,,,,,,,,,,,,,,,,,,,,,,,,,,,,,,,,,,,https://www.wish.com/c/5e3b0ba59719eddf0ac7e681,,5e3b0ba59719eddf0ac7e681
Couteau à beurre coupe-beurre à fromage en acier inoxydable avec trou essuyage multifonction crème pain couteau à confiture Gadgets de cuisine,Butter Knife Stainless Steel Cheese Butter Cutter With Hole Multi-function Wipe Cream Bread Jam Knife Kitchen Gadgets,4.75,EUR,5.0,EUR,5.76,10,,,4.410714285714286,56.0,40,7,5,0,4,,,,,,silver,,50,Livraison standard,2.0,false,,50,,,CN,retro home furnishing,retrohomefurnishing,"92 % avis positifs (6,912 notes)",6912,4.35083912037037,58f5eff8d0237707acdd9618,,,https://www.wish.com/c/5e9944b9f11fa741bfcb6e29,https://canary.contestimg.wish.com/api/webimage/5e9944b9f11fa741bfcb6e29-medium.jpg,5e9944b9f11fa741bfcb6e29
Cheese Stainless Steel Truffle Cheese Adjustable Blade Chocolate,Cheese Stainless Steel Truffle Cheese Adjustable Blade Chocolate,6.0,EUR,6.0,EUR,7,0,,,5.0,0.0,,,,,,,,,,,,,50,Livraison standard,2.0,false,,50,,,CN,Fenglinjoy66,fenglinjoy66,"92 % avis positifs (8,588 notes)",8588,4.308453656264555,58a2e83f2302674f3ad635ee,,,https://www.wish.com/c/5fd0e91cd7f7a301d1a98690,https://canary.contestimg.wish.com/api/webimage/5fd0e91cd7f7a301d1a98690-medium.jpg,5fd0e91cd7f7a301d1a98690
5 Types DIY Tart Ring Mold Cake French Dessert Cheese Bakeware Cutter Round Shape Decorating Perforated Mousse Circle Kitchen Tools,5 Types DIY Tart Ring Mold Cake French Dessert Cheese Bakeware Cutter Round Shape Decorating Perforated Mousse Circle Kitchen Tools,3.84,EUR,11.0,EUR,4.66,1,,,5.0,0.0,,,,,,,,,,,,round(1pcs),50,Livraison standard,1.0,false,,50,,,CN,caiziyang5635,caiziyang5635,100 % avis positifs (1 notes),1,5.0,6038aaecb4f2576544afdcab,,,https://www.wish.com/c/606c2f376f40789891556bce,https://canary.contestimg.wish.com/api/webimage/606c2f376f40789891556bce-medium.jpg,606c2f376f40789891556bce
Macaroni au fromage en poudre - (11Lb),Mac And Cheese Sauce Powder -( 11Lb ),123.0,EUR,123.0,EUR,148.2,0,,,5.0,0.0,,,,,,,,,,,,111,50,Livraison standard,125.0,false,,50,,,CA,Wholesale2go.ca,wholesale2goca,,0,5.0,5f234cfabafed2fd1e00c99d,,,https://www.wish.com/c/5f90d89121ad26784d3a07da,https://canary.contestimg.wish.com/api/webimage/5f90d89121ad26784d3a07da-medium.jpg,5f90d89121ad26784d3a07da
Chatham Village Large Cut Cheese & Garlic Croutons 5 oz. (qty. 6),Chatham Village Large Cut Cheese & Garlic Croutons 5 oz. (qty. 6),38.0,EUR,43.0,EUR,45,0,,,5.0,0.0,,,,,,,,,,,,,4,Livraison standard,12.0,false,,4,,,US,LetsMakeADealToday,letsmakeadealtoday,88 % avis positifs (249 notes),249,4.397590361445783,5e25bf443a003e80bfadbc3e,,,https://www.wish.com/c/604733d963922cc535460ab5,https://canary.contestimg.wish.com/api/webimage/604733d963922cc535460ab5-medium.jpg,604733d963922cc535460ab5
Trancheuse à pommes de terre manuelle multifonction coupe-fruits à légumes en acier inoxydable éplucheur d'oignon râpe à carottes outil de cuisine,Multifunction Manual Potato Slicer Vegetable Fruit Cutter Stainless Steel  Onion Peeler Carrot Grater Dicer Kitchen Tool,6.0,EUR,6.0,EUR,7,1000,,,4.072072072072072,222.0,129,37,21,13,22,,,,,,,1pcsstainlesspeeler,50,Livraison Express,6.0,true,,50,,,CN,huibaitong,huibaitong,88 % avis positifs (516 notes),516,4.158914728682171,593395b79c23de656594e852,,,https://www.wish.com/c/5ea13c8c7df53d45a263015b,https://canary.contestimg.wish.com/api/webimage/5ea13c8c7df53d45a263015b-medium.jpg,5ea13c8c7df53d45a263015b
"Bow wow, merci fromage, collation pour chien","Bow wow, thank you cheese, dog snack",38.0,EUR,38.0,EUR,46,0,,,5.0,0.0,,,,,,,,,,,,,10,Livraison standard,12.0,false,,10,,,KR,huinayuna,huinayuna,,0,5.0,5fd268ed4b35fb269ab253ab,,,https://www.wish.com/c/5fe153bf7b81c43df2b54172,https://canary.contestimg.wish.com/api/webimage/5fe153bf7b81c43df2b54172-medium.jpg,5fe153bf7b81c43df2b54172
