title,title_orig,discount_price,discount_price_currency,retail_price,retail_price_currency,discount_price_in_original_currency,nb_cart_orders_approx,nb_units_purchased_approx,uses_ad_boosts,rating,rating_count,rating_five_count,rating_four_count,rating_three_count,rating_two_count,rating_one_count,badges_count,badge_local_product,badge_product_quality,badge_fast_shipping,tags,product_color,product_variation_size_id,product_variation_inventory,shipping_option_name,shipping_option_price,shipping_is_express,countries_shipped_to,inventory_total,has_urgency_banner,urgency_text,origin_country,merchant_title,merchant_name,merchant_info_subtitle,merchant_rating_count,merchant_rating,merchant_id,merchant_has_profile_picture,merchant_profile_picture,product_url,product_picture,product_id
Machine de découpe de légumes multifonction accessoires de cuisine trancheuse de fruits pratique éplucheur de pommes de terre râpe à fromage carotte FR,Multi-Function Vegetable Cutting Machine Kitchen Accessories Convenient Fruit Slicer Potato Peeler Carrot Cheese Grater FR,31.0,EUR,31.0,EUR,37,3,,,5.0,0.0,,,,,,,,,,,,2019style,1,Livraison Express,10.0,true,,50,,,CN,sunmiaomiao1114,sunmiaomiao1114,"91 % avis positifs (1,790 notes)",1790,4.290502793296089,5b81324fadd97117d4da921d,,,https://www.wish.com/c/5ece55b02a98860cf16f88d5,https://canary.contestimg.wish.com/api/webimage/5ece55b02a98860cf16f88d5-medium.jpg,5ece55b02a98860cf16f88d5
" Lot de 4 chaises style scandinave Catherina Gris, Tabouret en Hêtre Moderne Pied en PP Chaise de Bar Cuisine Petit Déjeuner Café Chaise Longue FR"," Lot de 4 chaises style scandinave Catherina Gris, Modern Beech Leg PP Stool Bar Chair Kitchen Breakfast Cafe Lounge Chair  FR",132.0,EUR,132.0,EUR,160.0,7,,,5.0,0.0,,,,,,,,,,,black,,19,Livraison Express,12.0,true,,50,,,US,Spooky Way,repeat_store,100 % avis positifs (2 notes),2,4.0,5e7401a6c50ae806053304bc,,,https://www.wish.com/c/5f9bedc6e0264831b428f6e8,https://canary.contestimg.wish.com/api/webimage/5f9bedc6e0264831b428f6e8-medium.jpg,5f9bedc6e0264831b428f6e8
Montessori Baby Kids Toddler Jeu de fromages pour les tout-petits Puzzle éducatif Jouets en bois pour l'apprentissage des jeunes enfants ,Montessori Baby Kids Toddler Cheese Game for Early Learning Educational Puzzle Wooden Toys ,6.0,EUR,6.0,EUR,7,10000,,,4.2690735694822886,1468.0,891,286,161,55,75,,,,,,,apple,50,Livraison standard,2.0,false,,50,,,CN,Goods' life,goodslife,"(104,748 notes)",104748,4.390021766525376,58d21af499637852e4e3a520,,,https://www.wish.com/c/5a2e42f2d20e9311d29f2e44,https://canary.contestimg.wish.com/api/webimage/5a2e42f2d20e9311d29f2e44-medium.jpg,5a2e42f2d20e9311d29f2e44
Épandeur de sandwich couteau à beurre couteau trancheuse à fromage en acier inoxydable lame large spatule à crème glacée outil de cuisine KIC,Sandwich Spreader Butter Knife Cheese Slicer Knives Stainless Steel Wide Blade Ice Cream Spatula Kitchen Tool KIC,6.0,EUR,9.0,EUR,7,10,,,5.0,5.0,5,0,0,0,0,,,,,,,asthepicture,50,Livraison standard,2.0,false,,50,true,Quantité limitée !,CN,kicipo 310 pengp1,kicipo310pengp1,"95 % avis positifs (4,395 notes)",4395,4.52127417519909,58c1fd18d63ecf50551b86f9,,,https://www.wish.com/c/5bf7b45ee614b878e2dbce57,https://canary.contestimg.wish.com/api/webimage/5bf7b45ee614b878e2dbce57-medium.jpg,5bf7b45ee614b878e2dbce57
Neverland Beauty & Health,,,,,,,,,,,,,,,,,,,,,,,,,,,,,,,,,,,,,,,,,https://www.wish.com/c/5f94095890b8a6379ab5c913,,5f94095890b8a6379ab5c913
Lames en acier inoxydable de râpe à fromage rotative nettoyage facile pour le chocolat de noix de fromage,Rotary Cheese Grater Stainless Steel Blades Easy Cleaning for Cheese Nuts Chocolate,8.0,EUR,8.0,EUR,9,10,,,3.933333333333333,15.0,7,3,2,3,0,,,,,,,,50,Livraison standard,3.0,false,,50,,,CN,Yiwucitystars,yiwucitystars,"91 % avis positifs (26,877 notes)",26877,4.308590988577595,58b636dcf59b8a6f9aa71c53,,,https://www.wish.com/c/5d42f12f6063610b99901f1e,https://canary.contestimg.wish.com/api/webimage/5d42f12f6063610b99901f1e-medium.jpg,5d42f12f6063610b99901f1e
2Pcs Multifunction Stainless Steel Cheese Spatula Cutter Kitchen Utensils Orange+Purple Chan,2Pcs Multifunction Stainless Steel Cheese Spatula Cutter Kitchen Utensils Orange+Purple Chan,10.0,EUR,10.0,EUR,11,0,,,5.0,0.0,,,,,,,,,,,,,50,Livraison Express,8.0,true,,50,,,CN,ChangXiangYi,changxiangyi,88 % avis positifs (369 notes),369,4.176151761517615,5d79e2559e3dd2587b759296,,,https://www.wish.com/c/5ffaa954f61ca8005525cec5,https://canary.contestimg.wish.com/api/webimage/5ffaa954f61ca8005525cec5-medium.jpg,5ffaa954f61ca8005525cec5
10 pouces 3 types de couteau à pain Serratd en acier à incision Toast Couteaux à trancher Trancheuse à gâteau Coupe-pâtisserie Lame dentelée Outils de coupe de fromage à pain à coupe facile Outils de cuisson et de pâtisserie,10inch 3 Kinds of Incision Steel Serratd Bread Knife Toast Slicing Knives Cake Slicer Baking Pastry Cutter Serrated Blade Easy Cut Bread Cheese Cutting  tools Baking & Pastry Tools,6.0,EUR,6.0,EUR,7,10,,,4.6,60.0,43,12,3,2,0,,,,,,,coarseteeth,50,Livraison standard,2.0,false,,50,,,CN,LNshopping,lnshopping,"90 % avis positifs (35,709 notes)",35709,4.234870760872609,59b38e962351340e5da8b29d,,,https://www.wish.com/c/5da8265cc56a711142dcc1cb,https://canary.contestimg.wish.com/api/webimage/5da8265cc56a711142dcc1cb-medium.jpg,5da8265cc56a711142dcc1cb
Pizza 4/1 Pack Mini Tart Pan Non-Stick 4.5 Inch Heart Pan with Removable Bottom for Baking Pies Quiche Cheese Cakes and Dessert,Pizza 4/1 Pack Mini Tart Pan Non-Stick 4.5 Inch Heart Pan with Removable Bottom for Baking Pies Quiche Cheese Cakes and Dessert,5.0,EUR,61.0,EUR,6,2,,,5.0,0.0,,,,,,,,,,,,1pc,50,Livraison standard,2.0,false,,50,true,Quantité limitée !,CN,hushengjie,hushengjie,"92 % avis positifs (8,808 notes)",8808,4.303701180744778,58591154064aa96ce7e0d02c,,,https://www.wish.com/c/607687cf5f6e5d4192092f5d,https://canary.contestimg.wish.com/api/webimage/607687cf5f6e5d4192092f5d-medium.jpg,607687cf5f6e5d4192092f5d
Vente chaude Tofu Maker Gaze Coton Fromage Tissu Soja pour Cuisine DIY Pressage Moule 43x43 cm,Hot Sale Tofu Maker Gauze Cotton Cheese Cloth Soy for Kitchen DIY Pressing Mould 43x43cm,3.18,EUR,4.0,EUR,3.86,10,,,4.246913580246914,162.0,96,31,23,3,9,,,,,,,1pc,50,Livraison standard,1.0,false,,50,,,CN,qqzi,qqzi,"(19,884 notes)",19884,4.406457453228726,58e74effffbc010fa512de26,,,https://www.wish.com/c/596da3b641579103687f3712,https://canary.contestimg.wish.com/api/webimage/596da3b641579103687f3712-medium.jpg,596da3b641579103687f3712
2Kg Calcium Chloride CaCl2 FCC 77% Food Grade Soluble Cheese Making Beer Flakes,2Kg Calcium Chloride CaCl2 FCC 77% Food Grade Soluble Cheese Making Beer Flakes,69.0,EUR,69.0,EUR,83.0,0,,,5.0,0.0,,,,,,,,,,,,,37,Livraison standard,12.0,false,,37,true,Quantité limitée !,AU,ozdingo,ozdingo,93 % avis positifs (69 notes),69,4.27536231884058,59ed79b3fd9db81eaf6914da,,,https://www.wish.com/c/5fd2fac0d13116a38e430225,https://canary.contestimg.wish.com/api/webimage/5fd2fac0d13116a38e430225-medium.jpg,5fd2fac0d13116a38e430225
3 Colors Vegetable Cutter Manual Slicer For Vegetables/Fruits/Cheese Multifunctional Kitchen Gadgets FR,3 Colors Vegetable Cutter Manual Slicer For Vegetables/Fruits/Cheese Multifunctional Kitchen Gadgets FR,23.0,EUR,25.0,EUR,27,0,,,5.0,0.0,,,,,,,,,,,green,2021style,50,Livraison Express,8.0,true,,50,,,CN,zhangyixing1234,zhangyixing1234,"79 % avis positifs (1,455 notes)",1455,3.8804123711340206,5b9b6ffcd357521929d05485,,,https://www.wish.com/c/6048c08a64fcefb3b7e5c424,https://canary.contestimg.wish.com/api/webimage/6048c08a64fcefb3b7e5c424-medium.jpg,6048c08a64fcefb3b7e5c424
KOREA Cheese Cake Mold No. 1 / Round Cheese Cake Pan,KOREA Cheese Cake Mold No. 1 / Round Cheese Cake Pan,43.0,EUR,43.0,EUR,52.0,0,,,5.0,0.0,,,,,,,,,,,multicolor,onecolor,50,Livraison standard,12.0,false,,50,,,KR,GPOPMALL,gpopmall,69 % avis positifs (16 notes),16,3.6875,600bc259338f835382ad78e9,,,https://www.wish.com/c/60476274408685c8208f885c,https://canary.contestimg.wish.com/api/webimage/60476274408685c8208f885c-medium.jpg,60476274408685c8208f885c
Stainless Steel Pizza Peel Shovel Spatula Folding Baking Cheese Lifter Tool for Serving Food(12in ) JUS,Stainless Steel Pizza Peel Shovel Spatula Folding Baking Cheese Lifter Tool for Serving Food(12in ) JUS,21.0,EUR,21.0,EUR,25,0,,,5.0,0.0,,,,,,,,,,,,,50,Livraison Express,9.0,true,,50,,,CN,Justahastore,justahappy,91 % avis positifs (977 notes),977,4.340839303991812,5b29bfe3337afb6246310312,,,https://www.wish.com/c/5ffbd0e4486a71cc7d6ffb6c,https://canary.contestimg.wish.com/api/webimage/5ffbd0e4486a71cc7d6ffb6c-medium.jpg,5ffbd0e4486a71cc7d6ffb6c
2021 NOUVEAU Truffe à fromage à la truffe Rasoir à truffe au chocolat en acier inoxydable,2021 NEW Truffle Cheese Slicer Stainless Steel Chocolate Truffle Shaver,7.0,EUR,7.0,EUR,8,8,,,5.0,1.0,1,0,0,0,0,,,,,,,,50,Livraison standard,2.0,false,,50,,,CN,dolphinn,dolphinn,"93 % avis positifs (3,883 notes)",3883,4.445789338140613,5b0b6f9d0128753b6a76ec7c,,,https://www.wish.com/c/5c8a212314224818d2f80c6a,https://canary.contestimg.wish.com/api/webimage/5c8a212314224818d2f80c6a-medium.jpg,5c8a212314224818d2f80c6a
Boîte à beurre coupe-fromage bac à légumes en acier inoxydable ABS pâte avion râpe tranchage plateau à fromage ensembles outil,Butter box cheese cutting crisper Stainless Steel ABS Dough Plane Grater Slicing Cheese Board Sets Tool,14.0,EUR,81.0,EUR,16,1,,,5.0,0.0,,,,,,,,,,,,,50,Livraison standard,5.0,false,,50,,,CN,Dashan children,dashanchildren,95 % avis positifs (104 notes),104,4.5673076923076925,5b69109af070622bab53d119,,,https://www.wish.com/c/5cf3d3a4731ea5263b42decf,https://canary.contestimg.wish.com/api/webimage/5cf3d3a4731ea5263b42decf-medium.jpg,5cf3d3a4731ea5263b42decf
Trancheur de fromage végétal de nourriture de râpe ronde d'acier inoxydable avec la boîte de récipient,Stainless Steel Round Grater Food Vegetable Cheese Slicer With Container Box,4.68,EUR,5.0,EUR,5.67,10,,,4.0,5.0,3,1,0,0,1,,,,,,,m,50,Livraison Express,7.0,true,,50,true,Quantité limitée !,CN,liaishenhou,liaishenhou,"89 % avis positifs (6,950 notes)",6950,4.203021582733813,5ad00d9acd968d0acc1eebd8,,,https://www.wish.com/c/5b3aed7c08e5c7707533d80f,https://canary.contestimg.wish.com/api/webimage/5b3aed7c08e5c7707533d80f-medium.jpg,5b3aed7c08e5c7707533d80f
Couteau à beurre en acier inoxydable épandeurs de confiture de Dessert au fromage couteaux à crème ustensile couverts à Dessert outils pour pain grillé petit déjeuner outil,Stainless Steel Butter Knife Cheese Dessert Jam Spreaders Cream Knifes Utensil Cutlery Dessert Tools For Toast Breakfast Tool,6.0,EUR,9.0,EUR,7,10,,,4.777777777777778,9.0,7,2,0,0,0,,,,,,silver,1,50,Livraison standard,2.0,false,,50,,,CN,eshopincart,eshopincart,"95 % avis positifs (5,764 notes)",5764,4.5314018043025674,57c03a96e9557c72c6804819,,,https://www.wish.com/c/5cff3b6f79901c489312fc98,https://canary.contestimg.wish.com/api/webimage/5cff3b6f79901c489312fc98-medium.jpg,5cff3b6f79901c489312fc98
"Cheese Slicer, Stainless Steel Cheese Cutter with Accurate Size Scale, Wire Cheese Slicer for Cheese Butter, Equipped with 4 Replaceable Cheese Slicer Wires","Cheese Slicer, Stainless Steel Cheese Cutter with Accurate Size Scale, Wire Cheese Slicer for Cheese Butter, Equipped with 4 Replaceable Cheese Slicer Wires",22.0,USD,188.0,USD,22,3,,,5.0,0.0,,,,,,,,,,,,,50,Livraison standard,5.0,false,,50,,,CN,Achai88,achai88,"93 % avis positifs (3,133 notes)",3133,4.404085541015002,5989180a439a983c2375c93e,,,https://www.wish.com/c/605013d769261e65a4797b9f,https://canary.contestimg.wish.com/api/webimage/605013d769261e65a4797b9f-medium.jpg,605013d769261e65a4797b9f
1 pc multi-usages trancheuse à manivelle broyeur râpe déchiqueteuse pour chocolat fromage noix légume aide de cuisine,1pc Multi-purpose Hand-Cranked Slicer Grinder Grater Shredder for Chocolate Cheese Nut Vegetable Kitchen Helper,11.0,USD,11.0,USD,11,10,,,4.560975609756097,41.0,30,8,1,0,2,,,,,,white,,50,Livraison Express,4.0,true,,50,,,CN,tony big company,tonybigcompany,"92 % avis positifs (28,986 notes)",28986,4.33685227351135,55b195098cb4fc3c8b846779,,,https://www.wish.com/c/5ca454c1b340e70947d9f97a,https://canary.contestimg.wish.com/api/webimage/5ca454c1b340e70947d9f97a-medium.jpg,5ca454c1b340e70947d9f97a
Manual Rotary Vegetable Slicer Cutter Kitchen Vegetable Cheese Grater Chopper with 3 Sharp Stainless Steel Drums FR,Manual Rotary Vegetable Slicer Cutter Kitchen Vegetable Cheese Grater Chopper with 3 Sharp Stainless Steel Drums FR,23.0,EUR,23.0,EUR,27,0,,,5.0,0.0,,,,,,,,,,,,old(onlyvegetableslicer),50,Livraison Express,7.0,true,,50,,,CN,wangfenga,wangfenga,"93 % avis positifs (7,655 notes)",7655,4.36263879817113,5b2461491000a5144f75ca35,,,https://www.wish.com/c/5fdad3847efc3a639026fdd7,https://canary.contestimg.wish.com/api/webimage/5fdad3847efc3a639026fdd7-medium.jpg,5fdad3847efc3a639026fdd7
Coupe-légumes manuel trancheuse multifonctionnelle ronde Mandoline trancheuse pommes de terre fromage Gadgets de cuisine accessoires de cuisine,Manual Vegetable Cutter Slicer Multifunctional Round Mandoline Slicer Potato Cheese Kitchen Gadgets Kitchen Accessories,4.01,EUR,35.0,EUR,4.86,10,,,1.0,1.0,0,0,0,0,1,,,,,,green,typeb(minicutter),50,Livraison standard,1.0,false,,50,true,Quantité limitée !,CN,Oceaneshop03,oceaneshop03,"91 % avis positifs (19,440 notes)",19440,4.3200617283950615,58f9785991a95f6637b027db,,,https://www.wish.com/c/602f9a753ec83928962fc56c,https://canary.contestimg.wish.com/api/webimage/602f9a753ec83928962fc56c-medium.jpg,602f9a753ec83928962fc56c
1PC Stainless Steel Cake Shovel Knife Pie Pizza Cheese Server Cake Divider Knives Bread Shovel Baking Tools,1PC Stainless Steel Cake Shovel Knife Pie Pizza Cheese Server Cake Divider Knives Bread Shovel Baking Tools,3.13,EUR,4.0,EUR,3.8,10,,,5.0,0.0,,,,,,,,,,,silver,,50,Livraison standard,1.0,false,,50,,,CN,weishixing34ji,weishixing34ji,"91 % avis positifs (7,196 notes)",7196,4.330183435241801,5ac4d734a71fbf687f8c255a,,,https://www.wish.com/c/605da14d6f66598052c907e9,https://canary.contestimg.wish.com/api/webimage/605da14d6f66598052c907e9-medium.jpg,605da14d6f66598052c907e9
"Cheese Dish, Thick Dish, Classic Design Kitchen Use for Cake for Cream Cheese Home Use","Cheese Dish, Thick Dish, Classic Design Kitchen Use for Cake for Cream Cheese Home Use",15.0,EUR,15.0,EUR,18,0,,,5.0,0.0,,,,,,,,,,,,,50,Livraison Express,6.0,true,,50,,,CN,Enjoy100COM1,enjoy100com1,"94 % avis positifs (9,486 notes)",9486,4.462576428420831,58807c0d9cb3f24caa5e37ee,,,https://www.wish.com/c/5fc7e2272c95385d57b587b4,https://canary.contestimg.wish.com/api/webimage/5fc7e2272c95385d57b587b4-medium.jpg,5fc7e2272c95385d57b587b4
 Cuisine Cuisson Outil Ensemble DIY En Plastique Tofu Presse Moule Fait Maison Tofu Moule Soja Caillé Tofu Faire Moule avec Fromage Tissu, Kitchen Cooking Tool Set DIY Plastic Tofu Press Mould Homemade Tofu Mold Soybean Curd Tofu Making Mold with Cheese Cloth,6.0,USD,9.0,USD,6,10,,,4.013888888888889,72.0,41,12,6,5,8,,,,,,beige,,50,Livraison standard,8.0,false,,50,,,CN,Simple_style,simple_style,"91 % avis positifs (226,584 notes)",226584,4.292880344596265,58216982dd9916453fe2d1a1,,,https://www.wish.com/c/5ab1eb6e6d638a7a22ba5ddf,https://canary.contestimg.wish.com/api/webimage/5ab1eb6e6d638a7a22ba5ddf-medium.jpg,5ab1eb6e6d638a7a22ba5ddf
Pain Saucisse Trancheuse En Acier Inoxydable 10 Fils Tranche Viande Fruits Fromages Mous Cuisine Cuisine Outils,Bread Sausage Slicer Stainless Steel 10 Wires Slice Meat Fruit Soft Cheeses Kitchen Cooking Tools,8.0,EUR,8.0,EUR,9,10,,,5.0,0.0,,,,,,,,,,,,1pc,50,Livraison standard,3.0,false,,50,,,CN,Senourltd,senourltd,"92 % avis positifs (2,737 notes)",2737,4.385458531238583,58b6522e4a675750f96899f8,,,https://www.wish.com/c/5d790f79e0e0cf0e0d9dc725,https://canary.contestimg.wish.com/api/webimage/5d790f79e0e0cf0e0d9dc725-medium.jpg,5d790f79e0e0cf0e0d9dc725
6 PCS / ensemble En Acier Inoxydable Fourchette À Chocolat Hot Pot Fourchettes Fromage Fruits Dessert Fourche Fondue Fusion Brochette Cuisine Outils,6PCS/Set Stainless Steel Chocolate Fork Hot Pot Forks Cheese Fruit Dessert Fork Fondue Melting Skewer Kitchen Tools,5.0,EUR,5.0,EUR,6,10,,,5.0,2.0,2,0,0,0,0,,,,,,silver,,50,Livraison standard,7.0,false,,50,true,Quantité limitée !,CN,Home Stuff,homestuff,"93 % avis positifs (93,526 notes)",93526,4.391677180677031,58a6971e0e16e97a6636a1b8,,,https://www.wish.com/c/5abdb0f216d94465feb566ec,https://canary.contestimg.wish.com/api/webimage/5abdb0f216d94465feb566ec-medium.jpg,5abdb0f216d94465feb566ec
"304 Stainless Steel Cheese Grater, 1 pc., Cheese Grater","304 Stainless Steel Cheese Grater, 1 pc., Cheese Grater",64.0,EUR,64.0,EUR,77.0,0,,,5.0,0.0,,,,,,,,,,,,,50,Livraison standard,12.0,false,,50,,,KR,top korea seller,topkoreaseller,50 % avis positifs (2 notes),2,3.0,5ff4782d45e0239ccc5a5c96,,,https://www.wish.com/c/5ffba5dc4f35c02cf38aa8a4,https://canary.contestimg.wish.com/api/webimage/5ffba5dc4f35c02cf38aa8a4-medium.jpg,5ffba5dc4f35c02cf38aa8a4
"Roychen Yogurt Cheese Maker 2 Set Mini cuillère laquée 2P Bundle Set, 1 set, rose","Roychen Yogurt Cheese Maker 2 Set Lacquered Mini Spoon 2P Bundle Set, 1 Set, Pink",87.0,EUR,87.0,EUR,105.0,0,,,5.0,0.0,,,,,,,,,,,,,9,Livraison standard,0.0,false,,9,,,KR,ThinkerValue,thinkervalue,67 % avis positifs (3 notes),3,3.6666666666666665,5fc5ff4c3e691f2727facac4,,,https://www.wish.com/c/6003ee0f40228637974e3d48,https://canary.contestimg.wish.com/api/webimage/6003ee0f40228637974e3d48-medium.jpg,6003ee0f40228637974e3d48
Couteau à fromage en acier inoxydable accessoires de barman outil couteau à steak fournitures de cuisine,Stainless Steel Bar Cheese Knife Bartending Accessories Tool Steak Knife Kitchen Supplies,3.13,EUR,4.0,EUR,3.79,6,,,5.0,0.0,,,,,,,,,,,,,50,Livraison standard,1.0,false,,50,,,CN,junyan guo shuai,junyanguoshuai,"93 % avis positifs (9,990 notes)",9990,4.361061061061061,5aec0a407824ca12dff25998,,,https://www.wish.com/c/5d514cd8ae05fe1581c1cdd9,https://canary.contestimg.wish.com/api/webimage/5d514cd8ae05fe1581c1cdd9-medium.jpg,5d514cd8ae05fe1581c1cdd9
"Sachets de lait de noix réutilisables 1/2/3 Pack 12 ""x 12"" Sacs en étamine 100% coton biologique non blanchi Passoire pour tamiser le lait d'amande / soja Yaourt grec Infusion à froid Café Thé Jus de bière Chiffon à fromage","Nut Milk Bags Reusable 1/2/3 Pack 12"" x 12"" 100% Unbleached Organic Cotton Cheesecloth Bags Strainer for Straining Almond/Soy Milk Greek Yogurt Cold Brew Coffee Tea Beer Juice Cheese Cloth",7.0,EUR,8.0,EUR,8,9,,,5.0,1.0,1,0,0,0,0,,,,,,,1pack,50,Livraison standard,2.0,false,,50,,,CN,"Climb Electronic Technology Co., Ltd.",climbelectronictechnologycoltd,"92 % avis positifs (15,409 notes)",15409,4.340580180414044,53e1a490ff4d6d7be2e725ff,,,https://www.wish.com/c/5f44e8e9b6512d09e78958e1,https://canary.contestimg.wish.com/api/webimage/5f44e8e9b6512d09e78958e1-medium.jpg,5f44e8e9b6512d09e78958e1
Ensemble de 10 pièces multifonctionnel en acier inoxydable crème glacée chocolat fromage fondue fondue ensemble accessoires de cuisine pour Buffet de fête,10-Piece Set Multifunctional Stainless Steel Ice Cream Chocolate Cheese Melting Pot Fondue Set Kitchen Accessories for Party Buffet,23.0,EUR,23.0,EUR,27,10,,,5.0,6.0,6,0,0,0,0,,,,,,,10-pieceset,50,Livraison standard,7.0,false,,50,,,CN,qiaopinye,qiaopinye,"92 % avis positifs (4,342 notes)",4342,4.357669276830953,5a378460471c141067102a77,,,https://www.wish.com/c/5bfcdfd45ead95222144f681,https://canary.contestimg.wish.com/api/webimage/5bfcdfd45ead95222144f681-medium.jpg,5bfcdfd45ead95222144f681
Stainless Cheese Grater Hand Crank Rotary Blade Vegetable Grinder Kitchen Tool,Stainless Cheese Grater Hand Crank Rotary Blade Vegetable Grinder Kitchen Tool,10.0,EUR,10.0,EUR,12,3,,,5.0,0.0,,,,,,,,,,,silver,,50,Livraison standard,3.0,false,,50,,,US,DIK ZKGSE,dikzkgse,92 % avis positifs (100 notes),100,4.41,5e62146329e7865394976245,,,https://www.wish.com/c/5f558fc775f3f7755ff39790,https://canary.contestimg.wish.com/api/webimage/5f558fc775f3f7755ff39790-medium.jpg,5f558fc775f3f7755ff39790
Rackpack Say Cheese - Boîte à vin et plateau à fromage,Rackpack Say Cheese - Wine box and Cheese board,32.0,EUR,32.0,EUR,38,0,,,5.0,0.0,,,,,,,,,,,,,19,Livraison Express,11.0,true,,19,true,Quantité limitée !,NL,ChannelDistribution,channeldistribution,"93 % avis positifs (1,369 notes)",1369,4.445580715850986,59f9adcd67e9be5762e8fb98,,,https://www.wish.com/c/59fc43f06ca56f26a679cae9,https://canary.contestimg.wish.com/api/webimage/59fc43f06ca56f26a679cae9-medium.jpg,59fc43f06ca56f26a679cae9
Déchiqueteuse de trancheuse de râpe de carotte de légumes de nourriture de fromage avec l'outil de cuisine de récipient,Cheese Food Vegetable Carrot Grater Slicer Shredder With Container Kitchen Tool,5.74,USD,5.74,USD,5.74,10,,,3.7450980392156863,51.0,25,9,6,1,10,,,,,,purple,,50,Livraison standard,1.0,false,,50,,,CN,minxuyou2017,minxuyou201755491574cc3711e6a5b40253a6fa4064,"(4,148 notes)",4148,4.119816779170685,58626ac62268454cca87d208,,,https://www.wish.com/c/5af025f0442be415743dc58b,https://canary.contestimg.wish.com/api/webimage/5af025f0442be415743dc58b-medium.jpg,5af025f0442be415743dc58b
Chocolate Fondue Set Ice Cream Pot Set Cheese Hot Pot Creative Chocolat Melt With Heating Machine DIY Melt Waterfall Pot,Chocolate Fondue Set Ice Cream Pot Set Cheese Hot Pot Creative Chocolat Melt With Heating Machine DIY Melt Waterfall Pot,21.0,EUR,21.0,EUR,25,0,,,5.0,0.0,,,,,,,,,,,red,czechrepublic,50,Livraison standard,12.0,false,,50,,,CA,11368796 CANADA CORPORATION,11368796canadacorporation,"80 % avis positifs (1,166 notes)",1166,3.9382504288164664,5ffb1f43fa8a25c707537989,,,https://www.wish.com/c/60154a9b02715846ec736cf4,https://canary.contestimg.wish.com/api/webimage/60154a9b02715846ec736cf4-medium.jpg,60154a9b02715846ec736cf4
CHINA Homemade Tofu Press Mold Maker DIY Plastic Tofu Cotton Cheese Cloth Making Machine Bakeware Mold Kitchen Utensil Set,CHINA Homemade Tofu Press Mold Maker DIY Plastic Tofu Cotton Cheese Cloth Making Machine Bakeware Mold Kitchen Utensil Set,79.0,EUR,79.0,EUR,95.0,0,,,5.0,0.0,,,,,,,,,,,multicolor,select,50,Livraison standard,12.0,false,,50,,,KR,GPOPMALL,gpopmall,69 % avis positifs (16 notes),16,3.6875,600bc259338f835382ad78e9,,,https://www.wish.com/c/605df3c666edb661c244a22d,https://canary.contestimg.wish.com/api/webimage/605df3c666edb661c244a22d-medium.jpg,605df3c666edb661c244a22d
6 PCS / ensemble En Acier Inoxydable Fourchette À Chocolat Hot Pot Fourchettes Fromage Fruits Dessert Fourche Fondue Fusion Brochette Cuisine Outils,6PCS/Set Stainless Steel Chocolate Fork Hot Pot Forks Cheese Fruit Dessert Fork Fondue Melting Skewer Kitchen Tools,5.0,EUR,5.0,EUR,6,10,,,4.0,9.0,6,1,0,0,2,,,,,,,6pcs,50,Livraison Express,8.0,true,,50,,,CN,Starry Furniture,starryfurniture,"93 % avis positifs (28,763 notes)",28763,4.375551924347252,5964291e366c062359319f3e,,,https://www.wish.com/c/5ac1ffd80548ea6caa4997a7,https://canary.contestimg.wish.com/api/webimage/5ac1ffd80548ea6caa4997a7-medium.jpg,5ac1ffd80548ea6caa4997a7
Acier inoxydable Trancheuse Fromage Râpe Fromage Cutter Fromage Making Tool Acier inoxydable,Stainless Steel Slicer Cheese Grater Cheese Cutter Cheese Making Tool Stainless Steel,7.0,EUR,7.0,EUR,8,1,,,5.0,0.0,,,,,,,,,,,,1pc,50,Livraison Express,7.0,true,,50,,,CN,liaishenhou,liaishenhou,"89 % avis positifs (6,950 notes)",6950,4.203021582733813,5ad00d9acd968d0acc1eebd8,,,https://www.wish.com/c/5e5fc7e49833d425c03492bf,https://canary.contestimg.wish.com/api/webimage/5e5fc7e49833d425c03492bf-medium.jpg,5e5fc7e49833d425c03492bf
3 Pcs En Plastique Tofu Presse Moule DIY Maison Tofu Maker En Pressant Moule Kit + Fromage Tissu Cuisine Outil tofu moule,3Pcs Plastic Tofu Press Mould DIY Homemade Tofu Maker Pressing Mold Kit + Cheese Cloth Kitchen Tool tofu mold,7.0,EUR,7.0,EUR,8,10,,,4.0,1.0,0,1,0,0,0,,,,,,,,50,Livraison standard,2.0,false,,50,,,CN,Andy' store,andystore,(426 notes),426,4.60093896713615,54bfca6ed7df3c588750fbef,,,https://www.wish.com/c/592014516b5def214f144870,https://canary.contestimg.wish.com/api/webimage/592014516b5def214f144870-medium.jpg,592014516b5def214f144870
Râpe à fromage rotative 1 lames de tambour trancheuse chocolat carotte acier inoxydable nouveau,Rotary Cheese Grater 1 Drums Blades Slicer Chocolate Carrot Stainless Steel New,8.0,EUR,8.0,EUR,9,10,,,3.7777777777777777,9.0,4,3,0,0,2,,,,,,,,50,Livraison standard,3.0,false,,50,,,CN,idealhereqq,idealhereqq,"91 % avis positifs (14,906 notes)",14906,4.327049510264323,58a51e935779380eeca8bf6b,,,https://www.wish.com/c/5b3b1564f791d662faf1d66e,https://canary.contestimg.wish.com/api/webimage/5b3b1564f791d662faf1d66e-medium.jpg,5b3b1564f791d662faf1d66e
3D Plusieurs Formes Silicone Gâteau Décoration Moule Pour Cuisson Moule Dessert Mousse Fromage Pâtisserie Pan Ustensiles de Cuisson Outils,3D Multiple Shapes Silicone Cake Decorating Mold For Baking Mould Dessert Mousse Cheese Pastry Pan Bakeware Tools,10.0,EUR,10.0,EUR,11,10,,,5.0,0.0,,,,,,,,,,,,style1,50,Livraison standard,3.0,false,,50,,,CN,mamaxbd,mamaxbd,"91 % avis positifs (6,451 notes)",6451,4.2866222291117655,58ef59aec1c94c15678e2f36,,,https://www.wish.com/c/5f6ae1ea6e436c073858ec97,https://canary.contestimg.wish.com/api/webimage/5f6ae1ea6e436c073858ec97-medium.jpg,5f6ae1ea6e436c073858ec97
"Biscuit à saveur de fromage Doritos Nacho, 172g, 12ea","Doritos Nacho Cheese Flavor Cookie, 172g, 12ea",160.0,EUR,160.0,EUR,193.0,0,,,5.0,0.0,,,,,,,,,,,,,50,Livraison standard,12.0,false,,50,true,Quantité limitée !,KR,top korea seller,topkoreaseller,50 % avis positifs (2 notes),2,3.0,5ff4782d45e0239ccc5a5c96,,,https://www.wish.com/c/5ff84d979b9ad4677650be63,https://canary.contestimg.wish.com/api/webimage/5ff84d979b9ad4677650be63-medium.jpg,5ff84d979b9ad4677650be63
