title,title_orig,discount_price,discount_price_currency,retail_price,retail_price_currency,discount_price_in_original_currency,nb_cart_orders_approx,nb_units_purchased_approx,uses_ad_boosts,rating,rating_count,rating_five_count,rating_four_count,rating_three_count,rating_two_count,rating_one_count,badges_count,badge_local_product,badge_product_quality,badge_fast_shipping,tags,product_color,product_variation_size_id,product_variation_inventory,shipping_option_name,shipping_option_price,shipping_is_express,countries_shipped_to,inventory_total,has_urgency_banner,urgency_text,origin_country,merchant_title,merchant_name,merchant_info_subtitle,merchant_rating_count,merchant_rating,merchant_id,merchant_has_profile_picture,merchant_profile_picture,product_url,product_picture,product_id
Cheese Mug - I Make Cheese Disappear What's Your Superpower - Cheese Gift - Cheese Lovers,Cheese Mug - I Make Cheese Disappear What's Your Superpower - Cheese Gift - Cheese Lovers,21.0,EUR,21.0,EUR,25,0,,,5.0,0.0,,,,,,,,,,,white,11oz,50,Livraison Express,7.0,true,,50,,,VN,PaulStore97,paulstore97,63 % avis positifs (8 notes),8,3.5,5f97dad3f78021299c840c3f,,,https://www.wish.com/c/5fc313efccf7f49895f9bccc,https://canary.contestimg.wish.com/api/webimage/5fc313efccf7f49895f9bccc-medium.jpg,5fc313efccf7f49895f9bccc
"Natural Core Cheese Chups 16g Apple 15p Strawberry 15p Gum, 30p","Natural Core Cheese Chups 16g Apple 15p Strawberry 15p Gum, 30p",44.0,EUR,44.0,EUR,53.0,0,,,5.0,0.0,,,,,,,,,,,,,50,Livraison standard,12.0,false,,50,,,KR,easternlight,easternlight,,0,5.0,600406cb1f399b3b274795fc,,,https://www.wish.com/c/601b8359f5aeb36ff35c8dac,https://canary.contestimg.wish.com/api/webimage/601b8359f5aeb36ff35c8dac-medium.jpg,601b8359f5aeb36ff35c8dac
"Cheesy Dreamer Mug - cheese lover mug, cheese mug, cheese gift, cheese lover gift, cheese enthusiast, funny cheese gift, funny cheese mug","Cheesy Dreamer Mug - cheese lover mug, cheese mug, cheese gift, cheese lover gift, cheese enthusiast, funny cheese gift, funny cheese mug",19.0,EUR,19.0,EUR,23,0,,,5.0,0.0,,,,,,,,,,,white,11oz,50,Livraison Express,6.0,true,,50,true,Quantité limitée !,VN,HailStore,hailstore,75 % avis positifs (4 notes),4,4.25,5fa6a657c791dfd2d48fd9a4,,,https://www.wish.com/c/5fc4f72405ceca18afa128d0,https://canary.contestimg.wish.com/api/webimage/5fc4f72405ceca18afa128d0-medium.jpg,5fc4f72405ceca18afa128d0
outil de chen Tofu Maker moule de presse avec tissu de fromage moule de pressage bricolage,chen Tool Tofu Maker Press Mold With Cheese Cloth DIY Pressing Mould,6.0,EUR,6.0,EUR,7,10,,,3.625,8.0,4,1,0,2,1,,,,,,,,50,Livraison standard,2.0,false,,50,,,CN,Sammy ,yiwuelectronicinternational,"89 % avis positifs (142,627 notes)",142627,4.166097583206546,5406cabdc5c2464980dc6314,,,https://www.wish.com/c/5abe168e57085921c518c799,https://canary.contestimg.wish.com/api/webimage/5abe168e57085921c518c799-medium.jpg,5abe168e57085921c518c799
2 pièces couteau à beurre dentelé en acier inoxydable crème spatule épandeur de fromage pour gâteau plus lisse pâtisserie décor,2pcs Stainless Steel Serrated Butter Knife Cream Spatula Cheese Spreader for Cake Smoother Pastry Decor,10.0,EUR,10.0,EUR,11,10,,,4.8,5.0,4,1,0,0,0,,,,,,,2pcs,50,Livraison standard,2.0,false,,50,,,CN,goodluck.hk,goodluckhk,"93 % avis positifs (19,286 notes)",19286,4.387742403816239,57ade1f8ddd46f21ef2715f2,,,https://www.wish.com/c/5d3fab9a8527c7660d478729,https://canary.contestimg.wish.com/api/webimage/5d3fab9a8527c7660d478729-medium.jpg,5d3fab9a8527c7660d478729
Easy To Use Cheese Planer Cheese Grater For Restaurant Home Kitchen Shredder,Easy To Use Cheese Planer Cheese Grater For Restaurant Home Kitchen Shredder,19.0,EUR,19.0,EUR,22,0,,,5.0,0.0,,,,,,,,,,,,,10,Livraison Express,5.0,true,,10,,,CN,CCYshop,ccyshop,"90 % avis positifs (19,661 notes)",19661,4.250038146584609,583bec62fef4090757027908,,,https://www.wish.com/c/60165d712857481c9715ce5c,https://canary.contestimg.wish.com/api/webimage/60165d712857481c9715ce5c-medium.jpg,60165d712857481c9715ce5c
Tofu Maker Press Mold Kit + Cheese Cloth DIY Soy Pressing Mould Kitchen Tool Set,Tofu Maker Press Mold Kit + Cheese Cloth DIY Soy Pressing Mould Kitchen Tool Set,7.0,EUR,10.0,EUR,8,2,,,5.0,0.0,,,,,,,,,,,,1limitedquantity,10,Livraison standard,2.0,false,,50,,,CN,zq-1,zq1,90 % avis positifs (594 notes),594,4.316498316498317,58cfae30018a965060984591,,,https://www.wish.com/c/5f8026a89155d20045fc0c92,https://canary.contestimg.wish.com/api/webimage/5f8026a89155d20045fc0c92-medium.jpg,5f8026a89155d20045fc0c92
Râpe à fromage manuelle multifonctionnelle Râpe à fromage Râpe à légumes Râpe à légumes Coupe-légumes Outils de cuisine,Multifunctional Manual Vegetable Spiral Slicer Cheese Grater Vegetable Cutter Kitchen Tools,16.0,EUR,16.0,EUR,19,10,,,4.125,16.0,9,4,1,0,2,,,,,,,lightgreen,2,Livraison standard,5.0,false,,50,,,CN,poqxmia,poqxmia,"86 % avis positifs (2,588 notes)",2588,4.079984544049459,5af9119a5ccdca024c2e2648,,,https://www.wish.com/c/5cb839bcaff93c467746b36f,https://canary.contestimg.wish.com/api/webimage/5cb839bcaff93c467746b36f-medium.jpg,5cb839bcaff93c467746b36f
Moule de presse de tofu en plastique bricolage Moule de tofu fait maison Tofu de caillé de soja Fabrication de moule avec un ensemble d'outils de cuisine de cuisine en tissu de fromage (sans tissu),DIY Plastic Tofu Press Mold Homemade Tofu Mold Soybean Curd Tofu Making Mold with Cheese Cloth Kitchen Cooking Tool Set (Without Fabric),5.0,EUR,5.0,EUR,5,10,,,5.0,2.0,2,0,0,0,0,,,,,,,1pcs,50,Livraison standard,1.0,false,,50,,,CN,uuwywiaq,uuwywiaq,"90 % avis positifs (2,768 notes)",2768,4.240245664739884,5ae94014d204cc1bc913eb8d,,,https://www.wish.com/c/5b4e97c5ebcafb6b9d95c2aa,https://canary.contestimg.wish.com/api/webimage/5b4e97c5ebcafb6b9d95c2aa-medium.jpg,5b4e97c5ebcafb6b9d95c2aa
2018 ronde en ardoise naturelle diamètre 15 cm 20 cm 25 cm 30 cm plateau en pierre solide fromage nourriture Pizza Steak plat assiette plate plateau de fruits,2018 Round Natural Slate Plate Diameter 15cm 20cm 25cm 30cm Solid Stone Tray Cheese Food Pizza Steak Dish Flat Plate Fruit Tray ,10.0,EUR,10.0,EUR,11,4,,,3.3333333333333335,3.0,1,1,0,0,1,,,,,,black,dia10cm,49,Livraison standard,3.0,false,,50,,,CN,CY Jelwery Store,cyjelwerystore,90 % avis positifs (497 notes),497,4.323943661971831,5af901567824ca30214185ef,,,https://www.wish.com/c/5b169afcc2394e16eda4934f,https://canary.contestimg.wish.com/api/webimage/5b169afcc2394e16eda4934f-medium.jpg,5b169afcc2394e16eda4934f
0.53 Gallon Fruit Press Aluminum Stainless Steel Tincture Cheese Wine Juice Cider Brewing Squeezer Equipment ,0.53 Gallon Fruit Press Aluminum Stainless Steel Tincture Cheese Wine Juice Cider Brewing Squeezer Equipment ,73.0,EUR,73.0,EUR,88.0,0,,,5.0,0.0,,,,,,,,,,,,,18,Livraison Express,12.0,true,,18,true,Quantité limitée !,CN,cutelly,cutelly,,0,5.0,5f86560cfb205d893c4b89dd,,,https://www.wish.com/c/607eb16f26f1a632c6ea3e24,https://canary.contestimg.wish.com/api/webimage/607eb16f26f1a632c6ea3e24-medium.jpg,607eb16f26f1a632c6ea3e24
2018 outils de cuisine créatifs fromage alimentaire légume carotte râpe trancheuse déchiqueteuse avec récipient,2018 Creative Kitchen Tools Cheese Food Vegetable Carrot Grater Slicer Shredder With Container,4.7,EUR,5.0,EUR,5.7,10,,,3.6666666666666665,3.0,2,0,0,0,1,,,,,,rosered,,50,Livraison Express,4.0,true,,50,,,CN,Do not allow time to stay on the road of life,donotallowtimetostayontheroadoflife,"92 % avis positifs (28,094 notes)",28094,4.330604399515911,58528c0530157e4ded3f3083,,,https://www.wish.com/c/5f31ee6b706a950046577636,https://canary.contestimg.wish.com/api/webimage/5f31ee6b706a950046577636-medium.jpg,5f31ee6b706a950046577636
1 couteau à fromage en plastique outil de cuisine coupe-pizza à fromage trancheuse à foie gras,1 Pc Plastic Cheese Knife Kitchen Tool Cheese Pizza Cutter Foie Gras Slicer,3.89,EUR,4.0,EUR,4.71,1,,,5.0,0.0,,,,,,,,,,,,1pc,50,Livraison Express,8.0,true,,50,,,US,HegubeilugBp,hegubeilugbp,91 % avis positifs (552 notes),552,4.324275362318841,5e6b40b8151d567078ccc847,,,https://www.wish.com/c/5ecde1ab44a6b21c7617084b,https://canary.contestimg.wish.com/api/webimage/5ecde1ab44a6b21c7617084b-medium.jpg,5ecde1ab44a6b21c7617084b
Outil de cuisine de planche à découper de beurre de trancheuse de fromage d'argent largement utilisé en acier inoxydable,Stainless Steel Widely Used Silver Cheese Slicer Butter Cutting Board Kitchen Tool,5.0,EUR,5.0,EUR,6,10,,,4.08,50.0,32,4,7,0,7,,,,,,,1pc,50,Livraison Express,5.0,true,,50,,,CN,tajt123,tajt123,"91 % avis positifs (3,646 notes)",3646,4.293198025233132,5acc83372dde5e3a868d0eae,,,https://www.wish.com/c/5b6be4dc24518052c43b4841,https://canary.contestimg.wish.com/api/webimage/5b6be4dc24518052c43b4841-medium.jpg,5b6be4dc24518052c43b4841
Bamboo Cheese Cutting Board With Knives Fork Shovel Sets Cutlery Kit Kitchen Cooking Tools,Bamboo Cheese Cutting Board With Knives Fork Shovel Sets Cutlery Kit Kitchen Cooking Tools,68.0,EUR,68.0,EUR,82.0,0,,,5.0,0.0,,,,,,,,,,,,,10,Livraison Express,12.0,true,,10,true,Quantité limitée !,CN,lanqishop,lanqishop,"87 % avis positifs (145,141 notes)",145141,4.131644400961823,5754e27d9c9b9e5ccd8d41b9,,,https://www.wish.com/c/5fe860803d2a4c2aec31b264,https://canary.contestimg.wish.com/api/webimage/5fe860803d2a4c2aec31b264-medium.jpg,5fe860803d2a4c2aec31b264
Bestpysanky,,,,,,,,,,,,,,,,,,,,,,,,,,,,,,,,,,,,,,,,,https://www.wish.com/c/5f58b5e090b8a60d2d4671e8,,5f58b5e090b8a60d2d4671e8
Coupe-légumes Accessoires de cuisine Trancheuse à mandoline Coupe-fruits Éplucheuse de pommes de terre Râpe à carotte Râpe à légumes,Vegetable cutter Kitchen accessories Mandoline Slicer Fruit Cutter Potato Peeler Carrot Cheese Grater vegetable slicer,19.0,EUR,19.0,EUR,22,10,,,4.826086956521739,23.0,19,4,0,0,0,,,,,,grey&green,,50,Livraison standard,6.0,false,,50,,,CN,Rayo Container,rayocontainer,"94 % avis positifs (38,745 notes)",38745,4.462124145050974,570aff6dfa6bee7a679b8fc7,,,https://www.wish.com/c/5e72e66fe996af0266becb5f,https://canary.contestimg.wish.com/api/webimage/5e72e66fe996af0266becb5f-medium.jpg,5e72e66fe996af0266becb5f
Moes,,,,,,,,,,,,,,,,,,,,,,,,,,,,,,,,,,,,,,,,,https://www.wish.com/c/5eeb498ceb31f989ee1059db,,5eeb498ceb31f989ee1059db
Fromage Binggrae Pororo et ses amis,Binggrae Pororo and Friends Cheese,48.0,EUR,48.0,EUR,57.0,0,,,5.0,0.0,,,,,,,,,,,,,40,Livraison standard,12.0,false,,40,,,KR,K_market,k_market,80 % avis positifs (5 notes),5,3.6,5fb0fa5e3852e8c5c9fdc753,,,https://www.wish.com/c/5fdce5b875635b68a0f7b425,https://canary.contestimg.wish.com/api/webimage/5fdce5b875635b68a0f7b425-medium.jpg,5fdce5b875635b68a0f7b425
DIY En Plastique Tofu Presse Moule Fait Maison Tofu Moule Soja Curd Tofu Faire Moule avec Fromage Tissu Cuisine Cuisine Ensemble D'outils,DIY Plastic Tofu Press Mould Homemade Tofu Mold Soybean Curd Tofu Making Mold with Cheese Cloth Kitchen Cooking Tool Set,7.0,EUR,7.0,EUR,8,10,,,4.0,13.0,7,2,2,1,1,,,,,,beige,,50,Livraison Express,7.0,true,,50,true,Quantité limitée !,CN,liuhaiqingai,liuhaiqingai,"88 % avis positifs (9,707 notes)",9707,4.132790769547749,5acad7b4e0538871f1dc8339,,,https://www.wish.com/c/5aefb8b9ce122613b9c54b93,https://canary.contestimg.wish.com/api/webimage/5aefb8b9ce122613b9c54b93-medium.jpg,5aefb8b9ce122613b9c54b93
Multifonctionnel manuel légumes spirale trancheuse râpe à fromage tambour à main râpe rotative coupe-légumes outils de cuisine,Multifunctional Manual Vegetable Spiral Slicer Cheese Grater Hand Drum Rotary Grater Vegetable Cutter Kitchen Tools,15.0,EUR,15.0,EUR,18,2,,,5.0,0.0,,,,,,,,,,,blue,,50,Livraison standard,5.0,false,,50,,,US,ShaolanbinTa,shaolanbinta,88 % avis positifs (77 notes),77,4.077922077922078,5e6b8e913a00e7b172b728a8,,,https://www.wish.com/c/5fabb41a56ef7c004ba4697c,https://canary.contestimg.wish.com/api/webimage/5fabb41a56ef7c004ba4697c-medium.jpg,5fabb41a56ef7c004ba4697c
"Générateur de fumée froide, fumage à chaud ou à froid sur n'importe quel barbecue et fumoir, parfait pour le saumon fumé, le fromage, le porc et plus, temps de fumée jusqu'à 4-7 heures","Cold Smoke Generator, Hot or Cold Smoking on Any BBQ Grill and Smoker, Perfect for Smoked Salmon, Cheese, Pork and More, Smoke Time up to 4-7 Hours",14.0,EUR,33.0,EUR,16,7,,,4.5,2.0,1,1,0,0,0,,,,,,,,50,Livraison standard,5.0,false,,50,,,CN,jinchangsheng,jinchangsheng,92 % avis positifs (63 notes),63,4.412698412698413,5e16ee5b8ea5a70754448794,,,https://www.wish.com/c/5f8a98cf664b0c92fd053188,https://canary.contestimg.wish.com/api/webimage/5f8a98cf664b0c92fd053188-medium.jpg,5f8a98cf664b0c92fd053188
"Nacho Cheese Sauce Powder Mix, 29 Ounces, Pack of 2","Nacho Cheese Sauce Powder Mix, 29 Ounces, Pack of 2",43.0,EUR,52.0,EUR,51.0,0,,,5.0,0.0,,,,,,,,,,,,,2,Livraison standard,12.0,false,,2,true,Quantité limitée !,US,LetsMakeADealToday,letsmakeadealtoday,88 % avis positifs (249 notes),249,4.397590361445783,5e25bf443a003e80bfadbc3e,,,https://www.wish.com/c/6047399a7bdda5cbb60ccb60,https://canary.contestimg.wish.com/api/webimage/6047399a7bdda5cbb60ccb60-medium.jpg,6047399a7bdda5cbb60ccb60
1 PC acier inoxydable grattoir à chocolat râpe à fromage lame de beurre couteau coupe gâteau décoration outil outils de cuisson Gadget,1PC Stainless Steel Chocolate Scraper Cheese Grater Butter Blade Knife Cutter Cake Decorating Tool Baking Tools Gadget,4.0,EUR,4.0,EUR,4,2,,,5.0,0.0,,,,,,,,,,,silver,,50,Livraison Express,8.0,true,,50,true,Quantité limitée !,US,HuibashaowKv,huibashaowkv,83 % avis positifs (236 notes),236,3.8347457627118646,5e6b96f28d68d2b5ada06b53,,,https://www.wish.com/c/5f865d48a693bc072336c09b,https://canary.contestimg.wish.com/api/webimage/5f865d48a693bc072336c09b-medium.jpg,5f865d48a693bc072336c09b
Hisense,,,,,,,,,,,,,,,,,,,,,,,,,,,,,,,,,,,,,,,,,https://www.wish.com/c/5efb1b82eb31f93761263157,,5efb1b82eb31f93761263157
5pcs Stainless Steel Cheese Grater Hand Held Rotary Shredder Cutter Slicer Sharp,5pcs Stainless Steel Cheese Grater Hand Held Rotary Shredder Cutter Slicer Sharp,16.0,EUR,16.0,EUR,19,1,,,5.0,0.0,,,,,,,,,,,,5pcs/set,50,Livraison standard,5.0,false,,50,,,CN,salmon,salmon,"88 % avis positifs (2,349 notes)",2349,4.174968071519796,572b0d0024799c5a97088687,,,https://www.wish.com/c/6074386aa84251413902918d,https://canary.contestimg.wish.com/api/webimage/6074386aa84251413902918d-medium.jpg,6074386aa84251413902918d
KOREA Cheese shaker Salt shaker Pepper shaker Seasoning shaker Sugar shaker Cheese powder jar Small,KOREA Cheese shaker Salt shaker Pepper shaker Seasoning shaker Sugar shaker Cheese powder jar Small,49.0,EUR,49.0,EUR,59.0,0,,,5.0,0.0,,,,,,,,,,,multicolor,select,50,Livraison standard,12.0,false,,50,true,Quantité limitée !,KR,GPOPMALL,gpopmall,69 % avis positifs (16 notes),16,3.6875,600bc259338f835382ad78e9,,,https://www.wish.com/c/6023cc3956ab3bb447a78e8a,https://canary.contestimg.wish.com/api/webimage/6023cc3956ab3bb447a78e8a-medium.jpg,6023cc3956ab3bb447a78e8a
Multifunctional 3 in 1 Manual Vegetable Spiral Slicer Cheese Grater Hand Drum Rotary Grater Vegetable Cutter Potato Slicer FR,Multifunctional 3 in 1 Manual Vegetable Spiral Slicer Cheese Grater Hand Drum Rotary Grater Vegetable Cutter Potato Slicer FR,28.0,EUR,28.0,EUR,33,0,,,5.0,0.0,,,,,,,,,,,,1pcswith2blades,50,Livraison Express,8.0,true,,50,,,CN,resageopa,resageopa,100 % avis positifs (2 notes),2,5.0,5e93c48e418678081aca94d7,,,https://www.wish.com/c/5fcf512d0c76df60a79779a1,https://canary.contestimg.wish.com/api/webimage/5fcf512d0c76df60a79779a1-medium.jpg,5fcf512d0c76df60a79779a1
Trancheuse à légumes multifonctionnelle à trois lames spiraleuse manuelle à la main rapide hachoir à légumes coupe-fromage aux fruits,Multifunctional Tri-Blade Spiralizer Vegetable Slicer Manual Hand Speedy Safe Vegetables Chopper Fruit Cheese Cutter,23.0,EUR,23.0,EUR,27,0,,,5.0,0.0,,,,,,,,,,,green,,20,Livraison Express,7.0,true,,20,true,Quantité limitée !,CN,apicklot,pixiepace,"92 % avis positifs (10,147 notes)",10147,4.376465950527249,59dae1ccb90118619842662c,,,https://www.wish.com/c/601115394de44e0493daf101,https://canary.contestimg.wish.com/api/webimage/601115394de44e0493daf101-medium.jpg,601115394de44e0493daf101
Râpe à fromage rotative 1 lames de tambour trancheuse chocolat carotte acier inoxydable nouveau,Rotary Cheese Grater 1 Drums Blades Slicer Chocolate Carrot Stainless Steel New,13.0,USD,13.0,USD,13,10,,,4.139130434782609,115.0,62,28,12,5,8,,,,,,,,50,Livraison standard,3.0,false,,50,true,Quantité limitée !,CN,"guangzhou manyi trade co.,Ltd",guangzhoumanyitradecoltd,"93 % avis positifs (183,342 notes)",183342,4.369789791755299,55fd10378d034042efeb152d,,,https://www.wish.com/c/5a2f8bbe6cecb938c0f02a77,https://canary.contestimg.wish.com/api/webimage/5a2f8bbe6cecb938c0f02a77-medium.jpg,5a2f8bbe6cecb938c0f02a77
4 pièces / ensemble couteaux à fromage couverts en acier inoxydable trancheuse et coupe-fromage manche en bois Mini couteau couteau à beurre spatule et fourchette,4pcs/set Stainless Steel Covered Cheese Knives Cheese Slicer and Cutter Wood Handle Mini Knife Butter Knife Spatula and Fork,8.0,EUR,17.0,EUR,9,10,,,1.75,4.0,0,1,0,0,3,,,,,,,4pcs/set,50,Livraison standard,3.0,false,,50,,,CN,Ling Trade,lingtrade,"92 % avis positifs (4,409 notes)",4409,4.29938761623951,563c642978bc3937916cc94a,,,https://www.wish.com/c/5fc73a8f5de9a443aae20cae,https://canary.contestimg.wish.com/api/webimage/5fc73a8f5de9a443aae20cae-medium.jpg,5fc73a8f5de9a443aae20cae
Stainless Steel Butter Knife Cheese Dessert Jam Knife Cutlery Tool  Kitchen Toast Bread Knife Tableware,Stainless Steel Butter Knife Cheese Dessert Jam Knife Cutlery Tool  Kitchen Toast Bread Knife Tableware,4.66,EUR,5.0,EUR,5.65,10,,,5.0,0.0,,,,,,,,,,,silver,,6,Livraison standard,1.0,false,,50,,,CN,maoyi13,maoyi13,67 % avis positifs (89 notes),89,3.460674157303371,5f505c40f99467fd4f55994c,,,https://www.wish.com/c/6051b97642bea12c7f5b9fcd,https://canary.contestimg.wish.com/api/webimage/6051b97642bea12c7f5b9fcd-medium.jpg,6051b97642bea12c7f5b9fcd
"Kitchen Slicer Vegetable Cutter Grater Chopper Julienne Slicer Cutter for Potato,Tomato,Onion,Cheese,Cucumber - 6 Interchangeable Blades with Peeler,Hand Protector,Food Storage Container","Kitchen Slicer Vegetable Cutter Grater Chopper Julienne Slicer Cutter for Potato,Tomato,Onion,Cheese,Cucumber - 6 Interchangeable Blades with Peeler,Hand Protector,Food Storage Container",12.0,EUR,141.0,EUR,14,5,,,3.0,1.0,0,0,1,0,0,,,,,,,,50,Livraison standard,4.0,false,,50,,,CN,ngFu1992chil,ngfu1992chil,63 % avis positifs (175 notes),175,3.16,5d5cafaf1d862934ccbfd4f4,,,https://www.wish.com/c/5f2e6d9612c0430051fed46c,https://canary.contestimg.wish.com/api/webimage/5f2e6d9612c0430051fed46c-medium.jpg,5f2e6d9612c0430051fed46c
Professionnel Pizza Cutter En Acier Inoxydable Demi-Cercle Gâteau Pain Fromage Rouleau Rocker Trancheuse Hob Raclette Conseil Couteau De Cuisson,Professional Pizza Cutter Stainless Steel Semicircle Cake Bread Cheese Roll Rocker Slicer Hob Squeegee Board Baking Knife,7.0,EUR,25.0,EUR,8,10,,,3.9322033898305087,59.0,34,10,2,3,10,,,,,,,,50,Livraison standard,2.0,false,,50,,,CN,BEST-FASHION-HYD,bestfashionhyd,"(10,627 notes)",10627,4.269972711019102,56fe2de25cbb5a218c49607c,,,https://www.wish.com/c/58fdd124144ed2226367a071,https://canary.contestimg.wish.com/api/webimage/58fdd124144ed2226367a071-medium.jpg,58fdd124144ed2226367a071
Plateau en bambou de service de stockage plateau de pâtisserie de thé plateau de gâteau de plateau de fromages vaisselle écologique assiettes en bois outils de cuisine pour la fête,Round Bamboo Serving Storage Tray Tea Pastry Cake Tray Cheese Board Tableware Eco Friendly Wooden Plates Kitchen Tools for Party,23.0,EUR,37.0,EUR,27,10,,,3.5,4.0,1,2,0,0,1,,,,,,beige,s,50,Livraison standard,8.0,false,,50,,,CN,"Fulgurous Tech Co. Ltd,",fulguroustechcoltd,"92 % avis positifs (2,586 notes)",2586,4.398685228151585,54a153de1c3ab21aa4db810c,,,https://www.wish.com/c/59838369cc17ce71157de36a,https://canary.contestimg.wish.com/api/webimage/59838369cc17ce71157de36a-medium.jpg,59838369cc17ce71157de36a
Hachoir à légumes Trancheuse à légumes manuelle Coupe-fruits à légumes efficace et rapide Déchiqueteuse à fromage Râpe à tambour rotatif rapide Trancheuse,Vegetable Chopper Manual Vegetable Slicer Efficient and Fast Vegetable Fruit Cutter Cheese Shredder Speedy Rotary Drum Grater Slicer,17.0,EUR,17.0,EUR,20,10,,,4.0,1.0,0,1,0,0,0,,,,,,red,stylea,50,Livraison standard,6.0,false,,50,,,CN,qiaopinye,qiaopinye,"92 % avis positifs (4,342 notes)",4342,4.357669276830953,5a378460471c141067102a77,,,https://www.wish.com/c/5f3f9310a05c4e2ce85edcc9,https://canary.contestimg.wish.com/api/webimage/5f3f9310a05c4e2ce85edcc9-medium.jpg,5f3f9310a05c4e2ce85edcc9
"Carbon Steel Candlelight Cheese Melter Pan, Raclette Cheese Melter, Portable for Home for Kitchen","Carbon Steel Candlelight Cheese Melter Pan, Raclette Cheese Melter, Portable for Home for Kitchen",15.0,EUR,15.0,EUR,17,0,,,5.0,0.0,,,,,,,,,,,,,10,Livraison Express,5.0,true,,10,,,CN,Angrybaby,angrybaby,"86 % avis positifs (1,609 notes)",1609,4.083903045369795,5b374d0848fca93ec19818be,,,https://www.wish.com/c/5fca49264ebd011fd4223811,https://canary.contestimg.wish.com/api/webimage/5fca49264ebd011fd4223811-medium.jpg,5fca49264ebd011fd4223811
1 pièces coupe-fil coupe-fromage coupe-couteau cuisine en acier inoxydable planche coupe-beurre tranche de fromage couteau de coupe de fromage,1Pcs Wire Cutting Cheese Slicer Cutter Kitchen Stainless Steel Board Butter Cutter Cheese Slice Cheese Cutting Knife,35.0,EUR,35.0,EUR,42,0,,,5.0,0.0,,,,,,,,,,,,,50,Livraison standard,12.0,false,,50,,,CN,WERXDVDGDF,werxdvdgdf,89 % avis positifs (98 notes),98,4.23469387755102,5e147b19c2f163df7d52cdc3,,,https://www.wish.com/c/601a3b230441fd1d1b6c6456,https://canary.contestimg.wish.com/api/webimage/601a3b230441fd1d1b6c6456-medium.jpg,601a3b230441fd1d1b6c6456
Boîte de plateau de plat de fromage de beurre d'acier inoxydable de stockage de nourriture de récipient de dessert avec le couvercle,Stainless Steel Butter Cheese Dish Tray Box Food Storage Dessert Container Keeper with Lid,12.0,EUR,12.0,EUR,14,10,,,5.0,0.0,,,,,,,,,,,,,50,Livraison standard,3.0,false,,50,,,CN,pengpengnvzhuang,pengpengnvzhuang,"82 % avis positifs (2,140 notes)",2140,3.9495327102803737,5b3dc48c0b220e14d4bce98a,,,https://www.wish.com/c/5dc9321fd38d99497da73be9,https://canary.contestimg.wish.com/api/webimage/5dc9321fd38d99497da73be9-medium.jpg,5dc9321fd38d99497da73be9
Planche à découper à fromage en bambou ensemble de couverts couteau cadeau en bois Charcuterie viande plateau de service chb,Bamboo Cheese Cutting Board Cutlery Set Knife Gift Wooden Charcuterie Meat Serving Tray chb,62.0,EUR,62.0,EUR,75.0,1,,,5.0,0.0,,,,,,,,,,,,,49,Livraison standard,12.0,false,,49,true,Quantité limitée !,CN,chengbin456,chengbin456,"92 % avis positifs (1,578 notes)",1578,4.333333333333333,5b9a1fc020019042f37ba5b8,,,https://www.wish.com/c/600cb610cc6f9f1f61cf656b,https://canary.contestimg.wish.com/api/webimage/600cb610cc6f9f1f61cf656b-medium.jpg,600cb610cc6f9f1f61cf656b
Télécommande sans fil Double Vibration 3 Moteur Chauffage Papillon Clitoris Vibrateur Plug Anus Pénétration Gode Sex Toys X557,Wireless Remote Control Double Vibration 3 Motor Heating Butterfly Clitoris Vibrator Plug Anus Penetration Dildo Sex Toys X557,15.0,EUR,24.0,EUR,18,10,,,4.103448275862069,29.0,18,5,1,1,4,,,,,,purple,novibrationnoheating,5,Livraison standard,5.0,false,,24,,,CN,Qiudiwei-222555,qiudiwei222555,"84 % avis positifs (2,707 notes)",2707,3.9368304396010343,5dda255c80fb8239e94510de,,,https://www.wish.com/c/5eeb768945ce2340f85b42c7,https://canary.contestimg.wish.com/api/webimage/5eeb768945ce2340f85b42c7-medium.jpg,5eeb768945ce2340f85b42c7
Épandeur à sandwich Couteau à beurre Grattoir Trancheuse à fromage Spatule en acier inoxydable TT,Sandwich Spreader Butter Knife Scraper Cheese Slicer Stainless Steel Spatula TT,3.12,EUR,9.0,EUR,3.7800000000000002,10,,,5.0,3.0,3,0,0,0,0,,,,,,,,50,Livraison standard,1.0,false,,50,,,CN,Sunny Growth,sunnygrowth,"92 % avis positifs (12,993 notes)",12993,4.311321480797353,56e7d30b21790d269c149384,,,https://www.wish.com/c/5ce8a2e23818e47eb5b52139,https://canary.contestimg.wish.com/api/webimage/5ce8a2e23818e47eb5b52139-medium.jpg,5ce8a2e23818e47eb5b52139
4 types de râpe à fromage à main en acier inoxydable râpes de cuisine polyvalentes pour fromage chocolat beurre fruits légumes,4 Types Stainless Steel Handheld Cheese Grater Multi-purpose Kitchen Food Graters for Cheese Chocolate Butter Fruit Vegetable,4.73,EUR,5.0,EUR,5.73,4,,,5.0,0.0,,,,,,,,,,,,1-mhole,50,Livraison standard,2.0,false,,50,,,CN,PocketSelect,pocketselect,"92 % avis positifs (3,604 notes)",3604,4.444783573806881,58c9fdd96a987d505d823479,,,https://www.wish.com/c/5fb5e803cb89053bcbbd9cc6,https://canary.contestimg.wish.com/api/webimage/5fb5e803cb89053bcbbd9cc6-medium.jpg,5fb5e803cb89053bcbbd9cc6
"White+Orange Sealing Machine, Vacuum Sealer, for Meat Vegetable Fruits Cheese","White+Orange Sealing Machine, Vacuum Sealer, for Meat Vegetable Fruits Cheese",23.0,EUR,23.0,EUR,27,1,,,5.0,0.0,,,,,,,,,,,,euplug,50,Livraison standard,7.0,false,,50,,,CN,sikayishop,smashinging,89 % avis positifs (727 notes),727,4.2214580467675376,5b46f2a2e4b3fb23f0eaf3a0,,,https://www.wish.com/c/5fc92482a79b9ae22d4478b5,https://canary.contestimg.wish.com/api/webimage/5fc92482a79b9ae22d4478b5-medium.jpg,5fc92482a79b9ae22d4478b5
Machine à fromage en plastique micro-ondes sain pour la fabrication de fromage contient des recettes de cuisine à domicile cuisine Dessert pâtisserie tarte outil,Cheese Maker Microwave Plastic Healthy For Making Cheese Contains Recipes Home Cooking Kitchen Dessert Pastry Pie Tool,12.0,EUR,12.0,EUR,14,10,,,3.8518518518518516,27.0,13,6,2,3,3,,,,,,,,50,Livraison standard,3.0,false,,50,true,Quantité limitée !,CN,taihong,台红,"87 % avis positifs (3,274 notes)",3274,4.130421502748931,54ab31faffff657b8d15ff02,,,https://www.wish.com/c/59ce2d16b2d5b87ea9ffd385,https://canary.contestimg.wish.com/api/webimage/59ce2d16b2d5b87ea9ffd385-medium.jpg,59ce2d16b2d5b87ea9ffd385
