title,title_orig,discount_price,discount_price_currency,retail_price,retail_price_currency,discount_price_in_original_currency,nb_cart_orders_approx,nb_units_purchased_approx,uses_ad_boosts,rating,rating_count,rating_five_count,rating_four_count,rating_three_count,rating_two_count,rating_one_count,badges_count,badge_local_product,badge_product_quality,badge_fast_shipping,tags,product_color,product_variation_size_id,product_variation_inventory,shipping_option_name,shipping_option_price,shipping_is_express,countries_shipped_to,inventory_total,has_urgency_banner,urgency_text,origin_country,merchant_title,merchant_name,merchant_info_subtitle,merchant_rating_count,merchant_rating,merchant_id,merchant_has_profile_picture,merchant_profile_picture,product_url,product_picture,product_id
"JH Company Creative Balloon Vase, Pink (please check the description)","JH Company Creative Balloon Vase, Pink (please check the description)",99.0,EUR,99.0,EUR,119.0,0,,,5.0,0.0,,,,,,,,,,,pink,l,1,Livraison standard,12.0,false,,1,,,KR,K-Mild,kmild,63 % avis positifs (8 notes),8,3.0,5ff5ca506fb1f4d5c07d6fd6,,,https://www.wish.com/c/600a829af739b1fef42883ff,https://canary.contestimg.wish.com/api/webimage/600a829af739b1fef42883ff-medium.jpg,600a829af739b1fef42883ff
7pcs artisanat en cuir acrylique sac à bandoulière modèle de sac à main modèle de pochoir bricolage,7pcs Leather Craft Acrylic Shoulder Bag Handbag Pattern Stencil Template DIY,16.0,EUR,16.0,EUR,19,10,,,4.580882352941177,136.0,99,23,10,2,2,,,,,,,,50,Livraison standard,5.0,false,,50,,,CN,zhenxigerai,zhenxigerai,"(4,690 notes)",4690,4.371215351812367,5a9fda3815511a52292ed396,,,https://www.wish.com/c/5c0768de9b00782246eadb36,https://canary.contestimg.wish.com/api/webimage/5c0768de9b00782246eadb36-medium.jpg,5c0768de9b00782246eadb36
Tapis de coussin de chaise de balançoire suspendu Patio Egg Chair Coussin de siège Coussin de siège,Swing Chair Cushion Mat Hanging Patio Egg Chair Seat Pad Pillow Seat Cushion,24.0,EUR,24.0,EUR,28,10,,,3.0,26.0,9,3,3,1,10,,,,,,black,,50,Livraison standard,8.0,false,,50,,,CN,Art Space Station International Company,artspacestationinternationalcompany,"89 % avis positifs (20,535 notes)",20535,4.211930849768688,55c012e06e64df4216a2eb61,,,https://www.wish.com/c/5f338a7949dfb9004412b231,https://canary.contestimg.wish.com/api/webimage/5f338a7949dfb9004412b231-medium.jpg,5f338a7949dfb9004412b231
Kits de connecteur de fil électrique isolés par borne de pince de sertissage mâle femelle 280PCS assortis,280PCS Assorted Female Male Crimp Spade Terminal Insulated Electrical Wire Connector Kits,8.0,EUR,8.0,EUR,9,5000,,,4.588599752168525,1614.0,1159,301,116,21,17,,,,,,multicolor,,50,Livraison standard,3.0,false,,50,,,CN,IntegrityStoreMall,integritystoremall,"(4,707 notes)",4707,4.59613341831315,5a27f386d1aed21e31528c76,,,https://www.wish.com/c/5c417e60180d22127f2896a1,https://canary.contestimg.wish.com/api/webimage/5c417e60180d22127f2896a1-medium.jpg,5c417e60180d22127f2896a1
Boîte de cube de fond de photographie d'éclairage intégré portatif de qualité 9inch / 16inch ,Quality 9inch/16inch Portable Built-in Lighting Photography Backdrop Cube Box ,24.0,EUR,24.0,EUR,28,1000,,,4.332326283987915,331.0,208,72,24,7,20,,,,,,,30x30x30cm,50,Livraison standard,8.0,false,,50,,,CN,YJOYLY Trade Limited,yjoylytradelimited,"94 % avis positifs (1,166 notes)",1166,4.427958833619211,58f5e6cce2a53b489a70b425,,,https://www.wish.com/c/59cd164c9fc57356c90b6ea4,https://canary.contestimg.wish.com/api/webimage/59cd164c9fc57356c90b6ea4-medium.jpg,59cd164c9fc57356c90b6ea4
Courier Company T-shirt DHL Postal Service pour homme,Courier Company DHL Postal Service Men's T-shirt,16.0,EUR,21.0,EUR,19,10,,,5.0,2.0,2,0,0,0,0,,,,,,ash,men-s,50,Livraison standard,6.0,false,,50,,,CN,huangxianhui66058,huangxianhui66058,75 % avis positifs (164 notes),164,3.7560975609756095,5e71ae5929e786658094b737,,,https://www.wish.com/c/5ea11f4062713b0e0087981f,https://canary.contestimg.wish.com/api/webimage/5ea11f4062713b0e0087981f-medium.jpg,5ea11f4062713b0e0087981f
Baume à lèvres Iron Brew 10 ml. Fabriqué à la main en Ecosse par Glasgow Soap Company,Iron Brew Lip Balm 10ml. Handmade in Scotland by Glasgow Soap Company,46.0,EUR,59.0,EUR,54.99,0,,,5.0,0.0,,,,,,,,,,,,,3,Livraison standard,19.99,false,,3,,,GB,Giftenza,giftenza,79 % avis positifs (336 notes),336,3.8660714285714284,5e778af629e7865cfc55bd63,,,https://www.wish.com/c/5fb8a9dc0d6ba6521db7ecdd,https://canary.contestimg.wish.com/api/webimage/5fb8a9dc0d6ba6521db7ecdd-medium.jpg,5fb8a9dc0d6ba6521db7ecdd
Bluetooth Audio LED lampe de bureau USB cadeau créatif entreprise bricolage cadeau entreprise réunion annuelle vacances lampe de table,Bluetooth Audio LED Desk Lamp USB Creative Gift Business DIY Gift Company Annual Meeting Holiday Table Lamp,12.0,EUR,12.0,EUR,14,0,,,5.0,0.0,,,,,,,,,,,black,classic,8,Livraison standard,4.0,false,,50,,,CN,Xiatianday,xiatianday,"87 % avis positifs (10,354 notes)",10354,4.154046745219239,5d51199f3db43e308c7ee28e,,,https://www.wish.com/c/5f4739b96d1c0c0040928039,https://canary.contestimg.wish.com/api/webimage/5f4739b96d1c0c0040928039-medium.jpg,5f4739b96d1c0c0040928039
Company Policies Employee Boss 11 Ounces Funny Zenladen,Company Policies Employee Boss 11 Ounces Funny Zenladen,20.0,EUR,20.0,EUR,24,0,,,5.0,0.0,,,,,,,,,,,white,11oz,50,Livraison Express,6.0,true,,50,,,VN,BlueWaterK,bluewaterk,100 % avis positifs (6 notes),6,4.833333333333333,5fbe79253489f3f0ec66e969,,,https://www.wish.com/c/5ff6434d8e2d322b183f6328,https://canary.contestimg.wish.com/api/webimage/5ff6434d8e2d322b183f6328-medium.jpg,5ff6434d8e2d322b183f6328
6 paires dames filles hiver chaud doux moelleux lit chaussette salon pantoufle molleton chaussette,6 Pairs Ladies Girls Winter Warm Soft Fluffy Bed Sock Lounge Slipper Fleece Sock,10.0,EUR,10.0,EUR,12,10,,,4.568181818181818,132.0,92,30,5,3,2,,,,,,,6pairs,50,Livraison Express,6.0,true,,50,,,CN,yiwutanglei trading company,yiwutangleitradingcompany,"93 % avis positifs (50,854 notes)",50854,4.3722814331222715,55cc65fffb36df12434a5bf1,,,https://www.wish.com/c/5dbfc1d8bc21ca3f8b320396,https://canary.contestimg.wish.com/api/webimage/5dbfc1d8bc21ca3f8b320396-medium.jpg,5dbfc1d8bc21ca3f8b320396
1Sansome,,,,,,,,,,,,,,,,,,,,,,,,,,,,,,,,,,,,,,,,,https://www.wish.com/c/6037842a0b9aab0010ca9ca2,,6037842a0b9aab0010ca9ca2
Pointes de clôture murale Anti-escalade oiseaux de sécurité pointes de Pigeon répulsif pointes de clôture murale de dissuasion,Wall Fence Spikes Anti Climb Security Birds Pigeon Spikes Repeller Deterrent Wall Fence Spikes ,19.0,EUR,19.0,EUR,22,10,,,5.0,5.0,5,0,0,0,0,,,,,,,10pcs,50,Livraison standard,5.0,false,,50,,,CN,Art Space Station International Company,artspacestationinternationalcompany,"89 % avis positifs (20,535 notes)",20535,4.211930849768688,55c012e06e64df4216a2eb61,,,https://www.wish.com/c/5f2124fed5fcd83b37725f71,https://canary.contestimg.wish.com/api/webimage/5f2124fed5fcd83b37725f71-medium.jpg,5f2124fed5fcd83b37725f71
2021 New Men's Fashion Printed Cotton T-shirt cp company Casual Short-sleeved Top,2021 New Men's Fashion Printed Cotton T-shirt cp company Casual Short-sleeved Top,3.84,EUR,4.0,EUR,4.66,2,,,5.0,0.0,,,,,,,,,,,red,xxs,18,Livraison standard,1.0,false,,50,,,CN,puyong3,puyong3,"(1,323 notes)",1323,4.2532123960695385,5d4e8ba43db43e30437eefc9,,,https://www.wish.com/c/607e471e0280e78a6d7b3195,https://canary.contestimg.wish.com/api/webimage/607e471e0280e78a6d7b3195-medium.jpg,607e471e0280e78a6d7b3195
New21SS CP COMPANY JACKETS Casual Men's Zipper Jacket Hooded Coat Jacket,New21SS CP COMPANY JACKETS Casual Men's Zipper Jacket Hooded Coat Jacket,35.0,EUR,35.0,EUR,42,3,,,5.0,0.0,,,,,,,,,,,armygreen,xs,4,Livraison standard,12.0,false,,50,,,CN,WANGPAIYYYUANJIAA,wangpaiyyyuanjiaa,82 % avis positifs (717 notes),717,3.888423988842399,5d3abe3172b0c9215c6b90e6,,,https://www.wish.com/c/6050760af29bb5ee38bd6d0d,https://canary.contestimg.wish.com/api/webimage/6050760af29bb5ee38bd6d0d-medium.jpg,6050760af29bb5ee38bd6d0d
Mayer Slayer Dead and Company Bob Weir Dead and Co Mug,Mayer Slayer Dead and Company Bob Weir Dead and Co Mug,21.0,EUR,21.0,EUR,25,0,,,5.0,0.0,,,,,,,,,,,white,11oz,50,Livraison Express,6.0,true,,50,,,VN,JupiterShop,jupitershop,100 % avis positifs (2 notes),2,4.0,5fa5640a512709f0f4293fe0,,,https://www.wish.com/c/5fc4a8f432cebded0dce096c,https://canary.contestimg.wish.com/api/webimage/5fc4a8f432cebded0dce096c-medium.jpg,5fc4a8f432cebded0dce096c
FeSpähLehrKp 200 telemetry teaching company Oculus exercitus emblem badge - Coffee Cup Mug,FeSpähLehrKp 200 telemetry teaching company Oculus exercitus emblem badge - Coffee Cup Mug,16.0,EUR,16.0,EUR,19,0,,,5.0,0.0,,,,,,,,,,,white,11oz,50,Livraison standard,6.0,false,,50,,,VN,Anemogamic,anemogamic,,0,5.0,5fd0eecefc3d880a29cba8cf,,,https://www.wish.com/c/604744110ee9308fa1ea3613,https://canary.contestimg.wish.com/api/webimage/604744110ee9308fa1ea3613-medium.jpg,604744110ee9308fa1ea3613
WiFi Pan Tilt CCTV Réseau de sécurité à domicile Caméra IP IR Vision nocturne pour entreprise à domicile,WiFi Wireless Pan Tilt CCTV Network Home Security IP Camera IR Night Vision for Home Company,24.0,EUR,247.0,EUR,28,10,,,3.75,4.0,1,1,2,0,0,,,,,,,ukplug,50,Livraison standard,8.0,false,,50,,,CN,Shenzhen WuY Technology Co. Ltd,shenzhenwuytechnologycoltd,"89 % avis positifs (23,318 notes)",23318,4.226820482031049,53a050c946188e170800d9c7,,,https://www.wish.com/c/580a4f00a964b43cc67bbc60,https://canary.contestimg.wish.com/api/webimage/580a4f00a964b43cc67bbc60-medium.jpg,580a4f00a964b43cc67bbc60
Shooting Star Bad Company T-Shirt Chemise unisexe,Shooting Star Bad Company T-Shirt Unisex Shirt,19.0,EUR,21.0,EUR,23,2,,,3.0,2.0,1,0,0,0,1,,,,,,black,s,50,Livraison standard,6.0,false,,50,,,CN,Longxiang water pressure pump,longxiangwaterpressurepump,83 % avis positifs (983 notes),983,3.945066124109868,5b0bbd3fc721a97bfd5ef8b8,,,https://www.wish.com/c/5e704b91e7efbd2fed5f0037,https://canary.contestimg.wish.com/api/webimage/5e704b91e7efbd2fed5f0037-medium.jpg,5e704b91e7efbd2fed5f0037
Guess,,,,,,,,,,,,,,,,,,,,,,,,,,,,,,,,,,,,,,,,,https://www.wish.com/c/5e542cf99719ed19e8484850,,5e542cf99719ed19e8484850
"Resident Evil, Umbrella Company, Zombie Soft Rugs chambre salon, tapis de sol, tapis antidérapants, tapis d'Halloween, tapis décor","Resident Evil, Umbrella Company, Zombie Soft Rugs Bedroom Living Room , Floor Mat, Non Slip Rugs, Halloween Rugs, Rugs Decor",10.0,EUR,10.0,EUR,11,10,,,3.0,2.0,1,0,0,0,1,,,,,,,60x40cm,50,Livraison standard,2.0,false,,50,,,US,SaraLennonzZgDxM,saralennonzzgdxm,93 % avis positifs (27 notes),27,4.333333333333333,5e6cc28357af097b1a60d38e,,,https://www.wish.com/c/6017aa3d283138d91c40f3cf,https://canary.contestimg.wish.com/api/webimage/6017aa3d283138d91c40f3cf-medium.jpg,6017aa3d283138d91c40f3cf
Cahier A5 en cuir Super épais Wax Sense de 360 pages Business Office Cahier de travail quotidien Cahiers de notes Logo gratuit de l'entreprise 4.,360 Pages Super Thick Wax Sense Leather A5 Notebook Business Office Daily Work Notebook NotebookS Free Portrayal Company Logo 4.,12.0,EUR,25.0,EUR,14,10,,,5.0,4.0,4,0,0,0,0,,,,,,black,,50,Livraison standard,3.0,false,,50,,,CN,jxdxlgy,jxdxlgy,93 % avis positifs (220 notes),220,4.4,5d3bc428838897735858f68b,,,https://www.wish.com/c/5ee8a181ef82a759efbe114f,https://canary.contestimg.wish.com/api/webimage/5ee8a181ef82a759efbe114f-medium.jpg,5ee8a181ef82a759efbe114f
"You definitely deserve it,5ML/10ML Fruit Plant Essential Oils Water Soluble Oil Fragrance Lamp Furnace Humidifier","You definitely deserve it,5ML/10ML Fruit Plant Essential Oils Water Soluble Oil Fragrance Lamp Furnace Humidifier",3.84,EUR,10.0,EUR,4.66,10000,,,3.81203007518797,1064.0,544,154,148,58,160,,,,,,,lavender-10ml,50,Livraison standard,1.0,false,,50,,,CN,guangdong simei,guangdongsimei,"88% Positive Feedback (3,317 ratings)",3317,4.206210431112451,5adc9141b9605f65934eee9d,,,https://www.wish.com/c/5d07660b3cfc757885828492,https://canary.contestimg.wish.com/api/webimage/5d07660b3cfc757885828492-medium.jpg,5d07660b3cfc757885828492
Sharagano,,,,,,,,,,,,,,,,,,,,,,,,,,,,,,,,,,,,,,,,,https://www.wish.com/c/5eaaefd19719ed25a17f4488,,5eaaefd19719ed25a17f4488
Touché company game,Touché company game,26.0,EUR,26.0,EUR,30.5,0,,,5.0,0.0,,,,,,,,,,,multicolor,,50,Livraison Express,9.22,true,,50,,,NL,Erksononline,erksononline,"90 % avis positifs (1,444 notes)",1444,4.35387811634349,5f8571038ac61df76b7b8380,,,https://www.wish.com/c/5fbad9a36a1873ba2c51892b,https://canary.contestimg.wish.com/api/webimage/5fbad9a36a1873ba2c51892b-medium.jpg,5fbad9a36a1873ba2c51892b
Mode féminine lâche décontracté col rond Tie Dye Gradient manches courtes T-shirts d'été Tops Blouses Plus Size XS-5XL,Women's Fashion Loose Casual Round Neck Tie Dye Gradient Short Sleeves Summer T-Shirts Tops Blouses Plus Size XS-5XL,10.0,EUR,10.0,EUR,11,1000,,,4.011764705882353,255.0,140,43,34,11,27,,,,,,green,s,41,Livraison standard,3.0,false,,50,,,CN,shuilingjiao international trade company est un vendeur agréé,shuilingjiaointernationaltradecompany,"(102,220 notes)",102220,4.0586186656231655,5533c83986ff95173dc017d0,,,https://www.wish.com/c/5eb21f893b3dda0e358c910f,https://canary.contestimg.wish.com/api/webimage/5eb21f893b3dda0e358c910f-medium.jpg,5eb21f893b3dda0e358c910f
Cotton On,,,,,,,,,,,,,,,,,,,,,,,,,,,,,,,,,,,,,,,,,https://www.wish.com/c/5e3b0ba79719eddf0ac7e69f,,5e3b0ba79719eddf0ac7e69f
"Huile de vitamine E 10ML par Kate Blanc. Hydrate le visage et la peau. 100% pur, extra-fort. 28 000 UI, qualité supérieure, antioxydants. Réduisez l'apparence des cicatrices, des rides et des taches sombres. EBook gratuit avec recettes (1 oz)","10ML Vitamin E Oil by Kate Blanc. Moisturizes Face and Skin. 100% Pure, Extra Strength. 28,000 IU, Premium Grade, Antioxidants. Reduce Appearance of Scars, Wrinkles, Dark Spots. Free eBook w Recipes (1 oz)",5.0,EUR,15.0,EUR,5,10000,,,4.185236768802229,718.0,430,129,74,32,53,,,,,,,,50,Livraison standard,2.0,false,,50,,,CN,gaobin666,gaobin666,"78 % avis positifs (2,292 notes)",2292,3.7870855148342057,5d5b95d3560eca392e83878b,,,https://www.wish.com/c/5d6d1546cdcc9e55be284396,https://canary.contestimg.wish.com/api/webimage/5d6d1546cdcc9e55be284396-medium.jpg,5d6d1546cdcc9e55be284396
Entreprise de plein air camping trépied pique-nique ustensiles de cuisine feu de camp BBQ survie en milieu sauvage cuisine équipement de camping,Outdoor company camping tripod picnic cookware campfire BBQ wilderness survival cooking camping equipment,19.0,EUR,19.0,EUR,22,10,,,4.625,8.0,6,1,1,0,0,,,,,,newsilver,,8,Livraison standard,5.0,false,,50,,,CN,dwdetun,dwdetun,(66 notes),66,4.378787878787879,5e6880195c681853c7cfad83,,,https://www.wish.com/c/5f6998a880ccc70040f51e9d,https://canary.contestimg.wish.com/api/webimage/5f6998a880ccc70040f51e9d-medium.jpg,5f6998a880ccc70040f51e9d
"Good Smile Company Fleet Collection Kancore Aircraft Carrier Woo Class Animation Figure, 1 pc.","Good Smile Company Fleet Collection Kancore Aircraft Carrier Woo Class Animation Figure, 1 pc.",597.0,EUR,597.0,EUR,723.0,0,,,5.0,0.0,,,,,,,,,,,,,1,Livraison standard,17.0,false,,1,,,KR,atcmart,atcmart,67 % avis positifs (6 notes),6,3.8333333333333335,5fe2119d5265268f81dec682,,,https://www.wish.com/c/6009070123b0e299c29da84d,https://canary.contestimg.wish.com/api/webimage/6009070123b0e299c29da84d-medium.jpg,6009070123b0e299c29da84d
Femme Sac à bandoulière vintage Rivet crâne Rivet gland Lady Portable Lady Crossbody Satchel Messenger Messenger Bucket Sacs Moto Sacs Fourre-tout grande capacité,Women Vintage Shoulder Bag Skull Rivet Tassel Portable Lady Crossbody Satchel Messenger Bucket Motorcycle Bags Tote Big Capacity,14.0,EUR,82.0,EUR,16,1000,,,4.248436103663986,1119.0,698,193,110,44,74,,,,,,black,,50,Livraison standard,4.0,false,,50,,,CN,Yiwu Xiangpei International Trade Company,yiwuxiangpeiinternationaltradecompany,"(24,208 notes)",24208,4.449438202247191,551506968e8def3698cfd712,,,https://www.wish.com/c/567ad9c35803174640eaf1f3,https://canary.contestimg.wish.com/api/webimage/567ad9c35803174640eaf1f3-medium.jpg,567ad9c35803174640eaf1f3
"Shelby Company By Order Of The Peaky Blinders T-shirt pour hommes Mode ras du cou à manches courtes en coton Tops Vêtements, Noir","Shelby Company By Order Of The Peaky Blinders Men's T-shirt Men's Fashion Crew Neck Short Sleeves Cotton Tops Clothing, Black",21.0,EUR,54.0,EUR,25,10,,,4.121212121212121,33.0,17,7,7,0,2,,,,,,black,s,50,Livraison standard,6.0,false,,50,true,Quantité limitée !,CN,liqunlin fashion,liqunlinfashion,87 % avis positifs (123 notes),123,4.1138211382113825,54194340f8abc84ce328e3f7,,,https://www.wish.com/c/5bcac15a4c42af172fa7c0ec,https://canary.contestimg.wish.com/api/webimage/5bcac15a4c42af172fa7c0ec-medium.jpg,5bcac15a4c42af172fa7c0ec
Beats,,,,,,,,,,,,,,,,,,,,,,,,,,,,,,,,,,,,,,,,,https://www.wish.com/c/5e8d2fcc9719ed6404967675,,5e8d2fcc9719ed6404967675
Tokyo Bloom Eau De Toilette Spray (Unisex) By The Different Company,Tokyo Bloom Eau De Toilette Spray (Unisex) By The Different Company,141.0,EUR,141.0,EUR,170.0,0,,,5.0,0.0,,,,,,,,,,,,3ozeaudetoilettespray,50,Livraison standard,12.0,false,,50,true,Quantité limitée !,US,Toddybee,toddybee,85 % avis positifs (198 notes),198,4.262626262626263,5a4d91f35349205aec90609d,,,https://www.wish.com/c/5a4d922d3ec75817d953e389,https://canary.contestimg.wish.com/api/webimage/5a4d922d3ec75817d953e389-medium.jpg,5a4d922d3ec75817d953e389
Author: Massahi KishimotoISBN: 9788968220203 Original title: NARUTO-ナルト-Book type: Book Publishing Company-Daewon CI,Author: Massahi KishimotoISBN: 9788968220203 Original title: NARUTO-ナルト-Book type: Book Publishing Company-Daewon CI,10.0,EUR,10.0,EUR,12.0,0,,,5.0,0.0,,,,,,,,,,,,,3,Livraison standard,17.0,false,,3,true,Quantité limitée !,KR,atcmart,atcmart,(6 notes),6,3.8333333333333335,5fe2119d5265268f81dec682,,,https://www.wish.com/c/600be06af551661ee1edadf0,https://canary.contestimg.wish.com/api/webimage/600be06af551661ee1edadf0-medium.jpg,600be06af551661ee1edadf0
AMBI BUDD Presswerk Berlin Johannisthal Panzer company logo badge - Coffee Cup Mug,AMBI BUDD Presswerk Berlin Johannisthal Panzer company logo badge - Coffee Cup Mug,19.0,EUR,19.0,EUR,23,0,,,5.0,0.0,,,,,,,,,,,white,11oz,50,Livraison standard,6.0,false,,50,true,Quantité limitée !,VN,Anemogamic,anemogamic,,0,5.0,5fd0eecefc3d880a29cba8cf,,,https://www.wish.com/c/6047442b4bb5d810f219abc2,https://canary.contestimg.wish.com/api/webimage/6047442b4bb5d810f219abc2-medium.jpg,6047442b4bb5d810f219abc2
JH Company Women's Mini Buckle Strap Flat Sandals (please check the description),JH Company Women's Mini Buckle Strap Flat Sandals (please check the description),146.0,EUR,146.0,EUR,176.0,0,,,5.0,0.0,,,,,,,,,,,beige,,2,Livraison standard,12.0,false,,2,,,KR,K-Mild,kmild,63 % avis positifs (8 notes),8,3.0,5ff5ca506fb1f4d5c07d6fd6,,,https://www.wish.com/c/6063454c1616589fcfeb7ff4,https://canary.contestimg.wish.com/api/webimage/6063454c1616589fcfeb7ff4-medium.jpg,6063454c1616589fcfeb7ff4
Hommes et femmes Umbrella Company Resident Evil ， Masques réglables lavables multi-usages avec 2 filtres,Men and women Umbrella Company Resident Evil，Multi Usage washable Adjustable Masks with 2 filter,1.0,EUR,1.0,EUR,0.91,2,,,5.0,0.0,,,,,,,,,,,black,with2filter,50,Livraison standard,11.71,false,,50,,,US,wxb1,wxb1,97 % avis positifs (61 notes),61,4.590163934426229,5e5f82baec5cd32c1f412e18,,,https://www.wish.com/c/5f365360502b0d004ae7e2e5,https://canary.contestimg.wish.com/api/webimage/5f365360502b0d004ae7e2e5-medium.jpg,5f365360502b0d004ae7e2e5
Paquet de 24 boîtes de conserve rondes en acier 25 50 100g Baume à lèvres à couvercle vissé,24 Pack Steel Round Tin Cans 25 50 100g  Screw Top Storage Lip Balm Empty Can,19.0,EUR,21.0,EUR,23,1000,,,4.141414141414141,198.0,120,37,11,9,21,,,,,,,50g,50,Livraison standard,6.0,false,,50,,,CN,Futurestore8,futurestore8,"91 % avis positifs (21,134 notes)",21134,4.308933472130216,5875ab2e15f2f7691b2cf41b,,,https://www.wish.com/c/59bf8c42a72ff504bce8b91c,https://canary.contestimg.wish.com/api/webimage/59bf8c42a72ff504bce8b91c-medium.jpg,59bf8c42a72ff504bce8b91c
4 PzGrenBtl 173 Company Crest Badge Bundeswehr Infantry Battalion Hamburg Reservist - Coffee Cup Mug,4 PzGrenBtl 173 Company Crest Badge Bundeswehr Infantry Battalion Hamburg Reservist - Coffee Cup Mug,21.0,EUR,21.0,EUR,25,0,,,5.0,0.0,,,,,,,,,,,white,11oz,50,Livraison standard,7.0,false,,50,true,Quantité limitée !,VN,Anemogamic,anemogamic,,0,5.0,5fd0eecefc3d880a29cba8cf,,,https://www.wish.com/c/604744346300b50058f31708,https://canary.contestimg.wish.com/api/webimage/604744346300b50058f31708-medium.jpg,604744346300b50058f31708
Roland Shirt Company Logo T-shirt mode,Roland Shirt Company Logo Fashion T-shirt,12.0,EUR,156.0,EUR,14,10,,,4.5,6.0,4,1,1,0,0,,,,,,white,s,20,Livraison standard,4.0,false,,50,,,CN,poqssf,poqssf,"89 % avis positifs (1,511 notes)",1511,4.112508272667108,5d567e0c4a4e223c83dbcb18,,,https://www.wish.com/c/5ed4cd67ba507e2665333a82,https://canary.contestimg.wish.com/api/webimage/5ed4cd67ba507e2665333a82-medium.jpg,5ed4cd67ba507e2665333a82
10 / 30PCS Laser Silver Pink Mailing Envelope Bags Étanche Courier Bags Bubble Mailers Padded Bubble Envelopes Bag,10/30PCS Laser Silver Pink Mailing Envelope Bags Waterproof Courier Bags Bubble Mailers Padded Bubble Envelopes Bag,5.0,EUR,5.0,EUR,6,10,,,4.681159420289855,69.0,57,8,0,2,2,,,,,,silver,15x13cm-10pcs,50,Livraison standard,2.0,false,,50,,,CN,Chen Ai Luo Store,chenailuostore,"91 % avis positifs (3,372 notes)",3372,4.3303677342823255,5ae29ecc67d25c4e4cf2f91b,,,https://www.wish.com/c/5ecb6ad431f4d4131778f6c1,https://canary.contestimg.wish.com/api/webimage/5ecb6ad431f4d4131778f6c1-medium.jpg,5ecb6ad431f4d4131778f6c1
Support de casque GoPro Action Cam de Woorim Company,Woorim Company GoPro Action Cam Helmet Mount,37.0,EUR,37.0,EUR,44,0,,,5.0,0.0,,,,,,,,,,,,,50,Livraison standard,11.0,false,,50,true,Quantité limitée !,KR,K_market,k_market,(5 notes),5,3.6,5fb0fa5e3852e8c5c9fdc753,,,https://www.wish.com/c/5fe1de7ea2c155bc4208da40,https://canary.contestimg.wish.com/api/webimage/5fe1de7ea2c155bc4208da40-medium.jpg,5fe1de7ea2c155bc4208da40
"Ensemble de crochets de 14 pièces - Kit de crochets, poignées ergonomiques à prise souple, kit d'aiguilles à tricoter lisses pour les mains arthritiques, ensemble de fil à tisser d'aiguilles à tricot extra longues, artisanat et couture","14-pc Crochet Hook Set - Crochet Hooks Kit, Ergonomic Soft Grip Handles, Smooth Knitting Needles Kit for Arthritic Hands, Extra Long Knit Needles Weave Yarn Set, Arts Craft & Sewing",7.0,EUR,70.0,EUR,8,10,,,4.744186046511628,43.0,34,7,2,0,0,,,,,,,14pcs,50,Livraison standard,3.0,false,,50,,,CN,yiwutanglei trading company,yiwutangleitradingcompany,"93 % avis positifs (50,854 notes)",50854,4.3722814331222715,55cc65fffb36df12434a5bf1,,,https://www.wish.com/c/5fbcb6bbbd40ab8e54c38e48,https://canary.contestimg.wish.com/api/webimage/5fbcb6bbbd40ab8e54c38e48-medium.jpg,5fbcb6bbbd40ab8e54c38e48
6 pcs Creative En Alliage D'aluminium 3D Boule Sphère Forme DIY Bombe De Bain Moule Outil Accessoires,6pcs Creative Aluminum Alloy 3D Ball Sphere Shape DIY Bath Bomb Mold Tool Accessories,3.93,EUR,13.0,EUR,4.76,1000,,,4.491408934707904,582.0,416,90,42,14,20,,,,,,,,50,Livraison standard,1.0,false,,50,,,CN,aircraft09,aircraft09,"91 % avis positifs (1,614 notes)",1614,4.342007434944238,57b44972d56c990f4c2ad807,,,https://www.wish.com/c/5c01fc400f46b347632736a8,https://canary.contestimg.wish.com/api/webimage/5c01fc400f46b347632736a8-medium.jpg,5c01fc400f46b347632736a8
"Nouveau porte-badge de carte d'identité de passe de ski rétractable, bobine de traction, porte-clés, porte-cartes, bobines de recul pour entreprise de bureau scolaire",New Retractable Ski Pass ID Card Badge Holder Reel Pull Key Name Tag Card Holders Recoil Reels for School Office Company,3.94,EUR,4.0,EUR,4.78,10,,,4.746666666666667,150.0,129,8,10,2,1,,,,,,,lollipop,50,Livraison standard,1.0,false,,50,,,CN,wanw,wanw,"97 % avis positifs (10,695 notes)",10695,4.583730715287517,596f0743cdf3295b85ee99de,,,https://www.wish.com/c/5a4644137972f9436f5c7f65,https://canary.contestimg.wish.com/api/webimage/5a4644137972f9436f5c7f65-medium.jpg,5a4644137972f9436f5c7f65
Bcbg,,,,,,,,,,,,,,,,,,,,,,,,,,,,,,,,,,,,,,,,,https://www.wish.com/c/5e8d301f9719ed6404967889,,5e8d301f9719ed6404967889
"Clear Sound Wall Phones, Hanging Telephone, Pause Function Wall Telephone, for House for Home Company Community","Clear Sound Wall Phones, Hanging Telephone, Pause Function Wall Telephone, for House for Home Company Community",14.0,EUR,14.0,EUR,16,1,,,5.0,0.0,,,,,,,,,,,black,,50,Livraison standard,4.0,false,,50,true,Quantité limitée !,CN,dongnana189066,dongnana189066,89% ردود فعل إيجابية (998 تصنيفات),998,4.226452905811623,5ab29678b125ab23c9ebbd0b,,,https://www.wish.com/c/5fd27e5b9e65dade74737464,https://canary.contestimg.wish.com/api/webimage/5fd27e5b9e65dade74737464-medium.jpg,5fd27e5b9e65dade74737464
Kit de panneau solaire Flexible de fond de panier noir 400W placa solaire cargador painel panneau solaire pour voiture RV bateau maison toit 5V / 12V / 24V chargeur de batterie,400W Black Backplane Flexible Solar Panel Kit placa solar cargador painel panneau solaire For Car RV Boat Home Roof 5V/12V/24V Battery Charger ,92.0,EUR,92.0,EUR,111.0,10,,,3.7906976744186047,43.0,21,8,4,4,6,,,,,,,1xsolarpanelonlywithoutcontrollercable,50,Livraison Express,15.0,true,,50,,,CN,Solarparts Store,solarpartsstore,"88 % avis positifs (5,035 notes)",5035,4.251241310824231,57f4d4184287ed1078c22ceb,,,https://www.wish.com/c/5f955d683c6e5e003d8fd39e,https://canary.contestimg.wish.com/api/webimage/5f955d683c6e5e003d8fd39e-medium.jpg,5f955d683c6e5e003d8fd39e
