title,title_orig,discount_price,discount_price_currency,retail_price,retail_price_currency,discount_price_in_original_currency,nb_cart_orders_approx,nb_units_purchased_approx,uses_ad_boosts,rating,rating_count,rating_five_count,rating_four_count,rating_three_count,rating_two_count,rating_one_count,badges_count,badge_local_product,badge_product_quality,badge_fast_shipping,tags,product_color,product_variation_size_id,product_variation_inventory,shipping_option_name,shipping_option_price,shipping_is_express,countries_shipped_to,inventory_total,has_urgency_banner,urgency_text,origin_country,merchant_title,merchant_name,merchant_info_subtitle,merchant_rating_count,merchant_rating,merchant_id,merchant_has_profile_picture,merchant_profile_picture,product_url,product_picture,product_id
Stabilisateur vidéo de prise de vue en forme de C DV portable,DV Hand Held C-Shaped Shooting Video Stabilizer Hand-held Low Frame Flash Stands Stabilizer,15.0,EUR,15.0,EUR,18,1000,,,3.912878787878788,792.0,407,152,92,39,102,,,,,,black,actionstabilizinghandle,50,Livraison standard,5.0,false,,50,,,CN,Polintechnologymall,polintechnologymall,"(3,646 notes)",3646,4.302523313219967,56974da85f88ce0d7dcab891,,,https://www.wish.com/c/59f8971ed20e93189b1b7162,https://canary.contestimg.wish.com/api/webimage/59f8971ed20e93189b1b7162-medium.jpg,59f8971ed20e93189b1b7162
Innova,,,,,,,,,,,,,,,,,,,,,,,,,,,,,,,,,,,,,,,,,https://www.wish.com/c/5f50cce2eb31f92733bb8b1e,,5f50cce2eb31f92733bb8b1e
Coque de protection antichoc de luxe 360 pour Huawei P Smart 2019 P Smart Z Y5 2019 Y6 2019 Y7 2019 Y9 2019 Nova 5 Mate 20 Lite Mate 10 Pro P10 Lite P40 Lite P30 Pro P30 Lite P20 Lite Etc. avec Film protecteur d'écran gratuit,Luxury 360 Full Protection Shockproof Phone Case for Huawei P Smart 2019 P Smart Z Y5 2019 Y6 2019 Y7 2019 Y9 2019 Nova 5 Mate 20 Lite Mate 10 Pro P10 Lite P40 Lite P30 Pro P30 Lite P20 Lite Etc. with Free Screen Protector Film,3.98,EUR,5.0,EUR,4.83,10,,,3.5238095238095237,21.0,7,5,4,2,3,,,,,,black,huaweipsmart,50,Livraison standard,1.0,false,,50,,,CN,srfrbhdfbndfvsd,srfrbhdfbndfvsd,"87 % avis positifs (10,767 notes)",10767,4.122318194483143,58f771f8373aeb111b35af89,,,https://www.wish.com/c/60092040d3d84505b8530427,https://canary.contestimg.wish.com/api/webimage/60092040d3d84505b8530427-medium.jpg,60092040d3d84505b8530427
Autocollant en verre UV de film autocollant de vitrail décoratif statique sans colle 6 tailles,Glue-free Static Decorative Stained Glass Self-adhesive Film UV Glass Sticker 6 Sizes,7.0,EUR,17.0,EUR,8,10,,,3.75,8.0,3,2,2,0,1,,,,,,multicolor,45x100cm,50,Livraison standard,2.0,false,,50,,,US,Salted Sea,saltedsea,81 % avis positifs (104 notes),104,3.8365384615384617,5f1e94ac421e882c3a38d59c,,,https://www.wish.com/c/5fcda4206c1b98f03a080400,https://canary.contestimg.wish.com/api/webimage/5fcda4206c1b98f03a080400-medium.jpg,5fcda4206c1b98f03a080400
2021 clair doux clair Film de protection protecteur de protection pour Garmin Venu montre intelligente Smartwatch couverture de protection plein écran,2021 Clear Soft Clear Protective Film Guard Protection For Garmin Venu Smart Watch Smartwatch Full Screen Protector Cover,5.0,EUR,5.0,EUR,5,10,,,3.0,4.0,2,0,0,0,2,,,,,,,1pcs,50,Livraison standard,1.0,false,,50,,,CN,Cwenchu mutacion Foorn,cwenchumutacionfoorn,(8 notes),8,3.75,5e905b93d9de519b2848e2ad,,,https://www.wish.com/c/5fd1c259615271bbe8c01a58,https://canary.contestimg.wish.com/api/webimage/5fd1c259615271bbe8c01a58-medium.jpg,5fd1c259615271bbe8c01a58
"2021 Nouvelle mise à niveau de la caméra 8K HD 1080P Caméra numérique 16MP Sortie HDMI Écran LCD TFT de 3,0 pouces Caméra portable à zoom 16x Caméra 32 Go Microphone",2021 New upgrade 8K camera HD 1080P 16MP digital camera HDMI output 3.0 inch TFT LCD screen 16x zoom portable camera 32GB Camera Microphone,23.0,EUR,23.0,EUR,27,10,,,3.4444444444444446,9.0,4,0,3,0,2,,,,,,black,microphonewithoutcamera,4,Livraison standard,8.0,false,,50,true,Quantité limitée !,CN,Denoght Drank Rose Blankpen Octoure,denoghtdrankroseblankpenoctoure,71 % avis positifs (268 notes),268,3.533582089552239,5e4907d401ba9d49bc318fd9,,,https://www.wish.com/c/5ffd2a9bc791c839b33bd923,https://canary.contestimg.wish.com/api/webimage/5ffd2a9bc791c839b33bd923-medium.jpg,5ffd2a9bc791c839b33bd923
CHINA 64 Pocket Polaroid Photo Mini Album Case Storage FujiFilm Instax Film Size-Beige,CHINA 64 Pocket Polaroid Photo Mini Album Case Storage FujiFilm Instax Film Size-Beige,66.0,EUR,66.0,EUR,79.0,0,,,5.0,0.0,,,,,,,,,,,multicolor,beige[175],50,Livraison standard,12.0,false,,50,,,KR,GPOPMALL,gpopmall,69 % avis positifs (16 notes),16,3.6875,600bc259338f835382ad78e9,,,https://www.wish.com/c/605d1c3af2853900550c1c98,https://canary.contestimg.wish.com/api/webimage/605d1c3af2853900550c1c98-medium.jpg,605d1c3af2853900550c1c98
One Way Mirror Window Film Auto-adhésif Réfléchissant Intimité Verre Teinte Contrôle de La Chaleur Solaire Film Fenêtre Décor,One Way Mirror Window Film Self-adhesive Reflective Privacy Glass Tint Heat Control Solar Film Window Decor,8.0,EUR,8.0,EUR,9,10,,,5.0,6.0,6,0,0,0,0,,,,,,black,,50,Livraison standard,3.0,false,,50,,,CN,Xiao meng Cloth shoes,xiaomengclothshoes,"91 % avis positifs (1,807 notes)",1807,4.3209739900387385,5b594e5b109f1b5548accab3,,,https://www.wish.com/c/5ea3a0fc6db7e90f23ab718f,https://canary.contestimg.wish.com/api/webimage/5ea3a0fc6db7e90f23ab718f-medium.jpg,5ea3a0fc6db7e90f23ab718f
Film protecteur de fenêtre en verre opaque d'autocollant de fenêtre de confidentialité givré pour la salle de bain OUI,Frosted Privacy Window Sticker Opaque Glass Window Protective Film for Bathroom YES,14.0,EUR,14.0,EUR,16,10,,,3.6666666666666665,6.0,3,1,0,1,1,,,,,,,40,50,Livraison standard,5.0,false,,50,,,CN,YESPERL,yesperl,"93 % avis positifs (1,447 notes)",1447,4.434692467173463,5d3ff974838897467d147b06,,,https://www.wish.com/c/5efd8234dad232674cf65065,https://canary.contestimg.wish.com/api/webimage/5efd8234dad232674cf65065-medium.jpg,5efd8234dad232674cf65065
3 ml stylo nutrition des ongles solution de réparation des ongles antifongique ongle brillant film protecteur bio stylo de soin des ongles,3ml nail nutrition pen antifungal nail repair solution bright nail bio protective film nail care pen,2.0,EUR,2.0,EUR,2,1000,,,4.202046035805626,391.0,226,82,47,8,28,,,,,,,1pcs,50,Livraison standard,1,false,,50,,,CN,Feng-Feng Wu Jiu Tian,fengfengwujiutian,87 % avis positifs (968 notes),968,4.119834710743802,5d5a25101d86295d0e42ed80,,,https://www.wish.com/c/5fd30b07071608ca650f8dde,https://canary.contestimg.wish.com/api/webimage/5fd30b07071608ca650f8dde-medium.jpg,5fd30b07071608ca650f8dde
Fleur Eau Rose Motif Fenêtre Film Sans Colle Statique Décoratif Films De Confidentialité Fenêtre Frost Film pour Verre 40 Tailles,Flower Water Rose Pattern Window Film No Glue Static Decorative Privacy Films Window Frost Film for Glass 40 Sizes,7.0,EUR,7.0,EUR,8,10,,,3.7333333333333334,15.0,7,3,2,0,3,,,,,,assortment1,"40x60cm15.7""x23.6""",50,Livraison standard,3.0,false,,50,,,CN,Luck J4U,luckj4u,92 % avis positifs (193 notes),193,4.419689119170984,5d4653894c7855597bab8338,,,https://www.wish.com/c/5d6fb357e24dab24900c2aa8,https://canary.contestimg.wish.com/api/webimage/5d6fb357e24dab24900c2aa8-medium.jpg,5d6fb357e24dab24900c2aa8
"2PCS pour Samsung Galaxy A42 5G, A32, A22, A52, A72 5G, S21 Plus, S21 Ultra, S20 Plus, S20 Ultra, S20 FE 4G, S20 Fan Edition, Note 20 Ultra, Note 10 Lite Film de verre d'objectif de caméra pour Galaxy A12 / A02s / A11 / A21s / A41 / A51 / A71 / M21s / M31s / M51Film de protection d'écran en verre trempé","2PCS For Samsung Galaxy A42 5G , A32 , A22 , A52 , A72 5G , S21 Plus , S21 Ultra , S20 Plus , S20 Ultra , S20 FE 4G, S20 Fan Edition, Note 20 Ultra , Note 10 Lite Camera Lens Glass Film For Galaxy A12 / A02s / A11 / A21s  / A41 / A51  / A71 / M21s / M31s / M51Tempered Glass Screen Protector Film",2.34,EUR,3.0,EUR,2.84,1000,,,4.303571428571429,56.0,40,7,1,2,6,,,,,,,forsamsunggalaxya01,50,Livraison standard,1,false,,50,,,CN,Linleon,linleon,93 % avis positifs (29 notes),29,4.551724137931035,5f9e3799653534c9f2d4f91a,,,https://www.wish.com/c/5fe16136b37076328ae2fc1c,https://canary.contestimg.wish.com/api/webimage/5fe16136b37076328ae2fc1c-medium.jpg,5fe16136b37076328ae2fc1c
"2021 plus récent caméscope 4K Caméra numérique Ultra HD Wi-Fi 48,0MP Écran tactile 3,0 pouces Vision nocturne Enregistreur à zoom numérique 16X avec microphone externe et objectif grand angle et pare-soleil",2021 Newest 4K Camcorder Video Camera Ultra HD Wi-Fi Digital Camera 48.0MP 3.0 Inch Touch Screen Night Vision 16X Digital Zoom Recorder with External Microphone and Wide Angle Lens and Lens Hood,101.0,EUR,101.0,EUR,122.0,10,,,4.0,13.0,8,1,2,0,2,,,,,,,luxuryversion,50,Livraison standard,12.0,false,,50,,,CN,"YIWU MARVEL IMP&EXP CO.,LTD",yiwumarvelimpexpcoltd,"(84,573 notes)",84573,4.2311612453146985,55796013baa01a19e98a8eb6,,,https://www.wish.com/c/5fd03788c51f0865354a323e,https://canary.contestimg.wish.com/api/webimage/5fd03788c51f0865354a323e-medium.jpg,5fd03788c51f0865354a323e
Universel En Fiber De Carbone Vinyle Wrap Feuille Rouleau Film De Voiture Autocollants et Décalques Moto Voiture Style Accessoires 127 * 10cm 127 * 30CM,Universal Carbon Fiber Vinyl Car Wrap Sheet Roll Film Car Stickers and Decals Motorcycle Car Styling Accessories  127*10cm 127*30CM,3.18,EUR,4.0,EUR,3.86,1000,,,4.03125,448.0,242,88,47,32,39,,,,,,black,10cmby127cm,50,Livraison standard,1.0,false,,50,,,CN,wangjinjin9893,wangjinjin9893,"89 % avis positifs (2,617 notes)",2617,4.213603362628964,59b294a190a0f120eb122eed,,,https://www.wish.com/c/5ca5758277f017700c8634cd,https://canary.contestimg.wish.com/api/webimage/5ca5758277f017700c8634cd-medium.jpg,5ca5758277f017700c8634cd
Miroir isolation solaire teinte fenêtre Film autocollants UV réfléchissant une manière confidentialité isolation thermique économie d'énergie,Mirror Insulation Solar Tint Window Film Stickers UV Reflective One Way Privacy Heat Insulation Energy Saving ,10.0,EUR,16.0,EUR,11,10,,,3.923076923076923,13.0,7,1,3,1,1,,,,,,silver,30cmby400cm,50,Livraison standard,4.0,false,,50,,,CN,"Guangzhou Teamwin Trading Co.,Ltd",guangzhouteamwintradingcoltd,"92 % avis positifs (310,740 notes)",310740,4.3198912273926755,54898f4c223ebf1cd713fdc2,,,https://www.wish.com/c/5dc53dbc37032a002a852a73,https://canary.contestimg.wish.com/api/webimage/5dc53dbc37032a002a852a73-medium.jpg,5dc53dbc37032a002a852a73
9/16 pièces salle de bain miroir mur autocollant maison décorative auto-adhésif meubles films 15X15 cm carré miroir feuille Stickers muraux,9/16pcs Bathroom Mirror Wall Sticker Home Decorative Self Adhesive Furniture Films 15X15cm Square Mirror Foil Wall Stickers,4.82,EUR,5.0,EUR,5.85,10,,,3.3157894736842106,19.0,7,3,3,1,5,,,,,,,9pcs,50,Livraison standard,1.0,false,,50,,,CN,jiushiguang,jiushiguang,"87 % avis positifs (16,005 notes)",16005,4.124211184004999,5b8367bd3b3e961e9a4f4c03,,,https://www.wish.com/c/5f9be5946633330041c576e8,https://canary.contestimg.wish.com/api/webimage/5f9be5946633330041c576e8-medium.jpg,5f9be5946633330041c576e8
"Film d'enveloppe de vinyle en fibre de carbone, film d'enveloppe de voiture, protecteur de seuil de porte de voiture protecteur de pare-chocs","Carbon Fiber Vinyl Wrap Film,Car Wrap Film,Car Door Sill Protector Bumper Protector Carbon Fiber Film Gloss Vinyl Automotive Wrap Film Anti-Collision Self Adhesive Film Fits for Most Car DIY Decals",0.0,EUR,0.0,EUR,0,10,,,4.0,29.0,14,4,9,1,1,,,,,,red,11.8inchx7.8inch/30cmx20cm,50,Livraison standard,1,false,,50,,,CN,IVIKER,iviker,91 % avis positifs (540 notes),540,4.274074074074074,5ee9b97718e2640bb4573cec,,,https://www.wish.com/c/5f8d962f3ecdf1a43069a9ba,https://canary.contestimg.wish.com/api/webimage/5f8d962f3ecdf1a43069a9ba-medium.jpg,5f8d962f3ecdf1a43069a9ba
Film autocollant pour objectif arrière pour iPhone X XS MAX XR Changement d'appareil photo pour iPhone11 / 11 Pro / 11 Pro MAX,Lens Back Sticker Film for iPhone X XS MAX XR Camera Change to iPhone11/ 11 Pro / 11 Pro  MAX,6.0,EUR,6.0,EUR,7,10,,,3.9375,48.0,29,5,4,2,8,,,,,,black,iphonexxs,50,Livraison Express,3.0,true,,50,true,Quantité limitée !,CN,east-market,owendwad,"(13,136 notes)",13136,4.286997563946406,542aaf384f66d92ebd599576,,,https://www.wish.com/c/5e450b87ddbcbe5fa0b3e8e0,https://canary.contestimg.wish.com/api/webimage/5e450b87ddbcbe5fa0b3e8e0-medium.jpg,5e450b87ddbcbe5fa0b3e8e0
P5364 porte-clés de lanière de film lanières d'identification d'insigne / corde de téléphone portable / accessoires de sangles de cou de lanière de clé,P5364 Movie Lanyard Key Holders Badge ID Lanyards/ Mobile Phone Rope/ Key Lanyard Neck Straps Accessories,3.0,EUR,3.0,EUR,3,5000,,,4.765476190476191,840.0,702,100,26,3,9,,,,,,,,50,Livraison standard,1.0,false,,50,,,CN,bighomeshop,lindatradingcompany,"97 % avis positifs (124,578 notes)",124578,4.6513108253463695,55268e8d9e68870bf6197623,,,https://www.wish.com/c/5f0541ef3333b91da2bd76e7,https://canary.contestimg.wish.com/api/webimage/5f0541ef3333b91da2bd76e7-medium.jpg,5f0541ef3333b91da2bd76e7
Film de vinyle de glace chrome mat de style voiture / Film d'enveloppe de vinyle miroir chromé /,Car-styling Matte Chrome Ice Vinyl Film /Chrome Mirror Vinyl Wrap Film /,3.0,EUR,3.0,EUR,3,10,,,4.066666666666666,60.0,32,11,9,5,3,,,,,,pink,carbonfiberfilm(127x10cm),50,Livraison standard,1.0,false,,50,,,CN,XIAO7h,xiao7h,80 % avis positifs (823 notes),823,3.828675577156744,5a5edef67ce75c2a9e844ba9,,,https://www.wish.com/c/5e5dfd7adf4d4255d26a9dc7,https://canary.contestimg.wish.com/api/webimage/5e5dfd7adf4d4255d26a9dc7-medium.jpg,5e5dfd7adf4d4255d26a9dc7
500D Full Cover Screen Protector Soft Hydrogel film for iPhone 11 Pro Max 11Pro 11 2019 Xs Max Xr X 7 8 Plus Not Trempé Glass,500D Full Cover Screen Protector Soft Hydrogel film for iPhone 11 Pro Max 11Pro 11 2019 Xs Max Xr X 7 8 Plus Not Tempered Glass,2.23,EUR,3.0,EUR,2.7,10,,,3.769230769230769,13.0,9,0,0,0,4,,,,,,,iphone11,50,Livraison standard,1,false,,50,,,CN,Bob,shenzhennewonetechnologycoltd,"(15,431 notes)",15431,4.241591601322014,5501a06d24850b7df969b2bd,,,https://www.wish.com/c/5e61f3914b7c140ac30839bd,https://canary.contestimg.wish.com/api/webimage/5e61f3914b7c140ac30839bd-medium.jpg,5e61f3914b7c140ac30839bd
10/20 feuilles Fujifilm Instax Mini 9 8 Films Films à bord blanc pour Mini instantané 9 8 7 s 25 50 s 9 90 Papier Photo Sp-2 pour appareil photo,10/20 Sheets Fujifilm Instax Mini 9 8 Films White Edge Films for Instant Mini 9 8 7s 25 50s 9 90 Camera Sp-2 Photo Paper,10.0,EUR,77.0,EUR,11,10,,,3.71875,32.0,20,2,0,1,9,,,,,,,10pcs,50,Livraison standard,3.0,false,,50,,,CN,Baosity,baosity,"84 % avis positifs (12,230 notes)",12230,4.030417007358953,58d3703668ce8457a2b97633,,,https://www.wish.com/c/5ed5cb84c64172322ab6eb40,https://canary.contestimg.wish.com/api/webimage/5ed5cb84c64172322ab6eb40-medium.jpg,5ed5cb84c64172322ab6eb40
4PCS Verre Trempé Pour Huawei Y9 2019 / Y9 2018 / Y6 2019 / Y6 Pro 2019 / Y7 2019 / Y7 Prime 2019 / Y7 Pro 2019 / Y5 Lite 2018 / Y5 2018 / Y6 2018 / Y5 Prime 2018 / Y6 Prime 2018 / Y3 2018 Écran Film protecteur P Smart Plus 2019 Honor 8X,4PCS Tempered Glass For Huawei Y9 2019/ Y9 2018 / Y6 2019 / Y6 Pro 2019 / Y7 2019 / Y7 Prime 2019 / Y7 Pro 2019 / Y5 Lite 2018 / Y5 2018 / Y6 2018 / Y5 Prime 2018 / Y6 Prime 2018/ Y3 2018 Screen Protector Film P Smart Plus 2019 Honor 8X,2.34,EUR,8.0,EUR,2.84,1000,,,4.256239600665557,601.0,391,99,37,22,52,,,,,,transparent,foripodtouch4,50,Livraison standard,1,false,,50,,,CN,yu9663,yu9663,"88 % avis positifs (2,808 notes)",2808,4.261752136752137,5d5506d6a7c3733c904dd117,,,https://www.wish.com/c/5d9a982cea5da1281947e7ac,https://canary.contestimg.wish.com/api/webimage/5d9a982cea5da1281947e7ac-medium.jpg,5d9a982cea5da1281947e7ac
Les œuvres de la collection de Hayao Miyazaki Miyazaki[Blu-ray] Popular TV Show American Movies Poster Poster,The collection works of Hayao Miyazaki   [Blu-ray] Popular American TV Show Movies Poster,33.0,EUR,81.0,EUR,39,10,,,4.6591928251121075,223.0,185,20,7,2,9,,,,,,,,50,Livraison standard,11.0,false,,50,,,CN,yundududaai,yundududaai,93 % avis positifs (561 notes),561,4.529411764705882,5aa667285ebcfd3fbede422d,,,https://www.wish.com/c/5ab11e316931da5996c2f29c,https://canary.contestimg.wish.com/api/webimage/5ab11e316931da5996c2f29c-medium.jpg,5ab11e316931da5996c2f29c
"Film de fenêtre givré non adhésif, film de confidentialité givré pour fenêtres en verre, fenêtre décorative auto-statique adhérente pour protection UV à domicile","Frosted Window Film Non-Adhesive, Frosting Privacy Film for Glass Windows, Self Static-Cling Decorative Window Cling for Home Office UV Protection",7.0,EUR,11.0,EUR,8,10,,,3.875,8.0,5,1,0,0,2,,,,,,,45x100cm,50,Livraison standard,2.0,false,,50,,,CN,liuyanqingshopping,liuyanqingshopping,"92 % avis positifs (3,520 notes)",3520,4.353409090909091,5aa4df93aac71f3fe1976e82,,,https://www.wish.com/c/5e4df72199ce9a15604e51ca,https://canary.contestimg.wish.com/api/webimage/5e4df72199ce9a15604e51ca-medium.jpg,5e4df72199ce9a15604e51ca
Nouveau stylo nutritif pour ongles 5ML enlève la réparation des ongles fongiques liquide brillant ongle Film bio-protecteur soin des ongles,NEW 5ML Nail Nutrient Pen Removes Fungus Nail Repair Liquid Bright Nail Bio-Protective Film Nail Care,4.79,EUR,5.0,EUR,5.8100000000000005,10,,,4.833333333333333,6.0,5,1,0,0,0,,,,,,,1pcs,50,Livraison standard,1.0,false,,50,true,Quantité limitée !,CN,tinamight,tinamight,"(22,585 notes)",22585,4.388487934469781,5a13f1889fbc515331826944,,,https://www.wish.com/c/6034da9f4c91b71f2dd65334,https://canary.contestimg.wish.com/api/webimage/6034da9f4c91b71f2dd65334-medium.jpg,6034da9f4c91b71f2dd65334
Achetez-en trois pour en envoyer un Appelez-moi par votre nom Affiche de film classique vintage kraft mur rétro affiches pour la maison Bar café chambre sticker mural 42 * 30 cm,Buy three to send one Call Me by Your Name Classic movie poster vintage kraft  Wall Retro Posters For Home Bar Cafe Room Wall sticker 42*30cm,2.33,EUR,13.0,EUR,2.83,10,,,3.847826086956522,46.0,23,10,3,3,7,,,,,,,11,50,Livraison standard,1,false,,50,,,CN,xyzabc123,xyzabc123,"93 % avis positifs (1,071 notes)",1071,4.406162464985995,5dc55764b4bcf91a30ceefdb,,,https://www.wish.com/c/5e4e31ea43b4f2260171eeb6,https://canary.contestimg.wish.com/api/webimage/5e4e31ea43b4f2260171eeb6-medium.jpg,5e4e31ea43b4f2260171eeb6
30pcs PET Stickers Vintage Film Flower Scrapbooking Bullet Journal Decorative Diary Label  Stationery,30pcs PET Stickers Vintage Film Flower Scrapbooking Bullet Journal Decorative Diary Label  Stationery,2.22,EUR,13.0,EUR,2.69,10,,,5.0,4.0,4,0,0,0,0,,,,,,,1,50,Livraison standard,1,false,,50,,,CN,qingjing123,naturalworld,"97 % avis positifs (3,445 notes)",3445,4.612481857764877,58d47c1ec590c152fa8b2f25,,,https://www.wish.com/c/6050622f196657c6b4df206f,https://canary.contestimg.wish.com/api/webimage/6050622f196657c6b4df206f-medium.jpg,6050622f196657c6b4df206f
8 couleurs haute lumière métal lettrage Film transfert de chaleur bricolage T-shirt PU paillettes bricolage matériel,8Colors High Light Metal Lettering Film Heat Transfer DIY T-shirt PU Glitter DIY material,3.16,EUR,5.0,EUR,3.83,10,,,4.25,8.0,5,2,0,0,1,,,,,,red,20x25cm,50,Livraison standard,1.0,false,,50,,,CN,thermocouple,thermocouple,(31 notes),31,4.32258064516129,5ed5a916b0b0640a29a2a336,,,https://www.wish.com/c/5f0bc990120ead252d42f85e,https://canary.contestimg.wish.com/api/webimage/5f0bc990120ead252d42f85e-medium.jpg,5f0bc990120ead252d42f85e
4 pièces / ensemble autocollant de porte de voiture aux rayures couverture résistante Auto poignée de Protection Film accessoire extérieur,4Pcs/Set Car Door Sticker Scratches Resistant Cover Auto Handle Protection Film Exterior Accessory,2.29,EUR,3.0,EUR,2.7800000000000002,50000,,,4.053638763197586,10608.0,5734,2030,1427,513,904,,,,,,black,,50,Livraison standard,1,false,,50,,,CN,Needlleatiy,needlleatiy,"(28,300 notes)",28300,4.153321554770318,58d3778fc7b73b7548c8f8ab,,,https://www.wish.com/c/5c6d1be38a5bf111d9d24f60,https://canary.contestimg.wish.com/api/webimage/5c6d1be38a5bf111d9d24f60-medium.jpg,5c6d1be38a5bf111d9d24f60
Godox,,,,,,,,,,,,,,,,,,,,,,,,,,,,,,,,,,,,,,,,,https://www.wish.com/c/5f7859deeb31f9451e1de047,,5f7859deeb31f9451e1de047
Autocollant en verre teinté d'église de chapelle d'église de filtre de lumière de film de fenêtre statique,Static Cling Window Film Light Filter Church Chapel Stained Glass Stickers Self-adhesive,10.0,EUR,10.0,EUR,11,10,,,3.2213740458015265,131.0,46,15,25,12,33,,,,,,,w28,50,Livraison standard,2.0,false,,50,,,CN,You Mu,youmu,"(8,905 notes)",8905,4.280516563728242,556d2ddec00cd72787ff01f4,,,https://www.wish.com/c/5cc1692d38df4d3b346c6d7b,https://canary.contestimg.wish.com/api/webimage/5cc1692d38df4d3b346c6d7b-medium.jpg,5cc1692d38df4d3b346c6d7b
12 couleurs Laser avion lettrage Film Film transfert de chaleur bricolage T-shirt HTV vinyle PU paillettes léopard Camo,12Colors Laser Plane Lettering Film Film Heat Transfer DIY T-shirt HTV Vinyl PU Glitter Leopard Camo,3.05,EUR,5.0,EUR,3.7,10,,,3.5625,16.0,9,1,1,0,5,,,,,,,1-20x25cm,50,Livraison standard,1.0,false,,50,,,IT,RobertoAR,robertoar,94 % avis positifs (437 notes),437,4.519450800915332,5f7c9104b92574003fe58887,,,https://www.wish.com/c/5fd2f7808c4543a22aee7a74,https://canary.contestimg.wish.com/api/webimage/5fd2f7808c4543a22aee7a74-medium.jpg,5fd2f7808c4543a22aee7a74
Nouveau professionnel bricolage classique / 35mm double objectif Reflex TLR Film caméra / Kit de caméra d'assemblage Lomo,New Professional DIY Classic / 35mm Twin Lens Reflex TLR Film Camera / Lomo Assembly Camera Kit,19.0,EUR,19.0,EUR,22,10,,,4.5,4.0,2,2,0,0,0,,,,,,,,50,Livraison standard,5.0,false,,50,,,CN,Be your favorite,beyourfavorite,"95 % avis positifs (8,100 notes)",8100,4.442098765432099,56d7ee0b33980b1685af8614,,,https://www.wish.com/c/58148c4a82152e369e5a01e2,https://canary.contestimg.wish.com/api/webimage/58148c4a82152e369e5a01e2-medium.jpg,58148c4a82152e369e5a01e2
Yingnuost,,,,,,,,,,,,,,,,,,,,,,,,,,,,,,,,,,,,,,,,,https://www.wish.com/c/5f2a918690b8a6806b950568,,5f2a918690b8a6806b950568
Kit de rouleau de teinture de film de teinte de fenêtre de voiture 300 * 50cm 50% 35% 25% teinte de fenêtre Vlt pour autocollants de fenêtre de maison de voiture,300*50cm Car Window Tint Film Tinting Roll Kit 50%35%25% Vlt Window Tint for Car Home Window Stickersblack Uv-proof Sunshade Car Solar Protection Film,5.0,EUR,42.0,EUR,6,1000,,,3.6724137931034484,232.0,107,39,32,11,43,,,,,,,1%vlt,50,Livraison standard,2.0,false,,50,,,CN,hgutrioe0,hgutrioe0,86 % avis positifs (328 notes),328,4.091463414634147,5de4cf30ae88ea06cba73682,,,https://www.wish.com/c/5f23c648ba70eb067a6add85,https://canary.contestimg.wish.com/api/webimage/5f23c648ba70eb067a6add85-medium.jpg,5f23c648ba70eb067a6add85
Sweat à capuche Beacon Hills Lacrosse Hoodie Teen Wolf McCall Stilinski Lahey Unisexe Sweatshirt.,Beacon Hills Lacrosse Hoodie Teen Wolf McCall Stilinski Lahey Unisex Sweatshirt.,14.0,EUR,57.0,EUR,16,1000,,,4.324110671936759,253.0,153,56,26,9,9,,,,,,winered,lahey14(sizes),50,Livraison standard,5.0,false,,50,,,CN,bolin2017,bolin2017,"90 % avis positifs (3,307 notes)",3307,4.237375264590263,591ab3fb4b5a4742588d575f,,,https://www.wish.com/c/5a01afdc6cecb952dfe3021e,https://canary.contestimg.wish.com/api/webimage/5a01afdc6cecb952dfe3021e-medium.jpg,5a01afdc6cecb952dfe3021e
Appareil photo instantané Fujifilm Instax Mini 7s bleu clair (remis à neuf),Fujifilm Instax Mini 7s Light Blue Instant Film Camera  (Refurbished),49.0,EUR,49.0,EUR,59.0,10,,,4.5,20.0,14,4,1,0,1,,,,,,,,50,Livraison standard,67.74,false,,50,,,US,WombatReserve,wombatreserve,"87 % avis positifs (1,837 notes)",1837,4.248230811105063,5a85c2e028a2b328f8a4bdf4,,,https://www.wish.com/c/5f985c9f7d650c213315ed73,https://canary.contestimg.wish.com/api/webimage/5f985c9f7d650c213315ed73-medium.jpg,5f985c9f7d650c213315ed73
Le New York Times Ameublement décoration Kraft Film rétro Affiche Dessin noyau Stickers Muraux,The New York Times Home Furnishing decoration Kraft Movie retro Poster Drawing core Wall stickers,2.24,EUR,10.0,EUR,2.71,1000,,,4.234782608695652,115.0,73,17,14,1,10,,,,,,,1,50,Livraison standard,1,false,,50,,,CN,wangyixualp,wangyixualp,"(1,828 notes)",1828,4.291028446389497,5afa829d8699ce06c5ed6bda,,,https://www.wish.com/c/5dc28cfeabe10d1140dda418,https://canary.contestimg.wish.com/api/webimage/5dc28cfeabe10d1140dda418-medium.jpg,5dc28cfeabe10d1140dda418
Film de teinte de fenêtre noire 3M verre voiture Auto non coupée teinte de fenêtre 5% -50% Film noir autocollant de Protection UV solaire,3M Black Window Tint Film Glass Car Auto Uncut Window Tint 5%-50% Black Film Solar UV Protection Sticker,5.0,EUR,5.0,EUR,6,10,,,3.3043478260869565,23.0,10,0,5,3,5,,,,,,,50%vlt,50,Livraison standard,2.0,false,,50,,,CN,Seventh Mall,seventhmall,"92 % avis positifs (9,822 notes)",9822,4.353797597230707,595b5e682eac116bb9843ec2,,,https://www.wish.com/c/5fe2bb5992548f73726acc81,https://canary.contestimg.wish.com/api/webimage/5fe2bb5992548f73726acc81-medium.jpg,5fe2bb5992548f73726acc81
Sac d'enveloppe à bulles Sac de film de perle Vêtements Emballage léger et rapide Joint de sac de transport,Bubble Envelope Bag Pearl Film Packet Clothing Light and Fast Packaging Bag Transport Bag Seal,3.0,EUR,3.0,EUR,3,10,,,4.029411764705882,34.0,22,3,2,2,5,,,,,,rosegold,1pcs-15x13cm,50,Livraison standard,1.0,false,,50,,,CN,DHUKSGFOIUG,dhuksgfoiug,64 % avis positifs (780 notes),780,3.2628205128205128,5dcf5ca8a264fd0181cf3635,,,https://www.wish.com/c/5efb09c06033701e14bd3502,https://canary.contestimg.wish.com/api/webimage/5efb09c06033701e14bd3502-medium.jpg,5efb09c06033701e14bd3502
