title,title_orig,discount_price,discount_price_currency,retail_price,retail_price_currency,discount_price_in_original_currency,nb_cart_orders_approx,nb_units_purchased_approx,uses_ad_boosts,rating,rating_count,rating_five_count,rating_four_count,rating_three_count,rating_two_count,rating_one_count,badges_count,badge_local_product,badge_product_quality,badge_fast_shipping,tags,product_color,product_variation_size_id,product_variation_inventory,shipping_option_name,shipping_option_price,shipping_is_express,countries_shipped_to,inventory_total,has_urgency_banner,urgency_text,origin_country,merchant_title,merchant_name,merchant_info_subtitle,merchant_rating_count,merchant_rating,merchant_id,merchant_has_profile_picture,merchant_profile_picture,product_url,product_picture,product_id
Accessoires de moto couverture footstep carbone fibre de carbone motif Texture garde pour ADV150 2019-2021,Motorcycle Accessories Cover Footstep Carbon Carbon Fiber Pattern Texture Guard for ADV150 2019-2021,41.0,EUR,41.0,EUR,49.0,0,,,5.0,0.0,,,,,,,,,,,,,50,Livraison standard,0.0,false,,50,,,CA,Loom,loom,81 % avis positifs (403 notes),403,4.054590570719603,60108516d38ac0468d48a860,,,https://www.wish.com/c/60158a2c5b36d13947f8b3b0,https://canary.contestimg.wish.com/api/webimage/60158a2c5b36d13947f8b3b0-medium.jpg,60158a2c5b36d13947f8b3b0
Le nouvel élargissement du pénis masculin prend effet rapidement et retarde l'éjaculation,New male penis enlargement takes effect quickly and delays ejaculation,7.0,EUR,7.0,EUR,8,10,,,4.428571428571429,7.0,4,2,1,0,0,,,,,,,packof1,50,Livraison standard,2.0,false,,50,,,CN,Proud Xiao,proudxiao,86 % avis positifs (401 notes),401,3.9576059850374063,5d847bbb8810cc15b6e668d7,,,https://www.wish.com/c/5fc080a28ae27abfaa452c90,https://canary.contestimg.wish.com/api/webimage/5fc080a28ae27abfaa452c90-medium.jpg,5fc080a28ae27abfaa452c90
Porte de voiture pliante multifonction Crochet de verrouillage pour porte de voiture Mini échelle de pédale de pied pour Jeep SUV Échelles de voiture de toit de camion de camion de camion de Jeep,Multi-function Folding Car Door Latch Hook Step Mini Foot Pedal Ladder for Jeep SUV Truck Roof Car Ladders,15.0,EUR,15.0,EUR,17,10,,,4.384615384615385,13.0,8,2,3,0,0,,,,,,,,50,Livraison standard,5.0,false,,50,,,CN,funshoppinghere,funshoppinghere,"92 % avis positifs (16,210 notes)",16210,4.347008019740901,5822bf81d3e3fa1d54024750,,,https://www.wish.com/c/5c88b77b3602245df81a56b7,https://canary.contestimg.wish.com/api/webimage/5c88b77b3602245df81a56b7-medium.jpg,5c88b77b3602245df81a56b7
Multi-fonction Pliable Porte De Voiture Loquet Crochet Étape Mini Pied Pédale Échelle Sécurité Pliable Conception,Multi-function Folding Car Door Latch Hook Step Mini Foot Pedal Ladder Security Foldable Design,13.0,EUR,13.0,EUR,15,10,,,4.875,8.0,7,1,0,0,0,,,,,,,,50,Livraison standard,4.0,false,,50,,,CN,rademysky,rademysky,"78 % avis positifs (2,357 notes)",2357,3.812049215103946,5d553f18a7c3734ac04e07d8,,,https://www.wish.com/c/5eb11f1b453a364b9f740a87,https://canary.contestimg.wish.com/api/webimage/5eb11f1b453a364b9f740a87-medium.jpg,5eb11f1b453a364b9f740a87
Accessoires de moto couverture footstep carbone fibre de carbone motif Texture garde pour ADV150 2019-2021,Motorcycle Accessories Cover Footstep Carbon Carbon Fiber Pattern Texture Guard for ADV150 2019-2021,25.0,EUR,71.0,EUR,30,0,,,5.0,0.0,,,,,,,,,,,,,50,Livraison standard,8.0,false,,50,,,CN,winJodiewLdLxO,winjodiewldlxo,90 % avis positifs (394 notes),394,4.251269035532995,5d42a7e0e4b65d2bb4bf53ea,,,https://www.wish.com/c/60766f848ffa8d029210380a,https://canary.contestimg.wish.com/api/webimage/60766f848ffa8d029210380a-medium.jpg,60766f848ffa8d029210380a
,,,,,,,,,,,,,,,,,,,,,,,,,,,,,,,,,,,,,,,,,https://www.wish.com/c/60846e8d3ffc4e0010bcc142,,60846e8d3ffc4e0010bcc142
Electric Foot File Grinder Exfoliating 2 Gears Foot Callus Dead Skin Remover Pedicure Tools Phoe ,Electric Foot File Grinder Exfoliating 2 Gears Foot Callus Dead Skin Remover Pedicure Tools Phoe ,28.0,EUR,28.0,EUR,33,0,,,5.0,0.0,,,,,,,,,,,,,50,Livraison Express,14.0,true,,50,true,Quantité limitée !,CN,Phoenixnum001,phoenixnum001,"92 % avis positifs (12,048 notes)",12048,4.378154050464808,58805ce241fd8d296cf6d2a9,,,https://www.wish.com/c/6039ab24ed753525a587f208,https://canary.contestimg.wish.com/api/webimage/6039ab24ed753525a587f208-medium.jpg,6039ab24ed753525a587f208
Chaussures de course respirantes en mesh pour hommes Chaussures de jogging pour hommes,Men Mesh Breathable Running Shoes Jogging Shoes for Men,5.0,EUR,5.0,EUR,6,10,,,3.894230769230769,104.0,50,20,16,9,9,,,,,,black&white,32.5,1,Livraison standard,2.0,false,,50,,,CN,YANGCANAA,yangcanaa,(603 notes),603,4.053067993366501,5dc65d2c29e7864bfd04a199,,,https://www.wish.com/c/5df82a2f6e58fd0067c2a61d,https://canary.contestimg.wish.com/api/webimage/5df82a2f6e58fd0067c2a61d-medium.jpg,5df82a2f6e58fd0067c2a61d
"1pc réglable élastique fasciite plantaire attelle de nuit attelle orthopédique de chute de pied aide à soulager la douleur de la fasciite plantaire, des blessures, des fractures de stress, de la tendinite d'Achille","1pc Adjustable Elastic Plantar Fasciitis Night Splint Foot Drop Orthotic Brace Helps Alleviate Pain From Plantar Fasciitis, Injury, Stress Fracture, Achilles Tendonitis ",11.0,EUR,46.0,EUR,13,10,,,3.909090909090909,44.0,19,11,8,3,3,,,,,,,,50,Livraison standard,3.0,false,,50,true,Quantité limitée !,CN,Vanqualy,vanqualy,"93 % avis positifs (4,526 notes)",4526,4.373177198409191,5bee80abb9743d2469870054,,,https://www.wish.com/c/5e5dff3f636b024168c40d5e,https://canary.contestimg.wish.com/api/webimage/5e5dff3f636b024168c40d5e-medium.jpg,5e5dff3f636b024168c40d5e
Porte de voiture Étape charnière pied pédale repose-pied latéral repose-pieds Peg échelle de porte extérieure pour Jeep Wrangler JK 2007-2017,Car Door Step Hinge Foot Pedal Side Foot Rest Peg Exterior Door Ladder For Jeep Wrangler JK 2007-2017,24.0,EUR,30.0,EUR,29,10,,,4.585365853658536,41.0,31,7,1,0,2,,,,,,black,,50,Livraison standard,8.0,false,,50,,,CN,Devandra,devandra,"91 % avis positifs (62,660 notes)",62660,4.310485157995531,58789f2583cdfa46661d266e,,,https://www.wish.com/c/5c8b9fd0c111351e1524d1dc,https://canary.contestimg.wish.com/api/webimage/5c8b9fd0c111351e1524d1dc-medium.jpg,5c8b9fd0c111351e1524d1dc
1 PC Réglable Fasciite Plantaire Nuit Attelle Pied Goutte Orthèse Brace Élastique Dorsale Nuit Attelle,1PC Adjustable Plantar Fasciitis Night Splint Foot Drop Orthotic Brace Elastic Dorsal Night Splint,10.0,EUR,22.0,EUR,11,10,,,4.363636363636363,11.0,6,4,0,1,0,,,,,,black,,50,Livraison standard,2.0,false,,50,,,US,SJSJH,sjsjh,83 % avis positifs (84 notes),84,4.035714285714286,5e6b79c48d68d29f4ba06cbb,,,https://www.wish.com/c/5e931b1923692c52408d7920,https://canary.contestimg.wish.com/api/webimage/5e931b1923692c52408d7920-medium.jpg,5e931b1923692c52408d7920
Mustool,,,,,,,,,,,,,,,,,,,,,,,,,,,,,,,,,,,,,,,,,https://www.wish.com/c/5f8acee390b8a67af00235de,,5f8acee390b8a67af00235de
1Pari Bărbați Femei Femei silicon cu toc călcâi Talpi Talpa pentru alinarea piciorului Protectoare pentru durere Încălțăminte Încălțăminte cu toc înalt,1Pair Men Women Silicone Gel Heel Cushion Insoles Soles Relieve Foot Pain Protectors Shoe Pad High Heel Inserts,3.15,EUR,4.0,EUR,3.8200000000000003,1000,,,4.565130260521042,499.0,344,110,33,7,5,,,,,,red,s(women),50,Livraison standard,1.0,false,,50,,,CN,FM368,fm368,"91% Feedback pozitiv (12,037 rating)",12037,4.315194815984049,5893ff5d13d73851a71ae327,,,https://www.wish.com/c/5a2292dde26cae6664988661,https://canary.contestimg.wish.com/api/webimage/5a2292dde26cae6664988661-medium.jpg,5a2292dde26cae6664988661
"Marche de porte de voiture - Marche de porte multifonctionnelle pour véhicule 4 en 1 avec marteau de sécurité Accès facile au repose-pied d'échelle pliante sur le toit de la voiture pour voiture Jeep SUV avec coupe-ceinture de sécurité (mise à niveau, noir)","Car Doorstep - 4 in 1 Multifunctional Vehicle Latch Door Step with Safety Hammer Easy Access to Car Rooftop Folding Ladder Foot Peg for Jeep SUV Car with Seat Belt Cutter (Upgrade, Black)",15.0,EUR,15.0,EUR,18,10,,,4.529411764705882,17.0,12,4,0,0,1,,,,,,,,50,Livraison standard,5.0,false,,50,,,CN,tianyixiaozhan,天艺小站,"93 % avis positifs (2,984 notes)",2984,4.450402144772118,57a35e1dde8b7a10e61ad2df,,,https://www.wish.com/c/5c89cfd30c29c14ccf46944c,https://canary.contestimg.wish.com/api/webimage/5c89cfd30c29c14ccf46944c-medium.jpg,5c89cfd30c29c14ccf46944c
Nouveau dissolvant de callosités du pied électrique Pied électronique Rotation du fichier Polisseur de peau morte dure Exfoliant Meulage Pieds Outils de soins propres,New Electric Foot Callus Remover Electronic Foot Rotate File Hard Dead Skin Polisher Exfoliating Grinding Feet Clean Care Tools Foot Smooth Machine Personal Beauty Skin Care,23.0,EUR,91.0,EUR,27,10,,,4.2,10.0,7,1,0,1,1,,,,,,pink,euplug,50,Livraison standard,7.0,false,,50,true,Quantité limitée !,CN,sjraindrop,sjraindrop,"92 % avis positifs (11,479 notes)",11479,4.36666957052008,5b94c5239290462458808b72,,,https://www.wish.com/c/5d3bcee2194da71427dcc36a,https://canary.contestimg.wish.com/api/webimage/5d3bcee2194da71427dcc36a-medium.jpg,5d3bcee2194da71427dcc36a
1 Pair Outdoor TeamworkTraining Webbing Footsteps Belt Funny Game Props,1 Pair Outdoor TeamworkTraining Webbing Footsteps Belt Funny Game Props,17.0,EUR,17.0,EUR,20,0,,,5.0,0.0,,,,,,,,,,,,115x5cm,10,Livraison standard,6.0,false,,10,,,CN,lihncheya,lihncheya,89 % avis positifs (130 notes),130,4.338461538461538,5f128aada2283672de8d947c,,,https://www.wish.com/c/5fa0e7d730f015996155be97,https://canary.contestimg.wish.com/api/webimage/5fa0e7d730f015996155be97-medium.jpg,5fa0e7d730f015996155be97
Kids Safety Ladder Soft Seat Baby Toddler Kid Potty Training Toilet Step Bearing 75KG with Ladder,Kids Safety Ladder Soft Seat Baby Toddler Kid Potty Training Toilet Step Bearing 75KG with Ladder,38.0,EUR,38.0,EUR,46,0,,,5.0,0.0,,,,,,,,,,,,blue,8,Livraison Express,12.0,true,,8,,,CN,Wulishop,wulishop,"90 % avis positifs (38,206 notes)",38206,4.270428728471968,585a55ea4a39b14d5e278371,,,https://www.wish.com/c/5ff55536b1593ad9a612ce3a,https://canary.contestimg.wish.com/api/webimage/5ff55536b1593ad9a612ce3a-medium.jpg,5ff55536b1593ad9a612ce3a
Bike Kupegu Step Footrest Front Foot Pedal Motorcycle Footpeg Bike Footpeg 1,Bike Kupegu Step Footrest Front Foot Pedal Motorcycle Footpeg Bike Footpeg 1,14.0,EUR,14.0,EUR,16,1,,,5.0,0.0,,,,,,,,,,,,,50,Livraison Express,7.0,true,,50,,,CN,shifang,shifang,"93 % avis positifs (24,291 notes)",24291,4.378288254909226,571738c0b25f7a0359ede83c,,,https://www.wish.com/c/5ff93f01cb4abd0053599fad,https://canary.contestimg.wish.com/api/webimage/5ff93f01cb4abd0053599fad-medium.jpg,5ff93f01cb4abd0053599fad
Woodworking Sliding Chute Holder 3-Steps Quick Positioning Clamp Woodworking,Woodworking Sliding Chute Holder 3-Steps Quick Positioning Clamp Woodworking,20.0,EUR,20.0,EUR,24,0,,,5.0,0.0,,,,,,,,,,,,,50,Livraison standard,6.0,false,,50,true,Quantité limitée !,CN,WeeCannAlready,weecannalready,"93 % avis positifs (1,164 notes)",1164,4.445017182130584,5b600cd23652201effba458d,,,https://www.wish.com/c/5fd1f51327564b3758a14462,https://canary.contestimg.wish.com/api/webimage/5fd1f51327564b3758a14462-medium.jpg,5fd1f51327564b3758a14462
Nouveau Mini vélo d'exercice étape Machine maison utilisation vélo étape Machine Gym pédale vélos exercice intérieur,New Mini Exercise Bike Step Machine House Use Bike Step Machine  Gym Pedal Bikes Indoor Exerciser,38.0,EUR,38.0,EUR,46,1,,,5.0,0.0,,,,,,,,,,,coolblack,40x35cm,10,Livraison Express,12.0,true,,29,,,CN,shunyi6668,shunyi6668,"92 % avis positifs (11,950 notes)",11950,4.344016736401674,579f5003ab4062661072cb8f,,,https://www.wish.com/c/5f99296e61e8d61832bf8214,https://canary.contestimg.wish.com/api/webimage/5f99296e61e8d61832bf8214-medium.jpg,5f99296e61e8d61832bf8214
Electric Foot Massager Mat EMS Foot Massager Pad Feet ABS Stimulator with Remote TMPC,Electric Foot Massager Mat EMS Foot Massager Pad Feet ABS Stimulator with Remote TMPC,24.0,EUR,24.0,EUR,28,0,,,5.0,0.0,,,,,,,,,,,,,50,Livraison standard,8.0,false,,50,,,CN,TMPCJBCD,tmpcjbcd,100 % avis positifs (1 notes),1,5.0,5f606415238df1f670d38d12,,,https://www.wish.com/c/6000b72acfeefe9f18e17893,https://canary.contestimg.wish.com/api/webimage/6000b72acfeefe9f18e17893-medium.jpg,6000b72acfeefe9f18e17893
Nouveau 1 Pc / 1 paire orthèse de pied de pied orthèse fasciite plantaire cheville attelle fixe pied orthopédique support de pied pour enfants adultes,New 1Pc/1Pair Foot Drop Brace Orthosis Plantar Fasciitis Ankle Fixed Splint Foot Orthopedic Foot Support for Kids Adult,5.0,EUR,17.0,EUR,6,4,,,5.0,0.0,,,,,,,,,,,black,1pc-kidsize,4,Livraison standard,2.0,false,,50,true,Quantité limitée !,CN,xiangshan store,xiangshanstore,84 % avis positifs (171 notes),171,4.011695906432749,5d58a96d9373f456083a883b,,,https://www.wish.com/c/5fddb0c69a6911003f0f7926,https://canary.contestimg.wish.com/api/webimage/5fddb0c69a6911003f0f7926-medium.jpg,5fddb0c69a6911003f0f7926
Chaussures de course pour hommes Chaussures de sport confortables pour hommes Baskets de rembourrage en plein air athlétiques pour la marche et le jogging,Men's Running Shoes Comfortable Sports Shoes Men Athletic Outdoor Cushioning Sneakers for Walking&Jogging,7.0,EUR,14.0,EUR,8,20000,,,4.161880754055239,9124.0,5263,1869,918,354,720,,,,,,red,4.5,1,Livraison Express,3.0,true,,50,true,Quantité limitée !,CN,hello_beauty,hello_beauty,"90 % avis positifs (14,218 notes)",14218,4.252567168378112,57d663ac241d454a2616bd06,,,https://www.wish.com/c/5a8d1f6fd9179018fcc99d35,https://canary.contestimg.wish.com/api/webimage/5a8d1f6fd9179018fcc99d35-medium.jpg,5a8d1f6fd9179018fcc99d35
Step2,,,,,,,,,,,,,,,,,,,,,,,,,,,,,,,,,,,,,,,,,https://www.wish.com/c/5ed8d4a190b8a634bae4fe0f,,5ed8d4a190b8a634bae4fe0f
Outil professionnel d'accessoire de commande de commutateur de pédale de pied de machine d'équipement de sablage Lin,Professional Sandblasting Equipment Machine Foot Pedal Switch Control Accessory Tool Lin,16.0,EUR,16.0,EUR,19,10,,,4.5,2.0,1,1,0,0,0,,,,,,,,50,Livraison Express,7.0,true,,50,,,CN,LingFeiXiang,lingfeixiang,86 % avis positifs (501 notes),501,4.127744510978044,5d79e9b7288835520331af20,,,https://www.wish.com/c/5f705a8945fb3d0048dce2ae,https://canary.contestimg.wish.com/api/webimage/5f705a8945fb3d0048dce2ae-medium.jpg,5f705a8945fb3d0048dce2ae
Étape poubelle poubelle poubelle poubelle conteneur chambre hôtel bureau pour la maison,Step Trash Can Garbage Bin Dustbin Trash Container Room Hotel Office for Home,30.0,EUR,30.0,EUR,36,0,,,5.0,0.0,,,,,,,,,,,,,50,Livraison standard,9.0,false,,50,,,CN,Fenglinjoy66,fenglinjoy66,"92 % avis positifs (8,588 notes)",8588,4.308453656264555,58a2e83f2302674f3ad635ee,,,https://www.wish.com/c/5fc9d80c0cfc9a098aefacf6,https://canary.contestimg.wish.com/api/webimage/5fc9d80c0cfc9a098aefacf6-medium.jpg,5fc9d80c0cfc9a098aefacf6
Siège de toilette d'apprentissage de la propreté avec escabeau pour garçons et filles bébé enfant en bas âge enfant enfants siège d'entraînement de toilette chaise avec poignées siège rembourré large marche antidérapante,Potty Training Toilet Seat with Step Stool Ladder for Boys and Girls Baby Toddler Kid Children Toilet Training Seat Chair with Handles Padded Seat Non-Slip Wide Step,32.0,EUR,32.0,EUR,38,10,,,5.0,4.0,4,0,0,0,0,,,,,,red,,50,Livraison Express,11.0,true,,50,true,Quantité limitée !,CN,Luoshiftyao,luoshiftyao,92 % avis positifs (922 notes),922,4.372017353579175,5d639632283abc60dc4ddd41,,,https://www.wish.com/c/5f222a4d02400b2018d1b72c,https://canary.contestimg.wish.com/api/webimage/5f222a4d02400b2018d1b72c-medium.jpg,5f222a4d02400b2018d1b72c
2021 plus récent HD antidérapant danse étape tapis de danse Pad Pads danseur couverture Fitness équipement révolution pied tapis d'impression à PC avec USB nouveau,2021 Newest HD Non-Slip Dancing Step Dance Mat Pad Pads Dancer Blanket Fitness Equipment Revolution Foot Print Mat To PC with USB New,17.0,EUR,17.0,EUR,20,10,,,3.3333333333333335,9.0,3,1,2,2,1,,,,,,,,50,Livraison standard,6.0,false,,50,,,CN,Liuzhongye112818,liuzhongye112818,82 % avis positifs (970 notes),970,3.904123711340206,5eb018fd2adba513c6e8eb35,,,https://www.wish.com/c/5fd35142509a165560b56923,https://canary.contestimg.wish.com/api/webimage/5fd35142509a165560b56923-medium.jpg,5fd35142509a165560b56923
Mode Fille Femmes Tap Dance Step Dance PU Chaussures en cuir artificiel C9Ds,Fashion Girl Women Tap Dance Step Dance PU Artificial Leather Shoes C9Ds,23.0,EUR,23.0,EUR,27,3,,,5.0,0.0,,,,,,,,,,,red,,50,Livraison standard,7.0,false,,50,,,CN,C9Dshop,c9dshop,"93 % avis positifs (6,444 notes)",6444,4.4121663563004345,58e6fe5ab5fde3105f62c10c,,,https://www.wish.com/c/5fd713f83823e95026182ad8,https://canary.contestimg.wish.com/api/webimage/5fd713f83823e95026182ad8-medium.jpg,5fd713f83823e95026182ad8
2019 nouveau 1 paire de protecteur de manchon Super élastique pour oignon empêchent les blessures Hallux Valgus - correcteur d'orteil pour soins des pieds soins de santé,2019 NEW 1 Pair Super Elastic Bunion Sleeve Protector Prevent Hallux Valgus Injury - Foot Caring Toe Corrector Health Care,5.0,EUR,5.0,EUR,5,1000,,,4.221327967806841,497.0,296,88,68,17,28,,,,,,,,50,Livraison standard,1.0,false,,50,,,CN,wangjiali003,wangjiali003,"(8,055 notes)",8055,4.0911235257603975,58d2597a448af36bb62b8646,,,https://www.wish.com/c/5cdcbf63034a3c37090c7554,https://canary.contestimg.wish.com/api/webimage/5cdcbf63034a3c37090c7554-medium.jpg,5cdcbf63034a3c37090c7554
Kinzo,,,,,,,,,,,,,,,,,,,,,,,,,,,,,,,,,,,,,,,,,https://www.wish.com/c/5e8d300b9719ed6404967801,,5e8d300b9719ed6404967801
DON'T FOLLOW IN MY FOOTSTEPS - Unisex Cotton T-Shirt Tee Shirt,DON'T FOLLOW IN MY FOOTSTEPS - Unisex Cotton T-Shirt Tee Shirt,16.0,EUR,17.0,EUR,19,0,,,5.0,0.0,,,,,,,,,,,,men-s,50,Livraison standard,6.0,false,,50,,,CN,zhanglanzhen66058,zhanglanzhen66058,44 % avis positifs (16 notes),16,2.6875,5f8d0807ab43aae4d63be03f,,,https://www.wish.com/c/6030c5dd01adaad0fbde4f9c,https://canary.contestimg.wish.com/api/webimage/6030c5dd01adaad0fbde4f9c-medium.jpg,6030c5dd01adaad0fbde4f9c
Z-Hunter,,,,,,,,,,,,,,,,,,,,,,,,,,,,,,,,,,,,,,,,,https://www.wish.com/c/5e8d2fea9719ed6404967731,,5e8d2fea9719ed6404967731
In the Footsteps of Elephant Men's T shirt,In the Footsteps of Elephant Men's T shirt,19.0,EUR,19.0,EUR,23,0,,,5.0,0.0,,,,,,,,,,,white,s,50,Livraison standard,6.0,false,,50,,,US,RioLeigh Beauty,rioleighbeauty,,0,5.0,60123be051c9873451aad399,,,https://www.wish.com/c/6059baf82456e96c5ae26ff2,https://canary.contestimg.wish.com/api/webimage/6059baf82456e96c5ae26ff2-medium.jpg,6059baf82456e96c5ae26ff2
Sparkling Dog Footsteps Shining Sunflower Beautiful Natural Creature Gift For Sunflower Lover Car Decal / Walls Decal / Trucks Decal / Phone Case Decal 6'' - 14'',Sparkling Dog Footsteps Shining Sunflower Beautiful Natural Creature Gift For Sunflower Lover Car Decal / Walls Decal / Trucks Decal / Phone Case Decal 6'' - 14'',7.0,EUR,7.0,EUR,8.0,0,,,5.0,0.0,,,,,,,,,,,,6×9,50,Livraison standard,8.99,false,,50,,,VN,maccc,maccc,90 % avis positifs (303 notes),303,4.32013201320132,5ffea615fa9415150cb997db,,,https://www.wish.com/c/605abc1ed7edbef4a56480fc,https://canary.contestimg.wish.com/api/webimage/605abc1ed7edbef4a56480fc-medium.jpg,605abc1ed7edbef4a56480fc
1 paire de semelles souples en Gel de Silicone pour éperon de talon et douleur pieds coussin pied masseur soins demi talon semelle intérieure coussin de chaussure augmentation de la hauteur,1Pair Silicone Gel Soft Insoles for Heel Spur and Pain Feet Cushion Foot Massager Care Half Heel Insole Shoe Pad Height Increase,4.77,EUR,5.0,EUR,5.78,10,,,4.166666666666667,6.0,3,1,2,0,0,,,,,,rosered,,50,Livraison Express,7.0,true,,50,,,US,lalolnumjra,lalolnumjra,"(2,191 notes)",2191,4.344591510725696,5e5fc64dd6f61c5cda7a498c,,,https://www.wish.com/c/5ec4ccb7ad9f8501fd6e9bf9,https://canary.contestimg.wish.com/api/webimage/5ec4ccb7ad9f8501fd6e9bf9-medium.jpg,5ec4ccb7ad9f8501fd6e9bf9
2PCS caoutchouc anti-dérapant de remplacement échelle pieds pied tapis semelle de coussin,2PCS Rubber Non Slip Replacement Step Ladder Feet Foot Mat Cushion Sole,8.0,EUR,8.0,EUR,9,2,,,5.0,0.0,,,,,,,,,,,,,28,Livraison standard,3.0,false,,28,,,CN,CCMV892,ccmv892,"92 % avis positifs (8,618 notes)",8618,4.3349965189139015,5912bcd4bff209529e8ab737,,,https://www.wish.com/c/5efda9f22a234e74faf339bf,https://canary.contestimg.wish.com/api/webimage/5efda9f22a234e74faf339bf-medium.jpg,5efda9f22a234e74faf339bf
"Attelle de pied de nuit de fasciite plantaire réglable, orthèse orthopédique, attelle de nuit dorsale élastique",Adjustable Plantar Fasciitis Night Foot Splint Drop Orthotic Brace Elastic Dorsal Night Splint ,7.0,EUR,7.0,EUR,8,10,,,4.833333333333333,6.0,5,1,0,0,0,,,,,,,,50,Livraison standard,3.0,false,,50,true,Quantité limitée !,CN,shanghaishijianmengdianzishangwuyouxiangongsi,上海市简梦电子商务有限公司,"91 % avis positifs (17,916 notes)",17916,4.308774279973209,54c09889e0b8666ef329eead,,,https://www.wish.com/c/60000f1b856d9a06e9fd1da7,https://canary.contestimg.wish.com/api/webimage/60000f1b856d9a06e9fd1da7-medium.jpg,60000f1b856d9a06e9fd1da7
2PCS 4 People Giants Footsteps Trams Fastening Tape Outdoor Team Games Training Equipment,2PCS 4 People Giants Footsteps Trams Fastening Tape Outdoor Team Games Training Equipment,16.0,EUR,16.0,EUR,19,0,,,5.0,0.0,,,,,,,,,,,red,,50,Livraison standard,5.0,false,,50,,,CN,Wfating,wfating,"86 % avis positifs (1,385 notes)",1385,4.085198555956679,5d4938fc70327a5558b85654,,,https://www.wish.com/c/5fe4868160dc360048323287,https://canary.contestimg.wish.com/api/webimage/5fe4868160dc360048323287-medium.jpg,5fe4868160dc360048323287
Google,,,,,,,,,,,,,,,,,,,,,,,,,,,,,,,,,,,,,,,,,https://www.wish.com/c/5e8d2ffc9719ed640496779e,,5e8d2ffc9719ed640496779e
Portable enfants bébé pot formation siège toilette pot formateur intensifier tabouret doux coussin chaise avec échelle roulement 75 KG,Portable Kids Baby Potty Training Seat Toilet Potty Trainer Step Up Stool Soft Cushion Chair with Ladder Bearing 75KG,29.0,EUR,29.0,EUR,35,0,,,5.0,0.0,,,,,,,,,,,blue,,8,Livraison Express,9.0,true,,8,,,CN,AutoPartsmall,autopartsmall,"90 % avis positifs (9,099 notes)",9099,4.262336520496758,5b0e6b747752c81e130357c0,,,https://www.wish.com/c/5feaed623ab3e71b42a3d6d7,https://canary.contestimg.wish.com/api/webimage/5feaed623ab3e71b42a3d6d7-medium.jpg,5feaed623ab3e71b42a3d6d7
Waterpik,,,,,,,,,,,,,,,,,,,,,,,,,,,,,,,,,,,,,,,,,https://www.wish.com/c/5efb1b85eb31f93761263161,,5efb1b85eb31f93761263161
2021 plus récent HD antidérapant danse étape tapis de danse Pad Pads danseur couverture Fitness équipement révolution pied tapis d'impression à PC avec USB nouveau,2021 Newest HD Non-Slip Dancing Step Dance Mat Pad Pads Dancer Blanket Fitness Equipment Revolution Foot Print Mat To PC with USB New,16.0,EUR,16.0,EUR,19,10,,,5.0,2.0,2,0,0,0,0,,,,,,,,50,Livraison standard,6.0,false,,50,,,CN,RYstore008,rystore008,"86 % avis positifs (11,532 notes)",11532,4.102323968088796,58cb5b95f386f951cc2c6d46,,,https://www.wish.com/c/5fd35168fab2596bd8b50342,https://canary.contestimg.wish.com/api/webimage/5fd35168fab2596bd8b50342-medium.jpg,5fd35168fab2596bd8b50342
Kkmoon,,,,,,,,,,,,,,,,,,,,,,,,,,,,,,,,,,,,,,,,,https://www.wish.com/c/5ee20ef7eb31f902cf33bc73,,5ee20ef7eb31f902cf33bc73
81 Keys Piano Stickers Footsteps Keyboard Stickers,81 Keys Piano Stickers Footsteps Keyboard Stickers,3.04,EUR,4.0,EUR,3.6799999999999997,0,,,5.0,0.0,,,,,,,,,,,,,50,Livraison Express,5.0,true,,50,,,CN,Charles' House,yiwulalangelectronictechnologycoltd,"91 % avis positifs (490,206 notes)",490206,4.290522759819341,5406b68dc5c2464983dc5c7a,,,https://www.wish.com/c/58f8112c3c47a41a84775ac5,https://canary.contestimg.wish.com/api/webimage/58f8112c3c47a41a84775ac5-medium.jpg,58f8112c3c47a41a84775ac5
Pédale de porte de voiture SUV Véhicule Pédale de pied Pliable En Alliage D'aluminium Porte Escabeau Portable Accès Facile À La Porte Sur Le Toit Étape Crochet Fournitures De Voiture Avec Fonction Marteau De Sécurité,Car Door Pedal SUV Vehicle Foot Pedal Foldable  Aluminum Alloy Door Step Ladder Portable Easy Access To Rooftop Door Step Hook Car Supplies with Safety Hammer Function,14.0,EUR,14.0,EUR,16,10,,,4.512953367875648,193.0,130,41,15,5,2,,,,,,black,1pc,50,Livraison standard,4.0,false,,50,,,CN,dongxieu,dongxieu,"91 % avis positifs (5,940 notes)",5940,4.28030303030303,58d61f8a5b2e62534721f738,,,https://www.wish.com/c/5deb8bf225945e11af50beca,https://canary.contestimg.wish.com/api/webimage/5deb8bf225945e11af50beca-medium.jpg,5deb8bf225945e11af50beca
Nouveau ballon de natation anneau de yoga balle matelas gonflable jouet pied soufflet pompe à air,New Balloon Swimming Ring Yoga Ball Mattress Inflatable Toy Foot Bellow Air Pump,11.0,EUR,11.0,EUR,13,10,,,4.333333333333333,27.0,15,7,4,1,0,,,,,,,,50,Livraison standard,3.0,false,,50,,,CN,BuyInFun,buyinfun,"91 % avis positifs (36,034 notes)",36034,4.298412610312482,56f2453ba46e745880ee5e0f,,,https://www.wish.com/c/5731bb143824fb6dff098358,https://canary.contestimg.wish.com/api/webimage/5731bb143824fb6dff098358-medium.jpg,5731bb143824fb6dff098358
"Lip gloss 6 index 1 ointment Colorless water and loss of hair moisturizing moisture sex fever men's and women's 3 spots [random footsteps of flower clothes] (4680), 1 piece","Lip gloss 6 index 1 ointment Colorless water and loss of hair moisturizing moisture sex fever men's and women's 3 spots [random footsteps of flower clothes] (4680), 1 piece",31.0,EUR,31.0,EUR,37,0,,,5.0,0.0,,,,,,,,,,,,,50,Livraison standard,10.0,false,,50,true,Quantité limitée !,KR,CELLACOS,cellacos,100 % avis positifs (1 notes),1,5.0,600810561a65ebab003dcd77,,,https://www.wish.com/c/6012a80b4d6ffee20b383290,https://canary.contestimg.wish.com/api/webimage/6012a80b4d6ffee20b383290-medium.jpg,6012a80b4d6ffee20b383290
