title,title_orig,discount_price,discount_price_currency,retail_price,retail_price_currency,discount_price_in_original_currency,nb_cart_orders_approx,nb_units_purchased_approx,uses_ad_boosts,rating,rating_count,rating_five_count,rating_four_count,rating_three_count,rating_two_count,rating_one_count,badges_count,badge_local_product,badge_product_quality,badge_fast_shipping,tags,product_color,product_variation_size_id,product_variation_inventory,shipping_option_name,shipping_option_price,shipping_is_express,countries_shipped_to,inventory_total,has_urgency_banner,urgency_text,origin_country,merchant_title,merchant_name,merchant_info_subtitle,merchant_rating_count,merchant_rating,merchant_id,merchant_has_profile_picture,merchant_profile_picture,product_url,product_picture,product_id
New Universal Car Door Pedal Aluminum Alloy Black Practical Folding Car Door Step Latch Hook Foot Pedal Ladder Mini Vehicle Doorstep,New Universal Car Door Pedal Aluminum Alloy Black Practical Folding Car Door Step Latch Hook Foot Pedal Ladder Mini Vehicle Doorstep,13.0,EUR,13.0,EUR,15,2,,,5.0,0.0,,,,,,,,,,,black,,50,Livraison standard,4.0,false,,50,,,CN,Redbey32,redbey32,85 % avis positifs (189 notes),189,4.084656084656085,5f0bb8d930f90150d4a4c7ae,,,https://www.wish.com/c/607e725713b7fef8e8671ca5,https://canary.contestimg.wish.com/api/webimage/607e725713b7fef8e8671ca5-medium.jpg,607e725713b7fef8e8671ca5
Échelle de pédale de pied de marche de crochet de loquet de porte de voiture pliante en alliage d'aluminium de haute qualité pour Jeep SUV camion pièces intérieures de voiture pédales de toit,High Quality Aluminum Alloy Folding Car Door Latch Hook Step Foot Pedal Ladder for Jeep SUV Truck Car Interior Parts Roof Pedals,15.0,EUR,33.0,EUR,17,10,,,4.0,1.0,0,1,0,0,0,,,,,,black,,50,Livraison standard,5.0,false,,50,,,CN,Gettingwhatyouwant,gettingwhatyouwant,"93 % avis positifs (2,676 notes)",2676,4.373692077727952,598ae6a7b77173436b0689aa,,,https://www.wish.com/c/5d20563003b70b3c15e677a2,https://canary.contestimg.wish.com/api/webimage/5d20563003b70b3c15e677a2-medium.jpg,5d20563003b70b3c15e677a2
Mini vélo d'exercice Step Machine Home Gym Pedal Bikes Exerciseur d'intérieur (sans batterie),Mini Exercise Bike Step Machine Home Gym Pedal Bikes Indoor Exerciser (No Battery),39.0,EUR,39.0,EUR,47,0,,,5.0,0.0,,,,,,,,,,,,,10,Livraison Express,13.0,true,,10,,,CN,taozijiadiandianpu,taozijiadiandianpu,"90 % avis positifs (1,652 notes)",1652,4.302058111380146,5d524b3b1527541f5a5ff1df,,,https://www.wish.com/c/5f7176757ccf122a05a13749,https://canary.contestimg.wish.com/api/webimage/5f7176757ccf122a05a13749-medium.jpg,5f7176757ccf122a05a13749
1 paire de semelles de talon coussin coussin soulagement de l'absorption des chocs douleur au pied inserts souples,1 Pair Heel Pad Insoles Cushion Shock Absorption Relief Foot Pain Soft Inserts,4.0,EUR,9.0,EUR,4,10,,,3.9411764705882355,17.0,10,1,3,1,2,,,,,,black,,50,Livraison standard,1.0,false,,50,,,CN,zhangziyifly,zhangziyifly,"94 % avis positifs (2,806 notes)",2806,4.468638631503921,5ac884aaea876406a21d1e6a,,,https://www.wish.com/c/5c9702a08de79618373fcc91,https://canary.contestimg.wish.com/api/webimage/5c9702a08de79618373fcc91-medium.jpg,5c9702a08de79618373fcc91
Electric Foot Calf Leg Massager Shiatsu Kneading Rolling Relaxation Vibrating,Electric Foot Calf Leg Massager Shiatsu Kneading Rolling Relaxation Vibrating,25.0,EUR,25.0,EUR,30,0,,,5.0,0.0,,,,,,,,,,,,,50,Livraison standard,8.0,false,,50,,,CN,Junyuyuan,junyuyuan,"95 % avis positifs (5,686 notes)",5686,4.530953218431234,5955eb3b53ebe20362f40e94,,,https://www.wish.com/c/5fd37f45d8c894dc1eea3487,https://canary.contestimg.wish.com/api/webimage/5fd37f45d8c894dc1eea3487-medium.jpg,5fd37f45d8c894dc1eea3487
1 paire / 2 pièces Super élastique oignon manchon protecteur prévenir les blessures Hallux Valgus - soin des pieds correcteur d'orteil soins de santé,1 Pair/2 Pcs Super Elastic Bunion Sleeve Protector Prevent Hallux Valgus Injury - Foot Caring Toe Corrector Health Care,3.88,EUR,13.0,EUR,4.7,1000,,,4.270833333333333,96.0,64,11,9,7,5,,,,,,,1pair,50,Livraison standard,1.0,false,,50,,,CN,Superphonics tools,superphonicstools,(586 notes),586,4.368600682593857,5d41791e72b0c94d00f8a96d,,,https://www.wish.com/c/5fe2a04d59deb34a745de5ab,https://canary.contestimg.wish.com/api/webimage/5fe2a04d59deb34a745de5ab-medium.jpg,5fe2a04d59deb34a745de5ab
Toy Story,,,,,,,,,,,,,,,,,,,,,,,,,,,,,,,,,,,,,,,,,https://www.wish.com/c/5ed782f990b8a6318c2d7249,,5ed782f990b8a6318c2d7249
Nouveau tapis de danse d'étape de danse antidérapant détection de mouvement sans fil précis tapis de jeu d'impression de pied tapis de remise en forme à tapis de danse PC TV,NEW Non Slip Dancing Step Dance Mat motion sensing wireless accurate Foot Print Game Mats fitness Pads To PC TV Dancing Mat,22.0,EUR,22.0,EUR,26,4,,,1.0,1.0,0,0,0,0,1,,,,,,,purple(1pcs),50,Livraison standard,7.0,false,,50,,,CN,Consultingshop,consultingshop,80 % avis positifs (945 notes),945,3.833862433862434,5d5e008a2736787c4114d3f3,,,https://www.wish.com/c/5f6af0bf3168fb04c874558f,https://canary.contestimg.wish.com/api/webimage/5f6af0bf3168fb04c874558f-medium.jpg,5f6af0bf3168fb04c874558f
Bicycle Foot Step Steel Foldable Fork Foot Step Peg MTB Bike Foot Peda Parts,Bicycle Foot Step Steel Foldable Fork Foot Step Peg MTB Bike Foot Peda Parts,24.0,EUR,24.0,EUR,28,0,,,5.0,0.0,,,,,,,,,,,,silver,50,Livraison standard,8.0,false,,50,,,CN,wangkepeng7467363,wangkepeng7467363,90 % avis positifs (10 notes),10,4.4,5fb607cb31402f3d38deda9d,,,https://www.wish.com/c/5fd2319ec579f98859d8278d,https://canary.contestimg.wish.com/api/webimage/5fd2319ec579f98859d8278d-medium.jpg,5fd2319ec579f98859d8278d
"Attelle orthopédique réglable pour chute de pied Fasciite plantaire Attelle de nuit Attelle élastique dorsale pour fasciite plantaire, talon, cheville, douleur au pied de la voûte plantaire, tendinite d'Achille avec épines dures","Adjustable Foot Drop Orthotic Brace Plantar Fasciitis Night Splint Elastic Dorsal for Plantar Fasciitis, Heel, Ankle, Arch Foot Pain, Achilles Tendonitis with Hard Spiky",8.0,EUR,8.0,EUR,9,10,,,4.363636363636363,11.0,6,3,2,0,0,,,,,,,1pcs,50,Livraison Express,6.0,true,,50,true,Quantité limitée !,CN,myunsunyu1,myunsunyu1,"91 % avis positifs (15,478 notes)",15478,4.2953223930740405,578cd5853a698c3d52519509,,,https://www.wish.com/c/5eec5b443186da0fc9bc2dd5,https://canary.contestimg.wish.com/api/webimage/5eec5b443186da0fc9bc2dd5-medium.jpg,5eec5b443186da0fc9bc2dd5
Nearly Natural,,,,,,,,,,,,,,,,,,,,,,,,,,,,,,,,,,,,,,,,,https://www.wish.com/c/5f254ba090b8a6e847dddcdf,,5f254ba090b8a6e847dddcdf
Hommes Femmes Coussin d'Air Air Chaussures de Basketball Chaussures de Tennis Chaussures de Course Chaussures de Tennis Fashion Baskets Baskets 35-47,Men's Womens Air Cushion Basketball Shoes Running Tennis Shoes Fashion Sneaker 35-47,13.0,EUR,137.0,EUR,15,1000,,,4.377358490566038,318.0,216,52,22,10,18,,,,,,grey,us3,50,Livraison standard,4.0,false,,50,,,CN,Mechanicalteamten,mechanicalteamten,"85 % avis positifs (2,351 notes)",2351,4.042960442364951,59bba8f94b913a37a3535823,,,https://www.wish.com/c/5b593d38791ef8136f8ed617,https://canary.contestimg.wish.com/api/webimage/5b593d38791ef8136f8ed617-medium.jpg,5b593d38791ef8136f8ed617
Plaque de fixation de pédale de pied de poussette de bébé Accessoires de poussette jumelle,Baby Stroller Foot Pedal Fixing Plate Twin Stroller Accessories,29.0,EUR,29.0,EUR,34,1,,,5.0,0.0,,,,,,,,,,,babyblue,,1,Livraison standard,9.0,false,,50,,,US,Lose Sleep,losesleep,72 % avis positifs (148 notes),148,3.641891891891892,5f7182979998352270822416,,,https://www.wish.com/c/5fd46c68c593d59d0ab9808f,https://canary.contestimg.wish.com/api/webimage/5fd46c68c593d59d0ab9808f-medium.jpg,5fd46c68c593d59d0ab9808f
Canvas Print - Following the footsteps of Columbus,Canvas Print - Following the footsteps of Columbus,62.0,EUR,96.0,EUR,75.0,0,,,5.0,0.0,,,,,,,,,,,,120x60,50,Livraison standard,16.0,false,,50,,,SE,DecorDecor,decordecor,94 % avis positifs (16 notes),16,4.75,5d23af55871f553cd8a06c2f,,,https://www.wish.com/c/5d374930d5f3516a18b8d026,https://canary.contestimg.wish.com/api/webimage/5d374930d5f3516a18b8d026-medium.jpg,5d374930d5f3516a18b8d026
Dove,,,,,,,,,,,,,,,,,,,,,,,,,,,,,,,,,,,,,,,,,https://www.wish.com/c/5e8d2fd29719ed6404967698,,5e8d2fd29719ed6404967698
Hello Kitty,,,,,,,,,,,,,,,,,,,,,,,,,,,,,,,,,,,,,,,,,https://www.wish.com/c/5e542cf99719ed19e8484853,,5e542cf99719ed19e8484853
1 Pair Outdoor TeamworkTraining Webbing Footsteps Belt Funny Game Props,1 Pair Outdoor TeamworkTraining Webbing Footsteps Belt Funny Game Props,14.0,EUR,14.0,EUR,16,0,,,5.0,0.0,,,,,,,,,,,,115x5cm,10,Livraison standard,5.0,false,,10,true,Quantité limitée !,CN,Shoppingtalent,shoppingtalent,"87 % avis positifs (2,691 notes)",2691,4.098476402824229,5913ebf5bb57331c018f0686,,,https://www.wish.com/c/5fa17c15abe34c56a6fd7363,https://canary.contestimg.wish.com/api/webimage/5fa17c15abe34c56a6fd7363-medium.jpg,5fa17c15abe34c56a6fd7363
Baby Kids Portable Toilet Soft Chair Potty Training Step Stool Ladder Toddler,Baby Kids Portable Toilet Soft Chair Potty Training Step Stool Ladder Toddler,39.0,EUR,39.0,EUR,47,0,,,5.0,0.0,,,,,,,,,,,red,,50,Livraison Express,12.0,true,,50,,,CN,yuanchengshop,yuanchengshop,"94 % avis positifs (46,633 notes)",46633,4.409280981279352,581d55217959440f8063902d,,,https://www.wish.com/c/607814ecb8d902bae18e0f05,https://canary.contestimg.wish.com/api/webimage/607814ecb8d902bae18e0f05-medium.jpg,607814ecb8d902bae18e0f05
"Folding Step Ladder Aluminum Alloy, Multi - Use Heavy Duty Step Ladder For Industrial Household Daily","Folding Step Ladder Aluminum Alloy, Multi - Use Heavy Duty Step Ladder For Industrial Household Daily",123.0,EUR,123.0,EUR,149.0,0,,,5.0,0.0,,,,,,,,,,,,,50,Livraison standard,12.0,false,,50,,,CN,YYIshop,yyishop,"93 % avis positifs (3,710 notes)",3710,4.39622641509434,5b04d7b58b8be959ff222249,,,https://www.wish.com/c/5fc23bb2bd10f731a6f49c12,https://canary.contestimg.wish.com/api/webimage/5fc23bb2bd10f731a6f49c12-medium.jpg,5fc23bb2bd10f731a6f49c12
Mini vélo d'exercice durable machine à pédale de gymnastique à domicile,Mini Durable Exercise Bike Step Machine Home Gym Pedal Bikes Indoor Exerciser,41.0,EUR,41.0,EUR,49.0,3,,,3.0,1.0,0,0,1,0,0,,,,,,,black,4,Livraison Express,12.0,true,,4,,,CN,HongXing123 Shop,hongxing123shop,93 % avis positifs (338 notes),338,4.396449704142012,5b4da8565d643e2e3e321ee7,,,https://www.wish.com/c/6017aa3723bf630042181b36,https://canary.contestimg.wish.com/api/webimage/6017aa3723bf630042181b36-medium.jpg,6017aa3723bf630042181b36
Hommes Camouflage Chaussures de sécurité respirantes Chaussures de travail Bottes de travail à embout d'acier Chaussures anti-crevaison Chaussures de randonnée Chaussures de protection 35-48,Men Camouflage Breathable Safety Shoes Work Shoes Steel Toe Work Boots Shoes Puncture Proof Hiking Shoes Protective Shoes 35-48,19.0,EUR,577.0,EUR,22,10,,,4.395833333333333,96.0,62,22,6,0,6,,,,,,black,us3,5,Livraison standard,5.0,false,,50,,,CN,yaobai,yaobai,"84 % avis positifs (3,743 notes)",3743,3.9783596045952443,5ab224540e63fa645637032f,,,https://www.wish.com/c/5d95acd5ba74302bd301834e,https://canary.contestimg.wish.com/api/webimage/5d95acd5ba74302bd301834e-medium.jpg,5d95acd5ba74302bd301834e
25 JEU DE PIED DE PRESSE TIGE HAUTE pour JUKI TL98 Q QE JUKI INDUSTRIAL COUTURE MACHINE,25 PRESSER FOOT SET HIGH SHANK for JUKI TL98 Q QE JUKI INDUSTRIAL SEWING MACHINE,29.0,EUR,29.0,EUR,34,5,,,5.0,1.0,1,0,0,0,0,,,,,,,,1,Livraison standard,9.0,false,,1,,,CN,Goldensewing,goldensewing,97 % avis positifs (386 notes),386,4.715025906735751,596daf4cb1a4ca0e92c9eedb,,,https://www.wish.com/c/5a119e120a332a47eaf86c62,https://canary.contestimg.wish.com/api/webimage/5a119e120a332a47eaf86c62-medium.jpg,5a119e120a332a47eaf86c62
Chaussures de sports nautiques Chaussures aux pieds nus Chaussettes de plage à séchage rapide Aqua Yoga Slip-On pour hommes femmes,Water Sports Shoes Barefoot Shoes Quick-Dry Aqua Yoga Beach Socks Slip-On For Men Women,6.0,EUR,10.0,EUR,7,1000,,,4.467889908256881,654.0,446,121,53,15,19,,,,,,blue,us5.5-us6(forwomen),50,Livraison Express,6.0,true,,50,,,CN,pimingm123youxiang,pimingm123youxiang,"92 % avis positifs (21,079 notes)",21079,4.313629678827269,5acefb3c67d25c390d907140,,,https://www.wish.com/c/5af516070fa44114d0570f31,https://canary.contestimg.wish.com/api/webimage/5af516070fa44114d0570f31-medium.jpg,5af516070fa44114d0570f31
Jim Centorino - Footsteps in the Sand [CD],Jim Centorino - Footsteps in the Sand [CD],25.0,EUR,35.0,EUR,30,0,,,5.0,0.0,,,,,,,,,,,,,1,Livraison standard,9.0,false,,1,,,US,DeepDiscountIntl,deepdiscountintl,"95 % avis positifs (4,096 notes)",4096,4.605224609375,593abd6720d56c2f0e3f3af0,,,https://www.wish.com/c/5b4045dd8a2da47d69396c2c,https://canary.contestimg.wish.com/api/webimage/5b4045dd8a2da47d69396c2c-medium.jpg,5b4045dd8a2da47d69396c2c
NHL (National Hockey League),,,,,,,,,,,,,,,,,,,,,,,,,,,,,,,,,,,,,,,,,https://www.wish.com/c/5e542cfc9719ed19e848486b,,5e542cfc9719ed19e848486b
Fixateur Pédicure Récupérer Soins Des Pieds Nail Outil Correction Fichier Acronyx Fil Onyxis Oignon Correcteur pour Orteils Incarnés Ongles,Fixer Pedicure Recover Foot Care Nail Tool Correction File Acronyx Wire Onyxis Bunion Corrector for Toes Ingrown Toenails,3.97,EUR,4.0,EUR,4.8100000000000005,5000,,,3.9919700214132763,1868.0,982,330,286,99,171,,,,,,,6pairs,50,Livraison Express,3.0,true,,50,true,Quantité limitée !,CN,dream_studio,dream_studio,"(111,864 notes)",111864,4.308875062575985,58f6f47891a95f10f0c54b8c,,,https://www.wish.com/c/5a28efecc3834b2f97f7c800,https://canary.contestimg.wish.com/api/webimage/5a28efecc3834b2f97f7c800-medium.jpg,5a28efecc3834b2f97f7c800
dancingnail,,,,,,,,,,,,,,,,,,,,,,,,,,,,,,,,,,,,,,,,,https://www.wish.com/c/5f843757eb31f9d4a552c9df,,5f843757eb31f9d4a552c9df
"Adjustable Foot Stool - Stepping Stool For Adults And Children, Heavy Duty Portable Medical Footstool Bath Shower Seat Shower Stool ","Adjustable Foot Stool - Stepping Stool For Adults And Children, Heavy Duty Portable Medical Footstool Bath Shower Seat Shower Stool ",34.0,EUR,34.0,EUR,41,0,,,5.0,0.0,,,,,,,,,,,,,50,Livraison Express,12.0,true,,50,,,CN,Wovbagil,wovbagil,60 % avis positifs (5 notes),5,3.2,5f6af6efa9b0ce0bb855e64f,,,https://www.wish.com/c/5f998a3eff66c5004d7f3116,https://canary.contestimg.wish.com/api/webimage/5f998a3eff66c5004d7f3116-medium.jpg,5f998a3eff66c5004d7f3116
Bottes mi-mollet vintage en fausse peau de daim pour femmes Bottes d'hiver à pompons à franges et à franges à pompons Taille Plus 34-47,Vintage Women's Faux Suede Mid-calf Flat Boots Winter Tassel Moccasin Tassel Fringe Boots Plus Size 34-47,16.0,EUR,202.0,EUR,19,1000,,,4.440972222222222,864.0,614,131,50,24,45,,,,,,black,4,50,Livraison standard,6.0,false,,50,true,Quantité limitée !,CN,Happy's Ladies,happysladies,"90 % avis positifs (9,343 notes)",9343,4.283634806807235,5420d51af6d29608e2f9425c,,,https://www.wish.com/c/582d61813d6ce619e13980e6,https://canary.contestimg.wish.com/api/webimage/582d61813d6ce619e13980e6-medium.jpg,582d61813d6ce619e13980e6
Chauffe-pieds électrique USB Interrupteur à 3 étapes Fonction de minuterie de chauffage intégré Économie d'énergie Démarrage sûr Couvre-pied chaud Pieds Coussin chauffant,USB Electric Foot Warmer 3 Step Switch Built-in Heater Timer Function Power Saving Safe Start Warm Foot Cover Feet Heating Pad,20.0,EUR,20.0,EUR,24,10,,,3.6666666666666665,6.0,4,0,0,0,2,,,,,,grey,,50,Livraison standard,6.0,false,,50,,,CN,KanKan nan,kankannan,82 % avis positifs (98 notes),98,3.9591836734693877,5d09da6fc1171619cc6968a5,,,https://www.wish.com/c/5dee13d8c2a85a45e5a2cc20,https://canary.contestimg.wish.com/api/webimage/5dee13d8c2a85a45e5a2cc20-medium.jpg,5dee13d8c2a85a45e5a2cc20
Promend,,,,,,,,,,,,,,,,,,,,,,,,,,,,,,,,,,,,,,,,,https://www.wish.com/c/5f04560c90b8a6f245136a6e,,5f04560c90b8a6f245136a6e
Cat shirt-Area of Footsteps-fun birthday gift cool printed,Cat shirt-Area of Footsteps-fun birthday gift cool printed,17.0,EUR,17.0,EUR,20,0,,,5.0,0.0,,,,,,,,,,,,men-s,50,Livraison standard,6.0,false,,50,,,CN,fengcaizhen567,fengcaizhen567,80 % avis positifs (46 notes),46,3.9782608695652173,5e79c45435692d7271c0d98f,,,https://www.wish.com/c/5f1e930640261cf75992413a,https://canary.contestimg.wish.com/api/webimage/5f1e930640261cf75992413a-medium.jpg,5f1e930640261cf75992413a
Multifunctional Electric Household Sewing Machine Double Thread Double Speed LED Light Foot Pedal Clothes Fabrics Electric Sewing Machine 2 Types,Multifunctional Electric Household Sewing Machine Double Thread Double Speed LED Light Foot Pedal Clothes Fabrics Electric Sewing Machine 2 Types,14.0,EUR,14.0,EUR,16,2,,,5.0,0.0,,,,,,,,,,,,a,10,Livraison standard,4.0,false,,50,true,Quantité limitée !,CN,ddigita,ddigita,85 % avis positifs (423 notes),423,4.056737588652482,5e6738045a3e1f50798fabfe,,,https://www.wish.com/c/60630924753c5df5596d7f17,https://canary.contestimg.wish.com/api/webimage/60630924753c5df5596d7f17-medium.jpg,60630924753c5df5596d7f17
Pieds d'échelle pliables solides pour véhicules de voiture pliables Accès facile au toit de la voiture avec un marteau de sécurité,Strong Foldable Car Vehicle Folding Stepping Ladder Foot Pegs Easy Access to Car Rooftop With Safety Hammer,12.0,EUR,12.0,EUR,14,1,,,5.0,0.0,,,,,,,,,,,black,,50,Livraison standard,4.0,false,,50,,,CN,x23d59p7,x23d59p7,"96 % avis positifs (2,697 notes)",2697,4.550241008527994,5d5122ba7edfad37fa0a66cd,,,https://www.wish.com/c/5df75151eceec3071106fc86,https://canary.contestimg.wish.com/api/webimage/5df75151eceec3071106fc86-medium.jpg,5df75151eceec3071106fc86
Mini Machine à coudre Machines à coudre électriques portables portables réglables à 2 vitesses avec pédale pour Machine à broder pour débutants FR,Mini Sewing Machine Handheld Portable Electric Sewing Machines Adjustable 2-Speed with Foot Pedal for Beginners Embroidery Machine FR,19.0,EUR,19.0,EUR,22,10,,,4.2,5.0,4,0,0,0,1,,,,,,,new,41,Livraison Express,6.0,true,,50,true,Quantité limitée !,CN,morrisonli,morrisonli,"87 % avis positifs (4,573 notes)",4573,4.129018150010934,5b556e724543f45963e26b48,,,https://www.wish.com/c/5f2cba1877cc9f003edd6d41,https://canary.contestimg.wish.com/api/webimage/5f2cba1877cc9f003edd6d41-medium.jpg,5f2cba1877cc9f003edd6d41
OXO,,,,,,,,,,,,,,,,,,,,,,,,,,,,,,,,,,,,,,,,,https://www.wish.com/c/5eaaefec9719ed25a17f44fe,,5eaaefec9719ed25a17f44fe
Emoji,,,,,,,,,,,,,,,,,,,,,,,,,,,,,,,,,,,,,,,,,https://www.wish.com/c/5e8d30199719ed6404967867,,5e8d30199719ed6404967867
Fixateur Pédicure Récupérer Soins Des Pieds Nail Outil Correction Fichier Acronyx Fil Onyxis Oignon Correcteur pour Orteils Incarnés Ongles,Fixer Pedicure Recover Foot Care Nail Tool Correction File Acronyx Wire Onyxis Bunion Corrector for Toes Ingrown Toenails,4.77,EUR,5.0,EUR,5.78,10,,,3.9761904761904763,42.0,22,6,7,5,2,,,,,,,6pairs,50,Livraison Express,6.0,true,,50,,,CN,wangjie1995,wangjie1995,"91 % avis positifs (8,180 notes)",8180,4.271393643031785,586275542b52564ca8715626,,,https://www.wish.com/c/5aefbc6ec3a821151505883a,https://canary.contestimg.wish.com/api/webimage/5aefbc6ec3a821151505883a-medium.jpg,5aefbc6ec3a821151505883a
2021 plus récent HD antidérapant danse étape tapis de danse Pad Pads danseur couverture Fitness équipement révolution pied tapis d'impression à PC avec USB nouveau,2021 Newest HD Non-Slip Dancing Step Dance Mat Pad Pads Dancer Blanket Fitness Equipment Revolution Foot Print Mat To PC with USB New,19.0,EUR,25.0,EUR,22,3,,,5.0,0.0,,,,,,,,,,,,dancematspads&cddrive,50,Livraison standard,5.0,false,,50,,,VE,Sirah,sirah,"72 % avis positifs (2,325 notes)",2325,3.5544086021505374,5da509170e1e0f51766e9460,,,https://www.wish.com/c/601e011828c44f3698d81de8,https://canary.contestimg.wish.com/api/webimage/601e011828c44f3698d81de8-medium.jpg,601e011828c44f3698d81de8
2 pièces marchepieds de moto universels noir CNC en aluminium moto repose-pieds pliants repose-pieds pièces de jeu arrière,2Pcs Universal Motorcycle Footsteps Black CNC Aluminum Motor Bike Folding Footrests Rests Pegs Rear Set Parts,17.0,EUR,17.0,EUR,20,1,,,5.0,0.0,,,,,,,,,,,black,,19,Livraison standard,6.0,false,,19,,,CN,SZWStore,szwstore,95 % avis positifs (272 notes),272,4.529411764705882,5a1181d0471c141cd17b9568,,,https://www.wish.com/c/5e54c74477543f41499fb25f,https://canary.contestimg.wish.com/api/webimage/5e54c74477543f41499fb25f-medium.jpg,5e54c74477543f41499fb25f
Coussinets de talon en Silicone Coupes de talon en Gel Inserts de fasciite plantaire Coussin de coussin en Gel de silice pour soins des pieds (grand / petit）,Silicone Heel Cup Pads Gel Heel Cups Plantar Fasciitis Inserts Foot Care Silica Gel Cushion Pad (Large/Small）,4.8,EUR,5.0,EUR,5.82,10,,,4.512820512820513,39.0,30,4,2,1,2,,,,,,blue,small(1pair),50,Livraison standard,2.0,false,,50,,,CN,sofeistore,sofeistore,"(15,798 notes)",15798,4.494366375490569,592bd91aede5f667f58aadcf,,,https://www.wish.com/c/5b657f4371a28007cf013c80,https://canary.contestimg.wish.com/api/webimage/5b657f4371a28007cf013c80-medium.jpg,5b657f4371a28007cf013c80
La plus nouvelle jambe de pas à pas d'équipement de fitness domestique intérieur de charge 250lb amincissant la pédale d'exercice d'entraînement d'étape,Newest 250lb Load Indoor Domestic Fitness Equipment Stepper Leg Slimming Step Training Exercise Pedal,61.0,EUR,61.0,EUR,73.0,0,,,5.0,0.0,,,,,,,,,,,,,50,Livraison Express,12.0,true,,50,true,Quantité limitée !,CN,BaiWuHui,baiwuhui,93 % avis positifs (191 notes),191,4.507853403141361,5d80493db6b4c231405750bd,,,https://www.wish.com/c/5fa2e26b244caf00503d294b,https://canary.contestimg.wish.com/api/webimage/5fa2e26b244caf00503d294b-medium.jpg,5fa2e26b244caf00503d294b
Marchepieds de moto marchepieds de plaque de pied de moto pour SYM MAXSYM TL 500 TL500,Motorcycle Footboard Steps Motorbike Foot Plate Foot Board For SYM MAXSYM TL 500 TL500,41.0,EUR,52.0,EUR,49.0,0,,,5.0,0.0,,,,,,,,,,,titanium,,50,Livraison standard,12.0,false,,50,,,CN,SIMINZICH,siminzich,"91 % avis positifs (1,434 notes)",1434,4.334728033472803,5d539446838897134b2d8eb9,,,https://www.wish.com/c/5fa76a005616626ed2bc78ce,https://canary.contestimg.wish.com/api/webimage/5fa76a005616626ed2bc78ce-medium.jpg,5fa76a005616626ed2bc78ce
1Pcs Toilette Squatty Step Tabouret Salle De Bains Potty Squat Aid pour le soulagement de la constipation,1Pcs Toilet Squatty Step Stool Bathroom Potty Squat Aid for Constipation Relief,13.0,EUR,108.0,EUR,15,10,,,4.0,18.0,10,3,2,1,2,,,,,,milkwhite,,50,Livraison standard,4.0,false,,50,,,CN,Indoor stage,indoorstage,"92 % avis positifs (12,561 notes)",12561,4.322585781386833,5660eea0aa289523ed5f4210,,,https://www.wish.com/c/5cc51d0ab5d967463562c15c,https://canary.contestimg.wish.com/api/webimage/5cc51d0ab5d967463562c15c-medium.jpg,5cc51d0ab5d967463562c15c
Femmes Chaud Épais Doublure En Fourrure Gland Chaussures Dames Demi Genou Haute Plate-Forme Bottes De Neige,Women's Warm Thick Fur Lining Tassel Shoes Ladies Half Knee High Platform Snow Boots,17.0,EUR,27.0,EUR,20,1000,,,4.382211538461538,832.0,556,145,61,33,37,,,,,,purple,4.5,2,Livraison standard,6.0,false,,50,,,CN,sewed6,sewed6,"91 % avis positifs (13,565 notes)",13565,4.296424622189458,5589912aede156400078b7c9,,,https://www.wish.com/c/558cbaf84af6061e1c477775,https://canary.contestimg.wish.com/api/webimage/558cbaf84af6061e1c477775-medium.jpg,558cbaf84af6061e1c477775
1PC fasciite plantaire réglable attelle de nuit pied goutte orthèse orthèse soulagement de la douleur bandage de pied pour la fasciite plantaire talon cheville voûte pied soulagement de la douleur,1PC Adjustable Plantar Fasciitis Night Splint Foot Drop Orthotic Brace Pain Relief Foot Bandage for Plantar Fasciitis Heel Ankle Arch Foot Pain Relief,8.0,EUR,8.0,EUR,9,10,,,4.2272727272727275,22.0,14,2,4,1,1,,,,,,black,1pc-s-unajustable,1,Livraison standard,3.0,false,,50,,,CN,Insbook,insbook,"88 % avis positifs (19,555 notes)",19555,4.160163641012529,57d67dc4d36a2a0860d52d4e,,,https://www.wish.com/c/5f99638fd54d40208301f582,https://canary.contestimg.wish.com/api/webimage/5f99638fd54d40208301f582-medium.jpg,5f99638fd54d40208301f582
2 pièces chaise longue pied en bois tabouret de loisirs meubles chaise Art Design chaise blanc / gris / lait blanc / noir FR,2PCS Lounge Chair Wooden Foot Leisure Stool Furniture Chair Art Design Chair White/Gray/Milke White/Black FR,90.0,EUR,105.0,EUR,108.0,0,,,5.0,0.0,,,,,,,,,,,,2pcsblack,50,Livraison Express,12.0,true,,50,true,Quantité limitée !,CN,sunmiaomiao1114,sunmiaomiao1114,"91 % avis positifs (1,790 notes)",1790,4.290502793296089,5b81324fadd97117d4da921d,,,https://www.wish.com/c/5feaa73baed31ea8ba5e28c7,https://canary.contestimg.wish.com/api/webimage/5feaa73baed31ea8ba5e28c7-medium.jpg,5feaa73baed31ea8ba5e28c7
- children's step stool Zweistufiger Tritthocker für Kinder ab ca. 18 Monaten mit Anti-Rutsch-Funktion (1PC) FR,- children's step stool Zweistufiger Tritthocker für Kinder ab ca. 18 Monaten mit Anti-Rutsch-Funktion (1PC) FR,23.0,EUR,25.0,EUR,27,0,,,5.0,0.0,,,,,,,,,,,grey,onetierstepstool,8,Livraison Express,8.0,true,,50,true,Quantité limitée !,CN,damonabram,damonabram,"87 % avis positifs (1,166 notes)",1166,4.135506003430532,5d4a79cc70327a223ee6847c,,,https://www.wish.com/c/5fcdda0e2e247e7044db8a1d,https://canary.contestimg.wish.com/api/webimage/5fcdda0e2e247e7044db8a1d-medium.jpg,5fcdda0e2e247e7044db8a1d
Multi-function High Quality Hook Safety Hammer Auxiliary Folding Car Accessories Foot Pedal Hook Step Car Door Step,Multi-function High Quality Hook Safety Hammer Auxiliary Folding Car Accessories Foot Pedal Hook Step Car Door Step,21.0,EUR,21.0,EUR,25,1,,,5.0,0.0,,,,,,,,,,,black,,50,Livraison standard,7.0,false,,50,,,CN,gu zhou suo li weng,guzhousuoliweng,"92 % avis positifs (2,989 notes)",2989,4.328203412512546,582ec68182c7bb7d8f9369f9,,,https://www.wish.com/c/6048d5b6d17c96f8b23cabb2,https://canary.contestimg.wish.com/api/webimage/6048d5b6d17c96f8b23cabb2-medium.jpg,6048d5b6d17c96f8b23cabb2
