title,title_orig,discount_price,discount_price_currency,retail_price,retail_price_currency,discount_price_in_original_currency,nb_cart_orders_approx,nb_units_purchased_approx,uses_ad_boosts,rating,rating_count,rating_five_count,rating_four_count,rating_three_count,rating_two_count,rating_one_count,badges_count,badge_local_product,badge_product_quality,badge_fast_shipping,tags,product_color,product_variation_size_id,product_variation_inventory,shipping_option_name,shipping_option_price,shipping_is_express,countries_shipped_to,inventory_total,has_urgency_banner,urgency_text,origin_country,merchant_title,merchant_name,merchant_info_subtitle,merchant_rating_count,merchant_rating,merchant_id,merchant_has_profile_picture,merchant_profile_picture,product_url,product_picture,product_id
Fashion Girl Women Tap Dance Step Dance PU Artificial Leather Shoes AUT,Fashion Girl Women Tap Dance Step Dance PU Artificial Leather Shoes AUT,28.0,EUR,28.0,EUR,33,0,,,5.0,0.0,,,,,,,,,,,red,,50,Livraison Express,12.0,true,,50,,,CN,AuutumnLiQSHOP,auutumnliqshop,"91 % avis positifs (3,071 notes)",3071,4.297297297297297,5b85f7c3b0c3fa29f6a72a3c,,,https://www.wish.com/c/5fd5b0a1b1a939830f93a867,https://canary.contestimg.wish.com/api/webimage/5fd5b0a1b1a939830f93a867-medium.jpg,5fd5b0a1b1a939830f93a867
Crochet de verrouillage universel de porte de voiture pliante étape Mini pédale auxiliaire marteau de sécurité en alliage d'aluminium pour accessoires de voiture Jeep,Universal Folding Car Door Step Latch Hook Step Mini Auxiliary Foot Pedal Aluminium Alloy Safety Hammer For Jeep Car Accessories,20.0,EUR,20.0,EUR,24,2,,,5.0,1.0,1,0,0,0,0,,,,,,,,50,Livraison standard,6.0,false,,50,,,VE,lennsolano,lennsolano,91 % avis positifs (11 notes),11,4.454545454545454,5e4f74af968c884cac50eb32,,,https://www.wish.com/c/5fc2183966a603251e94579b,https://canary.contestimg.wish.com/api/webimage/5fc2183966a603251e94579b-medium.jpg,5fc2183966a603251e94579b
DON'T FOLLOW IN MY FOOTSTEPS - Unisex Cotton Long Sleeved T-Shirt,DON'T FOLLOW IN MY FOOTSTEPS - Unisex Cotton Long Sleeved T-Shirt,21.0,EUR,21.0,EUR,25,0,,,5.0,0.0,,,,,,,,,,,,men-s,50,Livraison standard,7.0,false,,50,,,CN,zhanglanzhen66058,zhanglanzhen66058,44 % avis positifs (16 notes),16,2.6875,5f8d0807ab43aae4d63be03f,,,https://www.wish.com/c/6030bafa1d61e5c6dbae65e5,https://canary.contestimg.wish.com/api/webimage/6030bafa1d61e5c6dbae65e5-medium.jpg,6030bafa1d61e5c6dbae65e5
2021 date 6 pièces de nouvelle mode chaise longue fil en bois pied loisirs tabouret meubles chaise Art Design chaise FR,2021 Newest 6 Pieces Of New Fashion Lounge Chair Wire Wooden Foot Leisure Stool Furniture Chair Art Design Chair FR,81.0,EUR,91.0,EUR,97.0,0,,,5.0,0.0,,,,,,,,,,,black,4pcs,50,Livraison Express,12.0,true,,50,,,CN,Woves,woves,"86 % avis positifs (17,033 notes)",17033,4.03962895555686,58d4bc9be6fe9a57a4464234,,,https://www.wish.com/c/5f8fdb9e1d27cc004475c0d9,https://canary.contestimg.wish.com/api/webimage/5f8fdb9e1d27cc004475c0d9-medium.jpg,5f8fdb9e1d27cc004475c0d9
Mini vélo d'exercice durable Step Machine Home Gym Pedal Bikes Exerciseur d'intérieur (sans batterie),Mini Durable Exercise Bike Step Machine Home Gym Pedal Bikes Indoor Exerciser (No Battery),38.0,EUR,38.0,EUR,45,2,,,5.0,1.0,1,0,0,0,0,,,,,,,black,4,Livraison Express,12.0,true,,8,,,CN,HongXing123 Shop,hongxing123shop,93 % avis positifs (338 notes),338,4.396449704142012,5b4da8565d643e2e3e321ee7,,,https://www.wish.com/c/5ff966b7bbf10600414deba3,https://canary.contestimg.wish.com/api/webimage/5ff966b7bbf10600414deba3-medium.jpg,5ff966b7bbf10600414deba3
American USA Flag Eagle Rug Doormat Foot Door Mat Steps,American USA Flag Eagle Rug Doormat Foot Door Mat Steps,19.0,EUR,19.0,EUR,22,1,,,5.0,0.0,,,,,,,,,,,,onesize,50,Livraison standard,5.0,false,,50,true,Quantité limitée !,CN,luohuiyin27,luohuiyin27,75 % avis positifs (4 notes),4,4.0,5ffc07af76c5202817e21752,,,https://www.wish.com/c/601366561c57833d2acfad8c,https://canary.contestimg.wish.com/api/webimage/601366561c57833d2acfad8c-medium.jpg,601366561c57833d2acfad8c
ecoco,,,,,,,,,,,,,,,,,,,,,,,,,,,,,,,,,,,,,,,,,https://www.wish.com/c/5f8d71eceb31f9a6cce12c8f,,5f8d71eceb31f9a6cce12c8f
Bois massif Simple Bar dossier haut chaise moderne Table chaise pied haut tabouret maison tabouret de Bar nordique FR,Solid Wood Simple Bar High Back Modern Chair Table Chair High Foot Home Stool Nordic Bar Stool FR,94.0,EUR,94.0,EUR,113.0,0,,,5.0,0.0,,,,,,,,,,,black,2pcs,41,Livraison Express,12.0,true,,41,true,Quantité limitée !,CN,burgesswiss,burgesswe,"91 % avis positifs (1,017 notes)",1017,4.335299901671583,5b11f65001287560cfebf50c,,,https://www.wish.com/c/5efc075507e0e522028aa758,https://canary.contestimg.wish.com/api/webimage/5efc075507e0e522028aa758-medium.jpg,5efc075507e0e522028aa758
Professional Sandblasting Equipment Machine Foot Pedal Switch Control Accessory Tool Dont,Professional Sandblasting Equipment Machine Foot Pedal Switch Control Accessory Tool Dont,16.0,EUR,16.0,EUR,19,0,,,5.0,0.0,,,,,,,,,,,,,50,Livraison Express,7.0,true,,50,true,Quantité limitée !,CN,Dontowwn,dontowwn,"93 % avis positifs (3,431 notes)",3431,4.391722529874672,5afa7f1e5ccdca7670a0679a,,,https://www.wish.com/c/600069cc3a1521c7c4e0c3b7,https://canary.contestimg.wish.com/api/webimage/600069cc3a1521c7c4e0c3b7-medium.jpg,600069cc3a1521c7c4e0c3b7
Folding Step Ladder Aluminum Multi - Use Heavy Duty Step Ladder ,Folding Step Ladder Aluminum Multi - Use Heavy Duty Step Ladder ,138.0,EUR,138.0,EUR,167.0,0,,,5.0,0.0,,,,,,,,,,,,,50,Livraison standard,12.0,false,,50,,,CN,blue00sky,blue00sky,"91 % avis positifs (2,020 notes)",2020,4.31039603960396,5b0cfa8f7752c815c83cfce8,,,https://www.wish.com/c/5fc23ba6d90b031f9926f36c,https://canary.contestimg.wish.com/api/webimage/5fc23ba6d90b031f9926f36c-medium.jpg,5fc23ba6d90b031f9926f36c
T Shirt Don’t Follow My Footsteps I Run Into Walls Funny Shirt or Hoodie,T Shirt Don’t Follow My Footsteps I Run Into Walls Funny Shirt or Hoodie,26.0,EUR,26.0,EUR,31,0,,,5.0,0.0,,,,,,,,,,,,men-s,50,Livraison standard,9.0,false,,50,,,CN,huanglihua Store,huanglihuastore,100 % avis positifs (1 notes),1,5.0,5f683ece6956f2d38de19d07,,,https://www.wish.com/c/5f81666c1a90b366e7a51f8d,https://canary.contestimg.wish.com/api/webimage/5f81666c1a90b366e7a51f8d-medium.jpg,5f81666c1a90b366e7a51f8d
Bureau pédales pédales enfants tabourets de maternité massage des pieds repose-pieds,Office Foot Pedals Children Step Stools Maternity Foot Massage Footrests,33.0,EUR,40.0,EUR,39,1,,,5.0,1.0,1,0,0,0,0,,,,,,,,20,Livraison standard,11.0,false,,20,,,CN,light_shop,light_shop,"93 % avis positifs (11,240 notes)",11240,4.426601423487544,583d53b0d914f53e25cf54c1,,,https://www.wish.com/c/5d77713f15cde73fc46a3440,https://canary.contestimg.wish.com/api/webimage/5d77713f15cde73fc46a3440-medium.jpg,5d77713f15cde73fc46a3440
6/4 Pcs Black And White Wooden Leg Dining Chair Iron Wire Wooden Foot Solid Fashion Casual Dining Room Bedroom Kitchen Furniture Leisure Chair FR,6/4 Pcs Black And White Wooden Leg Dining Chair Iron Wire Wooden Foot Solid Fashion Casual Dining Room Bedroom Kitchen Furniture Leisure Chair FR,100.0,EUR,100.0,EUR,121.0,0,,,5.0,0.0,,,,,,,,,,,,4pcs(black),50,Livraison Express,12.0,true,,50,true,Quantité limitée !,CN,pxysg,pxysg,94 % avis positifs (16 notes),16,4.0625,5febdff69a74260dde392c85,,,https://www.wish.com/c/600a48b262266d9843ec8d82,https://canary.contestimg.wish.com/api/webimage/600a48b262266d9843ec8d82-medium.jpg,600a48b262266d9843ec8d82
Chaussures de sport pour hommes Chaussures à coussin d'air Chaussures décontractées Chaussures de basket-ball Sports de plein air amortisseur,Men's Sports Shoes Air Cushion Shoes Casual Shoes Basketball Shoes Outdoor Sports Shock Absorber,28.0,EUR,495.0,EUR,33,5000,,,3.995633187772926,1603.0,860,313,179,65,186,,,,,,white,39,50,Livraison standard,8.0,false,,50,,,CN,fenghaibo,fenghaibo,"(3,246 notes)",3246,3.965187923598275,59bfb1b915da0714ae574999,,,https://www.wish.com/c/5ab101d076d0842a8c186663,https://canary.contestimg.wish.com/api/webimage/5ab101d076d0842a8c186663-medium.jpg,5ab101d076d0842a8c186663
Scooter T3 step Junior Blue,Scooter T3 step Junior Blue,86.0,EUR,86.0,EUR,103.23,0,,,5.0,0.0,,,,,,,,,,,blue,,1,Livraison Express,9.21,true,,1,,,NL,Erksononline,erksononline,"90 % avis positifs (1,444 notes)",1444,4.35387811634349,5f8571038ac61df76b7b8380,,,https://www.wish.com/c/5fbc1f8c3c07ed00407faea4,https://canary.contestimg.wish.com/api/webimage/5fbc1f8c3c07ed00407faea4-medium.jpg,5fbc1f8c3c07ed00407faea4
Don't follow in my footsteps I run into walls Essential T-Shirt,Don't follow in my footsteps I run into walls Essential T-Shirt,14.0,EUR,14.0,EUR,16,0,,,5.0,0.0,,,,,,,,,,,black,xs,50,Livraison standard,5.0,false,,50,,,CN,guanyinghua7890,guanyinghua7890,,0,5.0,604700d5680541825c1d5288,,,https://www.wish.com/c/607003c08d9ed500583ae8ca,https://canary.contestimg.wish.com/api/webimage/607003c08d9ed500583ae8ca-medium.jpg,607003c08d9ed500583ae8ca
"Pédale de pied de tatouage portable, interrupteur de pédale de tatouage, amateur de tatouage professionnel débutant de tatouage pour tatoueur","Portable Tattoo Foot Pedal, Tattoo Pedal Switch, Tattoo Beginner Professional Tattoo Tattoo Lovers for Tattoo Artist",15.0,EUR,15.0,EUR,18,2,,,5.0,1.0,1,0,0,0,0,,,,,,gold,,50,Livraison Express,8.0,true,,50,,,CN,LingFeiXiang,lingfeixiang,86 % avis positifs (501 notes),501,4.127744510978044,5d79e9b7288835520331af20,,,https://www.wish.com/c/5f5e7c5cfc1234a41e09dd06,https://canary.contestimg.wish.com/api/webimage/5f5e7c5cfc1234a41e09dd06-medium.jpg,5f5e7c5cfc1234a41e09dd06
Oivo,,,,,,,,,,,,,,,,,,,,,,,,,,,,,,,,,,,,,,,,,https://www.wish.com/c/5fafb8f0039a6f000fffa83d,,5fafb8f0039a6f000fffa83d
Dr Who Tardis Public Call Box Door Steps Foot Paillasson Tapis Tapis,Dr Who Tardis Public Call Box Door Steps Foot Doormat Rug Mat,15.0,EUR,15.0,EUR,18,1,,,5.0,0.0,,,,,,,,,,,,onesize,50,Livraison standard,5.0,false,,50,true,Quantité limitée !,CN,luxiantian22,luxiantian22,75 % avis positifs (4 notes),4,3.5,5ffc166bcabb513d4731a45d,,,https://www.wish.com/c/60122bb0f90403004c187cfa,https://canary.contestimg.wish.com/api/webimage/60122bb0f90403004c187cfa-medium.jpg,60122bb0f90403004c187cfa
Modern Exercise Bike Step Machine Home Gym Pedal Bikes Indoor Exerciser (No Battery),Modern Exercise Bike Step Machine Home Gym Pedal Bikes Indoor Exerciser (No Battery),52.0,EUR,52.0,EUR,62.0,0,,,5.0,0.0,,,,,,,,,,,,,10,Livraison Express,12.0,true,,10,true,Quantité limitée !,CN,Eightguai handwork,eightguaihandwork,"92 % avis positifs (4,058 notes)",4058,4.37161163134549,5b63ee0243886241c19c586c,,,https://www.wish.com/c/6012576ac95ae4003e30727e,https://canary.contestimg.wish.com/api/webimage/6012576ac95ae4003e30727e-medium.jpg,6012576ac95ae4003e30727e
Essie,,,,,,,,,,,,,,,,,,,,,,,,,,,,,,,,,,,,,,,,,https://www.wish.com/c/5edf6bf6eb31f934f62d6c96,,5edf6bf6eb31f934f62d6c96
Anti-Slip Kid Toilet Trainer Potty Training Sturdy with Non-Slip Wide Steps Adjustable for Kids Children Baby Toddler Toilet Training Boy and Girl,Anti-Slip Kid Toilet Trainer Potty Training Sturdy with Non-Slip Wide Steps Adjustable for Kids Children Baby Toddler Toilet Training Boy and Girl,37.0,EUR,37.0,EUR,44,0,,,5.0,0.0,,,,,,,,,,,red,,31,Livraison Express,11.0,true,,50,,,CN,Fuotunyar,fuotunyar,91 % avis positifs (76 notes),76,4.2105263157894735,5f320bbb4b1bf04e3dd020a9,,,https://www.wish.com/c/6077c7d791e699dfd5f2c7b1,https://canary.contestimg.wish.com/api/webimage/6077c7d791e699dfd5f2c7b1-medium.jpg,6077c7d791e699dfd5f2c7b1
Don't Follow In My Footsteps Funny Witty Clumsy T-Shirt,Don't Follow In My Footsteps Funny Witty Clumsy T-Shirt,20.0,EUR,29.0,EUR,24,0,,,5.0,0.0,,,,,,,,,,,,men-s,50,Livraison standard,6.0,false,,50,true,Quantité limitée !,CN,xuxinyi Store,xuxinyistore,100 % avis positifs (3 notes),3,5.0,5f7c36bdf82a9a750ebf0536,,,https://www.wish.com/c/5fd49bec1e675fd735a502a4,https://canary.contestimg.wish.com/api/webimage/5fd49bec1e675fd735a502a4-medium.jpg,5fd49bec1e675fd735a502a4
"Pouf de rangement pliable de 15 ""coffre à jouets avec siège de poitrine Ottomans tabouret repose-pieds","15"" Folding Storage Ottoman Toy Box Chest Seat Ottomans Bench Foot Rest Stool",25.0,EUR,25.0,EUR,30,8,,,4.5,2.0,1,1,0,0,0,,,,,,darkgray,,50,Livraison Express,8.0,true,,50,,,CN,DH1Glimitd,dh1glimitd,"94 % avis positifs (38,884 notes)",38884,4.474771114082913,59e1741def7b8970ddaf2e47,,,https://www.wish.com/c/5fc0e820ec3ed56f979376e5,https://canary.contestimg.wish.com/api/webimage/5fc0e820ec3ed56f979376e5-medium.jpg,5fc0e820ec3ed56f979376e5
Indoor Exercise Bike Cycling Trainer Bike Step Machine Weight Loss Fitness Bike Stationary Bicycle Fitness Equipment,Indoor Exercise Bike Cycling Trainer Bike Step Machine Weight Loss Fitness Bike Stationary Bicycle Fitness Equipment,68.0,EUR,68.0,EUR,82.0,4,,,5.0,0.0,,,,,,,,,,,,ordinaryversion(black),2,Livraison Express,12.0,true,,2,true,Quantité limitée !,CN,yoyovigor,yoyovigor,"93 % avis positifs (25,753 notes)",25753,4.368190113773153,595cb9d2905fdb3dbc823f26,,,https://www.wish.com/c/6059b48fb4095bc52d5394f2,https://canary.contestimg.wish.com/api/webimage/6059b48fb4095bc52d5394f2-medium.jpg,6059b48fb4095bc52d5394f2
Au-delà des traces de l'homme Poster Print par Briton Riviere,Beyond Man's Footsteps Poster Print by  Briton Riviere,32.0,EUR,37.0,EUR,38,0,,,5.0,0.0,,,,,,,,,,,,18x24,50,Livraison standard,11.0,false,,50,,,US,Posterazzi,posterazzi,"77 % avis positifs (5,643 notes)",5643,3.8628389154704945,55c0deb64e6a0874f22b3167,,,https://www.wish.com/c/5909e4c0e7c1845bfecca2bb,https://canary.contestimg.wish.com/api/webimage/5909e4c0e7c1845bfecca2bb-medium.jpg,5909e4c0e7c1845bfecca2bb
Miraculous Footstep,Miraculous Footstep,41.0,EUR,41.0,EUR,49.0,0,,,5.0,0.0,,,,,,,,,,,,hoodies,50,Livraison standard,12.0,false,,50,true,Quantité limitée !,US,MONICAECOM,monicaecom,100 % avis positifs (4 notes),4,4.75,601185a9d38ac0578448a6bb,,,https://www.wish.com/c/6014334b3a58b52d387917e2,https://canary.contestimg.wish.com/api/webimage/6014334b3a58b52d387917e2-medium.jpg,6014334b3a58b52d387917e2
Cuir de vachette Chaussures Automne Hiver Hommes Bottes De Mode Couleur Unie En Cuir De Vachette Bout Rond Bottes De Cheville Occidentales Boucle De Cheville Casual Cowboy Cheville Chaussons Hommes Chaussures De Sport,Cowhide Leather Shoes Autumn Winter Men Boots Fashion Solid Color Cowhide Leather Round Toe Western Ankle Boots Casual Ankle Buckle Cowboy Ankle Booties Mens Casual Shoes,29.0,EUR,313.0,EUR,35,10,,,2.8743455497382198,191.0,45,33,34,11,68,,,,,,black,us5(eu38),36,Livraison standard,9.0,false,,50,true,Quantité limitée !,CN,zhaofe,zhaofe,"82 % avis positifs (1,995 notes)",1995,3.90125313283208,5d5e34d5283abc37ade43336,,,https://www.wish.com/c/5d9aa457713ae149294c5830,https://canary.contestimg.wish.com/api/webimage/5d9aa457713ae149294c5830-medium.jpg,5d9aa457713ae149294c5830
Motorcycle Foot Peg Step Foot Peg Bike Step Slim Foot Peg Foot Step Aluminum,Motorcycle Foot Peg Step Foot Peg Bike Step Slim Foot Peg Foot Step Aluminum,14.0,EUR,14.0,EUR,16,0,,,5.0,0.0,,,,,,,,,,,,,50,Livraison Express,5.0,true,,50,,,CN,gukhapg,gukhapg,94 % avis positifs (94 notes),94,4.404255319148936,5f59f7bbe836885d74ef4c00,,,https://www.wish.com/c/5fce42f5a7c4774fd4951cdd,https://canary.contestimg.wish.com/api/webimage/5fce42f5a7c4774fd4951cdd-medium.jpg,5fce42f5a7c4774fd4951cdd
Été Hommes Pantoufles Chaussures De Plage La Tendance Des Sandales Tongs Personnalisées Tongs De Mode Chaussures Antidérapantes,Summer Men Slippers Beach Shoes The Trend of Personalized Flip-flop Sandals Fashion Flip Flops Non-slip Shoes,8.0,EUR,25.0,EUR,9,1000,,,4.485842026825633,671.0,475,113,44,12,27,,,,,,white,39,3,Livraison standard,3.0,false,,50,,,CN,kuqi2,kuqi2,"93 % avis positifs (3,869 notes)",3869,4.38640475575084,5b1b2dcd2b04103011763f4f,,,https://www.wish.com/c/5b4c93f725655354834e08e9,https://canary.contestimg.wish.com/api/webimage/5b4c93f725655354834e08e9-medium.jpg,5b4c93f725655354834e08e9
10.4AH Battery Electric Scooter 500W Scooter Smart Adult Electric Scooter Kick Scooter Electric Step Two Wheel Scooter ,10.4AH Battery Electric Scooter 500W Scooter Smart Adult Electric Scooter Kick Scooter Electric Step Two Wheel Scooter ,1027.0,EUR,1027.0,EUR,1244.0,0,,,5.0,0.0,,,,,,,,,,,black,,50,Livraison Express,12.0,true,,50,,,CN,iScooter Profession Store,iscooterprofessionstore,,0,5.0,5fbcab655aaf5d852538c2f0,,,https://www.wish.com/c/60655d7605ea2d092378c0ec,https://canary.contestimg.wish.com/api/webimage/60655d7605ea2d092378c0ec-medium.jpg,60655d7605ea2d092378c0ec
Yeti,,,,,,,,,,,,,,,,,,,,,,,,,,,,,,,,,,,,,,,,,https://www.wish.com/c/5f6341dd90b8a6dfa0fb6ef5,,5f6341dd90b8a6dfa0fb6ef5
"Offre spéciale attelle orthopédique réglable de chute de pied fasciite plantaire attelle de nuit attelle élastique dorsale pour la fasciite plantaire, talon, cheville, douleur au pied de l'arc, tendinite d'Achille avec épines","Hot Sale Adjustable Foot Drop Orthotic Brace Plantar Fasciitis Night Splint Elastic Dorsal for Plantar Fasciitis, Heel, Ankle, Arch Foot Pain, Achilles Tendonitis with Hard Spiky",3.08,EUR,74.0,EUR,3.73,10,,,3.2222222222222223,9.0,2,2,3,0,2,,,,,,black,non-adjustableminikidsize,4,Livraison standard,1.0,false,,50,,,CN,good brother store,goodbrotherstore,84 % avis positifs (429 notes),429,3.965034965034965,5d4fe278933fb16c06b89d6c,,,https://www.wish.com/c/5fb756fcdb159cb10ada4a86,https://canary.contestimg.wish.com/api/webimage/5fb756fcdb159cb10ada4a86-medium.jpg,5fb756fcdb159cb10ada4a86
 1 paire nouvelle paire unisexe semelles de chaussures en mousse à mémoire de forme soins des pieds confort soulagement de la douleur toutes tailles, 1 Pair New Pair Unisex Memory Foam Shoe Insoles Foot Care Comfort Pain Relief All Size,5.0,EUR,5.0,EUR,5,10,,,4.571428571428571,7.0,5,1,1,0,0,,,,,,,2pcs,50,Livraison standard,1.0,false,,50,,,CN,"Beijing Xiuhua Art Co., Ltd",beijingxiuhuaartcoltd,"93 % avis positifs (8,586 notes)",8586,4.360354064756581,56695380e363a330e034cecc,,,https://www.wish.com/c/5da19133b3bb430d209ec2af,https://canary.contestimg.wish.com/api/webimage/5da19133b3bb430d209ec2af-medium.jpg,5da19133b3bb430d209ec2af
,,,,,,,,,,,,,,,,,,,,,,,,,,,,,,,,,,,,,,,,,https://www.wish.com/c/5e4d679c9719ed06a1a06ab8,,5e4d679c9719ed06a1a06ab8
Accessoires de moto couverture footstep carbone fibre de carbone motif Texture garde pour ADV150 2019-2021,Motorcycle Accessories Cover Footstep Carbon Carbon Fiber Pattern Texture Guard for ADV150 2019-2021,40.0,EUR,40.0,EUR,48.0,0,,,5.0,0.0,,,,,,,,,,,,,50,Livraison standard,0.0,false,,50,true,Quantité limitée !,CA,Loom,loom,81 % avis positifs (403 notes),403,4.054590570719603,60108516d38ac0468d48a860,,,https://www.wish.com/c/60158a2895fb381dd6077512,https://canary.contestimg.wish.com/api/webimage/60158a2895fb381dd6077512-medium.jpg,60158a2895fb381dd6077512
1 Pair Nylon Webbing Sturdy Funny Durable Training Nylon Webbing Footsteps Training Webbing,1 Pair Nylon Webbing Sturdy Funny Durable Training Nylon Webbing Footsteps Training Webbing,15.0,EUR,15.0,EUR,18,0,,,5.0,0.0,,,,,,,,,,,red,115x5cm,10,Livraison standard,5.0,false,,20,true,Quantité limitée !,CN,lijuan520,lijuan520,"88 % avis positifs (3,406 notes)",3406,4.226658837345861,5b038d85c721a91d93f15195,,,https://www.wish.com/c/5febc9a13500470047b6d6a6,https://canary.contestimg.wish.com/api/webimage/5febc9a13500470047b6d6a6-medium.jpg,5febc9a13500470047b6d6a6
Dog Mom With Pet Footstep Shirt For Dog Lovers Women's Premium T-shirt Gift Tee,Dog Mom With Pet Footstep Shirt For Dog Lovers Women's Premium T-shirt Gift Tee,17.0,EUR,17.0,EUR,20,0,,,5.0,0.0,,,,,,,,,,,,men-s,50,Livraison standard,6.0,false,,50,,,CN,WDRDIEV,wdrdiev,81 % avis positifs (894 notes),894,3.9194630872483223,5d58b8449373f45fb03a865f,,,https://www.wish.com/c/5f4631dc32528c004a0e951a,https://canary.contestimg.wish.com/api/webimage/5f4631dc32528c004a0e951a-medium.jpg,5f4631dc32528c004a0e951a
Dance Pad Dancing Step Dance Mat Pad Pads Dancer Blanket Equipment Revolution HD Non-Slip Foot Print Mat to PC with USB,Dance Pad Dancing Step Dance Mat Pad Pads Dancer Blanket Equipment Revolution HD Non-Slip Foot Print Mat to PC with USB,21.0,EUR,21.0,EUR,25,0,,,5.0,0.0,,,,,,,,,,,,australia,50,Livraison standard,6.0,false,,50,,,CA,11368796 CANADA CORPORATION,11368796canadacorporation,"80 % avis positifs (1,166 notes)",1166,3.9382504288164664,5ffb1f43fa8a25c707537989,,,https://www.wish.com/c/60043cb3a3e2ab3d242c3066,https://canary.contestimg.wish.com/api/webimage/60043cb3a3e2ab3d242c3066-medium.jpg,60043cb3a3e2ab3d242c3066
Stefanplast,,,,,,,,,,,,,,,,,,,,,,,,,,,,,,,,,,,,,,,,,https://www.wish.com/c/5e8d2fe19719ed64049676ff,,5e8d2fe19719ed64049676ff
Mini vélo d'exercice Step Machine Home Gym Pedal Bikes Indoor Exerciseur,Mini Exercise Bike Step Machine Home Gym Pedal Bikes Indoor Exerciser,43.0,EUR,43.0,EUR,51.0,10,,,4.627450980392157,51.0,37,10,3,1,0,,,,,,black,,5,Livraison Express,12.0,true,,5,,,CN,NaHonShop,nahonshop,"94 % avis positifs (1,513 notes)",1513,4.439524124256444,5ac73b93abef95599959d93a,,,https://www.wish.com/c/5f589b2abf70d6004cfbcdcf,https://canary.contestimg.wish.com/api/webimage/5f589b2abf70d6004cfbcdcf-medium.jpg,5f589b2abf70d6004cfbcdcf
Sougayilang,,,,,,,,,,,,,,,,,,,,,,,,,,,,,,,,,,,,,,,,,https://www.wish.com/c/5f05a76ceb31f9e2f31ed2cf,,5f05a76ceb31f9e2f31ed2cf
Améliorateur en bois de voûte de civière d'étirement de pied de danse de ballet avec la bande élastique,Wooden Ballet Dance Foot Stretch Stretcher Arch Enhancer With Elastic Band,48.0,EUR,48.0,EUR,57.0,0,,,5.0,0.0,,,,,,,,,,,,,50,Livraison Express,12.0,true,,50,,,CN,lanlanxiaoxi,lanlanxiaoxi,93 % avis positifs (737 notes),737,4.485753052917232,5b6a488dc671ee12700c0687,,,https://www.wish.com/c/5f1ab8ff2b727f2c9f4f506b,https://canary.contestimg.wish.com/api/webimage/5f1ab8ff2b727f2c9f4f506b-medium.jpg,5f1ab8ff2b727f2c9f4f506b
1Pcs Toilette Squatty Step Tabouret Salle De Bains Potty Squat Aid pour le soulagement de la constipation DL,1Pcs Toilet Squatty Step Stool Bathroom Potty Squat Aid for Constipation Relief DL,16.0,EUR,99.0,EUR,19,10,,,5.0,2.0,2,0,0,0,0,,,,,,,l,50,Livraison standard,5.0,false,,50,true,Quantité limitée !,US,FiLtky-Gor,filtkygor,89 % avis positifs (274 notes),274,4.313868613138686,5dbc5086763de123a6243387,,,https://www.wish.com/c/5df0d50b18ddf308d118e4cb,https://canary.contestimg.wish.com/api/webimage/5df0d50b18ddf308d118e4cb-medium.jpg,5df0d50b18ddf308d118e4cb
Daping,,,,,,,,,,,,,,,,,,,,,,,,,,,,,,,,,,,,,,,,,https://www.wish.com/c/5f8c2050eb31f9c6391a61f6,,5f8c2050eb31f9c6391a61f6
Potty Training Seat With Step Stool Ladder And Handles For Baby Toddler Kid Children Boys And Girls Toilet Training Chair,Potty Training Seat With Step Stool Ladder And Handles For Baby Toddler Kid Children Boys And Girls Toilet Training Chair,32.0,EUR,32.0,EUR,38,0,,,5.0,0.0,,,,,,,,,,,red&yellow,,50,Livraison Express,11.0,true,,50,true,Quantité limitée !,CN,LQ1shop,lq1shop,"91 % avis positifs (11,678 notes)",11678,4.302106525089913,58f5b3cd1ae47c4dec78a365,,,https://www.wish.com/c/5f6f70dd24fd69003eb90197,https://canary.contestimg.wish.com/api/webimage/5f6f70dd24fd69003eb90197-medium.jpg,5f6f70dd24fd69003eb90197
Freins à pied Step Hood Junior Noir / Orange,Step Hood Junior Foot brakes Black/Orange,112.0,EUR,112.0,EUR,135.09,0,,,5.0,0.0,,,,,,,,,,,black&orange,,4,Livraison Express,9.19,true,,4,,,NL,Erksononline,erksononline,"(1,444 notes)",1444,4.35387811634349,5f8571038ac61df76b7b8380,,,https://www.wish.com/c/600af5140bc9b10555109433,https://canary.contestimg.wish.com/api/webimage/600af5140bc9b10555109433-medium.jpg,600af5140bc9b10555109433
Tex Beneke - In Glenn Miller's Footsteps: Blues Serenades and [CD],Tex Beneke - In Glenn Miller's Footsteps: Blues Serenades and [CD],12.0,EUR,35.0,EUR,14,0,,,5.0,0.0,,,,,,,,,,,,,2,Livraison standard,3.0,false,,2,,,US,DeepDiscountIntl,deepdiscountintl,"95 % avis positifs (4,096 notes)",4096,4.605224609375,593abd6720d56c2f0e3f3af0,,,https://www.wish.com/c/5b40f90980f4895e73549d7d,https://canary.contestimg.wish.com/api/webimage/5b40f90980f4895e73549d7d-medium.jpg,5b40f90980f4895e73549d7d
3 Tier Flower Plant Pot Shelf Stand Display Ladder Garden Rack Step Style Wooden,3 Tier Flower Plant Pot Shelf Stand Display Ladder Garden Rack Step Style Wooden,37.0,EUR,37.0,EUR,44,0,,,5.0,0.0,,,,,,,,,,,,,40,Livraison standard,12.0,false,,40,,,CN,TangXiaon,tangxiaon,100 % avis positifs (9 notes),9,4.444444444444445,5f840fe675d1b13efe60f37a,,,https://www.wish.com/c/607f89e2d1f5d70059b06530,https://canary.contestimg.wish.com/api/webimage/607f89e2d1f5d70059b06530-medium.jpg,607f89e2d1f5d70059b06530
"Queue de sirène résistante à l'usure 2020 pour nager avec insert monofin pour filles, garçons et adultes","2020 HOT Wear-Resistant Mermaid Tail for Swimming with Monofin Insert for Girls, Boys, Adults",10.0,EUR,133.0,EUR,12,10,,,3.76,50.0,25,5,10,3,7,,,,,,gold,youthxxs-withoutmonofin,6,Livraison standard,3.0,false,,50,,,CN,Lucky Black Cat,luckyblackcat,75 % avis positifs (325 notes),325,3.713846153846154,5e896dff29e78669df20b2b5,,,https://www.wish.com/c/5f4d21304567e71df607b93c,https://canary.contestimg.wish.com/api/webimage/5f4d21304567e71df607b93c-medium.jpg,5f4d21304567e71df607b93c
Leggings femmes 8 couleurs mode automne hiver épais chaud doublure brossée pantalon polaire extensible haute élasticité collants grande taille XS-XXL,Women Leggings 8 Colors Fashion Autumn Winter Thick Warm Brushed Lining Stretch Fleece Pants High Elasticity Tights Plus Size XS-XXL,7.0,EUR,7.0,EUR,8,1000,,,3.5055762081784385,538.0,225,82,81,40,110,,,,,,purple,style1-xs,50,Livraison standard,2.0,false,,50,true,Quantité limitée !,CN,yi lu huan zhan,yiluhuanzhan,"76 % avis positifs (1,066 notes)",1066,3.6707317073170733,5d3ab89f72b0c91fa36b8f69,,,https://www.wish.com/c/5f6581dff084de398f8adaad,https://canary.contestimg.wish.com/api/webimage/5f6581dff084de398f8adaad-medium.jpg,5f6581dff084de398f8adaad
