title,title_orig,discount_price,discount_price_currency,retail_price,retail_price_currency,discount_price_in_original_currency,nb_cart_orders_approx,nb_units_purchased_approx,uses_ad_boosts,rating,rating_count,rating_five_count,rating_four_count,rating_three_count,rating_two_count,rating_one_count,badges_count,badge_local_product,badge_product_quality,badge_fast_shipping,tags,product_color,product_variation_size_id,product_variation_inventory,shipping_option_name,shipping_option_price,shipping_is_express,countries_shipped_to,inventory_total,has_urgency_banner,urgency_text,origin_country,merchant_title,merchant_name,merchant_info_subtitle,merchant_rating_count,merchant_rating,merchant_id,merchant_has_profile_picture,merchant_profile_picture,product_url,product_picture,product_id
Kids Stacking Tower Toys Children Building Block Toys Preschool Education Health Wooden Stimulate imagination Intelligence Toy For Baby Best Gifts ,Kids Stacking Tower Toys Children Building Block Toys Preschool Education Health Wooden Stimulate imagination Intelligence Toy For Baby Best Gifts ,19.0,EUR,19.0,EUR,22,0,,,5.0,0.0,,,,,,,,,,,,,50,Livraison standard,5.0,false,,50,,,CN,fjxxyouth0124,fjxxyouth0124,89 % avis positifs (178 notes),178,4.252808988764045,5a10e42068788b20a1046184,,,https://www.wish.com/c/5fb7882ab64db43f57a1154a,https://canary.contestimg.wish.com/api/webimage/5fb7882ab64db43f57a1154a-medium.jpg,5fb7882ab64db43f57a1154a
Enfants Intelligence Puzzle champignon broche jouet combinaison panneau de brassage jouet boîte en bois puzzle loisirs jouet,Children Intelligence Puzzle Mushroom Pin Toy Combination Patch Board Toy Wooden Box Jigsaw Leisure Toy,23.0,EUR,83.0,EUR,27,10,,,3.4285714285714284,7.0,3,1,1,0,2,,,,,,multicolor,f,50,Livraison standard,7.0,false,,50,,,CN,DAHUILANG,dahuilang,"84 % avis positifs (1,812 notes)",1812,3.989514348785872,5931397e233588334a13a4f1,,,https://www.wish.com/c/5b5ed156d163a2137bc4843b,https://canary.contestimg.wish.com/api/webimage/5b5ed156d163a2137bc4843b-medium.jpg,5b5ed156d163a2137bc4843b
Wooden Children'S Educational Intelligence Wood Drag Shape Funny Toy,Wooden Children'S Educational Intelligence Wood Drag Shape Funny Toy,14.0,EUR,27.0,EUR,16,0,,,5.0,0.0,,,,,,,,,,,,duck,50,Livraison standard,4.0,false,,50,,,US,ZonglueguanJR,zonglueguanjr,91 % avis positifs (53 notes),53,4.169811320754717,5e6382bfad6a886feb648c2d,,,https://www.wish.com/c/5f365045fbd5420047e21edb,https://canary.contestimg.wish.com/api/webimage/5f365045fbd5420047e21edb-medium.jpg,5f365045fbd5420047e21edb
Sanrio,,,,,,,,,,,,,,,,,,,,,,,,,,,,,,,,,,,,,,,,,https://www.wish.com/c/5ed7832a90b8a6318c2d7363,,5ed7832a90b8a6318c2d7363
Drôle Intelligenter Roboter télécommande capteur de geste marche enfants jouet Action chantant danse Robot jouets pour enfants apprenant,Funny Intelligenter Roboter Remote Control Gesture Sensor Walking Kids Toy Action Singing Dance Robot Toys for Kids Learning,24.0,EUR,89.0,EUR,28,7,,,5.0,2.0,2,0,0,0,0,,,,,,blue,,2,Livraison Express,8.0,true,,7,,,CN,JY Fun,jyfun,"90 % avis positifs (2,933 notes)",2933,4.3041254688032735,5b026156e6b6cb22d9441d99,,,https://www.wish.com/c/5d7f5bc536a3ba7a297f01d1,https://canary.contestimg.wish.com/api/webimage/5d7f5bc536a3ba7a297f01d1-medium.jpg,5d7f5bc536a3ba7a297f01d1
17-hole Intelligence Box Geometric Shape Matching Cognitive Building Block Toy,17-hole Intelligence Box Geometric Shape Matching Cognitive Building Block Toy,22.0,EUR,22.0,EUR,26,0,,,5.0,0.0,,,,,,,,,,,multicolor,,50,Livraison standard,7.0,false,,50,true,Quantité limitée !,CN,c00lstreet,c00lstreet,"87 % avis positifs (1,917 notes)",1917,4.117370892018779,5d3ba0210ff7f9780cb32148,,,https://www.wish.com/c/6034c4000c43bae0528368af,https://canary.contestimg.wish.com/api/webimage/6034c4000c43bae0528368af-medium.jpg,6034c4000c43bae0528368af
Puzzle aimant perles fente labyrinthe pour bébé enfants développement éducatif jouets d'intelligence,Puzzle Magnet Beads Slot Maze For Baby Kids Educational Development Intelligence Toys,4.69,EUR,16.0,EUR,5.6899999999999995,10,,,4.533333333333333,45.0,34,4,4,3,0,,,,,,,beetle,50,Livraison standard,2.0,false,,50,true,Quantité limitée !,CN,Charmingu123,charmingu123,"84 % avis positifs (16,043 notes)",16043,3.990774792744499,5b604e95beb9724af733bb7d,,,https://www.wish.com/c/5d661afc9a2d071f5f702fcb,https://canary.contestimg.wish.com/api/webimage/5d661afc9a2d071f5f702fcb-medium.jpg,5d661afc9a2d071f5f702fcb
Éducation précoce bébé jouet multi-touch multifonctionnel et coloré livre de développement de l'intelligence animaux mignons livre en tissu pour bébé,Early Education Baby Toy Multi-touch Multifunctional and Colorful Intelligence Development Book Cute Animals Baby Cloth Book,7.0,EUR,7.0,EUR,8,20000,,,4.383595113438045,2865.0,1893,483,281,111,97,,,,,,,,50,Livraison standard,2.0,false,,50,,,CN,Excellently.Trading,hongkongexcellencetradingcompany,"92 % avis positifs (60,728 notes)",60728,4.3109603477802665,54c6017a7d8a31097738b171,,,https://www.wish.com/c/54f03f43372d401ae689ed1e,https://canary.contestimg.wish.com/api/webimage/54f03f43372d401ae689ed1e-medium.jpg,54f03f43372d401ae689ed1e
"Relief Rotating Magic Bean Cube Fingertip Toys for Kids and Adult, Intelligence Fingertip Gyroscope Educational Toys for Office Anxiety Relief (Blue)","Relief Rotating Magic Bean Cube Fingertip Toys for Kids and Adult, Intelligence Fingertip Gyroscope Educational Toys for Office Anxiety Relief (Blue)",7.0,EUR,17.0,EUR,8,10,,,5.0,1.0,1,0,0,0,0,,,,,,,blue,50,Livraison standard,3.0,false,,50,,,US,TanglanghuannB,tanglanghuannb,83 % avis positifs (110 notes),110,3.963636363636364,5e86b4eccdbbb822ad55058e,,,https://www.wish.com/c/603dda22200afba11e40e8e7,https://canary.contestimg.wish.com/api/webimage/603dda22200afba11e40e8e7-medium.jpg,603dda22200afba11e40e8e7
Volkswagen,,,,,,,,,,,,,,,,,,,,,,,,,,,,,,,,,,,,,,,,,https://www.wish.com/c/5ed7831b90b8a6318c2d7309,,5ed7831b90b8a6318c2d7309
Baby Cartoon Word Book Intelligence Development Education Toys Soft Cloth Bed Cognize Book,Baby Cartoon Word Book Intelligence Development Education Toys Soft Cloth Bed Cognize Book,4.0,EUR,5.0,EUR,4,1,,,5.0,0.0,,,,,,,,,,,,food,50,Livraison standard,1.0,false,,50,,,CN,sirmiss,sirmiss,"86 % avis positifs (26,864 notes)",26864,4.107392793329363,5aa5e8e79722331d27192592,,,https://www.wish.com/c/608115195de182d0b7037020,https://canary.contestimg.wish.com/api/webimage/608115195de182d0b7037020-medium.jpg,608115195de182d0b7037020
Métal neuf lien imbriqué Puzzle jouet 8 ensemble Intelligence déverrouillage formation développemental enfants apprentissage éducation jouets,Metal Nine Interlocking Link Puzzle Toy 8 Set Intelligence Unlocking Training Developmental Children Learning Education Toys,8.0,EUR,8.0,EUR,9,0,,,5.0,0.0,,,,,,,,,,,yellow,,50,Livraison standard,3.0,false,,50,,,CN,tianxinshop,tianxinshop,88 % avis positifs (140 notes),140,4.3,5e53427018034a30c1aeee2a,,,https://www.wish.com/c/5f938f37cb9a53003d2607b2,https://canary.contestimg.wish.com/api/webimage/5f938f37cb9a53003d2607b2-medium.jpg,5f938f37cb9a53003d2607b2
Bébé Infant Intelligence Apprentissage Cognition Fruits Légumes Mous Animaux Véhicules Livres Éducatifs Précoce Jouets Livre En Tissu Bande Dessinée,Baby Infant Intelligence Learning Cognition Fruit Soft Vegetable Animals Vehicles Early Educational Books Toys Cloth Book Cartoon,3.89,EUR,4.0,EUR,4.72,0,,,5.0,0.0,,,,,,,,,,,,fruit,50,Livraison standard,1.0,false,,50,,,CN,chucuezhaji,chucuezhaji,"91 % avis positifs (2,498 notes)",2498,4.325460368294635,5acd7a2f40626a314c132bda,,,https://www.wish.com/c/5fdc13388d0bb4a4c3ac1e71,https://canary.contestimg.wish.com/api/webimage/5fdc13388d0bb4a4c3ac1e71-medium.jpg,5fdc13388d0bb4a4c3ac1e71
Maikun Montessori Intelligence Mathématique Bâton Jouets Éducatifs Préscolaires (Couleur: Multicolore),Maikun Montessori Mathematical Intelligence Stick Preschool Educational Toys (Color: Multicolor),10.0,EUR,10.0,EUR,12,8,,,5.0,0.0,,,,,,,,,,,,,50,Livraison standard,3.0,false,,50,,,CN,yanjingliang654321,yanjingliang654321,84 % avis positifs (250 notes),250,4.096,5af2a63c4327d11a4ed648e3,,,https://www.wish.com/c/5b268d8c7b94e11455375cf4,https://canary.contestimg.wish.com/api/webimage/5b268d8c7b94e11455375cf4-medium.jpg,5b268d8c7b94e11455375cf4
"Enfants Intelligence Cognition Learning, Baby Cloth Book, Animals Soft Fruit Vegetable Vehicles Cartoon Cloth Books, Early Educational Books Toys","Children Intelligence Cognition Learning, Baby Cloth Book, Animals Soft Fruit Vegetable Vehicles Cartoon Cloth Books, Early Educational Books Toys",3.18,EUR,8.0,EUR,3.85,20000,,,3.8885844748858447,2190.0,1089,386,335,142,238,,,,,,,animal,50,Livraison standard,1.0,false,,50,,,CN,Chyuen369,chyuen369,"(7,772 notes)",7772,4.261065362840967,5b77c727bbbffb117a320354,,,https://www.wish.com/c/5def8e77f78f550c26a7f4e9,https://canary.contestimg.wish.com/api/webimage/5def8e77f78f550c26a7f4e9-medium.jpg,5def8e77f78f550c26a7f4e9
Infant Kids Intelligence Cognition Learning Animals Soft Vegetable Fruit Vehicles Cartoon Early Educational Books Toys Cloth Book,Infant Kids Intelligence Cognition Learning Animals Soft Vegetable Fruit Vehicles Cartoon Early Educational Books Toys Cloth Book,3.11,EUR,4.0,EUR,3.77,20000,,,3.9070378151260505,3808.0,1856,687,655,275,335,,,,,,,vehicle,50,Livraison standard,1.0,false,,50,,,CN,Pakchoi,yinilan,"(19,503 ratings)",19503,4.253909654924883,598b19648696be7883ec6022,,,https://www.wish.com/c/5bb85556c76f6217004d855c,https://canary.contestimg.wish.com/api/webimage/5bb85556c76f6217004d855c-medium.jpg,5bb85556c76f6217004d855c
2-14 ans de charge intelligente brosse à dents portable électrique dessin animé silicone brosse à dents en forme de U pour les enfants,2-14 Years  Intelligent Charging Electric Portable Toothbrush Cartoon Silicone U-shaped Toothbrush For Children,6.0,EUR,6.0,EUR,7,10,,,3.3333333333333335,3.0,1,1,0,0,1,,,,,,grey,only1pcsbraces2to6years,4,Livraison standard,2.0,false,,50,,,CN,WUDIDAKEAI,wudidakeai,"91 % avis positifs (38,041 notes)",38041,4.298388580741832,583feb2cd914f5290d9965da,,,https://www.wish.com/c/5fc4cbe6ab30a4e535ba7c84,https://canary.contestimg.wish.com/api/webimage/5fc4cbe6ab30a4e535ba7c84-medium.jpg,5fc4cbe6ab30a4e535ba7c84
Jeu Jouet Bois Jouets Pour Enfants Intelligence Dessin Animé En Bois Développement,Game Jouet Bois Toys For Children Intelligence Developmental Wooden Cartoon,12.0,EUR,12.0,EUR,14,0,,,5.0,0.0,,,,,,,,,,,,a-orchard,50,Livraison standard,3.0,false,,50,,,CN,c00lstreet,c00lstreet,"87 % avis positifs (1,917 notes)",1917,4.117370892018779,5d3ba0210ff7f9780cb32148,,,https://www.wish.com/c/5f2ba8a2825fd02e3e771cf1,https://canary.contestimg.wish.com/api/webimage/5f2ba8a2825fd02e3e771cf1-medium.jpg,5f2ba8a2825fd02e3e771cf1
Ville créative Robot RC blocs de construction électriques Technic télécommande intelligente Robot briques jouets pour enfants,City Creative RC Robot Electric Building Blocks Technic Remote Control Intelligent Robot Bricks Toys For Children,43.0,EUR,75.0,EUR,51.0,10,,,5.0,11.0,11,0,0,0,0,,,,,,black,,50,Livraison standard,12.0,false,,50,true,Quantité limitée !,CN,Dogeezy,dogeezy,96 % avis positifs (54 notes),54,4.648148148148148,5d61136407cc8d57aefc305b,,,https://www.wish.com/c/5ee1a3bc7bdbdb1b5cd23546,https://canary.contestimg.wish.com/api/webimage/5ee1a3bc7bdbdb1b5cd23546-medium.jpg,5ee1a3bc7bdbdb1b5cd23546
Emilio Pucci,,,,,,,,,,,,,,,,,,,,,,,,,,,,,,,,,,,,,,,,,https://www.wish.com/c/5ff83c65b270d00010d88036,,5ff83c65b270d00010d88036
Nouveau Robot télécommandé Intelligent 2.4G Robot télécommandé Intelligent petite boule figurine jouets enfants cadeau d'anniversaire garçon jouets,New Intelligent Remote Control Robot 2.4G Remote Control Robot Intelligent Small Ball Action Figure Toys Children Birthday Gift Boy Toys,16.0,EUR,16.0,EUR,19,10,,,4.090909090909091,11.0,6,1,3,1,0,,,,,,daffodil,lowquality,4,Livraison standard,5.0,false,,50,,,CN,nclcsc887,nclcsc887,84 % avis positifs (364 notes),364,4.054945054945055,5d82edb10ccdbd6e833243d2,,,https://www.wish.com/c/5dc5183c6cb6310eab069c8d,https://canary.contestimg.wish.com/api/webimage/5dc5183c6cb6310eab069c8d-medium.jpg,5dc5183c6cb6310eab069c8d
Bricolage éducatif pour enfants assemblage boîte à outils écrou bloc de construction assemblage vis vis puzzle jouet apprentissage et développement de l'intelligence,Children's educational DIY assembling toolbox nut building block assembling screw screw jigsaw puzzle toy learning and developing intelligence,20.0,EUR,58.0,EUR,24,1,,,5.0,0.0,,,,,,,,,,,multicolor,120pcs,5,Livraison standard,6.0,false,,49,,,CN,hzhr05,hzhr05,81 % avis positifs (962 notes),962,3.924116424116424,5d4e9f8f7ad242713df7208b,,,https://www.wish.com/c/5f6d941a3a7406004a935725,https://canary.contestimg.wish.com/api/webimage/5f6d941a3a7406004a935725-medium.jpg,5f6d941a3a7406004a935725
Enfants Gestes Télécommande Robot Charge Jouets Garçon Danse Intelligent Télécommande Robot Jouets,Kids Gestures Remote Control Robot Charge Toys Boy Dance Intelligent Remote Control Robot Toys,12.0,EUR,12.0,EUR,14,10,,,4.078125,64.0,34,10,15,1,4,,,,,,blue,typea(h21cm),50,Livraison standard,4.0,false,,50,,,CN,peng heko,pengheko,91 % avis positifs (466 notes),466,4.328326180257511,5eeb0106188b0b00e3950efc,,,https://www.wish.com/c/5f23c34f7228f204f1abf5dc,https://canary.contestimg.wish.com/api/webimage/5f23c34f7228f204f1abf5dc-medium.jpg,5f23c34f7228f204f1abf5dc
"2018 Robot télécommandé Kaidi Weida Weida Multi-fonction Charge Jouets Boy Dance Robot télécommandé intelligent pour enfants (couleur : bleu, rose)","2018 Remote Control Robot Kaidi Weida Multi-function Charge Toys Boy Dance Intelligent Remote Control Robot For Children's (Color:Blue,Pink)",23.0,EUR,164.0,EUR,27,5000,,,4.271827956989247,2325.0,1440,456,201,77,151,,,,,,red,h21cm,16,Livraison standard,7.0,false,,50,true,Quantité limitée !,CN,c1989jie,c1989jie,"(17,525 notes)",17525,4.354579172610556,59de07599b66c43c60d7ed55,,,https://www.wish.com/c/5b51ba1b12a2ab5c0f9b6b7e,https://canary.contestimg.wish.com/api/webimage/5b51ba1b12a2ab5c0f9b6b7e-medium.jpg,5b51ba1b12a2ab5c0f9b6b7e
Le plus récent Robot volant à Induction Intelligent avion à Induction à main infrarouge jouets Balance Suspension jouets Smart RC Robot cadeau de noël pour les enfants,Newest Intelligent Induction Flying Robot Infrared Hand Induction Aircraft Toys Balance Suspension Toys Smart RC Robot Christmas Gift For Kids ,4.74,EUR,5.0,EUR,5.75,10,,,5.0,2.0,2,0,0,0,0,,,,,,,flyingball-nolight,1,Livraison standard,2.0,false,,50,,,CN,goodfunction,goodfunction,"(2,914 notes)",2914,3.904598490048044,59df1bd09aee092e885dce37,,,https://www.wish.com/c/5fd479a64b2fe0a459fee87d,https://canary.contestimg.wish.com/api/webimage/5fd479a64b2fe0a459fee87d-medium.jpg,5fd479a64b2fe0a459fee87d
Livre d'apprentissage électronique pour bébé avec la logique anglaise intelligente des enfants,Baby Electronic Learning Book With Children's Intelligent English Logic,16.0,EUR,16.0,EUR,19,0,,,5.0,0.0,,,,,,,,,,,,,50,Livraison standard,6.0,false,,50,,,CN,Junyuyuan,junyuyuan,"95 % avis positifs (5,686 notes)",5686,4.530953218431234,5955eb3b53ebe20362f40e94,,,https://www.wish.com/c/5fc90bce7878c6acf489cf55,https://canary.contestimg.wish.com/api/webimage/5fc90bce7878c6acf489cf55-medium.jpg,5fc90bce7878c6acf489cf55
1000 pcs 5mm EVA Hama / Perler Perles DIY Hama Perles 12 Couleurs À La Main Amusement Artisanat Intelligence Jouets Éducatifs pour Enfants,1000pcs 5mm EVA Hama/Perler Beads DIY Hama Beads 12 Colors Handmade Fun Craft Intelligence Educational Toys for Kids,3.11,EUR,4.0,EUR,3.77,5000,,,4.446261682242991,428.0,312,54,27,11,24,,,,,,blue,,50,Livraison standard,1.0,false,,50,,,CN,Today Store,todaystore,"93 % avis positifs (4,066 notes)",4066,4.452041318248893,568bb742c1407677b2db22ff,,,https://www.wish.com/c/5b7173db88c69d491e53c929,https://canary.contestimg.wish.com/api/webimage/5b7173db88c69d491e53c929-medium.jpg,5b7173db88c69d491e53c929
Thermomètre intelligent USB Thermomètre intelligent Mini thermomètre portable pour téléphone portable Thermomètre infrarouge de type sans contact avec joint de type C pour téléphone Android IOS,Smart Thermometer USB Intelligent Thermometer Portable Mini Cell Phone Thermometer Non-contact Type Infrared Thermometer with Type-C Joint for Android IOS Phone,7.0,EUR,10.0,EUR,8,10,,,4.135135135135135,74.0,38,20,9,2,5,,,,,,white,miscrousbport,50,Livraison standard,2.0,false,,50,,,US,Nicbek,nicbek,"(2,332 notes)",2332,4.178387650085763,5e78877029e78673c0590dd1,,,https://www.wish.com/c/5ffc1e7a55fc1d31830b0f7a,https://canary.contestimg.wish.com/api/webimage/5ffc1e7a55fc1d31830b0f7a-medium.jpg,5ffc1e7a55fc1d31830b0f7a
Apprentissage en bois à la forme assortie Ensembles d'enseignement Blocs éducatifs Enfants Jouets Intelligence Mémoire jeu,Wooden Learning To Matching Shape Teaching Sets Educational Blocks Kids Toys Intelligence Memory game,14.0,EUR,99.0,EUR,16,4,,,5.0,1.0,1,0,0,0,0,,,,,,,,30,Livraison standard,5.0,false,,30,,,CN,missyourcom,missyourcom,"93 % avis positifs (3,995 notes)",3995,4.403754693366708,5a17bd913eb22a5ae0aed7b1,,,https://www.wish.com/c/5d5e87741ce2aa125d4e3cd0,https://canary.contestimg.wish.com/api/webimage/5d5e87741ce2aa125d4e3cd0-medium.jpg,5d5e87741ce2aa125d4e3cd0
Simple fossette gros cerveau jouet sensoriel jouet développement des compétences jouet Intelligence jouet adapté pour 1 à 2 ans,Simple Dimple Fat Brain Toy Sensory Toy Skills Development Toy Intelligence Toy Suitable for 1 To 2 Years Old,7.0,EUR,7.0,EUR,8,10,,,4.2,10.0,7,1,0,1,1,,,,,,multicolor,1pc(new),50,Livraison standard,3.0,false,,50,,,VE,lmontgo3,lmontgo3,42 % avis positifs (24 notes),24,2.5833333333333335,5fc6702893b390dee08e232c,,,https://www.wish.com/c/6006a5ca03a7b85bb1a2ba8f,https://canary.contestimg.wish.com/api/webimage/6006a5ca03a7b85bb1a2ba8f-medium.jpg,6006a5ca03a7b85bb1a2ba8f
1PC enfants bébé apprentissage livres en tissu infantile bébé développement de l'intelligence cognent livres en tissu,1PC Kids Baby Learning Cloth Books Infant Baby Intelligence Development Cognize Cloth Books,3.0,EUR,3.0,EUR,3,10,,,4.5,8.0,5,2,1,0,0,,,,,,,number,50,Livraison Express,7.0,true,,50,,,CN,renqingcairang,renqingcairang,"(16,180 notes)",16180,4.1435723114956735,5ad04376c2c89279dc4f98b2,,,https://www.wish.com/c/5e8d55f1278d713509939ab6,https://canary.contestimg.wish.com/api/webimage/5e8d55f1278d713509939ab6-medium.jpg,5e8d55f1278d713509939ab6
Dispositif intelligent multifonctionnel de nettoyeur de piscine de robot de nettoyage de piscine,Multi-functional Intelligent Pool Cleaning Robot Pool Cleaner Device,403.0,EUR,403.0,EUR,488.0,0,,,5.0,0.0,,,,,,,,,,,,,50,Livraison Express,12.0,true,,50,,,CN,celestialbody,celestialbody,92 % avis positifs (857 notes),857,4.38389731621937,5b4d6b858a5b7b23b49e7a28,,,https://www.wish.com/c/5f6ec2e3b92d3a0cadfd8e19,https://canary.contestimg.wish.com/api/webimage/5f6ec2e3b92d3a0cadfd8e19-medium.jpg,5f6ec2e3b92d3a0cadfd8e19
Bébé Infant Intelligence Apprentissage Cognition Fruits Légumes Mous Animaux Véhicules Livres Éducatifs Précoce Jouets Livre En Tissu Bande Dessinée,Baby Infant Intelligence Learning Cognition Fruit Soft Vegetable Animals Vehicles Early Educational Books Toys Cloth Book Cartoon,3.18,EUR,4.0,EUR,3.85,10,,,4.2,10.0,6,2,1,0,1,,,,,,,animal,50,Livraison standard,1.0,false,,50,,,CN,Yadangwaxia,yadangwaxia,93 % avis positifs (70 notes),70,4.385714285714286,5f8a8733907c86c146d5dc67,,,https://www.wish.com/c/5ff684e514d7d498f54b41f0,https://canary.contestimg.wish.com/api/webimage/5ff684e514d7d498f54b41f0-medium.jpg,5ff684e514d7d498f54b41f0
Beau 40 pièces / ensemble 3D coloré vis écrous boulons bâtiment Puzzle jeu Intelligent enfants jouet apprentissage jouets,Beautiful 40Pcs/Set 3D Colorful Screw Nuts Bolts Building Puzzle Game Intelligent Kids Toy  Learning Toys,15.0,EUR,15.0,EUR,17,4,,,2.0,1.0,0,0,0,1,0,,,,,,,40pcs,50,Livraison standard,5.0,false,,50,true,Quantité limitée !,CN,hhllou,hhllou,"92 % avis positifs (2,516 notes)",2516,4.387122416534181,595368f0abea9146da895283,,,https://www.wish.com/c/5cade66fde0a851606b6a466,https://canary.contestimg.wish.com/api/webimage/5cade66fde0a851606b6a466-medium.jpg,5cade66fde0a851606b6a466
Dessin animé en bois Fruit Animal Reconnaître Blocs Puzzle Montessori Éducatifs Enfants Intelligence Apprentissage Jouets,Wooden Cartoon Fruit Animal Recognize Blocks Puzzle Montessori Educational Children Intelligence Learning Toys,10.0,EUR,10.0,EUR,12,0,,,5.0,1.0,1,0,0,0,0,,,,,,,,50,Livraison standard,3.0,false,,50,true,Quantité limitée !,CN,Girls' showtime,girlsshowtime,"89 % avis positifs (134,330 notes)",134330,4.192965085982283,5860cf7b0929fc4d76180aed,,,https://www.wish.com/c/5c3408596194ab311ef1eedc,https://canary.contestimg.wish.com/api/webimage/5c3408596194ab311ef1eedc-medium.jpg,5c3408596194ab311ef1eedc
Jack Daniel's,,,,,,,,,,,,,,,,,,,,,,,,,,,,,,,,,,,,,,,,,https://www.wish.com/c/5e8d30069719ed64049677e3,,5e8d30069719ed64049677e3
8 pièces fil métallique éducation précoce Puzzle IQ esprit Puzzles jeu jouets pour enfants 8 en 1 IQ Intelligence jouets,8PCS Metal Wire Early Education Puzzle IQ Mind Puzzles Game Childrens Toys 8 in 1  IQ Intelligence Toys,7.0,EUR,7.0,EUR,8,0,,,5.0,0.0,,,,,,,,,,,yellow,8pcs,50,Livraison standard,3.0,false,,50,,,VE,Compra tu Producto,compratuproducto,82 % avis positifs (169 notes),169,3.93491124260355,5d7ee35a5e11b92f01c35a21,,,https://www.wish.com/c/5daa73f0c8c1b206ab7e8371,https://canary.contestimg.wish.com/api/webimage/5daa73f0c8c1b206ab7e8371-medium.jpg,5daa73f0c8c1b206ab7e8371
Montessori en bois comptage chiffres Alphabet anneaux couleur / forme / Conseil de Cognition numérique préscolaire mathématique jouet Puzzle mathématiques cadeaux Intelligence jouet,Montessori Wooden Count Numbers Alphabet Rings Color/Shape/Digital Cognition Board Preschool Math Toy Puzzle Math Gifts Intelligence Toy,15.0,EUR,15.0,EUR,17,1,,,5.0,0.0,,,,,,,,,,,,a,50,Livraison standard,5.0,false,,50,,,CN,Yuandane,yuandane,"89 % avis positifs (8,376 notes)",8376,4.232091690544412,5c2f01a7ab7d2428503ae1ec,,,https://www.wish.com/c/5f588dbef3b877003e627eb8,https://canary.contestimg.wish.com/api/webimage/5f588dbef3b877003e627eb8-medium.jpg,5f588dbef3b877003e627eb8
3D tissu doux bébé livres Montessori bébé jouets pour les tout-petits développement de l'intelligence jouets éducatifs cadeaux,3D Soft Cloth Baby Books  Montessori Baby Toys For Toddlers Intelligence Development Educational Toy Gifts,14.0,EUR,15.0,EUR,16,10,,,5.0,2.0,2,0,0,0,0,,,,,,multicolor,a,50,Livraison standard,4.0,false,,50,,,CN,coco mini shop,cocominishop,93 % avis positifs (41 notes),41,4.463414634146342,5d3e72f072b0c917291ea2da,,,https://www.wish.com/c/5e6263714a62723082ab71ee,https://canary.contestimg.wish.com/api/webimage/5e6263714a62723082ab71ee-medium.jpg,5e6263714a62723082ab71ee
Intelligence Card Swish Fun jeu de société transparent jouets éducatifs pour enfants,Intelligence Card Swish Fun Transparent Board Game Children's Educational Toys,13.0,EUR,66.0,EUR,15,1,,,3.0,1.0,0,0,1,0,0,,,,,,,,50,Livraison standard,4.0,false,,50,,,CN,Board game toys,boardgametoys,87 % avis positifs (615 notes),615,4.195121951219512,5d491c5772b0c93ec4bb02dc,,,https://www.wish.com/c/5e1d93e210482f07e4534f3f,https://canary.contestimg.wish.com/api/webimage/5e1d93e210482f07e4534f3f-medium.jpg,5e1d93e210482f07e4534f3f
DIY Kid 3D Puzzle Chinese House Model Wooden Accessory Assembled Jigsaw Intelligent Toy XiuR,DIY Kid 3D Puzzle Chinese House Model Wooden Accessory Assembled Jigsaw Intelligent Toy XiuR,24.0,EUR,24.0,EUR,28,0,,,5.0,0.0,,,,,,,,,,,,,50,Livraison Express,10.0,true,,50,,,CN,XiuRuiDa,xiuruida,91 % avis positifs (263 notes),263,4.365019011406844,5d7f7c192fd6cc7ab473f33c,,,https://www.wish.com/c/5fc5dcf4c08123d280bbf7bc,https://canary.contestimg.wish.com/api/webimage/5fc5dcf4c08123d280bbf7bc-medium.jpg,5fc5dcf4c08123d280bbf7bc
Montessori jouets éducatifs en bois pour enfants conseil mathématique pêche compter nombres caractères lettres correspondant à forme numérique match éducation précoce jouet,Montessori Educational Wooden Toys for Kids Board Math Fishing Count Numbers Character Letters Matching Digital Shape Match Early Education Toy,12.0,EUR,12.0,EUR,14,10,,,4.363636363636363,22.0,15,3,2,1,1,,,,,,,a,50,Livraison standard,4.0,false,,50,,,CN,HighsamWin,highsamwin,"86 % avis positifs (4,277 notes)",4277,4.128127191956979,5d5ce51c40defd39c2a77e49,,,https://www.wish.com/c/5f815dec3b4859004f4d2291,https://canary.contestimg.wish.com/api/webimage/5f815dec3b4859004f4d2291-medium.jpg,5f815dec3b4859004f4d2291
Fluffy Floam Slime Parfumé Soulagement du Stress Pas de Borax Enfants Intelligence Education Jouets Boue Jouets,Fluffy Floam Slime Scented Stress Relief No Borax Kids Intelligence Education Toys Sludge Toys,4.78,EUR,5.0,EUR,5.79,10,,,3.423076923076923,52.0,22,5,10,3,12,,,,,,,yellow&green&pink&blue,50,Livraison standard,1.0,false,,50,true,Quantité limitée !,CN,form color,formcolor,"91 % avis positifs (8,976 notes)",8976,4.333110516934046,57b46e2344ee7f2cd396e0bf,,,https://www.wish.com/c/5cdf672e29b7b805e0a8c9b4,https://canary.contestimg.wish.com/api/webimage/5cdf672e29b7b805e0a8c9b4-medium.jpg,5cdf672e29b7b805e0a8c9b4
Fortnite,,,,,,,,,,,,,,,,,,,,,,,,,,,,,,,,,,,,,,,,,https://www.wish.com/c/5ea1a2919719ed8249092ec7,,5ea1a2919719ed8249092ec7
Graffiti and Gold,,,,,,,,,,,,,,,,,,,,,,,,,,,,,,,,,,,,,,,,,https://www.wish.com/c/5f8c2060eb31f9c6391a6240,,5f8c2060eb31f9c6391a6240
