title,title_orig,discount_price,discount_price_currency,retail_price,retail_price_currency,discount_price_in_original_currency,nb_cart_orders_approx,nb_units_purchased_approx,uses_ad_boosts,rating,rating_count,rating_five_count,rating_four_count,rating_three_count,rating_two_count,rating_one_count,badges_count,badge_local_product,badge_product_quality,badge_fast_shipping,tags,product_color,product_variation_size_id,product_variation_inventory,shipping_option_name,shipping_option_price,shipping_is_express,countries_shipped_to,inventory_total,has_urgency_banner,urgency_text,origin_country,merchant_title,merchant_name,merchant_info_subtitle,merchant_rating_count,merchant_rating,merchant_id,merchant_has_profile_picture,merchant_profile_picture,product_url,product_picture,product_id
Micro USB Hub 2.0 Multi Port USB 4 Ports Hub USB High Speed HUb USB Splitter pour PC Accessoires informatiques,Micro USB Hub 2.0 Multi USB Port 4 Ports Hub USB High Speed HUb USB Splitter for PC Computer Accessories,3.3,EUR,13.0,EUR,4.0,10,,,3.9782608695652173,46.0,23,13,2,2,6,,,,,,coolblack,,50,Livraison standard,1.0,false,,50,true,Quantité limitée !,US,GurenmutansFo,gurenmutansfo,"93 % avis positifs (2,369 notes)",2369,4.423807513718868,5e6ccba2b2748482dec1429d,,,https://www.wish.com/c/5f9cfe2725a1c915446ba49b,https://canary.contestimg.wish.com/api/webimage/5f9cfe2725a1c915446ba49b-medium.jpg,5f9cfe2725a1c915446ba49b
Ugreen,,,,,,,,,,,,,,,,,,,,,,,,,,,,,,,,,,,,,,,,,https://www.wish.com/c/5e3b0ba49719eddf0ac7e679,,5e3b0ba49719eddf0ac7e679
[8Port / 4Port / 1Port] USB QC3.0 Chargeur rapide Adaptateur secteur Bureau Rapids Hub de chargement USB Voyage Bureau à domicile avec écran LCD pour smartphones Périphériques USB,[ 8Port/ 4Port /1Port] USB QC3.0 Fast Charger Power Adapter Wall Desktop Rapids USB Charging Hub Travel Office Home with LCD Display for Smartphones USB Devices  ,6.0,EUR,6.0,EUR,7,10,,,4.114754098360656,122.0,65,34,8,2,13,,,,,,white,1port(us)5v1a,50,Livraison standard,2.0,false,,50,,,CN,clothing fashion store one,clothingfashionstoreone,(147 notes),147,4.136054421768708,5e4b975929e786240333b5b2,,,https://www.wish.com/c/5f9d18670cae4f16883a33ae,https://canary.contestimg.wish.com/api/webimage/5f9d18670cae4f16883a33ae-medium.jpg,5f9d18670cae4f16883a33ae
Mode Femmes Porte-Monnaie Embrayage Wristlet Portefeuille Sac Multi-couches Polka Dots Téléphone Clé Cas Maquillage Sac Femmes Titulaire de la Carte de Crédit Fourre-Tout,Fashion Women Coin Purse Clutch Wristlet Wallet Bag Multi-layers Polka Dots Phone Key Case Makeup Bag Women Credit Card Holder Tote,7.0,EUR,33.0,EUR,8,1000,,,4.383233532934132,334.0,232,48,25,8,21,,,,,,khaki,,50,Livraison Express,9.0,true,,50,,,CN,lizhongbin,lizhongbin,"(1,027 notes)",1027,4.360272638753651,5824285f794d7a30d4fdaa6f,,,https://www.wish.com/c/5939182bd9366c273b968065,https://canary.contestimg.wish.com/api/webimage/5939182bd9366c273b968065-medium.jpg,5939182bd9366c273b968065
ZOSI,,,,,,,,,,,,,,,,,,,,,,,,,,,,,,,,,,,,,,,,,https://www.wish.com/c/5efc6ceeeb31f9cd145e0e9f,,5efc6ceeeb31f9cd145e0e9f
10.2A Station de charge USB ultra rapide à 4/6 ports pour téléphone intelligent Tablette de bureau universelle et station de charge multi-appareils pour smartphone,10.2A Super Fast 4/6 Port USB Charging Station for Smart Phone Universal Desktop Tablet & Smartphone Multi-Device Hub Charging Dock ,14.0,EUR,107.0,EUR,16,10,,,4.196428571428571,56.0,33,10,8,1,4,,,,,,black,4portsusb(usplug),3,Livraison standard,4.0,false,,50,,,CN,SHENZHEN ZHONGCHENG CO. LTD.,shenzhenzhongchengcoltd,"86 % avis positifs (1,286 notes)",1286,4.087091757387247,58f9d77291a95f6646b04049,,,https://www.wish.com/c/5c21a15672a7b537016a674f,https://canary.contestimg.wish.com/api/webimage/5c21a15672a7b537016a674f-medium.jpg,5c21a15672a7b537016a674f
USLION 5 ports USB chargeur HUB affichage LED Multi USB Station de charge Dock universel téléphone portable bureau mur maison EU UK Plug,USLION 5 Port USB Charger HUB LED Display Multi USB Charging Station Dock Universal Mobile Phone Desktop Wall Home EU UK Plug,19.0,EUR,19.0,EUR,22,2,,,5.0,0.0,,,,,,,,,,,,"eu,china",50,Livraison standard,5.0,false,,50,true,Quantité limitée !,CA,11368796 CANADA CORPORATION,11368796canadacorporation,"80 % avis positifs (1,166 notes)",1166,3.9382504288164664,5ffb1f43fa8a25c707537989,,,https://www.wish.com/c/604a2720a1dfcf0e638d1be3,https://canary.contestimg.wish.com/api/webimage/604a2720a1dfcf0e638d1be3-medium.jpg,604a2720a1dfcf0e638d1be3
Charm Bag Porte-clés Porte-clés Lapin Fourrure Pom-pom Fluffy Puff Ball Pendentif Clés,Charm Bag Key Chain Key Ring Rabbit Fur Pom-pom Fluffy Puff Ball Pendant Keys,3.0,EUR,5.0,EUR,3,5000,,,4.529177718832892,754.0,564,97,48,18,27,,,,,,,1,50,Livraison standard,1.0,false,,50,,,CN,statecao,statecao,"(4,346 notes)",4346,4.341923607915325,5912d5560118c9518521b7fd,,,https://www.wish.com/c/59e06426cd363715b0a7ffb5,https://canary.contestimg.wish.com/api/webimage/59e06426cd363715b0a7ffb5-medium.jpg,59e06426cd363715b0a7ffb5
Baril de vin de bois de chêne en bois vintage de 1.5L pour le port de rhum de whisky de bière,1.5L Vintage Wood Oak Timber Wine Barrel For Beer Whiskey Rum Port,45.0,EUR,45.0,EUR,54.0,10,,,3.993006993006993,143.0,77,30,12,6,18,,,,,,winered,1.5l,50,Livraison Express,16.0,true,,50,,,CN,Gonghaha,gonghaha,"94 % avis positifs (2,288 notes)",2288,4.456293706293707,5b46ec18e4b3fb231aeadc62,,,https://www.wish.com/c/5c39977a9740a94c0c9d3f46,https://canary.contestimg.wish.com/api/webimage/5c39977a9740a94c0c9d3f46-medium.jpg,5c39977a9740a94c0c9d3f46
2022 Upgrade 48W 4 Ports Adapter QC 3.0 Quick Charge 3.0 USB Charger AU/EU/US/UK Plug Wall Mobile Phone Fast Charger Home Wall Charger Travel Adapter 7Colors ,2022 Upgrade 48W 4 Ports Adapter QC 3.0 Quick Charge 3.0 USB Charger AU/EU/US/UK Plug Wall Mobile Phone Fast Charger Home Wall Charger Travel Adapter 7Colors ,0.0,EUR,0.0,EUR,0,10,,,5.0,0.0,,,,,,,,,,,white&blue,brplug,2,Livraison standard,1,false,,50,,,CN,posidsiyfdis,posidsiyfdis,"77 % avis positifs (1,577 notes)",1577,3.7634749524413444,5f4de1fbea76975591935a89,,,https://www.wish.com/c/606691a4c822e2b79ec58bd4,https://canary.contestimg.wish.com/api/webimage/606691a4c822e2b79ec58bd4-medium.jpg,606691a4c822e2b79ec58bd4
Xinpuguang,,,,,,,,,,,,,,,,,,,,,,,,,,,,,,,,,,,,,,,,,https://www.wish.com/c/5fa28a4c2c58b1000fb2bfad,,5fa28a4c2c58b1000fb2bfad
Station de charge USB 10.2A 4 ports / 6 ports Tablette de bureau universelle Smartphone Station de charge multi-périphériques,10.2A 4 Port / 6 Port USB Charging Station Universal Desktop Tablet Smartphone Multi-Device Hub Charging Dock ,15.0,EUR,115.0,EUR,18,10,,,4.013698630136986,73.0,39,13,11,3,7,,,,,,white,4portsusb(usplug),49,Livraison standard,5.0,false,,50,,,CN,qgq2213,qgq2213,"91 % avis positifs (1,449 notes)",1449,4.33471359558316,5ad8cb27c3911a65e9f2ec36,,,https://www.wish.com/c/5db80bb3c6fd3406470fcd7a,https://canary.contestimg.wish.com/api/webimage/5db80bb3c6fd3406470fcd7a-medium.jpg,5db80bb3c6fd3406470fcd7a
Nouvelle station de charge à affichage numérique USB à 5 ports à chargement rapide Dock Universal Multi USB Home Chargers,New Fast Charging 5-Port USB Digital Display Charging Station Dock Universal Multi USB Home Chargers,10.0,EUR,48.0,EUR,11,10,,,4.444444444444445,135.0,87,31,11,2,4,,,,,,black,us,50,Livraison standard,3.0,false,,50,,,CN,hing love vivi,hinglovevivi,"89 % avis positifs (3,427 notes)",3427,4.175372045520864,5afe53948699ce59376140eb,,,https://www.wish.com/c/5de2060e63c07f92e14070f2,https://canary.contestimg.wish.com/api/webimage/5de2060e63c07f92e14070f2-medium.jpg,5de2060e63c07f92e14070f2
Adaptateur de répartiteur de concentrateur USB Micro Mini 4 ports 2.0 haute vitesse pour ordinateur portable PC,High Speed Micro Mini 4 Ports 2.0 USB HUB Splitter Adapter for PC Laptop Computer,4.78,EUR,5.0,EUR,5.79,5000,,,4.1387900355871885,1124.0,659,195,134,39,97,,,,,,,white,50,Livraison standard,2.0,false,,50,,,CN,wushidaojin,wushidaojin,"89 % avis positifs (14,291 notes)",14291,4.2140508012035545,5aefed815ce1805b944fba35,,,https://www.wish.com/c/5c8f7dc9b14bfa61afae6c96,https://canary.contestimg.wish.com/api/webimage/5c8f7dc9b14bfa61afae6c96-medium.jpg,5c8f7dc9b14bfa61afae6c96
"Snyank Snyank USB C Hub with 2 USB 3.0 Ports SD/TF Card Reader USB-C, see details","Snyank Snyank USB C Hub with 2 USB 3.0 Ports SD/TF Card Reader USB-C, see details",216.0,EUR,216.0,EUR,261.0,0,,,5.0,0.0,,,,,,,,,,,,,50,Livraison standard,12.0,false,,50,,,KR,All about Korea,allaboutkorea,,0,5.0,5ff051473a432d5a8166807f,,,https://www.wish.com/c/5fffea2c8b7e0db440346da8,https://canary.contestimg.wish.com/api/webimage/5fffea2c8b7e0db440346da8-medium.jpg,5fffea2c8b7e0db440346da8
4/6 ports téléphones intelligents multi-ports de voyage appareils alimentés par USB chargeur mural multifonction adaptateur secteur 4/6 ports USB UK / US / EU,4/6-Ports Smart Phones Multi-Port Travel USB-Powered Devices Multi-function Wall Charger Power Adapter 4/6 Port USB UK/US/EU,4.69,EUR,15.0,EUR,5.68,10,,,4.609375,64.0,47,12,3,1,1,,,,,,,uk-4,50,Livraison standard,2.0,false,,50,,,CN,gavin2333,gavin2333,"(1,689 notes)",1689,4.177619893428064,5db52166ec09c13dc677c48d,,,https://www.wish.com/c/5f51de971e0b45130c82c390,https://canary.contestimg.wish.com/api/webimage/5f51de971e0b45130c82c390-medium.jpg,5f51de971e0b45130c82c390
US UK EU Plug PD 18W USB-C Type C Adaptateur de chargeur mural rapide pour / iPhone 12 11 Pro,US UK EU Plug PD 18W USB-C Type C Fast Wall Charger Adapter For/ iPhone 12 11 Pro,5.0,EUR,5.0,EUR,6,10,,,4.703703703703703,27.0,22,2,3,0,0,,,,,,,euplug,50,Livraison standard,2.0,false,,50,true,Quantité limitée !,CN,excellent.distinct,excellentdistinct,"93 % avis positifs (30,646 notes)",30646,4.402988970828167,5800857b79e05f5b850502f1,,,https://www.wish.com/c/5fae4c96897d403ce38693cc,https://canary.contestimg.wish.com/api/webimage/5fae4c96897d403ce38693cc-medium.jpg,5fae4c96897d403ce38693cc
Nouvelle mise à niveau 100W 20Ports USB chargeur rapide adaptateur secteur bureau mural concentrateur de charge USB rapide pour voyage bureau maison hôtel école,New Upgrade 100W 20Ports USB Fast Charger Power Adapter Wall Desktop Rapid USB Charging Hub for Travel Office Home Hotel School,15.0,EUR,106.0,EUR,17,10,,,4.666666666666667,3.0,2,1,0,0,0,,,,,,blue,lowused&10portscnplug,5,Livraison standard,5.0,false,,50,,,CN,leiyanhong,leiyanhong,"(1,002 notes)",1002,4.191616766467066,5df332d9dc64780e837c0e60,,,https://www.wish.com/c/5fd96ae99f90ef3ffd1f8c85,https://canary.contestimg.wish.com/api/webimage/5fd96ae99f90ef3ffd1f8c85-medium.jpg,5fd96ae99f90ef3ffd1f8c85
Liibot,,,,,,,,,,,,,,,,,,,,,,,,,,,,,,,,,,,,,,,,,https://www.wish.com/c/5fabc4b5a9c6480010b6f6e3,,5fabc4b5a9c6480010b6f6e3
"Porte-cartes étanche et imperméable Porte-cartes de crédit avec pochette pour cartes de crédit, Boîte brillante en couleur solide, simple et légère.","Card Wallet Waterproof Business ID Credit Card Pocket Holder,Solid Color Glossy Box,Simple and Lightweight.",3.0,EUR,5.0,EUR,3,5000,,,3.7386196769456683,1362.0,656,229,171,77,229,,,,,,black,,50,Livraison standard,1.0,false,,50,,,CN,lidalao168,lidalao168,"(1,214 notes)",1214,3.912685337726524,5ac5c1eeb125ab2187622e89,,,https://www.wish.com/c/5acc161f0548ea4fc9a68c58,https://canary.contestimg.wish.com/api/webimage/5acc161f0548ea4fc9a68c58-medium.jpg,5acc161f0548ea4fc9a68c58
1.5 M hot sale 1Pcs Volex EU European 2-Prong Port AC Power Cord Cable For  Mini Router for apple TV PS2 PS3  Power Cable,1.5 M hot sale 1Pcs Volex EU European 2-Prong Port AC Power Cord Cable For  Mini Router for apple TV PS2 PS3  Power Cable,14.0,EUR,14.0,EUR,16,0,,,5.0,0.0,,,,,,,,,,,,,50,Livraison standard,9.0,false,,50,,,CA,11368796 CANADA CORPORATION,11368796canadacorporation,"80 % avis positifs (1,166 notes)",1166,3.9382504288164664,5ffb1f43fa8a25c707537989,,,https://www.wish.com/c/601ed7f103d4b7448f228e7e,https://canary.contestimg.wish.com/api/webimage/601ed7f103d4b7448f228e7e-medium.jpg,601ed7f103d4b7448f228e7e
Porte-clés sifflet métallique ultrasonique réglable de formation de chien de compagnie argent,Pet Dog Training Adjustable Ultrasonic Sound Metal Whistle Keychain Silver,3.05,EUR,4.0,EUR,3.7,10,,,3.95,40.0,21,9,3,1,6,,,,,,silver,,50,Livraison standard,1.0,false,,50,,,CN,qianlitiaoyi,qianlitiaoyi,"(14,385 notes)",14385,4.294751477233229,5aed6aba1c250037c9fbeb12,,,https://www.wish.com/c/5b556f788f323c6d2b0b56c7,https://canary.contestimg.wish.com/api/webimage/5b556f788f323c6d2b0b56c7-medium.jpg,5b556f788f323c6d2b0b56c7
Mini Mini 4 Ports Micro Haute Vitesse 2.0 USB HUB Splitter Adaptateur pour Ordinateur Portable Ordinateur Portable PC ,High Speed Micro Mini 4 Ports 2.0 USB HUB Splitter Adapter for PC Laptop Computer ,5.0,EUR,5.0,EUR,5,10,,,3.8125,16.0,7,5,1,0,3,,,,,,,white,50,Livraison standard,1.0,false,,50,,,CN,The Miassiy's,themiassiys,"88 % avis positifs (8,061 notes)",8061,4.188190050862176,5465af838edcfa7d534a4e55,,,https://www.wish.com/c/5c8f7e12bcb74f17f66996f3,https://canary.contestimg.wish.com/api/webimage/5c8f7e12bcb74f17f66996f3-medium.jpg,5c8f7e12bcb74f17f66996f3
Adaptateur de chargeur mural électrique double port USB 5V 2A Prise de prise UE,Dual USB Port 5V 2A Electric Wall Charger Adapter EU Plug Socket Outlet,5.0,EUR,15.0,EUR,6,1000,,,4.413654618473895,249.0,162,54,17,6,10,,,,,,,,50,Livraison standard,2.0,false,,50,true,Quantité limitée !,CN,carefreemood,carefreemood,"(2,295 notes)",2295,4.3542483660130715,5982e6a421187f553aa0dd3f,,,https://www.wish.com/c/59d5f7e1dedf5f72c1f8aff0,https://canary.contestimg.wish.com/api/webimage/59d5f7e1dedf5f72c1f8aff0-medium.jpg,59d5f7e1dedf5f72c1f8aff0
Câble adaptateur Mini Thunderbolt DP vers HDMI de haute qualité pour Mac Macbook Pro Nouveau,High Quality Mini Display Port Thunderbolt DP To HDMI Adapter Cable For Mac Macbook Pro New,4.0,EUR,4.0,EUR,4,10,,,4.368421052631579,57.0,45,2,2,2,6,,,,,,white,1pcs,50,Livraison standard,1.0,false,,50,true,Quantité limitée !,CN,Pricekiller19,pricekiller19,"(4,470 notes)",4470,4.314541387024608,5d529d121527542001611709,,,https://www.wish.com/c/5e44d92a4cf9872830e046f2,https://canary.contestimg.wish.com/api/webimage/5e44d92a4cf9872830e046f2-medium.jpg,5e44d92a4cf9872830e046f2
UKCOCO 10 paires USB Type C couvercle de protection anti-poussière couvercle de prise de port en silicone,UKCOCO 10 Pairs USB Type C Anti Dust Protective Cover Silicone Port Plug Cover,3.06,EUR,4.0,EUR,3.71,10,,,4.5777777777777775,45.0,35,5,3,0,2,,,,,,black,,50,Livraison standard,1.0,false,,50,,,CN,drillsy18,drillsy18,"90 % avis positifs (1,324 notes)",1324,4.3104229607250755,5d848b398810cc1d95e66b1a,,,https://www.wish.com/c/5e15b62efb5b5a0a0f710391,https://canary.contestimg.wish.com/api/webimage/5e15b62efb5b5a0a0f710391-medium.jpg,5e15b62efb5b5a0a0f710391
Mountain Road Bicycle Bike 3 en 1 Sacs de coffre Vélo Double Side Porte-bagages arrière Tail Seat Pannier Pack Porte-bagages,Mountain Road Bicycle Bike 3 in 1 Trunk Bags Cycling Double Side Rear Rack Tail Seat Pannier Pack Luggage Carrier,31.0,EUR,31.0,EUR,37,10,,,4.478260869565218,69.0,49,10,6,2,2,,,,,,armygreen,,50,Livraison standard,10.0,false,,50,,,CN,BlueDanube2019,bluedanube2019,90 % avis positifs (933 notes),933,4.289389067524116,5d443b0f4c78550d3ae59a88,,,https://www.wish.com/c/5e65dd7afcc85c73061b92aa,https://canary.contestimg.wish.com/api/webimage/5e65dd7afcc85c73061b92aa-medium.jpg,5e65dd7afcc85c73061b92aa
2021 New Arrival  2 Types USB Hub 480Mbps High Speed Multiple USB 2.0 Power Cable Cord Expander 4/7 Port Adapter Splitter with Switch for Phone Tablet,2021 New Arrival  2 Types USB Hub 480Mbps High Speed Multiple USB 2.0 Power Cable Cord Expander 4/7 Port Adapter Splitter with Switch for Phone Tablet,4.78,EUR,5.0,EUR,5.79,10,,,4.571428571428571,7.0,5,1,1,0,0,,,,,,black,typea,50,Livraison standard,2.0,false,,50,,,CN,wugoumuxia665,wugoumuxia665,(255 ratings),255,2.772549019607843,5f12947e9ad18a1b45100ca3,,,https://www.wish.com/c/5fd201a1922e31484ff88784,https://canary.contestimg.wish.com/api/webimage/5fd201a1922e31484ff88784-medium.jpg,5fd201a1922e31484ff88784
"Kanix Thanos 2-port USB high-speed charging multi-outlet 3-hole 16A, 5m, 1ea","Kanix Thanos 2-port USB high-speed charging multi-outlet 3-hole 16A, 5m, 1ea",92.0,EUR,92.0,EUR,111.0,0,,,5.0,0.0,,,,,,,,,,,,,3,Livraison standard,12.0,false,,3,,,KR,top korea seller,topkoreaseller,50 % avis positifs (2 notes),2,3.0,5ff4782d45e0239ccc5a5c96,,,https://www.wish.com/c/600f784c3b2bc3448371e80e,https://canary.contestimg.wish.com/api/webimage/600f784c3b2bc3448371e80e-medium.jpg,600f784c3b2bc3448371e80e
Pied de biche télescopique de voiture de pied de biche télescopique d'arme d'auto-défense portative de 16 pouces,16Inch Portable Self-defense Weapon Telescopic Crowbar Car Automatic Spring Crowbar,8.0,EUR,8.0,EUR,9,10,,,5.0,0.0,,,,,,,,,,,,1pcs,50,Livraison Express,7.0,true,,50,true,Quantité limitée !,CN,All over the word,allovertheword,"87 % avis positifs (6,868 notes)",6868,4.089400116482237,5d521d0d8f85fa57d3b02680,,,https://www.wish.com/c/606537c9b3a9fa9c363b2b50,https://canary.contestimg.wish.com/api/webimage/606537c9b3a9fa9c363b2b50-medium.jpg,606537c9b3a9fa9c363b2b50
"Roblox Game Cartoon Backpack Cartable résistant à l'eau avec port de chargement USB et serrure Sacs à dos informatiques de 14/15,6 pouces pour femmes, hommes, collège, étudiant, cartable, sac à dos de randonnée décontracté","Roblox Game Cartoon Backpack Water Resistant Schoolbag with USB Charging Port and Lock 14/15.6 Inch Computer Business Backpacks for Women Men College School Student Gift,Bookbag Casual Hiking Daypack",12.0,EUR,49.0,EUR,14,10,,,1.0,1.0,0,0,0,0,1,,,,,,,style5,50,Livraison standard,4.0,false,,50,,,CN,Ting guo,tingguo,92 % avis positifs (97 notes),97,4.329896907216495,5d3beaf8ab0c791202a5973e,,,https://www.wish.com/c/5fc4aa1f75cd3a6e1af428d6,https://canary.contestimg.wish.com/api/webimage/5fc4aa1f75cd3a6e1af428d6-medium.jpg,5fc4aa1f75cd3a6e1af428d6
"Anker 12 prises et 3 ports USB avec prise plate, bande PowerPort avec rallonge de 6 pieds, pour la maison, le bureau et plus (4000J) (prise américaine)","Anker 12 Outlets & 3 USB Ports with Flat Plug, PowerPort Strip With 6ft Extension Cord, for Home, Office, and More (4000J) (US Plug)",63.0,EUR,63.0,EUR,76.0,0,,,5.0,0.0,,,,,,,,,,,,,50,Livraison standard,17.0,false,,50,,,CA,11368796 CANADA CORPORATION,11368796canadacorporation,"80 % avis positifs (1,166 notes)",1166,3.9382504288164664,5ffb1f43fa8a25c707537989,,,https://www.wish.com/c/601551e17acee86d7fe762f9,https://canary.contestimg.wish.com/api/webimage/601551e17acee86d7fe762f9-medium.jpg,601551e17acee86d7fe762f9
Placard de rangement armoire portative étagères à vêtements armoire armoire en tissu non tissé rangement de vêtements 4 couleurs FR,Storage Closet Portable Wardrobe Clothes Shelves Cabinet Non-Woven Fabric Wardrobe Clothing Storage 4 Colors FR,13.0,EUR,23.0,EUR,15,10,,,4.243243243243243,37.0,20,10,5,0,2,,,,,,,stylee,50,Livraison standard,4.0,false,,50,,,CN,eingmeace,eingmeace,86 % avis positifs (69 notes),69,3.927536231884058,5e5c6f1a99dd1f025399d5ea,,,https://www.wish.com/c/5ff670eb37e58c78e409e4ee,https://canary.contestimg.wish.com/api/webimage/5ff670eb37e58c78e409e4ee-medium.jpg,5ff670eb37e58c78e409e4ee
3 ports 1080P / 4K HDMI 2.0 câble séparateur automatique commutateur commutateur 3x1 adaptateur séparateur pour DVD HDTV PS3 PS4 Xbox,3 Port 1080P/4K HDMI 2.0 Cable Auto Splitter Switch Switcher 3x1 Adapter Splitter For DVD HDTV PS3 PS4 Xbox,8.0,EUR,8.0,EUR,9,10,,,4.5,16.0,12,2,1,0,1,,,,,,,1080p,23,Livraison standard,3.0,false,,50,true,Quantité limitée !,CN,greatfavor,greatfavor,"90 % avis positifs (10,166 notes)",10166,4.2349006492229,59846ab5d9d6a476dd10dbb1,,,https://www.wish.com/c/5fe41ba6b3ff057444f908cc,https://canary.contestimg.wish.com/api/webimage/5fe41ba6b3ff057444f908cc-medium.jpg,5fe41ba6b3ff057444f908cc
NOUVEAU transparent coupe-vent silicone bande d'étanchéité bande barre porte bande d'étanchéité,NEW Transparent Windproof Silicone Sealing Strip Bar Door Sealing Strip,3.08,EUR,5.0,EUR,3.73,10000,,,3.97100782328578,2173.0,1095,428,337,118,195,,,,,,,,50,Livraison standard,1.0,false,,50,true,Quantité limitée !,CN,FUEGNOD,fuegnod,"(4,608 notes)",4608,4.201822916666667,5a533cdd727653667b5f7f3d,,,https://www.wish.com/c/5d7203fb27f68d360ffdee75,https://canary.contestimg.wish.com/api/webimage/5d7203fb27f68d360ffdee75-medium.jpg,5d7203fb27f68d360ffdee75
Nouveau 50/200/500 PCS Saveur Cigarette Pops Perles Saveur De Fruits Menthe Saveur Porte-Cigarette Fumer Accessoires Hommes Cadeau Porte-Cigarette,New 50/200/500PCS Flavor Cigarette Pops Beads Fruit Flavour Mint Flavor Cigarette Holder Smoking Accessories Men Gift Cigarette Holder,3.0,EUR,3.0,EUR,3,1000,,,4.10655737704918,244.0,149,34,25,10,26,,,,,,,50pcs-mint,50,Livraison standard,1.0,false,,50,,,CN,nana333,nana333,90 % avis positifs (251 notes),251,4.286852589641434,5edf5e1304a03744ba1bc019,,,https://www.wish.com/c/5f291c296709990952ec5e78,https://canary.contestimg.wish.com/api/webimage/5f291c296709990952ec5e78-medium.jpg,5f291c296709990952ec5e78
3 ports USB Hub Mini USB3.0 boîte de répartition de concentrateur haute vitesse pour PC portable U lecteur de carte de disque pour téléphone portable,3 Port USB Hub Mini USB3.0 High Speed Hub Splitter Box for PC Laptop U Disk Card Reader for Mobile Phone,3.94,EUR,4.0,EUR,4.77,10000,,,4.533576642335767,2740.0,1896,556,197,36,55,,,,,,white,usb2.0,50,Livraison standard,1.0,false,,50,,,CN,Eula01,eula01,"(4,896 notes)",4896,4.392565359477124,5b3e16bb86152a2918eb7b87,,,https://www.wish.com/c/5da5a8894a76c143f101e2dc,https://canary.contestimg.wish.com/api/webimage/5da5a8894a76c143f101e2dc-medium.jpg,5da5a8894a76c143f101e2dc
Smart multifonction 4 en 1 téléphone portable PC TF Micro SD USB 3.1 avec port de Charge Micro USB adaptateur universel de type C lecteur de carte OTG,Smart Multifunctional 4 In 1 Phone Laptop PC TF Micro SD USB 3.1 With Micro USB Charge Port Universal Type C Adapter OTG Card Reader,4.72,EUR,25.0,EUR,5.72,10,,,4.416666666666667,60.0,43,9,3,0,5,,,,,,white,,50,Livraison standard,2.0,false,,50,,,CN,ashbu,ashbu,91 % avis positifs (735 notes),735,4.352380952380952,59315bc597555e4e45e1a12c,,,https://www.wish.com/c/5d9db3f02290a962a7b599c0,https://canary.contestimg.wish.com/api/webimage/5d9db3f02290a962a7b599c0-medium.jpg,5d9db3f02290a962a7b599c0
"Hub adaptateur USB 2.0 4 ports / 7 ports avec interrupteur d'alimentation et indicateur LED, adapté à divers produits de port USB","4 Ports/7 Ports USB 2.0 Adapter Hub with Power Switch and LED Indicator,suitable for Various USB Port Products",4.0,EUR,4.0,EUR,4,10,,,3.9160305343511452,131.0,70,23,15,3,20,,,,,,black,size1,50,Livraison standard,1.0,false,,50,true,Quantité limitée !,CN,wangminglr,wangminglr,"76 % avis positifs (2,351 notes)",2351,3.7247979583156106,5929910e71a2f27cff756419,,,https://www.wish.com/c/5eb3ce5f9cd7e6061611dccb,https://canary.contestimg.wish.com/api/webimage/5eb3ce5f9cd7e6061611dccb-medium.jpg,5eb3ce5f9cd7e6061611dccb
Prise d'alimentation St-Rip EU avec chargeur de prise USB Sm-Art adaptateur de voyage à la maison 4 Port de sortie support mural mis à la terre Cube Power St-Rip,Power St-Rip Eu Plug With Usb Sm-Art Socket Charger Travel Home Adapter 4 Outlet Port Grounded Wall Holder Cube Power St-Rip,15.0,EUR,17.0,EUR,17,10,,,4.75,8.0,7,0,1,0,0,,,,,,grey,euplug-stylea,50,Livraison Express,5.0,true,,50,,,CN,lijiajun,lijiajun,"91 % avis positifs (3,435 notes)",3435,4.304512372634643,5850fffae7881151aa24a343,,,https://www.wish.com/c/60338b7695490020891ba9c4,https://canary.contestimg.wish.com/api/webimage/60338b7695490020891ba9c4-medium.jpg,60338b7695490020891ba9c4
1 à 2 voies RJ45 Ethernet LAN répartiteur de réseau Double adaptateur Ports connecteur de coupleur adaptateur d'extension adaptateur de connecteur de prise,1 To 2 Ways RJ45 Ethernet LAN Network Splitter Double Adapter Ports Coupler Connector Extender Adapter Plug Connector Adapter,2.0,EUR,2.0,EUR,2,1000,,,4.251908396946565,262.0,164,47,24,7,20,,,,,,,,50,Livraison standard,1,false,,50,true,Quantité limitée !,CN,mandys,mandys,"84 % avis positifs (8,629 notes)",8629,4.029551512342103,57287dabeba1665924eb16ed,,,https://www.wish.com/c/5fd9e723bab9af95ed5624ae,https://canary.contestimg.wish.com/api/webimage/5fd9e723bab9af95ed5624ae-medium.jpg,5fd9e723bab9af95ed5624ae
Double Port USB 9-24V Étanche Moto Moto Guidon Chargeur Adaptateur Alimentation Prise Pour Téléphone Mobile USB chargeur,Dual USB Port 9-24V Waterproof Motorbike Motorcycle Handlebar Charger Adapter Power Supply Socket for Phone Mobile USB charger,7.0,EUR,7.0,EUR,8,5000,,,4.400215749730313,1854.0,1156,412,201,42,43,,,,,,,,50,Livraison standard,2.0,false,,50,true,Quantité limitée !,CN,furistroe,furistroe,"95 % avis positifs (4,532 notes)",4532,4.426743159752869,5844fc6415b9d74c8d799883,,,https://www.wish.com/c/5cd51ac066e826611dc5450d,https://canary.contestimg.wish.com/api/webimage/5cd51ac066e826611dc5450d-medium.jpg,5cd51ac066e826611dc5450d
Dispositif anti-viol alarme forte alerte attaque panique sécurité sécurité personnelle porte-clés WHE,Anti-rape Device Alarm Loud Alert Attack Panic Safety Personal Security Keychain WHE,3.0,EUR,16.0,EUR,3,10,,,4.306451612903226,62.0,43,7,6,0,6,,,,,,black,,50,Livraison standard,1.0,false,,50,,,CN,Where Home,wherehome,"89 % avis positifs (2,308 notes)",2308,4.179809358752166,590f087e864e5c2cccbcb040,,,https://www.wish.com/c/59eea2186fdc5149a6111bf9,https://canary.contestimg.wish.com/api/webimage/59eea2186fdc5149a6111bf9-medium.jpg,59eea2186fdc5149a6111bf9
