title,title_orig,discount_price,discount_price_currency,retail_price,retail_price_currency,discount_price_in_original_currency,nb_cart_orders_approx,nb_units_purchased_approx,uses_ad_boosts,rating,rating_count,rating_five_count,rating_four_count,rating_three_count,rating_two_count,rating_one_count,badges_count,badge_local_product,badge_product_quality,badge_fast_shipping,tags,product_color,product_variation_size_id,product_variation_inventory,shipping_option_name,shipping_option_price,shipping_is_express,countries_shipped_to,inventory_total,has_urgency_banner,urgency_text,origin_country,merchant_title,merchant_name,merchant_info_subtitle,merchant_rating_count,merchant_rating,merchant_id,merchant_has_profile_picture,merchant_profile_picture,product_url,product_picture,product_id
"Pushup Stands, Parallel Bars Pushup Handle, Strength Training Fitness Exercise for Arm for Chest","Pushup Stands, Parallel Bars Pushup Handle, Strength Training Fitness Exercise for Arm for Chest",21.0,CHF,21.0,CHF,23,1,,,5.0,0.0,,,,,,,,,,,black&silver,,50,Livraison standard,6.0,false,,50,,,CN,BaiFuXin,baifuxin,"81 % avis positifs (1,082 notes)",1082,3.955637707948244,5da571bb5d73456ea47cc466,,,https://www.wish.com/c/5fc84d2b98f829dd9fa9e9e5,https://canary.contestimg.wish.com/api/webimage/5fc84d2b98f829dd9fa9e9e5-medium.jpg,5fc84d2b98f829dd9fa9e9e5
Master Usa,,,,,,,,,,,,,,,,,,,,,,,,,,,,,,,,,,,,,,,,,https://www.wish.com/c/5efb1b7eeb31f93761263148,,5efb1b7eeb31f93761263148
Gymnastic Hanging Rings Durable Exercise Hanging Rings For Push‑Ups Pull‑Ups,Gymnastic Hanging Rings Durable Exercise Hanging Rings For Push‑Ups Pull‑Ups,41.0,CHF,41.0,CHF,44,0,,,5.0,0.0,,,,,,,,,,,,,50,Livraison standard,12.0,false,,50,,,CN,C9Dshop,c9dshop,"93 % avis positifs (6,444 notes)",6444,4.4121663563004345,58e6fe5ab5fde3105f62c10c,,,https://www.wish.com/c/600b5577154d6eeb561ccbe2,https://canary.contestimg.wish.com/api/webimage/600b5577154d6eeb561ccbe2-medium.jpg,600b5577154d6eeb561ccbe2
Accueil Push-up Barre de support pour l'entraînement Exercice Équipement de fitness Support de push-ups en forme de H Support de musculation de la poitrine,Home Push-up Push up Stand Bar for Workout Exercise fitness equipment H-shaped push-ups bracket chest muscle trainer chest muscle fitness,21.0,CHF,23.0,CHF,22,0,,,5.0,0.0,,,,,,,,,,,,black1pair,50,Livraison standard,6.0,false,,50,,,CN,Tome Shop,tomeshop,95 % avis positifs (510 notes),510,4.474509803921569,5778e6b97f1b50747a8613f3,,,https://www.wish.com/c/5e8aed2b8261dddd9e14a044,https://canary.contestimg.wish.com/api/webimage/5e8aed2b8261dddd9e14a044-medium.jpg,5e8aed2b8261dddd9e14a044
Fantastique femmes maillots de bain bikini une pièce push-up rembourré maillot de bain dos nu,Fantastic Women Swimwear Bikini One Piece Push-Up Padded Bathing Backless Beachwear,13.0,CHF,55.0,CHF,14,10,,,3.6812227074235806,229.0,98,44,32,26,29,,,,,,black,xs,20,Livraison standard,3.0,false,,50,,,CN,vobshoppingpark,vobshoppingpark,"88 % avis positifs (81,087 notes)",81087,4.138012258438468,55e40d40c9f8234229401ce9,,,https://www.wish.com/c/5aeff0365ce1805b944fd6c9,https://canary.contestimg.wish.com/api/webimage/5aeff0365ce1805b944fd6c9-medium.jpg,5aeff0365ce1805b944fd6c9
HALLOLURE,,,,,,,,,,,,,,,,,,,,,,,,,,,,,,,,,,,,,,,,,https://www.wish.com/c/5f8c2062eb31f9c6391a6248,,5f8c2062eb31f9c6391a6248
NORMOV femmes Push up Leggings Sexy taille haute Spandex entraînement Legging décontracté Fitness femme Leggings Jeggings Legins grande taille,NORMOV Women Push up Leggings Sexy High Waist Spandex Workout Legging Casual Fitness Female Leggings Jeggings Legins Plus Size,21.0,CHF,21.0,CHF,22,0,,,5.0,0.0,,,,,,,,,,,black,xs,50,Livraison standard,6.0,false,,50,,,CA,11368796 CANADA CORPORATION,11368796canadacorporation,"80 % avis positifs (1,166 notes)",1166,3.9382504288164664,5ffb1f43fa8a25c707537989,,,https://www.wish.com/c/606360afebe7a4d16ccfb790,https://canary.contestimg.wish.com/api/webimage/606360afebe7a4d16ccfb790-medium.jpg,606360afebe7a4d16ccfb790
Conjunto de bikini sexy para mujer Traje de baño Vendaje Traje de baño Traje de baño push-up,Sexy Women Bikini Set Bathing Suit Bandage Swimwear Push-up Swimsuit,18.0,CHF,18.0,CHF,19,5000,,,3.8098391674550616,1057.0,493,199,163,75,127,,,,,,white,s,50,Livraison standard,6.0,false,,50,,,CN,shenzhenxiaozhishangpu,深圳小志商铺,"85% retroalimentación positiva (43,531 calificaciones)",43531,3.984861363166479,5788dc8d88eb7a2e8a04b1b2,,,https://www.wish.com/c/59fd51ba9e82590b7bf7ad16,https://canary.contestimg.wish.com/api/webimage/59fd51ba9e82590b7bf7ad16-medium.jpg,59fd51ba9e82590b7bf7ad16
SunniMix Push Up Bars Pushup Stands Handles Grips Bar Stand Exercise Equipment Blue,SunniMix Push Up Bars Pushup Stands Handles Grips Bar Stand Exercise Equipment Blue,33.0,CHF,166.0,CHF,36,0,,,5.0,0.0,,,,,,,,,,,,1,7,Livraison standard,10.0,false,,7,,,CN,SunniMix,sunnimix,"87 % avis positifs (15,742 notes)",15742,4.128573243552281,58dcde249b324c53585d20e2,,,https://www.wish.com/c/5b6f7b335a126c13e4ffdd71,https://canary.contestimg.wish.com/api/webimage/5b6f7b335a126c13e4ffdd71-medium.jpg,5b6f7b335a126c13e4ffdd71
5 pièces / ensemble Abdominal rouleau roue Push-ups bandes de résistance Fitness Muscle Exercice Gym Fitness équipement ensemble exercice à domicile 2 couleurs,5PCS/Set Abdominal Roller Wheel Push-ups Resistance Bands Fitness Muscle Exercice Gym Fitness Equipment Set Home Exercise 2 Colors,49.0,CHF,49.0,CHF,53.0,0,,,5.0,0.0,,,,,,,,,,,red,,50,Livraison standard,12.0,false,,50,,,CN,Yingxinly,yingxinly,"86 % avis positifs (12,051 notes)",12051,4.120487926313169,5c2c2b2c5c2e6c36855f508e,,,https://www.wish.com/c/5f657bd269d0dc38ec0083e3,https://canary.contestimg.wish.com/api/webimage/5f657bd269d0dc38ec0083e3-medium.jpg,5f657bd269d0dc38ec0083e3
Elikliv 2pcs métal Push-up Bar Sucker Antidérapant Push-up Device Muscle Training,Elikliv 2pcs Metal Push-up Bar Sucker Non-slip Push-up Device Muscle Training,22.0,CHF,41.0,CHF,24,2,,,5.0,0.0,,,,,,,,,,,,,50,Livraison standard,6.0,false,,50,,,CN,springshop,springshop,"93 % avis positifs (1,521 notes)",1521,4.429322813938199,56eca76be0970b587dbe23e1,,,https://www.wish.com/c/5e85a89daa03ab4d43a4382f,https://canary.contestimg.wish.com/api/webimage/5e85a89daa03ab4d43a4382f-medium.jpg,5e85a89daa03ab4d43a4382f
Women's Fashion Halter Neck Bandage SwimSuits Colorblock Push Up Bra-Sized Bikini Sets Beachwear Plus Size ,Women's Fashion Halter Neck Bandage SwimSuits Colorblock Push Up Bra-Sized Bikini Sets Beachwear Plus Size ,7.0,CHF,7.0,CHF,7,10,,,4.0,13.0,8,2,0,1,2,,,,,,green,xs,5,Livraison standard,2.0,false,,50,,,CN,100% feel,100feel,"(5,095 avaliações)",5095,4.0,5953c8ac611d630fc1bfbcf7,,,https://www.wish.com/c/602f61ac95704ec1c3b09dc2,https://canary.contestimg.wish.com/api/webimage/602f61ac95704ec1c3b09dc2-medium.jpg,602f61ac95704ec1c3b09dc2
Ensemble de Yoga sans couture femmes vêtements de Fitness vêtements de sport femme Leggings de gymnastique rembourré Push-up soutien-gorge de sport à lanières 2 pièces costumes de sport,Seamless Yoga Set Women Fitness Clothing Sportswear Woman Gym Leggings Padded Push-up Strappy Sports Bra 2 Pcs Sports Suits,21.0,CHF,45.0,CHF,23,10,,,4.4,15.0,11,1,2,0,1,,,,,,black,s,50,Livraison standard,6.0,false,,50,,,CN,zhouleman,zhouleman,88 % avis positifs (330 notes),330,4.1909090909090905,5aacbeee0e63fa1912d052b1,,,https://www.wish.com/c/5cd4383c50bb3d69cb94e99b,https://canary.contestimg.wish.com/api/webimage/5cd4383c50bb3d69cb94e99b-medium.jpg,5cd4383c50bb3d69cb94e99b
"Mise à niveau de 13 façons en 1 conseil push-up ajouter du temps et des fonctions de comptage, outils d'exercice de remise en forme de musculation hommes femmes supports de push-up pour l'entraînement du corps GYM","Upgrade 13 Ways In 1 Push-Up Board Add Time and Counting Functions, Body Building Fitness Exercise Tools Men Women Push-up Stands for GYM Body Training",31.0,CHF,31.0,CHF,33,10,,,4.75,4.0,3,1,0,0,0,,,,,,,anodisplay,50,Livraison standard,8.0,false,,50,true,Quantité limitée !,CN,zkxjnc kja,zkxjnckja,"93 % avis positifs (2,334 notes)",2334,4.432305055698372,5e70726721861a5d05e6b97f,,,https://www.wish.com/c/5f70685e3dd7db1112f4f082,https://canary.contestimg.wish.com/api/webimage/5f70685e3dd7db1112f4f082-medium.jpg,5f70685e3dd7db1112f4f082
1 paire en forme de H Gym Push-Up Rack Portable Push-Up Frame Musculation Home Training Equipment Gym Fitness Equipment Accessories,1 Pair H Shape Gym Push-Up Rack Portable Push-Up Frame Musculation Home Training Equipment Gym Fitness Equipment Accessories,11.0,CHF,11.0,CHF,11,1000,,,4.276190476190476,315.0,174,81,40,13,7,,,,,,,,50,Livraison standard,3.0,false,,50,,,CN,weishengkejiyouxianmaoyigongsi,伟胜科技有限贸易公司,"92 % avis positifs (16,428 notes)",16428,4.328280983686389,54b4c504ffff65381e59e0cc,,,https://www.wish.com/c/59e999b603e1dd4ed24acf74,https://canary.contestimg.wish.com/api/webimage/59e999b603e1dd4ed24acf74-medium.jpg,59e999b603e1dd4ed24acf74
Support de gym push-up,Gym Push-Up Rack ,21.0,CHF,21.0,CHF,22,0,,,5.0,0.0,,,,,,,,,,,,2pcsblue-colorrandom,50,Livraison standard,5.0,false,,50,,,CN,Kiko-Love,kikolove,78 % avis positifs (924 notes),924,3.8582251082251084,56fa42b17bb49e063c6ce29d,,,https://www.wish.com/c/5ef3107e0578211efd15a089,https://canary.contestimg.wish.com/api/webimage/5ef3107e0578211efd15a089-medium.jpg,5ef3107e0578211efd15a089
2021 New Sexy Women Bikini Sets Summer Bathing Suit Ladies Bandage Swimwear Push-up Swimsuit,2021 New Sexy Women Bikini Sets Summer Bathing Suit Ladies Bandage Swimwear Push-up Swimsuit,9.0,CHF,9.0,CHF,9,10,,,3.0,1.0,0,0,1,0,0,,,,,,red,l,50,Livraison standard,3.0,false,,50,true,Quantité limitée !,CN,hongnana1314,hongnana1314,"(1,392 Bewertungen)",1392,4.047413793103448,5d4933a060c79c115f9052a6,,,https://www.wish.com/c/6038973e65b85e8d5b147b87,https://canary.contestimg.wish.com/api/webimage/6038973e65b85e8d5b147b87-medium.jpg,6038973e65b85e8d5b147b87
NEU Frauen Push-up Low Waist gestreifte Bikini Set gepolsterte Bandage Badeanzug Badebekleidung Beachwear,NEW Women Push-up Low Waist Striped Bikini Set Padded Bandage Swimsuit Swimwear Beachwear,9.0,CHF,18.0,CHF,9,10,,,4.612244897959184,147.0,111,24,7,1,4,,,,,,white,xxs,50,Livraison standard,3.0,false,,50,,,CN,VCAN,vcan,"89% Positives Feedback (19,411 Bewertungen)",19411,4.216578228839318,57b42e000bc8180a35ec0c89,,,https://www.wish.com/c/5cabcb9c8d3cfe09a4cbeb9e,https://canary.contestimg.wish.com/api/webimage/5cabcb9c8d3cfe09a4cbeb9e-medium.jpg,5cabcb9c8d3cfe09a4cbeb9e
Cold Steel,,,,,,,,,,,,,,,,,,,,,,,,,,,,,,,,,,,,,,,,,https://www.wish.com/c/5e8d2fc69719ed640496764d,,5e8d2fc69719ed640496764d
Summer Women Sexy Two Piece Print Split Push-Up Swimsuit Bandege Bikini Beachwear Swimwear Set,Summer Women Sexy Two Piece Print Split Push-Up Swimsuit Bandege Bikini Beachwear Swimwear Set,13.0,CHF,13.0,CHF,14,10,,,5.0,2.0,2,0,0,0,0,,,,,,green,s,50,Livraison standard,4.0,false,,50,true,Quantité limitée !,CN,stoneshop,stoneshop,"91 % avis positifs (137,409 notes)",137409,4.297935360857004,55dd7070de23d4104a41575f,,,https://www.wish.com/c/605075a622bdb919805ad445,https://canary.contestimg.wish.com/api/webimage/605075a622bdb919805ad445-medium.jpg,605075a622bdb919805ad445
Support de push-up Exercice de poitrine pour hommes Équipement d'exercice de remise en forme à domicile pour hommes,Push-up bracket chest exercise men's home fitness exercise equipment arm muscle sporting goods,37.0,CHF,37.0,CHF,40,0,,,5.0,0.0,,,,,,,,,,,,lowquality,5,Livraison standard,11.0,false,,10,true,Quantité limitée !,US,HuangpingshuohuitA,huangpingshuohuita,"73 % avis positifs (1,203 notes)",1203,3.5926849542809642,5e6cca125510407f4ea38ffd,,,https://www.wish.com/c/608653d415d0d0a5de44fdcd,https://canary.contestimg.wish.com/api/webimage/608653d415d0d0a5de44fdcd-medium.jpg,608653d415d0d0a5de44fdcd
Gepolsterte Push-Up-Bikini-Set-Badeanzüge für Damen Zweiteiliger Badeanzug Badeanzug Badeanzug Badeanzug Tankinis-Set Plus Size XS-8XL,Women's Padded Push Up Bikini Set Bathing Suits Two Pieces Swimsuit Swimwear Swimdress Bathing Suit Tankinis Set Plus Size XS-8XL,12.0,CHF,12.0,CHF,13,10,,,4.5,8.0,6,0,2,0,0,,,,,,,xs,50,Livraison standard,3.0,false,,50,,,CN,Fashion girl 123,fashiongirl123,"90% Positives Feedback (2,754 Bewertungen)",2754,4.1612200435729845,5829aab2ae08861b5d9f4141,,,https://www.wish.com/c/5fc5e4ee967263e80b33394a,https://canary.contestimg.wish.com/api/webimage/5fc5e4ee967263e80b33394a-medium.jpg,5fc5e4ee967263e80b33394a
1 Pair Self-Adhesive Invisible Shoulder Pads Women Men Soft Silicone Sponge Shoulder Push-Up Pads Enhancer Anti-slip Shoulder Pads,1 Pair Self-Adhesive Invisible Shoulder Pads Women Men Soft Silicone Sponge Shoulder Push-Up Pads Enhancer Anti-slip Shoulder Pads,5.24,CHF,6.0,CHF,5.76,10,,,4.0,1.0,0,1,0,0,0,,,,,,,1,50,Livraison standard,1.0,false,,50,,,CN,The young drift,theyoungdrift,"92% Positives Feedback (1,992 Bewertungen)",1992,4.338855421686747,58cfd547b13fb15064780c41,,,https://www.wish.com/c/5fb60945c73112761c2e5e54,https://canary.contestimg.wish.com/api/webimage/5fb60945c73112761c2e5e54-medium.jpg,5fb60945c73112761c2e5e54
Upgrade ! 2 Types Fitness Workout Push-up Rack Board Multi Function Gym Muscles Training Exercise Stand Back Exercise Supine Board,Upgrade ! 2 Types Fitness Workout Push-up Rack Board Multi Function Gym Muscles Training Exercise Stand Back Exercise Supine Board,18.0,CHF,18.0,CHF,19,7,,,5.0,0.0,,,,,,,,,,,,type1-purple,50,Livraison standard,6.0,false,,50,,,CN,wangliangwei52023,wangliangwei52023,76 % avis positifs (17 notes),17,3.764705882352941,5fa38484ba82835aaf0671dd,,,https://www.wish.com/c/605957d0949a096cbe89f0d5,https://canary.contestimg.wish.com/api/webimage/605957d0949a096cbe89f0d5-medium.jpg,605957d0949a096cbe89f0d5
Archie Mcphee,,,,,,,,,,,,,,,,,,,,,,,,,,,,,,,,,,,,,,,,,https://www.wish.com/c/5f4f7b59eb31f99b5bdaf4f3,,5f4f7b59eb31f99b5bdaf4f3
Double Suction Cup Sit-ups Push-up Assist Device Home Abdominal Exercise Fitness Equipement,Double Suction Cup Sit-ups Push-up Assist Device Home Abdominal Exercise Fitness Equipement,42.0,CHF,42.0,CHF,46,0,,,5.0,0.0,,,,,,,,,,,black,,50,Livraison standard,12.0,false,,50,true,Quantité limitée !,CN,Putongname norptdian,putongnamenorptdian,87 % avis positifs (324 notes),324,4.145061728395062,5db79691a9fbb200b662bde3,,,https://www.wish.com/c/5ea9510114a5cf53a52899fb,https://canary.contestimg.wish.com/api/webimage/5ea9510114a5cf53a52899fb-medium.jpg,5ea9510114a5cf53a52899fb
Lifting Hips Body Shaping Höschen Nahtlose Unterwäsche Frauen Push-Up Damen,Lifting Hips Body Shaping Panties Seamless Underwear Women's Push-Up Ladies,8.0,CHF,8.0,CHF,8,10,,,3.515151515151515,33.0,15,3,7,0,8,,,,,,,black-m-lowwaist,50,Livraison standard,2.0,false,,50,,,CN,Fuenreny Baby's,fuenrenybabys,"(1,256 Bewertungen)",1256,4.3415605095541405,5ecb1c2d00ef97884a37dee5,,,https://www.wish.com/c/5f66d560c5d855003ed8a488,https://canary.contestimg.wish.com/api/webimage/5f66d560c5d855003ed8a488-medium.jpg,5f66d560c5d855003ed8a488
Muskeltraining Sit Up Bars Stand Assistent Abdominal Core Strength Home Gym Saug Sit Up Fitnessgeräte Bench Bars Stand mit Zugseil,Muscle Training Sit Up Bars Stand Assistant Abdominal Core Strength Home Gym Suction Sit Up Fitness Equipment Bench Bars Stand with Pull Rope,8.0,CHF,14.0,CHF,8,10,,,3.857142857142857,14.0,7,3,0,3,1,,,,,,black,onlypullrope,50,Livraison standard,2.0,false,,50,,,CN,OUQIGN E-commerce,ouqignecommerce,"92% Positives Feedback (16,759 Bewertungen)",16759,4.333373112954233,55ab5842b06e29408bd8700c,,,https://www.wish.com/c/5ff80c3d9e9e94d30ea4bce0,https://canary.contestimg.wish.com/api/webimage/5ff80c3d9e9e94d30ea4bce0-medium.jpg,5ff80c3d9e9e94d30ea4bce0
One Piece Frauen Bademode Frauen Solid Beading Gepolsterte Bandage Push-up Monokini Badeanzug Tanga Trikini,One Piece Women Swimwear Women Solid Beading Padded Bandage Push-up Monokini Swimsuit Tanga Trikini,11.0,CHF,11.0,CHF,12,10,,,4.214285714285714,14.0,9,3,0,0,2,,,,,,rosered,arose,1,Livraison standard,3.0,false,,50,true,Quantité limitée !,CN,zfyyouth0101,zfyyouth0101,"90% Positives Feedback (3,199 Bewertungen)",3199,4.202875898718349,5a38a7d512fa1c56af8f093a,,,https://www.wish.com/c/601a46c2e50522162ea21c61,https://canary.contestimg.wish.com/api/webimage/601a46c2e50522162ea21c61-medium.jpg,601a46c2e50522162ea21c61
Support de push-up Exercice de poitrine pour hommes Équipement d'exercice de remise en forme à domicile pour hommes,Push-up bracket chest exercise men's home fitness exercise equipment arm muscle sporting goods,33.0,CHF,33.0,CHF,36,0,,,5.0,0.0,,,,,,,,,,,,lowquality,50,Livraison standard,10.0,false,,50,,,US,HuangpingshuohuitA,huangpingshuohuita,"73 % avis positifs (1,203 notes)",1203,3.5926849542809642,5e6cca125510407f4ea38ffd,,,https://www.wish.com/c/608652236512209be6d56a69,https://canary.contestimg.wish.com/api/webimage/608652236512209be6d56a69-medium.jpg,608652236512209be6d56a69
Mujeres Verano Fantástico Mujeres Traje de baño Bikini Una pieza Push-Up Acolchado Baño Ropa de playa sin respaldo,Women Summer Fantastic Women Swimwear Bikini One Piece Push-Up Padded Bathing Backless Beachwear,11.0,CHF,59.0,CHF,11,1000,,,3.5182186234817814,494.0,178,94,102,46,74,,,,,,black,m,19,Livraison standard,2.0,false,,50,,,CN,vobshoppingpark,vobshoppingpark,"88% retroalimentación positiva (81,087 calificaciones)",81087,4.138012258438468,55e40d40c9f8234229401ce9,,,https://www.wish.com/c/5a8038110e63fa2eec3d6fd8,https://canary.contestimg.wish.com/api/webimage/5a8038110e63fa2eec3d6fd8-medium.jpg,5a8038110e63fa2eec3d6fd8
Petit équipement de remise en forme à la maison,Push-up Trainer Sponge Foam Push-up Rack Small Home Fitness Equipment,21.0,CHF,21.0,CHF,22,10,,,5.0,1.0,1,0,0,0,0,,,,,,blue,,50,Livraison standard,5.0,false,,50,,,CN,Onlyyoufun,onlyyoufun,"90 % avis positifs (7,240 notes)",7240,4.262707182320442,5899857369b858031af8ba2a,,,https://www.wish.com/c/5fd72baf4a6c138939349448,https://canary.contestimg.wish.com/api/webimage/5fd72baf4a6c138939349448-medium.jpg,5fd72baf4a6c138939349448
5 Farbe Frauen New Fashion Lace Push Up BH und niedrige Taille Höschen Sets Sexy Dessous Set Damen Floral Lace Unterwäsche Set Nachtwäsche Plus Size,5 Color Women New Fashion Lace Push Up Bra and Low Waist Panties Sets Sexy Lingerie Set Ladies Floral Lace Underwear Set Sleepwear Plus Size,8.0,CHF,9.0,CHF,8,5000,,,3.445692883895131,534.0,218,86,63,50,117,,,,,,blue,s,50,Livraison standard,3.0,false,,50,,,CN,nn ei,nnei,"(1,619 Bewertungen)",1619,3.972205064854849,5d4653ea70327a1e1aef2604,,,https://www.wish.com/c/5f3603dc60e91a00385c06ff,https://canary.contestimg.wish.com/api/webimage/5f3603dc60e91a00385c06ff-medium.jpg,5f3603dc60e91a00385c06ff
Bras Muscle Exercis Gym Push-Up,Arm muscle Exercis Gym Push-Up,37.0,CHF,37.0,CHF,40,0,,,5.0,0.0,,,,,,,,,,,,2pcsblue-colorrandom,50,Livraison standard,11.0,false,,50,,,CN,Kiko-Love,kikolove,78 % avis positifs (924 notes),924,3.8582251082251084,56fa42b17bb49e063c6ce29d,,,https://www.wish.com/c/5ef313c3b0be1550698796d2,https://canary.contestimg.wish.com/api/webimage/5ef313c3b0be1550698796d2-medium.jpg,5ef313c3b0be1550698796d2
Maillot de bain une pièce Push Up Bikini rembourré pour femme Maillots de bain Bain Monokini CHAUD,Women's One Piece Push Up Padded Bikini Swimsuit Swimwear Bathing Monokini HOT,6.0,CHF,15.0,CHF,6,10,,,4.0,1.0,0,1,0,0,0,,,,,,red,xxs,4,Livraison standard,2.0,false,,50,,,CN,ShapeU,wonder_wall,"90 % avis positifs (6,081 notes)",6081,4.2443677026804805,5a5d9aa76f6023029597bc4d,,,https://www.wish.com/c/5e69d348fa12840f40b384ab,https://canary.contestimg.wish.com/api/webimage/5e69d348fa12840f40b384ab-medium.jpg,5e69d348fa12840f40b384ab
"2021 14 maneiras em 1 sistema de prancha push-up, ferramentas para exercícios de musculação Suporte multifuncional de push-up, sistema de treinamento de prancha de exercícios para homens, mulheres, casa, fitness portátil","2021 14 Ways In 1 Push Up Board System, Body Building Exercise Tools Multifunctional Push-Up Stand, Workout Board Training System for Men Women Home Fitness Portable",18.0,CHF,18.0,CHF,19,10,,,4.333333333333333,3.0,2,0,1,0,0,,,,,,,only2handle,50,Livraison standard,6.0,false,,50,,,CN,Happiness in the Shop,happinessintheshop,"91% Feedback positivo (8,523 avaliações)",8523,4.329930775548516,5d3d0e10e4b65d1d131e7286,,,https://www.wish.com/c/600809d55295dc7fd7e8bad5,https://canary.contestimg.wish.com/api/webimage/600809d55295dc7fd7e8bad5-medium.jpg,600809d55295dc7fd7e8bad5
CubicSeven,,,,,,,,,,,,,,,,,,,,,,,,,,,,,,,,,,,,,,,,,https://www.wish.com/c/5f994fc2f82dcc00109ede86,,5f994fc2f82dcc00109ede86
"2021 14 façons en 1 système de conseil push up, outils d'exercice de musculation support push-up multifonctionnel, système d'entraînement de planche d'entraînement pour hommes femmes fitness à domicile portable","2021 14 Ways In 1 Push Up Board System, Body Building Exercise Tools Multifunctional Push-Up Stand, Workout Board Training System for Men Women Home Fitness Portable",17.0,CHF,17.0,CHF,18,10,,,3.6666666666666665,3.0,1,1,0,1,0,,,,,,,sizea,1,Livraison standard,5.0,false,,12,,,CN,huyyewui,huyyewui,78 % avis positifs (142 notes),142,3.73943661971831,5db81e2c0e5a59060206747b,,,https://www.wish.com/c/5fee8bd858df2800453fad9a,https://canary.contestimg.wish.com/api/webimage/5fee8bd858df2800453fad9a-medium.jpg,5fee8bd858df2800453fad9a
4 Couleurs Bande De Résistance pour Banc Barbell Push-Up Support Support Tirer Bras Exercice Poitrine Muscle Formation Équipement de Fitness Dans La Gym À Domicile,4 Colors Resistance Band for Bench Barbell Push-Up Support Bracket Pull Arm Exercise Chest Muscle Training Fitness Equipment In Home Gym,32.0,CHF,32.0,CHF,35,10,,,3.526315789473684,19.0,7,4,3,2,3,,,,,,red,99lb,50,Livraison standard,9.0,false,,50,,,CN,FeiXing668,feixing668,"73 % avis positifs (1,353 notes)",1353,3.6164079822616406,5dc52e4df8680a0900982329,,,https://www.wish.com/c/5df052ae7a73ae0479777018,https://canary.contestimg.wish.com/api/webimage/5df052ae7a73ae0479777018-medium.jpg,5df052ae7a73ae0479777018
Damen Badeanzug mit V-Ausschnitt und Rüschenmuster und hoher Taille,Women V-neck Ruffle Print High Waisted Swimsuit Two Pieces Push Up Tropical Ruffled Bikini Set Floral Printed Bathing Suit Swimwear New Arrival,13.0,CHF,34.0,CHF,14,10,,,5.0,19.0,19,0,0,0,0,,,,,,blue,s,50,Livraison standard,4.0,false,,50,,,CN,guifangmiao,guifangmiao,"(13,247 Bewertungen)",13247,3.945119649732015,57921de1cb38dd5b70fa88eb,,,https://www.wish.com/c/5f07d15494e51c1c553479ca,https://canary.contestimg.wish.com/api/webimage/5f07d15494e51c1c553479ca-medium.jpg,5f07d15494e51c1c553479ca
"Fashion Swimsuits for Women ,Ladies Vintage Two Piece Push Up Halter Ruched Bikinis High Waist Tummy Control Bathing Suit","Fashion Swimsuits for Women ,Ladies Vintage Two Piece Push Up Halter Ruched Bikinis High Waist Tummy Control Bathing Suit",11.0,CHF,11.0,CHF,11,10,,,3.0,1.0,0,0,1,0,0,,,,,,yellow&floral,s,2,Livraison standard,2.0,false,,50,true,Quantité limitée !,CN,angeleye,angeleye,"85 % avis positifs (3,651 notes)",3651,4.013147082990962,58f1c67c91a24517051bf071,,,https://www.wish.com/c/604480c152e1960054eb3fa1,https://canary.contestimg.wish.com/api/webimage/604480c152e1960054eb3fa1-medium.jpg,604480c152e1960054eb3fa1
2020 nuevas Leggings de cintura alta sin costuras para mujer Leggins Push Up Yoga Sport Fitness Running Gym Pantalones Energy Workout Leggings Sport Girl Leggins,2020 New Seamless High Waist Leggings Women Push Up Yoga Leggins Sport Fitness Running Gym Pants Energy Workout Leggings Sport Girl Leggins,9.0,CHF,36.0,CHF,9,10,,,4.666666666666667,6.0,4,2,0,0,0,,,,,,black,s,20,Livraison standard,3.0,false,,50,,,CN,shenzhenkenaisenkejiyouxiangongsi,深圳科奈森科技有限公司,(22 calificaciones),22,4.590909090909091,54c775e0a1986d1893ff6983,,,https://www.wish.com/c/5f9bcc3bf65ee51b82bf57f4,https://canary.contestimg.wish.com/api/webimage/5f9bcc3bf65ee51b82bf57f4-medium.jpg,5f9bcc3bf65ee51b82bf57f4
Gepolsterte Push-Up-Bikini-Set-Badeanzüge für Damen Zweiteiliger Badeanzug Badeanzug Badeanzug Badeanzug Plus Size XS-8XL,Women's Padded Push Up Bikini Set Bathing Suits Two Pieces Swimsuit Swimwear Swimdress Bathing Suit Plus Size XS-8XL,13.0,CHF,13.0,CHF,14,10,,,4.0,6.0,4,0,0,2,0,,,,,,black,xs,50,Livraison standard,4.0,false,,50,true,Quantité limitée !,CN,SEABOY2,seaboy2,"89% Positives Feedback (7,041 Bewertungen)",7041,4.203664252236898,5b235f8ad1c3603c027fdcda,,,https://www.wish.com/c/5f3236d41d3be200405c1de2,https://canary.contestimg.wish.com/api/webimage/5f3236d41d3be200405c1de2-medium.jpg,5f3236d41d3be200405c1de2
2020 nouvelle mode femmes culottes équitation pantalons longs en plein air équestre passe-temps mince Jodhpurs Push Up Legging grande taille S-5XL,2020 New Fashion Women Breeches Horse Riding Long Pants Outdoor Equestrian Hobby Slim Jodhpurs Push Up Legging Plus Size S-5XL,23.0,CHF,61.0,CHF,25,10,,,1.5,2.0,0,0,0,1,1,,,,,,white,xs,1,Livraison standard,6.0,false,,50,true,Quantité limitée !,CN,patienceboom,patienceboom,66 % avis positifs (175 notes),175,3.3485714285714288,5ea120ed2a4ed4437fe97808,,,https://www.wish.com/c/5f437a5f6ac3b600497253b2,https://canary.contestimg.wish.com/api/webimage/5f437a5f6ac3b600497253b2-medium.jpg,5f437a5f6ac3b600497253b2
8/7 pièces / ensemble roue à rouleaux abdominale avec genouillère gymnase à domicile Fitness Abdomen Muscle entraînement exercice équipement comprend barre de poussée corde à sauter,8/7PCS/Set Abdominal Roller Wheel with Knee Pad Home Gym Fitness Abdomen Muscle Training Exercise Equipment include Push-up Bar Jump Rope,28.0,CHF,28.0,CHF,30,1,,,5.0,0.0,,,,,,,,,,,,7pcs/set,50,Livraison standard,8.0,false,,50,,,CN,"Guangzhou Teamwin Trading Co.,Ltd",guangzhouteamwintradingcoltd,"92 % avis positifs (310,740 notes)",310740,4.3198912273926755,54898f4c223ebf1cd713fdc2,,,https://www.wish.com/c/5f156d50312f4200425b3f6e,https://canary.contestimg.wish.com/api/webimage/5f156d50312f4200425b3f6e-medium.jpg,5f156d50312f4200425b3f6e
