title,title_orig,discount_price,discount_price_currency,retail_price,retail_price_currency,discount_price_in_original_currency,nb_cart_orders_approx,nb_units_purchased_approx,uses_ad_boosts,rating,rating_count,rating_five_count,rating_four_count,rating_three_count,rating_two_count,rating_one_count,badges_count,badge_local_product,badge_product_quality,badge_fast_shipping,tags,product_color,product_variation_size_id,product_variation_inventory,shipping_option_name,shipping_option_price,shipping_is_express,countries_shipped_to,inventory_total,has_urgency_banner,urgency_text,origin_country,merchant_title,merchant_name,merchant_info_subtitle,merchant_rating_count,merchant_rating,merchant_id,merchant_has_profile_picture,merchant_profile_picture,product_url,product_picture,product_id
DC Comics,,,,,,,,,,,,,,,,,,,,,,,,,,,,,,,,,,,,,,,,,https://www.wish.com/c/5e3b0ba49719eddf0ac7e677,,5e3b0ba49719eddf0ac7e677
Neue Mode Frauen Deep-V Neck Push Up Bodysuit Shapewear Nahtlose Ganzkörper Shaper Spitze Oberschenkel Schlanker Bauch Bauch Gürtel,New Fashion Women Deep-v Neck Push Up Bodysuit Shapewear Seamless Full Body Shaper Lace Thigh Slimmer Tummy Belly Girdle,17.0,CHF,119.0,CHF,18,10,,,3.982142857142857,56.0,26,14,8,5,3,,,,,,black,xs,50,Livraison standard,5.0,false,,50,,,CN,zhouqingdian,zhouqingdian,"86% Positives Feedback (10,986 Bewertungen)",10986,4.113326051338067,59a60dc869eced315bf1652c,,,https://www.wish.com/c/5d2848ef26e12b5eda733e74,https://canary.contestimg.wish.com/api/webimage/5d2848ef26e12b5eda733e74-medium.jpg,5d2848ef26e12b5eda733e74
Cuvave,,,,,,,,,,,,,,,,,,,,,,,,,,,,,,,,,,,,,,,,,https://www.wish.com/c/5f746575eb31f9c7cd02eeb2,,5f746575eb31f9c7cd02eeb2
Dark Side Blades,,,,,,,,,,,,,,,,,,,,,,,,,,,,,,,,,,,,,,,,,https://www.wish.com/c/5efb1b95eb31f937612631a3,,5efb1b95eb31f937612631a3
Iron Maiden,,,,,,,,,,,,,,,,,,,,,,,,,,,,,,,,,,,,,,,,,https://www.wish.com/c/5ed7830690b8a6318c2d7293,,5ed7830690b8a6318c2d7293
Support de push-up Exercice de poitrine pour hommes Équipement d'exercice de remise en forme à domicile pour hommes,Push-up bracket chest exercise men's home fitness exercise equipment arm muscle sporting goods,36.0,CHF,36.0,CHF,39,0,,,5.0,0.0,,,,,,,,,,,,lowquality,5,Livraison standard,11.0,false,,10,true,Quantité limitée !,US,HuangpingshuohuitA,huangpingshuohuita,"73 % avis positifs (1,203 notes)",1203,3.5926849542809642,5e6cca125510407f4ea38ffd,,,https://www.wish.com/c/608653b535273b0bd6a0b069,https://canary.contestimg.wish.com/api/webimage/608653b535273b0bd6a0b069-medium.jpg,608653b535273b0bd6a0b069
Fato de banho feminino de praia Trajes de banho para banho Monokini Biquíni push up acolchoado de uma peça,Women Beach Swimsuit Swimwear Bathing Monokini Push Up Padded One Piece Bikini,5.24,CHF,6.0,CHF,5.76,10,,,5.0,0.0,,,,,,,,,,,white,s,50,Livraison standard,1.0,false,,50,true,Quantité limitée !,CN,Holiday Winds,holidaywinds,"(8,613 avaliações)",8613,4.196563334494369,5b583e80109f1b32c57dce2a,,,https://www.wish.com/c/5eec7605e85109255ab4c186,https://canary.contestimg.wish.com/api/webimage/5eec7605e85109255ab4c186-medium.jpg,5eec7605e85109255ab4c186
Sport BH Frauen Push Up Fitness Yoga BH Tops Weiblich Gym Running Training BH Tank Tops Plus Size Sportweste,Sports Bra Women Push Up Fitness Yoga Bra Tops Female Gym Running Training Bra Tank Tops Plus Size Sports Vest,5.0,CHF,7.0,CHF,5,1000,,,4.564102564102564,234.0,167,44,16,2,5,,,,,,yellow,xs,2,Livraison standard,1.0,false,,50,true,Quantité limitée !,CN,liudongsheng,liudongsheng,"(16,701 Bewertungen)",16701,4.117597748637806,58e1bf9caa7d296f726d4c9a,,,https://www.wish.com/c/5e60f76f2f9684f28cde8d57,https://canary.contestimg.wish.com/api/webimage/5e60f76f2f9684f28cde8d57-medium.jpg,5e60f76f2f9684f28cde8d57
Été femmes Split Bikini ensemble Push-Up Pad maillot de bain léopard Bandage maillot de bain maillot de bain vêtements de plage,Summer Women Split Bikini Set Push-Up Pad Leopard Swimwear Bandage Swimsuit Bathing Suit Beachwear ,8.0,CHF,8.0,CHF,8,10,,,4.1,10.0,7,1,0,0,2,,,,,,purple,xs,5,Livraison standard,3.0,false,,50,,,CN,Adam_chun,adam_chun,"90 % avis positifs (10,012 notes)",10012,4.216939672393128,56c2e545df108f114a8c6cf7,,,https://www.wish.com/c/5e60b6e2253d513340899a9d,https://canary.contestimg.wish.com/api/webimage/5e60b6e2253d513340899a9d-medium.jpg,5e60b6e2253d513340899a9d
,,,,,,,,,,,,,,,,,,,,,,,,,,,,,,,,,,,,,,,,,https://www.wish.com/c/5e62b61b9719ed42053a9fe1,,5e62b61b9719ed42053a9fe1
Damen One Piece Push Up Gepolsterte Bikini Badeanzug Badebekleidung Bad Monokini HEISS,Women's One Piece Push Up Padded Bikini Swimsuit Swimwear Bathing Monokini HOT,8.0,CHF,8.0,CHF,8,10,,,3.0,1.0,0,0,1,0,0,,,,,,black,s,50,Livraison standard,3.0,false,,50,,,US,MishulaofUv,mishulaofuv,"90% Positives Feedback (1,024 Bewertungen)",1024,4.1962890625,5e6b89a13c17f48980bade22,,,https://www.wish.com/c/6042f869ec5544778193f87e,https://canary.contestimg.wish.com/api/webimage/6042f869ec5544778193f87e-medium.jpg,6042f869ec5544778193f87e
Paire de poignées en mousse Push-up Press Up Bar Bars Exercice à domicile,Pair Foam Handle Push-up Press Up Bar Bars Home Exercise,19.0,CHF,92.0,CHF,20,2,,,5.0,0.0,,,,,,,,,,,,,50,Livraison standard,6.0,false,,50,,,CN,Mer-tech,mertech,"93 % avis positifs (6,926 notes)",6926,4.434016748483973,5850fd0dfef4097a708a3dda,,,https://www.wish.com/c/58ad4fc2b3bd6d585606d102,https://canary.contestimg.wish.com/api/webimage/58ad4fc2b3bd6d585606d102-medium.jpg,58ad4fc2b3bd6d585606d102
Nouveau style mode sexy femmes bandage bikini ensemble push-up rembourré soutien-gorge,New Style Fashion Sexy Women Bandage Bikini Set Push-up Padded Bra,8.0,CHF,8.0,CHF,8,10,,,4.027027027027027,37.0,16,14,3,0,4,,,,,,camouflage&pink,s,50,Livraison standard,3.0,false,,50,,,CN,maryland,maryland,"94 % avis positifs (24,010 notes)",24010,4.420907955018742,56304b0c85990a0fc73f375e,,,https://www.wish.com/c/579aebf7f981507d5960cc63,https://canary.contestimg.wish.com/api/webimage/579aebf7f981507d5960cc63-medium.jpg,579aebf7f981507d5960cc63
Household Multifunction Push Up Rack Board 9 System Comprehensive Fitness Exercise Workout Push-up Stands Body Building Training GYM for Men And Women,Household Multifunction Push Up Rack Board 9 System Comprehensive Fitness Exercise Workout Push-up Stands Body Building Training GYM for Men And Women,21.0,CHF,21.0,CHF,22,10,,,4.333333333333333,24.0,14,5,4,1,0,,,,,,,2in1stand,50,Livraison standard,5.0,false,,50,true,Quantité limitée !,CN,Landwins,landwins,"92% Positive Feedback (54,960 ratings)",54960,4.335280203784571,5736d65a371c165c6b98e983,,,https://www.wish.com/c/5f45da45932cbd003edad873,https://canary.contestimg.wish.com/api/webimage/5f45da45932cbd003edad873-medium.jpg,5f45da45932cbd003edad873
Sommermode Frauen Push-Up gepolsterte Bikin Set Plaid Bowknot Push Up Tankini Badebekleidung,Summer Fashion Women Push-Up Padded Bikin Set Plaid Bowknot Push Up Tankini Swimwear,13.0,CHF,39.0,CHF,14,10,,,5.0,0.0,,,,,,,,,,,black,s.,5,Livraison standard,4.0,false,,50,,,CN,Icosin,icosin,"89% Positives Feedback (2,484 Bewertungen)",2484,4.1980676328502415,59b65de32351342a85a8b20c,,,https://www.wish.com/c/5ee1ac7339cf4a25c276f94b,https://canary.contestimg.wish.com/api/webimage/5ee1ac7339cf4a25c276f94b-medium.jpg,5ee1ac7339cf4a25c276f94b
Oakland Raiders,,,,,,,,,,,,,,,,,,,,,,,,,,,,,,,,,,,,,,,,,https://www.wish.com/c/5e8d2fff9719ed64049677b7,,5e8d2fff9719ed64049677b7
Femme Fatale,,,,,,,,,,,,,,,,,,,,,,,,,,,,,,,,,,,,,,,,,https://www.wish.com/c/5efb1b94eb31f9376126319d,,5efb1b94eb31f9376126319d
2020 femmes 3D impression numérique Leggings taille haute gothique silm pantalon Push Up Fitness pantalon femme Stretch Punk Rock Leggings,2020 Women 3D Digital Print Leggings High Waist Gothic Silm Pants Push Up Fitness Trouser Female Stretch Punk Rock Leggings,9.0,CHF,14.0,CHF,9,10,,,3.8584070796460175,113.0,61,16,11,9,16,,,,,,white,s,50,Livraison standard,3.0,false,,50,,,CN,NARUTONARO,narutonaro,"89 % avis positifs (7,816 notes)",7816,4.198183213920164,593921006a74d23963838445,,,https://www.wish.com/c/5e56322082dd6b3700201127,https://canary.contestimg.wish.com/api/webimage/5e56322082dd6b3700201127-medium.jpg,5e56322082dd6b3700201127
Smith & Wesson,,,,,,,,,,,,,,,,,,,,,,,,,,,,,,,,,,,,,,,,,https://www.wish.com/c/5e8d30179719ed640496785a,,5e8d30179719ed640496785a
DKERT dentelle dentelle impression grandes bonnets ensemble soutien-gorge push up BC plus taille soutien-gorge slip ensembles creux sous-vêtements et culottes bralette ensemble,DKERT lace printing large cups push up bra set BC plus size bra brief sets hollow out underwear and panties bralette set,8.0,CHF,17.0,CHF,8,10000,,,4.226430976430977,2376.0,1428,446,262,92,148,,,,,,red,36b,50,Livraison standard,3.0,false,,50,,,CN,Julexy Brand Monopoly shop,julexybrandmonopolyshop,"(23,814 notes)",23814,4.3539094650205765,572f3f1558f4bb5937314d1e,,,https://www.wish.com/c/5aace519d6339d1a197a0449,https://canary.contestimg.wish.com/api/webimage/5aace519d6339d1a197a0449-medium.jpg,5aace519d6339d1a197a0449
Mode Femmes Polka Dots Bikini Set Push-up Beach Maillot De Bain Maillot De Bain (S-3XL),Fashion Women Polka Dots Bikini Set Push-up Beach Swimsuit Bathing Suit(S-3XL),12.0,CHF,164.0,CHF,13,10,,,5.0,1.0,1,0,0,0,0,,,,,,black,m,22,Livraison standard,3.0,false,,50,true,Quantité limitée !,CN,angeleye,angeleye,"85 % avis positifs (3,651 notes)",3651,4.013147082990962,58f1c67c91a24517051bf071,,,https://www.wish.com/c/5d19a917352e386a1404ca34,https://canary.contestimg.wish.com/api/webimage/5d19a917352e386a1404ca34-medium.jpg,5d19a917352e386a1404ca34
Gym Home Fitness Equipment Pectoral Muscle Training Sponge Sleeve I-Shaped H-Type Push-Ups Bracket Indoor Comprehensive Exercise,Gym Home Fitness Equipment Pectoral Muscle Training Sponge Sleeve I-Shaped H-Type Push-Ups Bracket Indoor Comprehensive Exercise,17.0,CHF,21.0,CHF,18,0,,,5.0,0.0,,,,,,,,,,,red,1pair,50,Livraison standard,5.0,false,,50,,,CN,ShoppingTrolley,shoppingtrolley,"93 % avis positifs (1,721 notes)",1721,4.329459616502033,5a61a4a95349200ac9247725,,,https://www.wish.com/c/5f1545cc9d8187293fab6341,https://canary.contestimg.wish.com/api/webimage/5f1545cc9d8187293fab6341-medium.jpg,5f1545cc9d8187293fab6341
Costumi da bagno bikini da spiaggia push-up brasiliani push-up con fasciatura a fascia da donna,New Fashion Women Bandeau Bandage Bikini Set Push-Up Brazilian Swimwear Beachwear Swimsuit,13.0,CHF,36.0,CHF,14,5000,,,4.011834319526627,1183.0,577,276,174,79,77,,,,,,white,s,9,Livraison standard,3.0,false,,50,true,Quantité limitée !,CN,vsmart,vsmart,"91% feedback positivi (31,238 recensioni)",31238,4.275017606760996,58a567690e16e913a138fdc0,,,https://www.wish.com/c/5af0691d1c250014bcfbe922,https://canary.contestimg.wish.com/api/webimage/5af0691d1c250014bcfbe922-medium.jpg,5af0691d1c250014bcfbe922
Frauen Sexy Push Up Einteiler Backless Solid Retro Triangle Badeanzug Badebekleidung,Women Sexy Push Up One-piece Backless Solid Retro Triangle Swimsuit Swimwear,5.0,CHF,5.0,CHF,5,10,,,3.0,6.0,1,2,0,2,1,,,,,,winered,s,7,Livraison standard,2.0,false,,50,true,Quantité limitée !,CN,YIWUXINFENG,yiwuxinfeng,"(1,039 Bewertungen)",1039,4.0731472569778635,5d43e6b4a5f07b53ce124e64,,,https://www.wish.com/c/5f4324f831070e6132f737ea,https://canary.contestimg.wish.com/api/webimage/5f4324f831070e6132f737ea-medium.jpg,5f4324f831070e6132f737ea
1 paire Fitness ménage Push-up Stands Bars pour Gym Body Building Muscle Exercices Abdomen Poitrine Push Ups Main Grip Trainer Outil,1 Pair Fitness Household Push-up Stands Bars for Gym Body Building Muscle Exercises Abdomen Chest Push Ups Hand Grip Trainer Tool,33.0,CHF,33.0,CHF,36,10,,,5.0,2.0,2,0,0,0,0,,,,,,,a,47,Livraison standard,9.0,false,,50,,,CN,brendonin,brendonin,"93 % avis positifs (3,727 notes)",3727,4.3938824792057956,5b4edad10fa3694564c3fa71,,,https://www.wish.com/c/5f8969a3a76e3b1a865d55dd,https://canary.contestimg.wish.com/api/webimage/5f8969a3a76e3b1a865d55dd-medium.jpg,5f8969a3a76e3b1a865d55dd
Cadeaux de Mode Femme Soutien-gorge rembourré Push-Up Bohemia Beach Bikini Maillot de bain Maillot de Plage,Fashion Gifts Women Bohemia Push-Up Padded Bra Beach  Bikini Set Swimsuit Swimwear,14.0,CHF,63.0,CHF,15,1000,,,3.446305418719212,1015.0,330,208,214,111,152,,,,,,,s,11,Livraison standard,4.0,false,,50,,,CN,finestyles,finestyles,"83 % avis positifs (23,820 notes)",23820,3.9313182199832073,58d4d144901d295719e938ee,,,https://www.wish.com/c/594ccc0230047a707a24bcb3,https://canary.contestimg.wish.com/api/webimage/594ccc0230047a707a24bcb3-medium.jpg,594ccc0230047a707a24bcb3
Sexy Pink Hohe Taille Push Up Bikini Bandage Badeanzug Frauen Quaste Badebekleidung Beach Wear Badeanzug,Sexy Pink High Waist Push Up Bikini Bandage Swimsuit Women Tassle Swimwear Beach Wear Swim Bathing Suit,11.0,CHF,13.0,CHF,12,10,,,3.5,30.0,15,3,1,4,7,,,,,,white,xs,50,Livraison standard,3.0,false,,50,,,CN,VCAN,vcan,"(19,411 Bewertungen)",19411,4.216578228839318,57b42e000bc8180a35ec0c89,,,https://www.wish.com/c/5fd7d83878854696b33935a4,https://canary.contestimg.wish.com/api/webimage/5fd7d83878854696b33935a4-medium.jpg,5fd7d83878854696b33935a4
GEAR AID,,,,,,,,,,,,,,,,,,,,,,,,,,,,,,,,,,,,,,,,,https://www.wish.com/c/5f44ef61eb31f9fb768ea00c,,5f44ef61eb31f9fb768ea00c
Barres de Push Up 360 ° Supports de Push-up antidérapants Poignées de confort Support de Push-up circulaire Équipement d'entraînement de base pour la musculation Fitness,360°Push Up Bars Non Slip Push-up Stands Comfort Grips Circular Push-up Bracket Base Workout Equipment for Body Building Fitness,38.0,CHF,38.0,CHF,41,1,,,4.0,1.0,0,1,0,0,0,,,,,,,inferiorquality,1,Livraison standard,12.0,false,,2,,,CN,dounaidou,dounaidou,73 % avis positifs (657 notes),657,3.6407914764079146,5af8f5608699ce0687dd5fdc,,,https://www.wish.com/c/5e9e8b1ff81ef409c18fc362,https://canary.contestimg.wish.com/api/webimage/5e9e8b1ff81ef409c18fc362-medium.jpg,5e9e8b1ff81ef409c18fc362
Lucky,,,,,,,,,,,,,,,,,,,,,,,,,,,,,,,,,,,,,,,,,https://www.wish.com/c/5f8c205beb31f9c6391a622a,,5f8c205beb31f9c6391a622a
Durable Sturdy Premium Gymnasium Home for Muscle Training Device Push-up Frame Push-up Bracket Push-up Frame 1 Pair,Durable Sturdy Premium Gymnasium Home for Muscle Training Device Push-up Frame Push-up Bracket Push-up Frame 1 Pair,41.0,CHF,41.0,CHF,44,0,,,5.0,0.0,,,,,,,,,,,coffee,25x14x10cm,10,Livraison standard,12.0,false,,10,true,Quantité limitée !,CN,mirdubdhgc,mirdubdhgc,"88 % avis positifs (1,964 notes)",1964,4.220468431771894,5d5a4a05560eca427bf1d8d7,,,https://www.wish.com/c/5feb300657e1e5b1dc31e348,https://canary.contestimg.wish.com/api/webimage/5feb300657e1e5b1dc31e348-medium.jpg,5feb300657e1e5b1dc31e348
New Women Fashion Colorblock Halter Neck Bandage SwimSuits Push Up Bra Sized Bikinis Sets Beachwear Plus Size 5XL,New Women Fashion Colorblock Halter Neck Bandage SwimSuits Push Up Bra Sized Bikinis Sets Beachwear Plus Size 5XL,7.0,CHF,7.0,CHF,7,10,,,4.2,5.0,2,2,1,0,0,,,,,,green,xs,9,Livraison standard,2.0,false,,50,,,CN,Shenzhen Blue Sky Foreign Trade Co.,shenzhenblueskyforeigntradeco,"82% Feedback positivo (31,525 avaliações)",31525,3.8674702616970658,552c8b0fd4e6560c15793294,,,https://www.wish.com/c/602f6124bc5028b8b33cd122,https://canary.contestimg.wish.com/api/webimage/602f6124bc5028b8b33cd122-medium.jpg,602f6124bc5028b8b33cd122
Mode Atmungsaktive Dessous Set Frauen Sexy Push Up BH Unterwäsche Sexy Spitze Floral Bustier BH Höschen Set,Fashion Breathable Lingerie Set Women Sexy Push Up Bra Underwear Sexy Lace Floral Bustier Bra Panty Set,5.15,CHF,6.0,CHF,5.66,10,,,4.5,2.0,1,1,0,0,0,,,,,,black,s,50,Livraison standard,1.0,false,,50,,,CN,Joy Paradise,joyparadise,"90% Positives Feedback (91,726 Bewertungen)",91726,4.2517279724396575,585a431470a09e4ca3381d03,,,https://www.wish.com/c/5fc86b52dfb9fd9a40fa3629,https://canary.contestimg.wish.com/api/webimage/5fc86b52dfb9fd9a40fa3629-medium.jpg,5fc86b52dfb9fd9a40fa3629
Gepolsterte Bikinioberteile für Frauen Nur Push-up Bandeau BH Bandage Badeanzug Badeanzug Badebekleidung,Women Padded Bikini Top Only Push-up Bandeau Bra Bandage Swimsuit Bathing Suit Swimwear,8.0,CHF,8.0,CHF,8,10,,,4.479166666666667,48.0,34,8,3,1,2,,,,,,black,s,50,Livraison standard,2.0,false,,50,,,CN,Sweat moly,sweatmoly,"91% Positives Feedback (71,690 Bewertungen)",71690,4.295801366996792,589ae185ad330a4feb2b6dd5,,,https://www.wish.com/c/5dc1952af5f56b14f197c04a,https://canary.contestimg.wish.com/api/webimage/5dc1952af5f56b14f197c04a-medium.jpg,5dc1952af5f56b14f197c04a
Femmes Sexy Bikinis Push Up Halter Beach Maillot de bain de plage Mode Baignade Maillots de bain Sexy 8 Couleurs,Women Sexy Bikinis Push Up Halter Beach Bathing Suits Swimming Fashion Swimwear 8 Colors,5.28,CHF,6.0,CHF,5.8,1000,,,3.9424920127795526,313.0,151,66,48,23,25,,,,,,red,xxs,9,Livraison standard,2.0,false,,50,,,CN,your shopping heaven,yourshoppingheaven,"(5,310 notes)",5310,4.073822975517891,56bf294b6dd85f71efefefbb,,,https://www.wish.com/c/58b4ecc23c224f1da3706281,https://canary.contestimg.wish.com/api/webimage/58b4ecc23c224f1da3706281-medium.jpg,58b4ecc23c224f1da3706281
1 Pair Push Up Bars Press Up Bar Foam Handle Exercise Pushup Chest Arms Fitness Push-up Rack Bar Support Steel Pipe Stand,1 Pair Push Up Bars Press Up Bar Foam Handle Exercise Pushup Chest Arms Fitness Push-up Rack Bar Support Steel Pipe Stand,31.0,CHF,31.0,CHF,34,0,,,5.0,0.0,,,,,,,,,,,,,50,Livraison standard,9.0,false,,50,,,US,Butterfly spring forever,butterflyspringforever,,0,5.0,6076f879521dbe5380f077a1,,,https://www.wish.com/c/6082ca9720182ec6b89fd223,https://canary.contestimg.wish.com/api/webimage/6082ca9720182ec6b89fd223-medium.jpg,6082ca9720182ec6b89fd223
Mode femmes couleur impression Bikini ensemble push-up rembourré soutien-gorge maillot de bain maillot de bain,Fashion Women Color Print Bikini Set Push-up Padded Bra Swimsuit Bathing Swimwear,8.0,CHF,30.0,CHF,8,10,,,5.0,2.0,2,0,0,0,0,,,,,,red,xs,1,Livraison standard,2.0,false,,50,,,CN,ivypeng18,ivypeng18,"83 % avis positifs (1,380 notes)",1380,3.96231884057971,58ad618396f1bb65525cc65c,,,https://www.wish.com/c/5fb1f87df81f681bd313d44d,https://canary.contestimg.wish.com/api/webimage/5fb1f87df81f681bd313d44d-medium.jpg,5fb1f87df81f681bd313d44d
 Sutiã acolchoado feminino sexy com decote em V camisole push up sutiã colete tanque, Sexy Womens Padded Bra Tops V Neck Camisole Push Up Bra Vest Tank,7.0,CHF,7.0,CHF,7,10,,,3.7,60.0,26,11,11,3,9,,,,,,blue,s,50,Livraison standard,2.0,false,,50,,,CN,Beach_Vibe,beach_dream,"87% Feedback positivo (21,841 avaliações)",21841,4.110068220319582,5b3b07d7d3db32158cdda5e2,,,https://www.wish.com/c/5e041433c6929802b02121b6,https://canary.contestimg.wish.com/api/webimage/5e041433c6929802b02121b6-medium.jpg,5e041433c6929802b02121b6
Black & Decker,,,,,,,,,,,,,,,,,,,,,,,,,,,,,,,,,,,,,,,,,https://www.wish.com/c/5e8d30089719ed64049677ee,,5e8d30089719ed64049677ee
Body en V profond pour femme sangle transparente dos nu plongeant string Push Up soutien-gorge rembourré corps Shaper costume convertible sans couture bas du dos,Woman Deep V Bodysuit Clear Strap Backless Plunge Thong Push Up padded Bra Body Shaper Suit Convertible Seamless Low Back,5.15,CHF,6.0,CHF,5.66,10,,,5.0,0.0,,,,,,,,,,,pink,simpletype-xs,12,Livraison standard,1.0,false,,50,,,CN,chuxinmile,chuxinmile,"(4,382 notes)",4382,4.00114103149247,5947799a2eac1104f22e4486,,,https://www.wish.com/c/604b033e6c743ae38a9ea069,https://canary.contestimg.wish.com/api/webimage/604b033e6c743ae38a9ea069-medium.jpg,604b033e6c743ae38a9ea069
"Support de push-up, équipement de fitness d'entraînement musculaire abdominal pectoral, exercice de gymnastique à domicile, accolades push-up","Push-up Bracket, Home Gym Exercise Pectoral Abdominal Muscle Training Fitness Equipment, Push-up Braces",19.0,CHF,91.0,CHF,20,10,,,4.0,3.0,1,1,1,0,0,,,,,,orange,push-upbracket,50,Livraison standard,6.0,false,,50,,,CN,hongjipu,hongjipu,94 % avis positifs (344 notes),344,4.459302325581396,5a27c296eea5c53b1cfdaa96,,,https://www.wish.com/c/5b163a056d0fba4c50e26050,https://canary.contestimg.wish.com/api/webimage/5b163a056d0fba4c50e26050-medium.jpg,5b163a056d0fba4c50e26050
Culotte de fesses pour femmes rehausseur de hanche Butt Lifter Push Up sous-vêtements rembourrés Shapewear,Women's Hip Enhancer Bum Panties Butt Lifter Push Up Padded Underwear Shapewear,22.0,CHF,22.0,CHF,24,10,,,4.529411764705882,17.0,11,4,2,0,0,,,,,,black,s,50,Livraison standard,6.0,false,,50,,,CN,Luxury Area,luxuryarea,87 % avis positifs (554 notes),554,4.144404332129964,5d4e44121527543defad50d6,,,https://www.wish.com/c/5e7c7ef911b7f80a43adbfba,https://canary.contestimg.wish.com/api/webimage/5e7c7ef911b7f80a43adbfba-medium.jpg,5e7c7ef911b7f80a43adbfba
Support multifonctionnel 13-en-1push-up Design pliable Premium antidérapant Push-up Board Home Body Building Fitness équipements,Multifunctional 13-in-1push-up Stand Foldable Design Premium Non-slip Push-up Board Home Body Building Fitness Equipments,29.0,CHF,126.0,CHF,31,5,,,4.666666666666667,3.0,2,1,0,0,0,,,,,,,withpullrope,50,Livraison standard,9.0,false,,50,,,CN,AnlanBusiness_Ltd,anlanbusiness_ltd,"90 % avis positifs (2,116 notes)",2116,4.233459357277883,5d3ae26270327a55b8b520f9,,,https://www.wish.com/c/5e8dd9d50bfda583ffc4524a,https://canary.contestimg.wish.com/api/webimage/5e8dd9d50bfda583ffc4524a-medium.jpg,5e8dd9d50bfda583ffc4524a
Fitness equipment h shaped environmental wood custom handstand calisthenics parallel bar double rod push-up support,Fitness equipment h shaped environmental wood custom handstand calisthenics parallel bar double rod push-up support,31.0,CHF,31.0,CHF,33,10,,,4.571428571428571,7.0,5,1,1,0,0,,,,,,,,50,Livraison standard,8.0,false,,50,,,CN,studioweb,studioweb,"(7,163 ratings)",7163,4.246544743822421,5a50c6fa471c141e8b8aca96,,,https://www.wish.com/c/5e96e2b01f843f3ba721318c,https://canary.contestimg.wish.com/api/webimage/5e96e2b01f843f3ba721318c-medium.jpg,5e96e2b01f843f3ba721318c
Ménage Multifonction Push Up Rack Board 9 Système Complet Fitness Exercice Workout Push-up Stands Body Building Training GYM pour Hommes Et Femmes,Household Multifunction Push Up Rack Board 9 System Comprehensive Fitness Exercise Workout Push-up Stands Body Building Training GYM for Men And Women,38.0,CHF,44.0,CHF,41,0,,,5.0,0.0,,,,,,,,,,,,pushupboard.,5,Livraison standard,11.0,false,,15,,,CN,shengya0728,shengya0728,87 % avis positifs (260 notes),260,4.053846153846154,5d4e660c933fb16bdeb68b81,,,https://www.wish.com/c/5e994e4762c42647f15c497b,https://canary.contestimg.wish.com/api/webimage/5e994e4762c42647f15c497b-medium.jpg,5e994e4762c42647f15c497b
Handgefertigter Häkel-Spitze Strick-BH Boho Frauen Bademode Strand Push-up Bikini Halter Cami Tank Crop Top,Handmade Crochet Lace Knit Bra Boho Women Swimwear Beach Push-up Bikini Halter Cami Tank Crop Top,13.0,CHF,13.0,CHF,14,1000,,,4.03598971722365,389.0,204,78,55,21,31,,,,,,white,xs,50,Livraison standard,3.0,false,,50,true,Quantité limitée !,CN,zhanghuiying,zhanghuiying,"94% Positives Feedback (7,947 Bewertungen)",7947,4.415376871775512,55593c0abe0bad0e6c8371e5,,,https://www.wish.com/c/5a80b341a6bf7a536b8e5ca9,https://canary.contestimg.wish.com/api/webimage/5a80b341a6bf7a536b8e5ca9-medium.jpg,5a80b341a6bf7a536b8e5ca9
Sexy soutien-gorge sans bretelles femmes soutiens-gorge invisibles Push Up Lingerie dos nu soutien-gorge sans couture Bralette sous-vêtements soutien-gorge sans bretelles,Sexy Strapless Bra Women Invisible Bras Push Up Lingerie Backless Brassiere Seamless Bralette Underwear Brassiere Strapless Bra,8.0,CHF,8.0,CHF,8,1000,,,3.2992125984251968,127.0,53,13,15,11,35,,,,,,black,underwear,7,Livraison standard,2.0,false,,50,,,CN,dianpuming119,dianpuming119,"(2,890 notes)",2890,4.288927335640138,59572a92abea913296d4c385,,,https://www.wish.com/c/5fc5da7cff6bda804f3124f7,https://canary.contestimg.wish.com/api/webimage/5fc5da7cff6bda804f3124f7-medium.jpg,5fc5da7cff6bda804f3124f7
Julexy Leopardo Sexy Lace Push Up Conjunto de Sutiã 34 36 38 40 42 ABC escavar Sutiã Breve Conjuntos de Mulheres de Algodão G Corda Roupa Interior Conjunto de Calcinha,Julexy Leopard Sexy Lace Push Up Bra Set 34 36 38 40 42 ABC hollow out Bra Brief Sets Women Cotton G String Underwear Panty Set,9.0,CHF,27.0,CHF,9,10000,,,4.213519813519813,2145.0,1301,377,234,90,143,,,,,,white,36a,50,Livraison standard,3.0,false,,50,true,Quantité limitée !,CN,Julexy Brand Monopoly shop,julexybrandmonopolyshop,"(23,814 avaliações)",23814,4.3539094650205765,572f3f1558f4bb5937314d1e,,,https://www.wish.com/c/5a12bf8e86ac5b5e0be28d51,https://canary.contestimg.wish.com/api/webimage/5a12bf8e86ac5b5e0be28d51-medium.jpg,5a12bf8e86ac5b5e0be28d51
1 paire de barres push-up en pin Support de push-up pour adulte Support personnalisé de support extensible avec tapis antidérapant pour exercice de push-up de gymnastique en intérieur (couleur bois),1 Pair of Pine Push-up Bars Adult Push-up Bracket Personalised Fitness Stretch Stand Handstand Bars with Anti-slid Mat for Indoor Gym Push-up Exercise(Wood Color),35.0,CHF,35.0,CHF,38,0,,,5.0,0.0,,,,,,,,,,,,25x14cm,50,Livraison standard,11.0,false,,50,,,CN,Weiainiyiren,weiainiyiren,88 % avis positifs (276 notes),276,4.202898550724638,5f115680d1bcb4049d6a41ef,,,https://www.wish.com/c/5faa09abe6f96a4bb34f274b,https://canary.contestimg.wish.com/api/webimage/5faa09abe6f96a4bb34f274b-medium.jpg,5faa09abe6f96a4bb34f274b
Maillots de bain sexy à découpes pour femmes Maillot de bain une pièce Push Up Bandage,Women's Sexy Cut-out Halter Bathing Suits One-piece Push Up Swimsuit Bandage Swimwear,11.0,CHF,11.0,CHF,11,10,,,4.230769230769231,13.0,7,2,4,0,0,,,,,,white,s,50,Livraison standard,3.0,false,,50,,,CN,wangxiujiao,wangxiujiao,"89 % avis positifs (11,713 notes)",11713,4.217023819687527,5acf176e9d5e970416ee332a,,,https://www.wish.com/c/5b14a30d8205d915d21cecf6,https://canary.contestimg.wish.com/api/webimage/5b14a30d8205d915d21cecf6-medium.jpg,5b14a30d8205d915d21cecf6
Aonijie,,,,,,,,,,,,,,,,,,,,,,,,,,,,,,,,,,,,,,,,,https://www.wish.com/c/5f8d71e3eb31f9a6cce12c61,,5f8d71e3eb31f9a6cce12c61
