title,title_orig,discount_price,discount_price_currency,retail_price,retail_price_currency,discount_price_in_original_currency,nb_cart_orders_approx,nb_units_purchased_approx,uses_ad_boosts,rating,rating_count,rating_five_count,rating_four_count,rating_three_count,rating_two_count,rating_one_count,badges_count,badge_local_product,badge_product_quality,badge_fast_shipping,tags,product_color,product_variation_size_id,product_variation_inventory,shipping_option_name,shipping_option_price,shipping_is_express,countries_shipped_to,inventory_total,has_urgency_banner,urgency_text,origin_country,merchant_title,merchant_name,merchant_info_subtitle,merchant_rating_count,merchant_rating,merchant_id,merchant_has_profile_picture,merchant_profile_picture,product_url,product_picture,product_id
20/40/60Pcs Grafting Clips Greenhouse Clamp Stand Plastic Plant Clip Fastener Bracket Fixed Seed Stem Support Plant Grafting,20/40/60Pcs Grafting Clips Greenhouse Clamp Stand Plastic Plant Clip Fastener Bracket Fixed Seed Stem Support Plant Grafting,8.0,CHF,95.0,CHF,8,2,,,5.0,0.0,,,,,,,,,,,,10large&10small,50,Livraison standard,2.0,false,,50,,,CN,guilian international trading Ltd,guilianinternationaltradingltd,"91 % avis positifs (57,691 notes)",57691,4.288051862508883,557bbf6e5c8a3419ec59765d,,,https://www.wish.com/c/607e4a617533f481427af3d7,https://canary.contestimg.wish.com/api/webimage/607e4a617533f481427af3d7-medium.jpg,607e4a617533f481427af3d7
1PC Gartenschere Gartenschere Bonsai Pruners Gartenschere Easy Pruners Grafting Tool,1PC Garden Scissors Garden Shears Bonsai Pruners Secateurs Easy Pruners Grafting Tool,9.0,CHF,44.0,CHF,9,10,,,5.0,2.0,2,0,0,0,0,,,,,,,,50,Livraison standard,3.0,false,,50,,,CN,woyaokuaile,woyaokuaile,"90% Positives Feedback (1,456 Bewertungen)",1456,4.298076923076923,58d7b27608111752b1cb56ad,,,https://www.wish.com/c/5ebae289fcc85c3f268730e1,https://canary.contestimg.wish.com/api/webimage/5ebae289fcc85c3f268730e1-medium.jpg,5ebae289fcc85c3f268730e1
16 Styles bricolage allée pavage chaussée moule Patio béton étape pierre chemin marche fabricant maison jardin décor,16 Styles DIY Driveway Paving Pavement Mold Patio Concrete Step Stone Path Walk Maker Home Garden Decor,11.0,CHF,11.0,CHF,11,8,,,5.0,0.0,,,,,,,,,,,,a(30x30x4.5cm),3,Livraison standard,3.0,false,,50,,,CN,commercialtornado,commercialtornado,"89 % avis positifs (33,637 notes)",33637,4.21999583791658,574803b422581e5ce8a3c6eb,,,https://www.wish.com/c/6036111f434d63ebc626122e,https://canary.contestimg.wish.com/api/webimage/6036111f434d63ebc626122e-medium.jpg,6036111f434d63ebc626122e
Pocket Hole Jig Kit Schraubendreher Schrittbohrer Holzbearbeitung Tischlerei-Werkzeugsatz,Pocket Hole Jig Kit Screwdriver Step Drill Bit Woodworking Joinery Tool Set,12.0,CHF,12.0,CHF,13,1000,,,4.352941176470588,153.0,89,43,13,2,6,,,,,,grey,1pcs,50,Livraison standard,3.0,false,,50,true,Quantité limitée !,CN,pkqzdcdzd,pkqzdcdzd,"93% Positives Feedback (9,327 Bewertungen)",9327,4.345341481719738,5acb4708cd968d62c6cadd47,,,https://www.wish.com/c/5f3cc768263234003c629b3b,https://canary.contestimg.wish.com/api/webimage/5f3cc768263234003c629b3b-medium.jpg,5f3cc768263234003c629b3b
Femmes montre intelligente vie étanche fréquence cardiaque tensiomètre Smartwatch cadeau d'anniversaire pour dames,Women Smart Watch Life Waterproof Heart Rate Blood Pressure Monitor Smartwatch Birthday Gift For Ladies,29.0,USD,278.0,USD,29,10,,,4.2155172413793105,116.0,68,24,13,3,8,,,,,,,stainlesssteelgoldenband,50,Livraison standard,8.0,false,,50,,,CN,HUASHENG FACTORY,huashengfactory,92 % avis positifs (436 notes),436,4.387614678899083,5d3ff85b838897466b14419f,,,https://www.wish.com/c/5efef1077705bd177c938e50,https://canary.contestimg.wish.com/api/webimage/5efef1077705bd177c938e50-medium.jpg,5efef1077705bd177c938e50
2021 NOUVEAU Mini Vélo D'exercice Étape Machine À La Maison Gym Pédale Vélos Exercice Intérieur Pour La Maison Et Gym (Sans Batterie),2021 NEW Mini Exercise Bike Step Machine Home Gym Pedal Bikes Indoor Exerciser For Home And Gym (No Battery),73.0,CHF,73.0,CHF,80.0,3,,,5.0,0.0,,,,,,,,,,,black,typeb,18,Livraison Express,12.0,true,,18,,,CN,chcuyheya,chcuyheya,93 % avis positifs (91 notes),91,4.406593406593407,5f1261cf4b2c4e0048c50abf,,,https://www.wish.com/c/601a59878c940d26800b9913,https://canary.contestimg.wish.com/api/webimage/601a59878c940d26800b9913-medium.jpg,601a59878c940d26800b9913
NICOLE DIARY 3 en 1 Gel Vernis À Ongles Stylo One Step Nail Gel Crayon,NICOLE DIARY 3 In 1 Gel Nail Polish Pen One Step Nail Gel Pencil,3.36,CHF,4.0,CHF,3.7,10000,,,3.886004514672686,886.0,469,143,103,46,125,,,,,,,nd-b25,50,Livraison standard,1.0,false,,50,,,CN,Fashion Camp,fashioncamp,"93 % avis positifs (33,294 notes)",33294,4.386916561542621,58d4c4e439c21f57d4bcc0b6,,,https://www.wish.com/c/5d230cfbafa4024e78a2d9f3,https://canary.contestimg.wish.com/api/webimage/5d230cfbafa4024e78a2d9f3-medium.jpg,5d230cfbafa4024e78a2d9f3
Kit de formation de cils 19 en 1 extension de cils faux greffage pratique Curl colle pince à épiler outils ensemble sac pour greffe de cils oculaires,19 in 1 Training Eyelashes kit False Eyelash Extension Grafting Practice Curl Glue Tweezer Tools Set Bag For Eye Lash Graft,15.0,CHF,15.0,CHF,16,10,,,3.8194444444444446,72.0,40,8,8,3,13,,,,,,,makeupmannequinhead,50,Livraison standard,4.0,false,,50,,,CN,BHIKUBHFGKJ,bhikubhfgkj,87 % avis positifs (549 notes),549,4.225865209471767,5dabe0093b45910bc0bdb946,,,https://www.wish.com/c/5e7b0732b50ca40c84dbdb6b,https://canary.contestimg.wish.com/api/webimage/5e7b0732b50ca40c84dbdb6b-medium.jpg,5e7b0732b50ca40c84dbdb6b
Fascinator Cerchietto Feather Mesh Cocktail Bowknot Donna Derby Day Fedoras Bridal,Fascinator Headband Feather Mesh Cocktail Bowknot Women Derby Day Fedoras Bridal,9.0,CHF,9.0,CHF,9,10,,,4.2727272727272725,22.0,13,6,1,0,2,,,,,,yellow,,50,Livraison standard,3.0,false,,50,,,CN,zhangchunlan,zhangchunlan,"(6,087 valutazioni)",6087,4.356990307212091,58414b39d914f56ad2890f45,,,https://www.wish.com/c/5db7de0882e54c02a929b33a,https://canary.contestimg.wish.com/api/webimage/5db7de0882e54c02a929b33a-medium.jpg,5db7de0882e54c02a929b33a
2PCS MT3608 DC-DC 2V-24V to 5V-28V 2A Step Up Boost Converter Power Supply Module ,2PCS MT3608 DC-DC 2V-24V to 5V-28V 2A Step Up Boost Converter Power Supply Module ,3.47,CHF,5.0,CHF,3.81,1000,,,4.572093023255814,430.0,322,69,17,7,15,,,,,,,,50,Livraison standard,1.0,false,,50,,,CN,DIY Components Maker International,electroncomponentsupermarket,"96% Positive Feedback (7,292 ratings)",7292,4.623971475589688,5b8500eab0c3fa28d5a56c69,,,https://www.wish.com/c/5de5bdbaeb45cadb9107564f,https://canary.contestimg.wish.com/api/webimage/5de5bdbaeb45cadb9107564f-medium.jpg,5de5bdbaeb45cadb9107564f
Rowin,,,,,,,,,,,,,,,,,,,,,,,,,,,,,,,,,,,,,,,,,https://www.wish.com/c/5f8c2064eb31f9c6391a624f,,5f8c2064eb31f9c6391a624f
" S M M L Harnais pour chien en Nylon Rhinestone réfléchissant en maille souple, rembourré et rembourré, pour chiot de petite taille, avec laisse de sécurité pour la marche.", S M L Reflective Nylon Rhinestone Dog Harnesses Step in Soft Mesh Padded Small Dog Puppy Harness Leash Set Safety For Walking,10.0,CHF,81.0,CHF,11,1000,,,4.264750378214826,661.0,400,123,79,31,28,,,,,,brown,s,19,Livraison standard,3.0,false,,50,,,CN,SMOO,smoo,"89 % avis positifs (4,052 notes)",4052,4.192991115498519,5838fbb428683f1e5c7e1683,,,https://www.wish.com/c/5b189c81a2044b2d64189be2,https://canary.contestimg.wish.com/api/webimage/5b189c81a2044b2d64189be2-medium.jpg,5b189c81a2044b2d64189be2
M4 pro Körpertemperaturüberwachung Smart Bracelet Thermometer IP67 Wasserdicht Smart Armband Herzfrequenz Blutdruck Schlafmonitor Fitness Tracker Smartband Sport Schrittzähler Schritt Entfernung Kalorienzähler Aktivität Tracker Smart Watch PK Xiaomi mi Band 4,M4 pro Body Temperature Monitoring Smart Bracelet Thermometer IP67 Waterproof Smart Wristband Heart Rate Blood Pressure Sleep Monitor Fitness Tracker Smartband Sport Pedometer Step Distance Calorie Counter Activity Tracker Smart Watch PK Xiaomi mi band 4,8.0,CHF,8.0,CHF,8,1000,,,3.801282051282051,312.0,155,58,30,20,49,,,,,,black,m4smartbracelet,50,Livraison standard,2.0,false,,50,,,CN,HTH1,hth1,"(2,093 Bewertungen)",2093,4.108456760630673,5d50d4b8d0c0b24f03a0b2e8,,,https://www.wish.com/c/5ecce79f18e87d7e263e0cbf,https://canary.contestimg.wish.com/api/webimage/5ecce79f18e87d7e263e0cbf-medium.jpg,5ecce79f18e87d7e263e0cbf
Golf Step Down Tees Gemischte Größe 12 Count Unbreakable Plastic Tees Pack zum Üben,Golf Step Down Tees Mixed Size 12 Count  Unbreakable Plastic Tees Pack for Practice,3.5,CHF,4.0,CHF,3.85,10,,,4.189655172413793,58.0,31,15,6,4,2,,,,,,,"1-1/4""(31mm)-12pcs",50,Livraison standard,1.0,false,,50,true,Quantité limitée !,CN,Colersa,colersa,"(2,159 Bewertungen)",2159,4.1713756368689205,5d4d07a5b97c2576efcd4024,,,https://www.wish.com/c/5da1a0dcd2d3a95391da4bf4,https://canary.contestimg.wish.com/api/webimage/5da1a0dcd2d3a95391da4bf4-medium.jpg,5da1a0dcd2d3a95391da4bf4
Fitness Aerobic Step 27 '' Stepper W / Risers Cardio pour l'entraînement de gym,Fitness Aerobic Step 27'' Stepper W/Risers Cardio For Gym Workout,52.0,CHF,52.0,CHF,57.0,8,,,5.0,1.0,1,0,0,0,0,,,,,,black,27'',2,Livraison Express,12.0,true,,12,,,CN,rekhakimberly,rekhakimberly,"93 % avis positifs (5,793 notes)",5793,4.403590540307268,57ade6f8e370dd215ba91e4b,,,https://www.wish.com/c/5fbccbe7f1ec34b4a39589a8,https://canary.contestimg.wish.com/api/webimage/5fbccbe7f1ec34b4a39589a8-medium.jpg,5fbccbe7f1ec34b4a39589a8
100/50PCS Pro Make-up Pinsel & Werkzeuge Wimpernreiniger Stick Trimmen / Reinigen der Wimpern / Wimpern Separator / Pfropfwimpern Tupferstäbchen Gründlich Reinigen und Kamm Wimpern Frauen Kosmetikprodukte,100/50PCS Pro Makeup Brushes & Tools Eyelash Clean Stick Trimming / Cleaning Eyelashes / Eyelash Separator / Grafting Eyelashes Swab Sticks Thoroughly Cleanse and Comb Eyelashes Women Beauty Products,3.0,CHF,3.0,CHF,3,5000,,,4.561063218390805,1392.0,1039,187,106,28,32,,,,,,purple,50pcs(small),50,Livraison standard,1.0,false,,50,true,Quantité limitée !,CN,Shouyin,shouyin,"92% Positives Feedback (41,534 Bewertungen)",41534,4.361366591226465,5926b447fc9cce5577203fb5,,,https://www.wish.com/c/5a43c06a865403101a2e8242,https://canary.contestimg.wish.com/api/webimage/5a43c06a865403101a2e8242-medium.jpg,5a43c06a865403101a2e8242
"Neue Haartrocknerbürste und Heißluftbürste, Lufthaarbürste 4-in-1-Elektro-Ein-Schritt-Haartrockner-Volumizer mit negativer Ionen-Curling-Trocknerbürste, Glättungsbürste, Trockner-Styler","New Hair Dryer Brush and Hot Air Brush, Air Hair Brush 4 In 1 Electric One Step Hair Dryer Volumizer with Negative Ion Curling Dryer Brush, Straightening Brush, Dryer Styler",18.0,USD,18.0,USD,18,1000,,,4.324324324324325,444.0,302,64,34,8,36,,,,,,,thaiplug,50,Livraison standard,5.0,false,,50,,,CN,Global Beauting,globalbeauting,"(3,314 Bewertungen)",3314,4.0467712733856365,5d400a15fe55c84e00daafaf,,,https://www.wish.com/c/5dc3c6b6aaae830e6cc923ef,https://canary.contestimg.wish.com/api/webimage/5dc3c6b6aaae830e6cc923ef-medium.jpg,5dc3c6b6aaae830e6cc923ef
13 Types Garden Decor Newest DIY Concrete Stepping Garden Road Mold Pavement Mold Patio Stone Path Walk Maker Home,13 Types Garden Decor Newest DIY Concrete Stepping Garden Road Mold Pavement Mold Patio Stone Path Walk Maker Home,9.0,CHF,37.0,CHF,9,10,,,4.3076923076923075,13.0,9,1,2,0,1,,,,,,,type11(22x11x6cm),50,Livraison standard,3.0,false,,50,,,CN,The sugar gourd of the sheep and sheep,thesugargourdofthesheepandsheep,"79% Positive Feedback (2,365 ratings)",2365,3.8486257928118395,5b6121a3c2bd842a6a873910,,,https://www.wish.com/c/5ec7505ee9dccd2b4658b6c2,https://canary.contestimg.wish.com/api/webimage/5ec7505ee9dccd2b4658b6c2-medium.jpg,5ec7505ee9dccd2b4658b6c2
Machine d'exercice pas à pas multifonctionnelle conception antidérapante pliable Aerobic Fitness Step Air Kit d'entraînement d'escalier d'escalier,Multifunctional Stepper Exercise Machine foldable non-slip design  Aerobic Fitness Step Air Stair  Climber Workout Kit,22.0,CHF,55.0,CHF,24,10,,,1.25,4.0,0,0,0,1,3,,,,,,,,50,Livraison standard,6.0,false,,50,,,US,Danielle Stuart Jone,daniellestuartjone,"87 % avis positifs (1,254 notes)",1254,4.149920255183413,581b73cb854bcd110d0b602e,,,https://www.wish.com/c/5ecce51811f39f4b74426a41,https://canary.contestimg.wish.com/api/webimage/5ecce51811f39f4b74426a41-medium.jpg,5ecce51811f39f4b74426a41
Mini vélo d'exercice Step Machine Home Gym Pedal Bikes Indoor Exerciseur,Mini Exercise Bike Step Machine Home Gym Pedal Bikes Indoor Exerciser,75.0,CHF,75.0,CHF,82.0,3,,,5.0,0.0,,,,,,,,,,,black,,1,Livraison Express,12.0,true,,1,,,US,Spooky Way,repeat_store,100 % avis positifs (2 notes),2,4.0,5e7401a6c50ae806053304bc,,,https://www.wish.com/c/5fb78146c7e767231f20aeea,https://canary.contestimg.wish.com/api/webimage/5fb78146c7e767231f20aeea-medium.jpg,5fb78146c7e767231f20aeea
"Real BBQ: The Ultimate Step-by-Step Smoker Cookbook, Rockridge Pr","Real BBQ: The Ultimate Step-by-Step Smoker Cookbook, Rockridge Pr",34.0,CHF,34.0,CHF,37.0,0,,,5.0,0.0,,,,,,,,,,,,,4,Livraison standard,18.1,false,,4,,,KR,atcmart,atcmart,67 % avis positifs (6 notes),6,3.8333333333333335,5fe2119d5265268f81dec682,,,https://www.wish.com/c/60081d0080dd739d5da3b632,https://canary.contestimg.wish.com/api/webimage/60081d0080dd739d5da3b632-medium.jpg,60081d0080dd739d5da3b632
3 Stück HSS Cobalt Mehrfachbohrung Mehrfachgrößen Stufenbohrer-Set-Werkzeuge,3pcs HSS Cobalt Multiple Hole Multiple Sizes Step Drill Bit Set Tools,6.0,CHF,35.0,CHF,6,10,,,4.0,22.0,14,2,2,0,4,,,,,,,4-12,50,Livraison standard,2.0,false,,50,,,CN,Mr. Zhuo,mrzhuo,79% Positives Feedback (150 Bewertungen),150,3.94,5ede40091cb118c5b1611607,,,https://www.wish.com/c/5f96c14dcf267c1114c43ac8,https://canary.contestimg.wish.com/api/webimage/5f96c14dcf267c1114c43ac8-medium.jpg,5f96c14dcf267c1114c43ac8
"Brosse à air chaud, sèche-cheveux en une étape Styler Volumizer Multi-fonctionnel 3-en-1 Salon Lisseur à ions négatifs et peigne à cheveux bouclés avec fonction anti-brûlure","Hot Air Brush, One Step Hair Dryer Styler Volumizer Multi-functional 3-in-1 Salon Negative Ion Hair Straightener & Curly Hair Comb with Anti-Scald Feature",19.0,CHF,19.0,CHF,20,1000,,,4.353697749196141,933.0,634,150,56,31,62,,,,,,,usplug,50,Livraison standard,6.0,false,,50,,,CN,hair beauty factory,hairbeautyfactory,"86 % avis positifs (4,376 notes)",4376,4.174131627056672,596c8ca97fe24159495761fb,,,https://www.wish.com/c/5c7902beba7ed2558a660cbc,https://canary.contestimg.wish.com/api/webimage/5c7902beba7ed2558a660cbc-medium.jpg,5c7902beba7ed2558a660cbc
10 PCS Bande individuelle d'autocollants de cils Palette d'extension de greffe de camélia Support de cils Plateau adhésif Outil de maquillage de beauté Tampons adhésifs Cils Plateau d'autocollants Palette de cils individuelle Bande de stockage de cils de greffe de camélia,10 PCS Individual Eyelash Sticker Strip Camellia Grafting Extension Palette Lash Holder Adhesive Tray Beauty Makeup Tool Adhesive Pads Lashes Sticker Tray Individual Eyelash Pallet Camellia Grafting Eyelash Storage Strip,7.0,CHF,7.0,CHF,7,10,,,4.733333333333333,45.0,37,4,4,0,0,,,,,,,onesize,50,Livraison standard,2.0,false,,50,,,US,Stephmiller,stephmiller,"91 % avis positifs (23,408 notes)",23408,4.299982911825017,582b1c8b0e98df1b6d429618,,,https://www.wish.com/c/5c7e0898b3e2670639bd0e5d,https://canary.contestimg.wish.com/api/webimage/5c7e0898b3e2670639bd0e5d-medium.jpg,5c7e0898b3e2670639bd0e5d
Mode hommes nouveau élastique Fitness hommes Ninja porter à capuche à manches longues T-shirt crâne masque Halloween Cosplay costume,Fashion Men  New Elastic Fitness Men Ninja Wear Hooded Long Sleeved T-shirt Skull Mask Halloween Cosplay costume,3.0,CHF,50.0,CHF,3,10,,,3.8266666666666667,150.0,69,32,22,8,19,,,,,,black&gray,xs,1,Livraison standard,1.0,false,,50,,,CN,Lavender Clothes house,lavenderclotheshouse,"72 % avis positifs (1,928 notes)",1928,3.4590248962655603,5d426b5272b0c916ad74072e,,,https://www.wish.com/c/5d858e6788e5f22aee774d3e,https://canary.contestimg.wish.com/api/webimage/5d858e6788e5f22aee774d3e-medium.jpg,5d858e6788e5f22aee774d3e
"Écran couleur Smartband, moniteur de sommeil de la fréquence cardiaque de la pression artérielle, moniteur de fitness, montre intelligente, podomètre, compteur de pas, bracelet étanche, suivi d'activité, bracelet intelligent pour smartphone Android Ios","Color Screen Smartband, Heart Rate Blood Pressure Sleep Monitor Fitness Tracker Smart Watch, Pedometer Step Counter Sport Waterproof Bracelet Activity Tracker, Smart Wristband for Ios Android Smartphone",6.0,CHF,117.0,CHF,6,1000,,,4.043887147335423,638.0,351,117,77,33,60,,,,,,red,m3smartband,50,Livraison standard,2.0,false,,50,true,Quantité limitée !,CN,Huicreate,huicreate,"86 % avis positifs (8,765 notes)",8765,4.039589275527667,5d65e048169ed942c37fc997,,,https://www.wish.com/c/5dc4e2901af4430774edec86,https://canary.contestimg.wish.com/api/webimage/5dc4e2901af4430774edec86-medium.jpg,5dc4e2901af4430774edec86
"Dispositif d'étirement du tendon d'Achille Rampe de cheville Exercice de force du bas du corps Boîte d'étape de mollet Renfort complet du corps Renfort de banc Ceinture extensible durable Type debout Petite jambe Grande pédale d'entraînement Pédale d'équipement Pédale, fichier rose-5","Achilles tendon stretching device ankle ramp lower body strength exercise calf step box full body reinforcement bench bench reinforcement durable stretch belt standing type small leg big pedal training foot pedal equipment pedal, pink-5 file",115.0,CHF,115.0,CHF,126.0,0,,,5.0,0.0,,,,,,,,,,,,,50,Livraison standard,12.0,false,,50,,,KR,KoreanOasis,koreanoasis,100 % avis positifs (4 notes),4,5.0,601a4fde2dfa3d21b8cc2d66,,,https://www.wish.com/c/601cbecbbec0be6708f2dde4,https://canary.contestimg.wish.com/api/webimage/601cbecbbec0be6708f2dde4-medium.jpg,601cbecbbec0be6708f2dde4
1PC 30x30x6cm Kunststoff Retro Sprungbrett Garten Betonform Garten Dekor,1PC 30x30x6cm Plastic Retro Stepping Stone Garden Concrete Mold Garden Decor,23.0,CHF,23.0,CHF,25,10,,,4.6918238993710695,159.0,125,26,3,3,2,,,,,,,,5,Livraison standard,7.0,false,,5,,,CN,kuoleshop,kaopushop,"(51,073 Bewertungen)",51073,4.291151880641435,5a6ebc6c63aa6d34d10cb35a,,,https://www.wish.com/c/5bbcac7daca6181946326eb0,https://canary.contestimg.wish.com/api/webimage/5bbcac7daca6181946326eb0-medium.jpg,5bbcac7daca6181946326eb0
"Chinesische Medizin lindert Schmerzen, lindert Rheuma, Gelenkschmerzen, Muskelschmerzen, Blutergüsse, Schwellung Thailand Tigerölspray","Chinese medicine relieves pain, relieves rheumatism, joint pain, muscle pain, bruises, swelling Thailand tiger oil spray",2.56,CHF,3.0,CHF,2.8200000000000003,10000,,,4.120141342756184,283.0,168,44,33,13,25,,,,,,,10ml,50,Livraison standard,1,false,,50,,,CN,chengsiqi1985,chengsiqi1985,89% Positives Feedback (463 Bewertungen),463,4.215982721382289,5f71830f82a06b145439c985,,,https://www.wish.com/c/5fbdc1a470d583004ada30c7,https://canary.contestimg.wish.com/api/webimage/5fbdc1a470d583004ada30c7-medium.jpg,5fbdc1a470d583004ada30c7
2021 plus récent appel Bluetooth montre intelligente IP67 étanche température corporelle pression artérielle moniteur de fréquence cardiaque StepCounter bracelet Bluetooth activité Fitness bracelet pour Android IOS Smartphone PK Fit bit montre IWO 12,2021 Newest Bluetooth Call Smart Watch IP67 Waterproof Body Temperature Blood Pressure Heart Rate Monitor StepCounter Bluetooth Bracelet Activity Fitness Wristband for Android  IOS Smartphone PK Fit bit watch IWO 12,17.0,CHF,17.0,CHF,18,8,,,4.666666666666667,3.0,2,1,0,0,0,,,,,,white,withoutbluetoothcall,50,Livraison standard,5.0,false,,50,,,US,burisrosamaria217,burisrosamaria217,80 % avis positifs (354 notes),354,3.9519774011299433,5eaa579381728876d7bfcdeb,,,https://www.wish.com/c/5fe5ab5aabc1d0b2a43d08ef,https://canary.contestimg.wish.com/api/webimage/5fe5ab5aabc1d0b2a43d08ef-medium.jpg,5fe5ab5aabc1d0b2a43d08ef
30/50/100 pièces coussinets de Gel de remise en forme Abs Trainer feuille de Gel de remplacement EMS masseur d'entraînement musculaire,30/50/100PCS Fitness Gel Pads Abs Trainer Replacement Gel Sheet EMS Muscle Training Massager,10.0,CHF,10.0,CHF,11,10,,,4.403846153846154,52.0,38,6,3,1,4,,,,,,blue,30pcs,50,Livraison standard,3.0,false,,50,,,CN,"Shenzhen YeHuaJing Trade co., LTD",shenzhenyehuajingtradecoltd,"87 % avis positifs (14,885 notes)",14885,4.135774269398723,563324b29d1026498360696d,,,https://www.wish.com/c/5f97eb61689732004487e8f9,https://canary.contestimg.wish.com/api/webimage/5f97eb61689732004487e8f9-medium.jpg,5f97eb61689732004487e8f9
,,,,,,,,,,,,,,,,,,,,,,,,,,,,,,,,,,,,,,,,,https://www.wish.com/c/5e840fed9719ed1bb16cab41,,5e840fed9719ed1bb16cab41
"Женская мода с буквенным принтом, сука, не трахайся со мной, я прямо сбью глупого с твоего лица, майка с вырезом и галстуком",Women's Fashion Letters Print Bitch Don't Fuck with Me I Will Straight Knock The Stupid Off Your Face Tie Dye Hollow Out Tank Top,3.42,CHF,4.0,CHF,3.76,1000,,,4.277777777777778,72.0,47,11,6,3,5,,,,,,rosered,xxxxl,50,Livraison standard,1.0,false,,50,,,CN,Rosa boutiques,rosaboutiques,"(оценок: 44,724)",44724,3.9888203201860297,55c816360fab98422bbcb623,,,https://www.wish.com/c/5ec755086a22a12e8c5c248e,https://canary.contestimg.wish.com/api/webimage/5ec755086a22a12e8c5c248e-medium.jpg,5ec755086a22a12e8c5c248e
Nuovo agitatore per telefono cellulare per due telefoni Dispositivo di oscillazione automatico per guadagnare punti,New Mobile Phone Shaker for Two Phones Automatic Shake Step Earning Swing Device,9.0,CHF,9.0,CHF,9,10,,,4.421052631578948,19.0,13,3,2,0,1,,,,,,,1pc.,2,Livraison standard,3.0,false,,2,,,CN,huanshishuangshang,huanshishuangshang,(35 valutazioni),35,3.942857142857143,5ee063ba29e786714cccafe0,,,https://www.wish.com/c/5fb286bf5e31931f79fb456b,https://canary.contestimg.wish.com/api/webimage/5fb286bf5e31931f79fb456b-medium.jpg,5fb286bf5e31931f79fb456b
NOVO 2 tamanhos para pavimentação faça você mesmo: concreto de piso para entrada de automóveis Molde para caminhos de pedra Molde para criador de pátios,NEW 2 Sizes Paving DIY Pavement Concrete Stepping Driveway Stone Path Mold Patio Maker Mould,33.0,CHF,33.0,CHF,36,10,,,4.588785046728972,107.0,81,16,5,2,3,,,,,,,10gridss,50,Livraison standard,10.0,false,,50,,,CN,babeyroom,babeyroom,"(4,476 avaliações)",4476,4.296023235031278,5aded9c508a2245a24c2d9ee,,,https://www.wish.com/c/5af55f1335126e12bf32cad9,https://canary.contestimg.wish.com/api/webimage/5af55f1335126e12bf32cad9-medium.jpg,5af55f1335126e12bf32cad9
"119Plus Color Screeen Fitness Tracker Smartband, Herzfrequenz-Blutdruckmessgerät Smart Watch, Schrittzähler Schritt Kalorienzähler Aktivität Tracker Armband, wasserdichtes Sport Smart Armband für Kinder Frauen Männer","119Plus Color Screeen Fitness Tracker Smartband, Heart Rate Blood Pressure Monitor Smart Watch, Pedometer Step Calorie Counter Activity Tracker Wristband, Waterproof Sport Smart Bracelet for Kids Women Men",10.0,CHF,150.0,CHF,11,10000,,,3.421366163621922,2518.0,988,426,344,179,581,,,,,,green,,50,Livraison standard,2.0,false,,50,,,CN,biliheartshop,biliheartshop,"(92,318 Bewertungen)",92318,4.159882146493642,59ef1adb0a332a3e2aab1d00,,,https://www.wish.com/c/5ddd105e072f11242ae0db8f,https://canary.contestimg.wish.com/api/webimage/5ddd105e072f11242ae0db8f-medium.jpg,5ddd105e072f11242ae0db8f
Torche LED extérieure XHP50 / XHP70 Rechargeable 5 modes Torches tactiques LED Super Bright Puissant 999000000Lumens 4 puces de base Lampe de poche tactique zoomable pour camping randonnée vélo course à pied avec accessoires 18650 batteries,XHP50/XHP70 Outdoor LED Torch Rechargeable 5 Modes Tactical Torches LED Super Bright Powerful 999000000Lumens 4 Core Chips Zoomable Tactical Flashlight for Camping Hiking Bicyle Running Including Accessories 18650 Batteries,7.0,CHF,7.0,CHF,7,1000,,,4.114516129032258,620.0,355,115,67,32,51,,,,,,,minisize-100lm(nobattery),50,Livraison standard,2.0,false,,50,,,CN,eshopinbox,eshopinbox,"87 % avis positifs (3,765 notes)",3765,4.12456839309429,570a6486a18a3f59066cf284,,,https://www.wish.com/c/5f97dcd79839991ad585bcd2,https://canary.contestimg.wish.com/api/webimage/5f97dcd79839991ad585bcd2-medium.jpg,5f97dcd79839991ad585bcd2
Kit de gabarit de trou de poche Tournevis Étape Foret Jeu d'outils de menuiserie pour le travail du bois,Pocket Hole Jig Kit Screwdriver Step Drill Bit Woodworking Joinery Tool Set,10.0,CHF,59.0,CHF,11,10,,,4.229508196721311,122.0,73,27,7,7,8,,,,,,,7pcs/set,50,Livraison standard,2.0,false,,50,true,Quantité limitée !,CN,ZHAOTIANXIA-LIULIZHI,zhaotianxialiulizhi,81 % avis positifs (635 notes),635,3.8566929133858268,5d7b0355288835183b3ffe58,,,https://www.wish.com/c/5e4bf5a696159b27c051f16a,https://canary.contestimg.wish.com/api/webimage/5e4bf5a696159b27c051f16a-medium.jpg,5e4bf5a696159b27c051f16a
Herbst 5XL Plus Size Schlanker Bürorock Faldas Frauen Sexy Elastic High Waist Bleistiftrock Step Office Formeller Rock Saias Röcke,Autumn 5XL Plus Size Slim Office Skirt Faldas Women Sexy Elastic High Waist Pencil Skirt Step Office Formal Skirt Saias Skirts,11.0,CHF,22.0,CHF,12,10,,,4.143589743589744,195.0,108,45,18,10,14,,,,,,black,s,50,Livraison standard,3.0,false,,50,true,Quantité limitée !,CN,chengdongmei2018,chengdongmei2018,90% Positives Feedback (408 Bewertungen),408,4.267156862745098,5aaf55911b98df4c8d02d36e,,,https://www.wish.com/c/5abb4d0d0b43213a6e9b3673,https://canary.contestimg.wish.com/api/webimage/5abb4d0d0b43213a6e9b3673-medium.jpg,5abb4d0d0b43213a6e9b3673
