title,title_orig,discount_price,discount_price_currency,retail_price,retail_price_currency,discount_price_in_original_currency,nb_cart_orders_approx,nb_units_purchased_approx,uses_ad_boosts,rating,rating_count,rating_five_count,rating_four_count,rating_three_count,rating_two_count,rating_one_count,badges_count,badge_local_product,badge_product_quality,badge_fast_shipping,tags,product_color,product_variation_size_id,product_variation_inventory,shipping_option_name,shipping_option_price,shipping_is_express,countries_shipped_to,inventory_total,has_urgency_banner,urgency_text,origin_country,merchant_title,merchant_name,merchant_info_subtitle,merchant_rating_count,merchant_rating,merchant_id,merchant_has_profile_picture,merchant_profile_picture,product_url,product_picture,product_id
"Scooter per bambini con ruote illuminanti a LED Mini Kick pieghevole Scooter Ruote in alluminio Deluxe illuminate per ragazze Ragazzi, 3-15 anni","Scooter for Kids with LED Light Up Wheels Foldable Mini Kick Scooter Aluminum Deluxe Light Up Wheels for Girls Boys, Ages 3-15",59.0,CHF,59.0,CHF,64.0,10,,,4.35,20.0,13,4,1,1,1,,,,,,pink,,50,Livraison standard,12.0,false,,50,,,CN,lijingjingmei,lijingjingmei,"89% feedback positivi (4,773 recensioni)",4773,4.203855017808507,59351c6c83eb55506b9e1416,,,https://www.wish.com/c/5d4a896ac42819332bbbadcf,https://canary.contestimg.wish.com/api/webimage/5d4a896ac42819332bbbadcf-medium.jpg,5d4a896ac42819332bbbadcf
KOREA Dog Supplies Stand Dog Stair Pet Step Step 2 Red,KOREA Dog Supplies Stand Dog Stair Pet Step Step 2 Red,113.0,CHF,113.0,CHF,124.0,0,,,5.0,0.0,,,,,,,,,,,multicolor,select,50,Livraison standard,12.0,false,,50,true,Quantité limitée !,KR,GPOPMALL,gpopmall,69 % avis positifs (16 notes),16,3.6875,600bc259338f835382ad78e9,,,https://www.wish.com/c/6023ce2faeb6a33fdff00f4a,https://canary.contestimg.wish.com/api/webimage/6023ce2faeb6a33fdff00f4a-medium.jpg,6023ce2faeb6a33fdff00f4a
Greffe Extension de Cils Maquillage Remover Colle 5g Non-irritant Plante Adhésif Gel Remover Cils Yeux Maquillage Crème Démaquillante,Grafting Eyelash Extension Makeup Remover Glue 5g Non-irritating Plant Adhesive Gel Remover Eye Lashes Make Up Remover Cream,3.0,CHF,5.0,CHF,3,10,,,4.9,10.0,9,1,0,0,0,,,,,,,5g,50,Livraison standard,1.0,false,,50,,,CN,chenbangji,chenbangji,"92 % avis positifs (118,687 notes)",118687,4.319192497914683,58c135927a887c518dab50e7,,,https://www.wish.com/c/5e159066e925b708beb18a92,https://canary.contestimg.wish.com/api/webimage/5e159066e925b708beb18a92-medium.jpg,5e159066e925b708beb18a92
3 Farben Optionales Kinderwagen-Board-Kinderwagen-Step-Zusatz-Sitzpedal mit Seat Kid Universal,3 Colors Optional Stroller Board Pushchair Step Auxiliary Sitting Pedal with Seat Kid Universal ,35.0,CHF,35.0,CHF,38,10,,,3.375,8.0,4,0,1,1,2,,,,,,pink,,7,Livraison standard,10.0,false,,43,,,CN,dingduang,dingduang,"(2,947 Bewertungen)",2947,4.109942314217848,5df05c54a8af5703f2d38f1d,,,https://www.wish.com/c/5f85818c5d13e51f76f7d012,https://canary.contestimg.wish.com/api/webimage/5f85818c5d13e51f76f7d012-medium.jpg,5f85818c5d13e51f76f7d012
KOREA Step box large aerobic exercise sports full body physical fitness,KOREA Step box large aerobic exercise sports full body physical fitness,151.0,CHF,151.0,CHF,166.0,0,,,5.0,0.0,,,,,,,,,,,multicolor,select,50,Livraison standard,12.0,false,,50,,,KR,GPOPMALL,gpopmall,69 % avis positifs (16 notes),16,3.6875,600bc259338f835382ad78e9,,,https://www.wish.com/c/601f9b78e57a9d04a6706b7f,https://canary.contestimg.wish.com/api/webimage/601f9b78e57a9d04a6706b7f-medium.jpg,601f9b78e57a9d04a6706b7f
Stephen King's It 1990 Pennywise figurine en PVC,Stephen King's It 1990 Pennywise PVC Action Figure,24.0,CHF,110.0,CHF,26,10,,,4.6891891891891895,74.0,58,11,4,0,1,,,,,,,withoutcolorbox,50,Livraison standard,7.0,false,,50,,,CN,Magic Style,magicstyle,"93 % avis positifs (2,476 notes)",2476,4.434571890145396,5964d3a1826338399d446159,,,https://www.wish.com/c/5cb19d9d962dff6c2152bfeb,https://canary.contestimg.wish.com/api/webimage/5cb19d9d962dff6c2152bfeb-medium.jpg,5cb19d9d962dff6c2152bfeb
Lucky,,,,,,,,,,,,,,,,,,,,,,,,,,,,,,,,,,,,,,,,,https://www.wish.com/c/5f8c205beb31f9c6391a622a,,5f8c205beb31f9c6391a622a
10 Pz Pianta Radice Palla Pianta Crescita Scatola Allevamento Innesto Caso Pianta Radice Dispositivo Palla di Propagazione ad Alta Pressione Scatola ad Alta Pressione per Giardino,10 Pcs Plant Rooting Ball Plant Growing Box Breeding Grafting Case Plant Rooting Device High Pressure Propagation Ball High Pressure Box for Garden,5.0,CHF,5.0,CHF,5,10,,,4.125,40.0,26,4,4,1,5,,,,,,black,s(1pcs),50,Livraison standard,1.0,false,,50,,,CN,eshopinbox,eshopinbox,"87% feedback positivi (3,765 recensioni)",3765,4.12456839309429,570a6486a18a3f59066cf284,,,https://www.wish.com/c/5f23df35b325a817a4cba185,https://canary.contestimg.wish.com/api/webimage/5f23df35b325a817a4cba185-medium.jpg,5f23df35b325a817a4cba185
Lumières solaires mur lumière solaire éclairage de sécurité extérieur veilleuse étanche IP65 détecteur de mouvement détecteur de mouvement jardin porte arrière étape escalier clôture pont cour allée,Solar Lights Wall Solar Light Outdoor Security Lighting Nightlight Waterproof IP65 Motion Sensor Detector Garden Back Door Step Stair Fence Deck Yard Driveway,8.0,CHF,8.0,CHF,8,10,,,4.689655172413793,29.0,23,5,0,0,1,,,,,,white,1pc,50,Livraison standard,3.0,false,,50,,,CN,Salaery Shirts,salaeryshirts,91 % avis positifs (911 notes),911,4.307354555433589,5e966ad9f2744d05870ba92d,,,https://www.wish.com/c/5f7ead8c518db2003d31a5f7,https://canary.contestimg.wish.com/api/webimage/5f7ead8c518db2003d31a5f7-medium.jpg,5f7ead8c518db2003d31a5f7
Mini vélo d'exercice durable machine à pédale de gymnastique à domicile,Mini Durable Exercise Bike Step Machine Home Gym Pedal Bikes Indoor Exerciser,68.0,CHF,68.0,CHF,74.0,3,,,3.0,1.0,0,0,1,0,0,,,,,,,black,4,Livraison Express,12.0,true,,4,,,CN,HongXing123 Shop,hongxing123shop,93 % avis positifs (338 notes),338,4.396449704142012,5b4da8565d643e2e3e321ee7,,,https://www.wish.com/c/6017aa3723bf630042181b36,https://canary.contestimg.wish.com/api/webimage/6017aa3723bf630042181b36-medium.jpg,6017aa3723bf630042181b36
Pedal Bikes Pedal Exerciser  Mini Exercise Bike Step Machine Home Gym Pedal Bikes Indoor Exercise Exerciser Legs And Arms Fitness Cycling,Pedal Bikes Pedal Exerciser  Mini Exercise Bike Step Machine Home Gym Pedal Bikes Indoor Exercise Exerciser Legs And Arms Fitness Cycling,68.0,CHF,68.0,CHF,74.0,0,,,5.0,0.0,,,,,,,,,,,black,a-40x35cm,10,Livraison Express,12.0,true,,10,,,CN,mirdubdhgc,mirdubdhgc,"88 % avis positifs (1,964 notes)",1964,4.220468431771894,5d5a4a05560eca427bf1d8d7,,,https://www.wish.com/c/607d3d0db082685f00669421,https://canary.contestimg.wish.com/api/webimage/607d3d0db082685f00669421-medium.jpg,607d3d0db082685f00669421
Ensemble de forets étagés revêtus de titane HSS,HSS Titanium Coated Step Drill Bit set Hex Shank Step Cone Drilling Bit for Metal Wood Drill Hole Cutting Tools,5.16,CHF,20.0,CHF,5.68,10,,,3.8048780487804876,41.0,17,13,2,4,5,,,,,,,4-12,50,Livraison standard,2.0,false,,50,,,CN,cotre,cotre,85 % avis positifs (146 notes),146,4.123287671232877,5f5f0d6219a44fc7bb206b10,,,https://www.wish.com/c/5f68aa55c6a1ed004d1ca068,https://canary.contestimg.wish.com/api/webimage/5f68aa55c6a1ed004d1ca068-medium.jpg,5f68aa55c6a1ed004d1ca068
2020 New Fashion Unisex 1 Typen 1 Stück 3D-Druck Musiknotizen Muster Waschbar Wiederverwendbar Staubdichte und umweltfreundliche Baumwollmundmaske,2020 New Fashion Unisex 1 Types 1pcs 3D Print Music Notes Pattern Washable Reuseable Dustproof and Anti-pollution Cotton Mouth Mask,2.0,CHF,3.0,CHF,2.09,5000,,,4.353369763205829,549.0,354,98,57,17,23,,,,,,,01,13,Livraison standard,0.85,false,,50,,,CN,Shelan,shelan,"86% Positives Feedback (47,715 Bewertungen)",47715,4.051199832337839,57a995f564fa71286bac2109,,,https://www.wish.com/c/5f83da48b521a32bf07f5f41,https://canary.contestimg.wish.com/api/webimage/5f83da48b521a32bf07f5f41-medium.jpg,5f83da48b521a32bf07f5f41
Lait en poudre Aptamil Pronutra Advanced New Hmo Étape 1,Aptamil Pronutra Advanced New Hmo Powdered Milk Step 1,316.0,CHF,316.0,CHF,347.0,0,,,5.0,0.0,,,,,,,,,,,,,1,Livraison standard,9.0,false,,1,,,KR,ThinkerValue,thinkervalue,(3 notes),3,3.6666666666666665,5fc5ff4c3e691f2727facac4,,,https://www.wish.com/c/5fe28524cc9968003e696629,https://canary.contestimg.wish.com/api/webimage/5fe28524cc9968003e696629-medium.jpg,5fe28524cc9968003e696629
4pcs / set de anillo de silicona al aire libre de arco de paso para hombres y mujeres anillo de deportes al aire libre,4pcs / set of men's and women's arc step silicone ring outdoor sports ring,4.25,CHF,5.0,CHF,4.68,1000,,,4.372448979591836,196.0,127,34,23,5,7,,,,,,,set1-7,50,Livraison standard,1.0,false,,50,,,CN,xuehua006,xuehua006,(479 calificaciones),479,4.30062630480167,5db7b70aec09c177c47b00f0,,,https://www.wish.com/c/5de4b73de6d544c7af5f3fca,https://canary.contestimg.wish.com/api/webimage/5de4b73de6d544c7af5f3fca-medium.jpg,5de4b73de6d544c7af5f3fca
Film d'arbre fruitier greffé Type auto-adhésif sans nouage couteau de greffage Film d'emballage sangle de jonction cerclage connecteur spécial,Grafted Fruit Tree Film Self-adhesive Type Without Knotting Grafting Knife Wrapping Film Jointing Strap Strapping Special Connector,4.0,CHF,28.0,CHF,4,10,,,5.0,7.0,7,0,0,0,0,,,,,,green,,50,Livraison standard,1.0,false,,50,,,CN,luodongxuan,luodongxuan,"89 % avis positifs (4,189 notes)",4189,4.249940319885414,5a9ced1940626a18a2377bba,,,https://www.wish.com/c/5c9860d9987d734eb77af278,https://canary.contestimg.wish.com/api/webimage/5c9860d9987d734eb77af278-medium.jpg,5c9860d9987d734eb77af278
Neue 200-500 Paar gepfropfte Wimpernaufkleber Hydrogel Under Eye Gel Pads,New 200-500pair Grafted Eyelash Sticker Hydrogel Under Eye Gel Pads,26.0,CHF,73.0,CHF,28,10,,,4.875,32.0,29,2,1,0,0,,,,,,silver,200pair,50,Livraison standard,8.0,false,,50,,,CN,xiaochong_store,xiaochong_store,(717 Bewertungen),717,4.315202231520223,5ab3c4f8417cee50a7f85c14,,,https://www.wish.com/c/5d01f2268eb18f567440f956,https://canary.contestimg.wish.com/api/webimage/5d01f2268eb18f567440f956-medium.jpg,5d01f2268eb18f567440f956
"Achilles tendon stretching device ankle ramp lower body strength exercise calf step box full body stretch wheel thin small leg stretch artifact open hip stretch board incline pedal standing stretcher multifunctional, a pair of blue soul","Achilles tendon stretching device ankle ramp lower body strength exercise calf step box full body stretch wheel thin small leg stretch artifact open hip stretch board incline pedal standing stretcher multifunctional, a pair of blue soul",113.0,CHF,113.0,CHF,124.0,0,,,5.0,0.0,,,,,,,,,,,,,50,Livraison standard,12.0,false,,50,true,Quantité limitée !,KR,KoreanOasis,koreanoasis,100 % avis positifs (4 notes),4,5.0,601a4fde2dfa3d21b8cc2d66,,,https://www.wish.com/c/601cbeb56a54b57374c14775,https://canary.contestimg.wish.com/api/webimage/601cbeb56a54b57374c14775-medium.jpg,601cbeb56a54b57374c14775
Outil de greffage de ciseaux de ciseaux d'élagage d'arbres fruitiers de jardin de haute qualité + outil de jardin de lame de 2 pièces,High Quality Pro Garden Fruit Tree Pruning Shears Scissor Grafting Tool +2pcs Blade Garden Tool,6.0,CHF,6.0,CHF,6,10,,,4.666666666666667,3.0,2,1,0,0,0,,,,,,,typea(only3pcsblades),50,Livraison standard,2.0,false,,50,true,Quantité limitée !,CN,Futurelife1,futurelife1,"92 % avis positifs (19,836 notes)",19836,4.352792901794717,58d8f83ddcfd8c59b4770c44,,,https://www.wish.com/c/5ffeb6d5effdff604361d974,https://canary.contestimg.wish.com/api/webimage/5ffeb6d5effdff604361d974-medium.jpg,5ffeb6d5effdff604361d974
Nouvelle mise à niveau HSS Cobalt Multiple Hole 50 Tailles Step Drill Bit Set Tools,New Upgrade HSS Cobalt Multiple Hole 50 Sizes Step Drill Bit Set Tools,17.0,CHF,17.0,CHF,18,10,,,4.647058823529412,17.0,14,2,0,0,1,,,,,,,1pc,5,Livraison standard,5.0,false,,50,,,CN,Bigriver manshoes,bigrivermanshoes,"90 % avis positifs (2,157 notes)",2157,4.261010662957812,5b6d0713ca395227f89d358d,,,https://www.wish.com/c/5f0ebf25fcc85c3b5c7ac45b,https://canary.contestimg.wish.com/api/webimage/5f0ebf25fcc85c3b5c7ac45b-medium.jpg,5f0ebf25fcc85c3b5c7ac45b
"Mascara DNM soie 4D double tête greffé, imperméable à l'eau, l'eau chaude peut être évacuée sans halo teinture.","DNM silk 4D double head Mascara grafted grow waterproof, warm water can be discharged without halo dyeing.",5.22,CHF,6.0,CHF,5.75,1000,,,4.129675810473816,401.0,240,64,45,13,39,,,,,,,,50,Livraison standard,2.0,false,,50,true,Quantité limitée !,CN,MickyYiDa,mickyyida,"90 % avis positifs (59,364 notes)",59364,4.2313354895222695,5a463c91fd9db80f046e360e,,,https://www.wish.com/c/5cdbfb9095313f39ec30848f,https://canary.contestimg.wish.com/api/webimage/5cdbfb9095313f39ec30848f-medium.jpg,5cdbfb9095313f39ec30848f
Universelle Elektroroller-Kopftasche EVA Hartschalentasche für Xiaomi M365 ES1 ES2 ES3 ES4,Universal Electric Scooter Head Handle Bag EVA Hard Shell Bag for Xiaomi M365 ES1 ES2 ES3 ES4,13.0,CHF,13.0,CHF,14,1000,,,4.571895424836601,306.0,221,55,21,2,7,,,,,,,2l,50,Livraison standard,4.0,false,,50,,,CN,HuaKin Store,huakinstore,"(9,435 Bewertungen)",9435,4.366613672496025,58a18ab892cf4d5000e5719e,,,https://www.wish.com/c/5d569ba6ef9e53356137c25d,https://canary.contestimg.wish.com/api/webimage/5d569ba6ef9e53356137c25d-medium.jpg,5d569ba6ef9e53356137c25d
Phone Shaker for Steps Counter Accessories Compatible for Pokemon Go Cellphone Pedometer USB Cable Easy Installation,Phone Shaker for Steps Counter Accessories Compatible for Pokemon Go Cellphone Pedometer USB Cable Easy Installation,27.0,CHF,27.0,CHF,29,6,,,5.0,0.0,,,,,,,,,,,red,,10,Livraison standard,8.0,false,,34,,,CN,Walkthink,walkthink,"89 % avis positifs (1,349 notes)",1349,4.174944403261676,5954b8d4a124fe3b08b34a39,,,https://www.wish.com/c/5fd96a7bc11270496a7eeffd,https://canary.contestimg.wish.com/api/webimage/5fd96a7bc11270496a7eeffd-medium.jpg,5fd96a7bc11270496a7eeffd
Jambe de pas à pas d'équipement de fitness domestique d'intérieur amincissant la pédale d'exercice de formation d'étape,Indoor Domestic Fitness Equipment Stepper Leg Slimming Step Training Exercise Pedal,63.0,CHF,63.0,CHF,69.0,0,,,5.0,0.0,,,,,,,,,,,,,50,Livraison standard,12.0,false,,50,,,CN,Fluorescent,fluorescent,"94 % avis positifs (19,428 notes)",19428,4.456300185299567,58b557c796f1bb31a0976091,,,https://www.wish.com/c/5fad0dd783b5e609c570107d,https://canary.contestimg.wish.com/api/webimage/5fad0dd783b5e609c570107d-medium.jpg,5fad0dd783b5e609c570107d
Kit de démarrage pour Arduino Uno R3 - Platine d'essais et support Uno R3 Moteur pas à pas / Servo / 1602 LCD / Fil de cavalier / UNO R3,Starter Kit for arduino Uno R3 - Uno R3 Breadboard and holder Step Motor / Servo /1602 LCD / jumper Wire/ UNO R3,39.0,USD,39.0,USD,39,10,,,4.1940298507462686,67.0,41,11,7,3,5,,,,,,,,50,Livraison standard,11.0,false,,50,true,Quantité limitée !,CN,goug77,goug77,"79 % avis positifs (5,970 notes)",5970,3.8477386934673365,56d06c018bd26e54b8c5cc05,,,https://www.wish.com/c/5e1a8bd5e8ced428c4cd9efa,https://canary.contestimg.wish.com/api/webimage/5e1a8bd5e8ced428c4cd9efa-medium.jpg,5e1a8bd5e8ced428c4cd9efa
Absolut Nature's Gift Organic Palace Formula 1ère étape,Absolut Nature's Gift Organic Palace Formula 1st Step,81.0,CHF,81.0,CHF,89.0,0,,,5.0,0.0,,,,,,,,,,,,,1,Livraison standard,9.0,false,,1,,,KR,ThinkerValue,thinkervalue,67 % avis positifs (3 notes),3,3.6666666666666665,5fc5ff4c3e691f2727facac4,,,https://www.wish.com/c/5fe28629699cca0041ee1a68,https://canary.contestimg.wish.com/api/webimage/5fe28629699cca0041ee1a68-medium.jpg,5fe28629699cca0041ee1a68
"100 m * 20 mm PE Film de Greffage Ruban, Plantes Arbres Greffe Barrière Parafilm, Jardin Pépinière Greffage Fournitures","100m*20mm PE Grafting Tape Film,Tree Plants Graft Barrier Parafilm,Garden Nursery Grafting Supplies",5.32,CHF,6.0,CHF,5.85,10,,,4.2,5.0,3,1,0,1,0,,,,,,,1pcs,50,Livraison standard,1.0,false,,50,,,VE,Drooper369,drooper369,"90 % avis positifs (1,841 notes)",1841,4.335143943508963,5e14e7ac56fb9ceecc86022f,,,https://www.wish.com/c/5ec621b64a4c6e07b3d40cf5,https://canary.contestimg.wish.com/api/webimage/5ec621b64a4c6e07b3d40cf5-medium.jpg,5ec621b64a4c6e07b3d40cf5
Step Father T-shirt Step-dad Father's day Gift Shirt Mens shirt,Step Father T-shirt Step-dad Father's day Gift Shirt Mens shirt,22.0,CHF,22.0,CHF,24,1000,,,4.687150837988827,358.0,288,45,14,5,6,,,,,,black,s,50,Livraison standard,6.0,false,,50,,,US,TshirtsEmpire,wholesaleandretailcorp,"97% Positive Feedback (3,981 ratings)",3981,4.6568701331323785,530a27b5ab980a0eca518176,,,https://www.wish.com/c/5c9261a901063c49ffe48f64,https://canary.contestimg.wish.com/api/webimage/5c9261a901063c49ffe48f64-medium.jpg,5c9261a901063c49ffe48f64
 16 Farben One Step Nagellack Pen Glitter 3 In 1 Nail Art Color Gelpolitur Einfach zu verwendender UV Gel Painting Kleber, 16 Colors One Step Nail Varnish Pen Glitter 3 In 1 Nail Art Color Gel Polish Easy To Use UV Gel Painting Glue,2.0,CHF,11.0,CHF,2,1000,,,3.276595744680851,47.0,17,10,3,3,14,,,,,,,01,50,Livraison standard,1,false,,50,,,CN,Fun things to do,funthingstodo,"82% Positives Feedback (5,143 Bewertungen)",5143,3.93758506708147,5d514ed01d9a8e239c34a4ac,,,https://www.wish.com/c/5fe9a0e6118a8b6b725398a5,https://canary.contestimg.wish.com/api/webimage/5fe9a0e6118a8b6b725398a5-medium.jpg,5fe9a0e6118a8b6b725398a5
Enfants Garçons Casual Sport Print Vêtements Ensembles T-shirt à manches courtes + Pantalon taille élastique,Children Boys Casual Sport Print Clothing Sets Short Sleeve T-Shirt + Elastic Waist Pants,14.0,USD,14.0,USD,14,1000,,,4.467605633802817,355.0,244,63,29,8,11,,,,,,green,3t,50,Livraison standard,3.0,false,,50,true,Quantité limitée !,CN,misafashion,misainternationalcompany,"87 % avis positifs (23,848 notes)",23848,4.128731969137873,5484735840b37826a3031dc3,,,https://www.wish.com/c/5b0bcc63c2c9b22ca15f093b,https://canary.contestimg.wish.com/api/webimage/5b0bcc63c2c9b22ca15f093b-medium.jpg,5b0bcc63c2c9b22ca15f093b
Niedliche wasserdichte Stoff-Kosmetiktaschen Tragbare Reisetaschen Toilettentasche Make-up Organizer Clutch Bag mit Reißverschluss ,Cute  Waterproof Fabric Cosmetic Bags Portable Travel Toiletry Pouch Makeup Organizer Clutch Bag with Zipper ,3.0,CHF,3.0,CHF,3,10000,,,4.648445873526259,1866.0,1442,278,91,24,31,,,,,,,1,50,Livraison standard,1.0,false,,50,true,Quantité limitée !,CN,trendy_world,shanghailalanginternationaltradecoltd,"(346,498 Bewertungen)",346498,4.071769534023284,53f2beb39020ee03566d6e18,,,https://www.wish.com/c/59c60bb54505db4a71568e95,https://canary.contestimg.wish.com/api/webimage/59c60bb54505db4a71568e95-medium.jpg,59c60bb54505db4a71568e95
"2/4/6 paquets de lampes murales solaires extérieures, étape de poteau de clôture solaire allume l'acier inoxydable résistant aux intempéries pour l'étape de pont de clôture de chemin de jardin","2/4/6 Pack Solar Wall Lights Outdoor, Solar Fence Post Step Lights Weatherproof Stainless Steel for Garden Pathway Fence Deck Step",16.0,CHF,16.0,CHF,17,10,,,4.4,5.0,2,3,0,0,0,,,,,,warmwhite,2pack,50,Livraison standard,5.0,false,,50,,,CN,WANGFAN.8-8,wangfan88,"80 % avis positifs (1,663 notes)",1663,3.8496692723992783,5df1fe9f3afb0b00a01dd1b8,,,https://www.wish.com/c/5f196d31aa8ccd7afa37669e,https://canary.contestimg.wish.com/api/webimage/5f196d31aa8ccd7afa37669e-medium.jpg,5f196d31aa8ccd7afa37669e
Mini vélo d'exercice Step Machine Home Gym Pedal Bikes Indoor Exerciseur,Mini Exercise Bike Step Machine Home Gym Pedal Bikes Indoor Exerciser,65.0,CHF,65.0,CHF,71.0,8,,,5.0,0.0,,,,,,,,,,,black,,1,Livraison Express,12.0,true,,1,,,US,Spooky Way,repeat_store,100 % avis positifs (2 notes),2,4.0,5e7401a6c50ae806053304bc,,,https://www.wish.com/c/5fb80505d09a023bfd889c9a,https://canary.contestimg.wish.com/api/webimage/5fb80505d09a023bfd889c9a-medium.jpg,5fb80505d09a023bfd889c9a
"Jamickiki 2018 Marke Swag Pullover Kapuzenpullover Herren Kapuzenpullover Fleece Warme Pullover Sweatshirts Qualität Baumwolle Herren Kapuzenpullover Jacke Hip Hop Sportbekleidung, Nutzgröße XS-5XL, 6 Farben","Jamickiki 2018 Brand Swag Pullover Hoodies Hooded Men Hoodies Fleece Warm Pullovers Sweatshirts Quality Cotton Mens Hoodies Jacket Hip Hop Sportwear,Us Size XS-5XL,   6 Colors",10.0,CHF,359.0,CHF,11,20000,,,3.662784248474764,7212.0,2980,1457,1179,555,1041,,,,,,red,xs,50,Livraison standard,2.0,false,,50,,,CN,Kiki Fashion,kikifashion,"82% Positives Feedback (221,277 Bewertungen)",221277,3.837827700122471,53ca236f4497c55144fcf72b,,,https://www.wish.com/c/55bb2e07ec31eb43c084d0d9,https://canary.contestimg.wish.com/api/webimage/55bb2e07ec31eb43c084d0d9-medium.jpg,55bb2e07ec31eb43c084d0d9
Black&Grey Floor Fitness Aerobic Step Cardio Yoga Pedal Stepper Gym Workout Exercise Yoga Fitness Aerobic Step Equipment,Black&Grey Floor Fitness Aerobic Step Cardio Yoga Pedal Stepper Gym Workout Exercise Yoga Fitness Aerobic Step Equipment,63.0,CHF,63.0,CHF,69.0,0,,,5.0,0.0,,,,,,,,,,,,m,25,Livraison Express,12.0,true,,50,,,CN,leoflake,leoflake,"91 % avis positifs (12,954 notes)",12954,4.321290721012814,59a3bc8cb7717313b7e92194,,,https://www.wish.com/c/607803a8b3e4fc980ddd47c9,https://canary.contestimg.wish.com/api/webimage/607803a8b3e4fc980ddd47c9-medium.jpg,607803a8b3e4fc980ddd47c9
Imperial Dream Organic Organic Powdered Milk Step 3,Imperial Dream Organic Organic Powdered Milk Step 3,91.0,CHF,91.0,CHF,100.0,0,,,5.0,0.0,,,,,,,,,,,,,1,Livraison standard,9.0,false,,1,true,Quantité limitée !,KR,ThinkerValue,thinkervalue,67 % avis positifs (3 notes),3,3.6666666666666665,5fc5ff4c3e691f2727facac4,,,https://www.wish.com/c/5fe2a8dc98571c59a01b0c88,https://canary.contestimg.wish.com/api/webimage/5fe2a8dc98571c59a01b0c88-medium.jpg,5fe2a8dc98571c59a01b0c88
Scooter hordozó vállpántos öv Xiaomi Mijia M365 M187 MI Pro robogóhoz Ninebot ES1 ES2 robogóhoz M365 Oxford öv,Scooter Carrying Shoulder Hand Strap Belt for Xiaomi Mijia M365 M187 MI Pro Scooter for Ninebot ES1 ES2 Scooter M365 Oxford Belt,9.0,CHF,37.0,CHF,9,10,,,4.355263157894737,76.0,49,13,10,0,4,,,,,,,1pc,50,Livraison standard,3.0,false,,50,,,CN,SUSU Pig,susupig,(623 értékelés),623,4.237560192616372,5d5e4d1540defd18f3266d5a,,,https://www.wish.com/c/5f367ad6e3fda30044b622a7,https://canary.contestimg.wish.com/api/webimage/5f367ad6e3fda30044b622a7-medium.jpg,5f367ad6e3fda30044b622a7
"1/2 / 4PCS Hot Products TV / DVD / VCR Schritt Fernbedienung, Handyhalterständer, Aufbewahrungs- und Organizer-Wandhalter Praktische Ladebox Halterung Ständer Regalhalterung Universal für die Handyfernbedienung","1/2/4PCS Hot Products TV/DVD/VCR Step Remote Control,Mobile Phone Holder Stand,Storage & Organizer Wall Holder Practical Charging Box Bracket Stand Shelf Mount Support Universal for Mobile Phone remote control ",3.76,USD,4.0,USD,3.76,1000,,,4.457831325301205,166.0,111,33,13,5,4,,,,,,white,1pcs,50,Livraison standard,1.0,false,,50,,,CN,Chenlaiz,chenlaiz,"90% Positives Feedback (3,204 Bewertungen)",3204,4.260923845193508,5951d2d353ebe23c6eca4b50,,,https://www.wish.com/c/5f33b4c217d293004cbde2cc,https://canary.contestimg.wish.com/api/webimage/5f33b4c217d293004cbde2cc-medium.jpg,5f33b4c217d293004cbde2cc
NEW 27 Inch Fitness Aerobic Step Cardio Yoga Pedal Stepper For Gym Workout Exercise Aerobic Step Equipment,NEW 27 Inch Fitness Aerobic Step Cardio Yoga Pedal Stepper For Gym Workout Exercise Aerobic Step Equipment,59.0,CHF,59.0,CHF,64.0,1,,,5.0,0.0,,,,,,,,,,,,,18,Livraison Express,12.0,true,,18,true,Quantité limitée !,CN,bewristore win,bewristorewin,91 % avis positifs (463 notes),463,4.345572354211663,5d43e7d770327a6d1267f98a,,,https://www.wish.com/c/603371eb336f54df00f69e46,https://canary.contestimg.wish.com/api/webimage/603371eb336f54df00f69e46-medium.jpg,603371eb336f54df00f69e46
"Solar Deck Lichter im Freien, 4er Pack Solar Step Light Wasserdichte Solar Zaun Lichter für Terrassentreppen Post Pathway Veranda Auffahrt Yard Garden Decor Warmweiß / LED Farbwechsel Beleuchtung","Solar Deck Lights Outdoor, 4 Pack Solar Step Light Waterproof Solar Fence Lights for Patio Stairs Post Pathway Porch Driveway Yard Garden Decor Warm White/LED Color Changing Lighting",16.0,CHF,273.0,CHF,17,10,,,4.333333333333333,15.0,10,3,0,1,1,,,,,,,4pcs(oldstyle)-warmwhite,50,Livraison standard,5.0,false,,50,,,CN,YANGXIULL,yangxiull,88% Positives Feedback (757 Bewertungen),757,4.191545574636724,5e71e0f2eca1c81dc0521817,,,https://www.wish.com/c/5fc75c93bf67a3db6c4af616,https://canary.contestimg.wish.com/api/webimage/5fc75c93bf67a3db6c4af616-medium.jpg,5fc75c93bf67a3db6c4af616
Mode 60pcs maquillage professionnel maquillage individuel Cluster Cils individuels Cils Grafting Fake False Eyelashes,Fashion 60pcs Professional Makeup Individual Cluster Eye Lashes Grafting Fake False Eyelashes,4.29,CHF,5.0,CHF,4.72,10000,,,4.437908496732026,1224.0,872,152,112,40,48,,,,,,,8mm,50,Livraison standard,1.0,false,,50,,,CN,xiaofeng1989shop,xiaofeng1989shop,"90 % avis positifs (3,873 notes)",3873,4.287632326361993,59f83e056ea4a72f6abcabc0,,,https://www.wish.com/c/5b5be83a5dccad7a58526046,https://canary.contestimg.wish.com/api/webimage/5b5be83a5dccad7a58526046-medium.jpg,5b5be83a5dccad7a58526046
"Red Papy Eco Bombi Pet Step 4 étapes, gris","Red papy eco bombi pet step 4 steps, gray",135.0,CHF,135.0,CHF,148.0,0,,,5.0,0.0,,,,,,,,,,,gray,40x70x48cm,5,Livraison standard,12.0,false,,5,true,Quantité limitée !,KR,top korea seller,topkoreaseller,50 % avis positifs (2 notes),2,3.0,5ff4782d45e0239ccc5a5c96,,,https://www.wish.com/c/5fff1421ec26fb397e01dcbf,https://canary.contestimg.wish.com/api/webimage/5fff1421ec26fb397e01dcbf-medium.jpg,5fff1421ec26fb397e01dcbf
